{"run":19,"commit":"903743d","metric":101.12849020088026,"metrics":{"clique_apply_us":2.9135833333333334,"clique_preview_us":16.093791666666668,"correctness_suite_average_runtime_seconds":0.172189273,"correctness_suite_case_count":4.0,"correctness_suite_external_validation_failures":0.0,"correctness_suite_total_runtime_seconds":0.688757092,"correctness_suite_total_score_mismatches":0.0,"hotpath_total_us":36.02740625,"objective_fixed_iteration_average_final_score_raw":3579.5,"objective_fixed_iteration_average_runtime_seconds":50.897387568333336,"objective_fixed_iteration_case_adversarial_clique_swap_functionality_35p_final_score":4756.0,"objective_fixed_iteration_case_adversarial_clique_swap_functionality_35p_normalized_score":1.0,"objective_fixed_iteration_case_adversarial_clique_swap_functionality_35p_reference_final_score":4756.0,"objective_fixed_iteration_case_adversarial_clique_swap_functionality_35p_weight":1.0,"objective_fixed_iteration_case_adversarial_clique_swap_functionality_35p_weighted_contribution":1.0,"objective_fixed_iteration_case_adversarial_transfer_attribute_balance_111p_final_score":202.0,"objective_fixed_iteration_case_adversarial_transfer_attribute_balance_111p_normalized_score":0.9901960784313726,"objective_fixed_iteration_case_adversarial_transfer_attribute_balance_111p_reference_final_score":204.0,"objective_fixed_iteration_case_adversarial_transfer_attribute_balance_111p_weight":1.0,"objective_fixed_iteration_case_adversarial_transfer_attribute_balance_111p_weighted_contribution":0.9901960784313726,"objective_fixed_iteration_case_count":6.0,"objective_fixed_iteration_case_stretch_large_gender_immovable_110p_final_score":2124.0,"objective_fixed_iteration_case_stretch_large_gender_immovable_110p_normalized_score":0.994847775175644,"objective_fixed_iteration_case_stretch_large_gender_immovable_110p_reference_final_score":2135.0,"objective_fixed_iteration_case_stretch_large_gender_immovable_110p_weight":1.0,"objective_fixed_iteration_case_stretch_large_gender_immovable_110p_weighted_contribution":0.994847775175644,"objective_fixed_iteration_case_stretch_sailing_trip_demo_real_final_score":2284.0,"objective_fixed_iteration_case_stretch_sailing_trip_demo_real_normalized_score":1.0288288288288288,"objective_fixed_iteration_case_stretch_sailing_trip_demo_real_reference_final_score":2220.0,"objective_fixed_iteration_case_stretch_sailing_trip_demo_real_weight":1.0,"objective_fixed_iteration_case_stretch_sailing_trip_demo_real_weighted_contribution":1.0288288288288288,"objective_fixed_iteration_case_stretch_social_golfer_32x8x10_final_score":5472.0,"objective_fixed_iteration_case_stretch_social_golfer_32x8x10_normalized_score":0.9961769524849808,"objective_fixed_iteration_case_stretch_social_golfer_32x8x10_reference_final_score":5493.0,"objective_fixed_iteration_case_stretch_social_golfer_32x8x10_weight":1.0,"objective_fixed_iteration_case_stretch_social_golfer_32x8x10_weighted_contribution":0.9961769524849808,"objective_fixed_iteration_case_stretch_synthetic_partial_attendance_capacity_pressure_152p_final_score":6639.0,"objective_fixed_iteration_case_stretch_synthetic_partial_attendance_capacity_pressure_152p_normalized_score":1.0027186225645672,"objective_fixed_iteration_case_stretch_synthetic_partial_attendance_capacity_pressure_152p_reference_final_score":6621.0,"objective_fixed_iteration_case_stretch_synthetic_partial_attendance_capacity_pressure_152p_weight":1.0,"objective_fixed_iteration_case_stretch_synthetic_partial_attendance_capacity_pressure_152p_weighted_contribution":1.0027186225645672,"objective_fixed_iteration_external_validation_failures":0.0,"objective_fixed_iteration_score_breakdown_mismatches":0.0,"objective_fixed_iteration_total_final_score_raw":21477.0,"objective_fixed_iteration_total_runtime_seconds":305.38432541,"objective_fixed_iteration_total_score_mismatches":0.0,"objective_fixed_iteration_weighted_normalized_score":100.21280429142323,"objective_fixed_iteration_weighted_normalized_score_delta_from_reference":0.21280429142322976,"objective_fixed_iteration_weighted_normalized_score_weight_sum":6.0,"objective_suite_average_final_score_raw":3616.0,"objective_suite_average_runtime_seconds":15.668328740833333,"objective_suite_case_adversarial_clique_swap_functionality_35p_final_score":4756.0,"objective_suite_case_adversarial_clique_swap_functionality_35p_normalized_score":1.0,"objective_suite_case_adversarial_clique_swap_functionality_35p_reference_final_score":4756.0,"objective_suite_case_adversarial_clique_swap_functionality_35p_weight":1.0,"objective_suite_case_adversarial_clique_swap_functionality_35p_weighted_contribution":1.0,"objective_suite_case_adversarial_transfer_attribute_balance_111p_final_score":207.0,"objective_suite_case_adversarial_transfer_attribute_balance_111p_normalized_score":1.0454545454545454,"objective_suite_case_adversarial_transfer_attribute_balance_111p_reference_final_score":198.0,"objective_suite_case_adversarial_transfer_attribute_balance_111p_weight":1.0,"objective_suite_case_adversarial_transfer_attribute_balance_111p_weighted_contribution":1.0454545454545454,"objective_suite_case_count":6.0,"objective_suite_case_stretch_large_gender_immovable_110p_final_score":2322.0,"objective_suite_case_stretch_large_gender_immovable_110p_normalized_score":1.0656264341441029,"objective_suite_case_stretch_large_gender_immovable_110p_reference_final_score":2179.0,"objective_suite_case_stretch_large_gender_immovable_110p_weight":1.0,"objective_suite_case_stretch_large_gender_immovable_110p_weighted_contribution":1.0656264341441029,"objective_suite_case_stretch_sailing_trip_demo_real_final_score":2298.0,"objective_suite_case_stretch_sailing_trip_demo_real_normalized_score":0.9603008775595487,"objective_suite_case_stretch_sailing_trip_demo_real_reference_final_score":2393.0,"objective_suite_case_stretch_sailing_trip_demo_real_weight":1.0,"objective_suite_case_stretch_sailing_trip_demo_real_weighted_contribution":0.9603008775595487,"objective_suite_case_stretch_social_golfer_32x8x10_final_score":5472.0,"objective_suite_case_stretch_social_golfer_32x8x10_normalized_score":0.9961769524849808,"objective_suite_case_stretch_social_golfer_32x8x10_reference_final_score":5493.0,"objective_suite_case_stretch_social_golfer_32x8x10_weight":1.0,"objective_suite_case_stretch_social_golfer_32x8x10_weighted_contribution":0.9961769524849808,"objective_suite_case_stretch_synthetic_partial_attendance_capacity_pressure_152p_final_score":6641.0,"objective_suite_case_stretch_synthetic_partial_attendance_capacity_pressure_152p_normalized_score":1.0001506024096385,"objective_suite_case_stretch_synthetic_partial_attendance_capacity_pressure_152p_reference_final_score":6640.0,"objective_suite_case_stretch_synthetic_partial_attendance_capacity_pressure_152p_weight":1.0,"objective_suite_case_stretch_synthetic_partial_attendance_capacity_pressure_152p_weighted_contribution":1.0001506024096385,"objective_suite_external_validation_failures":0.0,"objective_suite_score_breakdown_mismatches":0.0,"objective_suite_total_final_score_raw":21696.0,"objective_suite_total_runtime_seconds":94.009972445,"objective_suite_total_score_mismatches":0.0,"objective_suite_weighted_normalized_score":101.12849020088026,"objective_suite_weighted_normalized_score_delta_from_reference":1.128490200880261,"objective_suite_weighted_normalized_score_weight_sum":6.0,"path_allowed_sessions_iter_us":32.397775,"path_avg_iter_us":18.90727,"path_clique_iter_us":18.2533,"path_construction_iter_us":20.214875,"path_swap_iter_us":14.119925,"path_transfer_iter_us":9.550475,"rep_avg_iter_us":30.925494999999998,"rep_balanced_iter_us":28.57755,"rep_balanced_score":3.0,"rep_constrained_iter_us":33.27344,"rep_constrained_score":6.0,"runtime_canonical_share_percent":99.27268602718593,"runtime_total_seconds":94.698729537,"solver3_raw_score_us":85.86017125,"swap_apply_us":2.27546875,"swap_preview_us":8.543140625,"transfer_apply_us":2.2714218749999997,"transfer_preview_us":3.9299999999999997},"status":"discard","description":"First freedom-aware GRASP-style constructor trial: after the shared baseline construction, rebuilt every session with a randomized restricted-candidate greedy pass that respected cliques/immovables, scored candidate groups using repeat/contact deltas plus attribute-balance/constraint heuristics, and fed the resulting schedule into the kept record-to-record search. It improved synthetic and sailing and held social_golfer near reference, but the aggregate still missed the current memetic keep because transfer-balance and large_gender remained too weak.","timestamp":1775664370993,"segment":0,"confidence":394.379435468937,"iterationTokens":26832,"asi":{"hypothesis":"A solver3-local freedom-aware GRASP rebuild of the initial schedule can produce stronger basins for the kept record-to-record search than the shared baseline constructor alone.","rollback_reason":"The first GRASP-style constructor pass did not beat the current best 100.8462 primary score, so it cannot be kept yet.","next_action_hint":"Move the GRASP family out of the untried queue and give it an incubation follow-up that specifically strengthens balance-heavy cases (attribute_balance/large_gender) without losing the synthetic and sailing gains.","mechanism_family":"freedom-aware GRASP-style session rebuild constructor","case_shape":{"attribute_balance":"1.0454545454545454","social_golfer":"0.9961769524849808","large_gender":"1.0656264341441029","sailing":"0.9603008775595487","synthetic_partial":"1.0001506024096385"}}}
{"run":20,"commit":"903743d","metric":101.46271554313763,"metrics":{"clique_apply_us":2.8255833333333333,"clique_preview_us":13.056583333333334,"correctness_suite_average_runtime_seconds":0.1817594485,"correctness_suite_case_count":4.0,"correctness_suite_external_validation_failures":0.0,"correctness_suite_total_runtime_seconds":0.727037794,"correctness_suite_total_score_mismatches":0.0,"hotpath_total_us":30.95086979166667,"objective_fixed_iteration_average_final_score_raw":3603.5,"objective_fixed_iteration_average_runtime_seconds":50.76381440433333,"objective_fixed_iteration_case_adversarial_clique_swap_functionality_35p_final_score":4765.0,"objective_fixed_iteration_case_adversarial_clique_swap_functionality_35p_normalized_score":1.001892346509672,"objective_fixed_iteration_case_adversarial_clique_swap_functionality_35p_reference_final_score":4756.0,"objective_fixed_iteration_case_adversarial_clique_swap_functionality_35p_weight":1.0,"objective_fixed_iteration_case_adversarial_clique_swap_functionality_35p_weighted_contribution":1.001892346509672,"objective_fixed_iteration_case_adversarial_transfer_attribute_balance_111p_final_score":202.0,"objective_fixed_iteration_case_adversarial_transfer_attribute_balance_111p_normalized_score":0.9901960784313726,"objective_fixed_iteration_case_adversarial_transfer_attribute_balance_111p_reference_final_score":204.0,"objective_fixed_iteration_case_adversarial_transfer_attribute_balance_111p_weight":1.0,"objective_fixed_iteration_case_adversarial_transfer_attribute_balance_111p_weighted_contribution":0.9901960784313726,"objective_fixed_iteration_case_count":6.0,"objective_fixed_iteration_case_stretch_large_gender_immovable_110p_final_score":2157.0,"objective_fixed_iteration_case_stretch_large_gender_immovable_110p_normalized_score":1.010304449648712,"objective_fixed_iteration_case_stretch_large_gender_immovable_110p_reference_final_score":2135.0,"objective_fixed_iteration_case_stretch_large_gender_immovable_110p_weight":1.0,"objective_fixed_iteration_case_stretch_large_gender_immovable_110p_weighted_contribution":1.010304449648712,"objective_fixed_iteration_case_stretch_sailing_trip_demo_real_final_score":2305.0,"objective_fixed_iteration_case_stretch_sailing_trip_demo_real_normalized_score":1.0382882882882882,"objective_fixed_iteration_case_stretch_sailing_trip_demo_real_reference_final_score":2220.0,"objective_fixed_iteration_case_stretch_sailing_trip_demo_real_weight":1.0,"objective_fixed_iteration_case_stretch_sailing_trip_demo_real_weighted_contribution":1.0382882882882882,"objective_fixed_iteration_case_stretch_social_golfer_32x8x10_final_score":5451.0,"objective_fixed_iteration_case_stretch_social_golfer_32x8x10_normalized_score":0.9923539049699618,"objective_fixed_iteration_case_stretch_social_golfer_32x8x10_reference_final_score":5493.0,"objective_fixed_iteration_case_stretch_social_golfer_32x8x10_weight":1.0,"objective_fixed_iteration_case_stretch_social_golfer_32x8x10_weighted_contribution":0.9923539049699618,"objective_fixed_iteration_case_stretch_synthetic_partial_attendance_capacity_pressure_152p_final_score":6741.0,"objective_fixed_iteration_case_stretch_synthetic_partial_attendance_capacity_pressure_152p_normalized_score":1.0181241504304486,"objective_fixed_iteration_case_stretch_synthetic_partial_attendance_capacity_pressure_152p_reference_final_score":6621.0,"objective_fixed_iteration_case_stretch_synthetic_partial_attendance_capacity_pressure_152p_weight":1.0,"objective_fixed_iteration_case_stretch_synthetic_partial_attendance_capacity_pressure_152p_weighted_contribution":1.0181241504304486,"objective_fixed_iteration_external_validation_failures":0.0,"objective_fixed_iteration_score_breakdown_mismatches":0.0,"objective_fixed_iteration_total_final_score_raw":21621.0,"objective_fixed_iteration_total_runtime_seconds":304.582886426,"objective_fixed_iteration_total_score_mismatches":0.0,"objective_fixed_iteration_weighted_normalized_score":100.85265363797424,"objective_fixed_iteration_weighted_normalized_score_delta_from_reference":0.8526536379742433,"objective_fixed_iteration_weighted_normalized_score_weight_sum":6.0,"objective_suite_average_final_score_raw":3636.1666666666665,"objective_suite_average_runtime_seconds":15.669014398166667,"objective_suite_case_adversarial_clique_swap_functionality_35p_final_score":4765.0,"objective_suite_case_adversarial_clique_swap_functionality_35p_normalized_score":1.001892346509672,"objective_suite_case_adversarial_clique_swap_functionality_35p_reference_final_score":4756.0,"objective_suite_case_adversarial_clique_swap_functionality_35p_weight":1.0,"objective_suite_case_adversarial_clique_swap_functionality_35p_weighted_contribution":1.001892346509672,"objective_suite_case_adversarial_transfer_attribute_balance_111p_final_score":207.0,"objective_suite_case_adversarial_transfer_attribute_balance_111p_normalized_score":1.0454545454545454,"objective_suite_case_adversarial_transfer_attribute_balance_111p_reference_final_score":198.0,"objective_suite_case_adversarial_transfer_attribute_balance_111p_weight":1.0,"objective_suite_case_adversarial_transfer_attribute_balance_111p_weighted_contribution":1.0454545454545454,"objective_suite_case_count":6.0,"objective_suite_case_stretch_large_gender_immovable_110p_final_score":2311.0,"objective_suite_case_stretch_large_gender_immovable_110p_normalized_score":1.0605782469022487,"objective_suite_case_stretch_large_gender_immovable_110p_reference_final_score":2179.0,"objective_suite_case_stretch_large_gender_immovable_110p_weight":1.0,"objective_suite_case_stretch_large_gender_immovable_110p_weighted_contribution":1.0605782469022487,"objective_suite_case_stretch_sailing_trip_demo_real_final_score":2318.0,"objective_suite_case_stretch_sailing_trip_demo_real_normalized_score":0.9686585875470122,"objective_suite_case_stretch_sailing_trip_demo_real_reference_final_score":2393.0,"objective_suite_case_stretch_sailing_trip_demo_real_weight":1.0,"objective_suite_case_stretch_sailing_trip_demo_real_weighted_contribution":0.9686585875470122,"objective_suite_case_stretch_social_golfer_32x8x10_final_score":5451.0,"objective_suite_case_stretch_social_golfer_32x8x10_normalized_score":0.9923539049699618,"objective_suite_case_stretch_social_golfer_32x8x10_reference_final_score":5493.0,"objective_suite_case_stretch_social_golfer_32x8x10_weight":1.0,"objective_suite_case_stretch_social_golfer_32x8x10_weighted_contribution":0.9923539049699618,"objective_suite_case_stretch_synthetic_partial_attendance_capacity_pressure_152p_final_score":6765.0,"objective_suite_case_stretch_synthetic_partial_attendance_capacity_pressure_152p_normalized_score":1.0188253012048192,"objective_suite_case_stretch_synthetic_partial_attendance_capacity_pressure_152p_reference_final_score":6640.0,"objective_suite_case_stretch_synthetic_partial_attendance_capacity_pressure_152p_weight":1.0,"objective_suite_case_stretch_synthetic_partial_attendance_capacity_pressure_152p_weighted_contribution":1.0188253012048192,"objective_suite_external_validation_failures":0.0,"objective_suite_score_breakdown_mismatches":0.0,"objective_suite_total_final_score_raw":21817.0,"objective_suite_total_runtime_seconds":94.014086389,"objective_suite_total_score_mismatches":0.0,"objective_suite_weighted_normalized_score":101.46271554313763,"objective_suite_weighted_normalized_score_delta_from_reference":1.4627155431376382,"objective_suite_weighted_normalized_score_weight_sum":6.0,"path_allowed_sessions_iter_us":27.570100000000004,"path_avg_iter_us":17.39473,"path_clique_iter_us":18.221574999999998,"path_construction_iter_us":21.337274999999998,"path_swap_iter_us":11.50775,"path_transfer_iter_us":8.33695,"rep_avg_iter_us":29.75262685185185,"rep_balanced_iter_us":28.064216666666663,"rep_balanced_score":3.0,"rep_constrained_iter_us":31.441037037037038,"rep_constrained_score":4.0,"runtime_canonical_share_percent":99.23260590343465,"runtime_total_seconds":94.741124183,"solver3_raw_score_us":78.09822664351852,"swap_apply_us":2.3738281249999997,"swap_preview_us":6.499640625,"transfer_apply_us":2.27803125,"transfer_preview_us":3.917203125},"status":"discard","description":"First stronger targeted ALNS/LNS follow-up on the new machine: added a one-shot stagnation-triggered exact repair burst that selected a hotspot session, freed three hotspot groups, repartitioned the affected clique/person units across those groups with an exact restricted search, and resumed the kept record-to-record search from the best repaired state. This was benchmark-honest and safe, but it did not improve the aggregate: it landed at 101.4627, effectively showing that this simple hotspot selector and small exact kernel are still too weak in this form.","timestamp":1775665189245,"segment":0,"confidence":395.79736294285163,"iterationTokens":18161,"asi":{"hypothesis":"A larger but still restricted exact repair burst over three hotspot groups can make the ALNS/LNS family materially stronger than the previously inert two-group exact kernel.","rollback_reason":"The first three-group exact repair burst regressed versus the current keep and did not show enough directional lift to justify keeping this implementation.","next_action_hint":"Move this ALNS/LNS item out of the untried queue; if the family is revisited later, it likely needs better destroy targeting, richer hotspot structure, or a stronger mixed repair operator rather than just a slightly larger exact partition kernel.","mechanism_family":"targeted ALNS/LNS with restricted exact repair burst","failure_shape":{"current_keep":"100.84622890492095","three_group_exact_repair":"101.46271554313763","attribute_balance_normalized":"1.0454545454545454","large_gender_normalized":"1.0605782469022487","sailing_normalized":"0.9686585875470122"}}}
