{"run":13,"commit":"a09f3f0","metric":101.11964843241488,"metrics":{"clique_apply_us":2.826395833333333,"clique_preview_us":12.727229166666667,"correctness_suite_average_runtime_seconds":0.18871831525,"correctness_suite_case_count":4.0,"correctness_suite_external_validation_failures":0.0,"correctness_suite_total_runtime_seconds":0.754873261,"correctness_suite_total_score_mismatches":0.0,"hotpath_total_us":30.406921875,"objective_fixed_iteration_average_final_score_raw":3603.6666666666665,"objective_fixed_iteration_average_runtime_seconds":50.956898515333336,"objective_fixed_iteration_case_adversarial_clique_swap_functionality_35p_final_score":4765.0,"objective_fixed_iteration_case_adversarial_clique_swap_functionality_35p_normalized_score":1.001892346509672,"objective_fixed_iteration_case_adversarial_clique_swap_functionality_35p_reference_final_score":4756.0,"objective_fixed_iteration_case_adversarial_clique_swap_functionality_35p_weight":1.0,"objective_fixed_iteration_case_adversarial_clique_swap_functionality_35p_weighted_contribution":1.001892346509672,"objective_fixed_iteration_case_adversarial_transfer_attribute_balance_111p_final_score":203.0,"objective_fixed_iteration_case_adversarial_transfer_attribute_balance_111p_normalized_score":0.9950980392156863,"objective_fixed_iteration_case_adversarial_transfer_attribute_balance_111p_reference_final_score":204.0,"objective_fixed_iteration_case_adversarial_transfer_attribute_balance_111p_weight":1.0,"objective_fixed_iteration_case_adversarial_transfer_attribute_balance_111p_weighted_contribution":0.9950980392156863,"objective_fixed_iteration_case_count":6.0,"objective_fixed_iteration_case_stretch_large_gender_immovable_110p_final_score":2157.0,"objective_fixed_iteration_case_stretch_large_gender_immovable_110p_normalized_score":1.010304449648712,"objective_fixed_iteration_case_stretch_large_gender_immovable_110p_reference_final_score":2135.0,"objective_fixed_iteration_case_stretch_large_gender_immovable_110p_weight":1.0,"objective_fixed_iteration_case_stretch_large_gender_immovable_110p_weighted_contribution":1.010304449648712,"objective_fixed_iteration_case_stretch_sailing_trip_demo_real_final_score":2305.0,"objective_fixed_iteration_case_stretch_sailing_trip_demo_real_normalized_score":1.0382882882882882,"objective_fixed_iteration_case_stretch_sailing_trip_demo_real_reference_final_score":2220.0,"objective_fixed_iteration_case_stretch_sailing_trip_demo_real_weight":1.0,"objective_fixed_iteration_case_stretch_sailing_trip_demo_real_weighted_contribution":1.0382882882882882,"objective_fixed_iteration_case_stretch_social_golfer_32x8x10_final_score":5451.0,"objective_fixed_iteration_case_stretch_social_golfer_32x8x10_normalized_score":0.9923539049699618,"objective_fixed_iteration_case_stretch_social_golfer_32x8x10_reference_final_score":5493.0,"objective_fixed_iteration_case_stretch_social_golfer_32x8x10_weight":1.0,"objective_fixed_iteration_case_stretch_social_golfer_32x8x10_weighted_contribution":0.9923539049699618,"objective_fixed_iteration_case_stretch_synthetic_partial_attendance_capacity_pressure_152p_final_score":6741.0,"objective_fixed_iteration_case_stretch_synthetic_partial_attendance_capacity_pressure_152p_normalized_score":1.0181241504304486,"objective_fixed_iteration_case_stretch_synthetic_partial_attendance_capacity_pressure_152p_reference_final_score":6621.0,"objective_fixed_iteration_case_stretch_synthetic_partial_attendance_capacity_pressure_152p_weight":1.0,"objective_fixed_iteration_case_stretch_synthetic_partial_attendance_capacity_pressure_152p_weighted_contribution":1.0181241504304486,"objective_fixed_iteration_external_validation_failures":0.0,"objective_fixed_iteration_score_breakdown_mismatches":0.0,"objective_fixed_iteration_total_final_score_raw":21622.0,"objective_fixed_iteration_total_runtime_seconds":305.741391092,"objective_fixed_iteration_total_score_mismatches":0.0,"objective_fixed_iteration_weighted_normalized_score":100.93435298437947,"objective_fixed_iteration_weighted_normalized_score_delta_from_reference":0.9343529843794718,"objective_fixed_iteration_weighted_normalized_score_weight_sum":6.0,"objective_suite_average_final_score_raw":3633.5,"objective_suite_average_runtime_seconds":15.668065756666667,"objective_suite_case_adversarial_clique_swap_functionality_35p_final_score":4765.0,"objective_suite_case_adversarial_clique_swap_functionality_35p_normalized_score":1.001892346509672,"objective_suite_case_adversarial_clique_swap_functionality_35p_reference_final_score":4756.0,"objective_suite_case_adversarial_clique_swap_functionality_35p_weight":1.0,"objective_suite_case_adversarial_clique_swap_functionality_35p_weighted_contribution":1.001892346509672,"objective_suite_case_adversarial_transfer_attribute_balance_111p_final_score":204.0,"objective_suite_case_adversarial_transfer_attribute_balance_111p_normalized_score":1.0303030303030303,"objective_suite_case_adversarial_transfer_attribute_balance_111p_reference_final_score":198.0,"objective_suite_case_adversarial_transfer_attribute_balance_111p_weight":1.0,"objective_suite_case_adversarial_transfer_attribute_balance_111p_weighted_contribution":1.0303030303030303,"objective_suite_case_count":6.0,"objective_suite_case_stretch_large_gender_immovable_110p_final_score":2311.0,"objective_suite_case_stretch_large_gender_immovable_110p_normalized_score":1.0605782469022487,"objective_suite_case_stretch_large_gender_immovable_110p_reference_final_score":2179.0,"objective_suite_case_stretch_large_gender_immovable_110p_weight":1.0,"objective_suite_case_stretch_large_gender_immovable_110p_weighted_contribution":1.0605782469022487,"objective_suite_case_stretch_sailing_trip_demo_real_final_score":2305.0,"objective_suite_case_stretch_sailing_trip_demo_real_normalized_score":0.9632260760551609,"objective_suite_case_stretch_sailing_trip_demo_real_reference_final_score":2393.0,"objective_suite_case_stretch_sailing_trip_demo_real_weight":1.0,"objective_suite_case_stretch_sailing_trip_demo_real_weighted_contribution":0.9632260760551609,"objective_suite_case_stretch_social_golfer_32x8x10_final_score":5451.0,"objective_suite_case_stretch_social_golfer_32x8x10_normalized_score":0.9923539049699618,"objective_suite_case_stretch_social_golfer_32x8x10_reference_final_score":5493.0,"objective_suite_case_stretch_social_golfer_32x8x10_weight":1.0,"objective_suite_case_stretch_social_golfer_32x8x10_weighted_contribution":0.9923539049699618,"objective_suite_case_stretch_synthetic_partial_attendance_capacity_pressure_152p_final_score":6765.0,"objective_suite_case_stretch_synthetic_partial_attendance_capacity_pressure_152p_normalized_score":1.0188253012048192,"objective_suite_case_stretch_synthetic_partial_attendance_capacity_pressure_152p_reference_final_score":6640.0,"objective_suite_case_stretch_synthetic_partial_attendance_capacity_pressure_152p_weight":1.0,"objective_suite_case_stretch_synthetic_partial_attendance_capacity_pressure_152p_weighted_contribution":1.0188253012048192,"objective_suite_external_validation_failures":0.0,"objective_suite_score_breakdown_mismatches":0.0,"objective_suite_total_final_score_raw":21801.0,"objective_suite_total_runtime_seconds":94.00839454,"objective_suite_total_score_mismatches":0.0,"objective_suite_weighted_normalized_score":101.11964843241488,"objective_suite_weighted_normalized_score_delta_from_reference":1.119648432414877,"objective_suite_weighted_normalized_score_weight_sum":6.0,"path_allowed_sessions_iter_us":33.834275,"path_avg_iter_us":22.851675,"path_clique_iter_us":19.875025,"path_construction_iter_us":40.448625,"path_swap_iter_us":11.5662,"path_transfer_iter_us":8.53425,"rep_avg_iter_us":32.81883425925926,"rep_balanced_iter_us":30.227483333333335,"rep_balanced_score":3.0,"rep_constrained_iter_us":35.410185185185185,"rep_constrained_score":4.0,"runtime_canonical_share_percent":99.20341153432445,"runtime_total_seconds":94.763267801,"solver3_raw_score_us":86.07743113425926,"swap_apply_us":2.2855937500000003,"swap_preview_us":6.409140625,"transfer_apply_us":2.291375,"transfer_preview_us":3.8671875},"status":"discard","description":"Confirmation rerun of the exact-rescored memetic donor-session burst stayed directionally positive versus the old baselines but did not beat the current memetic keep. The rerun landed at 101.1196, which supports that the stronger selector is materially better than the earlier proxy-based variant, but the best observed result remains 101.0558.","timestamp":1775660449400,"segment":0,"confidence":374.8365997670293,"iterationTokens":6625,"asi":{"hypothesis":"The exact-rescored donor-session memetic burst should reproduce as a real improvement family rather than a one-off noise artifact.","rollback_reason":"The rerun was worse than the current keep (101.0558), so there is no new primary improvement to keep from this cycle.","next_action_hint":"Retain the kept exact-rescored memetic selector and use the next incubation turn on a richer but still budget-honest compatibility follow-up, or switch to the next untried large family if memetic follow-ups start plateauing.","mechanism_family":"memetic / exact-rescored donor-session offspring","confirmation_context":{"current_keep":"101.05576963890799","confirm_rerun":"101.11964843241488","older_memetic_keep":"101.28103384244216","machine_baseline":"101.35127940997147"}}}
{"run":14,"commit":"a09f3f0","metric":101.6310657114878,"metrics":{"clique_apply_us":2.936375,"clique_preview_us":13.029083333333332,"correctness_suite_average_runtime_seconds":0.17763274375,"correctness_suite_case_count":4.0,"correctness_suite_external_validation_failures":0.0,"correctness_suite_total_runtime_seconds":0.710530975,"correctness_suite_total_score_mismatches":0.0,"hotpath_total_us":31.48617708333333,"objective_fixed_iteration_average_final_score_raw":3603.0,"objective_fixed_iteration_average_runtime_seconds":50.79744992233333,"objective_fixed_iteration_case_adversarial_clique_swap_functionality_35p_final_score":4765.0,"objective_fixed_iteration_case_adversarial_clique_swap_functionality_35p_normalized_score":1.001892346509672,"objective_fixed_iteration_case_adversarial_clique_swap_functionality_35p_reference_final_score":4756.0,"objective_fixed_iteration_case_adversarial_clique_swap_functionality_35p_weight":1.0,"objective_fixed_iteration_case_adversarial_clique_swap_functionality_35p_weighted_contribution":1.001892346509672,"objective_fixed_iteration_case_adversarial_transfer_attribute_balance_111p_final_score":196.0,"objective_fixed_iteration_case_adversarial_transfer_attribute_balance_111p_normalized_score":0.9607843137254902,"objective_fixed_iteration_case_adversarial_transfer_attribute_balance_111p_reference_final_score":204.0,"objective_fixed_iteration_case_adversarial_transfer_attribute_balance_111p_weight":1.0,"objective_fixed_iteration_case_adversarial_transfer_attribute_balance_111p_weighted_contribution":0.9607843137254902,"objective_fixed_iteration_case_count":6.0,"objective_fixed_iteration_case_stretch_large_gender_immovable_110p_final_score":2157.0,"objective_fixed_iteration_case_stretch_large_gender_immovable_110p_normalized_score":1.010304449648712,"objective_fixed_iteration_case_stretch_large_gender_immovable_110p_reference_final_score":2135.0,"objective_fixed_iteration_case_stretch_large_gender_immovable_110p_weight":1.0,"objective_fixed_iteration_case_stretch_large_gender_immovable_110p_weighted_contribution":1.010304449648712,"objective_fixed_iteration_case_stretch_sailing_trip_demo_real_final_score":2308.0,"objective_fixed_iteration_case_stretch_sailing_trip_demo_real_normalized_score":1.0396396396396397,"objective_fixed_iteration_case_stretch_sailing_trip_demo_real_reference_final_score":2220.0,"objective_fixed_iteration_case_stretch_sailing_trip_demo_real_weight":1.0,"objective_fixed_iteration_case_stretch_sailing_trip_demo_real_weighted_contribution":1.0396396396396397,"objective_fixed_iteration_case_stretch_social_golfer_32x8x10_final_score":5451.0,"objective_fixed_iteration_case_stretch_social_golfer_32x8x10_normalized_score":0.9923539049699618,"objective_fixed_iteration_case_stretch_social_golfer_32x8x10_reference_final_score":5493.0,"objective_fixed_iteration_case_stretch_social_golfer_32x8x10_weight":1.0,"objective_fixed_iteration_case_stretch_social_golfer_32x8x10_weighted_contribution":0.9923539049699618,"objective_fixed_iteration_case_stretch_synthetic_partial_attendance_capacity_pressure_152p_final_score":6741.0,"objective_fixed_iteration_case_stretch_synthetic_partial_attendance_capacity_pressure_152p_normalized_score":1.0181241504304486,"objective_fixed_iteration_case_stretch_synthetic_partial_attendance_capacity_pressure_152p_reference_final_score":6621.0,"objective_fixed_iteration_case_stretch_synthetic_partial_attendance_capacity_pressure_152p_weight":1.0,"objective_fixed_iteration_case_stretch_synthetic_partial_attendance_capacity_pressure_152p_weighted_contribution":1.0181241504304486,"objective_fixed_iteration_external_validation_failures":0.0,"objective_fixed_iteration_score_breakdown_mismatches":0.0,"objective_fixed_iteration_total_final_score_raw":21618.0,"objective_fixed_iteration_total_runtime_seconds":304.78469953399997,"objective_fixed_iteration_total_score_mismatches":0.0,"objective_fixed_iteration_weighted_normalized_score":100.3849800820654,"objective_fixed_iteration_weighted_normalized_score_delta_from_reference":0.38498008206540035,"objective_fixed_iteration_weighted_normalized_score_weight_sum":6.0,"objective_suite_average_final_score_raw":3636.5,"objective_suite_average_runtime_seconds":15.668335417333333,"objective_suite_case_adversarial_clique_swap_functionality_35p_final_score":4765.0,"objective_suite_case_adversarial_clique_swap_functionality_35p_normalized_score":1.001892346509672,"objective_suite_case_adversarial_clique_swap_functionality_35p_reference_final_score":4756.0,"objective_suite_case_adversarial_clique_swap_functionality_35p_weight":1.0,"objective_suite_case_adversarial_clique_swap_functionality_35p_weighted_contribution":1.001892346509672,"objective_suite_case_adversarial_transfer_attribute_balance_111p_final_score":209.0,"objective_suite_case_adversarial_transfer_attribute_balance_111p_normalized_score":1.0555555555555556,"objective_suite_case_adversarial_transfer_attribute_balance_111p_reference_final_score":198.0,"objective_suite_case_adversarial_transfer_attribute_balance_111p_weight":1.0,"objective_suite_case_adversarial_transfer_attribute_balance_111p_weighted_contribution":1.0555555555555556,"objective_suite_case_count":6.0,"objective_suite_case_stretch_large_gender_immovable_110p_final_score":2311.0,"objective_suite_case_stretch_large_gender_immovable_110p_normalized_score":1.0605782469022487,"objective_suite_case_stretch_large_gender_immovable_110p_reference_final_score":2179.0,"objective_suite_case_stretch_large_gender_immovable_110p_weight":1.0,"objective_suite_case_stretch_large_gender_immovable_110p_weighted_contribution":1.0605782469022487,"objective_suite_case_stretch_sailing_trip_demo_real_final_score":2318.0,"objective_suite_case_stretch_sailing_trip_demo_real_normalized_score":0.9686585875470122,"objective_suite_case_stretch_sailing_trip_demo_real_reference_final_score":2393.0,"objective_suite_case_stretch_sailing_trip_demo_real_weight":1.0,"objective_suite_case_stretch_sailing_trip_demo_real_weighted_contribution":0.9686585875470122,"objective_suite_case_stretch_social_golfer_32x8x10_final_score":5451.0,"objective_suite_case_stretch_social_golfer_32x8x10_normalized_score":0.9923539049699618,"objective_suite_case_stretch_social_golfer_32x8x10_reference_final_score":5493.0,"objective_suite_case_stretch_social_golfer_32x8x10_weight":1.0,"objective_suite_case_stretch_social_golfer_32x8x10_weighted_contribution":0.9923539049699618,"objective_suite_case_stretch_synthetic_partial_attendance_capacity_pressure_152p_final_score":6765.0,"objective_suite_case_stretch_synthetic_partial_attendance_capacity_pressure_152p_normalized_score":1.0188253012048192,"objective_suite_case_stretch_synthetic_partial_attendance_capacity_pressure_152p_reference_final_score":6640.0,"objective_suite_case_stretch_synthetic_partial_attendance_capacity_pressure_152p_weight":1.0,"objective_suite_case_stretch_synthetic_partial_attendance_capacity_pressure_152p_weighted_contribution":1.0188253012048192,"objective_suite_external_validation_failures":0.0,"objective_suite_score_breakdown_mismatches":0.0,"objective_suite_total_final_score_raw":21819.0,"objective_suite_total_runtime_seconds":94.010012504,"objective_suite_total_score_mismatches":0.0,"objective_suite_weighted_normalized_score":101.6310657114878,"objective_suite_weighted_normalized_score_delta_from_reference":1.6310657114878113,"objective_suite_weighted_normalized_score_weight_sum":6.0,"path_allowed_sessions_iter_us":25.870175,"path_avg_iter_us":17.82417,"path_clique_iter_us":19.646974999999998,"path_construction_iter_us":23.39145,"path_swap_iter_us":11.820975,"path_transfer_iter_us":8.391275,"rep_avg_iter_us":30.583093518518517,"rep_balanced_iter_us":28.58765,"rep_balanced_score":3.0,"rep_constrained_iter_us":32.57853703703704,"rep_constrained_score":4.0,"runtime_canonical_share_percent":99.24986602810452,"runtime_total_seconds":94.720543479,"solver3_raw_score_us":79.89344060185185,"swap_apply_us":2.334796875,"swap_preview_us":6.44365625,"transfer_apply_us":2.33828125,"transfer_preview_us":4.403984375},"status":"discard","description":"Memetic follow-up that greedily allowed up to two exact-rescored donor-session transplants in one burst regressed badly. The second transplanted session appears to overfit the donor structure and especially hurt transfer-balance, so the current exact-rescored one-session offspring remains the better kept shape.","timestamp":1775661016079,"segment":0,"confidence":490.6448413245269,"iterationTokens":11805,"asi":{"hypothesis":"A budget-honest greedy second donor-session transplant could unlock a stronger memetic offspring than the kept one-session exact-rescored burst.","rollback_reason":"Allowing a second transplanted donor session materially worsened the primary metric, mainly via transfer-balance regression, so this richer offspring shape is not worth keeping in its current form.","next_action_hint":"Retire naive greedy two-session extension inside this memetic line; if memetic incubation continues, prefer better donor compatibility or multi-donor choice rather than stacking extra donor sessions onto one offspring.","mechanism_family":"memetic / exact-rescored donor-session offspring","failure_shape":{"current_keep":"101.05576963890799","two_session_followup":"101.6310657114878","transfer_balance_normalized":"1.0555555555555556","sailing_normalized":"0.9686585875470122"}}}
