{"type":"config","name":"Solver3 fixed-time objective-quality autoresearch (x100 scale)","metricName":"objective_suite_weighted_normalized_score","metricUnit":"","bestDirection":"lower"}
{"run":1,"commit":"ed20d6f","metric":107.84922015844826,"metrics":{"correctness_suite_total_runtime_seconds":0.48705218,"objective_fixed_iteration_weighted_normalized_score":100.03753753753755,"objective_suite_case_adversarial_clique_swap_functionality_35p_final_score":4756.0,"objective_suite_case_adversarial_clique_swap_functionality_35p_normalized_score":1.0,"objective_suite_case_adversarial_clique_swap_functionality_35p_reference_final_score":4756.0,"objective_suite_case_adversarial_transfer_attribute_balance_111p_final_score":278.0,"objective_suite_case_adversarial_transfer_attribute_balance_111p_normalized_score":1.404040404040404,"objective_suite_case_adversarial_transfer_attribute_balance_111p_reference_final_score":198.0,"objective_suite_case_stretch_large_gender_immovable_110p_final_score":2234.0,"objective_suite_case_stretch_large_gender_immovable_110p_normalized_score":1.0252409362092703,"objective_suite_case_stretch_large_gender_immovable_110p_reference_final_score":2179.0,"objective_suite_case_stretch_sailing_trip_demo_real_final_score":2492.0,"objective_suite_case_stretch_sailing_trip_demo_real_normalized_score":1.041370664437944,"objective_suite_case_stretch_sailing_trip_demo_real_reference_final_score":2393.0,"objective_suite_case_stretch_social_golfer_32x8x10_final_score":5493.0,"objective_suite_case_stretch_social_golfer_32x8x10_normalized_score":1.0,"objective_suite_case_stretch_social_golfer_32x8x10_reference_final_score":5493.0,"objective_suite_case_stretch_synthetic_partial_attendance_capacity_pressure_152p_final_score":6642.0,"objective_suite_case_stretch_synthetic_partial_attendance_capacity_pressure_152p_normalized_score":1.0003012048192772,"objective_suite_case_stretch_synthetic_partial_attendance_capacity_pressure_152p_reference_final_score":6640.0,"objective_suite_total_runtime_seconds":94.000104176,"objective_suite_weighted_normalized_score":107.84922015844826,"objective_suite_weighted_normalized_score_delta_from_reference":7.849220158448267,"solver3_raw_score_us":79.614020625},"status":"keep","description":"Clean baseline for the solver3 objective autoresearch lane after the x100 metric-scale reset; per-case score metrics are the main anti-gaming signal.","timestamp":1775557110884,"segment":0,"confidence":null,"iterationTokens":135}
{"run":2,"commit":"ed20d6f","metric":186.62,"metrics":{"correctness_suite_total_runtime_seconds":0.231524409,"objective_fixed_iteration_weighted_normalized_score":129.12,"objective_suite_case_adversarial_clique_swap_functionality_35p_final_score":4756,"objective_suite_case_adversarial_clique_swap_functionality_35p_normalized_score":1,"objective_suite_case_adversarial_clique_swap_functionality_35p_reference_final_score":4756,"objective_suite_case_adversarial_transfer_attribute_balance_111p_final_score":560,"objective_suite_case_adversarial_transfer_attribute_balance_111p_normalized_score":2.828,"objective_suite_case_adversarial_transfer_attribute_balance_111p_reference_final_score":198,"objective_suite_case_stretch_large_gender_immovable_110p_final_score":5491,"objective_suite_case_stretch_large_gender_immovable_110p_normalized_score":2.52,"objective_suite_case_stretch_large_gender_immovable_110p_reference_final_score":2179,"objective_suite_case_stretch_sailing_trip_demo_real_final_score":4392,"objective_suite_case_stretch_sailing_trip_demo_real_normalized_score":1.835,"objective_suite_case_stretch_sailing_trip_demo_real_reference_final_score":2393,"objective_suite_case_stretch_social_golfer_32x8x10_final_score":6955,"objective_suite_case_stretch_social_golfer_32x8x10_normalized_score":1.266,"objective_suite_case_stretch_social_golfer_32x8x10_reference_final_score":5493,"objective_suite_case_stretch_synthetic_partial_attendance_capacity_pressure_152p_final_score":11602,"objective_suite_case_stretch_synthetic_partial_attendance_capacity_pressure_152p_normalized_score":1.747,"objective_suite_case_stretch_synthetic_partial_attendance_capacity_pressure_152p_reference_final_score":6640,"objective_suite_total_runtime_seconds":94,"objective_suite_weighted_normalized_score":186.62,"objective_suite_weighted_normalized_score_delta_from_reference":86.62,"solver3_raw_score_us":81.18},"status":"discard","description":"Adaptive temperature calibration: catastrophically bad. Calibrated T_initial too high (~55 for balance cases), making search random. Also surfaced deeper bug: cooling schedule uses max_iterations=3M but only ~188K iterations complete in 15s, so temperature barely changes.","timestamp":1775559272619,"segment":0,"confidence":null,"iterationTokens":135,"asi":{"hypothesis":"Calibrate T_initial from positive delta samples to give 40% uphill acceptance","rollback_reason":"Primary 186.62 vs baseline 107.85. T_initial calibrated to ~55, T_final=1.375 → search never converges.","root_cause_discovered":"Cooling schedule mismatch: max_iterations=3M but only ~188K iterations in 15s → temperature stays near 2.0 throughout. T_initial=2.0 too low for balance penalties but adaptive calibration overshoots.","next_action_hint":"Switch to TIME-BASED cooling (elapsed/time_limit as progress) when time_limit is set. Keep T_initial=2.0, T_final=0.05 but let cooling happen in wall-clock space. This alone won't help balance case but fixes the cooling mismatch first."}}
{"run":3,"commit":"7be6d99","metric":100.10545914898567,"metrics":{"clique_apply_us":0.8509166666666665,"clique_preview_us":4.305354166666667,"correctness_suite_average_runtime_seconds":0.063007089,"correctness_suite_case_count":4.0,"correctness_suite_external_validation_failures":0.0,"correctness_suite_total_runtime_seconds":0.252028356,"correctness_suite_total_score_mismatches":0.0,"hotpath_total_us":9.826270833333332,"objective_fixed_iteration_average_final_score_raw":3571.5,"objective_fixed_iteration_average_runtime_seconds":36.67837414383333,"objective_fixed_iteration_case_adversarial_clique_swap_functionality_35p_final_score":4756.0,"objective_fixed_iteration_case_adversarial_clique_swap_functionality_35p_normalized_score":1.0,"objective_fixed_iteration_case_adversarial_clique_swap_functionality_35p_reference_final_score":4756.0,"objective_fixed_iteration_case_adversarial_clique_swap_functionality_35p_weight":1.0,"objective_fixed_iteration_case_adversarial_clique_swap_functionality_35p_weighted_contribution":1.0,"objective_fixed_iteration_case_adversarial_transfer_attribute_balance_111p_final_score":204.0,"objective_fixed_iteration_case_adversarial_transfer_attribute_balance_111p_normalized_score":1.0,"objective_fixed_iteration_case_adversarial_transfer_attribute_balance_111p_reference_final_score":204.0,"objective_fixed_iteration_case_adversarial_transfer_attribute_balance_111p_weight":1.0,"objective_fixed_iteration_case_adversarial_transfer_attribute_balance_111p_weighted_contribution":1.0,"objective_fixed_iteration_case_count":6.0,"objective_fixed_iteration_case_stretch_large_gender_immovable_110p_final_score":2135.0,"objective_fixed_iteration_case_stretch_large_gender_immovable_110p_normalized_score":1.0,"objective_fixed_iteration_case_stretch_large_gender_immovable_110p_reference_final_score":2135.0,"objective_fixed_iteration_case_stretch_large_gender_immovable_110p_weight":1.0,"objective_fixed_iteration_case_stretch_large_gender_immovable_110p_weighted_contribution":1.0,"objective_fixed_iteration_case_stretch_sailing_trip_demo_real_final_score":2220.0,"objective_fixed_iteration_case_stretch_sailing_trip_demo_real_normalized_score":1.0,"objective_fixed_iteration_case_stretch_sailing_trip_demo_real_reference_final_score":2220.0,"objective_fixed_iteration_case_stretch_sailing_trip_demo_real_weight":1.0,"objective_fixed_iteration_case_stretch_sailing_trip_demo_real_weighted_contribution":1.0,"objective_fixed_iteration_case_stretch_social_golfer_32x8x10_final_score":5493.0,"objective_fixed_iteration_case_stretch_social_golfer_32x8x10_normalized_score":1.0,"objective_fixed_iteration_case_stretch_social_golfer_32x8x10_reference_final_score":5493.0,"objective_fixed_iteration_case_stretch_social_golfer_32x8x10_weight":1.0,"objective_fixed_iteration_case_stretch_social_golfer_32x8x10_weighted_contribution":1.0,"objective_fixed_iteration_case_stretch_synthetic_partial_attendance_capacity_pressure_152p_final_score":6621.0,"objective_fixed_iteration_case_stretch_synthetic_partial_attendance_capacity_pressure_152p_normalized_score":1.0,"objective_fixed_iteration_case_stretch_synthetic_partial_attendance_capacity_pressure_152p_reference_final_score":6621.0,"objective_fixed_iteration_case_stretch_synthetic_partial_attendance_capacity_pressure_152p_weight":1.0,"objective_fixed_iteration_case_stretch_synthetic_partial_attendance_capacity_pressure_152p_weighted_contribution":1.0,"objective_fixed_iteration_external_validation_failures":0.0,"objective_fixed_iteration_score_breakdown_mismatches":0.0,"objective_fixed_iteration_total_final_score_raw":21429.0,"objective_fixed_iteration_total_runtime_seconds":220.070244863,"objective_fixed_iteration_total_score_mismatches":0.0,"objective_fixed_iteration_weighted_normalized_score":100.0,"objective_fixed_iteration_weighted_normalized_score_delta_from_reference":0.0,"objective_fixed_iteration_weighted_normalized_score_weight_sum":6.0,"objective_suite_average_final_score_raw":3599.1666666666665,"objective_suite_average_runtime_seconds":15.6676790765,"objective_suite_case_adversarial_clique_swap_functionality_35p_final_score":4756.0,"objective_suite_case_adversarial_clique_swap_functionality_35p_normalized_score":1.0,"objective_suite_case_adversarial_clique_swap_functionality_35p_reference_final_score":4756.0,"objective_suite_case_adversarial_clique_swap_functionality_35p_weight":1.0,"objective_suite_case_adversarial_clique_swap_functionality_35p_weighted_contribution":1.0,"objective_suite_case_adversarial_transfer_attribute_balance_111p_final_score":197.0,"objective_suite_case_adversarial_transfer_attribute_balance_111p_normalized_score":0.9949494949494949,"objective_suite_case_adversarial_transfer_attribute_balance_111p_reference_final_score":198.0,"objective_suite_case_adversarial_transfer_attribute_balance_111p_weight":1.0,"objective_suite_case_adversarial_transfer_attribute_balance_111p_weighted_contribution":0.9949494949494949,"objective_suite_case_count":6.0,"objective_suite_case_stretch_large_gender_immovable_110p_final_score":2212.0,"objective_suite_case_stretch_large_gender_immovable_110p_normalized_score":1.0151445617255621,"objective_suite_case_stretch_large_gender_immovable_110p_reference_final_score":2179.0,"objective_suite_case_stretch_large_gender_immovable_110p_weight":1.0,"objective_suite_case_stretch_large_gender_immovable_110p_weighted_contribution":1.0151445617255621,"objective_suite_case_stretch_sailing_trip_demo_real_final_score":2433.0,"objective_suite_case_stretch_sailing_trip_demo_real_normalized_score":1.0167154199749269,"objective_suite_case_stretch_sailing_trip_demo_real_reference_final_score":2393.0,"objective_suite_case_stretch_sailing_trip_demo_real_weight":1.0,"objective_suite_case_stretch_sailing_trip_demo_real_weighted_contribution":1.0167154199749269,"objective_suite_case_stretch_social_golfer_32x8x10_final_score":5493.0,"objective_suite_case_stretch_social_golfer_32x8x10_normalized_score":1.0,"objective_suite_case_stretch_social_golfer_32x8x10_reference_final_score":5493.0,"objective_suite_case_stretch_social_golfer_32x8x10_weight":1.0,"objective_suite_case_stretch_social_golfer_32x8x10_weighted_contribution":1.0,"objective_suite_case_stretch_synthetic_partial_attendance_capacity_pressure_152p_final_score":6504.0,"objective_suite_case_stretch_synthetic_partial_attendance_capacity_pressure_152p_normalized_score":0.9795180722891567,"objective_suite_case_stretch_synthetic_partial_attendance_capacity_pressure_152p_reference_final_score":6640.0,"objective_suite_case_stretch_synthetic_partial_attendance_capacity_pressure_152p_weight":1.0,"objective_suite_case_stretch_synthetic_partial_attendance_capacity_pressure_152p_weighted_contribution":0.9795180722891567,"objective_suite_external_validation_failures":0.0,"objective_suite_score_breakdown_mismatches":0.0,"objective_suite_total_final_score_raw":21595.0,"objective_suite_total_runtime_seconds":94.006074459,"objective_suite_total_score_mismatches":0.0,"objective_suite_weighted_normalized_score":100.10545914898567,"objective_suite_weighted_normalized_score_delta_from_reference":0.10545914898567599,"objective_suite_weighted_normalized_score_weight_sum":6.0,"path_allowed_sessions_iter_us":8.07925,"path_avg_iter_us":6.196645,"path_clique_iter_us":5.793575,"path_construction_iter_us":7.8473500000000005,"path_swap_iter_us":6.105449999999999,"path_transfer_iter_us":3.1575999999999995,"rep_avg_iter_us":8.628599999999999,"rep_balanced_iter_us":8.512316666666667,"rep_balanced_score":3.0,"rep_constrained_iter_us":8.744883333333332,"rep_constrained_score":4.0,"runtime_canonical_share_percent":99.7326188959111,"runtime_total_seconds":94.258102815,"solver3_raw_score_us":24.65151583333333,"swap_apply_us":0.6205,"swap_preview_us":1.9893906250000002,"transfer_apply_us":0.868234375,"transfer_preview_us":1.191875},"status":"keep","description":"Time-based cooling: max(iter_fraction, time_fraction) as SA progress. Fixes the schedule mismatch where max_iterations=3M but only ~188K iters complete in 15s. attribute_balance 1.404\u21920.995 (beats reference), synthetic_partial below reference too. Also 3x raw iteration speedup from debouncing Instant::elapsed every 64 iters.","timestamp":1775560773969,"segment":0,"confidence":1,"iterationTokens":64945,"asi":{"hypothesis":"max(iter_progress, time_progress) drives SA cooling so whichever stop-condition binds ensures T reaches T_final","key_finding":"Iteration rate ~188K/15s vs max_iterations=3M meant T barely moved (stayed at 1.64 throughout). With time-fraction dominating, T now properly cools 2.0\u21920.05 over the budget. attribute_balance 1.404\u21920.995, primary 107.85\u2192100.11","speedup":"Debouncing Instant::elapsed every 64 iters cut solver3_raw_score_us from 79.6 to 24.7 (3x)","remaining_gaps":"large_gender 1.015x, sailing_trip 1.017x \u2014 both within 2% of reference"}}
