{"run":4,"commit":"598245d","metric":99.91372404017996,"metrics":{"clique_apply_us":0.2588125,"clique_preview_us":0.5939375,"correctness_suite_average_runtime_seconds":0.00723218025,"correctness_suite_case_count":4.0,"correctness_suite_external_validation_failures":0.0,"correctness_suite_total_runtime_seconds":0.028928721,"correctness_suite_total_score_mismatches":0.0,"hotpath_total_us":2.207390625,"metaheuristic_fixed_iteration_weighted_normalized_score":99.91372404017996,"metaheuristic_fixed_iteration_weighted_normalized_score_delta_from_reference":-0.08627595982004799,"metaheuristic_fixed_iteration_weighted_normalized_score_weight_sum":9.0,"metaheuristic_suite_weighted_normalized_score":99.91372404017996,"metaheuristic_suite_weighted_normalized_score_delta_from_reference":-0.08627595982004799,"metaheuristic_suite_weighted_normalized_score_weight_sum":9.0,"objective_fixed_iteration_average_final_score_raw":2598.8888888888887,"objective_fixed_iteration_average_runtime_seconds":14.101170115777778,"objective_fixed_iteration_case_adversarial_clique_swap_functionality_35p_final_score":4765.0,"objective_fixed_iteration_case_adversarial_clique_swap_functionality_35p_normalized_score":1.0,"objective_fixed_iteration_case_adversarial_clique_swap_functionality_35p_reference_final_score":4765.0,"objective_fixed_iteration_case_adversarial_clique_swap_functionality_35p_weight":1.0,"objective_fixed_iteration_case_adversarial_clique_swap_functionality_35p_weighted_contribution":1.0,"objective_fixed_iteration_case_adversarial_transfer_attribute_balance_111p_final_score":194.0,"objective_fixed_iteration_case_adversarial_transfer_attribute_balance_111p_normalized_score":1.0,"objective_fixed_iteration_case_adversarial_transfer_attribute_balance_111p_reference_final_score":194.0,"objective_fixed_iteration_case_adversarial_transfer_attribute_balance_111p_weight":1.0,"objective_fixed_iteration_case_adversarial_transfer_attribute_balance_111p_weighted_contribution":1.0,"objective_fixed_iteration_case_count":9.0,"objective_fixed_iteration_case_representative_small_workshop_balanced_final_score":3.0,"objective_fixed_iteration_case_representative_small_workshop_balanced_normalized_score":1.0,"objective_fixed_iteration_case_representative_small_workshop_balanced_reference_final_score":3.0,"objective_fixed_iteration_case_representative_small_workshop_balanced_weight":1.0,"objective_fixed_iteration_case_representative_small_workshop_balanced_weighted_contribution":1.0,"objective_fixed_iteration_case_representative_small_workshop_constrained_final_score":4.0,"objective_fixed_iteration_case_representative_small_workshop_constrained_normalized_score":1.0,"objective_fixed_iteration_case_representative_small_workshop_constrained_reference_final_score":4.0,"objective_fixed_iteration_case_representative_small_workshop_constrained_weight":1.0,"objective_fixed_iteration_case_representative_small_workshop_constrained_weighted_contribution":1.0,"objective_fixed_iteration_case_stretch_kirkman_schoolgirls_15x5x7_final_score":55.0,"objective_fixed_iteration_case_stretch_kirkman_schoolgirls_15x5x7_normalized_score":1.0,"objective_fixed_iteration_case_stretch_kirkman_schoolgirls_15x5x7_reference_final_score":55.0,"objective_fixed_iteration_case_stretch_kirkman_schoolgirls_15x5x7_weight":1.0,"objective_fixed_iteration_case_stretch_kirkman_schoolgirls_15x5x7_weighted_contribution":1.0,"objective_fixed_iteration_case_stretch_large_gender_immovable_110p_final_score":2102.0,"objective_fixed_iteration_case_stretch_large_gender_immovable_110p_normalized_score":1.0,"objective_fixed_iteration_case_stretch_large_gender_immovable_110p_reference_final_score":2102.0,"objective_fixed_iteration_case_stretch_large_gender_immovable_110p_weight":1.0,"objective_fixed_iteration_case_stretch_large_gender_immovable_110p_weighted_contribution":1.0,"objective_fixed_iteration_case_stretch_sailing_trip_demo_real_final_score":4362.0,"objective_fixed_iteration_case_stretch_sailing_trip_demo_real_normalized_score":1.0,"objective_fixed_iteration_case_stretch_sailing_trip_demo_real_reference_final_score":4362.0,"objective_fixed_iteration_case_stretch_sailing_trip_demo_real_weight":1.0,"objective_fixed_iteration_case_stretch_sailing_trip_demo_real_weighted_contribution":1.0,"objective_fixed_iteration_case_stretch_social_golfer_32x8x10_final_score":5367.0,"objective_fixed_iteration_case_stretch_social_golfer_32x8x10_normalized_score":0.9922351636161952,"objective_fixed_iteration_case_stretch_social_golfer_32x8x10_reference_final_score":5409.0,"objective_fixed_iteration_case_stretch_social_golfer_32x8x10_weight":1.0,"objective_fixed_iteration_case_stretch_social_golfer_32x8x10_weighted_contribution":0.9922351636161952,"objective_fixed_iteration_case_stretch_synthetic_partial_attendance_capacity_pressure_152p_final_score":6538.0,"objective_fixed_iteration_case_stretch_synthetic_partial_attendance_capacity_pressure_152p_normalized_score":1.0,"objective_fixed_iteration_case_stretch_synthetic_partial_attendance_capacity_pressure_152p_reference_final_score":6538.0,"objective_fixed_iteration_case_stretch_synthetic_partial_attendance_capacity_pressure_152p_weight":1.0,"objective_fixed_iteration_case_stretch_synthetic_partial_attendance_capacity_pressure_152p_weighted_contribution":1.0,"objective_fixed_iteration_external_validation_failures":0.0,"objective_fixed_iteration_score_breakdown_mismatches":0.0,"objective_fixed_iteration_total_final_score_raw":23390.0,"objective_fixed_iteration_total_runtime_seconds":126.910531042,"objective_fixed_iteration_total_score_mismatches":0.0,"objective_suite_average_final_score_raw":2592.6666666666665,"objective_suite_average_runtime_seconds":150.00005176744443,"objective_suite_case_adversarial_clique_swap_functionality_35p_final_score":4765.0,"objective_suite_case_adversarial_clique_swap_functionality_35p_normalized_score":1.0,"objective_suite_case_adversarial_clique_swap_functionality_35p_reference_final_score":4765.0,"objective_suite_case_adversarial_clique_swap_functionality_35p_weight":1.0,"objective_suite_case_adversarial_clique_swap_functionality_35p_weighted_contribution":1.0,"objective_suite_case_adversarial_transfer_attribute_balance_111p_final_score":183.0,"objective_suite_case_adversarial_transfer_attribute_balance_111p_normalized_score":1.0,"objective_suite_case_adversarial_transfer_attribute_balance_111p_reference_final_score":183.0,"objective_suite_case_adversarial_transfer_attribute_balance_111p_weight":1.0,"objective_suite_case_adversarial_transfer_attribute_balance_111p_weighted_contribution":1.0,"objective_suite_case_count":9.0,"objective_suite_case_representative_small_workshop_balanced_final_score":3.0,"objective_suite_case_representative_small_workshop_balanced_normalized_score":1.0,"objective_suite_case_representative_small_workshop_balanced_reference_final_score":3.0,"objective_suite_case_representative_small_workshop_balanced_weight":1.0,"objective_suite_case_representative_small_workshop_balanced_weighted_contribution":1.0,"objective_suite_case_representative_small_workshop_constrained_final_score":4.0,"objective_suite_case_representative_small_workshop_constrained_normalized_score":1.0,"objective_suite_case_representative_small_workshop_constrained_reference_final_score":4.0,"objective_suite_case_representative_small_workshop_constrained_weight":1.0,"objective_suite_case_representative_small_workshop_constrained_weighted_contribution":1.0,"objective_suite_case_stretch_kirkman_schoolgirls_15x5x7_final_score":55.0,"objective_suite_case_stretch_kirkman_schoolgirls_15x5x7_normalized_score":1.0,"objective_suite_case_stretch_kirkman_schoolgirls_15x5x7_reference_final_score":55.0,"objective_suite_case_stretch_kirkman_schoolgirls_15x5x7_weight":1.0,"objective_suite_case_stretch_kirkman_schoolgirls_15x5x7_weighted_contribution":1.0,"objective_suite_case_stretch_large_gender_immovable_110p_final_score":2102.0,"objective_suite_case_stretch_large_gender_immovable_110p_normalized_score":1.0,"objective_suite_case_stretch_large_gender_immovable_110p_reference_final_score":2102.0,"objective_suite_case_stretch_large_gender_immovable_110p_weight":1.0,"objective_suite_case_stretch_large_gender_immovable_110p_weighted_contribution":1.0,"objective_suite_case_stretch_sailing_trip_demo_real_final_score":4358.0,"objective_suite_case_stretch_sailing_trip_demo_real_normalized_score":1.0,"objective_suite_case_stretch_sailing_trip_demo_real_reference_final_score":4358.0,"objective_suite_case_stretch_sailing_trip_demo_real_weight":1.0,"objective_suite_case_stretch_sailing_trip_demo_real_weighted_contribution":1.0,"objective_suite_case_stretch_social_golfer_32x8x10_final_score":5367.0,"objective_suite_case_stretch_social_golfer_32x8x10_normalized_score":0.9922351636161952,"objective_suite_case_stretch_social_golfer_32x8x10_reference_final_score":5409.0,"objective_suite_case_stretch_social_golfer_32x8x10_weight":1.0,"objective_suite_case_stretch_social_golfer_32x8x10_weighted_contribution":0.9922351636161952,"objective_suite_case_stretch_synthetic_partial_attendance_capacity_pressure_152p_final_score":6497.0,"objective_suite_case_stretch_synthetic_partial_attendance_capacity_pressure_152p_normalized_score":1.0,"objective_suite_case_stretch_synthetic_partial_attendance_capacity_pressure_152p_reference_final_score":6497.0,"objective_suite_case_stretch_synthetic_partial_attendance_capacity_pressure_152p_weight":1.0,"objective_suite_case_stretch_synthetic_partial_attendance_capacity_pressure_152p_weighted_contribution":1.0,"objective_suite_external_validation_failures":0.0,"objective_suite_score_breakdown_mismatches":0.0,"objective_suite_total_final_score_raw":23334.0,"objective_suite_total_runtime_seconds":1350.000465907,"objective_suite_total_score_mismatches":0.0,"path_allowed_sessions_iter_us":1.2742749999999998,"path_avg_iter_us":1.376655,"path_clique_iter_us":1.5767,"path_construction_iter_us":1.9150000000000003,"path_swap_iter_us":1.37705,"path_transfer_iter_us":0.74025,"rep_avg_iter_us":1.0132887681159422,"rep_balanced_iter_us":1.0288166666666667,"rep_balanced_score":3.0,"rep_constrained_iter_us":0.9977608695652174,"rep_constrained_score":9.0,"runtime_canonical_share_percent":99.99785717843514,"runtime_total_seconds":1350.029394628,"solver3_raw_score_us":4.597334393115942,"swap_apply_us":0.234140625,"swap_preview_us":0.6569375,"transfer_apply_us":0.26812499999999995,"transfer_preview_us":0.1954375},"status":"keep","description":"Kept a narrower capability-routing split: route only the pure zero-repeat stretch cases (Social Golfer and Kirkman) through single_state + sgp_week_pair_tabu, while leaving large_gender plus feature-rich stretch cases on baseline truthful modes.","timestamp":1776136995308,"segment":0,"confidence":1,"iterationTokens":10749}
{"run":5,"commit":"c3a9ee0","metric":88.80261292906883,"metrics":{"clique_apply_us":0.24135416666666665,"clique_preview_us":0.7767499999999999,"correctness_suite_average_runtime_seconds":0.00659499,"correctness_suite_case_count":4.0,"correctness_suite_external_validation_failures":0.0,"correctness_suite_total_runtime_seconds":0.02637996,"correctness_suite_total_score_mismatches":0.0,"hotpath_total_us":2.3780885416666666,"metaheuristic_fixed_iteration_weighted_normalized_score":88.80261292906883,"metaheuristic_fixed_iteration_weighted_normalized_score_delta_from_reference":-11.197387070931164,"metaheuristic_fixed_iteration_weighted_normalized_score_weight_sum":9.0,"metaheuristic_suite_weighted_normalized_score":88.80261292906883,"metaheuristic_suite_weighted_normalized_score_delta_from_reference":-11.197387070931164,"metaheuristic_suite_weighted_normalized_score_weight_sum":9.0,"objective_fixed_iteration_average_final_score_raw":2592.777777777778,"objective_fixed_iteration_average_runtime_seconds":14.187222197777778,"objective_fixed_iteration_case_adversarial_clique_swap_functionality_35p_final_score":4765.0,"objective_fixed_iteration_case_adversarial_clique_swap_functionality_35p_normalized_score":1.0,"objective_fixed_iteration_case_adversarial_clique_swap_functionality_35p_reference_final_score":4765.0,"objective_fixed_iteration_case_adversarial_clique_swap_functionality_35p_weight":1.0,"objective_fixed_iteration_case_adversarial_clique_swap_functionality_35p_weighted_contribution":1.0,"objective_fixed_iteration_case_adversarial_transfer_attribute_balance_111p_final_score":194.0,"objective_fixed_iteration_case_adversarial_transfer_attribute_balance_111p_normalized_score":1.0,"objective_fixed_iteration_case_adversarial_transfer_attribute_balance_111p_reference_final_score":194.0,"objective_fixed_iteration_case_adversarial_transfer_attribute_balance_111p_weight":1.0,"objective_fixed_iteration_case_adversarial_transfer_attribute_balance_111p_weighted_contribution":1.0,"objective_fixed_iteration_case_count":9.0,"objective_fixed_iteration_case_representative_small_workshop_balanced_final_score":3.0,"objective_fixed_iteration_case_representative_small_workshop_balanced_normalized_score":1.0,"objective_fixed_iteration_case_representative_small_workshop_balanced_reference_final_score":3.0,"objective_fixed_iteration_case_representative_small_workshop_balanced_weight":1.0,"objective_fixed_iteration_case_representative_small_workshop_balanced_weighted_contribution":1.0,"objective_fixed_iteration_case_representative_small_workshop_constrained_final_score":4.0,"objective_fixed_iteration_case_representative_small_workshop_constrained_normalized_score":1.0,"objective_fixed_iteration_case_representative_small_workshop_constrained_reference_final_score":4.0,"objective_fixed_iteration_case_representative_small_workshop_constrained_weight":1.0,"objective_fixed_iteration_case_representative_small_workshop_constrained_weighted_contribution":1.0,"objective_fixed_iteration_case_stretch_kirkman_schoolgirls_15x5x7_final_score":0.0,"objective_fixed_iteration_case_stretch_kirkman_schoolgirls_15x5x7_normalized_score":0.0,"objective_fixed_iteration_case_stretch_kirkman_schoolgirls_15x5x7_reference_final_score":55.0,"objective_fixed_iteration_case_stretch_kirkman_schoolgirls_15x5x7_weight":1.0,"objective_fixed_iteration_case_stretch_kirkman_schoolgirls_15x5x7_weighted_contribution":0.0,"objective_fixed_iteration_case_stretch_large_gender_immovable_110p_final_score":2102.0,"objective_fixed_iteration_case_stretch_large_gender_immovable_110p_normalized_score":1.0,"objective_fixed_iteration_case_stretch_large_gender_immovable_110p_reference_final_score":2102.0,"objective_fixed_iteration_case_stretch_large_gender_immovable_110p_weight":1.0,"objective_fixed_iteration_case_stretch_large_gender_immovable_110p_weighted_contribution":1.0,"objective_fixed_iteration_case_stretch_sailing_trip_demo_real_final_score":4362.0,"objective_fixed_iteration_case_stretch_sailing_trip_demo_real_normalized_score":1.0,"objective_fixed_iteration_case_stretch_sailing_trip_demo_real_reference_final_score":4362.0,"objective_fixed_iteration_case_stretch_sailing_trip_demo_real_weight":1.0,"objective_fixed_iteration_case_stretch_sailing_trip_demo_real_weighted_contribution":1.0,"objective_fixed_iteration_case_stretch_social_golfer_32x8x10_final_score":5367.0,"objective_fixed_iteration_case_stretch_social_golfer_32x8x10_normalized_score":0.9922351636161952,"objective_fixed_iteration_case_stretch_social_golfer_32x8x10_reference_final_score":5409.0,"objective_fixed_iteration_case_stretch_social_golfer_32x8x10_weight":1.0,"objective_fixed_iteration_case_stretch_social_golfer_32x8x10_weighted_contribution":0.9922351636161952,"objective_fixed_iteration_case_stretch_synthetic_partial_attendance_capacity_pressure_152p_final_score":6538.0,"objective_fixed_iteration_case_stretch_synthetic_partial_attendance_capacity_pressure_152p_normalized_score":1.0,"objective_fixed_iteration_case_stretch_synthetic_partial_attendance_capacity_pressure_152p_reference_final_score":6538.0,"objective_fixed_iteration_case_stretch_synthetic_partial_attendance_capacity_pressure_152p_weight":1.0,"objective_fixed_iteration_case_stretch_synthetic_partial_attendance_capacity_pressure_152p_weighted_contribution":1.0,"objective_fixed_iteration_external_validation_failures":0.0,"objective_fixed_iteration_score_breakdown_mismatches":0.0,"objective_fixed_iteration_total_final_score_raw":23335.0,"objective_fixed_iteration_total_runtime_seconds":127.68499978,"objective_fixed_iteration_total_score_mismatches":0.0,"objective_suite_average_final_score_raw":2586.5555555555557,"objective_suite_average_runtime_seconds":150.00008132055555,"objective_suite_case_adversarial_clique_swap_functionality_35p_final_score":4765.0,"objective_suite_case_adversarial_clique_swap_functionality_35p_normalized_score":1.0,"objective_suite_case_adversarial_clique_swap_functionality_35p_reference_final_score":4765.0,"objective_suite_case_adversarial_clique_swap_functionality_35p_weight":1.0,"objective_suite_case_adversarial_clique_swap_functionality_35p_weighted_contribution":1.0,"objective_suite_case_adversarial_transfer_attribute_balance_111p_final_score":183.0,"objective_suite_case_adversarial_transfer_attribute_balance_111p_normalized_score":1.0,"objective_suite_case_adversarial_transfer_attribute_balance_111p_reference_final_score":183.0,"objective_suite_case_adversarial_transfer_attribute_balance_111p_weight":1.0,"objective_suite_case_adversarial_transfer_attribute_balance_111p_weighted_contribution":1.0,"objective_suite_case_count":9.0,"objective_suite_case_representative_small_workshop_balanced_final_score":3.0,"objective_suite_case_representative_small_workshop_balanced_normalized_score":1.0,"objective_suite_case_representative_small_workshop_balanced_reference_final_score":3.0,"objective_suite_case_representative_small_workshop_balanced_weight":1.0,"objective_suite_case_representative_small_workshop_balanced_weighted_contribution":1.0,"objective_suite_case_representative_small_workshop_constrained_final_score":4.0,"objective_suite_case_representative_small_workshop_constrained_normalized_score":1.0,"objective_suite_case_representative_small_workshop_constrained_reference_final_score":4.0,"objective_suite_case_representative_small_workshop_constrained_weight":1.0,"objective_suite_case_representative_small_workshop_constrained_weighted_contribution":1.0,"objective_suite_case_stretch_kirkman_schoolgirls_15x5x7_final_score":0.0,"objective_suite_case_stretch_kirkman_schoolgirls_15x5x7_normalized_score":0.0,"objective_suite_case_stretch_kirkman_schoolgirls_15x5x7_reference_final_score":55.0,"objective_suite_case_stretch_kirkman_schoolgirls_15x5x7_weight":1.0,"objective_suite_case_stretch_kirkman_schoolgirls_15x5x7_weighted_contribution":0.0,"objective_suite_case_stretch_large_gender_immovable_110p_final_score":2102.0,"objective_suite_case_stretch_large_gender_immovable_110p_normalized_score":1.0,"objective_suite_case_stretch_large_gender_immovable_110p_reference_final_score":2102.0,"objective_suite_case_stretch_large_gender_immovable_110p_weight":1.0,"objective_suite_case_stretch_large_gender_immovable_110p_weighted_contribution":1.0,"objective_suite_case_stretch_sailing_trip_demo_real_final_score":4358.0,"objective_suite_case_stretch_sailing_trip_demo_real_normalized_score":1.0,"objective_suite_case_stretch_sailing_trip_demo_real_reference_final_score":4358.0,"objective_suite_case_stretch_sailing_trip_demo_real_weight":1.0,"objective_suite_case_stretch_sailing_trip_demo_real_weighted_contribution":1.0,"objective_suite_case_stretch_social_golfer_32x8x10_final_score":5367.0,"objective_suite_case_stretch_social_golfer_32x8x10_normalized_score":0.9922351636161952,"objective_suite_case_stretch_social_golfer_32x8x10_reference_final_score":5409.0,"objective_suite_case_stretch_social_golfer_32x8x10_weight":1.0,"objective_suite_case_stretch_social_golfer_32x8x10_weighted_contribution":0.9922351636161952,"objective_suite_case_stretch_synthetic_partial_attendance_capacity_pressure_152p_final_score":6497.0,"objective_suite_case_stretch_synthetic_partial_attendance_capacity_pressure_152p_normalized_score":1.0,"objective_suite_case_stretch_synthetic_partial_attendance_capacity_pressure_152p_reference_final_score":6497.0,"objective_suite_case_stretch_synthetic_partial_attendance_capacity_pressure_152p_weight":1.0,"objective_suite_case_stretch_synthetic_partial_attendance_capacity_pressure_152p_weighted_contribution":1.0,"objective_suite_external_validation_failures":0.0,"objective_suite_score_breakdown_mismatches":0.0,"objective_suite_total_final_score_raw":23279.0,"objective_suite_total_runtime_seconds":1350.000731885,"objective_suite_total_score_mismatches":0.0,"path_allowed_sessions_iter_us":0.68135,"path_avg_iter_us":0.768585,"path_clique_iter_us":0.88195,"path_construction_iter_us":1.139575,"path_swap_iter_us":0.7137,"path_transfer_iter_us":0.42634999999999995,"rep_avg_iter_us":1.2696528985507247,"rep_balanced_iter_us":1.4865666666666668,"rep_balanced_score":3.0,"rep_constrained_iter_us":1.0527391304347826,"rep_constrained_score":9.0,"runtime_canonical_share_percent":99.99804596813141,"runtime_total_seconds":1350.027111845,"solver3_raw_score_us":4.416326440217391,"swap_apply_us":0.21409375,"swap_preview_us":0.70934375,"transfer_apply_us":0.246890625,"transfer_preview_us":0.18965625},"status":"keep","description":"Kept a stronger pure-zero-repeat routing upgrade: switch the Social Golfer + Kirkman zero-repeat stretch suite from single_state + sgp_week_pair_tabu to donor_session_transplant + sgp_week_pair_tabu, while leaving the broader feature-rich cases on baseline truthful modes.","timestamp":1776138579554,"segment":0,"confidence":77.02987949377024,"iterationTokens":9845}
