{"run":6,"commit":"7be6d99","metric":100.2342352270132,"metrics":{"clique_apply_us":0.8318333333333333,"clique_preview_us":4.517541666666666,"correctness_suite_average_runtime_seconds":0.108725969,"correctness_suite_case_count":4.0,"correctness_suite_external_validation_failures":0.0,"correctness_suite_total_runtime_seconds":0.434903876,"correctness_suite_total_score_mismatches":0.0,"hotpath_total_us":10.338625,"objective_fixed_iteration_average_final_score_raw":3571.5,"objective_fixed_iteration_average_runtime_seconds":41.25935017016667,"objective_fixed_iteration_case_adversarial_clique_swap_functionality_35p_final_score":4756.0,"objective_fixed_iteration_case_adversarial_clique_swap_functionality_35p_normalized_score":1.0,"objective_fixed_iteration_case_adversarial_clique_swap_functionality_35p_reference_final_score":4756.0,"objective_fixed_iteration_case_adversarial_clique_swap_functionality_35p_weight":1.0,"objective_fixed_iteration_case_adversarial_clique_swap_functionality_35p_weighted_contribution":1.0,"objective_fixed_iteration_case_adversarial_transfer_attribute_balance_111p_final_score":204.0,"objective_fixed_iteration_case_adversarial_transfer_attribute_balance_111p_normalized_score":1.0,"objective_fixed_iteration_case_adversarial_transfer_attribute_balance_111p_reference_final_score":204.0,"objective_fixed_iteration_case_adversarial_transfer_attribute_balance_111p_weight":1.0,"objective_fixed_iteration_case_adversarial_transfer_attribute_balance_111p_weighted_contribution":1.0,"objective_fixed_iteration_case_count":6.0,"objective_fixed_iteration_case_stretch_large_gender_immovable_110p_final_score":2135.0,"objective_fixed_iteration_case_stretch_large_gender_immovable_110p_normalized_score":1.0,"objective_fixed_iteration_case_stretch_large_gender_immovable_110p_reference_final_score":2135.0,"objective_fixed_iteration_case_stretch_large_gender_immovable_110p_weight":1.0,"objective_fixed_iteration_case_stretch_large_gender_immovable_110p_weighted_contribution":1.0,"objective_fixed_iteration_case_stretch_sailing_trip_demo_real_final_score":2220.0,"objective_fixed_iteration_case_stretch_sailing_trip_demo_real_normalized_score":1.0,"objective_fixed_iteration_case_stretch_sailing_trip_demo_real_reference_final_score":2220.0,"objective_fixed_iteration_case_stretch_sailing_trip_demo_real_weight":1.0,"objective_fixed_iteration_case_stretch_sailing_trip_demo_real_weighted_contribution":1.0,"objective_fixed_iteration_case_stretch_social_golfer_32x8x10_final_score":5493.0,"objective_fixed_iteration_case_stretch_social_golfer_32x8x10_normalized_score":1.0,"objective_fixed_iteration_case_stretch_social_golfer_32x8x10_reference_final_score":5493.0,"objective_fixed_iteration_case_stretch_social_golfer_32x8x10_weight":1.0,"objective_fixed_iteration_case_stretch_social_golfer_32x8x10_weighted_contribution":1.0,"objective_fixed_iteration_case_stretch_synthetic_partial_attendance_capacity_pressure_152p_final_score":6621.0,"objective_fixed_iteration_case_stretch_synthetic_partial_attendance_capacity_pressure_152p_normalized_score":1.0,"objective_fixed_iteration_case_stretch_synthetic_partial_attendance_capacity_pressure_152p_reference_final_score":6621.0,"objective_fixed_iteration_case_stretch_synthetic_partial_attendance_capacity_pressure_152p_weight":1.0,"objective_fixed_iteration_case_stretch_synthetic_partial_attendance_capacity_pressure_152p_weighted_contribution":1.0,"objective_fixed_iteration_external_validation_failures":0.0,"objective_fixed_iteration_score_breakdown_mismatches":0.0,"objective_fixed_iteration_total_final_score_raw":21429.0,"objective_fixed_iteration_total_runtime_seconds":247.556101021,"objective_fixed_iteration_total_score_mismatches":0.0,"objective_fixed_iteration_weighted_normalized_score":100.0,"objective_fixed_iteration_weighted_normalized_score_delta_from_reference":0.0,"objective_fixed_iteration_weighted_normalized_score_weight_sum":6.0,"objective_suite_average_final_score_raw":3602.0,"objective_suite_average_runtime_seconds":15.667547300833334,"objective_suite_case_adversarial_clique_swap_functionality_35p_final_score":4756.0,"objective_suite_case_adversarial_clique_swap_functionality_35p_normalized_score":1.0,"objective_suite_case_adversarial_clique_swap_functionality_35p_reference_final_score":4756.0,"objective_suite_case_adversarial_clique_swap_functionality_35p_weight":1.0,"objective_suite_case_adversarial_clique_swap_functionality_35p_weighted_contribution":1.0,"objective_suite_case_adversarial_transfer_attribute_balance_111p_final_score":201.0,"objective_suite_case_adversarial_transfer_attribute_balance_111p_normalized_score":1.0151515151515151,"objective_suite_case_adversarial_transfer_attribute_balance_111p_reference_final_score":198.0,"objective_suite_case_adversarial_transfer_attribute_balance_111p_weight":1.0,"objective_suite_case_adversarial_transfer_attribute_balance_111p_weighted_contribution":1.0151515151515151,"objective_suite_case_count":6.0,"objective_suite_case_stretch_large_gender_immovable_110p_final_score":2212.0,"objective_suite_case_stretch_large_gender_immovable_110p_normalized_score":1.0151445617255621,"objective_suite_case_stretch_large_gender_immovable_110p_reference_final_score":2179.0,"objective_suite_case_stretch_large_gender_immovable_110p_weight":1.0,"objective_suite_case_stretch_large_gender_immovable_110p_weighted_contribution":1.0151445617255621,"objective_suite_case_stretch_sailing_trip_demo_real_final_score":2379.0,"objective_suite_case_stretch_sailing_trip_demo_real_normalized_score":0.9941496030087756,"objective_suite_case_stretch_sailing_trip_demo_real_reference_final_score":2393.0,"objective_suite_case_stretch_sailing_trip_demo_real_weight":1.0,"objective_suite_case_stretch_sailing_trip_demo_real_weighted_contribution":0.9941496030087756,"objective_suite_case_stretch_social_golfer_32x8x10_final_score":5493.0,"objective_suite_case_stretch_social_golfer_32x8x10_normalized_score":1.0,"objective_suite_case_stretch_social_golfer_32x8x10_reference_final_score":5493.0,"objective_suite_case_stretch_social_golfer_32x8x10_weight":1.0,"objective_suite_case_stretch_social_golfer_32x8x10_weighted_contribution":1.0,"objective_suite_case_stretch_synthetic_partial_attendance_capacity_pressure_152p_final_score":6571.0,"objective_suite_case_stretch_synthetic_partial_attendance_capacity_pressure_152p_normalized_score":0.9896084337349398,"objective_suite_case_stretch_synthetic_partial_attendance_capacity_pressure_152p_reference_final_score":6640.0,"objective_suite_case_stretch_synthetic_partial_attendance_capacity_pressure_152p_weight":1.0,"objective_suite_case_stretch_synthetic_partial_attendance_capacity_pressure_152p_weighted_contribution":0.9896084337349398,"objective_suite_external_validation_failures":0.0,"objective_suite_score_breakdown_mismatches":0.0,"objective_suite_total_final_score_raw":21612.0,"objective_suite_total_runtime_seconds":94.005283805,"objective_suite_total_score_mismatches":0.0,"objective_suite_weighted_normalized_score":100.2342352270132,"objective_suite_weighted_normalized_score_delta_from_reference":0.23423522701320199,"objective_suite_weighted_normalized_score_weight_sum":6.0,"path_allowed_sessions_iter_us":7.365075,"path_avg_iter_us":5.567895,"path_clique_iter_us":5.356050000000001,"path_construction_iter_us":8.556075,"path_swap_iter_us":3.7264000000000004,"path_transfer_iter_us":2.835875,"rep_avg_iter_us":9.562000000000001,"rep_balanced_iter_us":9.44345,"rep_balanced_score":3.0,"rep_constrained_iter_us":9.68055,"rep_constrained_score":4.0,"runtime_canonical_share_percent":99.53949278725598,"runtime_total_seconds":94.440187681,"solver3_raw_score_us":25.46852,"swap_apply_us":0.690140625,"swap_preview_us":2.159046875,"transfer_apply_us":0.762328125,"transfer_preview_us":1.377734375},"status":"discard","description":"Conditional stagnation restart is much better than unconditional midpoint restart: fixed-iteration recovered to 100.0 and sailing stayed below reference, but primary still regressed vs best (100.11\u2192100.23) because attribute_balance slipped from 0.995 to 1.015. Restart family still plausible with stricter trigger.","timestamp":1775575011507,"segment":0,"confidence":16.87843437946469,"iterationTokens":25302,"asi":{"hypothesis":"Restart from incumbent-best only under stagnation can help hard local-minimum cases without forcing all cases through a second cooling cycle","rollback_reason":"Still worse than best: 100.11\u2192100.23, mainly due to slight attribute_balance regression. Restart trigger is still too permissive.","mechanism_family_signal":"Directionally better than unconditional restart (100.95\u2192100.23), so the family is not dead yet. Sailing and synthetic remain good; stricter trigger may preserve attribute_balance.","next_action_hint":"Final incubation follow-up: require larger drift-from-best and later progress window before restart, so only truly stuck runs reheat. If that still misses, retire restart family for now and move to a new neighborhood/move type."}}
{"run":7,"commit":"7be6d99","metric":100.59605019385181,"metrics":{"clique_apply_us":0.9686458333333333,"clique_preview_us":7.756145833333335,"correctness_suite_average_runtime_seconds":0.10632715100000001,"correctness_suite_case_count":4.0,"correctness_suite_external_validation_failures":0.0,"correctness_suite_total_runtime_seconds":0.42530860400000003,"correctness_suite_total_score_mismatches":0.0,"hotpath_total_us":16.352994791666667,"objective_fixed_iteration_average_final_score_raw":3571.5,"objective_fixed_iteration_average_runtime_seconds":42.686103183166665,"objective_fixed_iteration_case_adversarial_clique_swap_functionality_35p_final_score":4756.0,"objective_fixed_iteration_case_adversarial_clique_swap_functionality_35p_normalized_score":1.0,"objective_fixed_iteration_case_adversarial_clique_swap_functionality_35p_reference_final_score":4756.0,"objective_fixed_iteration_case_adversarial_clique_swap_functionality_35p_weight":1.0,"objective_fixed_iteration_case_adversarial_clique_swap_functionality_35p_weighted_contribution":1.0,"objective_fixed_iteration_case_adversarial_transfer_attribute_balance_111p_final_score":204.0,"objective_fixed_iteration_case_adversarial_transfer_attribute_balance_111p_normalized_score":1.0,"objective_fixed_iteration_case_adversarial_transfer_attribute_balance_111p_reference_final_score":204.0,"objective_fixed_iteration_case_adversarial_transfer_attribute_balance_111p_weight":1.0,"objective_fixed_iteration_case_adversarial_transfer_attribute_balance_111p_weighted_contribution":1.0,"objective_fixed_iteration_case_count":6.0,"objective_fixed_iteration_case_stretch_large_gender_immovable_110p_final_score":2135.0,"objective_fixed_iteration_case_stretch_large_gender_immovable_110p_normalized_score":1.0,"objective_fixed_iteration_case_stretch_large_gender_immovable_110p_reference_final_score":2135.0,"objective_fixed_iteration_case_stretch_large_gender_immovable_110p_weight":1.0,"objective_fixed_iteration_case_stretch_large_gender_immovable_110p_weighted_contribution":1.0,"objective_fixed_iteration_case_stretch_sailing_trip_demo_real_final_score":2220.0,"objective_fixed_iteration_case_stretch_sailing_trip_demo_real_normalized_score":1.0,"objective_fixed_iteration_case_stretch_sailing_trip_demo_real_reference_final_score":2220.0,"objective_fixed_iteration_case_stretch_sailing_trip_demo_real_weight":1.0,"objective_fixed_iteration_case_stretch_sailing_trip_demo_real_weighted_contribution":1.0,"objective_fixed_iteration_case_stretch_social_golfer_32x8x10_final_score":5493.0,"objective_fixed_iteration_case_stretch_social_golfer_32x8x10_normalized_score":1.0,"objective_fixed_iteration_case_stretch_social_golfer_32x8x10_reference_final_score":5493.0,"objective_fixed_iteration_case_stretch_social_golfer_32x8x10_weight":1.0,"objective_fixed_iteration_case_stretch_social_golfer_32x8x10_weighted_contribution":1.0,"objective_fixed_iteration_case_stretch_synthetic_partial_attendance_capacity_pressure_152p_final_score":6621.0,"objective_fixed_iteration_case_stretch_synthetic_partial_attendance_capacity_pressure_152p_normalized_score":1.0,"objective_fixed_iteration_case_stretch_synthetic_partial_attendance_capacity_pressure_152p_reference_final_score":6621.0,"objective_fixed_iteration_case_stretch_synthetic_partial_attendance_capacity_pressure_152p_weight":1.0,"objective_fixed_iteration_case_stretch_synthetic_partial_attendance_capacity_pressure_152p_weighted_contribution":1.0,"objective_fixed_iteration_external_validation_failures":0.0,"objective_fixed_iteration_score_breakdown_mismatches":0.0,"objective_fixed_iteration_total_final_score_raw":21429.0,"objective_fixed_iteration_total_runtime_seconds":256.116619099,"objective_fixed_iteration_total_score_mismatches":0.0,"objective_fixed_iteration_weighted_normalized_score":100.0,"objective_fixed_iteration_weighted_normalized_score_delta_from_reference":0.0,"objective_fixed_iteration_weighted_normalized_score_weight_sum":6.0,"objective_suite_average_final_score_raw":3617.8333333333335,"objective_suite_average_runtime_seconds":15.668051740166668,"objective_suite_case_adversarial_clique_swap_functionality_35p_final_score":4756.0,"objective_suite_case_adversarial_clique_swap_functionality_35p_normalized_score":1.0,"objective_suite_case_adversarial_clique_swap_functionality_35p_reference_final_score":4756.0,"objective_suite_case_adversarial_clique_swap_functionality_35p_weight":1.0,"objective_suite_case_adversarial_clique_swap_functionality_35p_weighted_contribution":1.0,"objective_suite_case_adversarial_transfer_attribute_balance_111p_final_score":198.0,"objective_suite_case_adversarial_transfer_attribute_balance_111p_normalized_score":1.0,"objective_suite_case_adversarial_transfer_attribute_balance_111p_reference_final_score":198.0,"objective_suite_case_adversarial_transfer_attribute_balance_111p_weight":1.0,"objective_suite_case_adversarial_transfer_attribute_balance_111p_weighted_contribution":1.0,"objective_suite_case_count":6.0,"objective_suite_case_stretch_large_gender_immovable_110p_final_score":2223.0,"objective_suite_case_stretch_large_gender_immovable_110p_normalized_score":1.0201927489674163,"objective_suite_case_stretch_large_gender_immovable_110p_reference_final_score":2179.0,"objective_suite_case_stretch_large_gender_immovable_110p_weight":1.0,"objective_suite_case_stretch_large_gender_immovable_110p_weighted_contribution":1.0201927489674163,"objective_suite_case_stretch_sailing_trip_demo_real_final_score":2449.0,"objective_suite_case_stretch_sailing_trip_demo_real_normalized_score":1.0234015879648977,"objective_suite_case_stretch_sailing_trip_demo_real_reference_final_score":2393.0,"objective_suite_case_stretch_sailing_trip_demo_real_weight":1.0,"objective_suite_case_stretch_sailing_trip_demo_real_weighted_contribution":1.0234015879648977,"objective_suite_case_stretch_social_golfer_32x8x10_final_score":5493.0,"objective_suite_case_stretch_social_golfer_32x8x10_normalized_score":1.0,"objective_suite_case_stretch_social_golfer_32x8x10_reference_final_score":5493.0,"objective_suite_case_stretch_social_golfer_32x8x10_weight":1.0,"objective_suite_case_stretch_social_golfer_32x8x10_weighted_contribution":1.0,"objective_suite_case_stretch_synthetic_partial_attendance_capacity_pressure_152p_final_score":6588.0,"objective_suite_case_stretch_synthetic_partial_attendance_capacity_pressure_152p_normalized_score":0.9921686746987952,"objective_suite_case_stretch_synthetic_partial_attendance_capacity_pressure_152p_reference_final_score":6640.0,"objective_suite_case_stretch_synthetic_partial_attendance_capacity_pressure_152p_weight":1.0,"objective_suite_case_stretch_synthetic_partial_attendance_capacity_pressure_152p_weighted_contribution":0.9921686746987952,"objective_suite_external_validation_failures":0.0,"objective_suite_score_breakdown_mismatches":0.0,"objective_suite_total_final_score_raw":21707.0,"objective_suite_total_runtime_seconds":94.008310441,"objective_suite_total_score_mismatches":0.0,"objective_suite_weighted_normalized_score":100.59605019385181,"objective_suite_weighted_normalized_score_delta_from_reference":0.5960501938518048,"objective_suite_weighted_normalized_score_weight_sum":6.0,"path_allowed_sessions_iter_us":15.977925000000003,"path_avg_iter_us":11.58549,"path_clique_iter_us":17.0018,"path_construction_iter_us":15.195924999999999,"path_swap_iter_us":5.540775,"path_transfer_iter_us":4.211025,"rep_avg_iter_us":11.723991666666667,"rep_balanced_iter_us":11.533483333333333,"rep_balanced_score":3.0,"rep_constrained_iter_us":11.9145,"rep_constrained_score":4.0,"runtime_canonical_share_percent":99.54962161960846,"runtime_total_seconds":94.433619045,"solver3_raw_score_us":39.66247645833333,"swap_apply_us":0.801734375,"swap_preview_us":3.0664218749999996,"transfer_apply_us":0.848171875,"transfer_preview_us":2.9118749999999998},"status":"discard","description":"Final restart-family incubation attempt with much stricter trigger still regressed (100.60). It preserved attribute_balance/fixed-iteration but lost the sailing benefit and slowed hotpaths badly. Restart-based perturbation is retired for now; next experiments should pivot to a genuinely new neighborhood/move type.","timestamp":1775575500311,"segment":0,"confidence":17.983427287064874,"iterationTokens":11982,"asi":{"hypothesis":"A very strict stagnation-triggered incumbent restart might preserve already-good cases while still helping rare local-minimum cases","rollback_reason":"Primary 100.60 vs best 100.11. Sailing benefit disappeared while hotpath and runtime diagnostics degraded materially. Restart-family ROI is poor.","mechanism_family_signal":"After three variants, restart/perturbation does not look like the next best path for this lane. It can be revisited later, but should be deprioritized now.","next_action_hint":"Pivot to a true search-innovation experiment: implement a new compound move / neighborhood rather than more restart tuning."}}
