{"run":12,"commit":"295db0c","metric":115.64007163320498,"metrics":{"clique_apply_us":0.95375,"clique_preview_us":4.617479166666667,"correctness_suite_average_runtime_seconds":0.07918520875,"correctness_suite_case_count":4.0,"correctness_suite_external_validation_failures":0.0,"correctness_suite_total_runtime_seconds":0.316740835,"correctness_suite_total_score_mismatches":0.0,"hotpath_total_us":11.195479166666665,"objective_fixed_iteration_average_final_score_raw":3959.0,"objective_fixed_iteration_average_runtime_seconds":43.87138781233333,"objective_fixed_iteration_case_adversarial_clique_swap_functionality_35p_final_score":4756.0,"objective_fixed_iteration_case_adversarial_clique_swap_functionality_35p_normalized_score":1.0,"objective_fixed_iteration_case_adversarial_clique_swap_functionality_35p_reference_final_score":4756.0,"objective_fixed_iteration_case_adversarial_clique_swap_functionality_35p_weight":1.0,"objective_fixed_iteration_case_adversarial_clique_swap_functionality_35p_weighted_contribution":1.0,"objective_fixed_iteration_case_adversarial_transfer_attribute_balance_111p_final_score":196.0,"objective_fixed_iteration_case_adversarial_transfer_attribute_balance_111p_normalized_score":0.9607843137254902,"objective_fixed_iteration_case_adversarial_transfer_attribute_balance_111p_reference_final_score":204.0,"objective_fixed_iteration_case_adversarial_transfer_attribute_balance_111p_weight":1.0,"objective_fixed_iteration_case_adversarial_transfer_attribute_balance_111p_weighted_contribution":0.9607843137254902,"objective_fixed_iteration_case_count":6.0,"objective_fixed_iteration_case_stretch_large_gender_immovable_110p_final_score":2157.0,"objective_fixed_iteration_case_stretch_large_gender_immovable_110p_normalized_score":1.010304449648712,"objective_fixed_iteration_case_stretch_large_gender_immovable_110p_reference_final_score":2135.0,"objective_fixed_iteration_case_stretch_large_gender_immovable_110p_weight":1.0,"objective_fixed_iteration_case_stretch_large_gender_immovable_110p_weighted_contribution":1.010304449648712,"objective_fixed_iteration_case_stretch_sailing_trip_demo_real_final_score":4617.0,"objective_fixed_iteration_case_stretch_sailing_trip_demo_real_normalized_score":2.07972972972973,"objective_fixed_iteration_case_stretch_sailing_trip_demo_real_reference_final_score":2220.0,"objective_fixed_iteration_case_stretch_sailing_trip_demo_real_weight":1.0,"objective_fixed_iteration_case_stretch_sailing_trip_demo_real_weighted_contribution":2.07972972972973,"objective_fixed_iteration_case_stretch_social_golfer_32x8x10_final_score":5430.0,"objective_fixed_iteration_case_stretch_social_golfer_32x8x10_normalized_score":0.9885308574549426,"objective_fixed_iteration_case_stretch_social_golfer_32x8x10_reference_final_score":5493.0,"objective_fixed_iteration_case_stretch_social_golfer_32x8x10_weight":1.0,"objective_fixed_iteration_case_stretch_social_golfer_32x8x10_weighted_contribution":0.9885308574549426,"objective_fixed_iteration_case_stretch_synthetic_partial_attendance_capacity_pressure_152p_final_score":6598.0,"objective_fixed_iteration_case_stretch_synthetic_partial_attendance_capacity_pressure_152p_normalized_score":0.9965262045008307,"objective_fixed_iteration_case_stretch_synthetic_partial_attendance_capacity_pressure_152p_reference_final_score":6621.0,"objective_fixed_iteration_case_stretch_synthetic_partial_attendance_capacity_pressure_152p_weight":1.0,"objective_fixed_iteration_case_stretch_synthetic_partial_attendance_capacity_pressure_152p_weighted_contribution":0.9965262045008307,"objective_fixed_iteration_external_validation_failures":0.0,"objective_fixed_iteration_score_breakdown_mismatches":0.0,"objective_fixed_iteration_total_final_score_raw":23754.0,"objective_fixed_iteration_total_runtime_seconds":263.228326874,"objective_fixed_iteration_total_score_mismatches":0.0,"objective_fixed_iteration_weighted_normalized_score":117.26459258432843,"objective_fixed_iteration_weighted_normalized_score_delta_from_reference":17.26459258432842,"objective_fixed_iteration_weighted_normalized_score_weight_sum":6.0,"objective_suite_average_final_score_raw":3959.1666666666665,"objective_suite_average_runtime_seconds":15.308189833333333,"objective_suite_case_adversarial_clique_swap_functionality_35p_final_score":4756.0,"objective_suite_case_adversarial_clique_swap_functionality_35p_normalized_score":1.0,"objective_suite_case_adversarial_clique_swap_functionality_35p_reference_final_score":4756.0,"objective_suite_case_adversarial_clique_swap_functionality_35p_weight":1.0,"objective_suite_case_adversarial_clique_swap_functionality_35p_weighted_contribution":1.0,"objective_suite_case_adversarial_transfer_attribute_balance_111p_final_score":201.0,"objective_suite_case_adversarial_transfer_attribute_balance_111p_normalized_score":1.0151515151515151,"objective_suite_case_adversarial_transfer_attribute_balance_111p_reference_final_score":198.0,"objective_suite_case_adversarial_transfer_attribute_balance_111p_weight":1.0,"objective_suite_case_adversarial_transfer_attribute_balance_111p_weighted_contribution":1.0151515151515151,"objective_suite_case_count":6.0,"objective_suite_case_stretch_large_gender_immovable_110p_final_score":2168.0,"objective_suite_case_stretch_large_gender_immovable_110p_normalized_score":0.9949518127581459,"objective_suite_case_stretch_large_gender_immovable_110p_reference_final_score":2179.0,"objective_suite_case_stretch_large_gender_immovable_110p_weight":1.0,"objective_suite_case_stretch_large_gender_immovable_110p_weighted_contribution":0.9949518127581459,"objective_suite_case_stretch_sailing_trip_demo_real_final_score":4688.0,"objective_suite_case_stretch_sailing_trip_demo_real_normalized_score":1.9590472210614291,"objective_suite_case_stretch_sailing_trip_demo_real_reference_final_score":2393.0,"objective_suite_case_stretch_sailing_trip_demo_real_weight":1.0,"objective_suite_case_stretch_sailing_trip_demo_real_weighted_contribution":1.9590472210614291,"objective_suite_case_stretch_social_golfer_32x8x10_final_score":5430.0,"objective_suite_case_stretch_social_golfer_32x8x10_normalized_score":0.9885308574549426,"objective_suite_case_stretch_social_golfer_32x8x10_reference_final_score":5493.0,"objective_suite_case_stretch_social_golfer_32x8x10_weight":1.0,"objective_suite_case_stretch_social_golfer_32x8x10_weighted_contribution":0.9885308574549426,"objective_suite_case_stretch_synthetic_partial_attendance_capacity_pressure_152p_final_score":6512.0,"objective_suite_case_stretch_synthetic_partial_attendance_capacity_pressure_152p_normalized_score":0.980722891566265,"objective_suite_case_stretch_synthetic_partial_attendance_capacity_pressure_152p_reference_final_score":6640.0,"objective_suite_case_stretch_synthetic_partial_attendance_capacity_pressure_152p_weight":1.0,"objective_suite_case_stretch_synthetic_partial_attendance_capacity_pressure_152p_weighted_contribution":0.980722891566265,"objective_suite_external_validation_failures":0.0,"objective_suite_score_breakdown_mismatches":0.0,"objective_suite_total_final_score_raw":23755.0,"objective_suite_total_runtime_seconds":91.849139,"objective_suite_total_score_mismatches":0.0,"objective_suite_weighted_normalized_score":115.64007163320498,"objective_suite_weighted_normalized_score_delta_from_reference":15.640071633204977,"objective_suite_weighted_normalized_score_weight_sum":6.0,"path_allowed_sessions_iter_us":17.864625,"path_avg_iter_us":9.07501,"path_clique_iter_us":8.232249999999999,"path_construction_iter_us":9.397450000000001,"path_swap_iter_us":5.543125000000001,"path_transfer_iter_us":4.3376,"rep_avg_iter_us":48.06775792682927,"rep_balanced_iter_us":47.580149999999996,"rep_balanced_score":3.0,"rep_constrained_iter_us":48.55536585365854,"rep_constrained_score":4.0,"runtime_canonical_share_percent":99.65633612398965,"runtime_total_seconds":92.165879835,"solver3_raw_score_us":68.33824709349594,"swap_apply_us":0.8625,"swap_preview_us":2.434109375,"transfer_apply_us":0.816234375,"transfer_preview_us":1.51140625},"status":"discard","description":"Incubated the adaptive move-family bandit with a cost-aware UCB score that penalized expensive families by average family time. This variant catastrophically regressed the primary metric, largely by blowing up sailing, so this cost-aware bandit formulation is decisively not a keep.","timestamp":1775580100394,"segment":0,"confidence":9.183476871973934,"iterationTokens":6626,"asi":{"hypothesis":"A cost-aware UCB family selector would preserve the upside of adaptive move-family allocation while avoiding over-spending on expensive families such as clique previews.","rollback_reason":"Primary metric worsened dramatically to 115.6401 and sailing exploded to 1.9590, indicating that the cost-aware bandit pushed solver3 into a very bad search regime.","next_action_hint":"Retire this cost-aware UCB variant. If online family adaptation is revisited, use richer reward signals tied to best-score improvements or case-agnostic structural conflict reduction, not simple improving-accept counts with cost penalties.","observations":["The previous plain UCB family selector was mildly bad; adding cost awareness made the family much worse rather than better.","solver3_raw_score_us ballooned to 68.34 despite the intent to control cost.","The failure concentrated in sailing, suggesting the selector starved or mis-sequenced the move families that keep that landscape stable."],"mechanism_family":"online family selection / UCB bandit","bandit_variant":"cost-aware UCB over move families","exploration_constant":0.7}}
{"type":"config","name":"Solver3 fixed-time objective-quality autoresearch (x100 scale) [new-machine baseline reset]","metricName":"objective_suite_weighted_normalized_score","metricUnit":"","bestDirection":"lower"}
{"run":1,"commit":"dd9925c","metric":0,"metrics":{},"status":"crash","description":"Baseline reset attempt failed immediately because ./autoresearch.sh was not executable on this machine (exit 126: Permission denied).","timestamp":1775652781624,"segment":0,"confidence":null,"iterationTokens":138,"asi":{"hypothesis":"Establish a fresh solver3 objective-quality baseline on the new machine using the current kept record-to-record code.","rollback_reason":"Baseline run could not start because the entrypoint lacked execute permission on this machine.","next_action_hint":"Mark autoresearch.sh executable or invoke it via bash, then rerun the baseline so the new-machine noise floor is recorded.","error":"bash: line 1: ./autoresearch.sh: Permission denied"}}
{"run":2,"commit":"dd9925c","metric":0,"metrics":{},"status":"crash","description":"Baseline reset still failed: the root wrapper now ran, but its delegated tools/autoresearch/solver3-objective-quality/autoresearch.sh script is also non-executable on this machine.","timestamp":1775652815957,"segment":0,"confidence":null,"iterationTokens":1140,"asi":{"hypothesis":"Rerun the new-machine baseline via bash wrapper after fixing the top-level entrypoint assumption.","rollback_reason":"The delegated solver3 autoresearch wrapper inside tools/autoresearch/solver3-objective-quality/ also lacked execute permission, so the baseline still could not start.","next_action_hint":"Repair execute permissions for the nested autoresearch wrapper (or invoke the nested script via bash as well), then rerun the baseline.","error":"./autoresearch.sh: line 4: /home/qido/repositories/GroupMixer/tools/autoresearch/solver3-objective-quality/autoresearch.sh: Permission denied"}}
{"run":3,"commit":"dd9925c","metric":102.06579338872064,"metrics":{},"status":"checks_failed","description":"New-machine baseline run completed and produced valid metrics, but the run must be discarded because autoresearch.checks.sh delegated into a non-executable tools/autoresearch/solver3-objective-quality/autoresearch.checks.sh wrapper on this machine.","timestamp":1775653371478,"segment":0,"confidence":null,"iterationTokens":4523,"asi":{"hypothesis":"Record a fresh current-code baseline on the new machine before continuing solver3 search experiments.","rollback_reason":"The benchmark itself passed, but the required post-run checks could not execute because the delegated checks wrapper lacked execute permission on this machine.","next_action_hint":"Mark both autoresearch checks wrappers executable, rerun the same baseline, then start new search experiments from that clean new-machine segment.","machine_reset":"User explicitly requested a new baseline because this machine differs from the previous setup.","observations":["The current kept record-to-record solver landed at objective_suite_weighted_normalized_score=102.06579338872064 on this machine.","This is materially slower than the previous machine: solver3_raw_score_us=79.59, with path and representative diagnostics also higher.","Quality shape stayed plausible: sailing and social_golfer beat reference, while attribute_balance, large_gender, and synthetic regressed."]}}
