{"run":35,"commit":"903743d","metric":102.24051033109325,"metrics":{"clique_apply_us":2.892354166666667,"clique_preview_us":13.245375000000001,"correctness_suite_average_runtime_seconds":0.19363265149999997,"correctness_suite_case_count":4.0,"correctness_suite_external_validation_failures":0.0,"correctness_suite_total_runtime_seconds":0.7745306059999999,"correctness_suite_total_score_mismatches":0.0,"hotpath_total_us":31.29255729166667,"objective_fixed_iteration_average_final_score_raw":3605.6666666666665,"objective_fixed_iteration_average_runtime_seconds":51.46050835533333,"objective_fixed_iteration_case_adversarial_clique_swap_functionality_35p_final_score":4765.0,"objective_fixed_iteration_case_adversarial_clique_swap_functionality_35p_normalized_score":1.001892346509672,"objective_fixed_iteration_case_adversarial_clique_swap_functionality_35p_reference_final_score":4756.0,"objective_fixed_iteration_case_adversarial_clique_swap_functionality_35p_weight":1.0,"objective_fixed_iteration_case_adversarial_clique_swap_functionality_35p_weighted_contribution":1.001892346509672,"objective_fixed_iteration_case_adversarial_transfer_attribute_balance_111p_final_score":201.0,"objective_fixed_iteration_case_adversarial_transfer_attribute_balance_111p_normalized_score":0.9852941176470589,"objective_fixed_iteration_case_adversarial_transfer_attribute_balance_111p_reference_final_score":204.0,"objective_fixed_iteration_case_adversarial_transfer_attribute_balance_111p_weight":1.0,"objective_fixed_iteration_case_adversarial_transfer_attribute_balance_111p_weighted_contribution":0.9852941176470589,"objective_fixed_iteration_case_count":6.0,"objective_fixed_iteration_case_stretch_large_gender_immovable_110p_final_score":2168.0,"objective_fixed_iteration_case_stretch_large_gender_immovable_110p_normalized_score":1.015456674473068,"objective_fixed_iteration_case_stretch_large_gender_immovable_110p_reference_final_score":2135.0,"objective_fixed_iteration_case_stretch_large_gender_immovable_110p_weight":1.0,"objective_fixed_iteration_case_stretch_large_gender_immovable_110p_weighted_contribution":1.015456674473068,"objective_fixed_iteration_case_stretch_sailing_trip_demo_real_final_score":2308.0,"objective_fixed_iteration_case_stretch_sailing_trip_demo_real_normalized_score":1.0396396396396397,"objective_fixed_iteration_case_stretch_sailing_trip_demo_real_reference_final_score":2220.0,"objective_fixed_iteration_case_stretch_sailing_trip_demo_real_weight":1.0,"objective_fixed_iteration_case_stretch_sailing_trip_demo_real_weighted_contribution":1.0396396396396397,"objective_fixed_iteration_case_stretch_social_golfer_32x8x10_final_score":5451.0,"objective_fixed_iteration_case_stretch_social_golfer_32x8x10_normalized_score":0.9923539049699618,"objective_fixed_iteration_case_stretch_social_golfer_32x8x10_reference_final_score":5493.0,"objective_fixed_iteration_case_stretch_social_golfer_32x8x10_weight":1.0,"objective_fixed_iteration_case_stretch_social_golfer_32x8x10_weighted_contribution":0.9923539049699618,"objective_fixed_iteration_case_stretch_synthetic_partial_attendance_capacity_pressure_152p_final_score":6741.0,"objective_fixed_iteration_case_stretch_synthetic_partial_attendance_capacity_pressure_152p_normalized_score":1.0181241504304486,"objective_fixed_iteration_case_stretch_synthetic_partial_attendance_capacity_pressure_152p_reference_final_score":6621.0,"objective_fixed_iteration_case_stretch_synthetic_partial_attendance_capacity_pressure_152p_weight":1.0,"objective_fixed_iteration_case_stretch_synthetic_partial_attendance_capacity_pressure_152p_weighted_contribution":1.0181241504304486,"objective_fixed_iteration_external_validation_failures":0.0,"objective_fixed_iteration_score_breakdown_mismatches":0.0,"objective_fixed_iteration_total_final_score_raw":21634.0,"objective_fixed_iteration_total_runtime_seconds":308.763050132,"objective_fixed_iteration_total_score_mismatches":0.0,"objective_fixed_iteration_weighted_normalized_score":100.8793472278308,"objective_fixed_iteration_weighted_normalized_score_delta_from_reference":0.8793472278308068,"objective_fixed_iteration_weighted_normalized_score_weight_sum":6.0,"objective_suite_average_final_score_raw":3643.3333333333335,"objective_suite_average_runtime_seconds":15.668403403166666,"objective_suite_case_adversarial_clique_swap_functionality_35p_final_score":4765.0,"objective_suite_case_adversarial_clique_swap_functionality_35p_normalized_score":1.001892346509672,"objective_suite_case_adversarial_clique_swap_functionality_35p_reference_final_score":4756.0,"objective_suite_case_adversarial_clique_swap_functionality_35p_weight":1.0,"objective_suite_case_adversarial_clique_swap_functionality_35p_weighted_contribution":1.001892346509672,"objective_suite_case_adversarial_transfer_attribute_balance_111p_final_score":213.0,"objective_suite_case_adversarial_transfer_attribute_balance_111p_normalized_score":1.0757575757575757,"objective_suite_case_adversarial_transfer_attribute_balance_111p_reference_final_score":198.0,"objective_suite_case_adversarial_transfer_attribute_balance_111p_weight":1.0,"objective_suite_case_adversarial_transfer_attribute_balance_111p_weighted_contribution":1.0757575757575757,"objective_suite_case_count":6.0,"objective_suite_case_stretch_large_gender_immovable_110p_final_score":2333.0,"objective_suite_case_stretch_large_gender_immovable_110p_normalized_score":1.0706746213859568,"objective_suite_case_stretch_large_gender_immovable_110p_reference_final_score":2179.0,"objective_suite_case_stretch_large_gender_immovable_110p_weight":1.0,"objective_suite_case_stretch_large_gender_immovable_110p_weighted_contribution":1.0706746213859568,"objective_suite_case_stretch_sailing_trip_demo_real_final_score":2333.0,"objective_suite_case_stretch_sailing_trip_demo_real_normalized_score":0.9749268700376097,"objective_suite_case_stretch_sailing_trip_demo_real_reference_final_score":2393.0,"objective_suite_case_stretch_sailing_trip_demo_real_weight":1.0,"objective_suite_case_stretch_sailing_trip_demo_real_weighted_contribution":0.9749268700376097,"objective_suite_case_stretch_social_golfer_32x8x10_final_score":5451.0,"objective_suite_case_stretch_social_golfer_32x8x10_normalized_score":0.9923539049699618,"objective_suite_case_stretch_social_golfer_32x8x10_reference_final_score":5493.0,"objective_suite_case_stretch_social_golfer_32x8x10_weight":1.0,"objective_suite_case_stretch_social_golfer_32x8x10_weighted_contribution":0.9923539049699618,"objective_suite_case_stretch_synthetic_partial_attendance_capacity_pressure_152p_final_score":6765.0,"objective_suite_case_stretch_synthetic_partial_attendance_capacity_pressure_152p_normalized_score":1.0188253012048192,"objective_suite_case_stretch_synthetic_partial_attendance_capacity_pressure_152p_reference_final_score":6640.0,"objective_suite_case_stretch_synthetic_partial_attendance_capacity_pressure_152p_weight":1.0,"objective_suite_case_stretch_synthetic_partial_attendance_capacity_pressure_152p_weighted_contribution":1.0188253012048192,"objective_suite_external_validation_failures":0.0,"objective_suite_score_breakdown_mismatches":0.0,"objective_suite_total_final_score_raw":21860.0,"objective_suite_total_runtime_seconds":94.010420419,"objective_suite_total_score_mismatches":0.0,"objective_suite_weighted_normalized_score":102.24051033109325,"objective_suite_weighted_normalized_score_delta_from_reference":2.2405103310932484,"objective_suite_weighted_normalized_score_weight_sum":6.0,"path_allowed_sessions_iter_us":24.89675,"path_avg_iter_us":16.88806,"path_clique_iter_us":17.6477,"path_construction_iter_us":22.1875,"path_swap_iter_us":11.35325,"path_transfer_iter_us":8.3551,"rep_avg_iter_us":38.46616574074074,"rep_balanced_iter_us":45.35001666666666,"rep_balanced_score":3.0,"rep_constrained_iter_us":31.58231481481482,"rep_constrained_score":4.0,"runtime_canonical_share_percent":99.18285487556383,"runtime_total_seconds":94.784951025,"solver3_raw_score_us":86.64678303240741,"swap_apply_us":2.365453125,"swap_preview_us":6.594625000000001,"transfer_apply_us":2.310765625,"transfer_preview_us":3.8839843750000003},"status":"discard","description":"Two-stage donor scouting memetic follow-up: expanded the burst into a donor portfolio that briefly polished four scout donors, ranked them by exact best-offspring potential, then spent the remaining donor budget polishing only the top two before normal exact session-transplant evaluation. This benchmark-honest elite-scout donor strategy was clearly worse, especially on transfer-balance, so donor budget fragmentation inside the memetic burst did not improve donor quality.","timestamp":1775675808270,"segment":0,"confidence":613.0785260891548,"iterationTokens":16826,"asi":{"hypothesis":"A scout-then-intensify donor portfolio can find better memetic donors than two fixed diversified seeds without paying the full cost of naive multi-start across the whole run.","rollback_reason":"Primary regressed badly to 102.2405 and worsened runtime diagnostics, so this donor-scout portfolio is not competitive.","next_action_hint":"Record this as a materially tried donor-portfolio variant and stop spending turns on donor-budget fragmentation inside the current memetic burst; the next idea should be a different mechanism family or a fundamentally different donor source.","mechanism_family":"two-stage donor scouting memetic search","observed_case_pattern":{"transfer_balance":"1.0758","large_gender":"1.0707","sailing":"0.9749","social_golfer":"0.9924","synthetic":"1.0188"},"learning":"Even a benchmark-honest scout-then-intensify donor portfolio behaves like harmful budget fragmentation here; better donor selection does not emerge from this light portfolio approach."}}
{"run":36,"commit":"903743d","metric":101.63098845119944,"metrics":{"clique_apply_us":2.836041666666667,"clique_preview_us":12.935583333333334,"correctness_suite_average_runtime_seconds":0.18005817675,"correctness_suite_case_count":4.0,"correctness_suite_external_validation_failures":0.0,"correctness_suite_total_runtime_seconds":0.720232707,"correctness_suite_total_score_mismatches":0.0,"hotpath_total_us":30.749359375,"objective_fixed_iteration_average_final_score_raw":3604.5,"objective_fixed_iteration_average_runtime_seconds":50.888394826,"objective_fixed_iteration_case_adversarial_clique_swap_functionality_35p_final_score":4765.0,"objective_fixed_iteration_case_adversarial_clique_swap_functionality_35p_normalized_score":1.001892346509672,"objective_fixed_iteration_case_adversarial_clique_swap_functionality_35p_reference_final_score":4756.0,"objective_fixed_iteration_case_adversarial_clique_swap_functionality_35p_weight":1.0,"objective_fixed_iteration_case_adversarial_clique_swap_functionality_35p_weighted_contribution":1.001892346509672,"objective_fixed_iteration_case_adversarial_transfer_attribute_balance_111p_final_score":207.0,"objective_fixed_iteration_case_adversarial_transfer_attribute_balance_111p_normalized_score":1.0147058823529411,"objective_fixed_iteration_case_adversarial_transfer_attribute_balance_111p_reference_final_score":204.0,"objective_fixed_iteration_case_adversarial_transfer_attribute_balance_111p_weight":1.0,"objective_fixed_iteration_case_adversarial_transfer_attribute_balance_111p_weighted_contribution":1.0147058823529411,"objective_fixed_iteration_case_count":6.0,"objective_fixed_iteration_case_stretch_large_gender_immovable_110p_final_score":2157.0,"objective_fixed_iteration_case_stretch_large_gender_immovable_110p_normalized_score":1.010304449648712,"objective_fixed_iteration_case_stretch_large_gender_immovable_110p_reference_final_score":2135.0,"objective_fixed_iteration_case_stretch_large_gender_immovable_110p_weight":1.0,"objective_fixed_iteration_case_stretch_large_gender_immovable_110p_weighted_contribution":1.010304449648712,"objective_fixed_iteration_case_stretch_sailing_trip_demo_real_final_score":2306.0,"objective_fixed_iteration_case_stretch_sailing_trip_demo_real_normalized_score":1.0387387387387388,"objective_fixed_iteration_case_stretch_sailing_trip_demo_real_reference_final_score":2220.0,"objective_fixed_iteration_case_stretch_sailing_trip_demo_real_weight":1.0,"objective_fixed_iteration_case_stretch_sailing_trip_demo_real_weighted_contribution":1.0387387387387388,"objective_fixed_iteration_case_stretch_social_golfer_32x8x10_final_score":5451.0,"objective_fixed_iteration_case_stretch_social_golfer_32x8x10_normalized_score":0.9923539049699618,"objective_fixed_iteration_case_stretch_social_golfer_32x8x10_reference_final_score":5493.0,"objective_fixed_iteration_case_stretch_social_golfer_32x8x10_weight":1.0,"objective_fixed_iteration_case_stretch_social_golfer_32x8x10_weighted_contribution":0.9923539049699618,"objective_fixed_iteration_case_stretch_synthetic_partial_attendance_capacity_pressure_152p_final_score":6741.0,"objective_fixed_iteration_case_stretch_synthetic_partial_attendance_capacity_pressure_152p_normalized_score":1.0181241504304486,"objective_fixed_iteration_case_stretch_synthetic_partial_attendance_capacity_pressure_152p_reference_final_score":6621.0,"objective_fixed_iteration_case_stretch_synthetic_partial_attendance_capacity_pressure_152p_weight":1.0,"objective_fixed_iteration_case_stretch_synthetic_partial_attendance_capacity_pressure_152p_weighted_contribution":1.0181241504304486,"objective_fixed_iteration_external_validation_failures":0.0,"objective_fixed_iteration_score_breakdown_mismatches":0.0,"objective_fixed_iteration_total_final_score_raw":21627.0,"objective_fixed_iteration_total_runtime_seconds":305.33036895600003,"objective_fixed_iteration_total_score_mismatches":0.0,"objective_fixed_iteration_weighted_normalized_score":101.26865787750792,"objective_fixed_iteration_weighted_normalized_score_delta_from_reference":1.2686578775079171,"objective_fixed_iteration_weighted_normalized_score_weight_sum":6.0,"objective_suite_average_final_score_raw":3639.8333333333335,"objective_suite_average_runtime_seconds":15.668806062333333,"objective_suite_case_adversarial_clique_swap_functionality_35p_final_score":4765.0,"objective_suite_case_adversarial_clique_swap_functionality_35p_normalized_score":1.001892346509672,"objective_suite_case_adversarial_clique_swap_functionality_35p_reference_final_score":4756.0,"objective_suite_case_adversarial_clique_swap_functionality_35p_weight":1.0,"objective_suite_case_adversarial_clique_swap_functionality_35p_weighted_contribution":1.001892346509672,"objective_suite_case_adversarial_transfer_attribute_balance_111p_final_score":207.0,"objective_suite_case_adversarial_transfer_attribute_balance_111p_normalized_score":1.0454545454545454,"objective_suite_case_adversarial_transfer_attribute_balance_111p_reference_final_score":198.0,"objective_suite_case_adversarial_transfer_attribute_balance_111p_weight":1.0,"objective_suite_case_adversarial_transfer_attribute_balance_111p_weighted_contribution":1.0454545454545454,"objective_suite_case_count":6.0,"objective_suite_case_stretch_large_gender_immovable_110p_final_score":2333.0,"objective_suite_case_stretch_large_gender_immovable_110p_normalized_score":1.0706746213859568,"objective_suite_case_stretch_large_gender_immovable_110p_reference_final_score":2179.0,"objective_suite_case_stretch_large_gender_immovable_110p_weight":1.0,"objective_suite_case_stretch_large_gender_immovable_110p_weighted_contribution":1.0706746213859568,"objective_suite_case_stretch_sailing_trip_demo_real_final_score":2318.0,"objective_suite_case_stretch_sailing_trip_demo_real_normalized_score":0.9686585875470122,"objective_suite_case_stretch_sailing_trip_demo_real_reference_final_score":2393.0,"objective_suite_case_stretch_sailing_trip_demo_real_weight":1.0,"objective_suite_case_stretch_sailing_trip_demo_real_weighted_contribution":0.9686585875470122,"objective_suite_case_stretch_social_golfer_32x8x10_final_score":5451.0,"objective_suite_case_stretch_social_golfer_32x8x10_normalized_score":0.9923539049699618,"objective_suite_case_stretch_social_golfer_32x8x10_reference_final_score":5493.0,"objective_suite_case_stretch_social_golfer_32x8x10_weight":1.0,"objective_suite_case_stretch_social_golfer_32x8x10_weighted_contribution":0.9923539049699618,"objective_suite_case_stretch_synthetic_partial_attendance_capacity_pressure_152p_final_score":6765.0,"objective_suite_case_stretch_synthetic_partial_attendance_capacity_pressure_152p_normalized_score":1.0188253012048192,"objective_suite_case_stretch_synthetic_partial_attendance_capacity_pressure_152p_reference_final_score":6640.0,"objective_suite_case_stretch_synthetic_partial_attendance_capacity_pressure_152p_weight":1.0,"objective_suite_case_stretch_synthetic_partial_attendance_capacity_pressure_152p_weighted_contribution":1.0188253012048192,"objective_suite_external_validation_failures":0.0,"objective_suite_score_breakdown_mismatches":0.0,"objective_suite_total_final_score_raw":21839.0,"objective_suite_total_runtime_seconds":94.012836374,"objective_suite_total_score_mismatches":0.0,"objective_suite_weighted_normalized_score":101.63098845119944,"objective_suite_weighted_normalized_score_delta_from_reference":1.6309884511994444,"objective_suite_weighted_normalized_score_weight_sum":6.0,"path_allowed_sessions_iter_us":26.329175000000003,"path_avg_iter_us":17.73973,"path_clique_iter_us":18.5676,"path_construction_iter_us":22.719,"path_swap_iter_us":12.357875000000002,"path_transfer_iter_us":8.725,"rep_avg_iter_us":31.15776203703704,"rep_balanced_iter_us":29.53395,"rep_balanced_score":3.0,"rep_constrained_iter_us":32.78157407407407,"rep_constrained_score":4.0,"runtime_canonical_share_percent":99.23972408580559,"runtime_total_seconds":94.733069081,"solver3_raw_score_us":79.64685141203705,"swap_apply_us":2.359375,"swap_preview_us":6.4762812499999995,"transfer_apply_us":2.2991875,"transfer_preview_us":3.8428906250000003},"status":"discard","description":"Session-global exact person-reassignment repair: added a stagnation-triggered restricted exact repair that picked the highest attribute-pressure session, selected up to four movable non-clique people contributing surplus attribute mass, enumerated compact cross-group reassignment combinations, and accepted the best exact-oracle-improving repair before the memetic burst. This was a stronger cross-group exact repair than the old two-group kernel and less catastrophic than the block-transfer burst, but it still failed to improve the chronic transfer/large-gender/synthetic blockers enough to challenge the incumbent.","timestamp":1775676572547,"segment":0,"confidence":577.4531177643339,"iterationTokens":18695,"asi":{"hypothesis":"A stronger restricted exact repair over a small set of imbalance-causing people, with reassignment freedom across the whole session rather than just one group-pair, can address the large_gender/transfer-balance weakness more directly than earlier local repair attempts.","rollback_reason":"Primary remained materially above the current incumbent (101.6310 vs 100.8462), so this exact person-reassignment repair is not competitive in its first form.","next_action_hint":"Record this as a materially tried stronger ALNS/LNS repair variant; if repair is revisited later, expand destroy selection or allow richer swap/cycle structure rather than only direct reassignment of a few imbalance-contributing singles.","mechanism_family":"session-global exact person-reassignment repair","observed_case_pattern":{"transfer_balance":"1.0455","large_gender":"1.0707","sailing":"0.9687","social_golfer":"0.9924","synthetic":"1.0188"},"learning":"Widening the exact repair from one group-pair to a small whole-session reassignment set was directionally more meaningful than the tiny kernel, but direct reassignment alone still cannot overcome the chronic objective blockers."}}
{"type":"config","name":"Solver3 feature-complete metaheuristic quality","metricName":"metaheuristic_suite_weighted_normalized_score","metricUnit":"","bestDirection":"lower"}
