{"run":17,"commit":"903743d","metric":101.22411980725816,"metrics":{"clique_apply_us":2.7353541666666668,"clique_preview_us":12.848416666666667,"correctness_suite_average_runtime_seconds":0.19167912574999998,"correctness_suite_case_count":4.0,"correctness_suite_external_validation_failures":0.0,"correctness_suite_total_runtime_seconds":0.7667165029999999,"correctness_suite_total_score_mismatches":0.0,"hotpath_total_us":54.076942708333334,"objective_fixed_iteration_average_final_score_raw":3603.3333333333335,"objective_fixed_iteration_average_runtime_seconds":50.78112337,"objective_fixed_iteration_case_adversarial_clique_swap_functionality_35p_final_score":4765.0,"objective_fixed_iteration_case_adversarial_clique_swap_functionality_35p_normalized_score":1.001892346509672,"objective_fixed_iteration_case_adversarial_clique_swap_functionality_35p_reference_final_score":4756.0,"objective_fixed_iteration_case_adversarial_clique_swap_functionality_35p_weight":1.0,"objective_fixed_iteration_case_adversarial_clique_swap_functionality_35p_weighted_contribution":1.001892346509672,"objective_fixed_iteration_case_adversarial_transfer_attribute_balance_111p_final_score":206.0,"objective_fixed_iteration_case_adversarial_transfer_attribute_balance_111p_normalized_score":1.0098039215686274,"objective_fixed_iteration_case_adversarial_transfer_attribute_balance_111p_reference_final_score":204.0,"objective_fixed_iteration_case_adversarial_transfer_attribute_balance_111p_weight":1.0,"objective_fixed_iteration_case_adversarial_transfer_attribute_balance_111p_weighted_contribution":1.0098039215686274,"objective_fixed_iteration_case_count":6.0,"objective_fixed_iteration_case_stretch_large_gender_immovable_110p_final_score":2157.0,"objective_fixed_iteration_case_stretch_large_gender_immovable_110p_normalized_score":1.010304449648712,"objective_fixed_iteration_case_stretch_large_gender_immovable_110p_reference_final_score":2135.0,"objective_fixed_iteration_case_stretch_large_gender_immovable_110p_weight":1.0,"objective_fixed_iteration_case_stretch_large_gender_immovable_110p_weighted_contribution":1.010304449648712,"objective_fixed_iteration_case_stretch_sailing_trip_demo_real_final_score":2300.0,"objective_fixed_iteration_case_stretch_sailing_trip_demo_real_normalized_score":1.0360360360360361,"objective_fixed_iteration_case_stretch_sailing_trip_demo_real_reference_final_score":2220.0,"objective_fixed_iteration_case_stretch_sailing_trip_demo_real_weight":1.0,"objective_fixed_iteration_case_stretch_sailing_trip_demo_real_weighted_contribution":1.0360360360360361,"objective_fixed_iteration_case_stretch_social_golfer_32x8x10_final_score":5451.0,"objective_fixed_iteration_case_stretch_social_golfer_32x8x10_normalized_score":0.9923539049699618,"objective_fixed_iteration_case_stretch_social_golfer_32x8x10_reference_final_score":5493.0,"objective_fixed_iteration_case_stretch_social_golfer_32x8x10_weight":1.0,"objective_fixed_iteration_case_stretch_social_golfer_32x8x10_weighted_contribution":0.9923539049699618,"objective_fixed_iteration_case_stretch_synthetic_partial_attendance_capacity_pressure_152p_final_score":6741.0,"objective_fixed_iteration_case_stretch_synthetic_partial_attendance_capacity_pressure_152p_normalized_score":1.0181241504304486,"objective_fixed_iteration_case_stretch_synthetic_partial_attendance_capacity_pressure_152p_reference_final_score":6621.0,"objective_fixed_iteration_case_stretch_synthetic_partial_attendance_capacity_pressure_152p_weight":1.0,"objective_fixed_iteration_case_stretch_synthetic_partial_attendance_capacity_pressure_152p_weighted_contribution":1.0181241504304486,"objective_fixed_iteration_external_validation_failures":0.0,"objective_fixed_iteration_score_breakdown_mismatches":0.0,"objective_fixed_iteration_total_final_score_raw":21620.0,"objective_fixed_iteration_total_runtime_seconds":304.68674022,"objective_fixed_iteration_total_score_mismatches":0.0,"objective_fixed_iteration_weighted_normalized_score":101.14191348605763,"objective_fixed_iteration_weighted_normalized_score_delta_from_reference":1.141913486057633,"objective_fixed_iteration_weighted_normalized_score_weight_sum":6.0,"objective_suite_average_final_score_raw":3636.0,"objective_suite_average_runtime_seconds":15.667743743333332,"objective_suite_case_adversarial_clique_swap_functionality_35p_final_score":4765.0,"objective_suite_case_adversarial_clique_swap_functionality_35p_normalized_score":1.001892346509672,"objective_suite_case_adversarial_clique_swap_functionality_35p_reference_final_score":4756.0,"objective_suite_case_adversarial_clique_swap_functionality_35p_weight":1.0,"objective_suite_case_adversarial_clique_swap_functionality_35p_weighted_contribution":1.001892346509672,"objective_suite_case_adversarial_transfer_attribute_balance_111p_final_score":204.0,"objective_suite_case_adversarial_transfer_attribute_balance_111p_normalized_score":1.0303030303030303,"objective_suite_case_adversarial_transfer_attribute_balance_111p_reference_final_score":198.0,"objective_suite_case_adversarial_transfer_attribute_balance_111p_weight":1.0,"objective_suite_case_adversarial_transfer_attribute_balance_111p_weighted_contribution":1.0303030303030303,"objective_suite_case_count":6.0,"objective_suite_case_stretch_large_gender_immovable_110p_final_score":2311.0,"objective_suite_case_stretch_large_gender_immovable_110p_normalized_score":1.0605782469022487,"objective_suite_case_stretch_large_gender_immovable_110p_reference_final_score":2179.0,"objective_suite_case_stretch_large_gender_immovable_110p_weight":1.0,"objective_suite_case_stretch_large_gender_immovable_110p_weighted_contribution":1.0605782469022487,"objective_suite_case_stretch_sailing_trip_demo_real_final_score":2320.0,"objective_suite_case_stretch_sailing_trip_demo_real_normalized_score":0.9694943585457585,"objective_suite_case_stretch_sailing_trip_demo_real_reference_final_score":2393.0,"objective_suite_case_stretch_sailing_trip_demo_real_weight":1.0,"objective_suite_case_stretch_sailing_trip_demo_real_weighted_contribution":0.9694943585457585,"objective_suite_case_stretch_social_golfer_32x8x10_final_score":5451.0,"objective_suite_case_stretch_social_golfer_32x8x10_normalized_score":0.9923539049699618,"objective_suite_case_stretch_social_golfer_32x8x10_reference_final_score":5493.0,"objective_suite_case_stretch_social_golfer_32x8x10_weight":1.0,"objective_suite_case_stretch_social_golfer_32x8x10_weighted_contribution":0.9923539049699618,"objective_suite_case_stretch_synthetic_partial_attendance_capacity_pressure_152p_final_score":6765.0,"objective_suite_case_stretch_synthetic_partial_attendance_capacity_pressure_152p_normalized_score":1.0188253012048192,"objective_suite_case_stretch_synthetic_partial_attendance_capacity_pressure_152p_reference_final_score":6640.0,"objective_suite_case_stretch_synthetic_partial_attendance_capacity_pressure_152p_weight":1.0,"objective_suite_case_stretch_synthetic_partial_attendance_capacity_pressure_152p_weighted_contribution":1.0188253012048192,"objective_suite_external_validation_failures":0.0,"objective_suite_score_breakdown_mismatches":0.0,"objective_suite_total_final_score_raw":21816.0,"objective_suite_total_runtime_seconds":94.00646246,"objective_suite_total_score_mismatches":0.0,"objective_suite_weighted_normalized_score":101.22411980725816,"objective_suite_weighted_normalized_score_delta_from_reference":1.2241198072581616,"objective_suite_weighted_normalized_score_weight_sum":6.0,"path_allowed_sessions_iter_us":24.944075,"path_avg_iter_us":16.85006,"path_clique_iter_us":18.5047,"path_construction_iter_us":21.05515,"path_swap_iter_us":11.431524999999999,"path_transfer_iter_us":8.31485,"rep_avg_iter_us":30.26349722222222,"rep_balanced_iter_us":28.74638333333333,"rep_balanced_score":3.0,"rep_constrained_iter_us":31.78061111111111,"rep_constrained_score":4.0,"runtime_canonical_share_percent":99.19099843290121,"runtime_total_seconds":94.773178963,"solver3_raw_score_us":101.19049993055556,"swap_apply_us":2.3211874999999997,"swap_preview_us":29.98446875,"transfer_apply_us":2.2531874999999997,"transfer_preview_us":3.934328125},"status":"discard","description":"Memetic stability follow-up: ranked each donor by the average of its top two exact-rescored one-session offspring scores, then chose the best session from the most robust-looking donor instead of taking the globally luckiest single donor-session offspring. This did not beat the current keep, landing at 101.2241, so the simple top-two donor-robustness heuristic did not stabilize the noisy two-donor burst.","timestamp":1775662736410,"segment":0,"confidence":414.67388999121164,"iterationTokens":30662,"asi":{"hypothesis":"Two-donor memetic search will stabilize if donor choice rewards robustness across multiple strong session transplants rather than one lucky best session.","rollback_reason":"The donor-robustness ranking regressed relative to the current keep and offered no new primary improvement.","next_action_hint":"Retain the current best two-donor memetic keep; if memetic incubation continues, prefer compatibility features tied to structure or case pressure rather than generic top-two donor averaging.","mechanism_family":"memetic / multi-donor exact-rescored one-session offspring","failure_shape":{"current_keep":"100.84622890492095","robust_donor_followup":"101.22411980725816","attribute_balance_normalized":"1.0303030303030303","large_gender_normalized":"1.0605782469022487","sailing_normalized":"0.9694943585457585"}}}
{"run":18,"commit":"903743d","metric":101.12367062462798,"metrics":{"clique_apply_us":2.8468333333333335,"clique_preview_us":13.037854166666667,"correctness_suite_average_runtime_seconds":0.18222616325000002,"correctness_suite_case_count":4.0,"correctness_suite_external_validation_failures":0.0,"correctness_suite_total_runtime_seconds":0.7289046530000001,"correctness_suite_total_score_mismatches":0.0,"hotpath_total_us":31.418015625,"objective_fixed_iteration_average_final_score_raw":3589.3333333333335,"objective_fixed_iteration_average_runtime_seconds":50.913795486333335,"objective_fixed_iteration_case_adversarial_clique_swap_functionality_35p_final_score":4765.0,"objective_fixed_iteration_case_adversarial_clique_swap_functionality_35p_normalized_score":1.001892346509672,"objective_fixed_iteration_case_adversarial_clique_swap_functionality_35p_reference_final_score":4756.0,"objective_fixed_iteration_case_adversarial_clique_swap_functionality_35p_weight":1.0,"objective_fixed_iteration_case_adversarial_clique_swap_functionality_35p_weighted_contribution":1.001892346509672,"objective_fixed_iteration_case_adversarial_transfer_attribute_balance_111p_final_score":200.0,"objective_fixed_iteration_case_adversarial_transfer_attribute_balance_111p_normalized_score":0.9803921568627451,"objective_fixed_iteration_case_adversarial_transfer_attribute_balance_111p_reference_final_score":204.0,"objective_fixed_iteration_case_adversarial_transfer_attribute_balance_111p_weight":1.0,"objective_fixed_iteration_case_adversarial_transfer_attribute_balance_111p_weighted_contribution":0.9803921568627451,"objective_fixed_iteration_case_count":6.0,"objective_fixed_iteration_case_stretch_large_gender_immovable_110p_final_score":2157.0,"objective_fixed_iteration_case_stretch_large_gender_immovable_110p_normalized_score":1.010304449648712,"objective_fixed_iteration_case_stretch_large_gender_immovable_110p_reference_final_score":2135.0,"objective_fixed_iteration_case_stretch_large_gender_immovable_110p_weight":1.0,"objective_fixed_iteration_case_stretch_large_gender_immovable_110p_weighted_contribution":1.010304449648712,"objective_fixed_iteration_case_stretch_sailing_trip_demo_real_final_score":2306.0,"objective_fixed_iteration_case_stretch_sailing_trip_demo_real_normalized_score":1.0387387387387388,"objective_fixed_iteration_case_stretch_sailing_trip_demo_real_reference_final_score":2220.0,"objective_fixed_iteration_case_stretch_sailing_trip_demo_real_weight":1.0,"objective_fixed_iteration_case_stretch_sailing_trip_demo_real_weighted_contribution":1.0387387387387388,"objective_fixed_iteration_case_stretch_social_golfer_32x8x10_final_score":5367.0,"objective_fixed_iteration_case_stretch_social_golfer_32x8x10_normalized_score":0.9770617149098854,"objective_fixed_iteration_case_stretch_social_golfer_32x8x10_reference_final_score":5493.0,"objective_fixed_iteration_case_stretch_social_golfer_32x8x10_weight":1.0,"objective_fixed_iteration_case_stretch_social_golfer_32x8x10_weighted_contribution":0.9770617149098854,"objective_fixed_iteration_case_stretch_synthetic_partial_attendance_capacity_pressure_152p_final_score":6741.0,"objective_fixed_iteration_case_stretch_synthetic_partial_attendance_capacity_pressure_152p_normalized_score":1.0181241504304486,"objective_fixed_iteration_case_stretch_synthetic_partial_attendance_capacity_pressure_152p_reference_final_score":6621.0,"objective_fixed_iteration_case_stretch_synthetic_partial_attendance_capacity_pressure_152p_weight":1.0,"objective_fixed_iteration_case_stretch_synthetic_partial_attendance_capacity_pressure_152p_weighted_contribution":1.0181241504304486,"objective_fixed_iteration_external_validation_failures":0.0,"objective_fixed_iteration_score_breakdown_mismatches":0.0,"objective_fixed_iteration_total_final_score_raw":21536.0,"objective_fixed_iteration_total_runtime_seconds":305.482772918,"objective_fixed_iteration_total_score_mismatches":0.0,"objective_fixed_iteration_weighted_normalized_score":100.4418926183367,"objective_fixed_iteration_weighted_normalized_score_delta_from_reference":0.44189261833669224,"objective_fixed_iteration_weighted_normalized_score_weight_sum":6.0,"objective_suite_average_final_score_raw":3622.0,"objective_suite_average_runtime_seconds":15.668626558333333,"objective_suite_case_adversarial_clique_swap_functionality_35p_final_score":4765.0,"objective_suite_case_adversarial_clique_swap_functionality_35p_normalized_score":1.001892346509672,"objective_suite_case_adversarial_clique_swap_functionality_35p_reference_final_score":4756.0,"objective_suite_case_adversarial_clique_swap_functionality_35p_weight":1.0,"objective_suite_case_adversarial_clique_swap_functionality_35p_weighted_contribution":1.001892346509672,"objective_suite_case_adversarial_transfer_attribute_balance_111p_final_score":206.0,"objective_suite_case_adversarial_transfer_attribute_balance_111p_normalized_score":1.0404040404040404,"objective_suite_case_adversarial_transfer_attribute_balance_111p_reference_final_score":198.0,"objective_suite_case_adversarial_transfer_attribute_balance_111p_weight":1.0,"objective_suite_case_adversarial_transfer_attribute_balance_111p_weighted_contribution":1.0404040404040404,"objective_suite_case_count":6.0,"objective_suite_case_stretch_large_gender_immovable_110p_final_score":2311.0,"objective_suite_case_stretch_large_gender_immovable_110p_normalized_score":1.0605782469022487,"objective_suite_case_stretch_large_gender_immovable_110p_reference_final_score":2179.0,"objective_suite_case_stretch_large_gender_immovable_110p_weight":1.0,"objective_suite_case_stretch_large_gender_immovable_110p_weighted_contribution":1.0605782469022487,"objective_suite_case_stretch_sailing_trip_demo_real_final_score":2318.0,"objective_suite_case_stretch_sailing_trip_demo_real_normalized_score":0.9686585875470122,"objective_suite_case_stretch_sailing_trip_demo_real_reference_final_score":2393.0,"objective_suite_case_stretch_sailing_trip_demo_real_weight":1.0,"objective_suite_case_stretch_sailing_trip_demo_real_weighted_contribution":0.9686585875470122,"objective_suite_case_stretch_social_golfer_32x8x10_final_score":5367.0,"objective_suite_case_stretch_social_golfer_32x8x10_normalized_score":0.9770617149098854,"objective_suite_case_stretch_social_golfer_32x8x10_reference_final_score":5493.0,"objective_suite_case_stretch_social_golfer_32x8x10_weight":1.0,"objective_suite_case_stretch_social_golfer_32x8x10_weighted_contribution":0.9770617149098854,"objective_suite_case_stretch_synthetic_partial_attendance_capacity_pressure_152p_final_score":6765.0,"objective_suite_case_stretch_synthetic_partial_attendance_capacity_pressure_152p_normalized_score":1.0188253012048192,"objective_suite_case_stretch_synthetic_partial_attendance_capacity_pressure_152p_reference_final_score":6640.0,"objective_suite_case_stretch_synthetic_partial_attendance_capacity_pressure_152p_weight":1.0,"objective_suite_case_stretch_synthetic_partial_attendance_capacity_pressure_152p_weighted_contribution":1.0188253012048192,"objective_suite_external_validation_failures":0.0,"objective_suite_score_breakdown_mismatches":0.0,"objective_suite_total_final_score_raw":21732.0,"objective_suite_total_runtime_seconds":94.01175935,"objective_suite_total_score_mismatches":0.0,"objective_suite_weighted_normalized_score":101.12367062462798,"objective_suite_weighted_normalized_score_delta_from_reference":1.1236706246279704,"objective_suite_weighted_normalized_score_weight_sum":6.0,"path_allowed_sessions_iter_us":25.044975,"path_avg_iter_us":16.808374999999998,"path_clique_iter_us":17.936149999999998,"path_construction_iter_us":21.333849999999998,"path_swap_iter_us":11.45975,"path_transfer_iter_us":8.26715,"rep_avg_iter_us":31.015880555555555,"rep_balanced_iter_us":28.29915,"rep_balanced_score":3.0,"rep_constrained_iter_us":33.73261111111111,"rep_constrained_score":4.0,"runtime_canonical_share_percent":99.23063168210759,"runtime_total_seconds":94.74066400299999,"solver3_raw_score_us":79.24227118055555,"swap_apply_us":2.5376250000000002,"swap_preview_us":6.783296875,"transfer_apply_us":2.3611250000000004,"transfer_preview_us":3.8512812500000004},"status":"discard","description":"Memetic post-crossover intensification follow-up: after selecting the best exact-rescored donor-session offspring from the two-donor burst, ran a short session-restricted polish on the transplanted session before returning to the main search. This improved social_golfer materially, but the aggregate still regressed to 101.1237 because transfer-balance and large_gender did not improve enough.","timestamp":1775663430653,"segment":0,"confidence":389.6463496362966,"iterationTokens":22551,"asi":{"hypothesis":"A short session-local polish immediately after donor-session transplantation will repair crossover seams and stabilize the two-donor memetic burst.","rollback_reason":"The post-crossover single-session polish did not beat the current keep; social_golfer improved, but the aggregate remained worse than 100.8462.","next_action_hint":"Retain the two-donor keep and stop spending turns on simple memetic stabilizers if they continue to miss; the next fresh experiment should likely pivot to the next untried large family rather than layering more local polish.","mechanism_family":"memetic / multi-donor exact-rescored offspring plus session-local polish","failure_shape":{"current_keep":"100.84622890492095","post_crossover_polish":"101.12367062462798","social_golfer_normalized":"0.9770617149098854","attribute_balance_normalized":"1.0404040404040404","large_gender_normalized":"1.0605782469022487"}}}
