{"run":4,"commit":"7be6d99","metric":100.1654447877826,"metrics":{"clique_apply_us":0.8521458333333333,"clique_preview_us":4.224083333333334,"correctness_suite_average_runtime_seconds":0.06499178,"correctness_suite_case_count":4.0,"correctness_suite_external_validation_failures":0.0,"correctness_suite_total_runtime_seconds":0.25996712,"correctness_suite_total_score_mismatches":0.0,"hotpath_total_us":9.889604166666667,"objective_fixed_iteration_average_final_score_raw":3598.5,"objective_fixed_iteration_average_runtime_seconds":36.651404877333334,"objective_fixed_iteration_case_adversarial_clique_swap_functionality_35p_final_score":4756.0,"objective_fixed_iteration_case_adversarial_clique_swap_functionality_35p_normalized_score":1.0,"objective_fixed_iteration_case_adversarial_clique_swap_functionality_35p_reference_final_score":4756.0,"objective_fixed_iteration_case_adversarial_clique_swap_functionality_35p_weight":1.0,"objective_fixed_iteration_case_adversarial_clique_swap_functionality_35p_weighted_contribution":1.0,"objective_fixed_iteration_case_adversarial_transfer_attribute_balance_111p_final_score":198.0,"objective_fixed_iteration_case_adversarial_transfer_attribute_balance_111p_normalized_score":0.9705882352941176,"objective_fixed_iteration_case_adversarial_transfer_attribute_balance_111p_reference_final_score":204.0,"objective_fixed_iteration_case_adversarial_transfer_attribute_balance_111p_weight":1.0,"objective_fixed_iteration_case_adversarial_transfer_attribute_balance_111p_weighted_contribution":0.9705882352941176,"objective_fixed_iteration_case_count":6.0,"objective_fixed_iteration_case_stretch_large_gender_immovable_110p_final_score":2157.0,"objective_fixed_iteration_case_stretch_large_gender_immovable_110p_normalized_score":1.010304449648712,"objective_fixed_iteration_case_stretch_large_gender_immovable_110p_reference_final_score":2135.0,"objective_fixed_iteration_case_stretch_large_gender_immovable_110p_weight":1.0,"objective_fixed_iteration_case_stretch_large_gender_immovable_110p_weighted_contribution":1.010304449648712,"objective_fixed_iteration_case_stretch_sailing_trip_demo_real_final_score":2416.0,"objective_fixed_iteration_case_stretch_sailing_trip_demo_real_normalized_score":1.0882882882882883,"objective_fixed_iteration_case_stretch_sailing_trip_demo_real_reference_final_score":2220.0,"objective_fixed_iteration_case_stretch_sailing_trip_demo_real_weight":1.0,"objective_fixed_iteration_case_stretch_sailing_trip_demo_real_weighted_contribution":1.0882882882882883,"objective_fixed_iteration_case_stretch_social_golfer_32x8x10_final_score":5409.0,"objective_fixed_iteration_case_stretch_social_golfer_32x8x10_normalized_score":0.9847078099399236,"objective_fixed_iteration_case_stretch_social_golfer_32x8x10_reference_final_score":5493.0,"objective_fixed_iteration_case_stretch_social_golfer_32x8x10_weight":1.0,"objective_fixed_iteration_case_stretch_social_golfer_32x8x10_weighted_contribution":0.9847078099399236,"objective_fixed_iteration_case_stretch_synthetic_partial_attendance_capacity_pressure_152p_final_score":6655.0,"objective_fixed_iteration_case_stretch_synthetic_partial_attendance_capacity_pressure_152p_normalized_score":1.0051351759552938,"objective_fixed_iteration_case_stretch_synthetic_partial_attendance_capacity_pressure_152p_reference_final_score":6621.0,"objective_fixed_iteration_case_stretch_synthetic_partial_attendance_capacity_pressure_152p_weight":1.0,"objective_fixed_iteration_case_stretch_synthetic_partial_attendance_capacity_pressure_152p_weighted_contribution":1.0051351759552938,"objective_fixed_iteration_external_validation_failures":0.0,"objective_fixed_iteration_score_breakdown_mismatches":0.0,"objective_fixed_iteration_total_final_score_raw":21591.0,"objective_fixed_iteration_total_runtime_seconds":219.908429264,"objective_fixed_iteration_total_score_mismatches":0.0,"objective_fixed_iteration_weighted_normalized_score":100.98373265210559,"objective_fixed_iteration_weighted_normalized_score_delta_from_reference":0.9837326521055845,"objective_fixed_iteration_weighted_normalized_score_weight_sum":6.0,"objective_suite_average_final_score_raw":3607.8333333333335,"objective_suite_average_runtime_seconds":15.667408332666668,"objective_suite_case_adversarial_clique_swap_functionality_35p_final_score":4756.0,"objective_suite_case_adversarial_clique_swap_functionality_35p_normalized_score":1.0,"objective_suite_case_adversarial_clique_swap_functionality_35p_reference_final_score":4756.0,"objective_suite_case_adversarial_clique_swap_functionality_35p_weight":1.0,"objective_suite_case_adversarial_clique_swap_functionality_35p_weighted_contribution":1.0,"objective_suite_case_adversarial_transfer_attribute_balance_111p_final_score":193.0,"objective_suite_case_adversarial_transfer_attribute_balance_111p_normalized_score":0.9747474747474747,"objective_suite_case_adversarial_transfer_attribute_balance_111p_reference_final_score":198.0,"objective_suite_case_adversarial_transfer_attribute_balance_111p_weight":1.0,"objective_suite_case_adversarial_transfer_attribute_balance_111p_weighted_contribution":0.9747474747474747,"objective_suite_case_count":6.0,"objective_suite_case_stretch_large_gender_immovable_110p_final_score":2234.0,"objective_suite_case_stretch_large_gender_immovable_110p_normalized_score":1.0252409362092703,"objective_suite_case_stretch_large_gender_immovable_110p_reference_final_score":2179.0,"objective_suite_case_stretch_large_gender_immovable_110p_weight":1.0,"objective_suite_case_stretch_large_gender_immovable_110p_weighted_contribution":1.0252409362092703,"objective_suite_case_stretch_sailing_trip_demo_real_final_score":2475.0,"objective_suite_case_stretch_sailing_trip_demo_real_normalized_score":1.0342666109486,"objective_suite_case_stretch_sailing_trip_demo_real_reference_final_score":2393.0,"objective_suite_case_stretch_sailing_trip_demo_real_weight":1.0,"objective_suite_case_stretch_sailing_trip_demo_real_weighted_contribution":1.0342666109486,"objective_suite_case_stretch_social_golfer_32x8x10_final_score":5409.0,"objective_suite_case_stretch_social_golfer_32x8x10_normalized_score":0.9847078099399236,"objective_suite_case_stretch_social_golfer_32x8x10_reference_final_score":5493.0,"objective_suite_case_stretch_social_golfer_32x8x10_weight":1.0,"objective_suite_case_stretch_social_golfer_32x8x10_weighted_contribution":0.9847078099399236,"objective_suite_case_stretch_synthetic_partial_attendance_capacity_pressure_152p_final_score":6580.0,"objective_suite_case_stretch_synthetic_partial_attendance_capacity_pressure_152p_normalized_score":0.9909638554216867,"objective_suite_case_stretch_synthetic_partial_attendance_capacity_pressure_152p_reference_final_score":6640.0,"objective_suite_case_stretch_synthetic_partial_attendance_capacity_pressure_152p_weight":1.0,"objective_suite_case_stretch_synthetic_partial_attendance_capacity_pressure_152p_weighted_contribution":0.9909638554216867,"objective_suite_external_validation_failures":0.0,"objective_suite_score_breakdown_mismatches":0.0,"objective_suite_total_final_score_raw":21647.0,"objective_suite_total_runtime_seconds":94.004449996,"objective_suite_total_score_mismatches":0.0,"objective_suite_weighted_normalized_score":100.1654447877826,"objective_suite_weighted_normalized_score_delta_from_reference":0.1654447877825982,"objective_suite_weighted_normalized_score_weight_sum":6.0,"path_allowed_sessions_iter_us":7.6259749999999995,"path_avg_iter_us":5.37841,"path_clique_iter_us":5.831575,"path_construction_iter_us":6.6930749999999986,"path_swap_iter_us":3.8531,"path_transfer_iter_us":2.888325,"rep_avg_iter_us":9.696744696969699,"rep_balanced_iter_us":9.599216666666669,"rep_balanced_score":3.0,"rep_constrained_iter_us":9.794272727272729,"rep_constrained_score":4.0,"runtime_canonical_share_percent":99.72421500291028,"runtime_total_seconds":94.264417116,"solver3_raw_score_us":24.964758863636366,"swap_apply_us":0.6346875,"swap_preview_us":2.151421875,"transfer_apply_us":0.7676562499999999,"transfer_preview_us":1.259609375},"status":"discard","description":"T_initial=1.0, T_final=0.02: cooler start hurt sailing_trip (1.017\u21921.034) and large_gender (1.015\u21921.025). Sailing fixed-iteration also regressed to 1.089, confirming T=1.0 is too cold for cases that need exploration. Previous T=2.0 was better.","timestamp":1775561311737,"segment":0,"confidence":1.9999999999999962,"iterationTokens":17230,"asi":{"hypothesis":"T_initial=1.0, T_final=0.02 reduces random hot-phase exploration","rollback_reason":"100.17 vs prev 100.11. sailing_trip 1.017\u21921.034, large_gender 1.015\u21921.025. Fixed-iteration sailing 1.089 confirms too cold. Cases needing escape from local optima need T\u22652.0.","next_action_hint":"T_initial=2.0, T_final=0.05 is the best known. Try population-based restart or reheating when no_improvement > threshold to improve sailing/gender gaps within the existing T schedule."}}
{"run":5,"commit":"7be6d99","metric":100.95426104508259,"metrics":{"clique_apply_us":5.379875,"clique_preview_us":18.960104166666667,"correctness_suite_average_runtime_seconds":0.0633501615,"correctness_suite_case_count":4.0,"correctness_suite_external_validation_failures":0.0,"correctness_suite_total_runtime_seconds":0.253400646,"correctness_suite_total_score_mismatches":0.0,"hotpath_total_us":28.932901041666668,"objective_fixed_iteration_average_final_score_raw":3618.0,"objective_fixed_iteration_average_runtime_seconds":39.693513270333334,"objective_fixed_iteration_case_adversarial_clique_swap_functionality_35p_final_score":4756.0,"objective_fixed_iteration_case_adversarial_clique_swap_functionality_35p_normalized_score":1.0,"objective_fixed_iteration_case_adversarial_clique_swap_functionality_35p_reference_final_score":4756.0,"objective_fixed_iteration_case_adversarial_clique_swap_functionality_35p_weight":1.0,"objective_fixed_iteration_case_adversarial_clique_swap_functionality_35p_weighted_contribution":1.0,"objective_fixed_iteration_case_adversarial_transfer_attribute_balance_111p_final_score":210.0,"objective_fixed_iteration_case_adversarial_transfer_attribute_balance_111p_normalized_score":1.0294117647058822,"objective_fixed_iteration_case_adversarial_transfer_attribute_balance_111p_reference_final_score":204.0,"objective_fixed_iteration_case_adversarial_transfer_attribute_balance_111p_weight":1.0,"objective_fixed_iteration_case_adversarial_transfer_attribute_balance_111p_weighted_contribution":1.0294117647058822,"objective_fixed_iteration_case_count":6.0,"objective_fixed_iteration_case_stretch_large_gender_immovable_110p_final_score":2168.0,"objective_fixed_iteration_case_stretch_large_gender_immovable_110p_normalized_score":1.015456674473068,"objective_fixed_iteration_case_stretch_large_gender_immovable_110p_reference_final_score":2135.0,"objective_fixed_iteration_case_stretch_large_gender_immovable_110p_weight":1.0,"objective_fixed_iteration_case_stretch_large_gender_immovable_110p_weighted_contribution":1.015456674473068,"objective_fixed_iteration_case_stretch_sailing_trip_demo_real_final_score":2536.0,"objective_fixed_iteration_case_stretch_sailing_trip_demo_real_normalized_score":1.1423423423423424,"objective_fixed_iteration_case_stretch_sailing_trip_demo_real_reference_final_score":2220.0,"objective_fixed_iteration_case_stretch_sailing_trip_demo_real_weight":1.0,"objective_fixed_iteration_case_stretch_sailing_trip_demo_real_weighted_contribution":1.1423423423423424,"objective_fixed_iteration_case_stretch_social_golfer_32x8x10_final_score":5493.0,"objective_fixed_iteration_case_stretch_social_golfer_32x8x10_normalized_score":1.0,"objective_fixed_iteration_case_stretch_social_golfer_32x8x10_reference_final_score":5493.0,"objective_fixed_iteration_case_stretch_social_golfer_32x8x10_weight":1.0,"objective_fixed_iteration_case_stretch_social_golfer_32x8x10_weighted_contribution":1.0,"objective_fixed_iteration_case_stretch_synthetic_partial_attendance_capacity_pressure_152p_final_score":6545.0,"objective_fixed_iteration_case_stretch_synthetic_partial_attendance_capacity_pressure_152p_normalized_score":0.9885213713940493,"objective_fixed_iteration_case_stretch_synthetic_partial_attendance_capacity_pressure_152p_reference_final_score":6621.0,"objective_fixed_iteration_case_stretch_synthetic_partial_attendance_capacity_pressure_152p_weight":1.0,"objective_fixed_iteration_case_stretch_synthetic_partial_attendance_capacity_pressure_152p_weighted_contribution":0.9885213713940493,"objective_fixed_iteration_external_validation_failures":0.0,"objective_fixed_iteration_score_breakdown_mismatches":0.0,"objective_fixed_iteration_total_final_score_raw":21708.0,"objective_fixed_iteration_total_runtime_seconds":238.161079622,"objective_fixed_iteration_total_score_mismatches":0.0,"objective_fixed_iteration_weighted_normalized_score":102.9288692152557,"objective_fixed_iteration_weighted_normalized_score_delta_from_reference":2.9288692152557028,"objective_fixed_iteration_weighted_normalized_score_weight_sum":6.0,"objective_suite_average_final_score_raw":3615.0,"objective_suite_average_runtime_seconds":15.667252050166667,"objective_suite_case_adversarial_clique_swap_functionality_35p_final_score":4756.0,"objective_suite_case_adversarial_clique_swap_functionality_35p_normalized_score":1.0,"objective_suite_case_adversarial_clique_swap_functionality_35p_reference_final_score":4756.0,"objective_suite_case_adversarial_clique_swap_functionality_35p_weight":1.0,"objective_suite_case_adversarial_clique_swap_functionality_35p_weighted_contribution":1.0,"objective_suite_case_adversarial_transfer_attribute_balance_111p_final_score":207.0,"objective_suite_case_adversarial_transfer_attribute_balance_111p_normalized_score":1.0454545454545454,"objective_suite_case_adversarial_transfer_attribute_balance_111p_reference_final_score":198.0,"objective_suite_case_adversarial_transfer_attribute_balance_111p_weight":1.0,"objective_suite_case_adversarial_transfer_attribute_balance_111p_weighted_contribution":1.0454545454545454,"objective_suite_case_count":6.0,"objective_suite_case_stretch_large_gender_immovable_110p_final_score":2223.0,"objective_suite_case_stretch_large_gender_immovable_110p_normalized_score":1.0201927489674163,"objective_suite_case_stretch_large_gender_immovable_110p_reference_final_score":2179.0,"objective_suite_case_stretch_large_gender_immovable_110p_weight":1.0,"objective_suite_case_stretch_large_gender_immovable_110p_weighted_contribution":1.0201927489674163,"objective_suite_case_stretch_sailing_trip_demo_real_final_score":2374.0,"objective_suite_case_stretch_sailing_trip_demo_real_normalized_score":0.9920601755119097,"objective_suite_case_stretch_sailing_trip_demo_real_reference_final_score":2393.0,"objective_suite_case_stretch_sailing_trip_demo_real_weight":1.0,"objective_suite_case_stretch_sailing_trip_demo_real_weighted_contribution":0.9920601755119097,"objective_suite_case_stretch_social_golfer_32x8x10_final_score":5493.0,"objective_suite_case_stretch_social_golfer_32x8x10_normalized_score":1.0,"objective_suite_case_stretch_social_golfer_32x8x10_reference_final_score":5493.0,"objective_suite_case_stretch_social_golfer_32x8x10_weight":1.0,"objective_suite_case_stretch_social_golfer_32x8x10_weighted_contribution":1.0,"objective_suite_case_stretch_synthetic_partial_attendance_capacity_pressure_152p_final_score":6637.0,"objective_suite_case_stretch_synthetic_partial_attendance_capacity_pressure_152p_normalized_score":0.9995481927710843,"objective_suite_case_stretch_synthetic_partial_attendance_capacity_pressure_152p_reference_final_score":6640.0,"objective_suite_case_stretch_synthetic_partial_attendance_capacity_pressure_152p_weight":1.0,"objective_suite_case_stretch_synthetic_partial_attendance_capacity_pressure_152p_weighted_contribution":0.9995481927710843,"objective_suite_external_validation_failures":0.0,"objective_suite_score_breakdown_mismatches":0.0,"objective_suite_total_final_score_raw":21690.0,"objective_suite_total_runtime_seconds":94.003512301,"objective_suite_total_score_mismatches":0.0,"objective_suite_weighted_normalized_score":100.95426104508259,"objective_suite_weighted_normalized_score_delta_from_reference":0.9542610450825828,"objective_suite_weighted_normalized_score_weight_sum":6.0,"path_allowed_sessions_iter_us":6.953099999999999,"path_avg_iter_us":5.34507,"path_clique_iter_us":5.729025,"path_construction_iter_us":6.749899999999999,"path_swap_iter_us":4.3976500000000005,"path_transfer_iter_us":2.8956749999999998,"rep_avg_iter_us":9.179141666666666,"rep_balanced_iter_us":8.172183333333333,"rep_balanced_score":3.0,"rep_constrained_iter_us":10.186100000000001,"rep_constrained_score":4.0,"runtime_canonical_share_percent":99.73115961675671,"runtime_total_seconds":94.256912947,"solver3_raw_score_us":43.457112708333334,"swap_apply_us":0.709765625,"swap_preview_us":1.9204843749999998,"transfer_apply_us":0.757296875,"transfer_preview_us":1.205375},"status":"discard","description":"Two-cycle incumbent restart (midpoint warm restart from best-so-far) regressed overall. It helped sailing_trip (1.017\u21920.992) but hurt attribute_balance (0.995\u21921.045) and fixed-iteration quality. The restart family is still promising, but unconditional midpoint restart is too disruptive.","timestamp":1775574474969,"segment":0,"confidence":9.12316648333501,"iterationTokens":17230,"asi":{"hypothesis":"A second full cooling cycle from the incumbent best state can escape late local minima better than one long SA pass","rollback_reason":"Primary regressed 100.11\u2192100.95. Attribute-balance and fixed-iteration quality both worsened materially. Unconditional midpoint restart is too blunt.","mechanism_family_signal":"Still promising as a restart/perturbation family because sailing_trip improved below reference while other cases regressed. Needs selective triggering, not mandatory midpoint restart on every case.","next_action_hint":"Incubation follow-up: make restart conditional on stagnation/no-improvement and only when current state has drifted meaningfully from best. Avoid restarting cases already converging well."}}
