{"run":21,"commit":"903743d","metric":101.36453368202842,"metrics":{"clique_apply_us":2.7565625000000002,"clique_preview_us":13.733770833333333,"correctness_suite_average_runtime_seconds":0.18455969475,"correctness_suite_case_count":4.0,"correctness_suite_external_validation_failures":0.0,"correctness_suite_total_runtime_seconds":0.738238779,"correctness_suite_total_score_mismatches":0.0,"hotpath_total_us":31.470630208333333,"objective_fixed_iteration_average_final_score_raw":3604.5,"objective_fixed_iteration_average_runtime_seconds":50.80849783266667,"objective_fixed_iteration_case_adversarial_clique_swap_functionality_35p_final_score":4765.0,"objective_fixed_iteration_case_adversarial_clique_swap_functionality_35p_normalized_score":1.001892346509672,"objective_fixed_iteration_case_adversarial_clique_swap_functionality_35p_reference_final_score":4756.0,"objective_fixed_iteration_case_adversarial_clique_swap_functionality_35p_weight":1.0,"objective_fixed_iteration_case_adversarial_clique_swap_functionality_35p_weighted_contribution":1.001892346509672,"objective_fixed_iteration_case_adversarial_transfer_attribute_balance_111p_final_score":207.0,"objective_fixed_iteration_case_adversarial_transfer_attribute_balance_111p_normalized_score":1.0147058823529411,"objective_fixed_iteration_case_adversarial_transfer_attribute_balance_111p_reference_final_score":204.0,"objective_fixed_iteration_case_adversarial_transfer_attribute_balance_111p_weight":1.0,"objective_fixed_iteration_case_adversarial_transfer_attribute_balance_111p_weighted_contribution":1.0147058823529411,"objective_fixed_iteration_case_count":6.0,"objective_fixed_iteration_case_stretch_large_gender_immovable_110p_final_score":2157.0,"objective_fixed_iteration_case_stretch_large_gender_immovable_110p_normalized_score":1.010304449648712,"objective_fixed_iteration_case_stretch_large_gender_immovable_110p_reference_final_score":2135.0,"objective_fixed_iteration_case_stretch_large_gender_immovable_110p_weight":1.0,"objective_fixed_iteration_case_stretch_large_gender_immovable_110p_weighted_contribution":1.010304449648712,"objective_fixed_iteration_case_stretch_sailing_trip_demo_real_final_score":2306.0,"objective_fixed_iteration_case_stretch_sailing_trip_demo_real_normalized_score":1.0387387387387388,"objective_fixed_iteration_case_stretch_sailing_trip_demo_real_reference_final_score":2220.0,"objective_fixed_iteration_case_stretch_sailing_trip_demo_real_weight":1.0,"objective_fixed_iteration_case_stretch_sailing_trip_demo_real_weighted_contribution":1.0387387387387388,"objective_fixed_iteration_case_stretch_social_golfer_32x8x10_final_score":5451.0,"objective_fixed_iteration_case_stretch_social_golfer_32x8x10_normalized_score":0.9923539049699618,"objective_fixed_iteration_case_stretch_social_golfer_32x8x10_reference_final_score":5493.0,"objective_fixed_iteration_case_stretch_social_golfer_32x8x10_weight":1.0,"objective_fixed_iteration_case_stretch_social_golfer_32x8x10_weighted_contribution":0.9923539049699618,"objective_fixed_iteration_case_stretch_synthetic_partial_attendance_capacity_pressure_152p_final_score":6741.0,"objective_fixed_iteration_case_stretch_synthetic_partial_attendance_capacity_pressure_152p_normalized_score":1.0181241504304486,"objective_fixed_iteration_case_stretch_synthetic_partial_attendance_capacity_pressure_152p_reference_final_score":6621.0,"objective_fixed_iteration_case_stretch_synthetic_partial_attendance_capacity_pressure_152p_weight":1.0,"objective_fixed_iteration_case_stretch_synthetic_partial_attendance_capacity_pressure_152p_weighted_contribution":1.0181241504304486,"objective_fixed_iteration_external_validation_failures":0.0,"objective_fixed_iteration_score_breakdown_mismatches":0.0,"objective_fixed_iteration_total_final_score_raw":21627.0,"objective_fixed_iteration_total_runtime_seconds":304.850986996,"objective_fixed_iteration_total_score_mismatches":0.0,"objective_fixed_iteration_weighted_normalized_score":101.26865787750792,"objective_fixed_iteration_weighted_normalized_score_delta_from_reference":1.2686578775079171,"objective_fixed_iteration_weighted_normalized_score_weight_sum":6.0,"objective_suite_average_final_score_raw":3639.0,"objective_suite_average_runtime_seconds":15.668875509833333,"objective_suite_case_adversarial_clique_swap_functionality_35p_final_score":4765.0,"objective_suite_case_adversarial_clique_swap_functionality_35p_normalized_score":1.001892346509672,"objective_suite_case_adversarial_clique_swap_functionality_35p_reference_final_score":4756.0,"objective_suite_case_adversarial_clique_swap_functionality_35p_weight":1.0,"objective_suite_case_adversarial_clique_swap_functionality_35p_weighted_contribution":1.001892346509672,"objective_suite_case_adversarial_transfer_attribute_balance_111p_final_score":204.0,"objective_suite_case_adversarial_transfer_attribute_balance_111p_normalized_score":1.0303030303030303,"objective_suite_case_adversarial_transfer_attribute_balance_111p_reference_final_score":198.0,"objective_suite_case_adversarial_transfer_attribute_balance_111p_weight":1.0,"objective_suite_case_adversarial_transfer_attribute_balance_111p_weighted_contribution":1.0303030303030303,"objective_suite_case_count":6.0,"objective_suite_case_stretch_large_gender_immovable_110p_final_score":2333.0,"objective_suite_case_stretch_large_gender_immovable_110p_normalized_score":1.0706746213859568,"objective_suite_case_stretch_large_gender_immovable_110p_reference_final_score":2179.0,"objective_suite_case_stretch_large_gender_immovable_110p_weight":1.0,"objective_suite_case_stretch_large_gender_immovable_110p_weighted_contribution":1.0706746213859568,"objective_suite_case_stretch_sailing_trip_demo_real_final_score":2316.0,"objective_suite_case_stretch_sailing_trip_demo_real_normalized_score":0.9678228165482657,"objective_suite_case_stretch_sailing_trip_demo_real_reference_final_score":2393.0,"objective_suite_case_stretch_sailing_trip_demo_real_weight":1.0,"objective_suite_case_stretch_sailing_trip_demo_real_weighted_contribution":0.9678228165482657,"objective_suite_case_stretch_social_golfer_32x8x10_final_score":5451.0,"objective_suite_case_stretch_social_golfer_32x8x10_normalized_score":0.9923539049699618,"objective_suite_case_stretch_social_golfer_32x8x10_reference_final_score":5493.0,"objective_suite_case_stretch_social_golfer_32x8x10_weight":1.0,"objective_suite_case_stretch_social_golfer_32x8x10_weighted_contribution":0.9923539049699618,"objective_suite_case_stretch_synthetic_partial_attendance_capacity_pressure_152p_final_score":6765.0,"objective_suite_case_stretch_synthetic_partial_attendance_capacity_pressure_152p_normalized_score":1.0188253012048192,"objective_suite_case_stretch_synthetic_partial_attendance_capacity_pressure_152p_reference_final_score":6640.0,"objective_suite_case_stretch_synthetic_partial_attendance_capacity_pressure_152p_weight":1.0,"objective_suite_case_stretch_synthetic_partial_attendance_capacity_pressure_152p_weighted_contribution":1.0188253012048192,"objective_suite_external_validation_failures":0.0,"objective_suite_score_breakdown_mismatches":0.0,"objective_suite_total_final_score_raw":21834.0,"objective_suite_total_runtime_seconds":94.013253059,"objective_suite_total_score_mismatches":0.0,"objective_suite_weighted_normalized_score":101.36453368202842,"objective_suite_weighted_normalized_score_delta_from_reference":1.3645336820284237,"objective_suite_weighted_normalized_score_weight_sum":6.0,"path_allowed_sessions_iter_us":25.322625,"path_avg_iter_us":17.874685,"path_clique_iter_us":19.519875000000003,"path_construction_iter_us":23.222625,"path_swap_iter_us":11.456,"path_transfer_iter_us":9.852300000000001,"rep_avg_iter_us":32.20654351851852,"rep_balanced_iter_us":31.290383333333335,"rep_balanced_score":3.0,"rep_constrained_iter_us":33.122703703703706,"rep_constrained_score":4.0,"runtime_canonical_share_percent":99.22086843734114,"runtime_total_seconds":94.75149183799999,"solver3_raw_score_us":81.55185872685186,"swap_apply_us":2.3781875,"swap_preview_us":6.426484375,"transfer_apply_us":2.363421875,"transfer_preview_us":3.812203125},"status":"discard","description":"First stage-aware macro-operator follow-up: replaced the fixed memetic burst choice with a simple stage-aware controller that switched between standard memetic exploitation and a balance-focused memetic burst based on progress and balance/constraint gaps, while keeping the same benchmark-honest donor mechanics underneath. This did not improve the aggregate; it regressed to 101.3645, mainly because large_gender worsened while the balance-focused selector did not produce enough compensating gains elsewhere.","timestamp":1775666011315,"segment":0,"confidence":403.64500536083386,"iterationTokens":12949,"asi":{"hypothesis":"A stage-aware controller over macro operators can improve robustness by invoking a balance-focused burst later in the search instead of always using the same memetic exploitation operator.","rollback_reason":"The first stage-aware macro-operator controller regressed versus the current keep and did not show evidence that this simple context rule improves operator choice.","next_action_hint":"Move the hyper-heuristic item out of the untried queue; if revisiting this family later, use richer operator diversity or learned/contextual rewards rather than a simple deterministic balance-vs-memetic rule over nearly identical operators.","mechanism_family":"stage-aware macro-operator controller over memetic burst variants","failure_shape":{"current_keep":"100.84622890492095","stage_aware_macro_controller":"101.36453368202842","attribute_balance_normalized":"1.0303030303030303","large_gender_normalized":"1.0706746213859568","sailing_normalized":"0.9678228165482657"}}}
{"run":22,"commit":"903743d","metric":101.39239271531999,"metrics":{"clique_apply_us":2.891583333333333,"clique_preview_us":12.854166666666668,"correctness_suite_average_runtime_seconds":0.2104938325,"correctness_suite_case_count":4.0,"correctness_suite_external_validation_failures":0.0,"correctness_suite_total_runtime_seconds":0.84197533,"correctness_suite_total_score_mismatches":0.0,"hotpath_total_us":30.991984375,"objective_fixed_iteration_average_final_score_raw":3603.6666666666665,"objective_fixed_iteration_average_runtime_seconds":50.83392706916667,"objective_fixed_iteration_case_adversarial_clique_swap_functionality_35p_final_score":4765.0,"objective_fixed_iteration_case_adversarial_clique_swap_functionality_35p_normalized_score":1.001892346509672,"objective_fixed_iteration_case_adversarial_clique_swap_functionality_35p_reference_final_score":4756.0,"objective_fixed_iteration_case_adversarial_clique_swap_functionality_35p_weight":1.0,"objective_fixed_iteration_case_adversarial_clique_swap_functionality_35p_weighted_contribution":1.001892346509672,"objective_fixed_iteration_case_adversarial_transfer_attribute_balance_111p_final_score":202.0,"objective_fixed_iteration_case_adversarial_transfer_attribute_balance_111p_normalized_score":0.9901960784313726,"objective_fixed_iteration_case_adversarial_transfer_attribute_balance_111p_reference_final_score":204.0,"objective_fixed_iteration_case_adversarial_transfer_attribute_balance_111p_weight":1.0,"objective_fixed_iteration_case_adversarial_transfer_attribute_balance_111p_weighted_contribution":0.9901960784313726,"objective_fixed_iteration_case_count":6.0,"objective_fixed_iteration_case_stretch_large_gender_immovable_110p_final_score":2157.0,"objective_fixed_iteration_case_stretch_large_gender_immovable_110p_normalized_score":1.010304449648712,"objective_fixed_iteration_case_stretch_large_gender_immovable_110p_reference_final_score":2135.0,"objective_fixed_iteration_case_stretch_large_gender_immovable_110p_weight":1.0,"objective_fixed_iteration_case_stretch_large_gender_immovable_110p_weighted_contribution":1.010304449648712,"objective_fixed_iteration_case_stretch_sailing_trip_demo_real_final_score":2306.0,"objective_fixed_iteration_case_stretch_sailing_trip_demo_real_normalized_score":1.0387387387387388,"objective_fixed_iteration_case_stretch_sailing_trip_demo_real_reference_final_score":2220.0,"objective_fixed_iteration_case_stretch_sailing_trip_demo_real_weight":1.0,"objective_fixed_iteration_case_stretch_sailing_trip_demo_real_weighted_contribution":1.0387387387387388,"objective_fixed_iteration_case_stretch_social_golfer_32x8x10_final_score":5451.0,"objective_fixed_iteration_case_stretch_social_golfer_32x8x10_normalized_score":0.9923539049699618,"objective_fixed_iteration_case_stretch_social_golfer_32x8x10_reference_final_score":5493.0,"objective_fixed_iteration_case_stretch_social_golfer_32x8x10_weight":1.0,"objective_fixed_iteration_case_stretch_social_golfer_32x8x10_weighted_contribution":0.9923539049699618,"objective_fixed_iteration_case_stretch_synthetic_partial_attendance_capacity_pressure_152p_final_score":6741.0,"objective_fixed_iteration_case_stretch_synthetic_partial_attendance_capacity_pressure_152p_normalized_score":1.0181241504304486,"objective_fixed_iteration_case_stretch_synthetic_partial_attendance_capacity_pressure_152p_reference_final_score":6621.0,"objective_fixed_iteration_case_stretch_synthetic_partial_attendance_capacity_pressure_152p_weight":1.0,"objective_fixed_iteration_case_stretch_synthetic_partial_attendance_capacity_pressure_152p_weighted_contribution":1.0181241504304486,"objective_fixed_iteration_external_validation_failures":0.0,"objective_fixed_iteration_score_breakdown_mismatches":0.0,"objective_fixed_iteration_total_final_score_raw":21622.0,"objective_fixed_iteration_total_runtime_seconds":305.00356241500003,"objective_fixed_iteration_total_score_mismatches":0.0,"objective_fixed_iteration_weighted_normalized_score":100.86016114548177,"objective_fixed_iteration_weighted_normalized_score_delta_from_reference":0.8601611454817748,"objective_fixed_iteration_weighted_normalized_score_weight_sum":6.0,"objective_suite_average_final_score_raw":3639.6666666666665,"objective_suite_average_runtime_seconds":15.668099742666667,"objective_suite_case_adversarial_clique_swap_functionality_35p_final_score":4765.0,"objective_suite_case_adversarial_clique_swap_functionality_35p_normalized_score":1.001892346509672,"objective_suite_case_adversarial_clique_swap_functionality_35p_reference_final_score":4756.0,"objective_suite_case_adversarial_clique_swap_functionality_35p_weight":1.0,"objective_suite_case_adversarial_clique_swap_functionality_35p_weighted_contribution":1.001892346509672,"objective_suite_case_adversarial_transfer_attribute_balance_111p_final_score":204.0,"objective_suite_case_adversarial_transfer_attribute_balance_111p_normalized_score":1.0303030303030303,"objective_suite_case_adversarial_transfer_attribute_balance_111p_reference_final_score":198.0,"objective_suite_case_adversarial_transfer_attribute_balance_111p_weight":1.0,"objective_suite_case_adversarial_transfer_attribute_balance_111p_weighted_contribution":1.0303030303030303,"objective_suite_case_count":6.0,"objective_suite_case_stretch_large_gender_immovable_110p_final_score":2333.0,"objective_suite_case_stretch_large_gender_immovable_110p_normalized_score":1.0706746213859568,"objective_suite_case_stretch_large_gender_immovable_110p_reference_final_score":2179.0,"objective_suite_case_stretch_large_gender_immovable_110p_weight":1.0,"objective_suite_case_stretch_large_gender_immovable_110p_weighted_contribution":1.0706746213859568,"objective_suite_case_stretch_sailing_trip_demo_real_final_score":2320.0,"objective_suite_case_stretch_sailing_trip_demo_real_normalized_score":0.9694943585457585,"objective_suite_case_stretch_sailing_trip_demo_real_reference_final_score":2393.0,"objective_suite_case_stretch_sailing_trip_demo_real_weight":1.0,"objective_suite_case_stretch_sailing_trip_demo_real_weighted_contribution":0.9694943585457585,"objective_suite_case_stretch_social_golfer_32x8x10_final_score":5451.0,"objective_suite_case_stretch_social_golfer_32x8x10_normalized_score":0.9923539049699618,"objective_suite_case_stretch_social_golfer_32x8x10_reference_final_score":5493.0,"objective_suite_case_stretch_social_golfer_32x8x10_weight":1.0,"objective_suite_case_stretch_social_golfer_32x8x10_weighted_contribution":0.9923539049699618,"objective_suite_case_stretch_synthetic_partial_attendance_capacity_pressure_152p_final_score":6765.0,"objective_suite_case_stretch_synthetic_partial_attendance_capacity_pressure_152p_normalized_score":1.0188253012048192,"objective_suite_case_stretch_synthetic_partial_attendance_capacity_pressure_152p_reference_final_score":6640.0,"objective_suite_case_stretch_synthetic_partial_attendance_capacity_pressure_152p_weight":1.0,"objective_suite_case_stretch_synthetic_partial_attendance_capacity_pressure_152p_weighted_contribution":1.0188253012048192,"objective_suite_external_validation_failures":0.0,"objective_suite_score_breakdown_mismatches":0.0,"objective_suite_total_final_score_raw":21838.0,"objective_suite_total_runtime_seconds":94.008598456,"objective_suite_total_score_mismatches":0.0,"objective_suite_weighted_normalized_score":101.39239271531999,"objective_suite_weighted_normalized_score_delta_from_reference":1.39239271531999,"objective_suite_weighted_normalized_score_weight_sum":6.0,"path_allowed_sessions_iter_us":25.226825,"path_avg_iter_us":18.303415,"path_clique_iter_us":18.385624999999997,"path_construction_iter_us":22.61065,"path_swap_iter_us":12.681475,"path_transfer_iter_us":12.612499999999999,"rep_avg_iter_us":29.689357407407407,"rep_balanced_iter_us":27.980233333333334,"rep_balanced_score":3.0,"rep_constrained_iter_us":31.398481481481483,"rep_constrained_score":4.0,"runtime_canonical_share_percent":99.11231393085755,"runtime_total_seconds":94.850573786,"solver3_raw_score_us":78.9847567824074,"swap_apply_us":2.37846875,"swap_preview_us":6.50665625,"transfer_apply_us":2.438375,"transfer_preview_us":3.9227343749999997},"status":"discard","description":"First structural-compatibility follow-up: added a lightweight session-level compatibility layer to the memetic burst that scored donor sessions by structural improvement (repeat-pressure plus attribute-balance pressure, with a shape-distance penalty) and only exactly rescored the top structurally promising transplants. This did not improve the aggregate: it landed at 101.3924, suggesting this simple session-signature filter is too weak and may be over-pruning useful donor-session options.","timestamp":1775666901001,"segment":0,"confidence":399.2289220786136,"iterationTokens":22603,"asi":{"hypothesis":"A structural-compatibility layer that prefilters donor-session transplants by session pressure improvement and shape similarity can stabilize the noisy memetic donor-choice line.","rollback_reason":"The structural compatibility prefilter regressed versus the current keep and did not show enough value to justify keeping this first implementation.","next_action_hint":"Move the hypergraph/compatibility item out of the untried queue; if revisited later, use richer structural signatures or compatibility features than simple session pressure plus shape distance.","mechanism_family":"structural-compatibility layer for memetic donor-session selection","failure_shape":{"current_keep":"100.84622890492095","structural_compatibility_filter":"101.39239271531999","large_gender_normalized":"1.0706746213859568","sailing_normalized":"0.9694943585457585","synthetic_partial_normalized":"1.0188253012048192"}}}
