{"run":1,"commit":"04026d6","metric":100,"metrics":{"clique_apply_us":0.30345833333333333,"clique_preview_us":1.3893958333333334,"correctness_suite_average_runtime_seconds":0.008006883499999999,"correctness_suite_case_count":4.0,"correctness_suite_external_validation_failures":0.0,"correctness_suite_total_runtime_seconds":0.032027533999999996,"correctness_suite_total_score_mismatches":0.0,"hotpath_total_us":2.8218072916666666,"metaheuristic_fixed_iteration_weighted_normalized_score":100.0,"metaheuristic_fixed_iteration_weighted_normalized_score_delta_from_reference":0.0,"metaheuristic_fixed_iteration_weighted_normalized_score_weight_sum":9.0,"metaheuristic_suite_weighted_normalized_score":100.0,"metaheuristic_suite_weighted_normalized_score_delta_from_reference":0.0,"metaheuristic_suite_weighted_normalized_score_weight_sum":9.0,"objective_fixed_iteration_average_final_score_raw":2603.5555555555557,"objective_fixed_iteration_average_runtime_seconds":14.139534432333333,"objective_fixed_iteration_case_adversarial_clique_swap_functionality_35p_final_score":4765.0,"objective_fixed_iteration_case_adversarial_clique_swap_functionality_35p_normalized_score":1.0,"objective_fixed_iteration_case_adversarial_clique_swap_functionality_35p_reference_final_score":4765.0,"objective_fixed_iteration_case_adversarial_clique_swap_functionality_35p_weight":1.0,"objective_fixed_iteration_case_adversarial_clique_swap_functionality_35p_weighted_contribution":1.0,"objective_fixed_iteration_case_adversarial_transfer_attribute_balance_111p_final_score":194.0,"objective_fixed_iteration_case_adversarial_transfer_attribute_balance_111p_normalized_score":1.0,"objective_fixed_iteration_case_adversarial_transfer_attribute_balance_111p_reference_final_score":194.0,"objective_fixed_iteration_case_adversarial_transfer_attribute_balance_111p_weight":1.0,"objective_fixed_iteration_case_adversarial_transfer_attribute_balance_111p_weighted_contribution":1.0,"objective_fixed_iteration_case_count":9.0,"objective_fixed_iteration_case_representative_small_workshop_balanced_final_score":3.0,"objective_fixed_iteration_case_representative_small_workshop_balanced_normalized_score":1.0,"objective_fixed_iteration_case_representative_small_workshop_balanced_reference_final_score":3.0,"objective_fixed_iteration_case_representative_small_workshop_balanced_weight":1.0,"objective_fixed_iteration_case_representative_small_workshop_balanced_weighted_contribution":1.0,"objective_fixed_iteration_case_representative_small_workshop_constrained_final_score":4.0,"objective_fixed_iteration_case_representative_small_workshop_constrained_normalized_score":1.0,"objective_fixed_iteration_case_representative_small_workshop_constrained_reference_final_score":4.0,"objective_fixed_iteration_case_representative_small_workshop_constrained_weight":1.0,"objective_fixed_iteration_case_representative_small_workshop_constrained_weighted_contribution":1.0,"objective_fixed_iteration_case_stretch_kirkman_schoolgirls_15x5x7_final_score":55.0,"objective_fixed_iteration_case_stretch_kirkman_schoolgirls_15x5x7_normalized_score":1.0,"objective_fixed_iteration_case_stretch_kirkman_schoolgirls_15x5x7_reference_final_score":55.0,"objective_fixed_iteration_case_stretch_kirkman_schoolgirls_15x5x7_weight":1.0,"objective_fixed_iteration_case_stretch_kirkman_schoolgirls_15x5x7_weighted_contribution":1.0,"objective_fixed_iteration_case_stretch_large_gender_immovable_110p_final_score":2102.0,"objective_fixed_iteration_case_stretch_large_gender_immovable_110p_normalized_score":1.0,"objective_fixed_iteration_case_stretch_large_gender_immovable_110p_reference_final_score":2102.0,"objective_fixed_iteration_case_stretch_large_gender_immovable_110p_weight":1.0,"objective_fixed_iteration_case_stretch_large_gender_immovable_110p_weighted_contribution":1.0,"objective_fixed_iteration_case_stretch_sailing_trip_demo_real_final_score":4362.0,"objective_fixed_iteration_case_stretch_sailing_trip_demo_real_normalized_score":1.0,"objective_fixed_iteration_case_stretch_sailing_trip_demo_real_reference_final_score":4362.0,"objective_fixed_iteration_case_stretch_sailing_trip_demo_real_weight":1.0,"objective_fixed_iteration_case_stretch_sailing_trip_demo_real_weighted_contribution":1.0,"objective_fixed_iteration_case_stretch_social_golfer_32x8x10_final_score":5409.0,"objective_fixed_iteration_case_stretch_social_golfer_32x8x10_normalized_score":1.0,"objective_fixed_iteration_case_stretch_social_golfer_32x8x10_reference_final_score":5409.0,"objective_fixed_iteration_case_stretch_social_golfer_32x8x10_weight":1.0,"objective_fixed_iteration_case_stretch_social_golfer_32x8x10_weighted_contribution":1.0,"objective_fixed_iteration_case_stretch_synthetic_partial_attendance_capacity_pressure_152p_final_score":6538.0,"objective_fixed_iteration_case_stretch_synthetic_partial_attendance_capacity_pressure_152p_normalized_score":1.0,"objective_fixed_iteration_case_stretch_synthetic_partial_attendance_capacity_pressure_152p_reference_final_score":6538.0,"objective_fixed_iteration_case_stretch_synthetic_partial_attendance_capacity_pressure_152p_weight":1.0,"objective_fixed_iteration_case_stretch_synthetic_partial_attendance_capacity_pressure_152p_weighted_contribution":1.0,"objective_fixed_iteration_external_validation_failures":0.0,"objective_fixed_iteration_score_breakdown_mismatches":0.0,"objective_fixed_iteration_total_final_score_raw":23432.0,"objective_fixed_iteration_total_runtime_seconds":127.255809891,"objective_fixed_iteration_total_score_mismatches":0.0,"objective_suite_average_final_score_raw":2597.3333333333335,"objective_suite_average_runtime_seconds":150.00006798966666,"objective_suite_case_adversarial_clique_swap_functionality_35p_final_score":4765.0,"objective_suite_case_adversarial_clique_swap_functionality_35p_normalized_score":1.0,"objective_suite_case_adversarial_clique_swap_functionality_35p_reference_final_score":4765.0,"objective_suite_case_adversarial_clique_swap_functionality_35p_weight":1.0,"objective_suite_case_adversarial_clique_swap_functionality_35p_weighted_contribution":1.0,"objective_suite_case_adversarial_transfer_attribute_balance_111p_final_score":183.0,"objective_suite_case_adversarial_transfer_attribute_balance_111p_normalized_score":1.0,"objective_suite_case_adversarial_transfer_attribute_balance_111p_reference_final_score":183.0,"objective_suite_case_adversarial_transfer_attribute_balance_111p_weight":1.0,"objective_suite_case_adversarial_transfer_attribute_balance_111p_weighted_contribution":1.0,"objective_suite_case_count":9.0,"objective_suite_case_representative_small_workshop_balanced_final_score":3.0,"objective_suite_case_representative_small_workshop_balanced_normalized_score":1.0,"objective_suite_case_representative_small_workshop_balanced_reference_final_score":3.0,"objective_suite_case_representative_small_workshop_balanced_weight":1.0,"objective_suite_case_representative_small_workshop_balanced_weighted_contribution":1.0,"objective_suite_case_representative_small_workshop_constrained_final_score":4.0,"objective_suite_case_representative_small_workshop_constrained_normalized_score":1.0,"objective_suite_case_representative_small_workshop_constrained_reference_final_score":4.0,"objective_suite_case_representative_small_workshop_constrained_weight":1.0,"objective_suite_case_representative_small_workshop_constrained_weighted_contribution":1.0,"objective_suite_case_stretch_kirkman_schoolgirls_15x5x7_final_score":55.0,"objective_suite_case_stretch_kirkman_schoolgirls_15x5x7_normalized_score":1.0,"objective_suite_case_stretch_kirkman_schoolgirls_15x5x7_reference_final_score":55.0,"objective_suite_case_stretch_kirkman_schoolgirls_15x5x7_weight":1.0,"objective_suite_case_stretch_kirkman_schoolgirls_15x5x7_weighted_contribution":1.0,"objective_suite_case_stretch_large_gender_immovable_110p_final_score":2102.0,"objective_suite_case_stretch_large_gender_immovable_110p_normalized_score":1.0,"objective_suite_case_stretch_large_gender_immovable_110p_reference_final_score":2102.0,"objective_suite_case_stretch_large_gender_immovable_110p_weight":1.0,"objective_suite_case_stretch_large_gender_immovable_110p_weighted_contribution":1.0,"objective_suite_case_stretch_sailing_trip_demo_real_final_score":4358.0,"objective_suite_case_stretch_sailing_trip_demo_real_normalized_score":1.0,"objective_suite_case_stretch_sailing_trip_demo_real_reference_final_score":4358.0,"objective_suite_case_stretch_sailing_trip_demo_real_weight":1.0,"objective_suite_case_stretch_sailing_trip_demo_real_weighted_contribution":1.0,"objective_suite_case_stretch_social_golfer_32x8x10_final_score":5409.0,"objective_suite_case_stretch_social_golfer_32x8x10_normalized_score":1.0,"objective_suite_case_stretch_social_golfer_32x8x10_reference_final_score":5409.0,"objective_suite_case_stretch_social_golfer_32x8x10_weight":1.0,"objective_suite_case_stretch_social_golfer_32x8x10_weighted_contribution":1.0,"objective_suite_case_stretch_synthetic_partial_attendance_capacity_pressure_152p_final_score":6497.0,"objective_suite_case_stretch_synthetic_partial_attendance_capacity_pressure_152p_normalized_score":1.0,"objective_suite_case_stretch_synthetic_partial_attendance_capacity_pressure_152p_reference_final_score":6497.0,"objective_suite_case_stretch_synthetic_partial_attendance_capacity_pressure_152p_weight":1.0,"objective_suite_case_stretch_synthetic_partial_attendance_capacity_pressure_152p_weighted_contribution":1.0,"objective_suite_external_validation_failures":0.0,"objective_suite_score_breakdown_mismatches":0.0,"objective_suite_total_final_score_raw":23376.0,"objective_suite_total_runtime_seconds":1350.000611907,"objective_suite_total_score_mismatches":0.0,"path_allowed_sessions_iter_us":0.77615,"path_avg_iter_us":0.8933099999999999,"path_clique_iter_us":0.9699499999999999,"path_construction_iter_us":1.390925,"path_swap_iter_us":0.86165,"path_transfer_iter_us":0.467875,"rep_avg_iter_us":1.1181902173913043,"rep_balanced_iter_us":1.14425,"rep_balanced_score":3.0,"rep_constrained_iter_us":1.0921304347826086,"rep_constrained_score":9.0,"runtime_canonical_share_percent":99.99762764743132,"runtime_total_seconds":1350.032639441,"solver3_raw_score_us":4.8333075090579705,"swap_apply_us":0.20840625,"swap_preview_us":0.324296875,"transfer_apply_us":0.40573437500000004,"transfer_preview_us":0.190515625},"status":"keep","description":"Baseline for the new release-mode solver3 metaheuristic autoresearch lane on the 150s/7M mixed feature-surface bundle.","timestamp":1776133201731,"segment":0,"confidence":null,"iterationTokens":171}
{"run":2,"commit":"04026d6","metric":100.20445244698828,"metrics":{"clique_apply_us":0.3385625,"clique_preview_us":0.8259375,"correctness_suite_average_runtime_seconds":0.00649335025,"correctness_suite_case_count":4.0,"correctness_suite_external_validation_failures":0.0,"correctness_suite_total_runtime_seconds":0.025973401,"correctness_suite_total_score_mismatches":0.0,"hotpath_total_us":2.410875,"metaheuristic_fixed_iteration_weighted_normalized_score":100.20445244698828,"metaheuristic_fixed_iteration_weighted_normalized_score_delta_from_reference":0.20445244698827914,"metaheuristic_fixed_iteration_weighted_normalized_score_weight_sum":9.0,"metaheuristic_suite_weighted_normalized_score":100.20445244698828,"metaheuristic_suite_weighted_normalized_score_delta_from_reference":0.20445244698827914,"metaheuristic_suite_weighted_normalized_score_weight_sum":9.0,"objective_fixed_iteration_average_final_score_raw":2605.0,"objective_fixed_iteration_average_runtime_seconds":14.072333775888888,"objective_fixed_iteration_case_adversarial_clique_swap_functionality_35p_final_score":4765.0,"objective_fixed_iteration_case_adversarial_clique_swap_functionality_35p_normalized_score":1.0,"objective_fixed_iteration_case_adversarial_clique_swap_functionality_35p_reference_final_score":4765.0,"objective_fixed_iteration_case_adversarial_clique_swap_functionality_35p_weight":1.0,"objective_fixed_iteration_case_adversarial_clique_swap_functionality_35p_weighted_contribution":1.0,"objective_fixed_iteration_case_adversarial_transfer_attribute_balance_111p_final_score":194.0,"objective_fixed_iteration_case_adversarial_transfer_attribute_balance_111p_normalized_score":1.0,"objective_fixed_iteration_case_adversarial_transfer_attribute_balance_111p_reference_final_score":194.0,"objective_fixed_iteration_case_adversarial_transfer_attribute_balance_111p_weight":1.0,"objective_fixed_iteration_case_adversarial_transfer_attribute_balance_111p_weighted_contribution":1.0,"objective_fixed_iteration_case_count":9.0,"objective_fixed_iteration_case_representative_small_workshop_balanced_final_score":3.0,"objective_fixed_iteration_case_representative_small_workshop_balanced_normalized_score":1.0,"objective_fixed_iteration_case_representative_small_workshop_balanced_reference_final_score":3.0,"objective_fixed_iteration_case_representative_small_workshop_balanced_weight":1.0,"objective_fixed_iteration_case_representative_small_workshop_balanced_weighted_contribution":1.0,"objective_fixed_iteration_case_representative_small_workshop_constrained_final_score":4.0,"objective_fixed_iteration_case_representative_small_workshop_constrained_normalized_score":1.0,"objective_fixed_iteration_case_representative_small_workshop_constrained_reference_final_score":4.0,"objective_fixed_iteration_case_representative_small_workshop_constrained_weight":1.0,"objective_fixed_iteration_case_representative_small_workshop_constrained_weighted_contribution":1.0,"objective_fixed_iteration_case_stretch_kirkman_schoolgirls_15x5x7_final_score":55.0,"objective_fixed_iteration_case_stretch_kirkman_schoolgirls_15x5x7_normalized_score":1.0,"objective_fixed_iteration_case_stretch_kirkman_schoolgirls_15x5x7_reference_final_score":55.0,"objective_fixed_iteration_case_stretch_kirkman_schoolgirls_15x5x7_weight":1.0,"objective_fixed_iteration_case_stretch_kirkman_schoolgirls_15x5x7_weighted_contribution":1.0,"objective_fixed_iteration_case_stretch_large_gender_immovable_110p_final_score":2157.0,"objective_fixed_iteration_case_stretch_large_gender_immovable_110p_normalized_score":1.0261655566127497,"objective_fixed_iteration_case_stretch_large_gender_immovable_110p_reference_final_score":2102.0,"objective_fixed_iteration_case_stretch_large_gender_immovable_110p_weight":1.0,"objective_fixed_iteration_case_stretch_large_gender_immovable_110p_weighted_contribution":1.0261655566127497,"objective_fixed_iteration_case_stretch_sailing_trip_demo_real_final_score":4362.0,"objective_fixed_iteration_case_stretch_sailing_trip_demo_real_normalized_score":1.0,"objective_fixed_iteration_case_stretch_sailing_trip_demo_real_reference_final_score":4362.0,"objective_fixed_iteration_case_stretch_sailing_trip_demo_real_weight":1.0,"objective_fixed_iteration_case_stretch_sailing_trip_demo_real_weighted_contribution":1.0,"objective_fixed_iteration_case_stretch_social_golfer_32x8x10_final_score":5367.0,"objective_fixed_iteration_case_stretch_social_golfer_32x8x10_normalized_score":0.9922351636161952,"objective_fixed_iteration_case_stretch_social_golfer_32x8x10_reference_final_score":5409.0,"objective_fixed_iteration_case_stretch_social_golfer_32x8x10_weight":1.0,"objective_fixed_iteration_case_stretch_social_golfer_32x8x10_weighted_contribution":0.9922351636161952,"objective_fixed_iteration_case_stretch_synthetic_partial_attendance_capacity_pressure_152p_final_score":6538.0,"objective_fixed_iteration_case_stretch_synthetic_partial_attendance_capacity_pressure_152p_normalized_score":1.0,"objective_fixed_iteration_case_stretch_synthetic_partial_attendance_capacity_pressure_152p_reference_final_score":6538.0,"objective_fixed_iteration_case_stretch_synthetic_partial_attendance_capacity_pressure_152p_weight":1.0,"objective_fixed_iteration_case_stretch_synthetic_partial_attendance_capacity_pressure_152p_weighted_contribution":1.0,"objective_fixed_iteration_external_validation_failures":0.0,"objective_fixed_iteration_score_breakdown_mismatches":0.0,"objective_fixed_iteration_total_final_score_raw":23445.0,"objective_fixed_iteration_total_runtime_seconds":126.651003983,"objective_fixed_iteration_total_score_mismatches":0.0,"objective_suite_average_final_score_raw":2598.777777777778,"objective_suite_average_runtime_seconds":150.00006580555555,"objective_suite_case_adversarial_clique_swap_functionality_35p_final_score":4765.0,"objective_suite_case_adversarial_clique_swap_functionality_35p_normalized_score":1.0,"objective_suite_case_adversarial_clique_swap_functionality_35p_reference_final_score":4765.0,"objective_suite_case_adversarial_clique_swap_functionality_35p_weight":1.0,"objective_suite_case_adversarial_clique_swap_functionality_35p_weighted_contribution":1.0,"objective_suite_case_adversarial_transfer_attribute_balance_111p_final_score":183.0,"objective_suite_case_adversarial_transfer_attribute_balance_111p_normalized_score":1.0,"objective_suite_case_adversarial_transfer_attribute_balance_111p_reference_final_score":183.0,"objective_suite_case_adversarial_transfer_attribute_balance_111p_weight":1.0,"objective_suite_case_adversarial_transfer_attribute_balance_111p_weighted_contribution":1.0,"objective_suite_case_count":9.0,"objective_suite_case_representative_small_workshop_balanced_final_score":3.0,"objective_suite_case_representative_small_workshop_balanced_normalized_score":1.0,"objective_suite_case_representative_small_workshop_balanced_reference_final_score":3.0,"objective_suite_case_representative_small_workshop_balanced_weight":1.0,"objective_suite_case_representative_small_workshop_balanced_weighted_contribution":1.0,"objective_suite_case_representative_small_workshop_constrained_final_score":4.0,"objective_suite_case_representative_small_workshop_constrained_normalized_score":1.0,"objective_suite_case_representative_small_workshop_constrained_reference_final_score":4.0,"objective_suite_case_representative_small_workshop_constrained_weight":1.0,"objective_suite_case_representative_small_workshop_constrained_weighted_contribution":1.0,"objective_suite_case_stretch_kirkman_schoolgirls_15x5x7_final_score":55.0,"objective_suite_case_stretch_kirkman_schoolgirls_15x5x7_normalized_score":1.0,"objective_suite_case_stretch_kirkman_schoolgirls_15x5x7_reference_final_score":55.0,"objective_suite_case_stretch_kirkman_schoolgirls_15x5x7_weight":1.0,"objective_suite_case_stretch_kirkman_schoolgirls_15x5x7_weighted_contribution":1.0,"objective_suite_case_stretch_large_gender_immovable_110p_final_score":2157.0,"objective_suite_case_stretch_large_gender_immovable_110p_normalized_score":1.0261655566127497,"objective_suite_case_stretch_large_gender_immovable_110p_reference_final_score":2102.0,"objective_suite_case_stretch_large_gender_immovable_110p_weight":1.0,"objective_suite_case_stretch_large_gender_immovable_110p_weighted_contribution":1.0261655566127497,"objective_suite_case_stretch_sailing_trip_demo_real_final_score":4358.0,"objective_suite_case_stretch_sailing_trip_demo_real_normalized_score":1.0,"objective_suite_case_stretch_sailing_trip_demo_real_reference_final_score":4358.0,"objective_suite_case_stretch_sailing_trip_demo_real_weight":1.0,"objective_suite_case_stretch_sailing_trip_demo_real_weighted_contribution":1.0,"objective_suite_case_stretch_social_golfer_32x8x10_final_score":5367.0,"objective_suite_case_stretch_social_golfer_32x8x10_normalized_score":0.9922351636161952,"objective_suite_case_stretch_social_golfer_32x8x10_reference_final_score":5409.0,"objective_suite_case_stretch_social_golfer_32x8x10_weight":1.0,"objective_suite_case_stretch_social_golfer_32x8x10_weighted_contribution":0.9922351636161952,"objective_suite_case_stretch_synthetic_partial_attendance_capacity_pressure_152p_final_score":6497.0,"objective_suite_case_stretch_synthetic_partial_attendance_capacity_pressure_152p_normalized_score":1.0,"objective_suite_case_stretch_synthetic_partial_attendance_capacity_pressure_152p_reference_final_score":6497.0,"objective_suite_case_stretch_synthetic_partial_attendance_capacity_pressure_152p_weight":1.0,"objective_suite_case_stretch_synthetic_partial_attendance_capacity_pressure_152p_weighted_contribution":1.0,"objective_suite_external_validation_failures":0.0,"objective_suite_score_breakdown_mismatches":0.0,"objective_suite_total_final_score_raw":23389.0,"objective_suite_total_runtime_seconds":1350.00059225,"objective_suite_total_score_mismatches":0.0,"path_allowed_sessions_iter_us":0.7925500000000001,"path_avg_iter_us":0.9094150000000001,"path_clique_iter_us":1.0114750000000001,"path_construction_iter_us":1.3122,"path_swap_iter_us":0.9257250000000001,"path_transfer_iter_us":0.505125,"rep_avg_iter_us":0.989377536231884,"rep_balanced_iter_us":1.0302333333333333,"rep_balanced_score":3.0,"rep_constrained_iter_us":0.9485217391304347,"rep_constrained_score":9.0,"runtime_canonical_share_percent":99.99807608222972,"runtime_total_seconds":1350.026565651,"solver3_raw_score_us":4.309667536231884,"swap_apply_us":0.241453125,"swap_preview_us":0.33073437499999997,"transfer_apply_us":0.4595,"transfer_preview_us":0.2146875},"status":"discard","description":"Tried capability-aware suite splitting that routed repeat-encounter stretch cases through single_state + sgp_week_pair_tabu while keeping feature-rich stretch cases on baseline modes; Social Golfer improved but large_gender regressed enough to make the mixed 150s/7M bundle worse overall.","timestamp":1776135061437,"segment":0,"confidence":null,"iterationTokens":26569}
{"run":3,"commit":"04026d6","metric":0,"metrics":{},"status":"crash","description":"Crash: autoresearch wrapper lost execute permission after discard/revert, so ./autoresearch.sh failed immediately with permission denied before the zero-repeat-only routing experiment could run.","timestamp":1776135230996,"segment":0,"confidence":null,"iterationTokens":20258}
