{"run":7,"commit":"42f01a4","metric":116.57067202265267,"metrics":{"clique_apply_us":2.8290833333333336,"clique_preview_us":13.727229166666667,"correctness_suite_average_runtime_seconds":0.2021622185,"correctness_suite_case_count":4.0,"correctness_suite_external_validation_failures":0.0,"correctness_suite_total_runtime_seconds":0.808648874,"correctness_suite_total_score_mismatches":0.0,"hotpath_total_us":31.819609375000002,"objective_fixed_iteration_average_final_score_raw":3933.3333333333335,"objective_fixed_iteration_average_runtime_seconds":47.168660258,"objective_fixed_iteration_case_adversarial_clique_swap_functionality_35p_final_score":4756.0,"objective_fixed_iteration_case_adversarial_clique_swap_functionality_35p_normalized_score":1.0,"objective_fixed_iteration_case_adversarial_clique_swap_functionality_35p_reference_final_score":4756.0,"objective_fixed_iteration_case_adversarial_clique_swap_functionality_35p_weight":1.0,"objective_fixed_iteration_case_adversarial_clique_swap_functionality_35p_weighted_contribution":1.0,"objective_fixed_iteration_case_adversarial_transfer_attribute_balance_111p_final_score":202.0,"objective_fixed_iteration_case_adversarial_transfer_attribute_balance_111p_normalized_score":0.9901960784313726,"objective_fixed_iteration_case_adversarial_transfer_attribute_balance_111p_reference_final_score":204.0,"objective_fixed_iteration_case_adversarial_transfer_attribute_balance_111p_weight":1.0,"objective_fixed_iteration_case_adversarial_transfer_attribute_balance_111p_weighted_contribution":0.9901960784313726,"objective_fixed_iteration_case_count":6.0,"objective_fixed_iteration_case_stretch_large_gender_immovable_110p_final_score":2168.0,"objective_fixed_iteration_case_stretch_large_gender_immovable_110p_normalized_score":1.015456674473068,"objective_fixed_iteration_case_stretch_large_gender_immovable_110p_reference_final_score":2135.0,"objective_fixed_iteration_case_stretch_large_gender_immovable_110p_weight":1.0,"objective_fixed_iteration_case_stretch_large_gender_immovable_110p_weighted_contribution":1.015456674473068,"objective_fixed_iteration_case_stretch_sailing_trip_demo_real_final_score":4370.0,"objective_fixed_iteration_case_stretch_sailing_trip_demo_real_normalized_score":1.9684684684684686,"objective_fixed_iteration_case_stretch_sailing_trip_demo_real_reference_final_score":2220.0,"objective_fixed_iteration_case_stretch_sailing_trip_demo_real_weight":1.0,"objective_fixed_iteration_case_stretch_sailing_trip_demo_real_weighted_contribution":1.9684684684684686,"objective_fixed_iteration_case_stretch_social_golfer_32x8x10_final_score":5451.0,"objective_fixed_iteration_case_stretch_social_golfer_32x8x10_normalized_score":0.9923539049699618,"objective_fixed_iteration_case_stretch_social_golfer_32x8x10_reference_final_score":5493.0,"objective_fixed_iteration_case_stretch_social_golfer_32x8x10_weight":1.0,"objective_fixed_iteration_case_stretch_social_golfer_32x8x10_weighted_contribution":0.9923539049699618,"objective_fixed_iteration_case_stretch_synthetic_partial_attendance_capacity_pressure_152p_final_score":6653.0,"objective_fixed_iteration_case_stretch_synthetic_partial_attendance_capacity_pressure_152p_normalized_score":1.0048331067814529,"objective_fixed_iteration_case_stretch_synthetic_partial_attendance_capacity_pressure_152p_reference_final_score":6621.0,"objective_fixed_iteration_case_stretch_synthetic_partial_attendance_capacity_pressure_152p_weight":1.0,"objective_fixed_iteration_case_stretch_synthetic_partial_attendance_capacity_pressure_152p_weighted_contribution":1.0048331067814529,"objective_fixed_iteration_external_validation_failures":0.0,"objective_fixed_iteration_score_breakdown_mismatches":0.0,"objective_fixed_iteration_total_final_score_raw":23600.0,"objective_fixed_iteration_total_runtime_seconds":283.011961548,"objective_fixed_iteration_total_score_mismatches":0.0,"objective_fixed_iteration_weighted_normalized_score":116.18847055207206,"objective_fixed_iteration_weighted_normalized_score_delta_from_reference":16.188470552072065,"objective_fixed_iteration_weighted_normalized_score_weight_sum":6.0,"objective_suite_average_final_score_raw":4000.6666666666665,"objective_suite_average_runtime_seconds":11.1688401135,"objective_suite_case_adversarial_clique_swap_functionality_35p_final_score":4756.0,"objective_suite_case_adversarial_clique_swap_functionality_35p_normalized_score":1.0,"objective_suite_case_adversarial_clique_swap_functionality_35p_reference_final_score":4756.0,"objective_suite_case_adversarial_clique_swap_functionality_35p_weight":1.0,"objective_suite_case_adversarial_clique_swap_functionality_35p_weighted_contribution":1.0,"objective_suite_case_adversarial_transfer_attribute_balance_111p_final_score":206.0,"objective_suite_case_adversarial_transfer_attribute_balance_111p_normalized_score":1.0404040404040404,"objective_suite_case_adversarial_transfer_attribute_balance_111p_reference_final_score":198.0,"objective_suite_case_adversarial_transfer_attribute_balance_111p_weight":1.0,"objective_suite_case_adversarial_transfer_attribute_balance_111p_weighted_contribution":1.0404040404040404,"objective_suite_case_count":6.0,"objective_suite_case_stretch_large_gender_immovable_110p_final_score":2399.0,"objective_suite_case_stretch_large_gender_immovable_110p_normalized_score":1.1009637448370813,"objective_suite_case_stretch_large_gender_immovable_110p_reference_final_score":2179.0,"objective_suite_case_stretch_large_gender_immovable_110p_weight":1.0,"objective_suite_case_stretch_large_gender_immovable_110p_weighted_contribution":1.1009637448370813,"objective_suite_case_stretch_sailing_trip_demo_real_final_score":4396.0,"objective_suite_case_stretch_sailing_trip_demo_real_normalized_score":1.8370246552444631,"objective_suite_case_stretch_sailing_trip_demo_real_reference_final_score":2393.0,"objective_suite_case_stretch_sailing_trip_demo_real_weight":1.0,"objective_suite_case_stretch_sailing_trip_demo_real_weighted_contribution":1.8370246552444631,"objective_suite_case_stretch_social_golfer_32x8x10_final_score":5451.0,"objective_suite_case_stretch_social_golfer_32x8x10_normalized_score":0.9923539049699618,"objective_suite_case_stretch_social_golfer_32x8x10_reference_final_score":5493.0,"objective_suite_case_stretch_social_golfer_32x8x10_weight":1.0,"objective_suite_case_stretch_social_golfer_32x8x10_weighted_contribution":0.9923539049699618,"objective_suite_case_stretch_synthetic_partial_attendance_capacity_pressure_152p_final_score":6796.0,"objective_suite_case_stretch_synthetic_partial_attendance_capacity_pressure_152p_normalized_score":1.0234939759036144,"objective_suite_case_stretch_synthetic_partial_attendance_capacity_pressure_152p_reference_final_score":6640.0,"objective_suite_case_stretch_synthetic_partial_attendance_capacity_pressure_152p_weight":1.0,"objective_suite_case_stretch_synthetic_partial_attendance_capacity_pressure_152p_weighted_contribution":1.0234939759036144,"objective_suite_external_validation_failures":0.0,"objective_suite_score_breakdown_mismatches":0.0,"objective_suite_total_final_score_raw":24004.0,"objective_suite_total_runtime_seconds":67.01304068099999,"objective_suite_total_score_mismatches":0.0,"objective_suite_weighted_normalized_score":116.57067202265267,"objective_suite_weighted_normalized_score_delta_from_reference":16.570672022652676,"objective_suite_weighted_normalized_score_weight_sum":6.0,"path_allowed_sessions_iter_us":31.614324999999997,"path_avg_iter_us":21.78285,"path_clique_iter_us":31.131,"path_construction_iter_us":23.069875000000003,"path_swap_iter_us":13.158325000000001,"path_transfer_iter_us":9.940724999999999,"rep_avg_iter_us":51.724999999999994,"rep_balanced_iter_us":28.23916666666667,"rep_balanced_score":3.0,"rep_constrained_iter_us":75.21083333333333,"rep_constrained_score":4.0,"runtime_canonical_share_percent":98.80768397351083,"runtime_total_seconds":67.82168955499999,"solver3_raw_score_us":105.32745937499999,"swap_apply_us":2.3396875,"swap_preview_us":6.59578125,"transfer_apply_us":2.445015625,"transfer_preview_us":3.8828125000000004},"status":"discard","description":"Front-loaded elite-scout constructor portfolio with honest time accounting regressed catastrophically on the canonical bundle. Even after fail-soft skipping invalid diversified seeds, sailing exploded to 1.837x reference and large_gender worsened to 1.101x, so this light scouting form is not a viable next step.","timestamp":1775655997389,"segment":0,"confidence":283.6929225300747,"iterationTokens":58970,"asi":{"hypothesis":"Spend a small front-loaded portion of the fixed-time budget on several short seeded scout runs, keep the best scout incumbent, then spend the remaining honest budget on the standard record-to-record search.","rollback_reason":"Primary metric collapsed from the new-machine baseline 101.3513 to 116.5707, dominated by a severe sailing failure and worse large_gender.","next_action_hint":"Retire light constructor-portfolio scouting for now. Pivot to a different top-queue family that changes the search mechanics more fundamentally, likely targeted ALNS/LNS repair or a stronger constructor rather than more seeded scouting.","mechanism_family":"front-loaded elite-scout multi-start / constructor portfolio","sanity_bug_learned":"Some diversified constructor seeds are invalid on sailing due clique-capacity normalization; fail-soft skipping avoids crashes but does not rescue the search family.","case_shape":{"sailing":"1.8370246552444631","large_gender":"1.1009637448370813","attribute_balance":"1.0404040404040404","social_golfer":"0.9923539049699618","synthetic_partial":"1.0234939759036144"}}}
{"run":8,"commit":"42f01a4","metric":101.37846319867421,"metrics":{"clique_apply_us":2.83025,"clique_preview_us":13.350687500000001,"correctness_suite_average_runtime_seconds":0.17987642725,"correctness_suite_case_count":4.0,"correctness_suite_external_validation_failures":0.0,"correctness_suite_total_runtime_seconds":0.719505709,"correctness_suite_total_score_mismatches":0.0,"hotpath_total_us":31.50328125,"objective_fixed_iteration_average_final_score_raw":3603.5,"objective_fixed_iteration_average_runtime_seconds":50.462943767,"objective_fixed_iteration_case_adversarial_clique_swap_functionality_35p_final_score":4765.0,"objective_fixed_iteration_case_adversarial_clique_swap_functionality_35p_normalized_score":1.001892346509672,"objective_fixed_iteration_case_adversarial_clique_swap_functionality_35p_reference_final_score":4756.0,"objective_fixed_iteration_case_adversarial_clique_swap_functionality_35p_weight":1.0,"objective_fixed_iteration_case_adversarial_clique_swap_functionality_35p_weighted_contribution":1.001892346509672,"objective_fixed_iteration_case_adversarial_transfer_attribute_balance_111p_final_score":201.0,"objective_fixed_iteration_case_adversarial_transfer_attribute_balance_111p_normalized_score":0.9852941176470589,"objective_fixed_iteration_case_adversarial_transfer_attribute_balance_111p_reference_final_score":204.0,"objective_fixed_iteration_case_adversarial_transfer_attribute_balance_111p_weight":1.0,"objective_fixed_iteration_case_adversarial_transfer_attribute_balance_111p_weighted_contribution":0.9852941176470589,"objective_fixed_iteration_case_count":6.0,"objective_fixed_iteration_case_stretch_large_gender_immovable_110p_final_score":2157.0,"objective_fixed_iteration_case_stretch_large_gender_immovable_110p_normalized_score":1.010304449648712,"objective_fixed_iteration_case_stretch_large_gender_immovable_110p_reference_final_score":2135.0,"objective_fixed_iteration_case_stretch_large_gender_immovable_110p_weight":1.0,"objective_fixed_iteration_case_stretch_large_gender_immovable_110p_weighted_contribution":1.010304449648712,"objective_fixed_iteration_case_stretch_sailing_trip_demo_real_final_score":2306.0,"objective_fixed_iteration_case_stretch_sailing_trip_demo_real_normalized_score":1.0387387387387388,"objective_fixed_iteration_case_stretch_sailing_trip_demo_real_reference_final_score":2220.0,"objective_fixed_iteration_case_stretch_sailing_trip_demo_real_weight":1.0,"objective_fixed_iteration_case_stretch_sailing_trip_demo_real_weighted_contribution":1.0387387387387388,"objective_fixed_iteration_case_stretch_social_golfer_32x8x10_final_score":5451.0,"objective_fixed_iteration_case_stretch_social_golfer_32x8x10_normalized_score":0.9923539049699618,"objective_fixed_iteration_case_stretch_social_golfer_32x8x10_reference_final_score":5493.0,"objective_fixed_iteration_case_stretch_social_golfer_32x8x10_weight":1.0,"objective_fixed_iteration_case_stretch_social_golfer_32x8x10_weighted_contribution":0.9923539049699618,"objective_fixed_iteration_case_stretch_synthetic_partial_attendance_capacity_pressure_152p_final_score":6741.0,"objective_fixed_iteration_case_stretch_synthetic_partial_attendance_capacity_pressure_152p_normalized_score":1.0181241504304486,"objective_fixed_iteration_case_stretch_synthetic_partial_attendance_capacity_pressure_152p_reference_final_score":6621.0,"objective_fixed_iteration_case_stretch_synthetic_partial_attendance_capacity_pressure_152p_weight":1.0,"objective_fixed_iteration_case_stretch_synthetic_partial_attendance_capacity_pressure_152p_weighted_contribution":1.0181241504304486,"objective_fixed_iteration_external_validation_failures":0.0,"objective_fixed_iteration_score_breakdown_mismatches":0.0,"objective_fixed_iteration_total_final_score_raw":21621.0,"objective_fixed_iteration_total_runtime_seconds":302.777662602,"objective_fixed_iteration_total_score_mismatches":0.0,"objective_fixed_iteration_weighted_normalized_score":100.77846179907655,"objective_fixed_iteration_weighted_normalized_score_delta_from_reference":0.7784617990765463,"objective_fixed_iteration_weighted_normalized_score_weight_sum":6.0,"objective_suite_average_final_score_raw":3639.3333333333335,"objective_suite_average_runtime_seconds":15.668323111166666,"objective_suite_case_adversarial_clique_swap_functionality_35p_final_score":4765.0,"objective_suite_case_adversarial_clique_swap_functionality_35p_normalized_score":1.001892346509672,"objective_suite_case_adversarial_clique_swap_functionality_35p_reference_final_score":4756.0,"objective_suite_case_adversarial_clique_swap_functionality_35p_weight":1.0,"objective_suite_case_adversarial_clique_swap_functionality_35p_weighted_contribution":1.001892346509672,"objective_suite_case_adversarial_transfer_attribute_balance_111p_final_score":204.0,"objective_suite_case_adversarial_transfer_attribute_balance_111p_normalized_score":1.0303030303030303,"objective_suite_case_adversarial_transfer_attribute_balance_111p_reference_final_score":198.0,"objective_suite_case_adversarial_transfer_attribute_balance_111p_weight":1.0,"objective_suite_case_adversarial_transfer_attribute_balance_111p_weighted_contribution":1.0303030303030303,"objective_suite_case_count":6.0,"objective_suite_case_stretch_large_gender_immovable_110p_final_score":2333.0,"objective_suite_case_stretch_large_gender_immovable_110p_normalized_score":1.0706746213859568,"objective_suite_case_stretch_large_gender_immovable_110p_reference_final_score":2179.0,"objective_suite_case_stretch_large_gender_immovable_110p_weight":1.0,"objective_suite_case_stretch_large_gender_immovable_110p_weighted_contribution":1.0706746213859568,"objective_suite_case_stretch_sailing_trip_demo_real_final_score":2318.0,"objective_suite_case_stretch_sailing_trip_demo_real_normalized_score":0.9686585875470122,"objective_suite_case_stretch_sailing_trip_demo_real_reference_final_score":2393.0,"objective_suite_case_stretch_sailing_trip_demo_real_weight":1.0,"objective_suite_case_stretch_sailing_trip_demo_real_weighted_contribution":0.9686585875470122,"objective_suite_case_stretch_social_golfer_32x8x10_final_score":5451.0,"objective_suite_case_stretch_social_golfer_32x8x10_normalized_score":0.9923539049699618,"objective_suite_case_stretch_social_golfer_32x8x10_reference_final_score":5493.0,"objective_suite_case_stretch_social_golfer_32x8x10_weight":1.0,"objective_suite_case_stretch_social_golfer_32x8x10_weighted_contribution":0.9923539049699618,"objective_suite_case_stretch_synthetic_partial_attendance_capacity_pressure_152p_final_score":6765.0,"objective_suite_case_stretch_synthetic_partial_attendance_capacity_pressure_152p_normalized_score":1.0188253012048192,"objective_suite_case_stretch_synthetic_partial_attendance_capacity_pressure_152p_reference_final_score":6640.0,"objective_suite_case_stretch_synthetic_partial_attendance_capacity_pressure_152p_weight":1.0,"objective_suite_case_stretch_synthetic_partial_attendance_capacity_pressure_152p_weighted_contribution":1.0188253012048192,"objective_suite_external_validation_failures":0.0,"objective_suite_score_breakdown_mismatches":0.0,"objective_suite_total_final_score_raw":21836.0,"objective_suite_total_runtime_seconds":94.009938667,"objective_suite_total_score_mismatches":0.0,"objective_suite_weighted_normalized_score":101.37846319867421,"objective_suite_weighted_normalized_score_delta_from_reference":1.3784631986742069,"objective_suite_weighted_normalized_score_weight_sum":6.0,"path_allowed_sessions_iter_us":24.8315,"path_avg_iter_us":17.18658,"path_clique_iter_us":17.741675,"path_construction_iter_us":21.756025,"path_swap_iter_us":11.648150000000001,"path_transfer_iter_us":9.955549999999999,"rep_avg_iter_us":29.711812037037042,"rep_balanced_iter_us":27.90371666666667,"rep_balanced_score":3.0,"rep_constrained_iter_us":31.51990740740741,"rep_constrained_score":4.0,"runtime_canonical_share_percent":99.24046244149375,"runtime_total_seconds":94.729444376,"solver3_raw_score_us":78.40167328703704,"swap_apply_us":2.3758749999999997,"swap_preview_us":6.787609375,"transfer_apply_us":2.272,"transfer_preview_us":3.886859375},"status":"discard","description":"Targeted two-group exact repair kernel was benchmark-honest but essentially inert. The occasional stagnation-triggered restricted repair over a session/group-pair subproblem left the aggregate basically unchanged versus the new-machine baseline (101.3513\u2192101.3785), with small case reshuffling only.","timestamp":1775657167377,"segment":0,"confidence":329.5247062566574,"iterationTokens":24484,"asi":{"hypothesis":"A tiny targeted ALNS/LNS step\u2014exact repartition over a stagnated two-group subproblem with immovables fixed and full oracle rescoring\u2014would unlock local improvements the move-by-move search misses.","rollback_reason":"Primary metric did not improve and the delta (+0.0272) is well inside the new-machine noise band, so this exact-repair micro form is too weak to justify keeping.","next_action_hint":"Retire this tiny two-group restricted repair form, but keep the broader ALNS/LNS family alive. Next try should use a larger hotspot destroy set or pivot to the still-untried top-queue memetic/GRASP families rather than more micro repair tuning.","mechanism_family":"targeted ALNS/LNS restricted exact repair","noise_context":{"baseline_metric":"101.35127940997147","this_metric":"101.37846319867421","delta":"0.027183788702734084"},"observations":["Sailing stayed good (0.9687x), but large_gender and synthetic remained the same weak spots as baseline.","The mechanism appears to have had little or no practical activation/coverage under the current trigger and neighborhood size.","This is a family-level signal that the destroy/repair region must be larger or better targeted to matter."]}}
