{"run":14,"commit":"09f897c","metric":97.47071273937541,"metrics":{"clique_apply_us":0.18254166666666669,"clique_preview_us":0.595625,"correctness_suite_average_runtime_seconds":0.004877619,"correctness_suite_case_count":4.0,"correctness_suite_external_validation_failures":0.0,"correctness_suite_total_runtime_seconds":0.019510476,"correctness_suite_total_score_mismatches":0.0,"hotpath_total_us":1.7666041666666665,"metaheuristic_fixed_iteration_weighted_normalized_score":97.60522585813767,"metaheuristic_fixed_iteration_weighted_normalized_score_delta_from_reference":-2.3947741418623214,"metaheuristic_fixed_iteration_weighted_normalized_score_weight_sum":9.0,"metaheuristic_suite_weighted_normalized_score":97.47071273937541,"metaheuristic_suite_weighted_normalized_score_delta_from_reference":-2.529287260624591,"metaheuristic_suite_weighted_normalized_score_weight_sum":9.0,"objective_fixed_iteration_average_final_score_raw":2593.0,"objective_fixed_iteration_average_runtime_seconds":12.87698261588889,"objective_fixed_iteration_case_adversarial_clique_swap_functionality_35p_final_score":4765.0,"objective_fixed_iteration_case_adversarial_clique_swap_functionality_35p_normalized_score":1.0,"objective_fixed_iteration_case_adversarial_clique_swap_functionality_35p_reference_final_score":4765.0,"objective_fixed_iteration_case_adversarial_clique_swap_functionality_35p_weight":1.0,"objective_fixed_iteration_case_adversarial_clique_swap_functionality_35p_weighted_contribution":1.0,"objective_fixed_iteration_case_adversarial_transfer_attribute_balance_111p_final_score":194.0,"objective_fixed_iteration_case_adversarial_transfer_attribute_balance_111p_normalized_score":1.0,"objective_fixed_iteration_case_adversarial_transfer_attribute_balance_111p_reference_final_score":194.0,"objective_fixed_iteration_case_adversarial_transfer_attribute_balance_111p_weight":1.0,"objective_fixed_iteration_case_adversarial_transfer_attribute_balance_111p_weighted_contribution":1.0,"objective_fixed_iteration_case_count":9.0,"objective_fixed_iteration_case_representative_small_workshop_balanced_final_score":3.0,"objective_fixed_iteration_case_representative_small_workshop_balanced_normalized_score":1.0,"objective_fixed_iteration_case_representative_small_workshop_balanced_reference_final_score":3.0,"objective_fixed_iteration_case_representative_small_workshop_balanced_weight":1.0,"objective_fixed_iteration_case_representative_small_workshop_balanced_weighted_contribution":1.0,"objective_fixed_iteration_case_representative_small_workshop_constrained_final_score":4.0,"objective_fixed_iteration_case_representative_small_workshop_constrained_normalized_score":1.0,"objective_fixed_iteration_case_representative_small_workshop_constrained_reference_final_score":4.0,"objective_fixed_iteration_case_representative_small_workshop_constrained_weight":1.0,"objective_fixed_iteration_case_representative_small_workshop_constrained_weighted_contribution":1.0,"objective_fixed_iteration_case_stretch_kirkman_schoolgirls_15x5x7_final_score":44.0,"objective_fixed_iteration_case_stretch_kirkman_schoolgirls_15x5x7_normalized_score":0.8,"objective_fixed_iteration_case_stretch_kirkman_schoolgirls_15x5x7_reference_final_score":55.0,"objective_fixed_iteration_case_stretch_kirkman_schoolgirls_15x5x7_weight":1.0,"objective_fixed_iteration_case_stretch_kirkman_schoolgirls_15x5x7_weighted_contribution":0.8,"objective_fixed_iteration_case_stretch_large_gender_immovable_110p_final_score":2102.0,"objective_fixed_iteration_case_stretch_large_gender_immovable_110p_normalized_score":1.0,"objective_fixed_iteration_case_stretch_large_gender_immovable_110p_reference_final_score":2102.0,"objective_fixed_iteration_case_stretch_large_gender_immovable_110p_weight":1.0,"objective_fixed_iteration_case_stretch_large_gender_immovable_110p_weighted_contribution":1.0,"objective_fixed_iteration_case_stretch_sailing_trip_demo_real_final_score":4362.0,"objective_fixed_iteration_case_stretch_sailing_trip_demo_real_normalized_score":1.0,"objective_fixed_iteration_case_stretch_sailing_trip_demo_real_reference_final_score":4362.0,"objective_fixed_iteration_case_stretch_sailing_trip_demo_real_weight":1.0,"objective_fixed_iteration_case_stretch_sailing_trip_demo_real_weighted_contribution":1.0,"objective_fixed_iteration_case_stretch_social_golfer_32x8x10_final_score":5325.0,"objective_fixed_iteration_case_stretch_social_golfer_32x8x10_normalized_score":0.9844703272323905,"objective_fixed_iteration_case_stretch_social_golfer_32x8x10_reference_final_score":5409.0,"objective_fixed_iteration_case_stretch_social_golfer_32x8x10_weight":1.0,"objective_fixed_iteration_case_stretch_social_golfer_32x8x10_weighted_contribution":0.9844703272323905,"objective_fixed_iteration_case_stretch_synthetic_partial_attendance_capacity_pressure_152p_final_score":6538.0,"objective_fixed_iteration_case_stretch_synthetic_partial_attendance_capacity_pressure_152p_normalized_score":1.0,"objective_fixed_iteration_case_stretch_synthetic_partial_attendance_capacity_pressure_152p_reference_final_score":6538.0,"objective_fixed_iteration_case_stretch_synthetic_partial_attendance_capacity_pressure_152p_weight":1.0,"objective_fixed_iteration_case_stretch_synthetic_partial_attendance_capacity_pressure_152p_weighted_contribution":1.0,"objective_fixed_iteration_external_validation_failures":0.0,"objective_fixed_iteration_score_breakdown_mismatches":0.0,"objective_fixed_iteration_total_final_score_raw":23337.0,"objective_fixed_iteration_total_runtime_seconds":115.892843543,"objective_fixed_iteration_total_score_mismatches":0.0,"objective_suite_average_final_score_raw":2579.5555555555557,"objective_suite_average_runtime_seconds":150.000028261,"objective_suite_case_adversarial_clique_swap_functionality_35p_final_score":4765.0,"objective_suite_case_adversarial_clique_swap_functionality_35p_normalized_score":1.0,"objective_suite_case_adversarial_clique_swap_functionality_35p_reference_final_score":4765.0,"objective_suite_case_adversarial_clique_swap_functionality_35p_weight":1.0,"objective_suite_case_adversarial_clique_swap_functionality_35p_weighted_contribution":1.0,"objective_suite_case_adversarial_transfer_attribute_balance_111p_final_score":183.0,"objective_suite_case_adversarial_transfer_attribute_balance_111p_normalized_score":1.0,"objective_suite_case_adversarial_transfer_attribute_balance_111p_reference_final_score":183.0,"objective_suite_case_adversarial_transfer_attribute_balance_111p_weight":1.0,"objective_suite_case_adversarial_transfer_attribute_balance_111p_weighted_contribution":1.0,"objective_suite_case_count":9.0,"objective_suite_case_representative_small_workshop_balanced_final_score":3.0,"objective_suite_case_representative_small_workshop_balanced_normalized_score":1.0,"objective_suite_case_representative_small_workshop_balanced_reference_final_score":3.0,"objective_suite_case_representative_small_workshop_balanced_weight":1.0,"objective_suite_case_representative_small_workshop_balanced_weighted_contribution":1.0,"objective_suite_case_representative_small_workshop_constrained_final_score":4.0,"objective_suite_case_representative_small_workshop_constrained_normalized_score":1.0,"objective_suite_case_representative_small_workshop_constrained_reference_final_score":4.0,"objective_suite_case_representative_small_workshop_constrained_weight":1.0,"objective_suite_case_representative_small_workshop_constrained_weighted_contribution":1.0,"objective_suite_case_stretch_kirkman_schoolgirls_15x5x7_final_score":44.0,"objective_suite_case_stretch_kirkman_schoolgirls_15x5x7_normalized_score":0.8,"objective_suite_case_stretch_kirkman_schoolgirls_15x5x7_reference_final_score":55.0,"objective_suite_case_stretch_kirkman_schoolgirls_15x5x7_weight":1.0,"objective_suite_case_stretch_kirkman_schoolgirls_15x5x7_weighted_contribution":0.8,"objective_suite_case_stretch_large_gender_immovable_110p_final_score":2102.0,"objective_suite_case_stretch_large_gender_immovable_110p_normalized_score":1.0,"objective_suite_case_stretch_large_gender_immovable_110p_reference_final_score":2102.0,"objective_suite_case_stretch_large_gender_immovable_110p_weight":1.0,"objective_suite_case_stretch_large_gender_immovable_110p_weighted_contribution":1.0,"objective_suite_case_stretch_sailing_trip_demo_real_final_score":4356.0,"objective_suite_case_stretch_sailing_trip_demo_real_normalized_score":0.9995410738871042,"objective_suite_case_stretch_sailing_trip_demo_real_reference_final_score":4358.0,"objective_suite_case_stretch_sailing_trip_demo_real_weight":1.0,"objective_suite_case_stretch_sailing_trip_demo_real_weighted_contribution":0.9995410738871042,"objective_suite_case_stretch_social_golfer_32x8x10_final_score":5262.0,"objective_suite_case_stretch_social_golfer_32x8x10_normalized_score":0.9728230726566833,"objective_suite_case_stretch_social_golfer_32x8x10_reference_final_score":5409.0,"objective_suite_case_stretch_social_golfer_32x8x10_weight":1.0,"objective_suite_case_stretch_social_golfer_32x8x10_weighted_contribution":0.9728230726566833,"objective_suite_case_stretch_synthetic_partial_attendance_capacity_pressure_152p_final_score":6497.0,"objective_suite_case_stretch_synthetic_partial_attendance_capacity_pressure_152p_normalized_score":1.0,"objective_suite_case_stretch_synthetic_partial_attendance_capacity_pressure_152p_reference_final_score":6497.0,"objective_suite_case_stretch_synthetic_partial_attendance_capacity_pressure_152p_weight":1.0,"objective_suite_case_stretch_synthetic_partial_attendance_capacity_pressure_152p_weighted_contribution":1.0,"objective_suite_external_validation_failures":0.0,"objective_suite_score_breakdown_mismatches":0.0,"objective_suite_total_final_score_raw":23216.0,"objective_suite_total_runtime_seconds":1350.000254349,"objective_suite_total_score_mismatches":0.0,"path_allowed_sessions_iter_us":0.683875,"path_avg_iter_us":0.901295,"path_clique_iter_us":1.5749499999999999,"path_construction_iter_us":1.040625,"path_swap_iter_us":0.7948999999999999,"path_transfer_iter_us":0.41212499999999996,"rep_avg_iter_us":1.2404282608695651,"rep_balanced_iter_us":1.3204,"rep_balanced_score":3.0,"rep_constrained_iter_us":1.1604565217391305,"rep_constrained_score":9.0,"runtime_canonical_share_percent":99.99855480071416,"runtime_total_seconds":1350.019764825,"solver3_raw_score_us":3.908327427536232,"swap_apply_us":0.20434375000000002,"swap_preview_us":0.33668750000000003,"transfer_apply_us":0.2575,"transfer_preview_us":0.18990625},"status":"discard","description":"Tried making adaptive raw-child retention much stricter on the pure-zero-repeat donor route by lowering keep_ratio from 0.5 to 0.25; Social Golfer held its gain but Kirkman regressed badly, so aggressive child pruning starves the mechanism.","timestamp":1776151409145,"segment":0,"confidence":51.71531229185015,"iterationTokens":6945}
{"run":15,"commit":"09f897c","metric":88.58182385048653,"metrics":{"clique_apply_us":0.20416666666666666,"clique_preview_us":0.5437083333333333,"correctness_suite_average_runtime_seconds":0.006948102,"correctness_suite_case_count":4.0,"correctness_suite_external_validation_failures":0.0,"correctness_suite_total_runtime_seconds":0.027792408,"correctness_suite_total_score_mismatches":0.0,"hotpath_total_us":1.765625,"metaheuristic_fixed_iteration_weighted_normalized_score":95.38300363591544,"metaheuristic_fixed_iteration_weighted_normalized_score_delta_from_reference":-4.616996364084558,"metaheuristic_fixed_iteration_weighted_normalized_score_weight_sum":9.0,"metaheuristic_suite_weighted_normalized_score":88.58182385048653,"metaheuristic_suite_weighted_normalized_score_delta_from_reference":-11.41817614951347,"metaheuristic_suite_weighted_normalized_score_weight_sum":9.0,"objective_fixed_iteration_average_final_score_raw":2591.777777777778,"objective_fixed_iteration_average_runtime_seconds":12.966272323444445,"objective_fixed_iteration_case_adversarial_clique_swap_functionality_35p_final_score":4765.0,"objective_fixed_iteration_case_adversarial_clique_swap_functionality_35p_normalized_score":1.0,"objective_fixed_iteration_case_adversarial_clique_swap_functionality_35p_reference_final_score":4765.0,"objective_fixed_iteration_case_adversarial_clique_swap_functionality_35p_weight":1.0,"objective_fixed_iteration_case_adversarial_clique_swap_functionality_35p_weighted_contribution":1.0,"objective_fixed_iteration_case_adversarial_transfer_attribute_balance_111p_final_score":194.0,"objective_fixed_iteration_case_adversarial_transfer_attribute_balance_111p_normalized_score":1.0,"objective_fixed_iteration_case_adversarial_transfer_attribute_balance_111p_reference_final_score":194.0,"objective_fixed_iteration_case_adversarial_transfer_attribute_balance_111p_weight":1.0,"objective_fixed_iteration_case_adversarial_transfer_attribute_balance_111p_weighted_contribution":1.0,"objective_fixed_iteration_case_count":9.0,"objective_fixed_iteration_case_representative_small_workshop_balanced_final_score":3.0,"objective_fixed_iteration_case_representative_small_workshop_balanced_normalized_score":1.0,"objective_fixed_iteration_case_representative_small_workshop_balanced_reference_final_score":3.0,"objective_fixed_iteration_case_representative_small_workshop_balanced_weight":1.0,"objective_fixed_iteration_case_representative_small_workshop_balanced_weighted_contribution":1.0,"objective_fixed_iteration_case_representative_small_workshop_constrained_final_score":4.0,"objective_fixed_iteration_case_representative_small_workshop_constrained_normalized_score":1.0,"objective_fixed_iteration_case_representative_small_workshop_constrained_reference_final_score":4.0,"objective_fixed_iteration_case_representative_small_workshop_constrained_weight":1.0,"objective_fixed_iteration_case_representative_small_workshop_constrained_weighted_contribution":1.0,"objective_fixed_iteration_case_stretch_kirkman_schoolgirls_15x5x7_final_score":33.0,"objective_fixed_iteration_case_stretch_kirkman_schoolgirls_15x5x7_normalized_score":0.6,"objective_fixed_iteration_case_stretch_kirkman_schoolgirls_15x5x7_reference_final_score":55.0,"objective_fixed_iteration_case_stretch_kirkman_schoolgirls_15x5x7_weight":1.0,"objective_fixed_iteration_case_stretch_kirkman_schoolgirls_15x5x7_weighted_contribution":0.6,"objective_fixed_iteration_case_stretch_large_gender_immovable_110p_final_score":2102.0,"objective_fixed_iteration_case_stretch_large_gender_immovable_110p_normalized_score":1.0,"objective_fixed_iteration_case_stretch_large_gender_immovable_110p_reference_final_score":2102.0,"objective_fixed_iteration_case_stretch_large_gender_immovable_110p_weight":1.0,"objective_fixed_iteration_case_stretch_large_gender_immovable_110p_weighted_contribution":1.0,"objective_fixed_iteration_case_stretch_sailing_trip_demo_real_final_score":4362.0,"objective_fixed_iteration_case_stretch_sailing_trip_demo_real_normalized_score":1.0,"objective_fixed_iteration_case_stretch_sailing_trip_demo_real_reference_final_score":4362.0,"objective_fixed_iteration_case_stretch_sailing_trip_demo_real_weight":1.0,"objective_fixed_iteration_case_stretch_sailing_trip_demo_real_weighted_contribution":1.0,"objective_fixed_iteration_case_stretch_social_golfer_32x8x10_final_score":5325.0,"objective_fixed_iteration_case_stretch_social_golfer_32x8x10_normalized_score":0.9844703272323905,"objective_fixed_iteration_case_stretch_social_golfer_32x8x10_reference_final_score":5409.0,"objective_fixed_iteration_case_stretch_social_golfer_32x8x10_weight":1.0,"objective_fixed_iteration_case_stretch_social_golfer_32x8x10_weighted_contribution":0.9844703272323905,"objective_fixed_iteration_case_stretch_synthetic_partial_attendance_capacity_pressure_152p_final_score":6538.0,"objective_fixed_iteration_case_stretch_synthetic_partial_attendance_capacity_pressure_152p_normalized_score":1.0,"objective_fixed_iteration_case_stretch_synthetic_partial_attendance_capacity_pressure_152p_reference_final_score":6538.0,"objective_fixed_iteration_case_stretch_synthetic_partial_attendance_capacity_pressure_152p_weight":1.0,"objective_fixed_iteration_case_stretch_synthetic_partial_attendance_capacity_pressure_152p_weighted_contribution":1.0,"objective_fixed_iteration_external_validation_failures":0.0,"objective_fixed_iteration_score_breakdown_mismatches":0.0,"objective_fixed_iteration_total_final_score_raw":23326.0,"objective_fixed_iteration_total_runtime_seconds":116.696450911,"objective_fixed_iteration_total_score_mismatches":0.0,"objective_suite_average_final_score_raw":2574.6666666666665,"objective_suite_average_runtime_seconds":150.00005306622222,"objective_suite_case_adversarial_clique_swap_functionality_35p_final_score":4765.0,"objective_suite_case_adversarial_clique_swap_functionality_35p_normalized_score":1.0,"objective_suite_case_adversarial_clique_swap_functionality_35p_reference_final_score":4765.0,"objective_suite_case_adversarial_clique_swap_functionality_35p_weight":1.0,"objective_suite_case_adversarial_clique_swap_functionality_35p_weighted_contribution":1.0,"objective_suite_case_adversarial_transfer_attribute_balance_111p_final_score":183.0,"objective_suite_case_adversarial_transfer_attribute_balance_111p_normalized_score":1.0,"objective_suite_case_adversarial_transfer_attribute_balance_111p_reference_final_score":183.0,"objective_suite_case_adversarial_transfer_attribute_balance_111p_weight":1.0,"objective_suite_case_adversarial_transfer_attribute_balance_111p_weighted_contribution":1.0,"objective_suite_case_count":9.0,"objective_suite_case_representative_small_workshop_balanced_final_score":3.0,"objective_suite_case_representative_small_workshop_balanced_normalized_score":1.0,"objective_suite_case_representative_small_workshop_balanced_reference_final_score":3.0,"objective_suite_case_representative_small_workshop_balanced_weight":1.0,"objective_suite_case_representative_small_workshop_balanced_weighted_contribution":1.0,"objective_suite_case_representative_small_workshop_constrained_final_score":4.0,"objective_suite_case_representative_small_workshop_constrained_normalized_score":1.0,"objective_suite_case_representative_small_workshop_constrained_reference_final_score":4.0,"objective_suite_case_representative_small_workshop_constrained_weight":1.0,"objective_suite_case_representative_small_workshop_constrained_weighted_contribution":1.0,"objective_suite_case_stretch_kirkman_schoolgirls_15x5x7_final_score":0.0,"objective_suite_case_stretch_kirkman_schoolgirls_15x5x7_normalized_score":0.0,"objective_suite_case_stretch_kirkman_schoolgirls_15x5x7_reference_final_score":55.0,"objective_suite_case_stretch_kirkman_schoolgirls_15x5x7_weight":1.0,"objective_suite_case_stretch_kirkman_schoolgirls_15x5x7_weighted_contribution":0.0,"objective_suite_case_stretch_large_gender_immovable_110p_final_score":2102.0,"objective_suite_case_stretch_large_gender_immovable_110p_normalized_score":1.0,"objective_suite_case_stretch_large_gender_immovable_110p_reference_final_score":2102.0,"objective_suite_case_stretch_large_gender_immovable_110p_weight":1.0,"objective_suite_case_stretch_large_gender_immovable_110p_weighted_contribution":1.0,"objective_suite_case_stretch_sailing_trip_demo_real_final_score":4356.0,"objective_suite_case_stretch_sailing_trip_demo_real_normalized_score":0.9995410738871042,"objective_suite_case_stretch_sailing_trip_demo_real_reference_final_score":4358.0,"objective_suite_case_stretch_sailing_trip_demo_real_weight":1.0,"objective_suite_case_stretch_sailing_trip_demo_real_weighted_contribution":0.9995410738871042,"objective_suite_case_stretch_social_golfer_32x8x10_final_score":5262.0,"objective_suite_case_stretch_social_golfer_32x8x10_normalized_score":0.9728230726566833,"objective_suite_case_stretch_social_golfer_32x8x10_reference_final_score":5409.0,"objective_suite_case_stretch_social_golfer_32x8x10_weight":1.0,"objective_suite_case_stretch_social_golfer_32x8x10_weighted_contribution":0.9728230726566833,"objective_suite_case_stretch_synthetic_partial_attendance_capacity_pressure_152p_final_score":6497.0,"objective_suite_case_stretch_synthetic_partial_attendance_capacity_pressure_152p_normalized_score":1.0,"objective_suite_case_stretch_synthetic_partial_attendance_capacity_pressure_152p_reference_final_score":6497.0,"objective_suite_case_stretch_synthetic_partial_attendance_capacity_pressure_152p_weight":1.0,"objective_suite_case_stretch_synthetic_partial_attendance_capacity_pressure_152p_weighted_contribution":1.0,"objective_suite_external_validation_failures":0.0,"objective_suite_score_breakdown_mismatches":0.0,"objective_suite_total_final_score_raw":23172.0,"objective_suite_total_runtime_seconds":1350.000477596,"objective_suite_total_score_mismatches":0.0,"path_allowed_sessions_iter_us":0.6634249999999999,"path_avg_iter_us":0.76317,"path_clique_iter_us":0.9714,"path_construction_iter_us":1.01865,"path_swap_iter_us":0.7609,"path_transfer_iter_us":0.401475,"rep_avg_iter_us":0.965511231884058,"rep_balanced_iter_us":1.0092833333333333,"rep_balanced_score":3.0,"rep_constrained_iter_us":0.9217391304347826,"rep_constrained_score":9.0,"runtime_canonical_share_percent":99.99794134622087,"runtime_total_seconds":1350.028270004,"solver3_raw_score_us":3.494306231884058,"swap_apply_us":0.20364062500000002,"swap_preview_us":0.3255,"transfer_apply_us":0.30054687500000005,"transfer_preview_us":0.1880625},"status":"discard","description":"Tried an asymmetric pure-zero-repeat donor trigger policy with recombination_no_improvement_window=10000 and recombination_cooldown_window=5000; it was effectively inert and reproduced the current champion's objective metrics.","timestamp":1776152977420,"segment":0,"confidence":58.05739142939328,"iterationTokens":8016}
