{"run":23,"commit":"903743d","metric":101.6318905132714,"metrics":{"clique_apply_us":2.843354166666667,"clique_preview_us":12.991458333333334,"correctness_suite_average_runtime_seconds":0.18800010325,"correctness_suite_case_count":4.0,"correctness_suite_external_validation_failures":0.0,"correctness_suite_total_runtime_seconds":0.752000413,"correctness_suite_total_score_mismatches":0.0,"hotpath_total_us":33.43140625,"objective_fixed_iteration_average_final_score_raw":3601.1666666666665,"objective_fixed_iteration_average_runtime_seconds":50.79438882633333,"objective_fixed_iteration_case_adversarial_clique_swap_functionality_35p_final_score":4765.0,"objective_fixed_iteration_case_adversarial_clique_swap_functionality_35p_normalized_score":1.001892346509672,"objective_fixed_iteration_case_adversarial_clique_swap_functionality_35p_reference_final_score":4756.0,"objective_fixed_iteration_case_adversarial_clique_swap_functionality_35p_weight":1.0,"objective_fixed_iteration_case_adversarial_clique_swap_functionality_35p_weighted_contribution":1.001892346509672,"objective_fixed_iteration_case_adversarial_transfer_attribute_balance_111p_final_score":199.0,"objective_fixed_iteration_case_adversarial_transfer_attribute_balance_111p_normalized_score":0.9754901960784313,"objective_fixed_iteration_case_adversarial_transfer_attribute_balance_111p_reference_final_score":204.0,"objective_fixed_iteration_case_adversarial_transfer_attribute_balance_111p_weight":1.0,"objective_fixed_iteration_case_adversarial_transfer_attribute_balance_111p_weighted_contribution":0.9754901960784313,"objective_fixed_iteration_case_count":6.0,"objective_fixed_iteration_case_stretch_large_gender_immovable_110p_final_score":2256.0,"objective_fixed_iteration_case_stretch_large_gender_immovable_110p_normalized_score":1.0566744730679156,"objective_fixed_iteration_case_stretch_large_gender_immovable_110p_reference_final_score":2135.0,"objective_fixed_iteration_case_stretch_large_gender_immovable_110p_weight":1.0,"objective_fixed_iteration_case_stretch_large_gender_immovable_110p_weighted_contribution":1.0566744730679156,"objective_fixed_iteration_case_stretch_sailing_trip_demo_real_final_score":2372.0,"objective_fixed_iteration_case_stretch_sailing_trip_demo_real_normalized_score":1.0684684684684684,"objective_fixed_iteration_case_stretch_sailing_trip_demo_real_reference_final_score":2220.0,"objective_fixed_iteration_case_stretch_sailing_trip_demo_real_weight":1.0,"objective_fixed_iteration_case_stretch_sailing_trip_demo_real_weighted_contribution":1.0684684684684684,"objective_fixed_iteration_case_stretch_social_golfer_32x8x10_final_score":5451.0,"objective_fixed_iteration_case_stretch_social_golfer_32x8x10_normalized_score":0.9923539049699618,"objective_fixed_iteration_case_stretch_social_golfer_32x8x10_reference_final_score":5493.0,"objective_fixed_iteration_case_stretch_social_golfer_32x8x10_weight":1.0,"objective_fixed_iteration_case_stretch_social_golfer_32x8x10_weighted_contribution":0.9923539049699618,"objective_fixed_iteration_case_stretch_synthetic_partial_attendance_capacity_pressure_152p_final_score":6564.0,"objective_fixed_iteration_case_stretch_synthetic_partial_attendance_capacity_pressure_152p_normalized_score":0.991391028545537,"objective_fixed_iteration_case_stretch_synthetic_partial_attendance_capacity_pressure_152p_reference_final_score":6621.0,"objective_fixed_iteration_case_stretch_synthetic_partial_attendance_capacity_pressure_152p_weight":1.0,"objective_fixed_iteration_case_stretch_synthetic_partial_attendance_capacity_pressure_152p_weighted_contribution":0.991391028545537,"objective_fixed_iteration_external_validation_failures":0.0,"objective_fixed_iteration_score_breakdown_mismatches":0.0,"objective_fixed_iteration_total_final_score_raw":21607.0,"objective_fixed_iteration_total_runtime_seconds":304.766332958,"objective_fixed_iteration_total_score_mismatches":0.0,"objective_fixed_iteration_weighted_normalized_score":101.43784029399978,"objective_fixed_iteration_weighted_normalized_score_delta_from_reference":1.4378402939997814,"objective_fixed_iteration_weighted_normalized_score_weight_sum":6.0,"objective_suite_average_final_score_raw":3620.6666666666665,"objective_suite_average_runtime_seconds":15.6681530095,"objective_suite_case_adversarial_clique_swap_functionality_35p_final_score":4765.0,"objective_suite_case_adversarial_clique_swap_functionality_35p_normalized_score":1.001892346509672,"objective_suite_case_adversarial_clique_swap_functionality_35p_reference_final_score":4756.0,"objective_suite_case_adversarial_clique_swap_functionality_35p_weight":1.0,"objective_suite_case_adversarial_clique_swap_functionality_35p_weighted_contribution":1.001892346509672,"objective_suite_case_adversarial_transfer_attribute_balance_111p_final_score":207.0,"objective_suite_case_adversarial_transfer_attribute_balance_111p_normalized_score":1.0454545454545454,"objective_suite_case_adversarial_transfer_attribute_balance_111p_reference_final_score":198.0,"objective_suite_case_adversarial_transfer_attribute_balance_111p_weight":1.0,"objective_suite_case_adversarial_transfer_attribute_balance_111p_weighted_contribution":1.0454545454545454,"objective_suite_case_count":6.0,"objective_suite_case_stretch_large_gender_immovable_110p_final_score":2333.0,"objective_suite_case_stretch_large_gender_immovable_110p_normalized_score":1.0706746213859568,"objective_suite_case_stretch_large_gender_immovable_110p_reference_final_score":2179.0,"objective_suite_case_stretch_large_gender_immovable_110p_weight":1.0,"objective_suite_case_stretch_large_gender_immovable_110p_weighted_contribution":1.0706746213859568,"objective_suite_case_stretch_sailing_trip_demo_real_final_score":2383.0,"objective_suite_case_stretch_sailing_trip_demo_real_normalized_score":0.9958211450062683,"objective_suite_case_stretch_sailing_trip_demo_real_reference_final_score":2393.0,"objective_suite_case_stretch_sailing_trip_demo_real_weight":1.0,"objective_suite_case_stretch_sailing_trip_demo_real_weighted_contribution":0.9958211450062683,"objective_suite_case_stretch_social_golfer_32x8x10_final_score":5451.0,"objective_suite_case_stretch_social_golfer_32x8x10_normalized_score":0.9923539049699618,"objective_suite_case_stretch_social_golfer_32x8x10_reference_final_score":5493.0,"objective_suite_case_stretch_social_golfer_32x8x10_weight":1.0,"objective_suite_case_stretch_social_golfer_32x8x10_weighted_contribution":0.9923539049699618,"objective_suite_case_stretch_synthetic_partial_attendance_capacity_pressure_152p_final_score":6585.0,"objective_suite_case_stretch_synthetic_partial_attendance_capacity_pressure_152p_normalized_score":0.9917168674698795,"objective_suite_case_stretch_synthetic_partial_attendance_capacity_pressure_152p_reference_final_score":6640.0,"objective_suite_case_stretch_synthetic_partial_attendance_capacity_pressure_152p_weight":1.0,"objective_suite_case_stretch_synthetic_partial_attendance_capacity_pressure_152p_weighted_contribution":0.9917168674698795,"objective_suite_external_validation_failures":0.0,"objective_suite_score_breakdown_mismatches":0.0,"objective_suite_total_final_score_raw":21724.0,"objective_suite_total_runtime_seconds":94.008918057,"objective_suite_total_score_mismatches":0.0,"objective_suite_weighted_normalized_score":101.6318905132714,"objective_suite_weighted_normalized_score_delta_from_reference":1.6318905132713946,"objective_suite_weighted_normalized_score_weight_sum":6.0,"path_allowed_sessions_iter_us":53.636874999999996,"path_avg_iter_us":22.72974,"path_clique_iter_us":18.042525,"path_construction_iter_us":21.774475000000002,"path_swap_iter_us":11.5995,"path_transfer_iter_us":8.595324999999999,"rep_avg_iter_us":29.869085185185185,"rep_balanced_iter_us":28.119966666666667,"rep_balanced_score":3.0,"rep_constrained_iter_us":31.618203703703703,"rep_constrained_score":4.0,"runtime_canonical_share_percent":99.20642346534655,"runtime_total_seconds":94.76091847000001,"solver3_raw_score_us":86.03023143518519,"swap_apply_us":2.44328125,"swap_preview_us":6.621515625000001,"transfer_apply_us":2.349234375,"transfer_preview_us":6.1825624999999995},"status":"discard","description":"Second freedom-aware GRASP incubation follow-up: kept the solver3-local constructor repair idea but focused it on the top attribute-pressure sessions only, rebuilding those sessions with a balance-heavy greedy/RCL pass after baseline construction. This shifted quality toward sailing and synthetic, but the aggregate regressed badly because transfer-balance and large_gender worsened, so the current balance-focused constructor follow-up is not worth keeping.","timestamp":1775667665085,"segment":0,"confidence":400.66017609684997,"iterationTokens":16152,"asi":{"hypothesis":"A balance-focused GRASP rebuild on only the top attribute-pressure sessions will preserve the first GRASP variant's synthetic gains while improving the balance-heavy cases that blocked it.","rollback_reason":"The focused balance-rebuild follow-up regressed to 101.6319 and worsened large_gender materially, so this follow-up is not a keep.","next_action_hint":"The GRASP family may need a different balance signal or selective partial rebuild to avoid harming large_gender; otherwise shift back to the still-best memetic family or synthesize a genuinely new architecture.","mechanism_family":"freedom-aware GRASP-style constructor follow-up","failure_shape":{"first_grasp_run":"101.12849020088026","balance_focused_followup":"101.6318905132714","large_gender_normalized":"1.0706746213859568","sailing_normalized":"0.9958211450062683","synthetic_partial_normalized":"0.9917168674698795"}}}
{"run":24,"commit":"903743d","metric":101.36453368202842,"metrics":{"clique_apply_us":2.731875,"clique_preview_us":13.287020833333333,"correctness_suite_average_runtime_seconds":0.23686258275,"correctness_suite_case_count":4.0,"correctness_suite_external_validation_failures":0.0,"correctness_suite_total_runtime_seconds":0.947450331,"correctness_suite_total_score_mismatches":0.0,"hotpath_total_us":31.07847395833333,"objective_fixed_iteration_average_final_score_raw":3607.6666666666665,"objective_fixed_iteration_average_runtime_seconds":50.83079312816667,"objective_fixed_iteration_case_adversarial_clique_swap_functionality_35p_final_score":4765.0,"objective_fixed_iteration_case_adversarial_clique_swap_functionality_35p_normalized_score":1.001892346509672,"objective_fixed_iteration_case_adversarial_clique_swap_functionality_35p_reference_final_score":4756.0,"objective_fixed_iteration_case_adversarial_clique_swap_functionality_35p_weight":1.0,"objective_fixed_iteration_case_adversarial_clique_swap_functionality_35p_weighted_contribution":1.001892346509672,"objective_fixed_iteration_case_adversarial_transfer_attribute_balance_111p_final_score":197.0,"objective_fixed_iteration_case_adversarial_transfer_attribute_balance_111p_normalized_score":0.9656862745098039,"objective_fixed_iteration_case_adversarial_transfer_attribute_balance_111p_reference_final_score":204.0,"objective_fixed_iteration_case_adversarial_transfer_attribute_balance_111p_weight":1.0,"objective_fixed_iteration_case_adversarial_transfer_attribute_balance_111p_weighted_contribution":0.9656862745098039,"objective_fixed_iteration_case_count":6.0,"objective_fixed_iteration_case_stretch_large_gender_immovable_110p_final_score":2157.0,"objective_fixed_iteration_case_stretch_large_gender_immovable_110p_normalized_score":1.010304449648712,"objective_fixed_iteration_case_stretch_large_gender_immovable_110p_reference_final_score":2135.0,"objective_fixed_iteration_case_stretch_large_gender_immovable_110p_weight":1.0,"objective_fixed_iteration_case_stretch_large_gender_immovable_110p_weighted_contribution":1.010304449648712,"objective_fixed_iteration_case_stretch_sailing_trip_demo_real_final_score":2298.0,"objective_fixed_iteration_case_stretch_sailing_trip_demo_real_normalized_score":1.0351351351351352,"objective_fixed_iteration_case_stretch_sailing_trip_demo_real_reference_final_score":2220.0,"objective_fixed_iteration_case_stretch_sailing_trip_demo_real_weight":1.0,"objective_fixed_iteration_case_stretch_sailing_trip_demo_real_weighted_contribution":1.0351351351351352,"objective_fixed_iteration_case_stretch_social_golfer_32x8x10_final_score":5451.0,"objective_fixed_iteration_case_stretch_social_golfer_32x8x10_normalized_score":0.9923539049699618,"objective_fixed_iteration_case_stretch_social_golfer_32x8x10_reference_final_score":5493.0,"objective_fixed_iteration_case_stretch_social_golfer_32x8x10_weight":1.0,"objective_fixed_iteration_case_stretch_social_golfer_32x8x10_weighted_contribution":0.9923539049699618,"objective_fixed_iteration_case_stretch_synthetic_partial_attendance_capacity_pressure_152p_final_score":6778.0,"objective_fixed_iteration_case_stretch_synthetic_partial_attendance_capacity_pressure_152p_normalized_score":1.0237124301465035,"objective_fixed_iteration_case_stretch_synthetic_partial_attendance_capacity_pressure_152p_reference_final_score":6621.0,"objective_fixed_iteration_case_stretch_synthetic_partial_attendance_capacity_pressure_152p_weight":1.0,"objective_fixed_iteration_case_stretch_synthetic_partial_attendance_capacity_pressure_152p_weighted_contribution":1.0237124301465035,"objective_fixed_iteration_external_validation_failures":0.0,"objective_fixed_iteration_score_breakdown_mismatches":0.0,"objective_fixed_iteration_total_final_score_raw":21646.0,"objective_fixed_iteration_total_runtime_seconds":304.984758769,"objective_fixed_iteration_total_score_mismatches":0.0,"objective_fixed_iteration_weighted_normalized_score":100.48474234866313,"objective_fixed_iteration_weighted_normalized_score_delta_from_reference":0.48474234866313637,"objective_fixed_iteration_weighted_normalized_score_weight_sum":6.0,"objective_suite_average_final_score_raw":3639.0,"objective_suite_average_runtime_seconds":15.668712190666666,"objective_suite_case_adversarial_clique_swap_functionality_35p_final_score":4765.0,"objective_suite_case_adversarial_clique_swap_functionality_35p_normalized_score":1.001892346509672,"objective_suite_case_adversarial_clique_swap_functionality_35p_reference_final_score":4756.0,"objective_suite_case_adversarial_clique_swap_functionality_35p_weight":1.0,"objective_suite_case_adversarial_clique_swap_functionality_35p_weighted_contribution":1.001892346509672,"objective_suite_case_adversarial_transfer_attribute_balance_111p_final_score":204.0,"objective_suite_case_adversarial_transfer_attribute_balance_111p_normalized_score":1.0303030303030303,"objective_suite_case_adversarial_transfer_attribute_balance_111p_reference_final_score":198.0,"objective_suite_case_adversarial_transfer_attribute_balance_111p_weight":1.0,"objective_suite_case_adversarial_transfer_attribute_balance_111p_weighted_contribution":1.0303030303030303,"objective_suite_case_count":6.0,"objective_suite_case_stretch_large_gender_immovable_110p_final_score":2333.0,"objective_suite_case_stretch_large_gender_immovable_110p_normalized_score":1.0706746213859568,"objective_suite_case_stretch_large_gender_immovable_110p_reference_final_score":2179.0,"objective_suite_case_stretch_large_gender_immovable_110p_weight":1.0,"objective_suite_case_stretch_large_gender_immovable_110p_weighted_contribution":1.0706746213859568,"objective_suite_case_stretch_sailing_trip_demo_real_final_score":2316.0,"objective_suite_case_stretch_sailing_trip_demo_real_normalized_score":0.9678228165482657,"objective_suite_case_stretch_sailing_trip_demo_real_reference_final_score":2393.0,"objective_suite_case_stretch_sailing_trip_demo_real_weight":1.0,"objective_suite_case_stretch_sailing_trip_demo_real_weighted_contribution":0.9678228165482657,"objective_suite_case_stretch_social_golfer_32x8x10_final_score":5451.0,"objective_suite_case_stretch_social_golfer_32x8x10_normalized_score":0.9923539049699618,"objective_suite_case_stretch_social_golfer_32x8x10_reference_final_score":5493.0,"objective_suite_case_stretch_social_golfer_32x8x10_weight":1.0,"objective_suite_case_stretch_social_golfer_32x8x10_weighted_contribution":0.9923539049699618,"objective_suite_case_stretch_synthetic_partial_attendance_capacity_pressure_152p_final_score":6765.0,"objective_suite_case_stretch_synthetic_partial_attendance_capacity_pressure_152p_normalized_score":1.0188253012048192,"objective_suite_case_stretch_synthetic_partial_attendance_capacity_pressure_152p_reference_final_score":6640.0,"objective_suite_case_stretch_synthetic_partial_attendance_capacity_pressure_152p_weight":1.0,"objective_suite_case_stretch_synthetic_partial_attendance_capacity_pressure_152p_weighted_contribution":1.0188253012048192,"objective_suite_external_validation_failures":0.0,"objective_suite_score_breakdown_mismatches":0.0,"objective_suite_total_final_score_raw":21834.0,"objective_suite_total_runtime_seconds":94.012273144,"objective_suite_total_score_mismatches":0.0,"objective_suite_weighted_normalized_score":101.36453368202842,"objective_suite_weighted_normalized_score_delta_from_reference":1.3645336820284237,"objective_suite_weighted_normalized_score_weight_sum":6.0,"path_allowed_sessions_iter_us":25.484675000000003,"path_avg_iter_us":18.18775,"path_clique_iter_us":19.244875,"path_construction_iter_us":25.405974999999998,"path_swap_iter_us":11.902775,"path_transfer_iter_us":8.90045,"rep_avg_iter_us":30.23145462962963,"rep_balanced_iter_us":28.666316666666667,"rep_balanced_score":3.0,"rep_constrained_iter_us":31.796592592592592,"rep_constrained_score":4.0,"runtime_canonical_share_percent":99.00226085720497,"runtime_total_seconds":94.959723475,"solver3_raw_score_us":79.49767858796295,"swap_apply_us":2.231765625,"swap_preview_us":6.75490625,"transfer_apply_us":2.233796875,"transfer_preview_us":3.839109375},"status":"discard","description":"Population-lite memetic archive follow-up: added an in-run elite archive intended to reuse diverse high-quality states discovered during the same search as additional donors for the stagnation-triggered memetic burst. On this first implementation the benchmark matched the earlier two-donor baseline-like behavior exactly, implying the archive was not accumulating materially distinct elite donors before the burst and therefore contributed no useful new recombination power.","timestamp":1775668459629,"segment":0,"confidence":399.2289220786136,"iterationTokens":14944,"asi":{"hypothesis":"A lightweight elite archive of diverse within-run high-quality states can make the memetic burst more like a real population search and improve donor quality without extra constructor fragmentation.","rollback_reason":"The first elite-archive implementation produced no primary improvement and appears effectively inert in practice, so there is nothing to keep from this cycle.","next_action_hint":"If continuing this population-lite direction, make archive insertion much more aggressive or structurally aware so the burst actually has distinct donor states to choose from; otherwise pivot to a different substantial idea.","mechanism_family":"population-lite memetic elite archive","failure_shape":{"current_keep":"100.84622890492095","elite_archive_followup":"101.36453368202842","symptom":"archive likely contained no materially distinct donor states by burst time"}}}
