{"run":10,"commit":"295db0c","metric":101.00309805837642,"metrics":{"clique_apply_us":1.0661250000000002,"clique_preview_us":6.9521041666666665,"correctness_suite_average_runtime_seconds":0.105824772,"correctness_suite_case_count":4.0,"correctness_suite_external_validation_failures":0.0,"correctness_suite_total_runtime_seconds":0.423299088,"correctness_suite_total_score_mismatches":0.0,"hotpath_total_us":15.115260416666665,"objective_fixed_iteration_average_final_score_raw":3624.5,"objective_fixed_iteration_average_runtime_seconds":43.362657017833335,"objective_fixed_iteration_case_adversarial_clique_swap_functionality_35p_final_score":4756.0,"objective_fixed_iteration_case_adversarial_clique_swap_functionality_35p_normalized_score":1.0,"objective_fixed_iteration_case_adversarial_clique_swap_functionality_35p_reference_final_score":4756.0,"objective_fixed_iteration_case_adversarial_clique_swap_functionality_35p_weight":1.0,"objective_fixed_iteration_case_adversarial_clique_swap_functionality_35p_weighted_contribution":1.0,"objective_fixed_iteration_case_adversarial_transfer_attribute_balance_111p_final_score":205.0,"objective_fixed_iteration_case_adversarial_transfer_attribute_balance_111p_normalized_score":1.0049019607843137,"objective_fixed_iteration_case_adversarial_transfer_attribute_balance_111p_reference_final_score":204.0,"objective_fixed_iteration_case_adversarial_transfer_attribute_balance_111p_weight":1.0,"objective_fixed_iteration_case_adversarial_transfer_attribute_balance_111p_weighted_contribution":1.0049019607843137,"objective_fixed_iteration_case_count":6.0,"objective_fixed_iteration_case_stretch_large_gender_immovable_110p_final_score":2201.0,"objective_fixed_iteration_case_stretch_large_gender_immovable_110p_normalized_score":1.0309133489461357,"objective_fixed_iteration_case_stretch_large_gender_immovable_110p_reference_final_score":2135.0,"objective_fixed_iteration_case_stretch_large_gender_immovable_110p_weight":1.0,"objective_fixed_iteration_case_stretch_large_gender_immovable_110p_weighted_contribution":1.0309133489461357,"objective_fixed_iteration_case_stretch_sailing_trip_demo_real_final_score":2461.0,"objective_fixed_iteration_case_stretch_sailing_trip_demo_real_normalized_score":1.1085585585585584,"objective_fixed_iteration_case_stretch_sailing_trip_demo_real_reference_final_score":2220.0,"objective_fixed_iteration_case_stretch_sailing_trip_demo_real_weight":1.0,"objective_fixed_iteration_case_stretch_sailing_trip_demo_real_weighted_contribution":1.1085585585585584,"objective_fixed_iteration_case_stretch_social_golfer_32x8x10_final_score":5472.0,"objective_fixed_iteration_case_stretch_social_golfer_32x8x10_normalized_score":0.9961769524849808,"objective_fixed_iteration_case_stretch_social_golfer_32x8x10_reference_final_score":5493.0,"objective_fixed_iteration_case_stretch_social_golfer_32x8x10_weight":1.0,"objective_fixed_iteration_case_stretch_social_golfer_32x8x10_weighted_contribution":0.9961769524849808,"objective_fixed_iteration_case_stretch_synthetic_partial_attendance_capacity_pressure_152p_final_score":6652.0,"objective_fixed_iteration_case_stretch_synthetic_partial_attendance_capacity_pressure_152p_normalized_score":1.0046820721945326,"objective_fixed_iteration_case_stretch_synthetic_partial_attendance_capacity_pressure_152p_reference_final_score":6621.0,"objective_fixed_iteration_case_stretch_synthetic_partial_attendance_capacity_pressure_152p_weight":1.0,"objective_fixed_iteration_case_stretch_synthetic_partial_attendance_capacity_pressure_152p_weighted_contribution":1.0046820721945326,"objective_fixed_iteration_external_validation_failures":0.0,"objective_fixed_iteration_score_breakdown_mismatches":0.0,"objective_fixed_iteration_total_final_score_raw":21747.0,"objective_fixed_iteration_total_runtime_seconds":260.17594210699997,"objective_fixed_iteration_total_score_mismatches":0.0,"objective_fixed_iteration_weighted_normalized_score":102.42054821614201,"objective_fixed_iteration_weighted_normalized_score_delta_from_reference":2.4205482161420155,"objective_fixed_iteration_weighted_normalized_score_weight_sum":6.0,"objective_suite_average_final_score_raw":3631.0,"objective_suite_average_runtime_seconds":15.667431224333333,"objective_suite_case_adversarial_clique_swap_functionality_35p_final_score":4756.0,"objective_suite_case_adversarial_clique_swap_functionality_35p_normalized_score":1.0,"objective_suite_case_adversarial_clique_swap_functionality_35p_reference_final_score":4756.0,"objective_suite_case_adversarial_clique_swap_functionality_35p_weight":1.0,"objective_suite_case_adversarial_clique_swap_functionality_35p_weighted_contribution":1.0,"objective_suite_case_adversarial_transfer_attribute_balance_111p_final_score":199.0,"objective_suite_case_adversarial_transfer_attribute_balance_111p_normalized_score":1.005050505050505,"objective_suite_case_adversarial_transfer_attribute_balance_111p_reference_final_score":198.0,"objective_suite_case_adversarial_transfer_attribute_balance_111p_weight":1.0,"objective_suite_case_adversarial_transfer_attribute_balance_111p_weighted_contribution":1.005050505050505,"objective_suite_case_count":6.0,"objective_suite_case_stretch_large_gender_immovable_110p_final_score":2223.0,"objective_suite_case_stretch_large_gender_immovable_110p_normalized_score":1.0201927489674163,"objective_suite_case_stretch_large_gender_immovable_110p_reference_final_score":2179.0,"objective_suite_case_stretch_large_gender_immovable_110p_weight":1.0,"objective_suite_case_stretch_large_gender_immovable_110p_weighted_contribution":1.0201927489674163,"objective_suite_case_stretch_sailing_trip_demo_real_final_score":2480.0,"objective_suite_case_stretch_sailing_trip_demo_real_normalized_score":1.036356038445466,"objective_suite_case_stretch_sailing_trip_demo_real_reference_final_score":2393.0,"objective_suite_case_stretch_sailing_trip_demo_real_weight":1.0,"objective_suite_case_stretch_sailing_trip_demo_real_weighted_contribution":1.036356038445466,"objective_suite_case_stretch_social_golfer_32x8x10_final_score":5472.0,"objective_suite_case_stretch_social_golfer_32x8x10_normalized_score":0.9961769524849808,"objective_suite_case_stretch_social_golfer_32x8x10_reference_final_score":5493.0,"objective_suite_case_stretch_social_golfer_32x8x10_weight":1.0,"objective_suite_case_stretch_social_golfer_32x8x10_weighted_contribution":0.9961769524849808,"objective_suite_case_stretch_synthetic_partial_attendance_capacity_pressure_152p_final_score":6656.0,"objective_suite_case_stretch_synthetic_partial_attendance_capacity_pressure_152p_normalized_score":1.002409638554217,"objective_suite_case_stretch_synthetic_partial_attendance_capacity_pressure_152p_reference_final_score":6640.0,"objective_suite_case_stretch_synthetic_partial_attendance_capacity_pressure_152p_weight":1.0,"objective_suite_case_stretch_synthetic_partial_attendance_capacity_pressure_152p_weighted_contribution":1.002409638554217,"objective_suite_external_validation_failures":0.0,"objective_suite_score_breakdown_mismatches":0.0,"objective_suite_total_final_score_raw":21786.0,"objective_suite_total_runtime_seconds":94.004587346,"objective_suite_total_score_mismatches":0.0,"objective_suite_weighted_normalized_score":101.00309805837642,"objective_suite_weighted_normalized_score_delta_from_reference":1.003098058376417,"objective_suite_weighted_normalized_score_weight_sum":6.0,"path_allowed_sessions_iter_us":15.081225,"path_avg_iter_us":11.10777,"path_clique_iter_us":14.203700000000001,"path_construction_iter_us":9.312675,"path_swap_iter_us":6.2078,"path_transfer_iter_us":10.73345,"rep_avg_iter_us":13.596290942028986,"rep_balanced_iter_us":12.973016666666666,"rep_balanced_score":3.0,"rep_constrained_iter_us":14.219565217391304,"rep_constrained_score":4.0,"runtime_canonical_share_percent":99.551722373564,"runtime_total_seconds":94.427886434,"solver3_raw_score_us":39.81932135869565,"swap_apply_us":0.8170625,"swap_preview_us":3.4005,"transfer_apply_us":0.9705625,"transfer_preview_us":1.90890625},"status":"discard","description":"Tried a lightweight exact-undo tabu memory for swap and transfer moves, blocking recent reverse moves while leaving clique swaps unchanged. This was a genuine metaheuristic change, but it still regressed the primary fixed-time aggregate versus the 100.105 best and increased solver overhead materially.","timestamp":1775577683320,"segment":0,"confidence":13.460022372085145,"iterationTokens":31637,"asi":{"hypothesis":"A tiny tabu memory that blocks immediate reverse swap/transfer moves would reduce cycling and let solver3 spend more time exploring new basins, improving fixed-time objective quality.","rollback_reason":"Primary metric worsened to 101.0031 and runtime overhead rose notably, so exact-undo tabu did not pay for itself.","next_action_hint":"Retire simple reverse-move tabu for now. If revisiting search memory later, make it more state-aware: target repeated group-pair churn or repeated person-pair contact regressions rather than blanket move reversal bans.","observations":["Large_gender, sailing, and synthetic all improved over reference, but not enough to beat the best kept aggregate because social_golfer slipped and runtime cost increased.","solver3_raw_score_us rose to 39.82 and clique/transfer path timings also increased, so even lightweight policy checks had a noticeable search cost.","This suggests solver3's current bottleneck is not simple immediate move reversal cycling."],"mechanism_family":"search memory / tabu","tabu_scope":"exact reverse swap/transfer moves","tabu_tenure":8}}
{"run":11,"commit":"295db0c","metric":106.40292350070739,"metrics":{"clique_apply_us":1.2147708333333334,"clique_preview_us":5.088291666666666,"correctness_suite_average_runtime_seconds":0.11422709175000001,"correctness_suite_case_count":4.0,"correctness_suite_external_validation_failures":0.0,"correctness_suite_total_runtime_seconds":0.45690836700000004,"correctness_suite_total_score_mismatches":0.0,"hotpath_total_us":14.674218749999998,"objective_fixed_iteration_average_final_score_raw":3647.0,"objective_fixed_iteration_average_runtime_seconds":42.939601621,"objective_fixed_iteration_case_adversarial_clique_swap_functionality_35p_final_score":4756.0,"objective_fixed_iteration_case_adversarial_clique_swap_functionality_35p_normalized_score":1.0,"objective_fixed_iteration_case_adversarial_clique_swap_functionality_35p_reference_final_score":4756.0,"objective_fixed_iteration_case_adversarial_clique_swap_functionality_35p_weight":1.0,"objective_fixed_iteration_case_adversarial_clique_swap_functionality_35p_weighted_contribution":1.0,"objective_fixed_iteration_case_adversarial_transfer_attribute_balance_111p_final_score":261.0,"objective_fixed_iteration_case_adversarial_transfer_attribute_balance_111p_normalized_score":1.2794117647058822,"objective_fixed_iteration_case_adversarial_transfer_attribute_balance_111p_reference_final_score":204.0,"objective_fixed_iteration_case_adversarial_transfer_attribute_balance_111p_weight":1.0,"objective_fixed_iteration_case_adversarial_transfer_attribute_balance_111p_weighted_contribution":1.2794117647058822,"objective_fixed_iteration_case_count":6.0,"objective_fixed_iteration_case_stretch_large_gender_immovable_110p_final_score":2157.0,"objective_fixed_iteration_case_stretch_large_gender_immovable_110p_normalized_score":1.010304449648712,"objective_fixed_iteration_case_stretch_large_gender_immovable_110p_reference_final_score":2135.0,"objective_fixed_iteration_case_stretch_large_gender_immovable_110p_weight":1.0,"objective_fixed_iteration_case_stretch_large_gender_immovable_110p_weighted_contribution":1.010304449648712,"objective_fixed_iteration_case_stretch_sailing_trip_demo_real_final_score":2369.0,"objective_fixed_iteration_case_stretch_sailing_trip_demo_real_normalized_score":1.0671171171171172,"objective_fixed_iteration_case_stretch_sailing_trip_demo_real_reference_final_score":2220.0,"objective_fixed_iteration_case_stretch_sailing_trip_demo_real_weight":1.0,"objective_fixed_iteration_case_stretch_sailing_trip_demo_real_weighted_contribution":1.0671171171171172,"objective_fixed_iteration_case_stretch_social_golfer_32x8x10_final_score":5430.0,"objective_fixed_iteration_case_stretch_social_golfer_32x8x10_normalized_score":0.9885308574549426,"objective_fixed_iteration_case_stretch_social_golfer_32x8x10_reference_final_score":5493.0,"objective_fixed_iteration_case_stretch_social_golfer_32x8x10_weight":1.0,"objective_fixed_iteration_case_stretch_social_golfer_32x8x10_weighted_contribution":0.9885308574549426,"objective_fixed_iteration_case_stretch_synthetic_partial_attendance_capacity_pressure_152p_final_score":6909.0,"objective_fixed_iteration_case_stretch_synthetic_partial_attendance_capacity_pressure_152p_normalized_score":1.0434979610330766,"objective_fixed_iteration_case_stretch_synthetic_partial_attendance_capacity_pressure_152p_reference_final_score":6621.0,"objective_fixed_iteration_case_stretch_synthetic_partial_attendance_capacity_pressure_152p_weight":1.0,"objective_fixed_iteration_case_stretch_synthetic_partial_attendance_capacity_pressure_152p_weighted_contribution":1.0434979610330766,"objective_fixed_iteration_external_validation_failures":0.0,"objective_fixed_iteration_score_breakdown_mismatches":0.0,"objective_fixed_iteration_total_final_score_raw":21882.0,"objective_fixed_iteration_total_runtime_seconds":257.637609726,"objective_fixed_iteration_total_score_mismatches":0.0,"objective_fixed_iteration_weighted_normalized_score":106.48103583266217,"objective_fixed_iteration_weighted_normalized_score_delta_from_reference":6.481035832662174,"objective_fixed_iteration_weighted_normalized_score_weight_sum":6.0,"objective_suite_average_final_score_raw":3646.3333333333335,"objective_suite_average_runtime_seconds":15.667244906666667,"objective_suite_case_adversarial_clique_swap_functionality_35p_final_score":4756.0,"objective_suite_case_adversarial_clique_swap_functionality_35p_normalized_score":1.0,"objective_suite_case_adversarial_clique_swap_functionality_35p_reference_final_score":4756.0,"objective_suite_case_adversarial_clique_swap_functionality_35p_weight":1.0,"objective_suite_case_adversarial_clique_swap_functionality_35p_weighted_contribution":1.0,"objective_suite_case_adversarial_transfer_attribute_balance_111p_final_score":248.0,"objective_suite_case_adversarial_transfer_attribute_balance_111p_normalized_score":1.2525252525252526,"objective_suite_case_adversarial_transfer_attribute_balance_111p_reference_final_score":198.0,"objective_suite_case_adversarial_transfer_attribute_balance_111p_weight":1.0,"objective_suite_case_adversarial_transfer_attribute_balance_111p_weighted_contribution":1.2525252525252526,"objective_suite_case_count":6.0,"objective_suite_case_stretch_large_gender_immovable_110p_final_score":2542.0,"objective_suite_case_stretch_large_gender_immovable_110p_normalized_score":1.1665901789811841,"objective_suite_case_stretch_large_gender_immovable_110p_reference_final_score":2179.0,"objective_suite_case_stretch_large_gender_immovable_110p_weight":1.0,"objective_suite_case_stretch_large_gender_immovable_110p_weighted_contribution":1.1665901789811841,"objective_suite_case_stretch_sailing_trip_demo_real_final_score":2379.0,"objective_suite_case_stretch_sailing_trip_demo_real_normalized_score":0.9941496030087756,"objective_suite_case_stretch_sailing_trip_demo_real_reference_final_score":2393.0,"objective_suite_case_stretch_sailing_trip_demo_real_weight":1.0,"objective_suite_case_stretch_sailing_trip_demo_real_weighted_contribution":0.9941496030087756,"objective_suite_case_stretch_social_golfer_32x8x10_final_score":5430.0,"objective_suite_case_stretch_social_golfer_32x8x10_normalized_score":0.9885308574549426,"objective_suite_case_stretch_social_golfer_32x8x10_reference_final_score":5493.0,"objective_suite_case_stretch_social_golfer_32x8x10_weight":1.0,"objective_suite_case_stretch_social_golfer_32x8x10_weighted_contribution":0.9885308574549426,"objective_suite_case_stretch_synthetic_partial_attendance_capacity_pressure_152p_final_score":6523.0,"objective_suite_case_stretch_synthetic_partial_attendance_capacity_pressure_152p_normalized_score":0.9823795180722892,"objective_suite_case_stretch_synthetic_partial_attendance_capacity_pressure_152p_reference_final_score":6640.0,"objective_suite_case_stretch_synthetic_partial_attendance_capacity_pressure_152p_weight":1.0,"objective_suite_case_stretch_synthetic_partial_attendance_capacity_pressure_152p_weighted_contribution":0.9823795180722892,"objective_suite_external_validation_failures":0.0,"objective_suite_score_breakdown_mismatches":0.0,"objective_suite_total_final_score_raw":21878.0,"objective_suite_total_runtime_seconds":94.00346944,"objective_suite_total_score_mismatches":0.0,"objective_suite_weighted_normalized_score":106.40292350070739,"objective_suite_weighted_normalized_score_delta_from_reference":6.4029235007073915,"objective_suite_weighted_normalized_score_weight_sum":6.0,"path_allowed_sessions_iter_us":12.187475000000001,"path_avg_iter_us":8.74381,"path_clique_iter_us":10.31495,"path_construction_iter_us":8.609774999999999,"path_swap_iter_us":5.4087,"path_transfer_iter_us":7.19815,"rep_avg_iter_us":12.650433536585368,"rep_balanced_iter_us":11.90055,"rep_balanced_score":3.0,"rep_constrained_iter_us":13.400317073170733,"rep_constrained_score":6.0,"runtime_canonical_share_percent":99.51629627404884,"runtime_total_seconds":94.460377807,"solver3_raw_score_us":36.068462286585365,"swap_apply_us":2.08325,"swap_preview_us":3.68109375,"transfer_apply_us":0.859,"transfer_preview_us":1.7478125},"status":"discard","description":"Replaced simulated annealing with Late Acceptance Hill Climbing using a rolling 256-score history as the acceptance reference. This was a true non-SA driver, but it badly destabilized transfer attribute balance and large_gender, so the pure LAHC policy is not suitable in this form for solver3's canonical fixed-time bundle.","timestamp":1775579046984,"segment":0,"confidence":9.816938910423163,"iterationTokens":37461,"asi":{"hypothesis":"A late-acceptance driver would escape SA's temperature-shape biases and improve basin traversal under fixed-time runs with modest overhead.","rollback_reason":"Primary metric regressed sharply to 106.4029, with especially bad damage on transfer attribute balance and large_gender, indicating that pure late-acceptance acceptance is too permissive or misaligned for solver3's penalty landscape.","next_action_hint":"Do not pursue pure LAHC unchanged. If revisiting non-SA acceptance, try a guarded variant: threshold acceptance with a shrinking cap, record-to-record travel, or a hybrid gate that only allows uphill moves when they stay within bounded regression on constraint-heavy penalties.","observations":["Attribute-balance case worsened to 1.2525 fixed-time and 1.2794 fixed-iteration.","Large_gender worsened materially while sailing slightly improved versus reference.","Runtime overhead also increased to solver3_raw_score_us 36.07, so the driver was neither better nor cheaper."],"mechanism_family":"non-SA acceptance / late acceptance hill climbing","late_acceptance_window":256}}
