{"run":11,"commit":"a946147","metric":101.45288227069989,"metrics":{"clique_apply_us":2.755416666666667,"clique_preview_us":13.038979166666666,"correctness_suite_average_runtime_seconds":0.17837535975,"correctness_suite_case_count":4.0,"correctness_suite_external_validation_failures":0.0,"correctness_suite_total_runtime_seconds":0.713501439,"correctness_suite_total_score_mismatches":0.0,"hotpath_total_us":30.776489583333337,"objective_fixed_iteration_average_final_score_raw":3602.8333333333335,"objective_fixed_iteration_average_runtime_seconds":50.8368026395,"objective_fixed_iteration_case_adversarial_clique_swap_functionality_35p_final_score":4765.0,"objective_fixed_iteration_case_adversarial_clique_swap_functionality_35p_normalized_score":1.001892346509672,"objective_fixed_iteration_case_adversarial_clique_swap_functionality_35p_reference_final_score":4756.0,"objective_fixed_iteration_case_adversarial_clique_swap_functionality_35p_weight":1.0,"objective_fixed_iteration_case_adversarial_clique_swap_functionality_35p_weighted_contribution":1.001892346509672,"objective_fixed_iteration_case_adversarial_transfer_attribute_balance_111p_final_score":197.0,"objective_fixed_iteration_case_adversarial_transfer_attribute_balance_111p_normalized_score":0.9656862745098039,"objective_fixed_iteration_case_adversarial_transfer_attribute_balance_111p_reference_final_score":204.0,"objective_fixed_iteration_case_adversarial_transfer_attribute_balance_111p_weight":1.0,"objective_fixed_iteration_case_adversarial_transfer_attribute_balance_111p_weighted_contribution":0.9656862745098039,"objective_fixed_iteration_case_count":6.0,"objective_fixed_iteration_case_stretch_large_gender_immovable_110p_final_score":2157.0,"objective_fixed_iteration_case_stretch_large_gender_immovable_110p_normalized_score":1.010304449648712,"objective_fixed_iteration_case_stretch_large_gender_immovable_110p_reference_final_score":2135.0,"objective_fixed_iteration_case_stretch_large_gender_immovable_110p_weight":1.0,"objective_fixed_iteration_case_stretch_large_gender_immovable_110p_weighted_contribution":1.010304449648712,"objective_fixed_iteration_case_stretch_sailing_trip_demo_real_final_score":2306.0,"objective_fixed_iteration_case_stretch_sailing_trip_demo_real_normalized_score":1.0387387387387388,"objective_fixed_iteration_case_stretch_sailing_trip_demo_real_reference_final_score":2220.0,"objective_fixed_iteration_case_stretch_sailing_trip_demo_real_weight":1.0,"objective_fixed_iteration_case_stretch_sailing_trip_demo_real_weighted_contribution":1.0387387387387388,"objective_fixed_iteration_case_stretch_social_golfer_32x8x10_final_score":5451.0,"objective_fixed_iteration_case_stretch_social_golfer_32x8x10_normalized_score":0.9923539049699618,"objective_fixed_iteration_case_stretch_social_golfer_32x8x10_reference_final_score":5493.0,"objective_fixed_iteration_case_stretch_social_golfer_32x8x10_weight":1.0,"objective_fixed_iteration_case_stretch_social_golfer_32x8x10_weighted_contribution":0.9923539049699618,"objective_fixed_iteration_case_stretch_synthetic_partial_attendance_capacity_pressure_152p_final_score":6741.0,"objective_fixed_iteration_case_stretch_synthetic_partial_attendance_capacity_pressure_152p_normalized_score":1.0181241504304486,"objective_fixed_iteration_case_stretch_synthetic_partial_attendance_capacity_pressure_152p_reference_final_score":6621.0,"objective_fixed_iteration_case_stretch_synthetic_partial_attendance_capacity_pressure_152p_weight":1.0,"objective_fixed_iteration_case_stretch_synthetic_partial_attendance_capacity_pressure_152p_weighted_contribution":1.0181241504304486,"objective_fixed_iteration_external_validation_failures":0.0,"objective_fixed_iteration_score_breakdown_mismatches":0.0,"objective_fixed_iteration_total_final_score_raw":21617.0,"objective_fixed_iteration_total_runtime_seconds":305.020815837,"objective_fixed_iteration_total_score_mismatches":0.0,"objective_fixed_iteration_weighted_normalized_score":100.45166441345563,"objective_fixed_iteration_weighted_normalized_score_delta_from_reference":0.45166441345563246,"objective_fixed_iteration_weighted_normalized_score_weight_sum":6.0,"objective_suite_average_final_score_raw":3642.5,"objective_suite_average_runtime_seconds":15.670543621166667,"objective_suite_case_adversarial_clique_swap_functionality_35p_final_score":4765.0,"objective_suite_case_adversarial_clique_swap_functionality_35p_normalized_score":1.001892346509672,"objective_suite_case_adversarial_clique_swap_functionality_35p_reference_final_score":4756.0,"objective_suite_case_adversarial_clique_swap_functionality_35p_weight":1.0,"objective_suite_case_adversarial_clique_swap_functionality_35p_weighted_contribution":1.001892346509672,"objective_suite_case_adversarial_transfer_attribute_balance_111p_final_score":204.0,"objective_suite_case_adversarial_transfer_attribute_balance_111p_normalized_score":1.0303030303030303,"objective_suite_case_adversarial_transfer_attribute_balance_111p_reference_final_score":198.0,"objective_suite_case_adversarial_transfer_attribute_balance_111p_weight":1.0,"objective_suite_case_adversarial_transfer_attribute_balance_111p_weighted_contribution":1.0303030303030303,"objective_suite_case_count":6.0,"objective_suite_case_stretch_large_gender_immovable_110p_final_score":2333.0,"objective_suite_case_stretch_large_gender_immovable_110p_normalized_score":1.0706746213859568,"objective_suite_case_stretch_large_gender_immovable_110p_reference_final_score":2179.0,"objective_suite_case_stretch_large_gender_immovable_110p_weight":1.0,"objective_suite_case_stretch_large_gender_immovable_110p_weighted_contribution":1.0706746213859568,"objective_suite_case_stretch_sailing_trip_demo_real_final_score":2324.0,"objective_suite_case_stretch_sailing_trip_demo_real_normalized_score":0.9711659005432511,"objective_suite_case_stretch_sailing_trip_demo_real_reference_final_score":2393.0,"objective_suite_case_stretch_sailing_trip_demo_real_weight":1.0,"objective_suite_case_stretch_sailing_trip_demo_real_weighted_contribution":0.9711659005432511,"objective_suite_case_stretch_social_golfer_32x8x10_final_score":5451.0,"objective_suite_case_stretch_social_golfer_32x8x10_normalized_score":0.9923539049699618,"objective_suite_case_stretch_social_golfer_32x8x10_reference_final_score":5493.0,"objective_suite_case_stretch_social_golfer_32x8x10_weight":1.0,"objective_suite_case_stretch_social_golfer_32x8x10_weighted_contribution":0.9923539049699618,"objective_suite_case_stretch_synthetic_partial_attendance_capacity_pressure_152p_final_score":6778.0,"objective_suite_case_stretch_synthetic_partial_attendance_capacity_pressure_152p_normalized_score":1.0207831325301204,"objective_suite_case_stretch_synthetic_partial_attendance_capacity_pressure_152p_reference_final_score":6640.0,"objective_suite_case_stretch_synthetic_partial_attendance_capacity_pressure_152p_weight":1.0,"objective_suite_case_stretch_synthetic_partial_attendance_capacity_pressure_152p_weighted_contribution":1.0207831325301204,"objective_suite_external_validation_failures":0.0,"objective_suite_score_breakdown_mismatches":0.0,"objective_suite_total_final_score_raw":21855.0,"objective_suite_total_runtime_seconds":94.023261727,"objective_suite_total_score_mismatches":0.0,"objective_suite_weighted_normalized_score":101.45288227069989,"objective_suite_weighted_normalized_score_delta_from_reference":1.4528822706998845,"objective_suite_weighted_normalized_score_weight_sum":6.0,"path_allowed_sessions_iter_us":27.762075,"path_avg_iter_us":29.27682,"path_clique_iter_us":54.961675,"path_construction_iter_us":26.253300000000003,"path_swap_iter_us":20.566725,"path_transfer_iter_us":16.840325,"rep_avg_iter_us":30.35185925925926,"rep_balanced_iter_us":27.9732,"rep_balanced_score":3.0,"rep_constrained_iter_us":32.73051851851852,"rep_constrained_score":4.0,"runtime_canonical_share_percent":99.24685896461357,"runtime_total_seconds":94.736763166,"solver3_raw_score_us":90.4051688425926,"swap_apply_us":2.28878125,"swap_preview_us":6.543421875,"transfer_apply_us":2.32146875,"transfer_preview_us":3.8284218750000005},"status":"discard","description":"Confirmation rerun of the memetic donor-session burst did not reproduce the slight gain from the first run. Same committed code landed at 101.4529 vs the kept 101.2810 and baseline 101.3513, so the current local-repeat-pressure donor-session selector looks too noisy to trust.","timestamp":1775659280892,"segment":0,"confidence":422.5179285891167,"iterationTokens":7607,"asi":{"hypothesis":"Re-running the committed memetic-burst code will show whether the initial 101.2810 improvement is repeatable on this machine.","rollback_reason":"The confirmation rerun regressed relative to the memetic keep and also landed above the baseline, so the current session-selection rule is not yet robust.","next_action_hint":"Stay within the memetic incubation window but strengthen compatibility selection: score all candidate donor-session transplants by actual offspring score (or a richer compatibility heuristic) instead of choosing by local repeat-pressure gain alone.","mechanism_family":"memetic / elite polished donor session transplant","noise_context":{"baseline_metric":"101.35127940997147","kept_memetic_metric":"101.28103384244216","confirm_rerun_metric":"101.45288227069989"}}}
{"run":12,"commit":"a09f3f0","metric":101.05576963890799,"metrics":{"clique_apply_us":2.9074166666666668,"clique_preview_us":13.265062499999999,"correctness_suite_average_runtime_seconds":0.18237207425,"correctness_suite_case_count":4.0,"correctness_suite_external_validation_failures":0.0,"correctness_suite_total_runtime_seconds":0.729488297,"correctness_suite_total_score_mismatches":0.0,"hotpath_total_us":31.318619791666666,"objective_fixed_iteration_average_final_score_raw":3604.1666666666665,"objective_fixed_iteration_average_runtime_seconds":50.807520845,"objective_fixed_iteration_case_adversarial_clique_swap_functionality_35p_final_score":4765.0,"objective_fixed_iteration_case_adversarial_clique_swap_functionality_35p_normalized_score":1.001892346509672,"objective_fixed_iteration_case_adversarial_clique_swap_functionality_35p_reference_final_score":4756.0,"objective_fixed_iteration_case_adversarial_clique_swap_functionality_35p_weight":1.0,"objective_fixed_iteration_case_adversarial_clique_swap_functionality_35p_weighted_contribution":1.001892346509672,"objective_fixed_iteration_case_adversarial_transfer_attribute_balance_111p_final_score":206.0,"objective_fixed_iteration_case_adversarial_transfer_attribute_balance_111p_normalized_score":1.0098039215686274,"objective_fixed_iteration_case_adversarial_transfer_attribute_balance_111p_reference_final_score":204.0,"objective_fixed_iteration_case_adversarial_transfer_attribute_balance_111p_weight":1.0,"objective_fixed_iteration_case_adversarial_transfer_attribute_balance_111p_weighted_contribution":1.0098039215686274,"objective_fixed_iteration_case_count":6.0,"objective_fixed_iteration_case_stretch_large_gender_immovable_110p_final_score":2157.0,"objective_fixed_iteration_case_stretch_large_gender_immovable_110p_normalized_score":1.010304449648712,"objective_fixed_iteration_case_stretch_large_gender_immovable_110p_reference_final_score":2135.0,"objective_fixed_iteration_case_stretch_large_gender_immovable_110p_weight":1.0,"objective_fixed_iteration_case_stretch_large_gender_immovable_110p_weighted_contribution":1.010304449648712,"objective_fixed_iteration_case_stretch_sailing_trip_demo_real_final_score":2305.0,"objective_fixed_iteration_case_stretch_sailing_trip_demo_real_normalized_score":1.0382882882882882,"objective_fixed_iteration_case_stretch_sailing_trip_demo_real_reference_final_score":2220.0,"objective_fixed_iteration_case_stretch_sailing_trip_demo_real_weight":1.0,"objective_fixed_iteration_case_stretch_sailing_trip_demo_real_weighted_contribution":1.0382882882882882,"objective_fixed_iteration_case_stretch_social_golfer_32x8x10_final_score":5451.0,"objective_fixed_iteration_case_stretch_social_golfer_32x8x10_normalized_score":0.9923539049699618,"objective_fixed_iteration_case_stretch_social_golfer_32x8x10_reference_final_score":5493.0,"objective_fixed_iteration_case_stretch_social_golfer_32x8x10_weight":1.0,"objective_fixed_iteration_case_stretch_social_golfer_32x8x10_weighted_contribution":0.9923539049699618,"objective_fixed_iteration_case_stretch_synthetic_partial_attendance_capacity_pressure_152p_final_score":6741.0,"objective_fixed_iteration_case_stretch_synthetic_partial_attendance_capacity_pressure_152p_normalized_score":1.0181241504304486,"objective_fixed_iteration_case_stretch_synthetic_partial_attendance_capacity_pressure_152p_reference_final_score":6621.0,"objective_fixed_iteration_case_stretch_synthetic_partial_attendance_capacity_pressure_152p_weight":1.0,"objective_fixed_iteration_case_stretch_synthetic_partial_attendance_capacity_pressure_152p_weighted_contribution":1.0181241504304486,"objective_fixed_iteration_external_validation_failures":0.0,"objective_fixed_iteration_score_breakdown_mismatches":0.0,"objective_fixed_iteration_total_final_score_raw":21625.0,"objective_fixed_iteration_total_runtime_seconds":304.84512507,"objective_fixed_iteration_total_score_mismatches":0.0,"objective_fixed_iteration_weighted_normalized_score":101.17945102359516,"objective_fixed_iteration_weighted_normalized_score_delta_from_reference":1.1794510235951572,"objective_fixed_iteration_weighted_normalized_score_weight_sum":6.0,"objective_suite_average_final_score_raw":3635.6666666666665,"objective_suite_average_runtime_seconds":15.669334824833333,"objective_suite_case_adversarial_clique_swap_functionality_35p_final_score":4765.0,"objective_suite_case_adversarial_clique_swap_functionality_35p_normalized_score":1.001892346509672,"objective_suite_case_adversarial_clique_swap_functionality_35p_reference_final_score":4756.0,"objective_suite_case_adversarial_clique_swap_functionality_35p_weight":1.0,"objective_suite_case_adversarial_clique_swap_functionality_35p_weighted_contribution":1.001892346509672,"objective_suite_case_adversarial_transfer_attribute_balance_111p_final_score":202.0,"objective_suite_case_adversarial_transfer_attribute_balance_111p_normalized_score":1.02020202020202,"objective_suite_case_adversarial_transfer_attribute_balance_111p_reference_final_score":198.0,"objective_suite_case_adversarial_transfer_attribute_balance_111p_weight":1.0,"objective_suite_case_adversarial_transfer_attribute_balance_111p_weighted_contribution":1.02020202020202,"objective_suite_case_count":6.0,"objective_suite_case_stretch_large_gender_immovable_110p_final_score":2311.0,"objective_suite_case_stretch_large_gender_immovable_110p_normalized_score":1.0605782469022487,"objective_suite_case_stretch_large_gender_immovable_110p_reference_final_score":2179.0,"objective_suite_case_stretch_large_gender_immovable_110p_weight":1.0,"objective_suite_case_stretch_large_gender_immovable_110p_weighted_contribution":1.0605782469022487,"objective_suite_case_stretch_sailing_trip_demo_real_final_score":2320.0,"objective_suite_case_stretch_sailing_trip_demo_real_normalized_score":0.9694943585457585,"objective_suite_case_stretch_sailing_trip_demo_real_reference_final_score":2393.0,"objective_suite_case_stretch_sailing_trip_demo_real_weight":1.0,"objective_suite_case_stretch_sailing_trip_demo_real_weighted_contribution":0.9694943585457585,"objective_suite_case_stretch_social_golfer_32x8x10_final_score":5451.0,"objective_suite_case_stretch_social_golfer_32x8x10_normalized_score":0.9923539049699618,"objective_suite_case_stretch_social_golfer_32x8x10_reference_final_score":5493.0,"objective_suite_case_stretch_social_golfer_32x8x10_weight":1.0,"objective_suite_case_stretch_social_golfer_32x8x10_weighted_contribution":0.9923539049699618,"objective_suite_case_stretch_synthetic_partial_attendance_capacity_pressure_152p_final_score":6765.0,"objective_suite_case_stretch_synthetic_partial_attendance_capacity_pressure_152p_normalized_score":1.0188253012048192,"objective_suite_case_stretch_synthetic_partial_attendance_capacity_pressure_152p_reference_final_score":6640.0,"objective_suite_case_stretch_synthetic_partial_attendance_capacity_pressure_152p_weight":1.0,"objective_suite_case_stretch_synthetic_partial_attendance_capacity_pressure_152p_weighted_contribution":1.0188253012048192,"objective_suite_external_validation_failures":0.0,"objective_suite_score_breakdown_mismatches":0.0,"objective_suite_total_final_score_raw":21814.0,"objective_suite_total_runtime_seconds":94.016008949,"objective_suite_total_score_mismatches":0.0,"objective_suite_weighted_normalized_score":101.05576963890799,"objective_suite_weighted_normalized_score_delta_from_reference":1.0557696389079885,"objective_suite_weighted_normalized_score_weight_sum":6.0,"path_allowed_sessions_iter_us":26.582899999999995,"path_avg_iter_us":19.22724,"path_clique_iter_us":25.687525,"path_construction_iter_us":23.181024999999998,"path_swap_iter_us":12.195375,"path_transfer_iter_us":8.489374999999999,"rep_avg_iter_us":30.1808787037037,"rep_balanced_iter_us":28.896016666666664,"rep_balanced_score":3.0,"rep_constrained_iter_us":31.46574074074074,"rep_constrained_score":4.0,"runtime_canonical_share_percent":99.23005491743218,"runtime_total_seconds":94.745497246,"solver3_raw_score_us":80.72673849537037,"swap_apply_us":2.282125,"swap_preview_us":6.758109375,"transfer_apply_us":2.30440625,"transfer_preview_us":3.8015},"status":"keep","description":"Memetic follow-up inside the incubation window: replaced the donor-session selector's cheap local repeat-pressure proxy with exact offspring rescoring across all allowable donor-session transplants, then accepted the best offspring under the existing record-to-record gate. This improved the primary metric from 101.2810 to 101.0558, with better transfer-balance and slightly better sailing while holding social_golfer and large_gender flat versus the prior memetic keep.","timestamp":1775659970596,"segment":0,"confidence":490.6448413245269,"iterationTokens":9397,"asi":{"hypothesis":"A memetic donor burst becomes more robust if donor-session compatibility is evaluated by actual offspring score rather than a noisy local repeat-pressure proxy.","mechanism_family":"memetic / elite polished donor session transplant","structural_change":"During stagnation, polish one diversified donor briefly, enumerate all allowed one-session donor transplants into the incumbent, fully rescore each offspring, and inject only the best-scoring offspring back into the main record-to-record search.","comparison":{"previous_kept_memetic_metric":"101.28103384244216","new_metric":"101.05576963890799","baseline_metric":"101.35127940997147"},"case_shape":{"attribute_balance":"1.02020202020202","social_golfer":"0.9923539049699618","large_gender":"1.0605782469022487","sailing":"0.9694943585457585","synthetic_partial":"1.0188253012048192"},"next_action_hint":"Confirm this stronger memetic selector with at least one rerun; if it holds, continue incubation by testing richer donor compatibility or two-session offspring only if they remain benchmark-honest within the same time budget."}}
