{"run":4,"commit":"42f01a4","metric":101.35127940997147,"metrics":{"clique_apply_us":2.879625,"clique_preview_us":12.709895833333333,"correctness_suite_average_runtime_seconds":0.1812336945,"correctness_suite_case_count":4.0,"correctness_suite_external_validation_failures":0.0,"correctness_suite_total_runtime_seconds":0.724934778,"correctness_suite_total_score_mismatches":0.0,"hotpath_total_us":30.719192708333335,"objective_fixed_iteration_average_final_score_raw":3603.1666666666665,"objective_fixed_iteration_average_runtime_seconds":50.42939424266667,"objective_fixed_iteration_case_adversarial_clique_swap_functionality_35p_final_score":4765.0,"objective_fixed_iteration_case_adversarial_clique_swap_functionality_35p_normalized_score":1.001892346509672,"objective_fixed_iteration_case_adversarial_clique_swap_functionality_35p_reference_final_score":4756.0,"objective_fixed_iteration_case_adversarial_clique_swap_functionality_35p_weight":1.0,"objective_fixed_iteration_case_adversarial_clique_swap_functionality_35p_weighted_contribution":1.001892346509672,"objective_fixed_iteration_case_adversarial_transfer_attribute_balance_111p_final_score":200.0,"objective_fixed_iteration_case_adversarial_transfer_attribute_balance_111p_normalized_score":0.9803921568627451,"objective_fixed_iteration_case_adversarial_transfer_attribute_balance_111p_reference_final_score":204.0,"objective_fixed_iteration_case_adversarial_transfer_attribute_balance_111p_weight":1.0,"objective_fixed_iteration_case_adversarial_transfer_attribute_balance_111p_weighted_contribution":0.9803921568627451,"objective_fixed_iteration_case_count":6.0,"objective_fixed_iteration_case_stretch_large_gender_immovable_110p_final_score":2157.0,"objective_fixed_iteration_case_stretch_large_gender_immovable_110p_normalized_score":1.010304449648712,"objective_fixed_iteration_case_stretch_large_gender_immovable_110p_reference_final_score":2135.0,"objective_fixed_iteration_case_stretch_large_gender_immovable_110p_weight":1.0,"objective_fixed_iteration_case_stretch_large_gender_immovable_110p_weighted_contribution":1.010304449648712,"objective_fixed_iteration_case_stretch_sailing_trip_demo_real_final_score":2305.0,"objective_fixed_iteration_case_stretch_sailing_trip_demo_real_normalized_score":1.0382882882882882,"objective_fixed_iteration_case_stretch_sailing_trip_demo_real_reference_final_score":2220.0,"objective_fixed_iteration_case_stretch_sailing_trip_demo_real_weight":1.0,"objective_fixed_iteration_case_stretch_sailing_trip_demo_real_weighted_contribution":1.0382882882882882,"objective_fixed_iteration_case_stretch_social_golfer_32x8x10_final_score":5451.0,"objective_fixed_iteration_case_stretch_social_golfer_32x8x10_normalized_score":0.9923539049699618,"objective_fixed_iteration_case_stretch_social_golfer_32x8x10_reference_final_score":5493.0,"objective_fixed_iteration_case_stretch_social_golfer_32x8x10_weight":1.0,"objective_fixed_iteration_case_stretch_social_golfer_32x8x10_weighted_contribution":0.9923539049699618,"objective_fixed_iteration_case_stretch_synthetic_partial_attendance_capacity_pressure_152p_final_score":6741.0,"objective_fixed_iteration_case_stretch_synthetic_partial_attendance_capacity_pressure_152p_normalized_score":1.0181241504304486,"objective_fixed_iteration_case_stretch_synthetic_partial_attendance_capacity_pressure_152p_reference_final_score":6621.0,"objective_fixed_iteration_case_stretch_synthetic_partial_attendance_capacity_pressure_152p_weight":1.0,"objective_fixed_iteration_case_stretch_synthetic_partial_attendance_capacity_pressure_152p_weighted_contribution":1.0181241504304486,"objective_fixed_iteration_external_validation_failures":0.0,"objective_fixed_iteration_score_breakdown_mismatches":0.0,"objective_fixed_iteration_total_final_score_raw":21619.0,"objective_fixed_iteration_total_runtime_seconds":302.576365456,"objective_fixed_iteration_total_score_mismatches":0.0,"objective_fixed_iteration_weighted_normalized_score":100.68925494516378,"objective_fixed_iteration_weighted_normalized_score_delta_from_reference":0.6892549451637864,"objective_fixed_iteration_weighted_normalized_score_weight_sum":6.0,"objective_suite_average_final_score_raw":3633.5,"objective_suite_average_runtime_seconds":15.668608860500001,"objective_suite_case_adversarial_clique_swap_functionality_35p_final_score":4765.0,"objective_suite_case_adversarial_clique_swap_functionality_35p_normalized_score":1.001892346509672,"objective_suite_case_adversarial_clique_swap_functionality_35p_reference_final_score":4756.0,"objective_suite_case_adversarial_clique_swap_functionality_35p_weight":1.0,"objective_suite_case_adversarial_clique_swap_functionality_35p_weighted_contribution":1.001892346509672,"objective_suite_case_adversarial_transfer_attribute_balance_111p_final_score":207.0,"objective_suite_case_adversarial_transfer_attribute_balance_111p_normalized_score":1.0454545454545454,"objective_suite_case_adversarial_transfer_attribute_balance_111p_reference_final_score":198.0,"objective_suite_case_adversarial_transfer_attribute_balance_111p_weight":1.0,"objective_suite_case_adversarial_transfer_attribute_balance_111p_weighted_contribution":1.0454545454545454,"objective_suite_case_count":6.0,"objective_suite_case_stretch_large_gender_immovable_110p_final_score":2311.0,"objective_suite_case_stretch_large_gender_immovable_110p_normalized_score":1.0605782469022487,"objective_suite_case_stretch_large_gender_immovable_110p_reference_final_score":2179.0,"objective_suite_case_stretch_large_gender_immovable_110p_weight":1.0,"objective_suite_case_stretch_large_gender_immovable_110p_weighted_contribution":1.0605782469022487,"objective_suite_case_stretch_sailing_trip_demo_real_final_score":2302.0,"objective_suite_case_stretch_sailing_trip_demo_real_normalized_score":0.9619724195570414,"objective_suite_case_stretch_sailing_trip_demo_real_reference_final_score":2393.0,"objective_suite_case_stretch_sailing_trip_demo_real_weight":1.0,"objective_suite_case_stretch_sailing_trip_demo_real_weighted_contribution":0.9619724195570414,"objective_suite_case_stretch_social_golfer_32x8x10_final_score":5451.0,"objective_suite_case_stretch_social_golfer_32x8x10_normalized_score":0.9923539049699618,"objective_suite_case_stretch_social_golfer_32x8x10_reference_final_score":5493.0,"objective_suite_case_stretch_social_golfer_32x8x10_weight":1.0,"objective_suite_case_stretch_social_golfer_32x8x10_weighted_contribution":0.9923539049699618,"objective_suite_case_stretch_synthetic_partial_attendance_capacity_pressure_152p_final_score":6765.0,"objective_suite_case_stretch_synthetic_partial_attendance_capacity_pressure_152p_normalized_score":1.0188253012048192,"objective_suite_case_stretch_synthetic_partial_attendance_capacity_pressure_152p_reference_final_score":6640.0,"objective_suite_case_stretch_synthetic_partial_attendance_capacity_pressure_152p_weight":1.0,"objective_suite_case_stretch_synthetic_partial_attendance_capacity_pressure_152p_weighted_contribution":1.0188253012048192,"objective_suite_external_validation_failures":0.0,"objective_suite_score_breakdown_mismatches":0.0,"objective_suite_total_final_score_raw":21801.0,"objective_suite_total_runtime_seconds":94.011653163,"objective_suite_total_score_mismatches":0.0,"objective_suite_weighted_normalized_score":101.35127940997147,"objective_suite_weighted_normalized_score_delta_from_reference":1.351279409971462,"objective_suite_weighted_normalized_score_weight_sum":6.0,"path_allowed_sessions_iter_us":25.148649999999996,"path_avg_iter_us":17.10678,"path_clique_iter_us":18.2352,"path_construction_iter_us":22.214825,"path_swap_iter_us":11.25835,"path_transfer_iter_us":8.676875,"rep_avg_iter_us":29.47876574074074,"rep_balanced_iter_us":27.77505,"rep_balanced_score":3.0,"rep_constrained_iter_us":31.18248148148148,"rep_constrained_score":4.0,"runtime_canonical_share_percent":99.23478901472421,"runtime_total_seconds":94.736587941,"solver3_raw_score_us":77.30473844907408,"swap_apply_us":2.46384375,"swap_preview_us":6.483796875,"transfer_apply_us":2.312515625,"transfer_preview_us":3.869515625},"status":"keep","description":"Fresh solver3 objective-quality baseline on the new machine after fixing missing execute bits on the autoresearch wrapper scripts. Current kept record-to-record baseline is 101.3513 here; slower machine profile shows solver3_raw_score_us 77.30 with strongest gains in sailing/social_golfer and biggest gaps in attribute_balance, large_gender, and synthetic.","timestamp":1775653999460,"segment":0,"confidence":null,"iterationTokens":5670,"asi":{"hypothesis":"Reset the autoresearch lane onto a clean new-machine baseline before further solver3 search changes.","machine_reset":"User explicitly requested a new baseline because this machine differs from the previous setup.","environment_fix":"Restored executable permissions on autoresearch wrapper/check scripts so the benchmark/check pipeline can run normally on this machine.","baseline_observation":"New-machine baseline is 101.35127940997147, materially worse than prior-machine history, so old noise/confidence should not be reused.","case_shape":{"sailing":"0.9619724195570414","social_golfer":"0.9923539049699618","attribute_balance":"1.0454545454545454","large_gender":"1.0605782469022487","synthetic_partial":"1.0188253012048192"}}}
{"run":5,"commit":"42f01a4","metric":0,"metrics":{},"status":"crash","description":"Front-loaded elite-scout multi-start crashed during the canonical suite: benchmark aggregation reported `case stretch.sailing-trip-demo-real has no final_score`, so at least one solver3 run failed to emit a valid completed case result under the new scouting orchestration.","timestamp":1775654435666,"segment":0,"confidence":null,"iterationTokens":23065,"asi":{"hypothesis":"Use a short elite-scout phase (current state + three diverse seeded starts) to pick a better basin, then spend the remaining fixed-time budget on the standard record-to-record search.","rollback_reason":"The suite aborted because sailing-trip-demo-real produced no final_score after the new scouting orchestration, indicating a hard integration bug rather than a fair quality regression.","next_action_hint":"Inspect the failing suite log/report for sailing-trip-demo-real; likely causes are zero/invalid remaining time budget handling, missing result emission after the scout phase, or a solver error triggered by seeded reinitialization.","mechanism_family":"smarter elite scouting / concentrated multi-start portfolio","baseline_reference":"new-machine baseline 101.35127940997147"}}
{"run":6,"commit":"42f01a4","metric":101.65884748449099,"metrics":{"clique_apply_us":2.8136458333333336,"clique_preview_us":13.560875,"correctness_suite_average_runtime_seconds":0.2008067145,"correctness_suite_case_count":4.0,"correctness_suite_external_validation_failures":0.0,"correctness_suite_total_runtime_seconds":0.803226858,"correctness_suite_total_score_mismatches":0.0,"hotpath_total_us":31.66173958333333,"objective_fixed_iteration_average_final_score_raw":3603.0,"objective_fixed_iteration_average_runtime_seconds":50.417455994166666,"objective_fixed_iteration_case_adversarial_clique_swap_functionality_35p_final_score":4765.0,"objective_fixed_iteration_case_adversarial_clique_swap_functionality_35p_normalized_score":1.001892346509672,"objective_fixed_iteration_case_adversarial_clique_swap_functionality_35p_reference_final_score":4756.0,"objective_fixed_iteration_case_adversarial_clique_swap_functionality_35p_weight":1.0,"objective_fixed_iteration_case_adversarial_clique_swap_functionality_35p_weighted_contribution":1.001892346509672,"objective_fixed_iteration_case_adversarial_transfer_attribute_balance_111p_final_score":199.0,"objective_fixed_iteration_case_adversarial_transfer_attribute_balance_111p_normalized_score":0.9754901960784313,"objective_fixed_iteration_case_adversarial_transfer_attribute_balance_111p_reference_final_score":204.0,"objective_fixed_iteration_case_adversarial_transfer_attribute_balance_111p_weight":1.0,"objective_fixed_iteration_case_adversarial_transfer_attribute_balance_111p_weighted_contribution":0.9754901960784313,"objective_fixed_iteration_case_count":6.0,"objective_fixed_iteration_case_stretch_large_gender_immovable_110p_final_score":2157.0,"objective_fixed_iteration_case_stretch_large_gender_immovable_110p_normalized_score":1.010304449648712,"objective_fixed_iteration_case_stretch_large_gender_immovable_110p_reference_final_score":2135.0,"objective_fixed_iteration_case_stretch_large_gender_immovable_110p_weight":1.0,"objective_fixed_iteration_case_stretch_large_gender_immovable_110p_weighted_contribution":1.010304449648712,"objective_fixed_iteration_case_stretch_sailing_trip_demo_real_final_score":2305.0,"objective_fixed_iteration_case_stretch_sailing_trip_demo_real_normalized_score":1.0382882882882882,"objective_fixed_iteration_case_stretch_sailing_trip_demo_real_reference_final_score":2220.0,"objective_fixed_iteration_case_stretch_sailing_trip_demo_real_weight":1.0,"objective_fixed_iteration_case_stretch_sailing_trip_demo_real_weighted_contribution":1.0382882882882882,"objective_fixed_iteration_case_stretch_social_golfer_32x8x10_final_score":5451.0,"objective_fixed_iteration_case_stretch_social_golfer_32x8x10_normalized_score":0.9923539049699618,"objective_fixed_iteration_case_stretch_social_golfer_32x8x10_reference_final_score":5493.0,"objective_fixed_iteration_case_stretch_social_golfer_32x8x10_weight":1.0,"objective_fixed_iteration_case_stretch_social_golfer_32x8x10_weighted_contribution":0.9923539049699618,"objective_fixed_iteration_case_stretch_synthetic_partial_attendance_capacity_pressure_152p_final_score":6741.0,"objective_fixed_iteration_case_stretch_synthetic_partial_attendance_capacity_pressure_152p_normalized_score":1.0181241504304486,"objective_fixed_iteration_case_stretch_synthetic_partial_attendance_capacity_pressure_152p_reference_final_score":6621.0,"objective_fixed_iteration_case_stretch_synthetic_partial_attendance_capacity_pressure_152p_weight":1.0,"objective_fixed_iteration_case_stretch_synthetic_partial_attendance_capacity_pressure_152p_weighted_contribution":1.0181241504304486,"objective_fixed_iteration_external_validation_failures":0.0,"objective_fixed_iteration_score_breakdown_mismatches":0.0,"objective_fixed_iteration_total_final_score_raw":21618.0,"objective_fixed_iteration_total_runtime_seconds":302.504735965,"objective_fixed_iteration_total_score_mismatches":0.0,"objective_fixed_iteration_weighted_normalized_score":100.60755559875855,"objective_fixed_iteration_weighted_normalized_score_delta_from_reference":0.6075555987585579,"objective_fixed_iteration_weighted_normalized_score_weight_sum":6.0,"objective_suite_average_final_score_raw":3640.5,"objective_suite_average_runtime_seconds":15.668294691833333,"objective_suite_case_adversarial_clique_swap_functionality_35p_final_score":4765.0,"objective_suite_case_adversarial_clique_swap_functionality_35p_normalized_score":1.001892346509672,"objective_suite_case_adversarial_clique_swap_functionality_35p_reference_final_score":4756.0,"objective_suite_case_adversarial_clique_swap_functionality_35p_weight":1.0,"objective_suite_case_adversarial_clique_swap_functionality_35p_weighted_contribution":1.001892346509672,"objective_suite_case_adversarial_transfer_attribute_balance_111p_final_score":207.0,"objective_suite_case_adversarial_transfer_attribute_balance_111p_normalized_score":1.0454545454545454,"objective_suite_case_adversarial_transfer_attribute_balance_111p_reference_final_score":198.0,"objective_suite_case_adversarial_transfer_attribute_balance_111p_weight":1.0,"objective_suite_case_adversarial_transfer_attribute_balance_111p_weighted_contribution":1.0454545454545454,"objective_suite_case_count":6.0,"objective_suite_case_stretch_large_gender_immovable_110p_final_score":2333.0,"objective_suite_case_stretch_large_gender_immovable_110p_normalized_score":1.0706746213859568,"objective_suite_case_stretch_large_gender_immovable_110p_reference_final_score":2179.0,"objective_suite_case_stretch_large_gender_immovable_110p_weight":1.0,"objective_suite_case_stretch_large_gender_immovable_110p_weighted_contribution":1.0706746213859568,"objective_suite_case_stretch_sailing_trip_demo_real_final_score":2322.0,"objective_suite_case_stretch_sailing_trip_demo_real_normalized_score":0.9703301295445048,"objective_suite_case_stretch_sailing_trip_demo_real_reference_final_score":2393.0,"objective_suite_case_stretch_sailing_trip_demo_real_weight":1.0,"objective_suite_case_stretch_sailing_trip_demo_real_weighted_contribution":0.9703301295445048,"objective_suite_case_stretch_social_golfer_32x8x10_final_score":5451.0,"objective_suite_case_stretch_social_golfer_32x8x10_normalized_score":0.9923539049699618,"objective_suite_case_stretch_social_golfer_32x8x10_reference_final_score":5493.0,"objective_suite_case_stretch_social_golfer_32x8x10_weight":1.0,"objective_suite_case_stretch_social_golfer_32x8x10_weighted_contribution":0.9923539049699618,"objective_suite_case_stretch_synthetic_partial_attendance_capacity_pressure_152p_final_score":6765.0,"objective_suite_case_stretch_synthetic_partial_attendance_capacity_pressure_152p_normalized_score":1.0188253012048192,"objective_suite_case_stretch_synthetic_partial_attendance_capacity_pressure_152p_reference_final_score":6640.0,"objective_suite_case_stretch_synthetic_partial_attendance_capacity_pressure_152p_weight":1.0,"objective_suite_case_stretch_synthetic_partial_attendance_capacity_pressure_152p_weighted_contribution":1.0188253012048192,"objective_suite_external_validation_failures":0.0,"objective_suite_score_breakdown_mismatches":0.0,"objective_suite_total_final_score_raw":21843.0,"objective_suite_total_runtime_seconds":94.009768151,"objective_suite_total_score_mismatches":0.0,"objective_suite_weighted_normalized_score":101.65884748449099,"objective_suite_weighted_normalized_score_delta_from_reference":1.6588474844909884,"objective_suite_weighted_normalized_score_weight_sum":6.0,"path_allowed_sessions_iter_us":81.836025,"path_avg_iter_us":38.702145,"path_clique_iter_us":18.916549999999997,"path_construction_iter_us":71.17127500000001,"path_swap_iter_us":12.49805,"path_transfer_iter_us":9.088825,"rep_avg_iter_us":29.49403611111111,"rep_balanced_iter_us":27.943016666666665,"rep_balanced_score":3.0,"rep_constrained_iter_us":31.045055555555557,"rep_constrained_score":4.0,"runtime_canonical_share_percent":99.15283041325321,"runtime_total_seconds":94.812995009,"solver3_raw_score_us":99.85792069444445,"swap_apply_us":2.464390625,"swap_preview_us":6.451046874999999,"transfer_apply_us":2.3385312500000004,"transfer_preview_us":4.03325},"status":"discard","description":"Noise-floor rerun on the new-machine baseline: slightly worse than the fresh baseline (101.3513\u2192101.6588), so discard. This confirms the lane now has visible machine variance, with especially noisy raw-runtime/path diagnostics (solver3_raw_score_us 77.30\u219299.86, path_allowed_sessions_iter_us 25.15\u219281.84) even while objective quality stayed within ~0.31 points.","timestamp":1775654949623,"segment":0,"confidence":329.5247062566574,"iterationTokens":1826,"asi":{"hypothesis":"Re-running the unchanged post-reset baseline will establish a new-machine noise floor before more ambitious solver3 changes.","rollback_reason":"Primary metric did not improve; the rerun was slightly worse and is best treated as variance measurement rather than a keep.","next_action_hint":"Use ~0.3 objective-score movement as an initial rough noise band on this machine and prefer experiments that target larger shifts or show consistent per-case wins; next real code experiment should be a lower-risk structural change than the crashed elite-scout orchestration.","noise_measurement":{"baseline_metric":"101.35127940997147","rerun_metric":"101.65884748449099","delta":"0.3075680745195264"},"observations":["Per-case shape was almost unchanged versus the kept baseline.","Raw runtime diagnostics were much noisier than objective quality on this machine.","This supports doing at least occasional confirmation reruns before keeping marginal improvements."]}}
