{"run":33,"commit":"903743d","metric":101.20382351658996,"metrics":{"clique_apply_us":2.7824166666666668,"clique_preview_us":13.076791666666667,"correctness_suite_average_runtime_seconds":0.18354709375,"correctness_suite_case_count":4.0,"correctness_suite_external_validation_failures":0.0,"correctness_suite_total_runtime_seconds":0.734188375,"correctness_suite_total_score_mismatches":0.0,"hotpath_total_us":30.937911458333335,"objective_fixed_iteration_average_final_score_raw":3603.5,"objective_fixed_iteration_average_runtime_seconds":50.800858579166665,"objective_fixed_iteration_case_adversarial_clique_swap_functionality_35p_final_score":4765.0,"objective_fixed_iteration_case_adversarial_clique_swap_functionality_35p_normalized_score":1.001892346509672,"objective_fixed_iteration_case_adversarial_clique_swap_functionality_35p_reference_final_score":4756.0,"objective_fixed_iteration_case_adversarial_clique_swap_functionality_35p_weight":1.0,"objective_fixed_iteration_case_adversarial_clique_swap_functionality_35p_weighted_contribution":1.001892346509672,"objective_fixed_iteration_case_adversarial_transfer_attribute_balance_111p_final_score":202.0,"objective_fixed_iteration_case_adversarial_transfer_attribute_balance_111p_normalized_score":0.9901960784313726,"objective_fixed_iteration_case_adversarial_transfer_attribute_balance_111p_reference_final_score":204.0,"objective_fixed_iteration_case_adversarial_transfer_attribute_balance_111p_weight":1.0,"objective_fixed_iteration_case_adversarial_transfer_attribute_balance_111p_weighted_contribution":0.9901960784313726,"objective_fixed_iteration_case_count":6.0,"objective_fixed_iteration_case_stretch_large_gender_immovable_110p_final_score":2157.0,"objective_fixed_iteration_case_stretch_large_gender_immovable_110p_normalized_score":1.010304449648712,"objective_fixed_iteration_case_stretch_large_gender_immovable_110p_reference_final_score":2135.0,"objective_fixed_iteration_case_stretch_large_gender_immovable_110p_weight":1.0,"objective_fixed_iteration_case_stretch_large_gender_immovable_110p_weighted_contribution":1.010304449648712,"objective_fixed_iteration_case_stretch_sailing_trip_demo_real_final_score":2305.0,"objective_fixed_iteration_case_stretch_sailing_trip_demo_real_normalized_score":1.0382882882882882,"objective_fixed_iteration_case_stretch_sailing_trip_demo_real_reference_final_score":2220.0,"objective_fixed_iteration_case_stretch_sailing_trip_demo_real_weight":1.0,"objective_fixed_iteration_case_stretch_sailing_trip_demo_real_weighted_contribution":1.0382882882882882,"objective_fixed_iteration_case_stretch_social_golfer_32x8x10_final_score":5451.0,"objective_fixed_iteration_case_stretch_social_golfer_32x8x10_normalized_score":0.9923539049699618,"objective_fixed_iteration_case_stretch_social_golfer_32x8x10_reference_final_score":5493.0,"objective_fixed_iteration_case_stretch_social_golfer_32x8x10_weight":1.0,"objective_fixed_iteration_case_stretch_social_golfer_32x8x10_weighted_contribution":0.9923539049699618,"objective_fixed_iteration_case_stretch_synthetic_partial_attendance_capacity_pressure_152p_final_score":6741.0,"objective_fixed_iteration_case_stretch_synthetic_partial_attendance_capacity_pressure_152p_normalized_score":1.0181241504304486,"objective_fixed_iteration_case_stretch_synthetic_partial_attendance_capacity_pressure_152p_reference_final_score":6621.0,"objective_fixed_iteration_case_stretch_synthetic_partial_attendance_capacity_pressure_152p_weight":1.0,"objective_fixed_iteration_case_stretch_synthetic_partial_attendance_capacity_pressure_152p_weighted_contribution":1.0181241504304486,"objective_fixed_iteration_external_validation_failures":0.0,"objective_fixed_iteration_score_breakdown_mismatches":0.0,"objective_fixed_iteration_total_final_score_raw":21621.0,"objective_fixed_iteration_total_runtime_seconds":304.805151475,"objective_fixed_iteration_total_score_mismatches":0.0,"objective_fixed_iteration_weighted_normalized_score":100.85265363797424,"objective_fixed_iteration_weighted_normalized_score_delta_from_reference":0.8526536379742433,"objective_fixed_iteration_weighted_normalized_score_weight_sum":6.0,"objective_suite_average_final_score_raw":3633.6666666666665,"objective_suite_average_runtime_seconds":15.668391371,"objective_suite_case_adversarial_clique_swap_functionality_35p_final_score":4765.0,"objective_suite_case_adversarial_clique_swap_functionality_35p_normalized_score":1.001892346509672,"objective_suite_case_adversarial_clique_swap_functionality_35p_reference_final_score":4756.0,"objective_suite_case_adversarial_clique_swap_functionality_35p_weight":1.0,"objective_suite_case_adversarial_clique_swap_functionality_35p_weighted_contribution":1.001892346509672,"objective_suite_case_adversarial_transfer_attribute_balance_111p_final_score":205.0,"objective_suite_case_adversarial_transfer_attribute_balance_111p_normalized_score":1.0353535353535352,"objective_suite_case_adversarial_transfer_attribute_balance_111p_reference_final_score":198.0,"objective_suite_case_adversarial_transfer_attribute_balance_111p_weight":1.0,"objective_suite_case_adversarial_transfer_attribute_balance_111p_weighted_contribution":1.0353535353535352,"objective_suite_case_count":6.0,"objective_suite_case_stretch_large_gender_immovable_110p_final_score":2311.0,"objective_suite_case_stretch_large_gender_immovable_110p_normalized_score":1.0605782469022487,"objective_suite_case_stretch_large_gender_immovable_110p_reference_final_score":2179.0,"objective_suite_case_stretch_large_gender_immovable_110p_weight":1.0,"objective_suite_case_stretch_large_gender_immovable_110p_weighted_contribution":1.0605782469022487,"objective_suite_case_stretch_sailing_trip_demo_real_final_score":2305.0,"objective_suite_case_stretch_sailing_trip_demo_real_normalized_score":0.9632260760551609,"objective_suite_case_stretch_sailing_trip_demo_real_reference_final_score":2393.0,"objective_suite_case_stretch_sailing_trip_demo_real_weight":1.0,"objective_suite_case_stretch_sailing_trip_demo_real_weighted_contribution":0.9632260760551609,"objective_suite_case_stretch_social_golfer_32x8x10_final_score":5451.0,"objective_suite_case_stretch_social_golfer_32x8x10_normalized_score":0.9923539049699618,"objective_suite_case_stretch_social_golfer_32x8x10_reference_final_score":5493.0,"objective_suite_case_stretch_social_golfer_32x8x10_weight":1.0,"objective_suite_case_stretch_social_golfer_32x8x10_weighted_contribution":0.9923539049699618,"objective_suite_case_stretch_synthetic_partial_attendance_capacity_pressure_152p_final_score":6765.0,"objective_suite_case_stretch_synthetic_partial_attendance_capacity_pressure_152p_normalized_score":1.0188253012048192,"objective_suite_case_stretch_synthetic_partial_attendance_capacity_pressure_152p_reference_final_score":6640.0,"objective_suite_case_stretch_synthetic_partial_attendance_capacity_pressure_152p_weight":1.0,"objective_suite_case_stretch_synthetic_partial_attendance_capacity_pressure_152p_weighted_contribution":1.0188253012048192,"objective_suite_external_validation_failures":0.0,"objective_suite_score_breakdown_mismatches":0.0,"objective_suite_total_final_score_raw":21802.0,"objective_suite_total_runtime_seconds":94.010348226,"objective_suite_total_score_mismatches":0.0,"objective_suite_weighted_normalized_score":101.20382351658996,"objective_suite_weighted_normalized_score_delta_from_reference":1.2038235165899636,"objective_suite_weighted_normalized_score_weight_sum":6.0,"path_allowed_sessions_iter_us":25.588925,"path_avg_iter_us":17.322155,"path_clique_iter_us":19.275025,"path_construction_iter_us":21.631975,"path_swap_iter_us":11.70095,"path_transfer_iter_us":8.4139,"rep_avg_iter_us":29.541632407407405,"rep_balanced_iter_us":28.263616666666667,"rep_balanced_score":3.0,"rep_constrained_iter_us":30.819648148148147,"rep_constrained_score":4.0,"runtime_canonical_share_percent":99.22508632018338,"runtime_total_seconds":94.74453660100001,"solver3_raw_score_us":77.80169886574073,"swap_apply_us":2.34721875,"swap_preview_us":6.60128125,"transfer_apply_us":2.302375,"transfer_preview_us":3.8278281250000004},"status":"discard","description":"Cross-donor mixed-session memetic recombination: after polishing the two diversified donors, exactly rescored not only the usual one-session transplants but also all two-session offspring that mix one session from donor A with a different session from donor B. This richer cross-donor bundle was more competitive than several recent follow-ups and improved sailing/large_gender versus the recent diagnostic reruns, but it still did not beat the kept champion.","timestamp":1775674153139,"segment":0,"confidence":794.4381017803418,"iterationTokens":11750,"asi":{"hypothesis":"The two polished donors may contain complementary good sessions, so exact mixed two-session bundles across different donors can unlock recombination value that same-donor bundles and simple donor choice miss.","rollback_reason":"Primary improved relative to many recent follow-ups but still stayed above the kept best (101.2038 vs 100.8462), so the cross-donor mixed bundle is not yet good enough to keep.","next_action_hint":"Record this as a materially tried richer memetic recombination variant; if continuing the memetic line, look for stronger donor-generation or more global compatibility signals rather than more exhaustive session-bundle enumeration.","mechanism_family":"cross-donor mixed-session memetic recombination","observed_case_pattern":{"transfer_balance":"1.0354","large_gender":"1.0606","sailing":"0.9632","social_golfer":"0.9924","synthetic":"1.0188"},"learning":"Cross-donor complementarity is directionally better than same-donor bundle enumeration, but the gain is still too small and the chronic transfer/synthetic blockers remain."}}
{"run":34,"commit":"903743d","metric":101.97713979828107,"metrics":{"clique_apply_us":3.315583333333333,"clique_preview_us":12.873854166666666,"correctness_suite_average_runtime_seconds":0.21854703275,"correctness_suite_case_count":4.0,"correctness_suite_external_validation_failures":0.0,"correctness_suite_total_runtime_seconds":0.874188131,"correctness_suite_total_score_mismatches":0.0,"hotpath_total_us":31.216343749999997,"objective_fixed_iteration_average_final_score_raw":3596.6666666666665,"objective_fixed_iteration_average_runtime_seconds":51.589104070000005,"objective_fixed_iteration_case_adversarial_clique_swap_functionality_35p_final_score":4765.0,"objective_fixed_iteration_case_adversarial_clique_swap_functionality_35p_normalized_score":1.001892346509672,"objective_fixed_iteration_case_adversarial_clique_swap_functionality_35p_reference_final_score":4756.0,"objective_fixed_iteration_case_adversarial_clique_swap_functionality_35p_weight":1.0,"objective_fixed_iteration_case_adversarial_clique_swap_functionality_35p_weighted_contribution":1.001892346509672,"objective_fixed_iteration_case_adversarial_transfer_attribute_balance_111p_final_score":202.0,"objective_fixed_iteration_case_adversarial_transfer_attribute_balance_111p_normalized_score":0.9901960784313726,"objective_fixed_iteration_case_adversarial_transfer_attribute_balance_111p_reference_final_score":204.0,"objective_fixed_iteration_case_adversarial_transfer_attribute_balance_111p_weight":1.0,"objective_fixed_iteration_case_adversarial_transfer_attribute_balance_111p_weighted_contribution":0.9901960784313726,"objective_fixed_iteration_case_count":6.0,"objective_fixed_iteration_case_stretch_large_gender_immovable_110p_final_score":2157.0,"objective_fixed_iteration_case_stretch_large_gender_immovable_110p_normalized_score":1.010304449648712,"objective_fixed_iteration_case_stretch_large_gender_immovable_110p_reference_final_score":2135.0,"objective_fixed_iteration_case_stretch_large_gender_immovable_110p_weight":1.0,"objective_fixed_iteration_case_stretch_large_gender_immovable_110p_weighted_contribution":1.010304449648712,"objective_fixed_iteration_case_stretch_sailing_trip_demo_real_final_score":2306.0,"objective_fixed_iteration_case_stretch_sailing_trip_demo_real_normalized_score":1.0387387387387388,"objective_fixed_iteration_case_stretch_sailing_trip_demo_real_reference_final_score":2220.0,"objective_fixed_iteration_case_stretch_sailing_trip_demo_real_weight":1.0,"objective_fixed_iteration_case_stretch_sailing_trip_demo_real_weighted_contribution":1.0387387387387388,"objective_fixed_iteration_case_stretch_social_golfer_32x8x10_final_score":5409.0,"objective_fixed_iteration_case_stretch_social_golfer_32x8x10_normalized_score":0.9847078099399236,"objective_fixed_iteration_case_stretch_social_golfer_32x8x10_reference_final_score":5493.0,"objective_fixed_iteration_case_stretch_social_golfer_32x8x10_weight":1.0,"objective_fixed_iteration_case_stretch_social_golfer_32x8x10_weighted_contribution":0.9847078099399236,"objective_fixed_iteration_case_stretch_synthetic_partial_attendance_capacity_pressure_152p_final_score":6741.0,"objective_fixed_iteration_case_stretch_synthetic_partial_attendance_capacity_pressure_152p_normalized_score":1.0181241504304486,"objective_fixed_iteration_case_stretch_synthetic_partial_attendance_capacity_pressure_152p_reference_final_score":6621.0,"objective_fixed_iteration_case_stretch_synthetic_partial_attendance_capacity_pressure_152p_weight":1.0,"objective_fixed_iteration_case_stretch_synthetic_partial_attendance_capacity_pressure_152p_weighted_contribution":1.0181241504304486,"objective_fixed_iteration_external_validation_failures":0.0,"objective_fixed_iteration_score_breakdown_mismatches":0.0,"objective_fixed_iteration_total_final_score_raw":21580.0,"objective_fixed_iteration_total_runtime_seconds":309.53462442,"objective_fixed_iteration_total_score_mismatches":0.0,"objective_fixed_iteration_weighted_normalized_score":100.73272622831446,"objective_fixed_iteration_weighted_normalized_score_delta_from_reference":0.732726228314462,"objective_fixed_iteration_weighted_normalized_score_weight_sum":6.0,"objective_suite_average_final_score_raw":3637.1666666666665,"objective_suite_average_runtime_seconds":15.6690166555,"objective_suite_case_adversarial_clique_swap_functionality_35p_final_score":4765.0,"objective_suite_case_adversarial_clique_swap_functionality_35p_normalized_score":1.001892346509672,"objective_suite_case_adversarial_clique_swap_functionality_35p_reference_final_score":4756.0,"objective_suite_case_adversarial_clique_swap_functionality_35p_weight":1.0,"objective_suite_case_adversarial_clique_swap_functionality_35p_weighted_contribution":1.001892346509672,"objective_suite_case_adversarial_transfer_attribute_balance_111p_final_score":212.0,"objective_suite_case_adversarial_transfer_attribute_balance_111p_normalized_score":1.0707070707070707,"objective_suite_case_adversarial_transfer_attribute_balance_111p_reference_final_score":198.0,"objective_suite_case_adversarial_transfer_attribute_balance_111p_weight":1.0,"objective_suite_case_adversarial_transfer_attribute_balance_111p_weighted_contribution":1.0707070707070707,"objective_suite_case_count":6.0,"objective_suite_case_stretch_large_gender_immovable_110p_final_score":2333.0,"objective_suite_case_stretch_large_gender_immovable_110p_normalized_score":1.0706746213859568,"objective_suite_case_stretch_large_gender_immovable_110p_reference_final_score":2179.0,"objective_suite_case_stretch_large_gender_immovable_110p_weight":1.0,"objective_suite_case_stretch_large_gender_immovable_110p_weighted_contribution":1.0706746213859568,"objective_suite_case_stretch_sailing_trip_demo_real_final_score":2318.0,"objective_suite_case_stretch_sailing_trip_demo_real_normalized_score":0.9686585875470122,"objective_suite_case_stretch_sailing_trip_demo_real_reference_final_score":2393.0,"objective_suite_case_stretch_sailing_trip_demo_real_weight":1.0,"objective_suite_case_stretch_sailing_trip_demo_real_weighted_contribution":0.9686585875470122,"objective_suite_case_stretch_social_golfer_32x8x10_final_score":5409.0,"objective_suite_case_stretch_social_golfer_32x8x10_normalized_score":0.9847078099399236,"objective_suite_case_stretch_social_golfer_32x8x10_reference_final_score":5493.0,"objective_suite_case_stretch_social_golfer_32x8x10_weight":1.0,"objective_suite_case_stretch_social_golfer_32x8x10_weighted_contribution":0.9847078099399236,"objective_suite_case_stretch_synthetic_partial_attendance_capacity_pressure_152p_final_score":6786.0,"objective_suite_case_stretch_synthetic_partial_attendance_capacity_pressure_152p_normalized_score":1.021987951807229,"objective_suite_case_stretch_synthetic_partial_attendance_capacity_pressure_152p_reference_final_score":6640.0,"objective_suite_case_stretch_synthetic_partial_attendance_capacity_pressure_152p_weight":1.0,"objective_suite_case_stretch_synthetic_partial_attendance_capacity_pressure_152p_weighted_contribution":1.021987951807229,"objective_suite_external_validation_failures":0.0,"objective_suite_score_breakdown_mismatches":0.0,"objective_suite_total_final_score_raw":21823.0,"objective_suite_total_runtime_seconds":94.014099933,"objective_suite_total_score_mismatches":0.0,"objective_suite_weighted_normalized_score":101.97713979828107,"objective_suite_weighted_normalized_score_delta_from_reference":1.977139798281069,"objective_suite_weighted_normalized_score_weight_sum":6.0,"path_allowed_sessions_iter_us":26.790750000000003,"path_avg_iter_us":22.46066,"path_clique_iter_us":42.180125,"path_construction_iter_us":21.73565,"path_swap_iter_us":12.525924999999999,"path_transfer_iter_us":9.07085,"rep_avg_iter_us":29.9947,"rep_balanced_iter_us":28.305566666666664,"rep_balanced_score":3.0,"rep_constrained_iter_us":31.683833333333336,"rep_constrained_score":4.0,"runtime_canonical_share_percent":99.0787186186662,"runtime_total_seconds":94.88828806400001,"solver3_raw_score_us":83.67170375,"swap_apply_us":2.304109375,"swap_preview_us":6.5711875,"transfer_apply_us":2.2479687499999996,"transfer_preview_us":3.9036406249999995},"status":"discard","description":"Cross-donor child-polish memetic recombination: after polishing the two diversified donors, built mixed donor children from each donor's top exact-rescored session candidates, polished those children briefly, then rescored their best one-session offspring against the incumbent. This deeper recombine-then-local-search variant was benchmark-honest but clearly regressed, especially on transfer-balance and synthetic, so the extra donor-child polishing did not unlock useful complementarities.","timestamp":1775674888679,"segment":0,"confidence":653.3887066993323,"iterationTokens":19939,"asi":{"hypothesis":"A mixed donor child that inherits strong sessions from both polished donors and is then locally polished can expose useful cross-donor complementarity that direct offspring bundle enumeration misses.","rollback_reason":"Primary regressed badly to 101.9771 and added overhead, so this child-polish recombination variant is not competitive.","next_action_hint":"Record this as a materially tried deeper memetic recombination variant and stop spending turns on richer session-bundle recombination over the current donor source; the next step should be a genuinely different macro idea or a much stronger donor-generation concept.","mechanism_family":"cross-donor child-polish memetic recombination","observed_case_pattern":{"transfer_balance":"1.0707","large_gender":"1.0707","sailing":"0.9687","social_golfer":"0.9847","synthetic":"1.0220"},"learning":"Adding a recombine-then-polish child on top of the current donor source made the memetic family slower and worse, suggesting the donor material itself is the limiting factor rather than insufficient local optimization after recombination."}}
