{"run":6,"commit":"c3a9ee0","metric":0,"metrics":{},"status":"crash","description":"Crash while broadening donor_session_transplant + sgp_week_pair_tabu routing from the pure zero-repeat pair to include large_gender: the aggregate step aborted because stretch.large-gender-immovable-110p produced no final_score in the zero-repeat suite run, indicating the case failed instead of completing.","timestamp":1776139894668,"segment":0,"confidence":77.02987949377024,"iterationTokens":6106}
{"run":7,"commit":"c3a9ee0","metric":88.86332938322792,"metrics":{},"status":"discard","description":"Tried extending capability-aware donor routing into the semantically supported non-clique adversarial transfer case via donor_session_transplant + record_to_record while keeping the pure zero-repeat donor+tabu route; transfer regressed slightly and the aggregate got worse.","timestamp":1776141586341,"segment":0,"confidence":38.514939746887,"iterationTokens":17202}
{"run":8,"commit":"c3a9ee0","metric":0,"metrics":{},"status":"crash","description":"Crash: after the discard/revert cycle the delegated solver3-metaheuristic autoresearch script again lost execute permission, so ./autoresearch.sh failed immediately with permission denied before the more aggressive zero-repeat donor-trigger experiment could run.","timestamp":1776141615810,"segment":0,"confidence":38.514939746887,"iterationTokens":7160}
{"run":9,"commit":"e6a994c","metric":88.75437577012664,"metrics":{"clique_apply_us":0.27668750000000003,"clique_preview_us":0.5301041666666667,"correctness_suite_average_runtime_seconds":0.005817477,"correctness_suite_case_count":4.0,"correctness_suite_external_validation_failures":0.0,"correctness_suite_total_runtime_seconds":0.023269908,"correctness_suite_total_score_mismatches":0.0,"hotpath_total_us":1.8964947916666666,"metaheuristic_fixed_iteration_weighted_normalized_score":88.84575090897886,"metaheuristic_fixed_iteration_weighted_normalized_score_delta_from_reference":-11.15424909102114,"metaheuristic_fixed_iteration_weighted_normalized_score_weight_sum":9.0,"metaheuristic_suite_weighted_normalized_score":88.75437577012664,"metaheuristic_suite_weighted_normalized_score_delta_from_reference":-11.245624229873364,"metaheuristic_suite_weighted_normalized_score_weight_sum":9.0,"objective_fixed_iteration_average_final_score_raw":2595.1111111111113,"objective_fixed_iteration_average_runtime_seconds":12.895086094777778,"objective_fixed_iteration_case_adversarial_clique_swap_functionality_35p_final_score":4765.0,"objective_fixed_iteration_case_adversarial_clique_swap_functionality_35p_normalized_score":1.0,"objective_fixed_iteration_case_adversarial_clique_swap_functionality_35p_reference_final_score":4765.0,"objective_fixed_iteration_case_adversarial_clique_swap_functionality_35p_weight":1.0,"objective_fixed_iteration_case_adversarial_clique_swap_functionality_35p_weighted_contribution":1.0,"objective_fixed_iteration_case_adversarial_transfer_attribute_balance_111p_final_score":194.0,"objective_fixed_iteration_case_adversarial_transfer_attribute_balance_111p_normalized_score":1.0,"objective_fixed_iteration_case_adversarial_transfer_attribute_balance_111p_reference_final_score":194.0,"objective_fixed_iteration_case_adversarial_transfer_attribute_balance_111p_weight":1.0,"objective_fixed_iteration_case_adversarial_transfer_attribute_balance_111p_weighted_contribution":1.0,"objective_fixed_iteration_case_count":9.0,"objective_fixed_iteration_case_representative_small_workshop_balanced_final_score":3.0,"objective_fixed_iteration_case_representative_small_workshop_balanced_normalized_score":1.0,"objective_fixed_iteration_case_representative_small_workshop_balanced_reference_final_score":3.0,"objective_fixed_iteration_case_representative_small_workshop_balanced_weight":1.0,"objective_fixed_iteration_case_representative_small_workshop_balanced_weighted_contribution":1.0,"objective_fixed_iteration_case_representative_small_workshop_constrained_final_score":4.0,"objective_fixed_iteration_case_representative_small_workshop_constrained_normalized_score":1.0,"objective_fixed_iteration_case_representative_small_workshop_constrained_reference_final_score":4.0,"objective_fixed_iteration_case_representative_small_workshop_constrained_weight":1.0,"objective_fixed_iteration_case_representative_small_workshop_constrained_weighted_contribution":1.0,"objective_fixed_iteration_case_stretch_kirkman_schoolgirls_15x5x7_final_score":0.0,"objective_fixed_iteration_case_stretch_kirkman_schoolgirls_15x5x7_normalized_score":0.0,"objective_fixed_iteration_case_stretch_kirkman_schoolgirls_15x5x7_reference_final_score":55.0,"objective_fixed_iteration_case_stretch_kirkman_schoolgirls_15x5x7_weight":1.0,"objective_fixed_iteration_case_stretch_kirkman_schoolgirls_15x5x7_weighted_contribution":0.0,"objective_fixed_iteration_case_stretch_large_gender_immovable_110p_final_score":2102.0,"objective_fixed_iteration_case_stretch_large_gender_immovable_110p_normalized_score":1.0,"objective_fixed_iteration_case_stretch_large_gender_immovable_110p_reference_final_score":2102.0,"objective_fixed_iteration_case_stretch_large_gender_immovable_110p_weight":1.0,"objective_fixed_iteration_case_stretch_large_gender_immovable_110p_weighted_contribution":1.0,"objective_fixed_iteration_case_stretch_sailing_trip_demo_real_final_score":4362.0,"objective_fixed_iteration_case_stretch_sailing_trip_demo_real_normalized_score":1.0,"objective_fixed_iteration_case_stretch_sailing_trip_demo_real_reference_final_score":4362.0,"objective_fixed_iteration_case_stretch_sailing_trip_demo_real_weight":1.0,"objective_fixed_iteration_case_stretch_sailing_trip_demo_real_weighted_contribution":1.0,"objective_fixed_iteration_case_stretch_social_golfer_32x8x10_final_score":5388.0,"objective_fixed_iteration_case_stretch_social_golfer_32x8x10_normalized_score":0.9961175818080976,"objective_fixed_iteration_case_stretch_social_golfer_32x8x10_reference_final_score":5409.0,"objective_fixed_iteration_case_stretch_social_golfer_32x8x10_weight":1.0,"objective_fixed_iteration_case_stretch_social_golfer_32x8x10_weighted_contribution":0.9961175818080976,"objective_fixed_iteration_case_stretch_synthetic_partial_attendance_capacity_pressure_152p_final_score":6538.0,"objective_fixed_iteration_case_stretch_synthetic_partial_attendance_capacity_pressure_152p_normalized_score":1.0,"objective_fixed_iteration_case_stretch_synthetic_partial_attendance_capacity_pressure_152p_reference_final_score":6538.0,"objective_fixed_iteration_case_stretch_synthetic_partial_attendance_capacity_pressure_152p_weight":1.0,"objective_fixed_iteration_case_stretch_synthetic_partial_attendance_capacity_pressure_152p_weighted_contribution":1.0,"objective_fixed_iteration_external_validation_failures":0.0,"objective_fixed_iteration_score_breakdown_mismatches":0.0,"objective_fixed_iteration_total_final_score_raw":23356.0,"objective_fixed_iteration_total_runtime_seconds":116.055774853,"objective_fixed_iteration_total_score_mismatches":0.0,"objective_suite_average_final_score_raw":2584.0,"objective_suite_average_runtime_seconds":150.00006312733333,"objective_suite_case_adversarial_clique_swap_functionality_35p_final_score":4765.0,"objective_suite_case_adversarial_clique_swap_functionality_35p_normalized_score":1.0,"objective_suite_case_adversarial_clique_swap_functionality_35p_reference_final_score":4765.0,"objective_suite_case_adversarial_clique_swap_functionality_35p_weight":1.0,"objective_suite_case_adversarial_clique_swap_functionality_35p_weighted_contribution":1.0,"objective_suite_case_adversarial_transfer_attribute_balance_111p_final_score":183.0,"objective_suite_case_adversarial_transfer_attribute_balance_111p_normalized_score":1.0,"objective_suite_case_adversarial_transfer_attribute_balance_111p_reference_final_score":183.0,"objective_suite_case_adversarial_transfer_attribute_balance_111p_weight":1.0,"objective_suite_case_adversarial_transfer_attribute_balance_111p_weighted_contribution":1.0,"objective_suite_case_count":9.0,"objective_suite_case_representative_small_workshop_balanced_final_score":3.0,"objective_suite_case_representative_small_workshop_balanced_normalized_score":1.0,"objective_suite_case_representative_small_workshop_balanced_reference_final_score":3.0,"objective_suite_case_representative_small_workshop_balanced_weight":1.0,"objective_suite_case_representative_small_workshop_balanced_weighted_contribution":1.0,"objective_suite_case_representative_small_workshop_constrained_final_score":4.0,"objective_suite_case_representative_small_workshop_constrained_normalized_score":1.0,"objective_suite_case_representative_small_workshop_constrained_reference_final_score":4.0,"objective_suite_case_representative_small_workshop_constrained_weight":1.0,"objective_suite_case_representative_small_workshop_constrained_weighted_contribution":1.0,"objective_suite_case_stretch_kirkman_schoolgirls_15x5x7_final_score":0.0,"objective_suite_case_stretch_kirkman_schoolgirls_15x5x7_normalized_score":0.0,"objective_suite_case_stretch_kirkman_schoolgirls_15x5x7_reference_final_score":55.0,"objective_suite_case_stretch_kirkman_schoolgirls_15x5x7_weight":1.0,"objective_suite_case_stretch_kirkman_schoolgirls_15x5x7_weighted_contribution":0.0,"objective_suite_case_stretch_large_gender_immovable_110p_final_score":2102.0,"objective_suite_case_stretch_large_gender_immovable_110p_normalized_score":1.0,"objective_suite_case_stretch_large_gender_immovable_110p_reference_final_score":2102.0,"objective_suite_case_stretch_large_gender_immovable_110p_weight":1.0,"objective_suite_case_stretch_large_gender_immovable_110p_weighted_contribution":1.0,"objective_suite_case_stretch_sailing_trip_demo_real_final_score":4356.0,"objective_suite_case_stretch_sailing_trip_demo_real_normalized_score":0.9995410738871042,"objective_suite_case_stretch_sailing_trip_demo_real_reference_final_score":4358.0,"objective_suite_case_stretch_sailing_trip_demo_real_weight":1.0,"objective_suite_case_stretch_sailing_trip_demo_real_weighted_contribution":0.9995410738871042,"objective_suite_case_stretch_social_golfer_32x8x10_final_score":5346.0,"objective_suite_case_stretch_social_golfer_32x8x10_normalized_score":0.9883527454242929,"objective_suite_case_stretch_social_golfer_32x8x10_reference_final_score":5409.0,"objective_suite_case_stretch_social_golfer_32x8x10_weight":1.0,"objective_suite_case_stretch_social_golfer_32x8x10_weighted_contribution":0.9883527454242929,"objective_suite_case_stretch_synthetic_partial_attendance_capacity_pressure_152p_final_score":6497.0,"objective_suite_case_stretch_synthetic_partial_attendance_capacity_pressure_152p_normalized_score":1.0,"objective_suite_case_stretch_synthetic_partial_attendance_capacity_pressure_152p_reference_final_score":6497.0,"objective_suite_case_stretch_synthetic_partial_attendance_capacity_pressure_152p_weight":1.0,"objective_suite_case_stretch_synthetic_partial_attendance_capacity_pressure_152p_weighted_contribution":1.0,"objective_suite_external_validation_failures":0.0,"objective_suite_score_breakdown_mismatches":0.0,"objective_suite_total_final_score_raw":23256.0,"objective_suite_total_runtime_seconds":1350.000568146,"objective_suite_total_score_mismatches":0.0,"path_allowed_sessions_iter_us":0.629725,"path_avg_iter_us":0.70358,"path_clique_iter_us":0.8092750000000001,"path_construction_iter_us":0.9514750000000001,"path_swap_iter_us":0.7341749999999999,"path_transfer_iter_us":0.39325,"rep_avg_iter_us":0.969613768115942,"rep_balanced_iter_us":1.0119666666666667,"rep_balanced_score":3.0,"rep_constrained_iter_us":0.9272608695652175,"rep_constrained_score":9.0,"runtime_canonical_share_percent":99.9982763335473,"runtime_total_seconds":1350.023838054,"solver3_raw_score_us":3.5696885597826085,"swap_apply_us":0.210765625,"swap_preview_us":0.332671875,"transfer_apply_us":0.200703125,"transfer_preview_us":0.3455625},"status":"keep","description":"Kept a more aggressive pure-zero-repeat donor policy: lower donor recombination trigger/cooldown windows and allow deeper stagnation-scaled child polish for the zero-repeat donor_session_transplant + sgp_week_pair_tabu route.","timestamp":1776143174205,"segment":0,"confidence":2.0086157884221776,"iterationTokens":2418}
