{"run":31,"commit":"903743d","metric":101.40632223196575,"metrics":{"clique_apply_us":2.7912916666666665,"clique_preview_us":12.7905,"correctness_suite_average_runtime_seconds":0.20750426,"correctness_suite_case_count":4.0,"correctness_suite_external_validation_failures":0.0,"correctness_suite_total_runtime_seconds":0.83001704,"correctness_suite_total_score_mismatches":0.0,"hotpath_total_us":31.978197916666666,"objective_fixed_iteration_average_final_score_raw":3603.6666666666665,"objective_fixed_iteration_average_runtime_seconds":50.83366640533333,"objective_fixed_iteration_case_adversarial_clique_swap_functionality_35p_final_score":4765.0,"objective_fixed_iteration_case_adversarial_clique_swap_functionality_35p_normalized_score":1.001892346509672,"objective_fixed_iteration_case_adversarial_clique_swap_functionality_35p_reference_final_score":4756.0,"objective_fixed_iteration_case_adversarial_clique_swap_functionality_35p_weight":1.0,"objective_fixed_iteration_case_adversarial_clique_swap_functionality_35p_weighted_contribution":1.001892346509672,"objective_fixed_iteration_case_adversarial_transfer_attribute_balance_111p_final_score":203.0,"objective_fixed_iteration_case_adversarial_transfer_attribute_balance_111p_normalized_score":0.9950980392156863,"objective_fixed_iteration_case_adversarial_transfer_attribute_balance_111p_reference_final_score":204.0,"objective_fixed_iteration_case_adversarial_transfer_attribute_balance_111p_weight":1.0,"objective_fixed_iteration_case_adversarial_transfer_attribute_balance_111p_weighted_contribution":0.9950980392156863,"objective_fixed_iteration_case_count":6.0,"objective_fixed_iteration_case_stretch_large_gender_immovable_110p_final_score":2157.0,"objective_fixed_iteration_case_stretch_large_gender_immovable_110p_normalized_score":1.010304449648712,"objective_fixed_iteration_case_stretch_large_gender_immovable_110p_reference_final_score":2135.0,"objective_fixed_iteration_case_stretch_large_gender_immovable_110p_weight":1.0,"objective_fixed_iteration_case_stretch_large_gender_immovable_110p_weighted_contribution":1.010304449648712,"objective_fixed_iteration_case_stretch_sailing_trip_demo_real_final_score":2305.0,"objective_fixed_iteration_case_stretch_sailing_trip_demo_real_normalized_score":1.0382882882882882,"objective_fixed_iteration_case_stretch_sailing_trip_demo_real_reference_final_score":2220.0,"objective_fixed_iteration_case_stretch_sailing_trip_demo_real_weight":1.0,"objective_fixed_iteration_case_stretch_sailing_trip_demo_real_weighted_contribution":1.0382882882882882,"objective_fixed_iteration_case_stretch_social_golfer_32x8x10_final_score":5451.0,"objective_fixed_iteration_case_stretch_social_golfer_32x8x10_normalized_score":0.9923539049699618,"objective_fixed_iteration_case_stretch_social_golfer_32x8x10_reference_final_score":5493.0,"objective_fixed_iteration_case_stretch_social_golfer_32x8x10_weight":1.0,"objective_fixed_iteration_case_stretch_social_golfer_32x8x10_weighted_contribution":0.9923539049699618,"objective_fixed_iteration_case_stretch_synthetic_partial_attendance_capacity_pressure_152p_final_score":6741.0,"objective_fixed_iteration_case_stretch_synthetic_partial_attendance_capacity_pressure_152p_normalized_score":1.0181241504304486,"objective_fixed_iteration_case_stretch_synthetic_partial_attendance_capacity_pressure_152p_reference_final_score":6621.0,"objective_fixed_iteration_case_stretch_synthetic_partial_attendance_capacity_pressure_152p_weight":1.0,"objective_fixed_iteration_case_stretch_synthetic_partial_attendance_capacity_pressure_152p_weighted_contribution":1.0181241504304486,"objective_fixed_iteration_external_validation_failures":0.0,"objective_fixed_iteration_score_breakdown_mismatches":0.0,"objective_fixed_iteration_total_final_score_raw":21622.0,"objective_fixed_iteration_total_runtime_seconds":305.001998432,"objective_fixed_iteration_total_score_mismatches":0.0,"objective_fixed_iteration_weighted_normalized_score":100.93435298437947,"objective_fixed_iteration_weighted_normalized_score_delta_from_reference":0.9343529843794718,"objective_fixed_iteration_weighted_normalized_score_weight_sum":6.0,"objective_suite_average_final_score_raw":3640.0,"objective_suite_average_runtime_seconds":15.668873849666667,"objective_suite_case_adversarial_clique_swap_functionality_35p_final_score":4765.0,"objective_suite_case_adversarial_clique_swap_functionality_35p_normalized_score":1.001892346509672,"objective_suite_case_adversarial_clique_swap_functionality_35p_reference_final_score":4756.0,"objective_suite_case_adversarial_clique_swap_functionality_35p_weight":1.0,"objective_suite_case_adversarial_clique_swap_functionality_35p_weighted_contribution":1.001892346509672,"objective_suite_case_adversarial_transfer_attribute_balance_111p_final_score":204.0,"objective_suite_case_adversarial_transfer_attribute_balance_111p_normalized_score":1.0303030303030303,"objective_suite_case_adversarial_transfer_attribute_balance_111p_reference_final_score":198.0,"objective_suite_case_adversarial_transfer_attribute_balance_111p_weight":1.0,"objective_suite_case_adversarial_transfer_attribute_balance_111p_weighted_contribution":1.0303030303030303,"objective_suite_case_count":6.0,"objective_suite_case_stretch_large_gender_immovable_110p_final_score":2333.0,"objective_suite_case_stretch_large_gender_immovable_110p_normalized_score":1.0706746213859568,"objective_suite_case_stretch_large_gender_immovable_110p_reference_final_score":2179.0,"objective_suite_case_stretch_large_gender_immovable_110p_weight":1.0,"objective_suite_case_stretch_large_gender_immovable_110p_weighted_contribution":1.0706746213859568,"objective_suite_case_stretch_sailing_trip_demo_real_final_score":2322.0,"objective_suite_case_stretch_sailing_trip_demo_real_normalized_score":0.9703301295445048,"objective_suite_case_stretch_sailing_trip_demo_real_reference_final_score":2393.0,"objective_suite_case_stretch_sailing_trip_demo_real_weight":1.0,"objective_suite_case_stretch_sailing_trip_demo_real_weighted_contribution":0.9703301295445048,"objective_suite_case_stretch_social_golfer_32x8x10_final_score":5451.0,"objective_suite_case_stretch_social_golfer_32x8x10_normalized_score":0.9923539049699618,"objective_suite_case_stretch_social_golfer_32x8x10_reference_final_score":5493.0,"objective_suite_case_stretch_social_golfer_32x8x10_weight":1.0,"objective_suite_case_stretch_social_golfer_32x8x10_weighted_contribution":0.9923539049699618,"objective_suite_case_stretch_synthetic_partial_attendance_capacity_pressure_152p_final_score":6765.0,"objective_suite_case_stretch_synthetic_partial_attendance_capacity_pressure_152p_normalized_score":1.0188253012048192,"objective_suite_case_stretch_synthetic_partial_attendance_capacity_pressure_152p_reference_final_score":6640.0,"objective_suite_case_stretch_synthetic_partial_attendance_capacity_pressure_152p_weight":1.0,"objective_suite_case_stretch_synthetic_partial_attendance_capacity_pressure_152p_weighted_contribution":1.0188253012048192,"objective_suite_external_validation_failures":0.0,"objective_suite_score_breakdown_mismatches":0.0,"objective_suite_total_final_score_raw":21840.0,"objective_suite_total_runtime_seconds":94.013243098,"objective_suite_total_score_mismatches":0.0,"objective_suite_weighted_normalized_score":101.40632223196575,"objective_suite_weighted_normalized_score_delta_from_reference":1.406322231965751,"objective_suite_weighted_normalized_score_weight_sum":6.0,"path_allowed_sessions_iter_us":26.42315,"path_avg_iter_us":16.960185,"path_clique_iter_us":17.64305,"path_construction_iter_us":21.362025,"path_swap_iter_us":11.21945,"path_transfer_iter_us":8.15325,"rep_avg_iter_us":30.130594444444448,"rep_balanced_iter_us":28.966966666666668,"rep_balanced_score":3.0,"rep_constrained_iter_us":31.294222222222224,"rep_constrained_score":4.0,"runtime_canonical_share_percent":99.1248539550493,"runtime_total_seconds":94.843260138,"solver3_raw_score_us":79.06897736111111,"swap_apply_us":2.60415625,"swap_preview_us":7.704,"transfer_apply_us":2.2887656250000004,"transfer_preview_us":3.799484375},"status":"discard","description":"Second unchanged-champion rerun to check stability after the first slow diagnostic rerun. The result stayed poor relative to the kept best and remained far above 100.8462, so the earlier champion win still stands; the issue is that current reruns are underperforming, not that recent experimental variants secretly beat the champion.","timestamp":1775672853208,"segment":0,"confidence":953.3069463396006,"iterationTokens":5237,"asi":{"hypothesis":"A second same-code rerun will tell us whether the first bad rerun was a one-off random miss or part of a sustained worse regime.","rollback_reason":"This was another diagnostic rerun on unchanged code and again did not improve the primary metric.","next_action_hint":"Do not reinterpret the bad reruns as evidence that newer discarded variants were better; instead treat them as evidence of substantial same-code variance/system-state drift and compare all recent results against the actual champion value 100.8462.","mechanism_family":"champion stability / system-drift check","comparison":{"best_keep_metric":"100.84622890492095","first_rerun_metric":"101.37846319867421","second_rerun_metric":"101.40632223196575","second_rerun_solver3_raw_score_us":"79.07"},"learning":"Back-to-back same-code reruns remained ~0.53-0.56 worse than the kept best, so the champion did not reproduce, but neither rerun crossed below the champion."}}
{"run":32,"commit":"903743d","metric":101.72909305202029,"metrics":{"clique_apply_us":2.8321875000000003,"clique_preview_us":13.545958333333331,"correctness_suite_average_runtime_seconds":0.20404542,"correctness_suite_case_count":4.0,"correctness_suite_external_validation_failures":0.0,"correctness_suite_total_runtime_seconds":0.81618168,"correctness_suite_total_score_mismatches":0.0,"hotpath_total_us":31.66030208333333,"objective_fixed_iteration_average_final_score_raw":3603.3333333333335,"objective_fixed_iteration_average_runtime_seconds":50.81690365516666,"objective_fixed_iteration_case_adversarial_clique_swap_functionality_35p_final_score":4765.0,"objective_fixed_iteration_case_adversarial_clique_swap_functionality_35p_normalized_score":1.001892346509672,"objective_fixed_iteration_case_adversarial_clique_swap_functionality_35p_reference_final_score":4756.0,"objective_fixed_iteration_case_adversarial_clique_swap_functionality_35p_weight":1.0,"objective_fixed_iteration_case_adversarial_clique_swap_functionality_35p_weighted_contribution":1.001892346509672,"objective_fixed_iteration_case_adversarial_transfer_attribute_balance_111p_final_score":201.0,"objective_fixed_iteration_case_adversarial_transfer_attribute_balance_111p_normalized_score":0.9852941176470589,"objective_fixed_iteration_case_adversarial_transfer_attribute_balance_111p_reference_final_score":204.0,"objective_fixed_iteration_case_adversarial_transfer_attribute_balance_111p_weight":1.0,"objective_fixed_iteration_case_adversarial_transfer_attribute_balance_111p_weighted_contribution":0.9852941176470589,"objective_fixed_iteration_case_count":6.0,"objective_fixed_iteration_case_stretch_large_gender_immovable_110p_final_score":2157.0,"objective_fixed_iteration_case_stretch_large_gender_immovable_110p_normalized_score":1.010304449648712,"objective_fixed_iteration_case_stretch_large_gender_immovable_110p_reference_final_score":2135.0,"objective_fixed_iteration_case_stretch_large_gender_immovable_110p_weight":1.0,"objective_fixed_iteration_case_stretch_large_gender_immovable_110p_weighted_contribution":1.010304449648712,"objective_fixed_iteration_case_stretch_sailing_trip_demo_real_final_score":2305.0,"objective_fixed_iteration_case_stretch_sailing_trip_demo_real_normalized_score":1.0382882882882882,"objective_fixed_iteration_case_stretch_sailing_trip_demo_real_reference_final_score":2220.0,"objective_fixed_iteration_case_stretch_sailing_trip_demo_real_weight":1.0,"objective_fixed_iteration_case_stretch_sailing_trip_demo_real_weighted_contribution":1.0382882882882882,"objective_fixed_iteration_case_stretch_social_golfer_32x8x10_final_score":5451.0,"objective_fixed_iteration_case_stretch_social_golfer_32x8x10_normalized_score":0.9923539049699618,"objective_fixed_iteration_case_stretch_social_golfer_32x8x10_reference_final_score":5493.0,"objective_fixed_iteration_case_stretch_social_golfer_32x8x10_weight":1.0,"objective_fixed_iteration_case_stretch_social_golfer_32x8x10_weighted_contribution":0.9923539049699618,"objective_fixed_iteration_case_stretch_synthetic_partial_attendance_capacity_pressure_152p_final_score":6741.0,"objective_fixed_iteration_case_stretch_synthetic_partial_attendance_capacity_pressure_152p_normalized_score":1.0181241504304486,"objective_fixed_iteration_case_stretch_synthetic_partial_attendance_capacity_pressure_152p_reference_final_score":6621.0,"objective_fixed_iteration_case_stretch_synthetic_partial_attendance_capacity_pressure_152p_weight":1.0,"objective_fixed_iteration_case_stretch_synthetic_partial_attendance_capacity_pressure_152p_weighted_contribution":1.0181241504304486,"objective_fixed_iteration_external_validation_failures":0.0,"objective_fixed_iteration_score_breakdown_mismatches":0.0,"objective_fixed_iteration_total_final_score_raw":21620.0,"objective_fixed_iteration_total_runtime_seconds":304.901421931,"objective_fixed_iteration_total_score_mismatches":0.0,"objective_fixed_iteration_weighted_normalized_score":100.77095429156901,"objective_fixed_iteration_weighted_normalized_score_delta_from_reference":0.7709542915690148,"objective_fixed_iteration_weighted_normalized_score_weight_sum":6.0,"objective_suite_average_final_score_raw":3640.3333333333335,"objective_suite_average_runtime_seconds":15.668598555833332,"objective_suite_case_adversarial_clique_swap_functionality_35p_final_score":4765.0,"objective_suite_case_adversarial_clique_swap_functionality_35p_normalized_score":1.001892346509672,"objective_suite_case_adversarial_clique_swap_functionality_35p_reference_final_score":4756.0,"objective_suite_case_adversarial_clique_swap_functionality_35p_weight":1.0,"objective_suite_case_adversarial_clique_swap_functionality_35p_weighted_contribution":1.001892346509672,"objective_suite_case_adversarial_transfer_attribute_balance_111p_final_score":208.0,"objective_suite_case_adversarial_transfer_attribute_balance_111p_normalized_score":1.0505050505050506,"objective_suite_case_adversarial_transfer_attribute_balance_111p_reference_final_score":198.0,"objective_suite_case_adversarial_transfer_attribute_balance_111p_weight":1.0,"objective_suite_case_adversarial_transfer_attribute_balance_111p_weighted_contribution":1.0505050505050506,"objective_suite_case_count":6.0,"objective_suite_case_stretch_large_gender_immovable_110p_final_score":2333.0,"objective_suite_case_stretch_large_gender_immovable_110p_normalized_score":1.0706746213859568,"objective_suite_case_stretch_large_gender_immovable_110p_reference_final_score":2179.0,"objective_suite_case_stretch_large_gender_immovable_110p_weight":1.0,"objective_suite_case_stretch_large_gender_immovable_110p_weighted_contribution":1.0706746213859568,"objective_suite_case_stretch_sailing_trip_demo_real_final_score":2320.0,"objective_suite_case_stretch_sailing_trip_demo_real_normalized_score":0.9694943585457585,"objective_suite_case_stretch_sailing_trip_demo_real_reference_final_score":2393.0,"objective_suite_case_stretch_sailing_trip_demo_real_weight":1.0,"objective_suite_case_stretch_sailing_trip_demo_real_weighted_contribution":0.9694943585457585,"objective_suite_case_stretch_social_golfer_32x8x10_final_score":5451.0,"objective_suite_case_stretch_social_golfer_32x8x10_normalized_score":0.9923539049699618,"objective_suite_case_stretch_social_golfer_32x8x10_reference_final_score":5493.0,"objective_suite_case_stretch_social_golfer_32x8x10_weight":1.0,"objective_suite_case_stretch_social_golfer_32x8x10_weighted_contribution":0.9923539049699618,"objective_suite_case_stretch_synthetic_partial_attendance_capacity_pressure_152p_final_score":6765.0,"objective_suite_case_stretch_synthetic_partial_attendance_capacity_pressure_152p_normalized_score":1.0188253012048192,"objective_suite_case_stretch_synthetic_partial_attendance_capacity_pressure_152p_reference_final_score":6640.0,"objective_suite_case_stretch_synthetic_partial_attendance_capacity_pressure_152p_weight":1.0,"objective_suite_case_stretch_synthetic_partial_attendance_capacity_pressure_152p_weighted_contribution":1.0188253012048192,"objective_suite_external_validation_failures":0.0,"objective_suite_score_breakdown_mismatches":0.0,"objective_suite_total_final_score_raw":21842.0,"objective_suite_total_runtime_seconds":94.01159133499999,"objective_suite_total_score_mismatches":0.0,"objective_suite_weighted_normalized_score":101.72909305202029,"objective_suite_weighted_normalized_score_delta_from_reference":1.7290930520202918,"objective_suite_weighted_normalized_score_weight_sum":6.0,"path_allowed_sessions_iter_us":24.965375,"path_avg_iter_us":17.02506,"path_clique_iter_us":18.094500000000004,"path_construction_iter_us":21.715825,"path_swap_iter_us":12.160675000000001,"path_transfer_iter_us":8.188925000000001,"rep_avg_iter_us":30.234799074074076,"rep_balanced_iter_us":28.824783333333336,"rep_balanced_score":3.0,"rep_constrained_iter_us":31.644814814814815,"rep_constrained_score":4.0,"runtime_canonical_share_percent":99.13930101482937,"runtime_total_seconds":94.827773015,"solver3_raw_score_us":78.9201611574074,"swap_apply_us":2.362265625,"swap_preview_us":6.5986875,"transfer_apply_us":2.3784843749999998,"transfer_preview_us":3.94271875},"status":"discard","description":"Hotspot repair burst follow-up: added a stagnation-triggered clique-aware macro repair operator that picks the highest-pressure session and applies up to three exact-recomputed improving block transfers (singletons or whole active cliques) before the existing memetic burst. This stronger session-local repair idea was benchmark-honest but clearly uncompetitive, worsening transfer-balance without fixing the large_gender/synthetic blockers.","timestamp":1775673552844,"segment":0,"confidence":888.7732379227493,"iterationTokens":16606,"asi":{"hypothesis":"A targeted clique-safe hotspot repair burst over exact block transfers within one pressured session can give ALNS-style repair coverage that is broader than the old tiny two-group kernel while remaining compatible with the current search loop.","rollback_reason":"Primary regressed badly to 101.7291, so this first session-local block-transfer repair burst is not competitive enough to keep.","next_action_hint":"Record this as a materially tried macro repair operator and pivot again; if repair is revisited later, it likely needs richer destroy+repair structure or swap/cycle coverage rather than greedy exact block transfers alone.","mechanism_family":"hotspot session-local exact block-transfer repair","observed_case_pattern":{"transfer_balance":"1.0505","large_gender":"1.0707","sailing":"0.9695","social_golfer":"0.9924","synthetic":"1.0188"},"learning":"Even clique-aware exact block transfers inside one hotspot session are too myopic in this form and can make the balance case worse."}}
