{"run":27,"commit":"903743d","metric":101.29436537478749,"metrics":{"clique_apply_us":2.7488333333333332,"clique_preview_us":12.898145833333334,"correctness_suite_average_runtime_seconds":0.18672704425,"correctness_suite_case_count":4.0,"correctness_suite_external_validation_failures":0.0,"correctness_suite_total_runtime_seconds":0.746908177,"correctness_suite_total_score_mismatches":0.0,"hotpath_total_us":32.098932291666664,"objective_fixed_iteration_average_final_score_raw":3602.6666666666665,"objective_fixed_iteration_average_runtime_seconds":50.76542913066667,"objective_fixed_iteration_case_adversarial_clique_swap_functionality_35p_final_score":4765.0,"objective_fixed_iteration_case_adversarial_clique_swap_functionality_35p_normalized_score":1.001892346509672,"objective_fixed_iteration_case_adversarial_clique_swap_functionality_35p_reference_final_score":4756.0,"objective_fixed_iteration_case_adversarial_clique_swap_functionality_35p_weight":1.0,"objective_fixed_iteration_case_adversarial_clique_swap_functionality_35p_weighted_contribution":1.001892346509672,"objective_fixed_iteration_case_adversarial_transfer_attribute_balance_111p_final_score":197.0,"objective_fixed_iteration_case_adversarial_transfer_attribute_balance_111p_normalized_score":0.9656862745098039,"objective_fixed_iteration_case_adversarial_transfer_attribute_balance_111p_reference_final_score":204.0,"objective_fixed_iteration_case_adversarial_transfer_attribute_balance_111p_weight":1.0,"objective_fixed_iteration_case_adversarial_transfer_attribute_balance_111p_weighted_contribution":0.9656862745098039,"objective_fixed_iteration_case_count":6.0,"objective_fixed_iteration_case_stretch_large_gender_immovable_110p_final_score":2157.0,"objective_fixed_iteration_case_stretch_large_gender_immovable_110p_normalized_score":1.010304449648712,"objective_fixed_iteration_case_stretch_large_gender_immovable_110p_reference_final_score":2135.0,"objective_fixed_iteration_case_stretch_large_gender_immovable_110p_weight":1.0,"objective_fixed_iteration_case_stretch_large_gender_immovable_110p_weighted_contribution":1.010304449648712,"objective_fixed_iteration_case_stretch_sailing_trip_demo_real_final_score":2305.0,"objective_fixed_iteration_case_stretch_sailing_trip_demo_real_normalized_score":1.0382882882882882,"objective_fixed_iteration_case_stretch_sailing_trip_demo_real_reference_final_score":2220.0,"objective_fixed_iteration_case_stretch_sailing_trip_demo_real_weight":1.0,"objective_fixed_iteration_case_stretch_sailing_trip_demo_real_weighted_contribution":1.0382882882882882,"objective_fixed_iteration_case_stretch_social_golfer_32x8x10_final_score":5451.0,"objective_fixed_iteration_case_stretch_social_golfer_32x8x10_normalized_score":0.9923539049699618,"objective_fixed_iteration_case_stretch_social_golfer_32x8x10_reference_final_score":5493.0,"objective_fixed_iteration_case_stretch_social_golfer_32x8x10_weight":1.0,"objective_fixed_iteration_case_stretch_social_golfer_32x8x10_weighted_contribution":0.9923539049699618,"objective_fixed_iteration_case_stretch_synthetic_partial_attendance_capacity_pressure_152p_final_score":6741.0,"objective_fixed_iteration_case_stretch_synthetic_partial_attendance_capacity_pressure_152p_normalized_score":1.0181241504304486,"objective_fixed_iteration_case_stretch_synthetic_partial_attendance_capacity_pressure_152p_reference_final_score":6621.0,"objective_fixed_iteration_case_stretch_synthetic_partial_attendance_capacity_pressure_152p_weight":1.0,"objective_fixed_iteration_case_stretch_synthetic_partial_attendance_capacity_pressure_152p_weighted_contribution":1.0181241504304486,"objective_fixed_iteration_external_validation_failures":0.0,"objective_fixed_iteration_score_breakdown_mismatches":0.0,"objective_fixed_iteration_total_final_score_raw":21616.0,"objective_fixed_iteration_total_runtime_seconds":304.592574784,"objective_fixed_iteration_total_score_mismatches":0.0,"objective_fixed_iteration_weighted_normalized_score":100.4441569059481,"objective_fixed_iteration_weighted_normalized_score_delta_from_reference":0.444156905948101,"objective_fixed_iteration_weighted_normalized_score_weight_sum":6.0,"objective_suite_average_final_score_raw":3635.8333333333335,"objective_suite_average_runtime_seconds":15.668986792333333,"objective_suite_case_adversarial_clique_swap_functionality_35p_final_score":4765.0,"objective_suite_case_adversarial_clique_swap_functionality_35p_normalized_score":1.001892346509672,"objective_suite_case_adversarial_clique_swap_functionality_35p_reference_final_score":4756.0,"objective_suite_case_adversarial_clique_swap_functionality_35p_weight":1.0,"objective_suite_case_adversarial_clique_swap_functionality_35p_weighted_contribution":1.001892346509672,"objective_suite_case_adversarial_transfer_attribute_balance_111p_final_score":205.0,"objective_suite_case_adversarial_transfer_attribute_balance_111p_normalized_score":1.0353535353535352,"objective_suite_case_adversarial_transfer_attribute_balance_111p_reference_final_score":198.0,"objective_suite_case_adversarial_transfer_attribute_balance_111p_weight":1.0,"objective_suite_case_adversarial_transfer_attribute_balance_111p_weighted_contribution":1.0353535353535352,"objective_suite_case_count":6.0,"objective_suite_case_stretch_large_gender_immovable_110p_final_score":2311.0,"objective_suite_case_stretch_large_gender_immovable_110p_normalized_score":1.0605782469022487,"objective_suite_case_stretch_large_gender_immovable_110p_reference_final_score":2179.0,"objective_suite_case_stretch_large_gender_immovable_110p_weight":1.0,"objective_suite_case_stretch_large_gender_immovable_110p_weighted_contribution":1.0605782469022487,"objective_suite_case_stretch_sailing_trip_demo_real_final_score":2318.0,"objective_suite_case_stretch_sailing_trip_demo_real_normalized_score":0.9686585875470122,"objective_suite_case_stretch_sailing_trip_demo_real_reference_final_score":2393.0,"objective_suite_case_stretch_sailing_trip_demo_real_weight":1.0,"objective_suite_case_stretch_sailing_trip_demo_real_weighted_contribution":0.9686585875470122,"objective_suite_case_stretch_social_golfer_32x8x10_final_score":5451.0,"objective_suite_case_stretch_social_golfer_32x8x10_normalized_score":0.9923539049699618,"objective_suite_case_stretch_social_golfer_32x8x10_reference_final_score":5493.0,"objective_suite_case_stretch_social_golfer_32x8x10_weight":1.0,"objective_suite_case_stretch_social_golfer_32x8x10_weighted_contribution":0.9923539049699618,"objective_suite_case_stretch_synthetic_partial_attendance_capacity_pressure_152p_final_score":6765.0,"objective_suite_case_stretch_synthetic_partial_attendance_capacity_pressure_152p_normalized_score":1.0188253012048192,"objective_suite_case_stretch_synthetic_partial_attendance_capacity_pressure_152p_reference_final_score":6640.0,"objective_suite_case_stretch_synthetic_partial_attendance_capacity_pressure_152p_weight":1.0,"objective_suite_case_stretch_synthetic_partial_attendance_capacity_pressure_152p_weighted_contribution":1.0188253012048192,"objective_suite_external_validation_failures":0.0,"objective_suite_score_breakdown_mismatches":0.0,"objective_suite_total_final_score_raw":21815.0,"objective_suite_total_runtime_seconds":94.013920754,"objective_suite_total_score_mismatches":0.0,"objective_suite_weighted_normalized_score":101.29436537478749,"objective_suite_weighted_normalized_score_delta_from_reference":1.2943653747874873,"objective_suite_weighted_normalized_score_weight_sum":6.0,"path_allowed_sessions_iter_us":24.985699999999998,"path_avg_iter_us":16.95446,"path_clique_iter_us":18.79445,"path_construction_iter_us":21.213900000000002,"path_swap_iter_us":11.47315,"path_transfer_iter_us":8.3051,"rep_avg_iter_us":41.02688333333333,"rep_balanced_iter_us":50.8226,"rep_balanced_score":3.0,"rep_constrained_iter_us":31.231166666666667,"rep_constrained_score":4.0,"runtime_canonical_share_percent":99.21179649289068,"runtime_total_seconds":94.760828931,"solver3_raw_score_us":90.080275625,"swap_apply_us":2.3590781250000004,"swap_preview_us":7.871531249999999,"transfer_apply_us":2.3159687499999997,"transfer_preview_us":3.905375},"status":"discard","description":"Exact joint two-session donor recombination: replaced single-session exact offspring scoring with exact evaluation of every 1-session and 2-session transplant bundle from each polished donor. This benchmark-honest richer recombination unit still regressed versus the kept two-donor single-session memetic line and also slowed the hotpath, so the extra bundle expressiveness did not unlock the missing quality.","timestamp":1775670508311,"segment":0,"confidence":535.7644222883782,"iterationTokens":8492,"asi":{"hypothesis":"Exact evaluation of joint two-session donor bundles can capture positive interaction that naive greedy stacking missed and make memetic recombination meaningfully stronger.","rollback_reason":"Primary remained well above the kept memetic best (101.2944 vs 100.8462) and solver3_raw_score_us also worsened materially.","next_action_hint":"Record this as the first materially tried richer recombination unit; further memetic work should probably focus on much stronger donor generation or a different macro neighborhood rather than more exhaustive bundle scoring over the same donor source.","mechanism_family":"joint exact two-session donor recombination","observed_case_pattern":{"transfer_balance":"1.0354","large_gender":"1.0606","sailing":"0.9687","social_golfer":"0.9924","synthetic":"1.0188"},"learning":"The bottleneck now appears less about greedy interaction misspecification and more about the donor source/recombination unit itself."}}
{"run":28,"commit":"903743d","metric":101.26499642829685,"metrics":{"clique_apply_us":2.8718958333333333,"clique_preview_us":12.687416666666666,"correctness_suite_average_runtime_seconds":0.18038986425,"correctness_suite_case_count":4.0,"correctness_suite_external_validation_failures":0.0,"correctness_suite_total_runtime_seconds":0.721559457,"correctness_suite_total_score_mismatches":0.0,"hotpath_total_us":30.527109375000002,"objective_fixed_iteration_average_final_score_raw":3595.5,"objective_fixed_iteration_average_runtime_seconds":50.780536387333335,"objective_fixed_iteration_case_adversarial_clique_swap_functionality_35p_final_score":4765.0,"objective_fixed_iteration_case_adversarial_clique_swap_functionality_35p_normalized_score":1.001892346509672,"objective_fixed_iteration_case_adversarial_clique_swap_functionality_35p_reference_final_score":4756.0,"objective_fixed_iteration_case_adversarial_clique_swap_functionality_35p_weight":1.0,"objective_fixed_iteration_case_adversarial_clique_swap_functionality_35p_weighted_contribution":1.001892346509672,"objective_fixed_iteration_case_adversarial_transfer_attribute_balance_111p_final_score":196.0,"objective_fixed_iteration_case_adversarial_transfer_attribute_balance_111p_normalized_score":0.9607843137254902,"objective_fixed_iteration_case_adversarial_transfer_attribute_balance_111p_reference_final_score":204.0,"objective_fixed_iteration_case_adversarial_transfer_attribute_balance_111p_weight":1.0,"objective_fixed_iteration_case_adversarial_transfer_attribute_balance_111p_weighted_contribution":0.9607843137254902,"objective_fixed_iteration_case_count":6.0,"objective_fixed_iteration_case_stretch_large_gender_immovable_110p_final_score":2157.0,"objective_fixed_iteration_case_stretch_large_gender_immovable_110p_normalized_score":1.010304449648712,"objective_fixed_iteration_case_stretch_large_gender_immovable_110p_reference_final_score":2135.0,"objective_fixed_iteration_case_stretch_large_gender_immovable_110p_weight":1.0,"objective_fixed_iteration_case_stretch_large_gender_immovable_110p_weighted_contribution":1.010304449648712,"objective_fixed_iteration_case_stretch_sailing_trip_demo_real_final_score":2305.0,"objective_fixed_iteration_case_stretch_sailing_trip_demo_real_normalized_score":1.0382882882882882,"objective_fixed_iteration_case_stretch_sailing_trip_demo_real_reference_final_score":2220.0,"objective_fixed_iteration_case_stretch_sailing_trip_demo_real_weight":1.0,"objective_fixed_iteration_case_stretch_sailing_trip_demo_real_weighted_contribution":1.0382882882882882,"objective_fixed_iteration_case_stretch_social_golfer_32x8x10_final_score":5409.0,"objective_fixed_iteration_case_stretch_social_golfer_32x8x10_normalized_score":0.9847078099399236,"objective_fixed_iteration_case_stretch_social_golfer_32x8x10_reference_final_score":5493.0,"objective_fixed_iteration_case_stretch_social_golfer_32x8x10_weight":1.0,"objective_fixed_iteration_case_stretch_social_golfer_32x8x10_weighted_contribution":0.9847078099399236,"objective_fixed_iteration_case_stretch_synthetic_partial_attendance_capacity_pressure_152p_final_score":6741.0,"objective_fixed_iteration_case_stretch_synthetic_partial_attendance_capacity_pressure_152p_normalized_score":1.0181241504304486,"objective_fixed_iteration_case_stretch_synthetic_partial_attendance_capacity_pressure_152p_reference_final_score":6621.0,"objective_fixed_iteration_case_stretch_synthetic_partial_attendance_capacity_pressure_152p_weight":1.0,"objective_fixed_iteration_case_stretch_synthetic_partial_attendance_capacity_pressure_152p_weighted_contribution":1.0181241504304486,"objective_fixed_iteration_external_validation_failures":0.0,"objective_fixed_iteration_score_breakdown_mismatches":0.0,"objective_fixed_iteration_total_final_score_raw":21573.0,"objective_fixed_iteration_total_runtime_seconds":304.683218324,"objective_fixed_iteration_total_score_mismatches":0.0,"objective_fixed_iteration_weighted_normalized_score":100.23502264237558,"objective_fixed_iteration_weighted_normalized_score_delta_from_reference":0.2350226423755819,"objective_fixed_iteration_weighted_normalized_score_weight_sum":6.0,"objective_suite_average_final_score_raw":3631.0,"objective_suite_average_runtime_seconds":15.667605027666667,"objective_suite_case_adversarial_clique_swap_functionality_35p_final_score":4765.0,"objective_suite_case_adversarial_clique_swap_functionality_35p_normalized_score":1.001892346509672,"objective_suite_case_adversarial_clique_swap_functionality_35p_reference_final_score":4756.0,"objective_suite_case_adversarial_clique_swap_functionality_35p_weight":1.0,"objective_suite_case_adversarial_clique_swap_functionality_35p_weighted_contribution":1.001892346509672,"objective_suite_case_adversarial_transfer_attribute_balance_111p_final_score":205.0,"objective_suite_case_adversarial_transfer_attribute_balance_111p_normalized_score":1.0353535353535352,"objective_suite_case_adversarial_transfer_attribute_balance_111p_reference_final_score":198.0,"objective_suite_case_adversarial_transfer_attribute_balance_111p_weight":1.0,"objective_suite_case_adversarial_transfer_attribute_balance_111p_weighted_contribution":1.0353535353535352,"objective_suite_case_count":6.0,"objective_suite_case_stretch_large_gender_immovable_110p_final_score":2322.0,"objective_suite_case_stretch_large_gender_immovable_110p_normalized_score":1.0656264341441029,"objective_suite_case_stretch_large_gender_immovable_110p_reference_final_score":2179.0,"objective_suite_case_stretch_large_gender_immovable_110p_weight":1.0,"objective_suite_case_stretch_large_gender_immovable_110p_weighted_contribution":1.0656264341441029,"objective_suite_case_stretch_sailing_trip_demo_real_final_score":2320.0,"objective_suite_case_stretch_sailing_trip_demo_real_normalized_score":0.9694943585457585,"objective_suite_case_stretch_sailing_trip_demo_real_reference_final_score":2393.0,"objective_suite_case_stretch_sailing_trip_demo_real_weight":1.0,"objective_suite_case_stretch_sailing_trip_demo_real_weighted_contribution":0.9694943585457585,"objective_suite_case_stretch_social_golfer_32x8x10_final_score":5409.0,"objective_suite_case_stretch_social_golfer_32x8x10_normalized_score":0.9847078099399236,"objective_suite_case_stretch_social_golfer_32x8x10_reference_final_score":5493.0,"objective_suite_case_stretch_social_golfer_32x8x10_weight":1.0,"objective_suite_case_stretch_social_golfer_32x8x10_weighted_contribution":0.9847078099399236,"objective_suite_case_stretch_synthetic_partial_attendance_capacity_pressure_152p_final_score":6765.0,"objective_suite_case_stretch_synthetic_partial_attendance_capacity_pressure_152p_normalized_score":1.0188253012048192,"objective_suite_case_stretch_synthetic_partial_attendance_capacity_pressure_152p_reference_final_score":6640.0,"objective_suite_case_stretch_synthetic_partial_attendance_capacity_pressure_152p_weight":1.0,"objective_suite_case_stretch_synthetic_partial_attendance_capacity_pressure_152p_weighted_contribution":1.0188253012048192,"objective_suite_external_validation_failures":0.0,"objective_suite_score_breakdown_mismatches":0.0,"objective_suite_total_final_score_raw":21786.0,"objective_suite_total_runtime_seconds":94.005630166,"objective_suite_total_score_mismatches":0.0,"objective_suite_weighted_normalized_score":101.26499642829685,"objective_suite_weighted_normalized_score_delta_from_reference":1.2649964282968496,"objective_suite_weighted_normalized_score_weight_sum":6.0,"path_allowed_sessions_iter_us":25.131349999999998,"path_avg_iter_us":16.90991,"path_clique_iter_us":17.9411,"path_construction_iter_us":21.68045,"path_swap_iter_us":11.383275000000001,"path_transfer_iter_us":8.413375,"rep_avg_iter_us":30.533534259259262,"rep_balanced_iter_us":28.989050000000002,"rep_balanced_score":3.0,"rep_constrained_iter_us":32.07801851851852,"rep_constrained_score":4.0,"runtime_canonical_share_percent":99.23827629651878,"runtime_total_seconds":94.727189623,"solver3_raw_score_us":77.97055363425926,"swap_apply_us":2.29078125,"swap_preview_us":6.533234375,"transfer_apply_us":2.258375,"transfer_preview_us":3.8854062499999995},"status":"discard","description":"Incumbent-derived hotspot donor generation: instead of polishing fully fresh donors, each memetic donor started from the incumbent best state, replaced the top repeat/balance-pressure sessions with sessions from a diversified random donor, then polished and competed via exact one-session transplant. This new perturb-and-repair donor source was benchmark-honest and directionally active, but still not competitive with the kept two-donor memetic line.","timestamp":1775671332451,"segment":0,"confidence":718.2070081743815,"iterationTokens":37774,"asi":{"hypothesis":"Memetic donors that start from the incumbent and are perturbed through hotspot-session replacement will be structurally more compatible than fully fresh donors, producing higher-value offspring after donor polishing.","rollback_reason":"Primary quality remained clearly above the kept memetic best (101.2650 vs 100.8462), so the first hotspot-donor generator is not yet good enough to keep.","next_action_hint":"Within this incubation window, try selecting replacement sessions by donor-vs-incumbent structural advantage rather than just incumbent hotspot pressure; if that still stalls, retire this donor-generation variant.","mechanism_family":"incumbent-derived hotspot donor generation","observed_case_pattern":{"social_golfer":"0.9847","sailing":"0.9695","large_gender":"1.0656","synthetic":"1.0188","transfer_balance":"1.0354"},"learning":"Changing donor generation was more meaningful than archive/pool tweaks, but a pure incumbent-hotspot selector still imports the wrong sessions too often."}}
