{"run":25,"commit":"903743d","metric":101.26642908120758,"metrics":{"clique_apply_us":2.8271875,"clique_preview_us":12.958833333333335,"correctness_suite_average_runtime_seconds":0.1988945845,"correctness_suite_case_count":4.0,"correctness_suite_external_validation_failures":0.0,"correctness_suite_total_runtime_seconds":0.795578338,"correctness_suite_total_score_mismatches":0.0,"hotpath_total_us":30.942395833333336,"objective_fixed_iteration_average_final_score_raw":3604.6666666666665,"objective_fixed_iteration_average_runtime_seconds":50.844335683833336,"objective_fixed_iteration_case_adversarial_clique_swap_functionality_35p_final_score":4765.0,"objective_fixed_iteration_case_adversarial_clique_swap_functionality_35p_normalized_score":1.001892346509672,"objective_fixed_iteration_case_adversarial_clique_swap_functionality_35p_reference_final_score":4756.0,"objective_fixed_iteration_case_adversarial_clique_swap_functionality_35p_weight":1.0,"objective_fixed_iteration_case_adversarial_clique_swap_functionality_35p_weighted_contribution":1.001892346509672,"objective_fixed_iteration_case_adversarial_transfer_attribute_balance_111p_final_score":206.0,"objective_fixed_iteration_case_adversarial_transfer_attribute_balance_111p_normalized_score":1.0098039215686274,"objective_fixed_iteration_case_adversarial_transfer_attribute_balance_111p_reference_final_score":204.0,"objective_fixed_iteration_case_adversarial_transfer_attribute_balance_111p_weight":1.0,"objective_fixed_iteration_case_adversarial_transfer_attribute_balance_111p_weighted_contribution":1.0098039215686274,"objective_fixed_iteration_case_count":6.0,"objective_fixed_iteration_case_stretch_large_gender_immovable_110p_final_score":2157.0,"objective_fixed_iteration_case_stretch_large_gender_immovable_110p_normalized_score":1.010304449648712,"objective_fixed_iteration_case_stretch_large_gender_immovable_110p_reference_final_score":2135.0,"objective_fixed_iteration_case_stretch_large_gender_immovable_110p_weight":1.0,"objective_fixed_iteration_case_stretch_large_gender_immovable_110p_weighted_contribution":1.010304449648712,"objective_fixed_iteration_case_stretch_sailing_trip_demo_real_final_score":2308.0,"objective_fixed_iteration_case_stretch_sailing_trip_demo_real_normalized_score":1.0396396396396397,"objective_fixed_iteration_case_stretch_sailing_trip_demo_real_reference_final_score":2220.0,"objective_fixed_iteration_case_stretch_sailing_trip_demo_real_weight":1.0,"objective_fixed_iteration_case_stretch_sailing_trip_demo_real_weighted_contribution":1.0396396396396397,"objective_fixed_iteration_case_stretch_social_golfer_32x8x10_final_score":5451.0,"objective_fixed_iteration_case_stretch_social_golfer_32x8x10_normalized_score":0.9923539049699618,"objective_fixed_iteration_case_stretch_social_golfer_32x8x10_reference_final_score":5493.0,"objective_fixed_iteration_case_stretch_social_golfer_32x8x10_weight":1.0,"objective_fixed_iteration_case_stretch_social_golfer_32x8x10_weighted_contribution":0.9923539049699618,"objective_fixed_iteration_case_stretch_synthetic_partial_attendance_capacity_pressure_152p_final_score":6741.0,"objective_fixed_iteration_case_stretch_synthetic_partial_attendance_capacity_pressure_152p_normalized_score":1.0181241504304486,"objective_fixed_iteration_case_stretch_synthetic_partial_attendance_capacity_pressure_152p_reference_final_score":6621.0,"objective_fixed_iteration_case_stretch_synthetic_partial_attendance_capacity_pressure_152p_weight":1.0,"objective_fixed_iteration_case_stretch_synthetic_partial_attendance_capacity_pressure_152p_weighted_contribution":1.0181241504304486,"objective_fixed_iteration_external_validation_failures":0.0,"objective_fixed_iteration_score_breakdown_mismatches":0.0,"objective_fixed_iteration_total_final_score_raw":21628.0,"objective_fixed_iteration_total_runtime_seconds":305.066014103,"objective_fixed_iteration_total_score_mismatches":0.0,"objective_fixed_iteration_weighted_normalized_score":101.20197354611769,"objective_fixed_iteration_weighted_normalized_score_delta_from_reference":1.201973546117685,"objective_fixed_iteration_weighted_normalized_score_weight_sum":6.0,"objective_suite_average_final_score_raw":3638.5,"objective_suite_average_runtime_seconds":15.6683683995,"objective_suite_case_adversarial_clique_swap_functionality_35p_final_score":4765.0,"objective_suite_case_adversarial_clique_swap_functionality_35p_normalized_score":1.001892346509672,"objective_suite_case_adversarial_clique_swap_functionality_35p_reference_final_score":4756.0,"objective_suite_case_adversarial_clique_swap_functionality_35p_weight":1.0,"objective_suite_case_adversarial_clique_swap_functionality_35p_weighted_contribution":1.001892346509672,"objective_suite_case_adversarial_transfer_attribute_balance_111p_final_score":203.0,"objective_suite_case_adversarial_transfer_attribute_balance_111p_normalized_score":1.0252525252525253,"objective_suite_case_adversarial_transfer_attribute_balance_111p_reference_final_score":198.0,"objective_suite_case_adversarial_transfer_attribute_balance_111p_weight":1.0,"objective_suite_case_adversarial_transfer_attribute_balance_111p_weighted_contribution":1.0252525252525253,"objective_suite_case_count":6.0,"objective_suite_case_stretch_large_gender_immovable_110p_final_score":2333.0,"objective_suite_case_stretch_large_gender_immovable_110p_normalized_score":1.0706746213859568,"objective_suite_case_stretch_large_gender_immovable_110p_reference_final_score":2179.0,"objective_suite_case_stretch_large_gender_immovable_110p_weight":1.0,"objective_suite_case_stretch_large_gender_immovable_110p_weighted_contribution":1.0706746213859568,"objective_suite_case_stretch_sailing_trip_demo_real_final_score":2314.0,"objective_suite_case_stretch_sailing_trip_demo_real_normalized_score":0.9669870455495194,"objective_suite_case_stretch_sailing_trip_demo_real_reference_final_score":2393.0,"objective_suite_case_stretch_sailing_trip_demo_real_weight":1.0,"objective_suite_case_stretch_sailing_trip_demo_real_weighted_contribution":0.9669870455495194,"objective_suite_case_stretch_social_golfer_32x8x10_final_score":5451.0,"objective_suite_case_stretch_social_golfer_32x8x10_normalized_score":0.9923539049699618,"objective_suite_case_stretch_social_golfer_32x8x10_reference_final_score":5493.0,"objective_suite_case_stretch_social_golfer_32x8x10_weight":1.0,"objective_suite_case_stretch_social_golfer_32x8x10_weighted_contribution":0.9923539049699618,"objective_suite_case_stretch_synthetic_partial_attendance_capacity_pressure_152p_final_score":6765.0,"objective_suite_case_stretch_synthetic_partial_attendance_capacity_pressure_152p_normalized_score":1.0188253012048192,"objective_suite_case_stretch_synthetic_partial_attendance_capacity_pressure_152p_reference_final_score":6640.0,"objective_suite_case_stretch_synthetic_partial_attendance_capacity_pressure_152p_weight":1.0,"objective_suite_case_stretch_synthetic_partial_attendance_capacity_pressure_152p_weighted_contribution":1.0188253012048192,"objective_suite_external_validation_failures":0.0,"objective_suite_score_breakdown_mismatches":0.0,"objective_suite_total_final_score_raw":21831.0,"objective_suite_total_runtime_seconds":94.010210397,"objective_suite_total_score_mismatches":0.0,"objective_suite_weighted_normalized_score":101.26642908120758,"objective_suite_weighted_normalized_score_delta_from_reference":1.2664290812075762,"objective_suite_weighted_normalized_score_weight_sum":6.0,"path_allowed_sessions_iter_us":24.874724999999998,"path_avg_iter_us":16.85523,"path_clique_iter_us":17.774675,"path_construction_iter_us":21.919175,"path_swap_iter_us":11.34825,"path_transfer_iter_us":8.359325,"rep_avg_iter_us":29.717287037037035,"rep_balanced_iter_us":28.5595,"rep_balanced_score":3.0,"rep_constrained_iter_us":30.87507407407407,"rep_constrained_score":4.0,"runtime_canonical_share_percent":99.16083358556956,"runtime_total_seconds":94.805788735,"solver3_raw_score_us":77.51491287037038,"swap_apply_us":2.332765625,"swap_preview_us":6.783625,"transfer_apply_us":2.259859375,"transfer_preview_us":3.780125},"status":"discard","description":"Second population-lite memetic archive attempt: relaxed elite insertion and donor eligibility so the stagnation burst could reuse near-best, structurally different states from the same run. This did move the outcome off the exact baseline-like plateau, but still failed clearly versus the kept two-donor memetic line; gains stayed concentrated in sailing/social_golfer while large_gender and synthetic remained the blockers.","timestamp":1775669154696,"segment":0,"confidence":410.91614129683836,"iterationTokens":9488,"asi":{"hypothesis":"A more permissive within-run elite archive, with periodic snapshots and score slack, can supply genuinely distinct donors to the memetic burst and approximate a small population without paying for full multi-start fragmentation.","rollback_reason":"Primary quality remained well above the kept memetic best (101.2664 vs 100.8462), so the population-lite archive is still not competitive in its current form.","next_action_hint":"Record this as a materially tried archive/population variant and either pivot to a deeper population mechanism with explicit survivor management/recombination timing or move to a different large-family idea; do not keep iterating cheap archive-threshold tweaks.","mechanism_family":"population-lite memetic elite archive","observed_case_pattern":{"social_golfer":"0.9924","sailing":"0.9670","large_gender":"1.0707","synthetic":"1.0188","transfer_balance":"1.0253"},"learning":"More aggressive archive admission made the mechanism active but did not solve the core donor-quality/compatibility problem."}}
{"run":26,"commit":"903743d","metric":101.26650634149594,"metrics":{"clique_apply_us":2.812125,"clique_preview_us":12.966854166666668,"correctness_suite_average_runtime_seconds":0.1966122285,"correctness_suite_case_count":4.0,"correctness_suite_external_validation_failures":0.0,"correctness_suite_total_runtime_seconds":0.786448914,"correctness_suite_total_score_mismatches":0.0,"hotpath_total_us":30.79029166666667,"objective_fixed_iteration_average_final_score_raw":3602.8333333333335,"objective_fixed_iteration_average_runtime_seconds":50.747853644833334,"objective_fixed_iteration_case_adversarial_clique_swap_functionality_35p_final_score":4765.0,"objective_fixed_iteration_case_adversarial_clique_swap_functionality_35p_normalized_score":1.001892346509672,"objective_fixed_iteration_case_adversarial_clique_swap_functionality_35p_reference_final_score":4756.0,"objective_fixed_iteration_case_adversarial_clique_swap_functionality_35p_weight":1.0,"objective_fixed_iteration_case_adversarial_clique_swap_functionality_35p_weighted_contribution":1.001892346509672,"objective_fixed_iteration_case_adversarial_transfer_attribute_balance_111p_final_score":202.0,"objective_fixed_iteration_case_adversarial_transfer_attribute_balance_111p_normalized_score":0.9901960784313726,"objective_fixed_iteration_case_adversarial_transfer_attribute_balance_111p_reference_final_score":204.0,"objective_fixed_iteration_case_adversarial_transfer_attribute_balance_111p_weight":1.0,"objective_fixed_iteration_case_adversarial_transfer_attribute_balance_111p_weighted_contribution":0.9901960784313726,"objective_fixed_iteration_case_count":6.0,"objective_fixed_iteration_case_stretch_large_gender_immovable_110p_final_score":2157.0,"objective_fixed_iteration_case_stretch_large_gender_immovable_110p_normalized_score":1.010304449648712,"objective_fixed_iteration_case_stretch_large_gender_immovable_110p_reference_final_score":2135.0,"objective_fixed_iteration_case_stretch_large_gender_immovable_110p_weight":1.0,"objective_fixed_iteration_case_stretch_large_gender_immovable_110p_weighted_contribution":1.010304449648712,"objective_fixed_iteration_case_stretch_sailing_trip_demo_real_final_score":2301.0,"objective_fixed_iteration_case_stretch_sailing_trip_demo_real_normalized_score":1.0364864864864864,"objective_fixed_iteration_case_stretch_sailing_trip_demo_real_reference_final_score":2220.0,"objective_fixed_iteration_case_stretch_sailing_trip_demo_real_weight":1.0,"objective_fixed_iteration_case_stretch_sailing_trip_demo_real_weighted_contribution":1.0364864864864864,"objective_fixed_iteration_case_stretch_social_golfer_32x8x10_final_score":5451.0,"objective_fixed_iteration_case_stretch_social_golfer_32x8x10_normalized_score":0.9923539049699618,"objective_fixed_iteration_case_stretch_social_golfer_32x8x10_reference_final_score":5493.0,"objective_fixed_iteration_case_stretch_social_golfer_32x8x10_weight":1.0,"objective_fixed_iteration_case_stretch_social_golfer_32x8x10_weighted_contribution":0.9923539049699618,"objective_fixed_iteration_case_stretch_synthetic_partial_attendance_capacity_pressure_152p_final_score":6741.0,"objective_fixed_iteration_case_stretch_synthetic_partial_attendance_capacity_pressure_152p_normalized_score":1.0181241504304486,"objective_fixed_iteration_case_stretch_synthetic_partial_attendance_capacity_pressure_152p_reference_final_score":6621.0,"objective_fixed_iteration_case_stretch_synthetic_partial_attendance_capacity_pressure_152p_weight":1.0,"objective_fixed_iteration_case_stretch_synthetic_partial_attendance_capacity_pressure_152p_weighted_contribution":1.0181241504304486,"objective_fixed_iteration_external_validation_failures":0.0,"objective_fixed_iteration_score_breakdown_mismatches":0.0,"objective_fixed_iteration_total_final_score_raw":21617.0,"objective_fixed_iteration_total_runtime_seconds":304.487121869,"objective_fixed_iteration_total_score_mismatches":0.0,"objective_fixed_iteration_weighted_normalized_score":100.82262360794422,"objective_fixed_iteration_weighted_normalized_score_delta_from_reference":0.8226236079442284,"objective_fixed_iteration_weighted_normalized_score_weight_sum":6.0,"objective_suite_average_final_score_raw":3635.1666666666665,"objective_suite_average_runtime_seconds":15.668297787833334,"objective_suite_case_adversarial_clique_swap_functionality_35p_final_score":4765.0,"objective_suite_case_adversarial_clique_swap_functionality_35p_normalized_score":1.001892346509672,"objective_suite_case_adversarial_clique_swap_functionality_35p_reference_final_score":4756.0,"objective_suite_case_adversarial_clique_swap_functionality_35p_weight":1.0,"objective_suite_case_adversarial_clique_swap_functionality_35p_weighted_contribution":1.001892346509672,"objective_suite_case_adversarial_transfer_attribute_balance_111p_final_score":205.0,"objective_suite_case_adversarial_transfer_attribute_balance_111p_normalized_score":1.0353535353535352,"objective_suite_case_adversarial_transfer_attribute_balance_111p_reference_final_score":198.0,"objective_suite_case_adversarial_transfer_attribute_balance_111p_weight":1.0,"objective_suite_case_adversarial_transfer_attribute_balance_111p_weighted_contribution":1.0353535353535352,"objective_suite_case_count":6.0,"objective_suite_case_stretch_large_gender_immovable_110p_final_score":2311.0,"objective_suite_case_stretch_large_gender_immovable_110p_normalized_score":1.0605782469022487,"objective_suite_case_stretch_large_gender_immovable_110p_reference_final_score":2179.0,"objective_suite_case_stretch_large_gender_immovable_110p_weight":1.0,"objective_suite_case_stretch_large_gender_immovable_110p_weighted_contribution":1.0605782469022487,"objective_suite_case_stretch_sailing_trip_demo_real_final_score":2314.0,"objective_suite_case_stretch_sailing_trip_demo_real_normalized_score":0.9669870455495194,"objective_suite_case_stretch_sailing_trip_demo_real_reference_final_score":2393.0,"objective_suite_case_stretch_sailing_trip_demo_real_weight":1.0,"objective_suite_case_stretch_sailing_trip_demo_real_weighted_contribution":0.9669870455495194,"objective_suite_case_stretch_social_golfer_32x8x10_final_score":5451.0,"objective_suite_case_stretch_social_golfer_32x8x10_normalized_score":0.9923539049699618,"objective_suite_case_stretch_social_golfer_32x8x10_reference_final_score":5493.0,"objective_suite_case_stretch_social_golfer_32x8x10_weight":1.0,"objective_suite_case_stretch_social_golfer_32x8x10_weighted_contribution":0.9923539049699618,"objective_suite_case_stretch_synthetic_partial_attendance_capacity_pressure_152p_final_score":6765.0,"objective_suite_case_stretch_synthetic_partial_attendance_capacity_pressure_152p_normalized_score":1.0188253012048192,"objective_suite_case_stretch_synthetic_partial_attendance_capacity_pressure_152p_reference_final_score":6640.0,"objective_suite_case_stretch_synthetic_partial_attendance_capacity_pressure_152p_weight":1.0,"objective_suite_case_stretch_synthetic_partial_attendance_capacity_pressure_152p_weighted_contribution":1.0188253012048192,"objective_suite_external_validation_failures":0.0,"objective_suite_score_breakdown_mismatches":0.0,"objective_suite_total_final_score_raw":21811.0,"objective_suite_total_runtime_seconds":94.009786727,"objective_suite_total_score_mismatches":0.0,"objective_suite_weighted_normalized_score":101.26650634149594,"objective_suite_weighted_normalized_score_delta_from_reference":1.2665063414959432,"objective_suite_weighted_normalized_score_weight_sum":6.0,"path_allowed_sessions_iter_us":25.187099999999997,"path_avg_iter_us":16.721059999999998,"path_clique_iter_us":17.7505,"path_construction_iter_us":21.061625,"path_swap_iter_us":11.400949999999998,"path_transfer_iter_us":8.205124999999999,"rep_avg_iter_us":29.756105555555557,"rep_balanced_iter_us":28.493266666666667,"rep_balanced_score":3.0,"rep_constrained_iter_us":31.018944444444447,"rep_constrained_score":4.0,"runtime_canonical_share_percent":99.17037959505235,"runtime_total_seconds":94.796235641,"solver3_raw_score_us":77.26745722222222,"swap_apply_us":2.33940625,"swap_preview_us":6.511015625000001,"transfer_apply_us":2.29109375,"transfer_preview_us":3.8697968750000005},"status":"discard","description":"Survivor-managed donor-pool memetic follow-up: allowed two stagnation-triggered bursts, stored polished donors and accepted offspring in a small pool, and reused structurally distinct pool donors in later bursts. This deeper population-lite step still failed to beat the kept two-donor memetic line and ended up nearly identical to the prior relaxed archive attempt, suggesting the extra survivor machinery still was not creating meaningfully better donor material.","timestamp":1775669899164,"segment":0,"confidence":427.2358144117628,"iterationTokens":23075,"asi":{"hypothesis":"A small explicit donor pool carried across multiple memetic bursts can act like a true population and improve donor reuse beyond passive archive snapshots.","rollback_reason":"Primary quality again stayed far above the kept memetic best (101.2665 vs 100.8462), with essentially the same case pattern as the relaxed archive follow-up.","next_action_hint":"Retire this lightweight survivor-managed population variant in its current form; if memetic work continues, it likely needs stronger donor generation or a richer recombination unit than one-session exact transplant.","mechanism_family":"survivor-managed donor-pool memetic search","observed_case_pattern":{"transfer_balance":"1.0354","large_gender":"1.0606","sailing":"0.9670","social_golfer":"0.9924","synthetic":"1.0188"},"learning":"Adding multiple bursts and simple survivor rules did not materially change donor quality; the bottleneck now looks more like recombination power or donor-construction quality than archive persistence."}}
