{"run":12,"commit":"09f897c","metric":88.58182385048653,"metrics":{"clique_apply_us":0.2979791666666667,"clique_preview_us":0.5952083333333332,"correctness_suite_average_runtime_seconds":0.00505863275,"correctness_suite_case_count":4.0,"correctness_suite_external_validation_failures":0.0,"correctness_suite_total_runtime_seconds":0.020234531,"correctness_suite_total_score_mismatches":0.0,"hotpath_total_us":1.8346249999999997,"metaheuristic_fixed_iteration_weighted_normalized_score":95.38300363591544,"metaheuristic_fixed_iteration_weighted_normalized_score_delta_from_reference":-4.616996364084558,"metaheuristic_fixed_iteration_weighted_normalized_score_weight_sum":9.0,"metaheuristic_suite_weighted_normalized_score":88.58182385048653,"metaheuristic_suite_weighted_normalized_score_delta_from_reference":-11.41817614951347,"metaheuristic_suite_weighted_normalized_score_weight_sum":9.0,"objective_fixed_iteration_average_final_score_raw":2591.777777777778,"objective_fixed_iteration_average_runtime_seconds":12.797173950222222,"objective_fixed_iteration_case_adversarial_clique_swap_functionality_35p_final_score":4765.0,"objective_fixed_iteration_case_adversarial_clique_swap_functionality_35p_normalized_score":1.0,"objective_fixed_iteration_case_adversarial_clique_swap_functionality_35p_reference_final_score":4765.0,"objective_fixed_iteration_case_adversarial_clique_swap_functionality_35p_weight":1.0,"objective_fixed_iteration_case_adversarial_clique_swap_functionality_35p_weighted_contribution":1.0,"objective_fixed_iteration_case_adversarial_transfer_attribute_balance_111p_final_score":194.0,"objective_fixed_iteration_case_adversarial_transfer_attribute_balance_111p_normalized_score":1.0,"objective_fixed_iteration_case_adversarial_transfer_attribute_balance_111p_reference_final_score":194.0,"objective_fixed_iteration_case_adversarial_transfer_attribute_balance_111p_weight":1.0,"objective_fixed_iteration_case_adversarial_transfer_attribute_balance_111p_weighted_contribution":1.0,"objective_fixed_iteration_case_count":9.0,"objective_fixed_iteration_case_representative_small_workshop_balanced_final_score":3.0,"objective_fixed_iteration_case_representative_small_workshop_balanced_normalized_score":1.0,"objective_fixed_iteration_case_representative_small_workshop_balanced_reference_final_score":3.0,"objective_fixed_iteration_case_representative_small_workshop_balanced_weight":1.0,"objective_fixed_iteration_case_representative_small_workshop_balanced_weighted_contribution":1.0,"objective_fixed_iteration_case_representative_small_workshop_constrained_final_score":4.0,"objective_fixed_iteration_case_representative_small_workshop_constrained_normalized_score":1.0,"objective_fixed_iteration_case_representative_small_workshop_constrained_reference_final_score":4.0,"objective_fixed_iteration_case_representative_small_workshop_constrained_weight":1.0,"objective_fixed_iteration_case_representative_small_workshop_constrained_weighted_contribution":1.0,"objective_fixed_iteration_case_stretch_kirkman_schoolgirls_15x5x7_final_score":33.0,"objective_fixed_iteration_case_stretch_kirkman_schoolgirls_15x5x7_normalized_score":0.6,"objective_fixed_iteration_case_stretch_kirkman_schoolgirls_15x5x7_reference_final_score":55.0,"objective_fixed_iteration_case_stretch_kirkman_schoolgirls_15x5x7_weight":1.0,"objective_fixed_iteration_case_stretch_kirkman_schoolgirls_15x5x7_weighted_contribution":0.6,"objective_fixed_iteration_case_stretch_large_gender_immovable_110p_final_score":2102.0,"objective_fixed_iteration_case_stretch_large_gender_immovable_110p_normalized_score":1.0,"objective_fixed_iteration_case_stretch_large_gender_immovable_110p_reference_final_score":2102.0,"objective_fixed_iteration_case_stretch_large_gender_immovable_110p_weight":1.0,"objective_fixed_iteration_case_stretch_large_gender_immovable_110p_weighted_contribution":1.0,"objective_fixed_iteration_case_stretch_sailing_trip_demo_real_final_score":4362.0,"objective_fixed_iteration_case_stretch_sailing_trip_demo_real_normalized_score":1.0,"objective_fixed_iteration_case_stretch_sailing_trip_demo_real_reference_final_score":4362.0,"objective_fixed_iteration_case_stretch_sailing_trip_demo_real_weight":1.0,"objective_fixed_iteration_case_stretch_sailing_trip_demo_real_weighted_contribution":1.0,"objective_fixed_iteration_case_stretch_social_golfer_32x8x10_final_score":5325.0,"objective_fixed_iteration_case_stretch_social_golfer_32x8x10_normalized_score":0.9844703272323905,"objective_fixed_iteration_case_stretch_social_golfer_32x8x10_reference_final_score":5409.0,"objective_fixed_iteration_case_stretch_social_golfer_32x8x10_weight":1.0,"objective_fixed_iteration_case_stretch_social_golfer_32x8x10_weighted_contribution":0.9844703272323905,"objective_fixed_iteration_case_stretch_synthetic_partial_attendance_capacity_pressure_152p_final_score":6538.0,"objective_fixed_iteration_case_stretch_synthetic_partial_attendance_capacity_pressure_152p_normalized_score":1.0,"objective_fixed_iteration_case_stretch_synthetic_partial_attendance_capacity_pressure_152p_reference_final_score":6538.0,"objective_fixed_iteration_case_stretch_synthetic_partial_attendance_capacity_pressure_152p_weight":1.0,"objective_fixed_iteration_case_stretch_synthetic_partial_attendance_capacity_pressure_152p_weighted_contribution":1.0,"objective_fixed_iteration_external_validation_failures":0.0,"objective_fixed_iteration_score_breakdown_mismatches":0.0,"objective_fixed_iteration_total_final_score_raw":23326.0,"objective_fixed_iteration_total_runtime_seconds":115.174565552,"objective_fixed_iteration_total_score_mismatches":0.0,"objective_suite_average_final_score_raw":2574.6666666666665,"objective_suite_average_runtime_seconds":150.00004184755556,"objective_suite_case_adversarial_clique_swap_functionality_35p_final_score":4765.0,"objective_suite_case_adversarial_clique_swap_functionality_35p_normalized_score":1.0,"objective_suite_case_adversarial_clique_swap_functionality_35p_reference_final_score":4765.0,"objective_suite_case_adversarial_clique_swap_functionality_35p_weight":1.0,"objective_suite_case_adversarial_clique_swap_functionality_35p_weighted_contribution":1.0,"objective_suite_case_adversarial_transfer_attribute_balance_111p_final_score":183.0,"objective_suite_case_adversarial_transfer_attribute_balance_111p_normalized_score":1.0,"objective_suite_case_adversarial_transfer_attribute_balance_111p_reference_final_score":183.0,"objective_suite_case_adversarial_transfer_attribute_balance_111p_weight":1.0,"objective_suite_case_adversarial_transfer_attribute_balance_111p_weighted_contribution":1.0,"objective_suite_case_count":9.0,"objective_suite_case_representative_small_workshop_balanced_final_score":3.0,"objective_suite_case_representative_small_workshop_balanced_normalized_score":1.0,"objective_suite_case_representative_small_workshop_balanced_reference_final_score":3.0,"objective_suite_case_representative_small_workshop_balanced_weight":1.0,"objective_suite_case_representative_small_workshop_balanced_weighted_contribution":1.0,"objective_suite_case_representative_small_workshop_constrained_final_score":4.0,"objective_suite_case_representative_small_workshop_constrained_normalized_score":1.0,"objective_suite_case_representative_small_workshop_constrained_reference_final_score":4.0,"objective_suite_case_representative_small_workshop_constrained_weight":1.0,"objective_suite_case_representative_small_workshop_constrained_weighted_contribution":1.0,"objective_suite_case_stretch_kirkman_schoolgirls_15x5x7_final_score":0.0,"objective_suite_case_stretch_kirkman_schoolgirls_15x5x7_normalized_score":0.0,"objective_suite_case_stretch_kirkman_schoolgirls_15x5x7_reference_final_score":55.0,"objective_suite_case_stretch_kirkman_schoolgirls_15x5x7_weight":1.0,"objective_suite_case_stretch_kirkman_schoolgirls_15x5x7_weighted_contribution":0.0,"objective_suite_case_stretch_large_gender_immovable_110p_final_score":2102.0,"objective_suite_case_stretch_large_gender_immovable_110p_normalized_score":1.0,"objective_suite_case_stretch_large_gender_immovable_110p_reference_final_score":2102.0,"objective_suite_case_stretch_large_gender_immovable_110p_weight":1.0,"objective_suite_case_stretch_large_gender_immovable_110p_weighted_contribution":1.0,"objective_suite_case_stretch_sailing_trip_demo_real_final_score":4356.0,"objective_suite_case_stretch_sailing_trip_demo_real_normalized_score":0.9995410738871042,"objective_suite_case_stretch_sailing_trip_demo_real_reference_final_score":4358.0,"objective_suite_case_stretch_sailing_trip_demo_real_weight":1.0,"objective_suite_case_stretch_sailing_trip_demo_real_weighted_contribution":0.9995410738871042,"objective_suite_case_stretch_social_golfer_32x8x10_final_score":5262.0,"objective_suite_case_stretch_social_golfer_32x8x10_normalized_score":0.9728230726566833,"objective_suite_case_stretch_social_golfer_32x8x10_reference_final_score":5409.0,"objective_suite_case_stretch_social_golfer_32x8x10_weight":1.0,"objective_suite_case_stretch_social_golfer_32x8x10_weighted_contribution":0.9728230726566833,"objective_suite_case_stretch_synthetic_partial_attendance_capacity_pressure_152p_final_score":6497.0,"objective_suite_case_stretch_synthetic_partial_attendance_capacity_pressure_152p_normalized_score":1.0,"objective_suite_case_stretch_synthetic_partial_attendance_capacity_pressure_152p_reference_final_score":6497.0,"objective_suite_case_stretch_synthetic_partial_attendance_capacity_pressure_152p_weight":1.0,"objective_suite_case_stretch_synthetic_partial_attendance_capacity_pressure_152p_weighted_contribution":1.0,"objective_suite_external_validation_failures":0.0,"objective_suite_score_breakdown_mismatches":0.0,"objective_suite_total_final_score_raw":23172.0,"objective_suite_total_runtime_seconds":1350.000376628,"objective_suite_total_score_mismatches":0.0,"path_allowed_sessions_iter_us":0.70015,"path_avg_iter_us":0.7996949999999999,"path_clique_iter_us":0.884675,"path_construction_iter_us":1.0536999999999999,"path_swap_iter_us":0.8952,"path_transfer_iter_us":0.46475,"rep_avg_iter_us":0.9253735507246377,"rep_balanced_iter_us":0.9251166666666667,"rep_balanced_score":3.0,"rep_constrained_iter_us":0.9256304347826088,"rep_constrained_score":9.0,"runtime_canonical_share_percent":99.99850116873529,"runtime_total_seconds":1350.020611159,"solver3_raw_score_us":3.5596935507246372,"swap_apply_us":0.2345,"swap_preview_us":0.316953125,"transfer_apply_us":0.22143749999999998,"transfer_preview_us":0.168546875},"status":"discard","description":"Tried keeping the 10000/10000 pure-zero-repeat donor trigger spacing but increasing child_polish_max_stagnation_windows from 8 to 12; it was effectively inert on the primary metric and did not beat the current champion.","timestamp":1776147856618,"segment":0,"confidence":51.71531229185015,"iterationTokens":7921}
{"run":13,"commit":"09f897c","metric":88.58182385048653,"metrics":{"clique_apply_us":0.20602083333333332,"clique_preview_us":0.5699166666666666,"correctness_suite_average_runtime_seconds":0.00483608425,"correctness_suite_case_count":4.0,"correctness_suite_external_validation_failures":0.0,"correctness_suite_total_runtime_seconds":0.019344337,"correctness_suite_total_score_mismatches":0.0,"hotpath_total_us":1.745859375,"metaheuristic_fixed_iteration_weighted_normalized_score":95.38300363591544,"metaheuristic_fixed_iteration_weighted_normalized_score_delta_from_reference":-4.616996364084558,"metaheuristic_fixed_iteration_weighted_normalized_score_weight_sum":9.0,"metaheuristic_suite_weighted_normalized_score":88.58182385048653,"metaheuristic_suite_weighted_normalized_score_delta_from_reference":-11.41817614951347,"metaheuristic_suite_weighted_normalized_score_weight_sum":9.0,"objective_fixed_iteration_average_final_score_raw":2591.777777777778,"objective_fixed_iteration_average_runtime_seconds":12.866794153444445,"objective_fixed_iteration_case_adversarial_clique_swap_functionality_35p_final_score":4765.0,"objective_fixed_iteration_case_adversarial_clique_swap_functionality_35p_normalized_score":1.0,"objective_fixed_iteration_case_adversarial_clique_swap_functionality_35p_reference_final_score":4765.0,"objective_fixed_iteration_case_adversarial_clique_swap_functionality_35p_weight":1.0,"objective_fixed_iteration_case_adversarial_clique_swap_functionality_35p_weighted_contribution":1.0,"objective_fixed_iteration_case_adversarial_transfer_attribute_balance_111p_final_score":194.0,"objective_fixed_iteration_case_adversarial_transfer_attribute_balance_111p_normalized_score":1.0,"objective_fixed_iteration_case_adversarial_transfer_attribute_balance_111p_reference_final_score":194.0,"objective_fixed_iteration_case_adversarial_transfer_attribute_balance_111p_weight":1.0,"objective_fixed_iteration_case_adversarial_transfer_attribute_balance_111p_weighted_contribution":1.0,"objective_fixed_iteration_case_count":9.0,"objective_fixed_iteration_case_representative_small_workshop_balanced_final_score":3.0,"objective_fixed_iteration_case_representative_small_workshop_balanced_normalized_score":1.0,"objective_fixed_iteration_case_representative_small_workshop_balanced_reference_final_score":3.0,"objective_fixed_iteration_case_representative_small_workshop_balanced_weight":1.0,"objective_fixed_iteration_case_representative_small_workshop_balanced_weighted_contribution":1.0,"objective_fixed_iteration_case_representative_small_workshop_constrained_final_score":4.0,"objective_fixed_iteration_case_representative_small_workshop_constrained_normalized_score":1.0,"objective_fixed_iteration_case_representative_small_workshop_constrained_reference_final_score":4.0,"objective_fixed_iteration_case_representative_small_workshop_constrained_weight":1.0,"objective_fixed_iteration_case_representative_small_workshop_constrained_weighted_contribution":1.0,"objective_fixed_iteration_case_stretch_kirkman_schoolgirls_15x5x7_final_score":33.0,"objective_fixed_iteration_case_stretch_kirkman_schoolgirls_15x5x7_normalized_score":0.6,"objective_fixed_iteration_case_stretch_kirkman_schoolgirls_15x5x7_reference_final_score":55.0,"objective_fixed_iteration_case_stretch_kirkman_schoolgirls_15x5x7_weight":1.0,"objective_fixed_iteration_case_stretch_kirkman_schoolgirls_15x5x7_weighted_contribution":0.6,"objective_fixed_iteration_case_stretch_large_gender_immovable_110p_final_score":2102.0,"objective_fixed_iteration_case_stretch_large_gender_immovable_110p_normalized_score":1.0,"objective_fixed_iteration_case_stretch_large_gender_immovable_110p_reference_final_score":2102.0,"objective_fixed_iteration_case_stretch_large_gender_immovable_110p_weight":1.0,"objective_fixed_iteration_case_stretch_large_gender_immovable_110p_weighted_contribution":1.0,"objective_fixed_iteration_case_stretch_sailing_trip_demo_real_final_score":4362.0,"objective_fixed_iteration_case_stretch_sailing_trip_demo_real_normalized_score":1.0,"objective_fixed_iteration_case_stretch_sailing_trip_demo_real_reference_final_score":4362.0,"objective_fixed_iteration_case_stretch_sailing_trip_demo_real_weight":1.0,"objective_fixed_iteration_case_stretch_sailing_trip_demo_real_weighted_contribution":1.0,"objective_fixed_iteration_case_stretch_social_golfer_32x8x10_final_score":5325.0,"objective_fixed_iteration_case_stretch_social_golfer_32x8x10_normalized_score":0.9844703272323905,"objective_fixed_iteration_case_stretch_social_golfer_32x8x10_reference_final_score":5409.0,"objective_fixed_iteration_case_stretch_social_golfer_32x8x10_weight":1.0,"objective_fixed_iteration_case_stretch_social_golfer_32x8x10_weighted_contribution":0.9844703272323905,"objective_fixed_iteration_case_stretch_synthetic_partial_attendance_capacity_pressure_152p_final_score":6538.0,"objective_fixed_iteration_case_stretch_synthetic_partial_attendance_capacity_pressure_152p_normalized_score":1.0,"objective_fixed_iteration_case_stretch_synthetic_partial_attendance_capacity_pressure_152p_reference_final_score":6538.0,"objective_fixed_iteration_case_stretch_synthetic_partial_attendance_capacity_pressure_152p_weight":1.0,"objective_fixed_iteration_case_stretch_synthetic_partial_attendance_capacity_pressure_152p_weighted_contribution":1.0,"objective_fixed_iteration_external_validation_failures":0.0,"objective_fixed_iteration_score_breakdown_mismatches":0.0,"objective_fixed_iteration_total_final_score_raw":23326.0,"objective_fixed_iteration_total_runtime_seconds":115.801147381,"objective_fixed_iteration_total_score_mismatches":0.0,"objective_suite_average_final_score_raw":2574.6666666666665,"objective_suite_average_runtime_seconds":150.00003649277778,"objective_suite_case_adversarial_clique_swap_functionality_35p_final_score":4765.0,"objective_suite_case_adversarial_clique_swap_functionality_35p_normalized_score":1.0,"objective_suite_case_adversarial_clique_swap_functionality_35p_reference_final_score":4765.0,"objective_suite_case_adversarial_clique_swap_functionality_35p_weight":1.0,"objective_suite_case_adversarial_clique_swap_functionality_35p_weighted_contribution":1.0,"objective_suite_case_adversarial_transfer_attribute_balance_111p_final_score":183.0,"objective_suite_case_adversarial_transfer_attribute_balance_111p_normalized_score":1.0,"objective_suite_case_adversarial_transfer_attribute_balance_111p_reference_final_score":183.0,"objective_suite_case_adversarial_transfer_attribute_balance_111p_weight":1.0,"objective_suite_case_adversarial_transfer_attribute_balance_111p_weighted_contribution":1.0,"objective_suite_case_count":9.0,"objective_suite_case_representative_small_workshop_balanced_final_score":3.0,"objective_suite_case_representative_small_workshop_balanced_normalized_score":1.0,"objective_suite_case_representative_small_workshop_balanced_reference_final_score":3.0,"objective_suite_case_representative_small_workshop_balanced_weight":1.0,"objective_suite_case_representative_small_workshop_balanced_weighted_contribution":1.0,"objective_suite_case_representative_small_workshop_constrained_final_score":4.0,"objective_suite_case_representative_small_workshop_constrained_normalized_score":1.0,"objective_suite_case_representative_small_workshop_constrained_reference_final_score":4.0,"objective_suite_case_representative_small_workshop_constrained_weight":1.0,"objective_suite_case_representative_small_workshop_constrained_weighted_contribution":1.0,"objective_suite_case_stretch_kirkman_schoolgirls_15x5x7_final_score":0.0,"objective_suite_case_stretch_kirkman_schoolgirls_15x5x7_normalized_score":0.0,"objective_suite_case_stretch_kirkman_schoolgirls_15x5x7_reference_final_score":55.0,"objective_suite_case_stretch_kirkman_schoolgirls_15x5x7_weight":1.0,"objective_suite_case_stretch_kirkman_schoolgirls_15x5x7_weighted_contribution":0.0,"objective_suite_case_stretch_large_gender_immovable_110p_final_score":2102.0,"objective_suite_case_stretch_large_gender_immovable_110p_normalized_score":1.0,"objective_suite_case_stretch_large_gender_immovable_110p_reference_final_score":2102.0,"objective_suite_case_stretch_large_gender_immovable_110p_weight":1.0,"objective_suite_case_stretch_large_gender_immovable_110p_weighted_contribution":1.0,"objective_suite_case_stretch_sailing_trip_demo_real_final_score":4356.0,"objective_suite_case_stretch_sailing_trip_demo_real_normalized_score":0.9995410738871042,"objective_suite_case_stretch_sailing_trip_demo_real_reference_final_score":4358.0,"objective_suite_case_stretch_sailing_trip_demo_real_weight":1.0,"objective_suite_case_stretch_sailing_trip_demo_real_weighted_contribution":0.9995410738871042,"objective_suite_case_stretch_social_golfer_32x8x10_final_score":5262.0,"objective_suite_case_stretch_social_golfer_32x8x10_normalized_score":0.9728230726566833,"objective_suite_case_stretch_social_golfer_32x8x10_reference_final_score":5409.0,"objective_suite_case_stretch_social_golfer_32x8x10_weight":1.0,"objective_suite_case_stretch_social_golfer_32x8x10_weighted_contribution":0.9728230726566833,"objective_suite_case_stretch_synthetic_partial_attendance_capacity_pressure_152p_final_score":6497.0,"objective_suite_case_stretch_synthetic_partial_attendance_capacity_pressure_152p_normalized_score":1.0,"objective_suite_case_stretch_synthetic_partial_attendance_capacity_pressure_152p_reference_final_score":6497.0,"objective_suite_case_stretch_synthetic_partial_attendance_capacity_pressure_152p_weight":1.0,"objective_suite_case_stretch_synthetic_partial_attendance_capacity_pressure_152p_weighted_contribution":1.0,"objective_suite_external_validation_failures":0.0,"objective_suite_score_breakdown_mismatches":0.0,"objective_suite_total_final_score_raw":23172.0,"objective_suite_total_runtime_seconds":1350.000328435,"objective_suite_total_score_mismatches":0.0,"path_allowed_sessions_iter_us":0.8755000000000001,"path_avg_iter_us":1.6491550000000001,"path_clique_iter_us":3.8255250000000003,"path_construction_iter_us":1.2585000000000002,"path_swap_iter_us":1.547075,"path_transfer_iter_us":0.739175,"rep_avg_iter_us":1.8885311594202898,"rep_balanced_iter_us":1.9748666666666668,"rep_balanced_score":3.0,"rep_constrained_iter_us":1.8021956521739129,"rep_constrained_score":9.0,"runtime_canonical_share_percent":99.99856710702888,"runtime_total_seconds":1350.019672772,"solver3_raw_score_us":5.28354553442029,"swap_apply_us":0.2253125,"swap_preview_us":0.328109375,"transfer_apply_us":0.215296875,"transfer_preview_us":0.201203125},"status":"discard","description":"Re-ran the current pure-zero-repeat donor+tabu champion unchanged to check overfitting/noise; it reproduced the exact same objective metrics and per-case scores, so the quality gain looks stable even though micro-runtime diagnostics drifted.","timestamp":1776149851236,"segment":0,"confidence":58.05739142939328,"iterationTokens":7921}
