{"run":15,"commit":"903743d","metric":100.84622890492095,"metrics":{"clique_apply_us":2.780479166666667,"clique_preview_us":13.227291666666668,"correctness_suite_average_runtime_seconds":0.18003168675,"correctness_suite_case_count":4.0,"correctness_suite_external_validation_failures":0.0,"correctness_suite_total_runtime_seconds":0.720126747,"correctness_suite_total_score_mismatches":0.0,"hotpath_total_us":30.862614583333333,"objective_fixed_iteration_average_final_score_raw":3603.1666666666665,"objective_fixed_iteration_average_runtime_seconds":50.742850042166666,"objective_fixed_iteration_case_adversarial_clique_swap_functionality_35p_final_score":4765.0,"objective_fixed_iteration_case_adversarial_clique_swap_functionality_35p_normalized_score":1.001892346509672,"objective_fixed_iteration_case_adversarial_clique_swap_functionality_35p_reference_final_score":4756.0,"objective_fixed_iteration_case_adversarial_clique_swap_functionality_35p_weight":1.0,"objective_fixed_iteration_case_adversarial_clique_swap_functionality_35p_weighted_contribution":1.001892346509672,"objective_fixed_iteration_case_adversarial_transfer_attribute_balance_111p_final_score":204.0,"objective_fixed_iteration_case_adversarial_transfer_attribute_balance_111p_normalized_score":1.0,"objective_fixed_iteration_case_adversarial_transfer_attribute_balance_111p_reference_final_score":204.0,"objective_fixed_iteration_case_adversarial_transfer_attribute_balance_111p_weight":1.0,"objective_fixed_iteration_case_adversarial_transfer_attribute_balance_111p_weighted_contribution":1.0,"objective_fixed_iteration_case_count":6.0,"objective_fixed_iteration_case_stretch_large_gender_immovable_110p_final_score":2157.0,"objective_fixed_iteration_case_stretch_large_gender_immovable_110p_normalized_score":1.010304449648712,"objective_fixed_iteration_case_stretch_large_gender_immovable_110p_reference_final_score":2135.0,"objective_fixed_iteration_case_stretch_large_gender_immovable_110p_weight":1.0,"objective_fixed_iteration_case_stretch_large_gender_immovable_110p_weighted_contribution":1.010304449648712,"objective_fixed_iteration_case_stretch_sailing_trip_demo_real_final_score":2301.0,"objective_fixed_iteration_case_stretch_sailing_trip_demo_real_normalized_score":1.0364864864864864,"objective_fixed_iteration_case_stretch_sailing_trip_demo_real_reference_final_score":2220.0,"objective_fixed_iteration_case_stretch_sailing_trip_demo_real_weight":1.0,"objective_fixed_iteration_case_stretch_sailing_trip_demo_real_weighted_contribution":1.0364864864864864,"objective_fixed_iteration_case_stretch_social_golfer_32x8x10_final_score":5451.0,"objective_fixed_iteration_case_stretch_social_golfer_32x8x10_normalized_score":0.9923539049699618,"objective_fixed_iteration_case_stretch_social_golfer_32x8x10_reference_final_score":5493.0,"objective_fixed_iteration_case_stretch_social_golfer_32x8x10_weight":1.0,"objective_fixed_iteration_case_stretch_social_golfer_32x8x10_weighted_contribution":0.9923539049699618,"objective_fixed_iteration_case_stretch_synthetic_partial_attendance_capacity_pressure_152p_final_score":6741.0,"objective_fixed_iteration_case_stretch_synthetic_partial_attendance_capacity_pressure_152p_normalized_score":1.0181241504304486,"objective_fixed_iteration_case_stretch_synthetic_partial_attendance_capacity_pressure_152p_reference_final_score":6621.0,"objective_fixed_iteration_case_stretch_synthetic_partial_attendance_capacity_pressure_152p_weight":1.0,"objective_fixed_iteration_case_stretch_synthetic_partial_attendance_capacity_pressure_152p_weighted_contribution":1.0181241504304486,"objective_fixed_iteration_external_validation_failures":0.0,"objective_fixed_iteration_score_breakdown_mismatches":0.0,"objective_fixed_iteration_total_final_score_raw":21619.0,"objective_fixed_iteration_total_runtime_seconds":304.457100253,"objective_fixed_iteration_total_score_mismatches":0.0,"objective_fixed_iteration_weighted_normalized_score":100.98602230075468,"objective_fixed_iteration_weighted_normalized_score_delta_from_reference":0.9860223007546853,"objective_fixed_iteration_weighted_normalized_score_weight_sum":6.0,"objective_suite_average_final_score_raw":3632.5,"objective_suite_average_runtime_seconds":15.6686976475,"objective_suite_case_adversarial_clique_swap_functionality_35p_final_score":4765.0,"objective_suite_case_adversarial_clique_swap_functionality_35p_normalized_score":1.001892346509672,"objective_suite_case_adversarial_clique_swap_functionality_35p_reference_final_score":4756.0,"objective_suite_case_adversarial_clique_swap_functionality_35p_weight":1.0,"objective_suite_case_adversarial_clique_swap_functionality_35p_weighted_contribution":1.001892346509672,"objective_suite_case_adversarial_transfer_attribute_balance_111p_final_score":201.0,"objective_suite_case_adversarial_transfer_attribute_balance_111p_normalized_score":1.0151515151515151,"objective_suite_case_adversarial_transfer_attribute_balance_111p_reference_final_score":198.0,"objective_suite_case_adversarial_transfer_attribute_balance_111p_weight":1.0,"objective_suite_case_adversarial_transfer_attribute_balance_111p_weighted_contribution":1.0151515151515151,"objective_suite_case_count":6.0,"objective_suite_case_stretch_large_gender_immovable_110p_final_score":2311.0,"objective_suite_case_stretch_large_gender_immovable_110p_normalized_score":1.0605782469022487,"objective_suite_case_stretch_large_gender_immovable_110p_reference_final_score":2179.0,"objective_suite_case_stretch_large_gender_immovable_110p_weight":1.0,"objective_suite_case_stretch_large_gender_immovable_110p_weighted_contribution":1.0605782469022487,"objective_suite_case_stretch_sailing_trip_demo_real_final_score":2302.0,"objective_suite_case_stretch_sailing_trip_demo_real_normalized_score":0.9619724195570414,"objective_suite_case_stretch_sailing_trip_demo_real_reference_final_score":2393.0,"objective_suite_case_stretch_sailing_trip_demo_real_weight":1.0,"objective_suite_case_stretch_sailing_trip_demo_real_weighted_contribution":0.9619724195570414,"objective_suite_case_stretch_social_golfer_32x8x10_final_score":5451.0,"objective_suite_case_stretch_social_golfer_32x8x10_normalized_score":0.9923539049699618,"objective_suite_case_stretch_social_golfer_32x8x10_reference_final_score":5493.0,"objective_suite_case_stretch_social_golfer_32x8x10_weight":1.0,"objective_suite_case_stretch_social_golfer_32x8x10_weighted_contribution":0.9923539049699618,"objective_suite_case_stretch_synthetic_partial_attendance_capacity_pressure_152p_final_score":6765.0,"objective_suite_case_stretch_synthetic_partial_attendance_capacity_pressure_152p_normalized_score":1.0188253012048192,"objective_suite_case_stretch_synthetic_partial_attendance_capacity_pressure_152p_reference_final_score":6640.0,"objective_suite_case_stretch_synthetic_partial_attendance_capacity_pressure_152p_weight":1.0,"objective_suite_case_stretch_synthetic_partial_attendance_capacity_pressure_152p_weighted_contribution":1.0188253012048192,"objective_suite_external_validation_failures":0.0,"objective_suite_score_breakdown_mismatches":0.0,"objective_suite_total_final_score_raw":21795.0,"objective_suite_total_runtime_seconds":94.012185885,"objective_suite_total_score_mismatches":0.0,"objective_suite_weighted_normalized_score":100.84622890492095,"objective_suite_weighted_normalized_score_delta_from_reference":0.8462289049209426,"objective_suite_weighted_normalized_score_weight_sum":6.0,"path_allowed_sessions_iter_us":31.096925,"path_avg_iter_us":20.729464999999998,"path_clique_iter_us":22.732525,"path_construction_iter_us":29.220074999999998,"path_swap_iter_us":11.878775000000001,"path_transfer_iter_us":8.719025,"rep_avg_iter_us":30.631194444444446,"rep_balanced_iter_us":28.879166666666666,"rep_balanced_score":3.0,"rep_constrained_iter_us":32.38322222222222,"rep_constrained_score":4.0,"runtime_canonical_share_percent":99.23982986692468,"runtime_total_seconds":94.732312632,"solver3_raw_score_us":82.22327402777778,"swap_apply_us":2.283578125,"swap_preview_us":6.451421874999999,"transfer_apply_us":2.297765625,"transfer_preview_us":3.8220781250000004},"status":"keep","description":"Memetic donor-choice follow-up: split the donor-polish burst across two diversified donors, exactly rescored all allowable one-session donor transplants for each donor, and injected the best offspring under the existing record-to-record gate. This improved the primary metric from 101.0558 to 100.8462, mainly via better transfer-balance and sailing while holding social_golfer and large_gender flat.","timestamp":1775661602067,"segment":0,"confidence":374.05937015885314,"iterationTokens":14010,"asi":{"hypothesis":"A small diversified donor set is better than a single donor in the memetic burst because donor choice matters more than extra polish on one donor.","mechanism_family":"memetic / multi-donor exact-rescored one-session offspring","structural_change":"When stagnation triggers a memetic burst, spend the same total donor budget across two diversified polished donors, evaluate exact one-session offspring from each donor, and inject only the globally best offspring back into the main record-to-record search.","comparison":{"previous_keep":"101.05576963890799","new_metric":"100.84622890492095","machine_baseline":"101.35127940997147"},"case_shape":{"attribute_balance":"1.0151515151515151","social_golfer":"0.9923539049699618","large_gender":"1.0605782469022487","sailing":"0.9619724195570414","synthetic_partial":"1.0188253012048192"},"next_action_hint":"Confirm the multi-donor memetic keep with at least one rerun; if it holds, further incubation should prefer smarter donor diversity/compatibility over larger offspring stacks."}}
{"run":16,"commit":"903743d","metric":101.65888611463518,"metrics":{"clique_apply_us":3.467604166666667,"clique_preview_us":14.097666666666667,"correctness_suite_average_runtime_seconds":0.197265923,"correctness_suite_case_count":4.0,"correctness_suite_external_validation_failures":0.0,"correctness_suite_total_runtime_seconds":0.789063692,"correctness_suite_total_score_mismatches":0.0,"hotpath_total_us":32.789005208333336,"objective_fixed_iteration_average_final_score_raw":3602.1666666666665,"objective_fixed_iteration_average_runtime_seconds":50.776139934,"objective_fixed_iteration_case_adversarial_clique_swap_functionality_35p_final_score":4765.0,"objective_fixed_iteration_case_adversarial_clique_swap_functionality_35p_normalized_score":1.001892346509672,"objective_fixed_iteration_case_adversarial_clique_swap_functionality_35p_reference_final_score":4756.0,"objective_fixed_iteration_case_adversarial_clique_swap_functionality_35p_weight":1.0,"objective_fixed_iteration_case_adversarial_clique_swap_functionality_35p_weighted_contribution":1.001892346509672,"objective_fixed_iteration_case_adversarial_transfer_attribute_balance_111p_final_score":202.0,"objective_fixed_iteration_case_adversarial_transfer_attribute_balance_111p_normalized_score":0.9901960784313726,"objective_fixed_iteration_case_adversarial_transfer_attribute_balance_111p_reference_final_score":204.0,"objective_fixed_iteration_case_adversarial_transfer_attribute_balance_111p_weight":1.0,"objective_fixed_iteration_case_adversarial_transfer_attribute_balance_111p_weighted_contribution":0.9901960784313726,"objective_fixed_iteration_case_count":6.0,"objective_fixed_iteration_case_stretch_large_gender_immovable_110p_final_score":2157.0,"objective_fixed_iteration_case_stretch_large_gender_immovable_110p_normalized_score":1.010304449648712,"objective_fixed_iteration_case_stretch_large_gender_immovable_110p_reference_final_score":2135.0,"objective_fixed_iteration_case_stretch_large_gender_immovable_110p_weight":1.0,"objective_fixed_iteration_case_stretch_large_gender_immovable_110p_weighted_contribution":1.010304449648712,"objective_fixed_iteration_case_stretch_sailing_trip_demo_real_final_score":2297.0,"objective_fixed_iteration_case_stretch_sailing_trip_demo_real_normalized_score":1.0346846846846847,"objective_fixed_iteration_case_stretch_sailing_trip_demo_real_reference_final_score":2220.0,"objective_fixed_iteration_case_stretch_sailing_trip_demo_real_weight":1.0,"objective_fixed_iteration_case_stretch_sailing_trip_demo_real_weighted_contribution":1.0346846846846847,"objective_fixed_iteration_case_stretch_social_golfer_32x8x10_final_score":5451.0,"objective_fixed_iteration_case_stretch_social_golfer_32x8x10_normalized_score":0.9923539049699618,"objective_fixed_iteration_case_stretch_social_golfer_32x8x10_reference_final_score":5493.0,"objective_fixed_iteration_case_stretch_social_golfer_32x8x10_weight":1.0,"objective_fixed_iteration_case_stretch_social_golfer_32x8x10_weighted_contribution":0.9923539049699618,"objective_fixed_iteration_case_stretch_synthetic_partial_attendance_capacity_pressure_152p_final_score":6741.0,"objective_fixed_iteration_case_stretch_synthetic_partial_attendance_capacity_pressure_152p_normalized_score":1.0181241504304486,"objective_fixed_iteration_case_stretch_synthetic_partial_attendance_capacity_pressure_152p_reference_final_score":6621.0,"objective_fixed_iteration_case_stretch_synthetic_partial_attendance_capacity_pressure_152p_weight":1.0,"objective_fixed_iteration_case_stretch_synthetic_partial_attendance_capacity_pressure_152p_weighted_contribution":1.0181241504304486,"objective_fixed_iteration_external_validation_failures":0.0,"objective_fixed_iteration_score_breakdown_mismatches":0.0,"objective_fixed_iteration_total_final_score_raw":21613.0,"objective_fixed_iteration_total_runtime_seconds":304.65683960399997,"objective_fixed_iteration_total_score_mismatches":0.0,"objective_fixed_iteration_weighted_normalized_score":100.79259357791419,"objective_fixed_iteration_weighted_normalized_score_delta_from_reference":0.7925935779141913,"objective_fixed_iteration_weighted_normalized_score_weight_sum":6.0,"objective_suite_average_final_score_raw":3638.8333333333335,"objective_suite_average_runtime_seconds":15.667789557166667,"objective_suite_case_adversarial_clique_swap_functionality_35p_final_score":4765.0,"objective_suite_case_adversarial_clique_swap_functionality_35p_normalized_score":1.001892346509672,"objective_suite_case_adversarial_clique_swap_functionality_35p_reference_final_score":4756.0,"objective_suite_case_adversarial_clique_swap_functionality_35p_weight":1.0,"objective_suite_case_adversarial_clique_swap_functionality_35p_weighted_contribution":1.001892346509672,"objective_suite_case_adversarial_transfer_attribute_balance_111p_final_score":208.0,"objective_suite_case_adversarial_transfer_attribute_balance_111p_normalized_score":1.0505050505050506,"objective_suite_case_adversarial_transfer_attribute_balance_111p_reference_final_score":198.0,"objective_suite_case_adversarial_transfer_attribute_balance_111p_weight":1.0,"objective_suite_case_adversarial_transfer_attribute_balance_111p_weighted_contribution":1.0505050505050506,"objective_suite_case_count":6.0,"objective_suite_case_stretch_large_gender_immovable_110p_final_score":2322.0,"objective_suite_case_stretch_large_gender_immovable_110p_normalized_score":1.0656264341441029,"objective_suite_case_stretch_large_gender_immovable_110p_reference_final_score":2179.0,"objective_suite_case_stretch_large_gender_immovable_110p_weight":1.0,"objective_suite_case_stretch_large_gender_immovable_110p_weighted_contribution":1.0656264341441029,"objective_suite_case_stretch_sailing_trip_demo_real_final_score":2322.0,"objective_suite_case_stretch_sailing_trip_demo_real_normalized_score":0.9703301295445048,"objective_suite_case_stretch_sailing_trip_demo_real_reference_final_score":2393.0,"objective_suite_case_stretch_sailing_trip_demo_real_weight":1.0,"objective_suite_case_stretch_sailing_trip_demo_real_weighted_contribution":0.9703301295445048,"objective_suite_case_stretch_social_golfer_32x8x10_final_score":5451.0,"objective_suite_case_stretch_social_golfer_32x8x10_normalized_score":0.9923539049699618,"objective_suite_case_stretch_social_golfer_32x8x10_reference_final_score":5493.0,"objective_suite_case_stretch_social_golfer_32x8x10_weight":1.0,"objective_suite_case_stretch_social_golfer_32x8x10_weighted_contribution":0.9923539049699618,"objective_suite_case_stretch_synthetic_partial_attendance_capacity_pressure_152p_final_score":6765.0,"objective_suite_case_stretch_synthetic_partial_attendance_capacity_pressure_152p_normalized_score":1.0188253012048192,"objective_suite_case_stretch_synthetic_partial_attendance_capacity_pressure_152p_reference_final_score":6640.0,"objective_suite_case_stretch_synthetic_partial_attendance_capacity_pressure_152p_weight":1.0,"objective_suite_case_stretch_synthetic_partial_attendance_capacity_pressure_152p_weighted_contribution":1.0188253012048192,"objective_suite_external_validation_failures":0.0,"objective_suite_score_breakdown_mismatches":0.0,"objective_suite_total_final_score_raw":21833.0,"objective_suite_total_runtime_seconds":94.006737343,"objective_suite_total_score_mismatches":0.0,"objective_suite_weighted_normalized_score":101.65888611463518,"objective_suite_weighted_normalized_score_delta_from_reference":1.658886114635183,"objective_suite_weighted_normalized_score_weight_sum":6.0,"path_allowed_sessions_iter_us":26.936674999999997,"path_avg_iter_us":17.498775,"path_clique_iter_us":18.1385,"path_construction_iter_us":21.555175,"path_swap_iter_us":11.570425,"path_transfer_iter_us":9.293099999999999,"rep_avg_iter_us":30.19442314814815,"rep_balanced_iter_us":29.05505,"rep_balanced_score":3.0,"rep_constrained_iter_us":31.3337962962963,"rep_constrained_score":4.0,"runtime_canonical_share_percent":99.1676174647138,"runtime_total_seconds":94.795801035,"solver3_raw_score_us":80.48220335648148,"swap_apply_us":2.2514531250000003,"swap_preview_us":6.919296875,"transfer_apply_us":2.390640625,"transfer_preview_us":3.6623437500000002},"status":"discard","description":"Confirmation rerun of the two-donor memetic burst did not reproduce the 100.8462 keep. The rerun regressed to 101.6589, mainly through worse transfer-balance and large_gender, so the stronger donor-choice mechanism still looks promising but remains noisy and not yet stable enough to extrapolate from one best run alone.","timestamp":1775662048203,"segment":0,"confidence":489.53566583251575,"iterationTokens":4893,"asi":{"hypothesis":"The two-donor exact-rescored memetic burst will confirm as a robust improvement over the one-donor version.","rollback_reason":"The confirmation rerun was substantially worse than the current keep and even worse than the old baseline, so there is no new improvement to keep from this cycle.","next_action_hint":"Keep the current best two-donor memetic result as the incumbent, but if incubation continues prefer stability-oriented donor diversity or compatibility controls before increasing donor count further.","mechanism_family":"memetic / multi-donor exact-rescored one-session offspring","confirmation_context":{"current_keep":"100.84622890492095","confirm_rerun":"101.65888611463518","previous_one_donor_keep":"101.05576963890799","machine_baseline":"101.35127940997147"}}}
