{"run":29,"commit":"903743d","metric":101.38682023030687,"metrics":{"clique_apply_us":2.79475,"clique_preview_us":13.246875,"correctness_suite_average_runtime_seconds":0.2084512445,"correctness_suite_case_count":4.0,"correctness_suite_external_validation_failures":0.0,"correctness_suite_total_runtime_seconds":0.833804978,"correctness_suite_total_score_mismatches":0.0,"hotpath_total_us":31.11421875,"objective_fixed_iteration_average_final_score_raw":3588.8333333333335,"objective_fixed_iteration_average_runtime_seconds":50.95140147916667,"objective_fixed_iteration_case_adversarial_clique_swap_functionality_35p_final_score":4765.0,"objective_fixed_iteration_case_adversarial_clique_swap_functionality_35p_normalized_score":1.001892346509672,"objective_fixed_iteration_case_adversarial_clique_swap_functionality_35p_reference_final_score":4756.0,"objective_fixed_iteration_case_adversarial_clique_swap_functionality_35p_weight":1.0,"objective_fixed_iteration_case_adversarial_clique_swap_functionality_35p_weighted_contribution":1.001892346509672,"objective_fixed_iteration_case_adversarial_transfer_attribute_balance_111p_final_score":203.0,"objective_fixed_iteration_case_adversarial_transfer_attribute_balance_111p_normalized_score":0.9950980392156863,"objective_fixed_iteration_case_adversarial_transfer_attribute_balance_111p_reference_final_score":204.0,"objective_fixed_iteration_case_adversarial_transfer_attribute_balance_111p_weight":1.0,"objective_fixed_iteration_case_adversarial_transfer_attribute_balance_111p_weighted_contribution":0.9950980392156863,"objective_fixed_iteration_case_count":6.0,"objective_fixed_iteration_case_stretch_large_gender_immovable_110p_final_score":2135.0,"objective_fixed_iteration_case_stretch_large_gender_immovable_110p_normalized_score":1.0,"objective_fixed_iteration_case_stretch_large_gender_immovable_110p_reference_final_score":2135.0,"objective_fixed_iteration_case_stretch_large_gender_immovable_110p_weight":1.0,"objective_fixed_iteration_case_stretch_large_gender_immovable_110p_weighted_contribution":1.0,"objective_fixed_iteration_case_stretch_sailing_trip_demo_real_final_score":2308.0,"objective_fixed_iteration_case_stretch_sailing_trip_demo_real_normalized_score":1.0396396396396397,"objective_fixed_iteration_case_stretch_sailing_trip_demo_real_reference_final_score":2220.0,"objective_fixed_iteration_case_stretch_sailing_trip_demo_real_weight":1.0,"objective_fixed_iteration_case_stretch_sailing_trip_demo_real_weighted_contribution":1.0396396396396397,"objective_fixed_iteration_case_stretch_social_golfer_32x8x10_final_score":5346.0,"objective_fixed_iteration_case_stretch_social_golfer_32x8x10_normalized_score":0.9732386673948662,"objective_fixed_iteration_case_stretch_social_golfer_32x8x10_reference_final_score":5493.0,"objective_fixed_iteration_case_stretch_social_golfer_32x8x10_weight":1.0,"objective_fixed_iteration_case_stretch_social_golfer_32x8x10_weighted_contribution":0.9732386673948662,"objective_fixed_iteration_case_stretch_synthetic_partial_attendance_capacity_pressure_152p_final_score":6776.0,"objective_fixed_iteration_case_stretch_synthetic_partial_attendance_capacity_pressure_152p_normalized_score":1.0234103609726628,"objective_fixed_iteration_case_stretch_synthetic_partial_attendance_capacity_pressure_152p_reference_final_score":6621.0,"objective_fixed_iteration_case_stretch_synthetic_partial_attendance_capacity_pressure_152p_weight":1.0,"objective_fixed_iteration_case_stretch_synthetic_partial_attendance_capacity_pressure_152p_weighted_contribution":1.0234103609726628,"objective_fixed_iteration_external_validation_failures":0.0,"objective_fixed_iteration_score_breakdown_mismatches":0.0,"objective_fixed_iteration_total_final_score_raw":21533.0,"objective_fixed_iteration_total_runtime_seconds":305.70840887500003,"objective_fixed_iteration_total_score_mismatches":0.0,"objective_fixed_iteration_weighted_normalized_score":100.55465089554212,"objective_fixed_iteration_weighted_normalized_score_delta_from_reference":0.5546508955421192,"objective_fixed_iteration_weighted_normalized_score_weight_sum":6.0,"objective_suite_average_final_score_raw":3625.5,"objective_suite_average_runtime_seconds":15.6698024035,"objective_suite_case_adversarial_clique_swap_functionality_35p_final_score":4765.0,"objective_suite_case_adversarial_clique_swap_functionality_35p_normalized_score":1.001892346509672,"objective_suite_case_adversarial_clique_swap_functionality_35p_reference_final_score":4756.0,"objective_suite_case_adversarial_clique_swap_functionality_35p_weight":1.0,"objective_suite_case_adversarial_clique_swap_functionality_35p_weighted_contribution":1.001892346509672,"objective_suite_case_adversarial_transfer_attribute_balance_111p_final_score":207.0,"objective_suite_case_adversarial_transfer_attribute_balance_111p_normalized_score":1.0454545454545454,"objective_suite_case_adversarial_transfer_attribute_balance_111p_reference_final_score":198.0,"objective_suite_case_adversarial_transfer_attribute_balance_111p_weight":1.0,"objective_suite_case_adversarial_transfer_attribute_balance_111p_weighted_contribution":1.0454545454545454,"objective_suite_case_count":6.0,"objective_suite_case_stretch_large_gender_immovable_110p_final_score":2333.0,"objective_suite_case_stretch_large_gender_immovable_110p_normalized_score":1.0706746213859568,"objective_suite_case_stretch_large_gender_immovable_110p_reference_final_score":2179.0,"objective_suite_case_stretch_large_gender_immovable_110p_weight":1.0,"objective_suite_case_stretch_large_gender_immovable_110p_weighted_contribution":1.0706746213859568,"objective_suite_case_stretch_sailing_trip_demo_real_final_score":2324.0,"objective_suite_case_stretch_sailing_trip_demo_real_normalized_score":0.9711659005432511,"objective_suite_case_stretch_sailing_trip_demo_real_reference_final_score":2393.0,"objective_suite_case_stretch_sailing_trip_demo_real_weight":1.0,"objective_suite_case_stretch_sailing_trip_demo_real_weighted_contribution":0.9711659005432511,"objective_suite_case_stretch_social_golfer_32x8x10_final_score":5346.0,"objective_suite_case_stretch_social_golfer_32x8x10_normalized_score":0.9732386673948662,"objective_suite_case_stretch_social_golfer_32x8x10_reference_final_score":5493.0,"objective_suite_case_stretch_social_golfer_32x8x10_weight":1.0,"objective_suite_case_stretch_social_golfer_32x8x10_weighted_contribution":0.9732386673948662,"objective_suite_case_stretch_synthetic_partial_attendance_capacity_pressure_152p_final_score":6778.0,"objective_suite_case_stretch_synthetic_partial_attendance_capacity_pressure_152p_normalized_score":1.0207831325301204,"objective_suite_case_stretch_synthetic_partial_attendance_capacity_pressure_152p_reference_final_score":6640.0,"objective_suite_case_stretch_synthetic_partial_attendance_capacity_pressure_152p_weight":1.0,"objective_suite_case_stretch_synthetic_partial_attendance_capacity_pressure_152p_weighted_contribution":1.0207831325301204,"objective_suite_external_validation_failures":0.0,"objective_suite_score_breakdown_mismatches":0.0,"objective_suite_total_final_score_raw":21753.0,"objective_suite_total_runtime_seconds":94.018814421,"objective_suite_total_score_mismatches":0.0,"objective_suite_weighted_normalized_score":101.38682023030687,"objective_suite_weighted_normalized_score_delta_from_reference":1.3868202303068733,"objective_suite_weighted_normalized_score_weight_sum":6.0,"path_allowed_sessions_iter_us":29.2879,"path_avg_iter_us":18.5183,"path_clique_iter_us":19.32865,"path_construction_iter_us":23.675424999999997,"path_swap_iter_us":11.740275,"path_transfer_iter_us":8.55925,"rep_avg_iter_us":29.94707314814815,"rep_balanced_iter_us":28.321849999999998,"rep_balanced_score":3.0,"rep_constrained_iter_us":31.572296296296297,"rep_constrained_score":4.0,"runtime_canonical_share_percent":99.12094680855087,"runtime_total_seconds":94.852619399,"solver3_raw_score_us":79.57959189814815,"swap_apply_us":2.263015625,"swap_preview_us":6.640890625,"transfer_apply_us":2.35040625,"transfer_preview_us":3.81828125},"status":"discard","description":"Incubation follow-up on incumbent-derived donor generation: instead of replacing the incumbent's hottest sessions, the donor generator imported only sessions where a diversified donor looked structurally better on repeat/balance pressure before donor polishing. This sharper donor-advantage selector overfit the local structural proxy and regressed the primary aggregate despite strong social_golfer gains.","timestamp":1775671883929,"segment":0,"confidence":840.5564044192622,"iterationTokens":9338,"asi":{"hypothesis":"Importing only sessions where the randomized donor is structurally better than the incumbent will produce higher-quality perturbed donors than blindly mutating incumbent hotspot sessions.","rollback_reason":"Primary quality regressed to 101.3868 and the selector worsened transfer-balance, large_gender, and synthetic despite better social_golfer.","next_action_hint":"Pause this donor-generation incubation and rerun the kept champion to measure whether recent regressions are just machine drift/noise or a real thermal/system effect, as requested by the user.","mechanism_family":"incumbent-derived donor generation","observed_case_pattern":{"social_golfer":"0.9732","sailing":"0.9712","large_gender":"1.0707","synthetic":"1.0208","transfer_balance":"1.0455"},"learning":"A simple donor-vs-incumbent session-pressure proxy is too myopic; it imports sessions that look locally attractive but do not improve global offspring quality."}}
{"run":30,"commit":"903743d","metric":101.37846319867421,"metrics":{"clique_apply_us":2.8487708333333335,"clique_preview_us":12.778145833333335,"correctness_suite_average_runtime_seconds":0.17995147649999998,"correctness_suite_case_count":4.0,"correctness_suite_external_validation_failures":0.0,"correctness_suite_total_runtime_seconds":0.7198059059999999,"correctness_suite_total_score_mismatches":0.0,"hotpath_total_us":31.29674479166667,"objective_fixed_iteration_average_final_score_raw":3604.5,"objective_fixed_iteration_average_runtime_seconds":50.9155013985,"objective_fixed_iteration_case_adversarial_clique_swap_functionality_35p_final_score":4765.0,"objective_fixed_iteration_case_adversarial_clique_swap_functionality_35p_normalized_score":1.001892346509672,"objective_fixed_iteration_case_adversarial_clique_swap_functionality_35p_reference_final_score":4756.0,"objective_fixed_iteration_case_adversarial_clique_swap_functionality_35p_weight":1.0,"objective_fixed_iteration_case_adversarial_clique_swap_functionality_35p_weighted_contribution":1.001892346509672,"objective_fixed_iteration_case_adversarial_transfer_attribute_balance_111p_final_score":207.0,"objective_fixed_iteration_case_adversarial_transfer_attribute_balance_111p_normalized_score":1.0147058823529411,"objective_fixed_iteration_case_adversarial_transfer_attribute_balance_111p_reference_final_score":204.0,"objective_fixed_iteration_case_adversarial_transfer_attribute_balance_111p_weight":1.0,"objective_fixed_iteration_case_adversarial_transfer_attribute_balance_111p_weighted_contribution":1.0147058823529411,"objective_fixed_iteration_case_count":6.0,"objective_fixed_iteration_case_stretch_large_gender_immovable_110p_final_score":2157.0,"objective_fixed_iteration_case_stretch_large_gender_immovable_110p_normalized_score":1.010304449648712,"objective_fixed_iteration_case_stretch_large_gender_immovable_110p_reference_final_score":2135.0,"objective_fixed_iteration_case_stretch_large_gender_immovable_110p_weight":1.0,"objective_fixed_iteration_case_stretch_large_gender_immovable_110p_weighted_contribution":1.010304449648712,"objective_fixed_iteration_case_stretch_sailing_trip_demo_real_final_score":2306.0,"objective_fixed_iteration_case_stretch_sailing_trip_demo_real_normalized_score":1.0387387387387388,"objective_fixed_iteration_case_stretch_sailing_trip_demo_real_reference_final_score":2220.0,"objective_fixed_iteration_case_stretch_sailing_trip_demo_real_weight":1.0,"objective_fixed_iteration_case_stretch_sailing_trip_demo_real_weighted_contribution":1.0387387387387388,"objective_fixed_iteration_case_stretch_social_golfer_32x8x10_final_score":5451.0,"objective_fixed_iteration_case_stretch_social_golfer_32x8x10_normalized_score":0.9923539049699618,"objective_fixed_iteration_case_stretch_social_golfer_32x8x10_reference_final_score":5493.0,"objective_fixed_iteration_case_stretch_social_golfer_32x8x10_weight":1.0,"objective_fixed_iteration_case_stretch_social_golfer_32x8x10_weighted_contribution":0.9923539049699618,"objective_fixed_iteration_case_stretch_synthetic_partial_attendance_capacity_pressure_152p_final_score":6741.0,"objective_fixed_iteration_case_stretch_synthetic_partial_attendance_capacity_pressure_152p_normalized_score":1.0181241504304486,"objective_fixed_iteration_case_stretch_synthetic_partial_attendance_capacity_pressure_152p_reference_final_score":6621.0,"objective_fixed_iteration_case_stretch_synthetic_partial_attendance_capacity_pressure_152p_weight":1.0,"objective_fixed_iteration_case_stretch_synthetic_partial_attendance_capacity_pressure_152p_weighted_contribution":1.0181241504304486,"objective_fixed_iteration_external_validation_failures":0.0,"objective_fixed_iteration_score_breakdown_mismatches":0.0,"objective_fixed_iteration_total_final_score_raw":21627.0,"objective_fixed_iteration_total_runtime_seconds":305.493008391,"objective_fixed_iteration_total_score_mismatches":0.0,"objective_fixed_iteration_weighted_normalized_score":101.26865787750792,"objective_fixed_iteration_weighted_normalized_score_delta_from_reference":1.2686578775079171,"objective_fixed_iteration_weighted_normalized_score_weight_sum":6.0,"objective_suite_average_final_score_raw":3639.3333333333335,"objective_suite_average_runtime_seconds":15.669525870333333,"objective_suite_case_adversarial_clique_swap_functionality_35p_final_score":4765.0,"objective_suite_case_adversarial_clique_swap_functionality_35p_normalized_score":1.001892346509672,"objective_suite_case_adversarial_clique_swap_functionality_35p_reference_final_score":4756.0,"objective_suite_case_adversarial_clique_swap_functionality_35p_weight":1.0,"objective_suite_case_adversarial_clique_swap_functionality_35p_weighted_contribution":1.001892346509672,"objective_suite_case_adversarial_transfer_attribute_balance_111p_final_score":204.0,"objective_suite_case_adversarial_transfer_attribute_balance_111p_normalized_score":1.0303030303030303,"objective_suite_case_adversarial_transfer_attribute_balance_111p_reference_final_score":198.0,"objective_suite_case_adversarial_transfer_attribute_balance_111p_weight":1.0,"objective_suite_case_adversarial_transfer_attribute_balance_111p_weighted_contribution":1.0303030303030303,"objective_suite_case_count":6.0,"objective_suite_case_stretch_large_gender_immovable_110p_final_score":2333.0,"objective_suite_case_stretch_large_gender_immovable_110p_normalized_score":1.0706746213859568,"objective_suite_case_stretch_large_gender_immovable_110p_reference_final_score":2179.0,"objective_suite_case_stretch_large_gender_immovable_110p_weight":1.0,"objective_suite_case_stretch_large_gender_immovable_110p_weighted_contribution":1.0706746213859568,"objective_suite_case_stretch_sailing_trip_demo_real_final_score":2318.0,"objective_suite_case_stretch_sailing_trip_demo_real_normalized_score":0.9686585875470122,"objective_suite_case_stretch_sailing_trip_demo_real_reference_final_score":2393.0,"objective_suite_case_stretch_sailing_trip_demo_real_weight":1.0,"objective_suite_case_stretch_sailing_trip_demo_real_weighted_contribution":0.9686585875470122,"objective_suite_case_stretch_social_golfer_32x8x10_final_score":5451.0,"objective_suite_case_stretch_social_golfer_32x8x10_normalized_score":0.9923539049699618,"objective_suite_case_stretch_social_golfer_32x8x10_reference_final_score":5493.0,"objective_suite_case_stretch_social_golfer_32x8x10_weight":1.0,"objective_suite_case_stretch_social_golfer_32x8x10_weighted_contribution":0.9923539049699618,"objective_suite_case_stretch_synthetic_partial_attendance_capacity_pressure_152p_final_score":6765.0,"objective_suite_case_stretch_synthetic_partial_attendance_capacity_pressure_152p_normalized_score":1.0188253012048192,"objective_suite_case_stretch_synthetic_partial_attendance_capacity_pressure_152p_reference_final_score":6640.0,"objective_suite_case_stretch_synthetic_partial_attendance_capacity_pressure_152p_weight":1.0,"objective_suite_case_stretch_synthetic_partial_attendance_capacity_pressure_152p_weighted_contribution":1.0188253012048192,"objective_suite_external_validation_failures":0.0,"objective_suite_score_breakdown_mismatches":0.0,"objective_suite_total_final_score_raw":21836.0,"objective_suite_total_runtime_seconds":94.017155222,"objective_suite_total_score_mismatches":0.0,"objective_suite_weighted_normalized_score":101.37846319867421,"objective_suite_weighted_normalized_score_delta_from_reference":1.3784631986742069,"objective_suite_weighted_normalized_score_weight_sum":6.0,"path_allowed_sessions_iter_us":43.734674999999996,"path_avg_iter_us":25.243215,"path_clique_iter_us":25.74165,"path_construction_iter_us":24.879150000000003,"path_swap_iter_us":18.360625000000002,"path_transfer_iter_us":13.499975000000001,"rep_avg_iter_us":34.366888888888894,"rep_balanced_iter_us":29.549666666666667,"rep_balanced_score":3.0,"rep_constrained_iter_us":39.184111111111115,"rep_constrained_score":4.0,"runtime_canonical_share_percent":99.24020583156825,"runtime_total_seconds":94.736961128,"solver3_raw_score_us":90.90684868055556,"swap_apply_us":2.36284375,"swap_preview_us":7.0483125,"transfer_apply_us":2.3585,"transfer_preview_us":3.9001718750000003},"status":"discard","description":"Champion rerun on unchanged kept commit 903743d to check stability/thermal drift. The same code landed well above its kept best (100.8462 -> 101.3785), with materially slower raw runtime diagnostics, so the champion did not hold on this rerun and the machine appears slower than at the winning run.","timestamp":1775672402111,"segment":0,"confidence":1013.1506056705375,"iterationTokens":5008,"asi":{"hypothesis":"If the champion still performs near 100.8462 with similar runtime diagnostics, the earlier win likely held; if both quality and raw runtime regress together, machine-state drift such as thermal slowdown is a plausible contributor.","rollback_reason":"This was a diagnostic rerun on unchanged code and did not improve the primary metric.","next_action_hint":"Run at least one more unchanged-champion rerun to separate stochastic quality noise from sustained machine slowdown; compare solver3_raw_score_us and path/hotpath probes across reruns.","mechanism_family":"champion stability / system-drift check","comparison":{"best_keep_metric":"100.84622890492095","rerun_metric":"101.37846319867421","best_keep_solver3_raw_score_us":"79.50","rerun_solver3_raw_score_us":"90.91"},"learning":"Same-code quality regression coincided with slower raw runtime, which is more consistent with system-state drift than with a genuine code regression."}}
