{"run":8,"commit":"295db0c","metric":100.27926595089932,"metrics":{"clique_apply_us":0.9515208333333334,"clique_preview_us":3.8157083333333333,"correctness_suite_average_runtime_seconds":0.30952085325,"correctness_suite_case_count":4.0,"correctness_suite_external_validation_failures":0.0,"correctness_suite_total_runtime_seconds":1.238083413,"correctness_suite_total_score_mismatches":0.0,"hotpath_total_us":9.967197916666667,"objective_fixed_iteration_average_final_score_raw":3569.8333333333335,"objective_fixed_iteration_average_runtime_seconds":49.22069198083334,"objective_fixed_iteration_case_adversarial_clique_swap_functionality_35p_final_score":4756.0,"objective_fixed_iteration_case_adversarial_clique_swap_functionality_35p_normalized_score":1.0,"objective_fixed_iteration_case_adversarial_clique_swap_functionality_35p_reference_final_score":4756.0,"objective_fixed_iteration_case_adversarial_clique_swap_functionality_35p_weight":1.0,"objective_fixed_iteration_case_adversarial_clique_swap_functionality_35p_weighted_contribution":1.0,"objective_fixed_iteration_case_adversarial_transfer_attribute_balance_111p_final_score":202.0,"objective_fixed_iteration_case_adversarial_transfer_attribute_balance_111p_normalized_score":0.9901960784313726,"objective_fixed_iteration_case_adversarial_transfer_attribute_balance_111p_reference_final_score":204.0,"objective_fixed_iteration_case_adversarial_transfer_attribute_balance_111p_weight":1.0,"objective_fixed_iteration_case_adversarial_transfer_attribute_balance_111p_weighted_contribution":0.9901960784313726,"objective_fixed_iteration_case_count":6.0,"objective_fixed_iteration_case_stretch_large_gender_immovable_110p_final_score":2025.0,"objective_fixed_iteration_case_stretch_large_gender_immovable_110p_normalized_score":0.9484777517564403,"objective_fixed_iteration_case_stretch_large_gender_immovable_110p_reference_final_score":2135.0,"objective_fixed_iteration_case_stretch_large_gender_immovable_110p_weight":1.0,"objective_fixed_iteration_case_stretch_large_gender_immovable_110p_weighted_contribution":0.9484777517564403,"objective_fixed_iteration_case_stretch_sailing_trip_demo_real_final_score":2545.0,"objective_fixed_iteration_case_stretch_sailing_trip_demo_real_normalized_score":1.1463963963963963,"objective_fixed_iteration_case_stretch_sailing_trip_demo_real_reference_final_score":2220.0,"objective_fixed_iteration_case_stretch_sailing_trip_demo_real_weight":1.0,"objective_fixed_iteration_case_stretch_sailing_trip_demo_real_weighted_contribution":1.1463963963963963,"objective_fixed_iteration_case_stretch_social_golfer_32x8x10_final_score":5430.0,"objective_fixed_iteration_case_stretch_social_golfer_32x8x10_normalized_score":0.9885308574549426,"objective_fixed_iteration_case_stretch_social_golfer_32x8x10_reference_final_score":5493.0,"objective_fixed_iteration_case_stretch_social_golfer_32x8x10_weight":1.0,"objective_fixed_iteration_case_stretch_social_golfer_32x8x10_weighted_contribution":0.9885308574549426,"objective_fixed_iteration_case_stretch_synthetic_partial_attendance_capacity_pressure_152p_final_score":6461.0,"objective_fixed_iteration_case_stretch_synthetic_partial_attendance_capacity_pressure_152p_normalized_score":0.9758344660927353,"objective_fixed_iteration_case_stretch_synthetic_partial_attendance_capacity_pressure_152p_reference_final_score":6621.0,"objective_fixed_iteration_case_stretch_synthetic_partial_attendance_capacity_pressure_152p_weight":1.0,"objective_fixed_iteration_case_stretch_synthetic_partial_attendance_capacity_pressure_152p_weighted_contribution":0.9758344660927353,"objective_fixed_iteration_external_validation_failures":0.0,"objective_fixed_iteration_score_breakdown_mismatches":0.0,"objective_fixed_iteration_total_final_score_raw":21419.0,"objective_fixed_iteration_total_runtime_seconds":295.324151885,"objective_fixed_iteration_total_score_mismatches":0.0,"objective_fixed_iteration_weighted_normalized_score":100.82392583553144,"objective_fixed_iteration_weighted_normalized_score_delta_from_reference":0.8239258355314361,"objective_fixed_iteration_weighted_normalized_score_weight_sum":6.0,"objective_suite_average_final_score_raw":3592.3333333333335,"objective_suite_average_runtime_seconds":15.667920293,"objective_suite_case_adversarial_clique_swap_functionality_35p_final_score":4756.0,"objective_suite_case_adversarial_clique_swap_functionality_35p_normalized_score":1.0,"objective_suite_case_adversarial_clique_swap_functionality_35p_reference_final_score":4756.0,"objective_suite_case_adversarial_clique_swap_functionality_35p_weight":1.0,"objective_suite_case_adversarial_clique_swap_functionality_35p_weighted_contribution":1.0,"objective_suite_case_adversarial_transfer_attribute_balance_111p_final_score":199.0,"objective_suite_case_adversarial_transfer_attribute_balance_111p_normalized_score":1.005050505050505,"objective_suite_case_adversarial_transfer_attribute_balance_111p_reference_final_score":198.0,"objective_suite_case_adversarial_transfer_attribute_balance_111p_weight":1.0,"objective_suite_case_adversarial_transfer_attribute_balance_111p_weighted_contribution":1.005050505050505,"objective_suite_case_count":6.0,"objective_suite_case_stretch_large_gender_immovable_110p_final_score":2146.0,"objective_suite_case_stretch_large_gender_immovable_110p_normalized_score":0.9848554382744378,"objective_suite_case_stretch_large_gender_immovable_110p_reference_final_score":2179.0,"objective_suite_case_stretch_large_gender_immovable_110p_weight":1.0,"objective_suite_case_stretch_large_gender_immovable_110p_weighted_contribution":0.9848554382744378,"objective_suite_case_stretch_sailing_trip_demo_real_final_score":2542.0,"objective_suite_case_stretch_sailing_trip_demo_real_normalized_score":1.0622649394066026,"objective_suite_case_stretch_sailing_trip_demo_real_reference_final_score":2393.0,"objective_suite_case_stretch_sailing_trip_demo_real_weight":1.0,"objective_suite_case_stretch_sailing_trip_demo_real_weighted_contribution":1.0622649394066026,"objective_suite_case_stretch_social_golfer_32x8x10_final_score":5430.0,"objective_suite_case_stretch_social_golfer_32x8x10_normalized_score":0.9885308574549426,"objective_suite_case_stretch_social_golfer_32x8x10_reference_final_score":5493.0,"objective_suite_case_stretch_social_golfer_32x8x10_weight":1.0,"objective_suite_case_stretch_social_golfer_32x8x10_weighted_contribution":0.9885308574549426,"objective_suite_case_stretch_synthetic_partial_attendance_capacity_pressure_152p_final_score":6481.0,"objective_suite_case_stretch_synthetic_partial_attendance_capacity_pressure_152p_normalized_score":0.9760542168674698,"objective_suite_case_stretch_synthetic_partial_attendance_capacity_pressure_152p_reference_final_score":6640.0,"objective_suite_case_stretch_synthetic_partial_attendance_capacity_pressure_152p_weight":1.0,"objective_suite_case_stretch_synthetic_partial_attendance_capacity_pressure_152p_weighted_contribution":0.9760542168674698,"objective_suite_external_validation_failures":0.0,"objective_suite_score_breakdown_mismatches":0.0,"objective_suite_total_final_score_raw":21554.0,"objective_suite_total_runtime_seconds":94.007521758,"objective_suite_total_score_mismatches":0.0,"objective_suite_weighted_normalized_score":100.27926595089932,"objective_suite_weighted_normalized_score_delta_from_reference":0.27926595089931006,"objective_suite_weighted_normalized_score_weight_sum":6.0,"path_allowed_sessions_iter_us":21.167525,"path_avg_iter_us":13.1076,"path_clique_iter_us":6.7871250000000005,"path_construction_iter_us":16.397275,"path_swap_iter_us":13.076975,"path_transfer_iter_us":8.1091,"rep_avg_iter_us":24.963442204301074,"rep_balanced_iter_us":25.045916666666663,"rep_balanced_score":3.0,"rep_constrained_iter_us":24.880967741935482,"rep_constrained_score":4.0,"runtime_canonical_share_percent":98.70011491787238,"runtime_total_seconds":95.245605171,"solver3_raw_score_us":48.038240120967735,"swap_apply_us":0.711375,"swap_preview_us":2.375,"transfer_apply_us":0.7836718749999999,"transfer_preview_us":1.329921875},"status":"discard","description":"Tried a richer best-of-k sampled neighborhood inside existing move families (k=3 for swap/transfer, k=1 for clique). This enlarged the local neighborhood and helped sailing, but regressed the primary fixed-time aggregate versus the 100.105 best due to runtime inflation (~48us raw score vs ~24.7 baseline) and losses on large_gender/social_golfer/synthetic.","timestamp":1775576592704,"segment":0,"confidence":25.624105228801643,"iterationTokens":25217,"asi":{"hypothesis":"A small best-of-k random neighborhood inside swap/transfer would convert recent speed headroom into better local move quality and improve the fixed-time solver3 objective suite.","rollback_reason":"Primary metric regressed from the best kept run and hotpath/runtime cost roughly doubled, so the richer neighborhood was too expensive at k=3.","next_action_hint":"Incubate the neighborhood family in a cheaper form: try asymmetric draws (e.g. swap=2, transfer=1), selective best-of-k only when temperature is low or for one family at a time, or targeted candidate generation rather than brute extra previews.","observations":["Fixed-time objective suite score 100.2793 was worse than the best kept 100.1055.","Sailing improved to 1.062, but large_gender fell to 0.985 and social_golfer/synthetic also slipped.","solver3_raw_score_us increased to 48.04, suggesting preview multiplication dominated the benefit."],"mechanism_family":"richer neighborhood / best-of-k candidate sampling","draws":{"swap":3,"transfer":3,"clique_swap":1}}}
{"run":9,"commit":"295db0c","metric":112.6265424345814,"metrics":{"clique_apply_us":1.211625,"clique_preview_us":4.61175,"correctness_suite_average_runtime_seconds":0.13318285725,"correctness_suite_case_count":4.0,"correctness_suite_external_validation_failures":0.0,"correctness_suite_total_runtime_seconds":0.532731429,"correctness_suite_total_score_mismatches":0.0,"hotpath_total_us":11.623,"objective_fixed_iteration_average_final_score_raw":3879.5,"objective_fixed_iteration_average_runtime_seconds":43.74808092483333,"objective_fixed_iteration_case_adversarial_clique_swap_functionality_35p_final_score":4756.0,"objective_fixed_iteration_case_adversarial_clique_swap_functionality_35p_normalized_score":1.0,"objective_fixed_iteration_case_adversarial_clique_swap_functionality_35p_reference_final_score":4756.0,"objective_fixed_iteration_case_adversarial_clique_swap_functionality_35p_weight":1.0,"objective_fixed_iteration_case_adversarial_clique_swap_functionality_35p_weighted_contribution":1.0,"objective_fixed_iteration_case_adversarial_transfer_attribute_balance_111p_final_score":200.0,"objective_fixed_iteration_case_adversarial_transfer_attribute_balance_111p_normalized_score":0.9803921568627451,"objective_fixed_iteration_case_adversarial_transfer_attribute_balance_111p_reference_final_score":204.0,"objective_fixed_iteration_case_adversarial_transfer_attribute_balance_111p_weight":1.0,"objective_fixed_iteration_case_adversarial_transfer_attribute_balance_111p_weighted_contribution":0.9803921568627451,"objective_fixed_iteration_case_count":6.0,"objective_fixed_iteration_case_stretch_large_gender_immovable_110p_final_score":2080.0,"objective_fixed_iteration_case_stretch_large_gender_immovable_110p_normalized_score":0.9742388758782201,"objective_fixed_iteration_case_stretch_large_gender_immovable_110p_reference_final_score":2135.0,"objective_fixed_iteration_case_stretch_large_gender_immovable_110p_weight":1.0,"objective_fixed_iteration_case_stretch_large_gender_immovable_110p_weighted_contribution":0.9742388758782201,"objective_fixed_iteration_case_stretch_sailing_trip_demo_real_final_score":4234.0,"objective_fixed_iteration_case_stretch_sailing_trip_demo_real_normalized_score":1.9072072072072073,"objective_fixed_iteration_case_stretch_sailing_trip_demo_real_reference_final_score":2220.0,"objective_fixed_iteration_case_stretch_sailing_trip_demo_real_weight":1.0,"objective_fixed_iteration_case_stretch_sailing_trip_demo_real_weighted_contribution":1.9072072072072073,"objective_fixed_iteration_case_stretch_social_golfer_32x8x10_final_score":5430.0,"objective_fixed_iteration_case_stretch_social_golfer_32x8x10_normalized_score":0.9885308574549426,"objective_fixed_iteration_case_stretch_social_golfer_32x8x10_reference_final_score":5493.0,"objective_fixed_iteration_case_stretch_social_golfer_32x8x10_weight":1.0,"objective_fixed_iteration_case_stretch_social_golfer_32x8x10_weighted_contribution":0.9885308574549426,"objective_fixed_iteration_case_stretch_synthetic_partial_attendance_capacity_pressure_152p_final_score":6577.0,"objective_fixed_iteration_case_stretch_synthetic_partial_attendance_capacity_pressure_152p_normalized_score":0.9933544781755022,"objective_fixed_iteration_case_stretch_synthetic_partial_attendance_capacity_pressure_152p_reference_final_score":6621.0,"objective_fixed_iteration_case_stretch_synthetic_partial_attendance_capacity_pressure_152p_weight":1.0,"objective_fixed_iteration_case_stretch_synthetic_partial_attendance_capacity_pressure_152p_weighted_contribution":0.9933544781755022,"objective_fixed_iteration_external_validation_failures":0.0,"objective_fixed_iteration_score_breakdown_mismatches":0.0,"objective_fixed_iteration_total_final_score_raw":23277.0,"objective_fixed_iteration_total_runtime_seconds":262.48848554899996,"objective_fixed_iteration_total_score_mismatches":0.0,"objective_fixed_iteration_weighted_normalized_score":114.06205959297695,"objective_fixed_iteration_weighted_normalized_score_delta_from_reference":14.06205959297695,"objective_fixed_iteration_weighted_normalized_score_weight_sum":6.0,"objective_suite_average_final_score_raw":3900.6666666666665,"objective_suite_average_runtime_seconds":15.667164905,"objective_suite_case_adversarial_clique_swap_functionality_35p_final_score":4756.0,"objective_suite_case_adversarial_clique_swap_functionality_35p_normalized_score":1.0,"objective_suite_case_adversarial_clique_swap_functionality_35p_reference_final_score":4756.0,"objective_suite_case_adversarial_clique_swap_functionality_35p_weight":1.0,"objective_suite_case_adversarial_clique_swap_functionality_35p_weighted_contribution":1.0,"objective_suite_case_adversarial_transfer_attribute_balance_111p_final_score":197.0,"objective_suite_case_adversarial_transfer_attribute_balance_111p_normalized_score":0.9949494949494949,"objective_suite_case_adversarial_transfer_attribute_balance_111p_reference_final_score":198.0,"objective_suite_case_adversarial_transfer_attribute_balance_111p_weight":1.0,"objective_suite_case_adversarial_transfer_attribute_balance_111p_weighted_contribution":0.9949494949494949,"objective_suite_case_count":6.0,"objective_suite_case_stretch_large_gender_immovable_110p_final_score":2146.0,"objective_suite_case_stretch_large_gender_immovable_110p_normalized_score":0.9848554382744378,"objective_suite_case_stretch_large_gender_immovable_110p_reference_final_score":2179.0,"objective_suite_case_stretch_large_gender_immovable_110p_weight":1.0,"objective_suite_case_stretch_large_gender_immovable_110p_weighted_contribution":0.9848554382744378,"objective_suite_case_stretch_sailing_trip_demo_real_final_score":4308.0,"objective_suite_case_stretch_sailing_trip_demo_real_normalized_score":1.8002507312996239,"objective_suite_case_stretch_sailing_trip_demo_real_reference_final_score":2393.0,"objective_suite_case_stretch_sailing_trip_demo_real_weight":1.0,"objective_suite_case_stretch_sailing_trip_demo_real_weighted_contribution":1.8002507312996239,"objective_suite_case_stretch_social_golfer_32x8x10_final_score":5430.0,"objective_suite_case_stretch_social_golfer_32x8x10_normalized_score":0.9885308574549426,"objective_suite_case_stretch_social_golfer_32x8x10_reference_final_score":5493.0,"objective_suite_case_stretch_social_golfer_32x8x10_weight":1.0,"objective_suite_case_stretch_social_golfer_32x8x10_weighted_contribution":0.9885308574549426,"objective_suite_case_stretch_synthetic_partial_attendance_capacity_pressure_152p_final_score":6567.0,"objective_suite_case_stretch_synthetic_partial_attendance_capacity_pressure_152p_normalized_score":0.9890060240963855,"objective_suite_case_stretch_synthetic_partial_attendance_capacity_pressure_152p_reference_final_score":6640.0,"objective_suite_case_stretch_synthetic_partial_attendance_capacity_pressure_152p_weight":1.0,"objective_suite_case_stretch_synthetic_partial_attendance_capacity_pressure_152p_weighted_contribution":0.9890060240963855,"objective_suite_external_validation_failures":0.0,"objective_suite_score_breakdown_mismatches":0.0,"objective_suite_total_final_score_raw":23404.0,"objective_suite_total_runtime_seconds":94.00298943,"objective_suite_total_score_mismatches":0.0,"objective_suite_weighted_normalized_score":112.6265424345814,"objective_suite_weighted_normalized_score_delta_from_reference":12.626542434581388,"objective_suite_weighted_normalized_score_weight_sum":6.0,"path_allowed_sessions_iter_us":14.551899999999998,"path_avg_iter_us":8.651295,"path_clique_iter_us":6.871674999999999,"path_construction_iter_us":10.45435,"path_swap_iter_us":7.710374999999999,"path_transfer_iter_us":3.668175,"rep_avg_iter_us":13.878197826086957,"rep_balanced_iter_us":14.5182,"rep_balanced_score":3.0,"rep_constrained_iter_us":13.238195652173912,"rep_constrained_score":4.0,"runtime_canonical_share_percent":99.43647604930779,"runtime_total_seconds":94.535720859,"solver3_raw_score_us":34.152492826086956,"swap_apply_us":0.7989375,"swap_preview_us":2.7023125,"transfer_apply_us":0.9246562500000001,"transfer_preview_us":1.3737187499999999},"status":"discard","description":"Incubated the richer-neighborhood family with a cheap asymmetric variant: best-of-2 on swap only, transfer/clique unchanged. This still regressed the primary metric badly, driven by a huge sailing collapse, so greedy local preview selection appears harmful for this family even when the runtime overhead is moderated.","timestamp":1775577085376,"segment":0,"confidence":17.983427287064874,"iterationTokens":19149,"asi":{"hypothesis":"A cheaper swap-only best-of-k neighborhood might retain the upside of richer local choice without the runtime inflation of sampling multiple transfer previews.","rollback_reason":"Primary metric worsened sharply to 112.6265, with sailing exploding to 1.8003 fixed-time and 1.9072 fixed-iteration, so the neighborhood family appears directionally wrong rather than merely too expensive.","next_action_hint":"Retire na\u00efve best-of-k preview selection for now. If revisiting neighborhood enrichment later, make it structurally different: target specific conflict patterns, add diversity/randomization guards, or score compound moves rather than greedily picking the locally best sampled swap.","observations":["Swap-only best-of-2 still increased solver3_raw_score_us to 34.15, but the main failure was search quality, not just runtime.","The damage concentrated in stretch_sailing_trip_demo_real while most other cases stayed near baseline.","This suggests local delta-greediness can steer solver3 into a bad basin on sailing-like instances."],"mechanism_family":"richer neighborhood / best-of-k candidate sampling","draws":{"swap":2,"transfer":1,"clique_swap":1}}}
