{"run":9,"commit":"42f01a4","metric":118.31364792615982,"metrics":{"clique_apply_us":2.9602708333333334,"clique_preview_us":13.0200625,"correctness_suite_average_runtime_seconds":0.16603253775,"correctness_suite_case_count":4.0,"correctness_suite_external_validation_failures":0.0,"correctness_suite_total_runtime_seconds":0.664130151,"correctness_suite_total_score_mismatches":0.0,"hotpath_total_us":31.23091145833333,"objective_fixed_iteration_average_final_score_raw":4006.6666666666665,"objective_fixed_iteration_average_runtime_seconds":50.640595930833335,"objective_fixed_iteration_case_adversarial_clique_swap_functionality_35p_final_score":4756.0,"objective_fixed_iteration_case_adversarial_clique_swap_functionality_35p_normalized_score":1.0,"objective_fixed_iteration_case_adversarial_clique_swap_functionality_35p_reference_final_score":4756.0,"objective_fixed_iteration_case_adversarial_clique_swap_functionality_35p_weight":1.0,"objective_fixed_iteration_case_adversarial_clique_swap_functionality_35p_weighted_contribution":1.0,"objective_fixed_iteration_case_adversarial_transfer_attribute_balance_111p_final_score":212.0,"objective_fixed_iteration_case_adversarial_transfer_attribute_balance_111p_normalized_score":1.0392156862745099,"objective_fixed_iteration_case_adversarial_transfer_attribute_balance_111p_reference_final_score":204.0,"objective_fixed_iteration_case_adversarial_transfer_attribute_balance_111p_weight":1.0,"objective_fixed_iteration_case_adversarial_transfer_attribute_balance_111p_weighted_contribution":1.0392156862745099,"objective_fixed_iteration_case_count":6.0,"objective_fixed_iteration_case_stretch_large_gender_immovable_110p_final_score":2223.0,"objective_fixed_iteration_case_stretch_large_gender_immovable_110p_normalized_score":1.0412177985948479,"objective_fixed_iteration_case_stretch_large_gender_immovable_110p_reference_final_score":2135.0,"objective_fixed_iteration_case_stretch_large_gender_immovable_110p_weight":1.0,"objective_fixed_iteration_case_stretch_large_gender_immovable_110p_weighted_contribution":1.0412177985948479,"objective_fixed_iteration_case_stretch_sailing_trip_demo_real_final_score":4497.0,"objective_fixed_iteration_case_stretch_sailing_trip_demo_real_normalized_score":2.0256756756756755,"objective_fixed_iteration_case_stretch_sailing_trip_demo_real_reference_final_score":2220.0,"objective_fixed_iteration_case_stretch_sailing_trip_demo_real_weight":1.0,"objective_fixed_iteration_case_stretch_sailing_trip_demo_real_weighted_contribution":2.0256756756756755,"objective_fixed_iteration_case_stretch_social_golfer_32x8x10_final_score":5619.0,"objective_fixed_iteration_case_stretch_social_golfer_32x8x10_normalized_score":1.0229382850901148,"objective_fixed_iteration_case_stretch_social_golfer_32x8x10_reference_final_score":5493.0,"objective_fixed_iteration_case_stretch_social_golfer_32x8x10_weight":1.0,"objective_fixed_iteration_case_stretch_social_golfer_32x8x10_weighted_contribution":1.0229382850901148,"objective_fixed_iteration_case_stretch_synthetic_partial_attendance_capacity_pressure_152p_final_score":6733.0,"objective_fixed_iteration_case_stretch_synthetic_partial_attendance_capacity_pressure_152p_normalized_score":1.0169158737350854,"objective_fixed_iteration_case_stretch_synthetic_partial_attendance_capacity_pressure_152p_reference_final_score":6621.0,"objective_fixed_iteration_case_stretch_synthetic_partial_attendance_capacity_pressure_152p_weight":1.0,"objective_fixed_iteration_case_stretch_synthetic_partial_attendance_capacity_pressure_152p_weighted_contribution":1.0169158737350854,"objective_fixed_iteration_external_validation_failures":0.0,"objective_fixed_iteration_score_breakdown_mismatches":0.0,"objective_fixed_iteration_total_final_score_raw":24040.0,"objective_fixed_iteration_total_runtime_seconds":303.843575585,"objective_fixed_iteration_total_score_mismatches":0.0,"objective_fixed_iteration_weighted_normalized_score":119.09938865617056,"objective_fixed_iteration_weighted_normalized_score_delta_from_reference":19.099388656170557,"objective_fixed_iteration_weighted_normalized_score_weight_sum":6.0,"objective_suite_average_final_score_raw":4034.8333333333335,"objective_suite_average_runtime_seconds":15.6684843695,"objective_suite_case_adversarial_clique_swap_functionality_35p_final_score":4756.0,"objective_suite_case_adversarial_clique_swap_functionality_35p_normalized_score":1.0,"objective_suite_case_adversarial_clique_swap_functionality_35p_reference_final_score":4756.0,"objective_suite_case_adversarial_clique_swap_functionality_35p_weight":1.0,"objective_suite_case_adversarial_clique_swap_functionality_35p_weighted_contribution":1.0,"objective_suite_case_adversarial_transfer_attribute_balance_111p_final_score":215.0,"objective_suite_case_adversarial_transfer_attribute_balance_111p_normalized_score":1.0858585858585859,"objective_suite_case_adversarial_transfer_attribute_balance_111p_reference_final_score":198.0,"objective_suite_case_adversarial_transfer_attribute_balance_111p_weight":1.0,"objective_suite_case_adversarial_transfer_attribute_balance_111p_weighted_contribution":1.0858585858585859,"objective_suite_case_count":6.0,"objective_suite_case_stretch_large_gender_immovable_110p_final_score":2399.0,"objective_suite_case_stretch_large_gender_immovable_110p_normalized_score":1.1009637448370813,"objective_suite_case_stretch_large_gender_immovable_110p_reference_final_score":2179.0,"objective_suite_case_stretch_large_gender_immovable_110p_weight":1.0,"objective_suite_case_stretch_large_gender_immovable_110p_weighted_contribution":1.1009637448370813,"objective_suite_case_stretch_sailing_trip_demo_real_final_score":4487.0,"objective_suite_case_stretch_sailing_trip_demo_real_normalized_score":1.8750522356874217,"objective_suite_case_stretch_sailing_trip_demo_real_reference_final_score":2393.0,"objective_suite_case_stretch_sailing_trip_demo_real_weight":1.0,"objective_suite_case_stretch_sailing_trip_demo_real_weighted_contribution":1.8750522356874217,"objective_suite_case_stretch_social_golfer_32x8x10_final_score":5619.0,"objective_suite_case_stretch_social_golfer_32x8x10_normalized_score":1.0229382850901148,"objective_suite_case_stretch_social_golfer_32x8x10_reference_final_score":5493.0,"objective_suite_case_stretch_social_golfer_32x8x10_weight":1.0,"objective_suite_case_stretch_social_golfer_32x8x10_weighted_contribution":1.0229382850901148,"objective_suite_case_stretch_synthetic_partial_attendance_capacity_pressure_152p_final_score":6733.0,"objective_suite_case_stretch_synthetic_partial_attendance_capacity_pressure_152p_normalized_score":1.0140060240963855,"objective_suite_case_stretch_synthetic_partial_attendance_capacity_pressure_152p_reference_final_score":6640.0,"objective_suite_case_stretch_synthetic_partial_attendance_capacity_pressure_152p_weight":1.0,"objective_suite_case_stretch_synthetic_partial_attendance_capacity_pressure_152p_weighted_contribution":1.0140060240963855,"objective_suite_external_validation_failures":0.0,"objective_suite_score_breakdown_mismatches":0.0,"objective_suite_total_final_score_raw":24209.0,"objective_suite_total_runtime_seconds":94.010906217,"objective_suite_total_score_mismatches":0.0,"objective_suite_weighted_normalized_score":118.31364792615982,"objective_suite_weighted_normalized_score_delta_from_reference":18.313647926159817,"objective_suite_weighted_normalized_score_weight_sum":6.0,"path_allowed_sessions_iter_us":1053.278,"path_avg_iter_us":386.34856186931347,"path_clique_iter_us":357.90749999999997,"path_construction_iter_us":20.754051282051282,"path_swap_iter_us":487.31399999999996,"path_transfer_iter_us":12.48925806451613,"rep_avg_iter_us":91.97960196078432,"rep_balanced_iter_us":121.58773333333333,"rep_balanced_score":3.0,"rep_constrained_iter_us":62.3714705882353,"rep_constrained_score":4.0,"runtime_canonical_share_percent":99.29851608567803,"runtime_total_seconds":94.675036368,"solver3_raw_score_us":509.55907528843113,"swap_apply_us":2.31046875,"swap_preview_us":6.819453125,"transfer_apply_us":2.29484375,"transfer_preview_us":3.8258125},"status":"discard","description":"Structural tabu keyed to session/group-pair corridors was catastrophically bad. The coarse memory blocked too much legitimate revisitation, blowing up sailing to 1.875x reference, regressing social_golfer, and making representative/path hotpaths unusably slow.","timestamp":1775657866774,"segment":0,"confidence":203.74199658331676,"iterationTokens":14416,"asi":{"hypothesis":"A coarse structural tabu over session/group-pair churn would suppress local corridor cycling better than exact-undo tabu and help the record-to-record search escape repeated structural loops.","rollback_reason":"Primary collapsed from the new-machine baseline 101.3513 to 118.3136, with major quality damage and extreme raw-runtime/path regressions.","next_action_hint":"Retire coarse group-pair structural tabu. The remaining strongest untried paths are now the more architectural ones: elite-population memetic search, a genuinely stronger GRASP-style constructor, or macro-operator hyper-heuristics\u2014not more blanket memory bans.","mechanism_family":"structural tabu / group-pair churn memory","case_shape":{"sailing":"1.8750522356874217","social_golfer":"1.0229382850901148","large_gender":"1.1009637448370813","attribute_balance":"1.0858585858585859","synthetic_partial":"1.0140060240963855"},"performance_failure":{"solver3_raw_score_us":"509.55907528843113","path_allowed_sessions_iter_us":"1053.278","path_swap_iter_us":"487.31399999999996"}}}
{"run":10,"commit":"a946147","metric":101.28103384244216,"metrics":{"clique_apply_us":2.8194583333333334,"clique_preview_us":12.889270833333333,"correctness_suite_average_runtime_seconds":0.18125085275,"correctness_suite_case_count":4.0,"correctness_suite_external_validation_failures":0.0,"correctness_suite_total_runtime_seconds":0.725003411,"correctness_suite_total_score_mismatches":0.0,"hotpath_total_us":30.967135416666665,"objective_fixed_iteration_average_final_score_raw":3601.1666666666665,"objective_fixed_iteration_average_runtime_seconds":50.862864601333335,"objective_fixed_iteration_case_adversarial_clique_swap_functionality_35p_final_score":4765.0,"objective_fixed_iteration_case_adversarial_clique_swap_functionality_35p_normalized_score":1.001892346509672,"objective_fixed_iteration_case_adversarial_clique_swap_functionality_35p_reference_final_score":4756.0,"objective_fixed_iteration_case_adversarial_clique_swap_functionality_35p_weight":1.0,"objective_fixed_iteration_case_adversarial_clique_swap_functionality_35p_weighted_contribution":1.001892346509672,"objective_fixed_iteration_case_adversarial_transfer_attribute_balance_111p_final_score":196.0,"objective_fixed_iteration_case_adversarial_transfer_attribute_balance_111p_normalized_score":0.9607843137254902,"objective_fixed_iteration_case_adversarial_transfer_attribute_balance_111p_reference_final_score":204.0,"objective_fixed_iteration_case_adversarial_transfer_attribute_balance_111p_weight":1.0,"objective_fixed_iteration_case_adversarial_transfer_attribute_balance_111p_weighted_contribution":0.9607843137254902,"objective_fixed_iteration_case_count":6.0,"objective_fixed_iteration_case_stretch_large_gender_immovable_110p_final_score":2157.0,"objective_fixed_iteration_case_stretch_large_gender_immovable_110p_normalized_score":1.010304449648712,"objective_fixed_iteration_case_stretch_large_gender_immovable_110p_reference_final_score":2135.0,"objective_fixed_iteration_case_stretch_large_gender_immovable_110p_weight":1.0,"objective_fixed_iteration_case_stretch_large_gender_immovable_110p_weighted_contribution":1.010304449648712,"objective_fixed_iteration_case_stretch_sailing_trip_demo_real_final_score":2297.0,"objective_fixed_iteration_case_stretch_sailing_trip_demo_real_normalized_score":1.0346846846846847,"objective_fixed_iteration_case_stretch_sailing_trip_demo_real_reference_final_score":2220.0,"objective_fixed_iteration_case_stretch_sailing_trip_demo_real_weight":1.0,"objective_fixed_iteration_case_stretch_sailing_trip_demo_real_weighted_contribution":1.0346846846846847,"objective_fixed_iteration_case_stretch_social_golfer_32x8x10_final_score":5451.0,"objective_fixed_iteration_case_stretch_social_golfer_32x8x10_normalized_score":0.9923539049699618,"objective_fixed_iteration_case_stretch_social_golfer_32x8x10_reference_final_score":5493.0,"objective_fixed_iteration_case_stretch_social_golfer_32x8x10_weight":1.0,"objective_fixed_iteration_case_stretch_social_golfer_32x8x10_weighted_contribution":0.9923539049699618,"objective_fixed_iteration_case_stretch_synthetic_partial_attendance_capacity_pressure_152p_final_score":6741.0,"objective_fixed_iteration_case_stretch_synthetic_partial_attendance_capacity_pressure_152p_normalized_score":1.0181241504304486,"objective_fixed_iteration_case_stretch_synthetic_partial_attendance_capacity_pressure_152p_reference_final_score":6621.0,"objective_fixed_iteration_case_stretch_synthetic_partial_attendance_capacity_pressure_152p_weight":1.0,"objective_fixed_iteration_case_stretch_synthetic_partial_attendance_capacity_pressure_152p_weighted_contribution":1.0181241504304486,"objective_fixed_iteration_external_validation_failures":0.0,"objective_fixed_iteration_score_breakdown_mismatches":0.0,"objective_fixed_iteration_total_final_score_raw":21607.0,"objective_fixed_iteration_total_runtime_seconds":305.177187608,"objective_fixed_iteration_total_score_mismatches":0.0,"objective_fixed_iteration_weighted_normalized_score":100.30239749948282,"objective_fixed_iteration_weighted_normalized_score_delta_from_reference":0.30239749948282046,"objective_fixed_iteration_weighted_normalized_score_weight_sum":6.0,"objective_suite_average_final_score_raw":3633.6666666666665,"objective_suite_average_runtime_seconds":15.669213457833333,"objective_suite_case_adversarial_clique_swap_functionality_35p_final_score":4765.0,"objective_suite_case_adversarial_clique_swap_functionality_35p_normalized_score":1.001892346509672,"objective_suite_case_adversarial_clique_swap_functionality_35p_reference_final_score":4756.0,"objective_suite_case_adversarial_clique_swap_functionality_35p_weight":1.0,"objective_suite_case_adversarial_clique_swap_functionality_35p_weighted_contribution":1.001892346509672,"objective_suite_case_adversarial_transfer_attribute_balance_111p_final_score":206.0,"objective_suite_case_adversarial_transfer_attribute_balance_111p_normalized_score":1.0404040404040404,"objective_suite_case_adversarial_transfer_attribute_balance_111p_reference_final_score":198.0,"objective_suite_case_adversarial_transfer_attribute_balance_111p_weight":1.0,"objective_suite_case_adversarial_transfer_attribute_balance_111p_weighted_contribution":1.0404040404040404,"objective_suite_case_count":6.0,"objective_suite_case_stretch_large_gender_immovable_110p_final_score":2311.0,"objective_suite_case_stretch_large_gender_immovable_110p_normalized_score":1.0605782469022487,"objective_suite_case_stretch_large_gender_immovable_110p_reference_final_score":2179.0,"objective_suite_case_stretch_large_gender_immovable_110p_weight":1.0,"objective_suite_case_stretch_large_gender_immovable_110p_weighted_contribution":1.0605782469022487,"objective_suite_case_stretch_sailing_trip_demo_real_final_score":2304.0,"objective_suite_case_stretch_sailing_trip_demo_real_normalized_score":0.9628081905557877,"objective_suite_case_stretch_sailing_trip_demo_real_reference_final_score":2393.0,"objective_suite_case_stretch_sailing_trip_demo_real_weight":1.0,"objective_suite_case_stretch_sailing_trip_demo_real_weighted_contribution":0.9628081905557877,"objective_suite_case_stretch_social_golfer_32x8x10_final_score":5451.0,"objective_suite_case_stretch_social_golfer_32x8x10_normalized_score":0.9923539049699618,"objective_suite_case_stretch_social_golfer_32x8x10_reference_final_score":5493.0,"objective_suite_case_stretch_social_golfer_32x8x10_weight":1.0,"objective_suite_case_stretch_social_golfer_32x8x10_weighted_contribution":0.9923539049699618,"objective_suite_case_stretch_synthetic_partial_attendance_capacity_pressure_152p_final_score":6765.0,"objective_suite_case_stretch_synthetic_partial_attendance_capacity_pressure_152p_normalized_score":1.0188253012048192,"objective_suite_case_stretch_synthetic_partial_attendance_capacity_pressure_152p_reference_final_score":6640.0,"objective_suite_case_stretch_synthetic_partial_attendance_capacity_pressure_152p_weight":1.0,"objective_suite_case_stretch_synthetic_partial_attendance_capacity_pressure_152p_weighted_contribution":1.0188253012048192,"objective_suite_external_validation_failures":0.0,"objective_suite_score_breakdown_mismatches":0.0,"objective_suite_total_final_score_raw":21802.0,"objective_suite_total_runtime_seconds":94.015280747,"objective_suite_total_score_mismatches":0.0,"objective_suite_weighted_normalized_score":101.28103384244216,"objective_suite_weighted_normalized_score_delta_from_reference":1.2810338424421586,"objective_suite_weighted_normalized_score_weight_sum":6.0,"path_allowed_sessions_iter_us":25.6389,"path_avg_iter_us":16.831395,"path_clique_iter_us":17.819449999999996,"path_construction_iter_us":21.202325,"path_swap_iter_us":11.329625,"path_transfer_iter_us":8.166675,"rep_avg_iter_us":30.67160555555555,"rep_balanced_iter_us":28.65493333333333,"rep_balanced_score":3.0,"rep_constrained_iter_us":32.68827777777778,"rep_constrained_score":4.0,"runtime_canonical_share_percent":99.23474642551115,"runtime_total_seconds":94.740284158,"solver3_raw_score_us":78.47013597222221,"swap_apply_us":2.329875,"swap_preview_us":6.48321875,"transfer_apply_us":2.443,"transfer_preview_us":4.0023124999999995},"status":"keep","description":"First memetic-style follow-up on the new machine: added a one-shot stagnation-triggered offspring burst that briefly polishes a donor from a diversified seed, then transplants the donor's best repeat-pressure session into the incumbent before resuming record-to-record search. Primary improved slightly (101.3513\u2192101.2810), but the gain is small and should be confirmed with a rerun because it is still within the current machine noise band.","timestamp":1775658780057,"segment":0,"confidence":268.0714049741773,"iterationTokens":28358,"asi":{"hypothesis":"A lightweight memetic offspring burst using an elite incumbent recipient and a briefly polished diversified donor can improve search basin quality without the catastrophic budget fragmentation of full front-loaded multi-start.","machine_noise_context":"Current rough noise band on this machine is ~0.3 objective-score points, so this first gain is promising but not yet conclusive.","mechanism_family":"memetic / elite polished donor session transplant","structural_change":"During prolonged stagnation, generate one donor via short inner search, pick the donor session with the best local repeat-pressure improvement, transplant it into the incumbent, then continue the main search honestly within the same wall-clock budget.","case_shape":{"sailing":"0.9628081905557877","social_golfer":"0.9923539049699618","attribute_balance":"1.0404040404040404","large_gender":"1.0605782469022487","synthetic_partial":"1.0188253012048192"},"next_action_hint":"Immediately rerun the same committed memetic-burst code once or twice to test whether the small primary improvement survives noise before incubating further."}}
