{"run":47,"commit":"fea1825","metric":89.95,"metrics":{"best_final_score":0,"worst_final_score":282,"mean_unique_contacts":567.35,"best_unique_contacts":654,"worst_unique_contacts":474,"solved_runs":5,"mean_best_conflict_positions":25.15,"best_best_conflict_positions":0,"runtime_total_seconds":335.701665298,"social_golfer_32x8x10_seed_1_final_score":66,"social_golfer_32x8x10_seed_1_unique_contacts":474,"social_golfer_32x8x10_seed_1_best_conflict_positions":24,"social_golfer_32x8x10_seed_1_runtime_seconds":60.000934098,"social_golfer_32x8x10_seed_2_final_score":66,"social_golfer_32x8x10_seed_2_unique_contacts":474,"social_golfer_32x8x10_seed_2_best_conflict_positions":24,"social_golfer_32x8x10_seed_2_runtime_seconds":60.000609946,"social_golfer_32x8x10_seed_3_final_score":0,"social_golfer_32x8x10_seed_3_unique_contacts":480,"social_golfer_32x8x10_seed_3_best_conflict_positions":0,"social_golfer_32x8x10_seed_3_runtime_seconds":4.765226333,"social_golfer_32x8x10_seed_4_final_score":0,"social_golfer_32x8x10_seed_4_unique_contacts":480,"social_golfer_32x8x10_seed_4_best_conflict_positions":0,"social_golfer_32x8x10_seed_4_runtime_seconds":3.797447262,"social_golfer_36x9x10_seed_1_final_score":66,"social_golfer_36x9x10_seed_1_unique_contacts":534,"social_golfer_36x9x10_seed_1_best_conflict_positions":21,"social_golfer_36x9x10_seed_1_runtime_seconds":60.000695099999994,"social_golfer_36x9x10_seed_2_final_score":97,"social_golfer_36x9x10_seed_2_unique_contacts":533,"social_golfer_36x9x10_seed_2_best_conflict_positions":25,"social_golfer_36x9x10_seed_2_runtime_seconds":60.00001217,"social_golfer_36x9x10_seed_3_final_score":88,"social_golfer_36x9x10_seed_3_unique_contacts":532,"social_golfer_36x9x10_seed_3_best_conflict_positions":27,"social_golfer_36x9x10_seed_3_runtime_seconds":60.000641322999996,"social_golfer_36x9x10_seed_4_final_score":77,"social_golfer_36x9x10_seed_4_unique_contacts":533,"social_golfer_36x9x10_seed_4_best_conflict_positions":26,"social_golfer_36x9x10_seed_4_runtime_seconds":60.000182279,"social_golfer_36x9x11_seed_1_final_score":218,"social_golfer_36x9x11_seed_1_unique_contacts":576,"social_golfer_36x9x11_seed_1_best_conflict_positions":61,"social_golfer_36x9x11_seed_1_runtime_seconds":90.002578117,"social_golfer_36x9x11_seed_2_final_score":240,"social_golfer_36x9x11_seed_2_unique_contacts":574,"social_golfer_36x9x11_seed_2_best_conflict_positions":64,"social_golfer_36x9x11_seed_2_runtime_seconds":90.003950012,"social_golfer_36x9x11_seed_3_final_score":282,"social_golfer_36x9x11_seed_3_unique_contacts":572,"social_golfer_36x9x11_seed_3_best_conflict_positions":64,"social_golfer_36x9x11_seed_3_runtime_seconds":90.005321329,"social_golfer_36x9x11_seed_4_final_score":282,"social_golfer_36x9x11_seed_4_unique_contacts":572,"social_golfer_36x9x11_seed_4_best_conflict_positions":70,"social_golfer_36x9x11_seed_4_runtime_seconds":90.003817271,"social_golfer_40x10x10_seed_1_final_score":0,"social_golfer_40x10x10_seed_1_unique_contacts":600,"social_golfer_40x10x10_seed_1_best_conflict_positions":0,"social_golfer_40x10x10_seed_1_runtime_seconds":1.838779394,"social_golfer_40x10x10_seed_2_final_score":0,"social_golfer_40x10x10_seed_2_unique_contacts":600,"social_golfer_40x10x10_seed_2_best_conflict_positions":0,"social_golfer_40x10x10_seed_2_runtime_seconds":8.897004352,"social_golfer_40x10x10_seed_3_final_score":11,"social_golfer_40x10x10_seed_3_unique_contacts":599,"social_golfer_40x10x10_seed_3_best_conflict_positions":4,"social_golfer_40x10x10_seed_3_runtime_seconds":60.000562558000006,"social_golfer_40x10x10_seed_4_final_score":0,"social_golfer_40x10x10_seed_4_unique_contacts":600,"social_golfer_40x10x10_seed_4_best_conflict_positions":0,"social_golfer_40x10x10_seed_4_runtime_seconds":12.309627576,"social_golfer_40x10x11_seed_1_final_score":66,"social_golfer_40x10x11_seed_1_unique_contacts":654,"social_golfer_40x10x11_seed_1_best_conflict_positions":24,"social_golfer_40x10x11_seed_1_runtime_seconds":120.000308022,"social_golfer_40x10x11_seed_2_final_score":86,"social_golfer_40x10x11_seed_2_unique_contacts":654,"social_golfer_40x10x11_seed_2_best_conflict_positions":22,"social_golfer_40x10x11_seed_2_runtime_seconds":120.001296637,"social_golfer_40x10x11_seed_3_final_score":88,"social_golfer_40x10x11_seed_3_unique_contacts":652,"social_golfer_40x10x11_seed_3_best_conflict_positions":25,"social_golfer_40x10x11_seed_3_runtime_seconds":120.000001497,"social_golfer_40x10x11_seed_4_final_score":66,"social_golfer_40x10x11_seed_4_unique_contacts":654,"social_golfer_40x10x11_seed_4_best_conflict_positions":22,"social_golfer_40x10x11_seed_4_runtime_seconds":120.000605929},"status":"discard","description":"Tried making breakout gentler by reducing solver4's random breakout from two swaps to one while keeping the same best-so-far stagnation, untabued breakout, and fixed-tenure-12 regime. The smaller perturbation was too weak and regressed the p=4 stretch bundle.","timestamp":1776322562513,"segment":3,"confidence":8.630434782608694,"iterationTokens":13489,"asi":{"hypothesis":"The current two-swap breakout may be slightly too disruptive under the stronger fixed-tenure-12 baseline. Reducing breakout to a single untabued, conflict-anchored swap might preserve more good structure while still escaping plateaus.","rollback_reason":"A one-swap breakout was too weak. mean_final_score regressed from 79.4 to 89.95 and 32x8x10 lost two perfect seeds.","observations":{"baseline_commit":"fea1825","baseline_mean_final_score":79.4,"experiment_mean_final_score":89.95,"baseline_solved_runs":6,"experiment_solved_runs":5,"32x8x10_scores":[66,66,0,0],"36x9x11_scores":[218,240,282,282],"40x10x11_scores":[66,86,88,66]},"learned_tradeoff":"The current breakout needs more than one swap to escape the hard basin honestly. The successful breakout operator is simple, but not that gentle.","next_action_hint":"Keep breakout at two swaps. If breakout strength is revisited again, do not weaken it below the current baseline; any further breakout experiments should preserve at least the current perturbation strength."}}
{"run":48,"commit":"fea1825","metric":87,"metrics":{"best_final_score":0,"worst_final_score":293,"mean_unique_contacts":567.8,"best_unique_contacts":654,"worst_unique_contacts":480,"solved_runs":6,"mean_best_conflict_positions":23.15,"best_best_conflict_positions":0,"runtime_total_seconds":334.252457928,"social_golfer_32x8x10_seed_1_final_score":0,"social_golfer_32x8x10_seed_1_unique_contacts":480,"social_golfer_32x8x10_seed_1_best_conflict_positions":0,"social_golfer_32x8x10_seed_1_runtime_seconds":4.184507514,"social_golfer_32x8x10_seed_2_final_score":0,"social_golfer_32x8x10_seed_2_unique_contacts":480,"social_golfer_32x8x10_seed_2_best_conflict_positions":0,"social_golfer_32x8x10_seed_2_runtime_seconds":2.703189483,"social_golfer_32x8x10_seed_3_final_score":0,"social_golfer_32x8x10_seed_3_unique_contacts":480,"social_golfer_32x8x10_seed_3_best_conflict_positions":0,"social_golfer_32x8x10_seed_3_runtime_seconds":2.3913428689999994,"social_golfer_32x8x10_seed_4_final_score":0,"social_golfer_32x8x10_seed_4_unique_contacts":480,"social_golfer_32x8x10_seed_4_best_conflict_positions":0,"social_golfer_32x8x10_seed_4_runtime_seconds":3.6678420700000003,"social_golfer_36x9x10_seed_1_final_score":77,"social_golfer_36x9x10_seed_1_unique_contacts":533,"social_golfer_36x9x10_seed_1_best_conflict_positions":26,"social_golfer_36x9x10_seed_1_runtime_seconds":60.000889953999994,"social_golfer_36x9x10_seed_2_final_score":99,"social_golfer_36x9x10_seed_2_unique_contacts":531,"social_golfer_36x9x10_seed_2_best_conflict_positions":23,"social_golfer_36x9x10_seed_2_runtime_seconds":60.00144132,"social_golfer_36x9x10_seed_3_final_score":97,"social_golfer_36x9x10_seed_3_unique_contacts":533,"social_golfer_36x9x10_seed_3_best_conflict_positions":24,"social_golfer_36x9x10_seed_3_runtime_seconds":60.00092893,"social_golfer_36x9x10_seed_4_final_score":88,"social_golfer_36x9x10_seed_4_unique_contacts":532,"social_golfer_36x9x10_seed_4_best_conflict_positions":24,"social_golfer_36x9x10_seed_4_runtime_seconds":60.001041972,"social_golfer_36x9x11_seed_1_final_score":293,"social_golfer_36x9x11_seed_1_unique_contacts":571,"social_golfer_36x9x11_seed_1_best_conflict_positions":69,"social_golfer_36x9x11_seed_1_runtime_seconds":90.00310096099999,"social_golfer_36x9x11_seed_2_final_score":269,"social_golfer_36x9x11_seed_2_unique_contacts":575,"social_golfer_36x9x11_seed_2_best_conflict_positions":60,"social_golfer_36x9x11_seed_2_runtime_seconds":90.000431842,"social_golfer_36x9x11_seed_3_final_score":271,"social_golfer_36x9x11_seed_3_unique_contacts":573,"social_golfer_36x9x11_seed_3_best_conflict_positions":68,"social_golfer_36x9x11_seed_3_runtime_seconds":90.00032193599999,"social_golfer_36x9x11_seed_4_final_score":229,"social_golfer_36x9x11_seed_4_unique_contacts":575,"social_golfer_36x9x11_seed_4_best_conflict_positions":67,"social_golfer_36x9x11_seed_4_runtime_seconds":90.003543623,"social_golfer_40x10x10_seed_1_final_score":0,"social_golfer_40x10x10_seed_1_unique_contacts":600,"social_golfer_40x10x10_seed_1_best_conflict_positions":0,"social_golfer_40x10x10_seed_1_runtime_seconds":53.959518667000005,"social_golfer_40x10x10_seed_2_final_score":0,"social_golfer_40x10x10_seed_2_unique_contacts":600,"social_golfer_40x10x10_seed_2_best_conflict_positions":0,"social_golfer_40x10x10_seed_2_runtime_seconds":22.464997279000002,"social_golfer_40x10x10_seed_3_final_score":11,"social_golfer_40x10x10_seed_3_unique_contacts":599,"social_golfer_40x10x10_seed_3_best_conflict_positions":4,"social_golfer_40x10x10_seed_3_runtime_seconds":60.002901606,"social_golfer_40x10x10_seed_4_final_score":11,"social_golfer_40x10x10_seed_4_unique_contacts":599,"social_golfer_40x10x10_seed_4_best_conflict_positions":4,"social_golfer_40x10x10_seed_4_runtime_seconds":60.001098303999996,"social_golfer_40x10x11_seed_1_final_score":66,"social_golfer_40x10x11_seed_1_unique_contacts":654,"social_golfer_40x10x11_seed_1_best_conflict_positions":24,"social_golfer_40x10x11_seed_1_runtime_seconds":120.00265049000001,"social_golfer_40x10x11_seed_2_final_score":97,"social_golfer_40x10x11_seed_2_unique_contacts":653,"social_golfer_40x10x11_seed_2_best_conflict_positions":23,"social_golfer_40x10x11_seed_2_runtime_seconds":120.00222167599999,"social_golfer_40x10x11_seed_3_final_score":66,"social_golfer_40x10x11_seed_3_unique_contacts":654,"social_golfer_40x10x11_seed_3_best_conflict_positions":23,"social_golfer_40x10x11_seed_3_runtime_seconds":120.001803079,"social_golfer_40x10x11_seed_4_final_score":66,"social_golfer_40x10x11_seed_4_unique_contacts":654,"social_golfer_40x10x11_seed_4_best_conflict_positions":24,"social_golfer_40x10x11_seed_4_runtime_seconds":120.00028015699999},"status":"discard","description":"Tried strengthening breakout slightly by increasing solver4's untabued conflict-anchored breakout from two swaps to three while keeping fixed tenure 12 and the same stagnation regime. The stronger perturbation still regressed the p=4 stretch bundle.","timestamp":1776323042390,"segment":3,"confidence":8.921348314606737,"iterationTokens":11272,"asi":{"hypothesis":"A one-swap breakout was too weak, so perhaps the current baseline wants a slightly stronger but still simple perturbation. Increasing breakout from two swaps to three might improve hard-case escape while preserving the same structure and honesty constraints.","rollback_reason":"The stronger perturbation still regressed mean_final_score from 79.4 to 87.0, so the current two-swap breakout remains the best balance.","observations":{"baseline_commit":"fea1825","baseline_mean_final_score":79.4,"experiment_mean_final_score":87,"baseline_solved_runs":6,"experiment_solved_runs":6,"32x8x10_scores":[0,0,0,0],"36x9x10_scores":[77,99,97,88],"36x9x11_scores":[293,269,271,229],"40x10x11_scores":[66,97,66,66]},"learned_tradeoff":"The breakout-strength axis appears locally tuned already: one swap is too weak, three swaps is too strong, and the current two-swap perturbation remains the best simple setting.","next_action_hint":"Keep breakout at two swaps and stop tuning simple breakout strength. The next experiment should move to a different mild mechanism outside straightforward tabu or breakout-strength changes."}}
{"run":49,"commit":"fea1825","metric":83.05,"metrics":{"best_final_score":0,"worst_final_score":273,"mean_unique_contacts":568.25,"best_unique_contacts":655,"worst_unique_contacts":480,"solved_runs":6,"mean_best_conflict_positions":22.35,"best_best_conflict_positions":0,"runtime_total_seconds":335.634889478,"social_golfer_32x8x10_seed_1_final_score":0,"social_golfer_32x8x10_seed_1_unique_contacts":480,"social_golfer_32x8x10_seed_1_best_conflict_positions":0,"social_golfer_32x8x10_seed_1_runtime_seconds":3.7553338020000004,"social_golfer_32x8x10_seed_2_final_score":0,"social_golfer_32x8x10_seed_2_unique_contacts":480,"social_golfer_32x8x10_seed_2_best_conflict_positions":0,"social_golfer_32x8x10_seed_2_runtime_seconds":5.562923302000001,"social_golfer_32x8x10_seed_3_final_score":0,"social_golfer_32x8x10_seed_3_unique_contacts":480,"social_golfer_32x8x10_seed_3_best_conflict_positions":0,"social_golfer_32x8x10_seed_3_runtime_seconds":4.447454058,"social_golfer_32x8x10_seed_4_final_score":0,"social_golfer_32x8x10_seed_4_unique_contacts":480,"social_golfer_32x8x10_seed_4_best_conflict_positions":0,"social_golfer_32x8x10_seed_4_runtime_seconds":3.759967223,"social_golfer_36x9x10_seed_1_final_score":97,"social_golfer_36x9x10_seed_1_unique_contacts":533,"social_golfer_36x9x10_seed_1_best_conflict_positions":24,"social_golfer_36x9x10_seed_1_runtime_seconds":60.002601053999996,"social_golfer_36x9x10_seed_2_final_score":66,"social_golfer_36x9x10_seed_2_unique_contacts":534,"social_golfer_36x9x10_seed_2_best_conflict_positions":23,"social_golfer_36x9x10_seed_2_runtime_seconds":60.000644306,"social_golfer_36x9x10_seed_3_final_score":117,"social_golfer_36x9x10_seed_3_unique_contacts":533,"social_golfer_36x9x10_seed_3_best_conflict_positions":23,"social_golfer_36x9x10_seed_3_runtime_seconds":60.000060863,"social_golfer_36x9x10_seed_4_final_score":66,"social_golfer_36x9x10_seed_4_unique_contacts":534,"social_golfer_36x9x10_seed_4_best_conflict_positions":23,"social_golfer_36x9x10_seed_4_runtime_seconds":60.000413082,"social_golfer_36x9x11_seed_1_final_score":258,"social_golfer_36x9x11_seed_1_unique_contacts":576,"social_golfer_36x9x11_seed_1_best_conflict_positions":64,"social_golfer_36x9x11_seed_1_runtime_seconds":90.003025307,"social_golfer_36x9x11_seed_2_final_score":273,"social_golfer_36x9x11_seed_2_unique_contacts":571,"social_golfer_36x9x11_seed_2_best_conflict_positions":69,"social_golfer_36x9x11_seed_2_runtime_seconds":90.000385452,"social_golfer_36x9x11_seed_3_final_score":238,"social_golfer_36x9x11_seed_3_unique_contacts":576,"social_golfer_36x9x11_seed_3_best_conflict_positions":62,"social_golfer_36x9x11_seed_3_runtime_seconds":90.00557065,"social_golfer_36x9x11_seed_4_final_score":260,"social_golfer_36x9x11_seed_4_unique_contacts":574,"social_golfer_36x9x11_seed_4_best_conflict_positions":66,"social_golfer_36x9x11_seed_4_runtime_seconds":90.00313753,"social_golfer_40x10x10_seed_1_final_score":0,"social_golfer_40x10x10_seed_1_unique_contacts":600,"social_golfer_40x10x10_seed_1_best_conflict_positions":0,"social_golfer_40x10x10_seed_1_runtime_seconds":27.985429961,"social_golfer_40x10x10_seed_2_final_score":11,"social_golfer_40x10x10_seed_2_unique_contacts":599,"social_golfer_40x10x10_seed_2_best_conflict_positions":4,"social_golfer_40x10x10_seed_2_runtime_seconds":60.000573717,"social_golfer_40x10x10_seed_3_final_score":0,"social_golfer_40x10x10_seed_3_unique_contacts":600,"social_golfer_40x10x10_seed_3_best_conflict_positions":0,"social_golfer_40x10x10_seed_3_runtime_seconds":5.433909710999999,"social_golfer_40x10x10_seed_4_final_score":11,"social_golfer_40x10x10_seed_4_unique_contacts":599,"social_golfer_40x10x10_seed_4_best_conflict_positions":4,"social_golfer_40x10x10_seed_4_runtime_seconds":60.003464109,"social_golfer_40x10x11_seed_1_final_score":55,"social_golfer_40x10x11_seed_1_unique_contacts":655,"social_golfer_40x10x11_seed_1_best_conflict_positions":19,"social_golfer_40x10x11_seed_1_runtime_seconds":120.000966152,"social_golfer_40x10x11_seed_2_final_score":66,"social_golfer_40x10x11_seed_2_unique_contacts":654,"social_golfer_40x10x11_seed_2_best_conflict_positions":20,"social_golfer_40x10x11_seed_2_runtime_seconds":120.001021447,"social_golfer_40x10x11_seed_3_final_score":77,"social_golfer_40x10x11_seed_3_unique_contacts":653,"social_golfer_40x10x11_seed_3_best_conflict_positions":25,"social_golfer_40x10x11_seed_3_runtime_seconds":120.000821821,"social_golfer_40x10x11_seed_4_final_score":66,"social_golfer_40x10x11_seed_4_unique_contacts":654,"social_golfer_40x10x11_seed_4_best_conflict_positions":21,"social_golfer_40x10x11_seed_4_runtime_seconds":120.000126995},"status":"discard","description":"Tried narrowing late active-repeated-pair guidance so it only activates after 4+ stagnant iterations when the current schedule is exactly at the incumbent best conflict-position level, instead of also during below-best recovery states. This was milder than the baseline but regressed the p=4 stretch bundle.","timestamp":1776323762489,"segment":3,"confidence":8.583783783783785,"iterationTokens":28105,"asi":{"hypothesis":"Under best-so-far stagnation counting, active-repeated-pair guidance may help mainly when the search is truly plateaued at the incumbent best, not while it is still recovering below best. Restricting the late guidance to current==best might reduce oversteer while keeping the stronger stagnation semantics.","rollback_reason":"The narrower guidance was too weak. mean_final_score regressed from 79.4 to 83.05, mainly by worsening 36x9x10 while leaving the main hard 36x9x11 behavior essentially unchanged.","observations":{"baseline_commit":"fea1825","baseline_mean_final_score":79.4,"experiment_mean_final_score":83.05,"baseline_solved_runs":6,"experiment_solved_runs":6,"32x8x10_scores":[0,0,0,0],"36x9x10_scores":[97,66,117,66],"36x9x11_scores":[258,273,238,260],"40x10x11_scores":[55,66,77,66]},"learned_tradeoff":"The kept 4+ repeat-guidance seems to provide useful steering even during below-best recovery states. Restricting it to exact incumbent-best plateaus removes too much of that benefit.","next_action_hint":"Keep the existing 4+ repeat-guidance semantics. Future work should look for a different mild mechanism rather than narrowing its state gating further."}}
