{"run":11,"commit":"2dfacef","metric":0,"metrics":{"best_final_score":0,"worst_final_score":0,"mean_unique_contacts":0,"best_unique_contacts":0,"worst_unique_contacts":0,"solved_runs":0,"mean_best_conflict_positions":0,"best_best_conflict_positions":0,"runtime_total_seconds":0,"social_golfer_32x8x10_seed_1_final_score":0,"social_golfer_32x8x10_seed_1_unique_contacts":0,"social_golfer_32x8x10_seed_1_best_conflict_positions":0,"social_golfer_32x8x10_seed_1_runtime_seconds":0,"social_golfer_32x8x10_seed_2_final_score":0,"social_golfer_32x8x10_seed_2_unique_contacts":0,"social_golfer_32x8x10_seed_2_best_conflict_positions":0,"social_golfer_32x8x10_seed_2_runtime_seconds":0,"social_golfer_32x8x10_seed_3_final_score":0,"social_golfer_32x8x10_seed_3_unique_contacts":0,"social_golfer_32x8x10_seed_3_best_conflict_positions":0,"social_golfer_32x8x10_seed_3_runtime_seconds":0,"social_golfer_32x8x10_seed_4_final_score":0,"social_golfer_32x8x10_seed_4_unique_contacts":0,"social_golfer_32x8x10_seed_4_best_conflict_positions":0,"social_golfer_32x8x10_seed_4_runtime_seconds":0,"social_golfer_36x9x10_seed_1_final_score":0,"social_golfer_36x9x10_seed_1_unique_contacts":0,"social_golfer_36x9x10_seed_1_best_conflict_positions":0,"social_golfer_36x9x10_seed_1_runtime_seconds":0,"social_golfer_36x9x10_seed_2_final_score":0,"social_golfer_36x9x10_seed_2_unique_contacts":0,"social_golfer_36x9x10_seed_2_best_conflict_positions":0,"social_golfer_36x9x10_seed_2_runtime_seconds":0,"social_golfer_36x9x10_seed_3_final_score":0,"social_golfer_36x9x10_seed_3_unique_contacts":0,"social_golfer_36x9x10_seed_3_best_conflict_positions":0,"social_golfer_36x9x10_seed_3_runtime_seconds":0,"social_golfer_36x9x10_seed_4_final_score":0,"social_golfer_36x9x10_seed_4_unique_contacts":0,"social_golfer_36x9x10_seed_4_best_conflict_positions":0,"social_golfer_36x9x10_seed_4_runtime_seconds":0,"social_golfer_36x9x11_seed_1_final_score":0,"social_golfer_36x9x11_seed_1_unique_contacts":0,"social_golfer_36x9x11_seed_1_best_conflict_positions":0,"social_golfer_36x9x11_seed_1_runtime_seconds":0,"social_golfer_36x9x11_seed_2_final_score":0,"social_golfer_36x9x11_seed_2_unique_contacts":0,"social_golfer_36x9x11_seed_2_best_conflict_positions":0,"social_golfer_36x9x11_seed_2_runtime_seconds":0,"social_golfer_36x9x11_seed_3_final_score":0,"social_golfer_36x9x11_seed_3_unique_contacts":0,"social_golfer_36x9x11_seed_3_best_conflict_positions":0,"social_golfer_36x9x11_seed_3_runtime_seconds":0,"social_golfer_36x9x11_seed_4_final_score":0,"social_golfer_36x9x11_seed_4_unique_contacts":0,"social_golfer_36x9x11_seed_4_best_conflict_positions":0,"social_golfer_36x9x11_seed_4_runtime_seconds":0,"social_golfer_40x10x10_seed_1_final_score":0,"social_golfer_40x10x10_seed_1_unique_contacts":0,"social_golfer_40x10x10_seed_1_best_conflict_positions":0,"social_golfer_40x10x10_seed_1_runtime_seconds":0,"social_golfer_40x10x10_seed_2_final_score":0,"social_golfer_40x10x10_seed_2_unique_contacts":0,"social_golfer_40x10x10_seed_2_best_conflict_positions":0,"social_golfer_40x10x10_seed_2_runtime_seconds":0,"social_golfer_40x10x10_seed_3_final_score":0,"social_golfer_40x10x10_seed_3_unique_contacts":0,"social_golfer_40x10x10_seed_3_best_conflict_positions":0,"social_golfer_40x10x10_seed_3_runtime_seconds":0,"social_golfer_40x10x10_seed_4_final_score":0,"social_golfer_40x10x10_seed_4_unique_contacts":0,"social_golfer_40x10x10_seed_4_best_conflict_positions":0,"social_golfer_40x10x10_seed_4_runtime_seconds":0,"social_golfer_40x10x11_seed_1_final_score":0,"social_golfer_40x10x11_seed_1_unique_contacts":0,"social_golfer_40x10x11_seed_1_best_conflict_positions":0,"social_golfer_40x10x11_seed_1_runtime_seconds":0,"social_golfer_40x10x11_seed_2_final_score":0,"social_golfer_40x10x11_seed_2_unique_contacts":0,"social_golfer_40x10x11_seed_2_best_conflict_positions":0,"social_golfer_40x10x11_seed_2_runtime_seconds":0,"social_golfer_40x10x11_seed_3_final_score":0,"social_golfer_40x10x11_seed_3_unique_contacts":0,"social_golfer_40x10x11_seed_3_best_conflict_positions":0,"social_golfer_40x10x11_seed_3_runtime_seconds":0,"social_golfer_40x10x11_seed_4_final_score":0,"social_golfer_40x10x11_seed_4_unique_contacts":0,"social_golfer_40x10x11_seed_4_best_conflict_positions":0,"social_golfer_40x10x11_seed_4_runtime_seconds":0},"status":"crash","description":"Retried the expanded baseline after restoring execute permissions, but the wrapper still exited 1 before emitting a run report. The captured log only contained compiler warnings, so the harness is still failing before benchmark execution.","timestamp":1776291440161,"segment":3,"confidence":null,"iterationTokens":4106,"asi":{"hypothesis":"After fixing the execute bit, the wrapper should launch the expanded benchmark suite and produce the first valid baseline.","rollback_reason":"The wrapper still exited without a run report, so there is still a harness failure and no baseline metrics.","error_details":{"observed_log":"compiler warnings only; no 'Run report:' line emitted"},"next_action_hint":"Run the benchmark command directly outside the wrapper to determine whether cargo run returns nonzero despite successful compilation or whether the wrapper’s report-path extraction is the failing step."}}
{"run":12,"commit":"0c2b168","metric":111.65,"metrics":{"best_final_score":0,"worst_final_score":324,"mean_unique_contacts":565.65,"best_unique_contacts":656,"worst_unique_contacts":464,"solved_runs":3,"mean_best_conflict_positions":31.05,"best_best_conflict_positions":0,"runtime_total_seconds":390.114896043,"social_golfer_32x8x10_seed_1_final_score":0,"social_golfer_32x8x10_seed_1_unique_contacts":480,"social_golfer_32x8x10_seed_1_best_conflict_positions":0,"social_golfer_32x8x10_seed_1_runtime_seconds":4.4496382279999995,"social_golfer_32x8x10_seed_2_final_score":0,"social_golfer_32x8x10_seed_2_unique_contacts":480,"social_golfer_32x8x10_seed_2_best_conflict_positions":0,"social_golfer_32x8x10_seed_2_runtime_seconds":1.089165296,"social_golfer_32x8x10_seed_3_final_score":176,"social_golfer_32x8x10_seed_3_unique_contacts":464,"social_golfer_32x8x10_seed_3_best_conflict_positions":64,"social_golfer_32x8x10_seed_3_runtime_seconds":60.001681992,"social_golfer_32x8x10_seed_4_final_score":176,"social_golfer_32x8x10_seed_4_unique_contacts":464,"social_golfer_32x8x10_seed_4_best_conflict_positions":64,"social_golfer_32x8x10_seed_4_runtime_seconds":60.000605676,"social_golfer_36x9x10_seed_1_final_score":88,"social_golfer_36x9x10_seed_1_unique_contacts":532,"social_golfer_36x9x10_seed_1_best_conflict_positions":25,"social_golfer_36x9x10_seed_1_runtime_seconds":60.000362784000004,"social_golfer_36x9x10_seed_2_final_score":88,"social_golfer_36x9x10_seed_2_unique_contacts":532,"social_golfer_36x9x10_seed_2_best_conflict_positions":28,"social_golfer_36x9x10_seed_2_runtime_seconds":60.001352274,"social_golfer_36x9x10_seed_3_final_score":128,"social_golfer_36x9x10_seed_3_unique_contacts":532,"social_golfer_36x9x10_seed_3_best_conflict_positions":25,"social_golfer_36x9x10_seed_3_runtime_seconds":60.002252647,"social_golfer_36x9x10_seed_4_final_score":77,"social_golfer_36x9x10_seed_4_unique_contacts":533,"social_golfer_36x9x10_seed_4_best_conflict_positions":26,"social_golfer_36x9x10_seed_4_runtime_seconds":60.001343006,"social_golfer_36x9x11_seed_1_final_score":291,"social_golfer_36x9x11_seed_1_unique_contacts":573,"social_golfer_36x9x11_seed_1_best_conflict_positions":67,"social_golfer_36x9x11_seed_1_runtime_seconds":90.00281794300001,"social_golfer_36x9x11_seed_2_final_score":251,"social_golfer_36x9x11_seed_2_unique_contacts":573,"social_golfer_36x9x11_seed_2_best_conflict_positions":67,"social_golfer_36x9x11_seed_2_runtime_seconds":90.00371101699999,"social_golfer_36x9x11_seed_3_final_score":324,"social_golfer_36x9x11_seed_3_unique_contacts":570,"social_golfer_36x9x11_seed_3_best_conflict_positions":70,"social_golfer_36x9x11_seed_3_runtime_seconds":90.00049216900001,"social_golfer_36x9x11_seed_4_final_score":275,"social_golfer_36x9x11_seed_4_unique_contacts":569,"social_golfer_36x9x11_seed_4_best_conflict_positions":82,"social_golfer_36x9x11_seed_4_runtime_seconds":90.00456319999999,"social_golfer_40x10x10_seed_1_final_score":11,"social_golfer_40x10x10_seed_1_unique_contacts":599,"social_golfer_40x10x10_seed_1_best_conflict_positions":4,"social_golfer_40x10x10_seed_1_runtime_seconds":60.000204721,"social_golfer_40x10x10_seed_2_final_score":11,"social_golfer_40x10x10_seed_2_unique_contacts":599,"social_golfer_40x10x10_seed_2_best_conflict_positions":4,"social_golfer_40x10x10_seed_2_runtime_seconds":60.001588232,"social_golfer_40x10x10_seed_3_final_score":0,"social_golfer_40x10x10_seed_3_unique_contacts":600,"social_golfer_40x10x10_seed_3_best_conflict_positions":0,"social_golfer_40x10x10_seed_3_runtime_seconds":27.784179669999997,"social_golfer_40x10x10_seed_4_final_score":11,"social_golfer_40x10x10_seed_4_unique_contacts":599,"social_golfer_40x10x10_seed_4_best_conflict_positions":4,"social_golfer_40x10x10_seed_4_runtime_seconds":60.000424932,"social_golfer_40x10x11_seed_1_final_score":44,"social_golfer_40x10x11_seed_1_unique_contacts":656,"social_golfer_40x10x11_seed_1_best_conflict_positions":16,"social_golfer_40x10x11_seed_1_runtime_seconds":120.001024732,"social_golfer_40x10x11_seed_2_final_score":108,"social_golfer_40x10x11_seed_2_unique_contacts":652,"social_golfer_40x10x11_seed_2_best_conflict_positions":26,"social_golfer_40x10x11_seed_2_runtime_seconds":120.002066183,"social_golfer_40x10x11_seed_3_final_score":97,"social_golfer_40x10x11_seed_3_unique_contacts":653,"social_golfer_40x10x11_seed_3_best_conflict_positions":24,"social_golfer_40x10x11_seed_3_runtime_seconds":120.00142689500001,"social_golfer_40x10x11_seed_4_final_score":77,"social_golfer_40x10x11_seed_4_unique_contacts":653,"social_golfer_40x10x11_seed_4_best_conflict_positions":25,"social_golfer_40x10x11_seed_4_runtime_seconds":120.000226878},"status":"keep","description":"Established the first valid baseline for the expanded p=4 stretch autoresearch bundle after fixing the non-canonical suite policy in the benchmark manifest. The 20-case jobs=4 lane now benchmarks 32x8x10 plus 36x9x10, 36x9x11, 40x10x10, and 40x10x11 with 4 seeds each.","timestamp":1776291943169,"segment":3,"confidence":null,"iterationTokens":7120,"asi":{"hypothesis":"The expanded 4-seed-per-case p=4 stretch bundle should now run cleanly and establish a trustworthy new baseline for solver4 quality work.","observations":{"mean_final_score":111.65,"solved_runs":3,"notable_cases":{"32x8x10":[0,0,176,176],"36x9x10":[88,88,128,77],"36x9x11":[291,251,324,275],"40x10x10":[11,11,0,11],"40x10x11":[44,108,97,77]}},"next_action_hint":"Optimize the remaining unsolved basins, especially 32x8x10 seeds 3-4 and 36x9x11, while preserving the already-solved 32x8x10 and 40x10x10 seeds."}}
{"run":13,"commit":"0c2b168","metric":128.4,"metrics":{"best_final_score":22,"worst_final_score":337,"mean_unique_contacts":564.4,"best_unique_contacts":652,"worst_unique_contacts":464,"solved_runs":0,"mean_best_conflict_positions":36.4,"best_best_conflict_positions":8,"runtime_total_seconds":390.257354219,"social_golfer_32x8x10_seed_1_final_score":66,"social_golfer_32x8x10_seed_1_unique_contacts":474,"social_golfer_32x8x10_seed_1_best_conflict_positions":24,"social_golfer_32x8x10_seed_1_runtime_seconds":60.001065739999994,"social_golfer_32x8x10_seed_2_final_score":66,"social_golfer_32x8x10_seed_2_unique_contacts":474,"social_golfer_32x8x10_seed_2_best_conflict_positions":24,"social_golfer_32x8x10_seed_2_runtime_seconds":60.001608406,"social_golfer_32x8x10_seed_3_final_score":176,"social_golfer_32x8x10_seed_3_unique_contacts":464,"social_golfer_32x8x10_seed_3_best_conflict_positions":64,"social_golfer_32x8x10_seed_3_runtime_seconds":60.001513261999996,"social_golfer_32x8x10_seed_4_final_score":66,"social_golfer_32x8x10_seed_4_unique_contacts":474,"social_golfer_32x8x10_seed_4_best_conflict_positions":24,"social_golfer_32x8x10_seed_4_runtime_seconds":59.99993152,"social_golfer_36x9x10_seed_1_final_score":88,"social_golfer_36x9x10_seed_1_unique_contacts":532,"social_golfer_36x9x10_seed_1_best_conflict_positions":29,"social_golfer_36x9x10_seed_1_runtime_seconds":60.002012597000004,"social_golfer_36x9x10_seed_2_final_score":119,"social_golfer_36x9x10_seed_2_unique_contacts":531,"social_golfer_36x9x10_seed_2_best_conflict_positions":32,"social_golfer_36x9x10_seed_2_runtime_seconds":60.002415499,"social_golfer_36x9x10_seed_3_final_score":161,"social_golfer_36x9x10_seed_3_unique_contacts":529,"social_golfer_36x9x10_seed_3_best_conflict_positions":33,"social_golfer_36x9x10_seed_3_runtime_seconds":60.045697569,"social_golfer_36x9x10_seed_4_final_score":99,"social_golfer_36x9x10_seed_4_unique_contacts":531,"social_golfer_36x9x10_seed_4_best_conflict_positions":34,"social_golfer_36x9x10_seed_4_runtime_seconds":60.002127537,"social_golfer_36x9x11_seed_1_final_score":251,"social_golfer_36x9x11_seed_1_unique_contacts":573,"social_golfer_36x9x11_seed_1_best_conflict_positions":75,"social_golfer_36x9x11_seed_1_runtime_seconds":90.001757778,"social_golfer_36x9x11_seed_2_final_score":337,"social_golfer_36x9x11_seed_2_unique_contacts":567,"social_golfer_36x9x11_seed_2_best_conflict_positions":85,"social_golfer_36x9x11_seed_2_runtime_seconds":90.001495732,"social_golfer_36x9x11_seed_3_final_score":302,"social_golfer_36x9x11_seed_3_unique_contacts":572,"social_golfer_36x9x11_seed_3_best_conflict_positions":71,"social_golfer_36x9x11_seed_3_runtime_seconds":90.003136575,"social_golfer_36x9x11_seed_4_final_score":302,"social_golfer_36x9x11_seed_4_unique_contacts":572,"social_golfer_36x9x11_seed_4_best_conflict_positions":75,"social_golfer_36x9x11_seed_4_runtime_seconds":90.000816445,"social_golfer_40x10x10_seed_1_final_score":22,"social_golfer_40x10x10_seed_1_unique_contacts":598,"social_golfer_40x10x10_seed_1_best_conflict_positions":8,"social_golfer_40x10x10_seed_1_runtime_seconds":60.000127803999995,"social_golfer_40x10x10_seed_2_final_score":22,"social_golfer_40x10x10_seed_2_unique_contacts":598,"social_golfer_40x10x10_seed_2_best_conflict_positions":8,"social_golfer_40x10x10_seed_2_runtime_seconds":60.130783703,"social_golfer_40x10x10_seed_3_final_score":22,"social_golfer_40x10x10_seed_3_unique_contacts":598,"social_golfer_40x10x10_seed_3_best_conflict_positions":8,"social_golfer_40x10x10_seed_3_runtime_seconds":60.034011152000005,"social_golfer_40x10x10_seed_4_final_score":22,"social_golfer_40x10x10_seed_4_unique_contacts":598,"social_golfer_40x10x10_seed_4_best_conflict_positions":8,"social_golfer_40x10x10_seed_4_runtime_seconds":60.129212314,"social_golfer_40x10x11_seed_1_final_score":161,"social_golfer_40x10x11_seed_1_unique_contacts":649,"social_golfer_40x10x11_seed_1_best_conflict_positions":32,"social_golfer_40x10x11_seed_1_runtime_seconds":120.009316698,"social_golfer_40x10x11_seed_2_final_score":99,"social_golfer_40x10x11_seed_2_unique_contacts":651,"social_golfer_40x10x11_seed_2_best_conflict_positions":34,"social_golfer_40x10x11_seed_2_runtime_seconds":120.069031985,"social_golfer_40x10x11_seed_3_final_score":99,"social_golfer_40x10x11_seed_3_unique_contacts":651,"social_golfer_40x10x11_seed_3_best_conflict_positions":34,"social_golfer_40x10x11_seed_3_runtime_seconds":120.00105726100001,"social_golfer_40x10x11_seed_4_final_score":88,"social_golfer_40x10x11_seed_4_unique_contacts":652,"social_golfer_40x10x11_seed_4_best_conflict_positions":26,"social_golfer_40x10x11_seed_4_runtime_seconds":120.001759564},"status":"discard","description":"Tried replacing the random two-swap breakout with a solver3-inspired structured week repair: rebuild one max-conflict week greedily from the current cross-week partnership state, and only fall back to random swaps if the rebuilt week is unchanged. This generalized perturbation looked attractive in theory but regressed the p=4 bundle badly.","timestamp":1776293195976,"segment":3,"confidence":null,"iterationTokens":7120,"asi":{"hypothesis":"A structured week-rebuild breakout should generalize better than blind swaps by repairing one whole max-conflict week using the same freedom-aware constructor under the current cross-week constraints.","rollback_reason":"The stronger destroy-repair breakout over-intensified deterministic basins, eliminated all solved runs, and worsened the bundle mean from 111.65 to 128.4.","observations":{"baseline_mean_final_score":111.65,"experiment_mean_final_score":128.4,"baseline_solved_runs":3,"experiment_solved_runs":0,"32x8x10_shift":[0,0,176,176,"->",66,66,176,66],"40x10x10_shift":[11,11,0,11,"->",22,22,22,22]},"dead_end":"Whole-week greedy repair is too strong and too deterministic as the default breakout operator for this lane.","next_action_hint":"Keep breakout lightweight and instead explore a smaller generalization from solver3, such as using incident-burden information to choose breakout positions or widening the selected-swap neighborhood only around the highest-burden repeated pairs."}}
