{"run":50,"commit":"fea1825","metric":80.6,"metrics":{"best_final_score":0,"worst_final_score":273,"mean_unique_contacts":568.2,"best_unique_contacts":655,"worst_unique_contacts":480,"solved_runs":6,"mean_best_conflict_positions":21.9,"best_best_conflict_positions":0,"runtime_total_seconds":335.326369673,"social_golfer_32x8x10_seed_1_final_score":0,"social_golfer_32x8x10_seed_1_unique_contacts":480,"social_golfer_32x8x10_seed_1_best_conflict_positions":0,"social_golfer_32x8x10_seed_1_runtime_seconds":3.623066126,"social_golfer_32x8x10_seed_2_final_score":0,"social_golfer_32x8x10_seed_2_unique_contacts":480,"social_golfer_32x8x10_seed_2_best_conflict_positions":0,"social_golfer_32x8x10_seed_2_runtime_seconds":5.2619526180000005,"social_golfer_32x8x10_seed_3_final_score":0,"social_golfer_32x8x10_seed_3_unique_contacts":480,"social_golfer_32x8x10_seed_3_best_conflict_positions":0,"social_golfer_32x8x10_seed_3_runtime_seconds":4.27287469,"social_golfer_32x8x10_seed_4_final_score":0,"social_golfer_32x8x10_seed_4_unique_contacts":480,"social_golfer_32x8x10_seed_4_best_conflict_positions":0,"social_golfer_32x8x10_seed_4_runtime_seconds":3.5370933690000004,"social_golfer_36x9x10_seed_1_final_score":97,"social_golfer_36x9x10_seed_1_unique_contacts":533,"social_golfer_36x9x10_seed_1_best_conflict_positions":24,"social_golfer_36x9x10_seed_1_runtime_seconds":59.999985101,"social_golfer_36x9x10_seed_2_final_score":86,"social_golfer_36x9x10_seed_2_unique_contacts":534,"social_golfer_36x9x10_seed_2_best_conflict_positions":21,"social_golfer_36x9x10_seed_2_runtime_seconds":60.000572512000005,"social_golfer_36x9x10_seed_3_final_score":44,"social_golfer_36x9x10_seed_3_unique_contacts":536,"social_golfer_36x9x10_seed_3_best_conflict_positions":16,"social_golfer_36x9x10_seed_3_runtime_seconds":60.00177024,"social_golfer_36x9x10_seed_4_final_score":66,"social_golfer_36x9x10_seed_4_unique_contacts":534,"social_golfer_36x9x10_seed_4_best_conflict_positions":23,"social_golfer_36x9x10_seed_4_runtime_seconds":60.002509061000005,"social_golfer_36x9x11_seed_1_final_score":251,"social_golfer_36x9x11_seed_1_unique_contacts":573,"social_golfer_36x9x11_seed_1_best_conflict_positions":67,"social_golfer_36x9x11_seed_1_runtime_seconds":90.00309825299999,"social_golfer_36x9x11_seed_2_final_score":260,"social_golfer_36x9x11_seed_2_unique_contacts":574,"social_golfer_36x9x11_seed_2_best_conflict_positions":62,"social_golfer_36x9x11_seed_2_runtime_seconds":90.000143711,"social_golfer_36x9x11_seed_3_final_score":260,"social_golfer_36x9x11_seed_3_unique_contacts":574,"social_golfer_36x9x11_seed_3_best_conflict_positions":67,"social_golfer_36x9x11_seed_3_runtime_seconds":90.00298091399999,"social_golfer_36x9x11_seed_4_final_score":273,"social_golfer_36x9x11_seed_4_unique_contacts":571,"social_golfer_36x9x11_seed_4_best_conflict_positions":67,"social_golfer_36x9x11_seed_4_runtime_seconds":90.001822455,"social_golfer_40x10x10_seed_1_final_score":0,"social_golfer_40x10x10_seed_1_unique_contacts":600,"social_golfer_40x10x10_seed_1_best_conflict_positions":0,"social_golfer_40x10x10_seed_1_runtime_seconds":26.204557067,"social_golfer_40x10x10_seed_2_final_score":11,"social_golfer_40x10x10_seed_2_unique_contacts":599,"social_golfer_40x10x10_seed_2_best_conflict_positions":4,"social_golfer_40x10x10_seed_2_runtime_seconds":60.000533262,"social_golfer_40x10x10_seed_3_final_score":0,"social_golfer_40x10x10_seed_3_unique_contacts":600,"social_golfer_40x10x10_seed_3_best_conflict_positions":0,"social_golfer_40x10x10_seed_3_runtime_seconds":5.781824839,"social_golfer_40x10x10_seed_4_final_score":11,"social_golfer_40x10x10_seed_4_unique_contacts":599,"social_golfer_40x10x10_seed_4_best_conflict_positions":4,"social_golfer_40x10x10_seed_4_runtime_seconds":60.000557567,"social_golfer_40x10x11_seed_1_final_score":55,"social_golfer_40x10x11_seed_1_unique_contacts":655,"social_golfer_40x10x11_seed_1_best_conflict_positions":19,"social_golfer_40x10x11_seed_1_runtime_seconds":120.000038387,"social_golfer_40x10x11_seed_2_final_score":66,"social_golfer_40x10x11_seed_2_unique_contacts":654,"social_golfer_40x10x11_seed_2_best_conflict_positions":20,"social_golfer_40x10x11_seed_2_runtime_seconds":120.00086759599999,"social_golfer_40x10x11_seed_3_final_score":66,"social_golfer_40x10x11_seed_3_unique_contacts":654,"social_golfer_40x10x11_seed_3_best_conflict_positions":23,"social_golfer_40x10x11_seed_3_runtime_seconds":120.00221799399999,"social_golfer_40x10x11_seed_4_final_score":66,"social_golfer_40x10x11_seed_4_unique_contacts":654,"social_golfer_40x10x11_seed_4_best_conflict_positions":21,"social_golfer_40x10x11_seed_4_runtime_seconds":120.00163558499999},"status":"discard","description":"Tried reintroducing late active-repeated-pair guidance in a much narrower form: activate it only from the pre-breakout stagnation step onward and only when the current schedule is already at the incumbent best conflict-position level. A confirmation rerun reproduced the same 80.6 mean_final_score, so the small regression appears real.","timestamp":1776324842395,"segment":3,"confidence":8.27083333333334,"iterationTokens":3868,"asi":{"hypothesis":"Because breakout fires at the same stagnation depth as the current 4+ repeat-guidance threshold, a narrower reintroduction might work: enable repeat guidance only on the final pre-breakout local-search step and only when the search is already sitting at the incumbent-best conflict plateau.","rollback_reason":"The narrowed reintroduction still regressed the primary metric. A confirmation rerun reproduced mean_final_score 80.6 exactly, so this is not just measurement noise.","observations":{"baseline_commit":"fea1825","baseline_mean_final_score":79.4,"experiment_mean_final_score":80.6,"confirmation_rerun_mean_final_score":80.6,"baseline_solved_runs":6,"experiment_solved_runs":6,"32x8x10_scores":[0,0,0,0],"36x9x10_scores":[97,86,44,66],"36x9x11_scores":[251,260,260,273],"40x10x11_scores":[55,66,66,66]},"learned_tradeoff":"The best current regime still prefers effectively no extra active-repeated-pair steering beyond the kept baseline semantics. Even a very narrow pre-breakout/incumbent-best version slightly worsened the bundle.","next_action_hint":"Prune repeat-guidance reintroduction ideas for now. Look next at a different mild move-ordering or neighborhood idea that does not revisit the tabu-memory axis, breakout strength axis, or active-repeated-pair guidance thresholds."}}
{"run":51,"commit":"fea1825","metric":88.55,"metrics":{"best_final_score":0,"worst_final_score":322,"mean_unique_contacts":567.75,"best_unique_contacts":654,"worst_unique_contacts":480,"solved_runs":6,"mean_best_conflict_positions":22.9,"best_best_conflict_positions":0,"runtime_total_seconds":336.526338044,"social_golfer_32x8x10_seed_1_final_score":0,"social_golfer_32x8x10_seed_1_unique_contacts":480,"social_golfer_32x8x10_seed_1_best_conflict_positions":0,"social_golfer_32x8x10_seed_1_runtime_seconds":6.449897195999999,"social_golfer_32x8x10_seed_2_final_score":0,"social_golfer_32x8x10_seed_2_unique_contacts":480,"social_golfer_32x8x10_seed_2_best_conflict_positions":0,"social_golfer_32x8x10_seed_2_runtime_seconds":7.003565857999999,"social_golfer_32x8x10_seed_3_final_score":0,"social_golfer_32x8x10_seed_3_unique_contacts":480,"social_golfer_32x8x10_seed_3_best_conflict_positions":0,"social_golfer_32x8x10_seed_3_runtime_seconds":4.392404994,"social_golfer_32x8x10_seed_4_final_score":0,"social_golfer_32x8x10_seed_4_unique_contacts":480,"social_golfer_32x8x10_seed_4_best_conflict_positions":0,"social_golfer_32x8x10_seed_4_runtime_seconds":3.688451879,"social_golfer_36x9x10_seed_1_final_score":77,"social_golfer_36x9x10_seed_1_unique_contacts":533,"social_golfer_36x9x10_seed_1_best_conflict_positions":25,"social_golfer_36x9x10_seed_1_runtime_seconds":60.001566808999996,"social_golfer_36x9x10_seed_2_final_score":66,"social_golfer_36x9x10_seed_2_unique_contacts":534,"social_golfer_36x9x10_seed_2_best_conflict_positions":21,"social_golfer_36x9x10_seed_2_runtime_seconds":60.000225482000005,"social_golfer_36x9x10_seed_3_final_score":77,"social_golfer_36x9x10_seed_3_unique_contacts":533,"social_golfer_36x9x10_seed_3_best_conflict_positions":24,"social_golfer_36x9x10_seed_3_runtime_seconds":60.0004723,"social_golfer_36x9x10_seed_4_final_score":66,"social_golfer_36x9x10_seed_4_unique_contacts":534,"social_golfer_36x9x10_seed_4_best_conflict_positions":22,"social_golfer_36x9x10_seed_4_runtime_seconds":60.002272929,"social_golfer_36x9x11_seed_1_final_score":304,"social_golfer_36x9x11_seed_1_unique_contacts":570,"social_golfer_36x9x11_seed_1_best_conflict_positions":70,"social_golfer_36x9x11_seed_1_runtime_seconds":90.002046695,"social_golfer_36x9x11_seed_2_final_score":322,"social_golfer_36x9x11_seed_2_unique_contacts":572,"social_golfer_36x9x11_seed_2_best_conflict_positions":61,"social_golfer_36x9x11_seed_2_runtime_seconds":90.001074906,"social_golfer_36x9x11_seed_3_final_score":260,"social_golfer_36x9x11_seed_3_unique_contacts":574,"social_golfer_36x9x11_seed_3_best_conflict_positions":65,"social_golfer_36x9x11_seed_3_runtime_seconds":90.00054116,"social_golfer_36x9x11_seed_4_final_score":271,"social_golfer_36x9x11_seed_4_unique_contacts":573,"social_golfer_36x9x11_seed_4_best_conflict_positions":69,"social_golfer_36x9x11_seed_4_runtime_seconds":90.003875967,"social_golfer_40x10x10_seed_1_final_score":11,"social_golfer_40x10x10_seed_1_unique_contacts":599,"social_golfer_40x10x10_seed_1_best_conflict_positions":4,"social_golfer_40x10x10_seed_1_runtime_seconds":60.000357939000004,"social_golfer_40x10x10_seed_2_final_score":0,"social_golfer_40x10x10_seed_2_unique_contacts":600,"social_golfer_40x10x10_seed_2_best_conflict_positions":0,"social_golfer_40x10x10_seed_2_runtime_seconds":32.669057268,"social_golfer_40x10x10_seed_3_final_score":11,"social_golfer_40x10x10_seed_3_unique_contacts":599,"social_golfer_40x10x10_seed_3_best_conflict_positions":4,"social_golfer_40x10x10_seed_3_runtime_seconds":60.000823008999994,"social_golfer_40x10x10_seed_4_final_score":0,"social_golfer_40x10x10_seed_4_unique_contacts":600,"social_golfer_40x10x10_seed_4_best_conflict_positions":0,"social_golfer_40x10x10_seed_4_runtime_seconds":34.993270299,"social_golfer_40x10x11_seed_1_final_score":66,"social_golfer_40x10x11_seed_1_unique_contacts":654,"social_golfer_40x10x11_seed_1_best_conflict_positions":23,"social_golfer_40x10x11_seed_1_runtime_seconds":120.00244856299999,"social_golfer_40x10x11_seed_2_final_score":108,"social_golfer_40x10x11_seed_2_unique_contacts":652,"social_golfer_40x10x11_seed_2_best_conflict_positions":24,"social_golfer_40x10x11_seed_2_runtime_seconds":120.001159942,"social_golfer_40x10x11_seed_3_final_score":66,"social_golfer_40x10x11_seed_3_unique_contacts":654,"social_golfer_40x10x11_seed_3_best_conflict_positions":23,"social_golfer_40x10x11_seed_3_runtime_seconds":120.00067391599998,"social_golfer_40x10x11_seed_4_final_score":66,"social_golfer_40x10x11_seed_4_unique_contacts":654,"social_golfer_40x10x11_seed_4_best_conflict_positions":23,"social_golfer_40x10x11_seed_4_runtime_seconds":120.000620747},"status":"discard","description":"Tried a mild late-stage move-ordering tweak: on the last pre-breakout local-search step, break otherwise-equal swap ties toward moves taken from the currently harder week instead of falling straight to lexicographic order. This over-focused on hard-week structure and regressed the p=4 stretch bundle.","timestamp":1776325802381,"segment":3,"confidence":7.979899497487436,"iterationTokens":13440,"asi":{"hypothesis":"With simple tabu and breakout-strength tuning exhausted, a mild remaining option was to add hard-week-aware move ordering: on the last local-search step before breakout, prefer otherwise-equal swaps drawn from the currently hardest week to concentrate effort where the schedule is most conflicted.","rollback_reason":"This overfocused the search on hard-week structure and regressed mean_final_score from 79.4 to 88.55, especially on 36x9x11 and one 40x10x11 seed.","observations":{"baseline_commit":"fea1825","baseline_mean_final_score":79.4,"experiment_mean_final_score":88.55,"baseline_solved_runs":6,"experiment_solved_runs":6,"32x8x10_scores":[0,0,0,0],"36x9x10_scores":[77,66,77,66],"36x9x11_scores":[304,322,260,271],"40x10x11_scores":[66,108,66,66]},"learned_tradeoff":"Even very mild move-order bias toward the current hardest week can oversteer larger hard cases. The current baseline likely needs broader flexibility than 'prefer the hardest week' at tie time.","next_action_hint":"Prune hard-week tie-focus for now. The next experiment should target a different mild neighborhood-shaping idea rather than more hard-week-only ordering or further simple plateau-control retunes."}}
{"run":52,"commit":"fea1825","metric":85.6,"metrics":{"best_final_score":0,"worst_final_score":302,"mean_unique_contacts":568.2,"best_unique_contacts":654,"worst_unique_contacts":480,"solved_runs":7,"mean_best_conflict_positions":21.95,"best_best_conflict_positions":0,"runtime_total_seconds":334.000754305,"social_golfer_32x8x10_seed_1_final_score":0,"social_golfer_32x8x10_seed_1_unique_contacts":480,"social_golfer_32x8x10_seed_1_best_conflict_positions":0,"social_golfer_32x8x10_seed_1_runtime_seconds":4.017121793,"social_golfer_32x8x10_seed_2_final_score":0,"social_golfer_32x8x10_seed_2_unique_contacts":480,"social_golfer_32x8x10_seed_2_best_conflict_positions":0,"social_golfer_32x8x10_seed_2_runtime_seconds":3.8948080169999995,"social_golfer_32x8x10_seed_3_final_score":0,"social_golfer_32x8x10_seed_3_unique_contacts":480,"social_golfer_32x8x10_seed_3_best_conflict_positions":0,"social_golfer_32x8x10_seed_3_runtime_seconds":5.108961991,"social_golfer_32x8x10_seed_4_final_score":0,"social_golfer_32x8x10_seed_4_unique_contacts":480,"social_golfer_32x8x10_seed_4_best_conflict_positions":0,"social_golfer_32x8x10_seed_4_runtime_seconds":4.858265485,"social_golfer_36x9x10_seed_1_final_score":137,"social_golfer_36x9x10_seed_1_unique_contacts":533,"social_golfer_36x9x10_seed_1_best_conflict_positions":23,"social_golfer_36x9x10_seed_1_runtime_seconds":60.001298051,"social_golfer_36x9x10_seed_2_final_score":77,"social_golfer_36x9x10_seed_2_unique_contacts":533,"social_golfer_36x9x10_seed_2_best_conflict_positions":26,"social_golfer_36x9x10_seed_2_runtime_seconds":60.002206851000004,"social_golfer_36x9x10_seed_3_final_score":66,"social_golfer_36x9x10_seed_3_unique_contacts":534,"social_golfer_36x9x10_seed_3_best_conflict_positions":22,"social_golfer_36x9x10_seed_3_runtime_seconds":60.001356584999996,"social_golfer_36x9x10_seed_4_final_score":97,"social_golfer_36x9x10_seed_4_unique_contacts":533,"social_golfer_36x9x10_seed_4_best_conflict_positions":24,"social_golfer_36x9x10_seed_4_runtime_seconds":60.000338686,"social_golfer_36x9x11_seed_1_final_score":280,"social_golfer_36x9x11_seed_1_unique_contacts":574,"social_golfer_36x9x11_seed_1_best_conflict_positions":63,"social_golfer_36x9x11_seed_1_runtime_seconds":90.003665697,"social_golfer_36x9x11_seed_2_final_score":302,"social_golfer_36x9x11_seed_2_unique_contacts":572,"social_golfer_36x9x11_seed_2_best_conflict_positions":66,"social_golfer_36x9x11_seed_2_runtime_seconds":90.000565181,"social_golfer_36x9x11_seed_3_final_score":209,"social_golfer_36x9x11_seed_3_unique_contacts":575,"social_golfer_36x9x11_seed_3_best_conflict_positions":64,"social_golfer_36x9x11_seed_3_runtime_seconds":90.003126067,"social_golfer_36x9x11_seed_4_final_score":207,"social_golfer_36x9x11_seed_4_unique_contacts":577,"social_golfer_36x9x11_seed_4_best_conflict_positions":57,"social_golfer_36x9x11_seed_4_runtime_seconds":90.00428045299999,"social_golfer_40x10x10_seed_1_final_score":11,"social_golfer_40x10x10_seed_1_unique_contacts":599,"social_golfer_40x10x10_seed_1_best_conflict_positions":4,"social_golfer_40x10x10_seed_1_runtime_seconds":60.00059288,"social_golfer_40x10x10_seed_2_final_score":0,"social_golfer_40x10x10_seed_2_unique_contacts":600,"social_golfer_40x10x10_seed_2_best_conflict_positions":0,"social_golfer_40x10x10_seed_2_runtime_seconds":23.650813572,"social_golfer_40x10x10_seed_3_final_score":0,"social_golfer_40x10x10_seed_3_unique_contacts":600,"social_golfer_40x10x10_seed_3_best_conflict_positions":0,"social_golfer_40x10x10_seed_3_runtime_seconds":55.822086053999996,"social_golfer_40x10x10_seed_4_final_score":0,"social_golfer_40x10x10_seed_4_unique_contacts":600,"social_golfer_40x10x10_seed_4_best_conflict_positions":0,"social_golfer_40x10x10_seed_4_runtime_seconds":12.264497809000002,"social_golfer_40x10x11_seed_1_final_score":86,"social_golfer_40x10x11_seed_1_unique_contacts":654,"social_golfer_40x10x11_seed_1_best_conflict_positions":20,"social_golfer_40x10x11_seed_1_runtime_seconds":120.000466185,"social_golfer_40x10x11_seed_2_final_score":108,"social_golfer_40x10x11_seed_2_unique_contacts":652,"social_golfer_40x10x11_seed_2_best_conflict_positions":23,"social_golfer_40x10x11_seed_2_runtime_seconds":120.001814219,"social_golfer_40x10x11_seed_3_final_score":66,"social_golfer_40x10x11_seed_3_unique_contacts":654,"social_golfer_40x10x11_seed_3_best_conflict_positions":23,"social_golfer_40x10x11_seed_3_runtime_seconds":120.00183890699999,"social_golfer_40x10x11_seed_4_final_score":66,"social_golfer_40x10x11_seed_4_unique_contacts":654,"social_golfer_40x10x11_seed_4_best_conflict_positions":24,"social_golfer_40x10x11_seed_4_runtime_seconds":119.99996339399999},"status":"discard","description":"Tried a late-stage current-week-resolution tie-break: on the last pre-breakout local-search step, break otherwise-equal swaps by lower conflict count in the move's own week after the swap, ahead of lexicographic order. A confirmation rerun reproduced the same 85.6 mean_final_score, so this week-local tie focus appears genuinely worse than baseline.","timestamp":1776327542423,"segment":3,"confidence":7.746341463414635,"iterationTokens":19743,"asi":{"hypothesis":"A milder neighborhood-shaping step than hard-week source bias is to favor moves that actually reduce conflict inside their own week after the swap. Activating that only on the final pre-breakout step might help clean up hard local structure without changing early search behavior.","rollback_reason":"This week-local tie focus still regressed the bundle. A confirmation rerun reproduced mean_final_score 85.6, so the result appears real rather than noise.","observations":{"baseline_commit":"fea1825","baseline_mean_final_score":79.4,"experiment_mean_final_score":85.6,"confirmation_rerun_mean_final_score":85.6,"baseline_solved_runs":6,"experiment_solved_runs":7,"32x8x10_scores":[0,0,0,0],"36x9x10_scores":[137,77,66,97],"36x9x11_scores":[280,302,209,207],"40x10x11_scores":[86,108,66,66]},"learned_tradeoff":"Late-stage tie-breaks that further concentrate pressure on one week's structure appear to oversteer the larger hard cases, even when they are based on realized post-swap improvement rather than raw source-week burden.","next_action_hint":"Prune late-stage week-local tie-focus ideas for now. Future experiments should try a different kind of late-stage neighborhood expansion rather than additional tie-break pressure on the existing candidate set."}}
