{"run":20,"commit":"0c2b168","metric":111.65,"metrics":{"best_final_score":0,"worst_final_score":324,"mean_unique_contacts":565.65,"best_unique_contacts":656,"worst_unique_contacts":464,"solved_runs":3,"mean_best_conflict_positions":31.05,"best_best_conflict_positions":0,"runtime_total_seconds":390.072022081,"social_golfer_32x8x10_seed_1_final_score":0,"social_golfer_32x8x10_seed_1_unique_contacts":480,"social_golfer_32x8x10_seed_1_best_conflict_positions":0,"social_golfer_32x8x10_seed_1_runtime_seconds":3.407457374,"social_golfer_32x8x10_seed_2_final_score":0,"social_golfer_32x8x10_seed_2_unique_contacts":480,"social_golfer_32x8x10_seed_2_best_conflict_positions":0,"social_golfer_32x8x10_seed_2_runtime_seconds":0.6875092740000001,"social_golfer_32x8x10_seed_3_final_score":176,"social_golfer_32x8x10_seed_3_unique_contacts":464,"social_golfer_32x8x10_seed_3_best_conflict_positions":64,"social_golfer_32x8x10_seed_3_runtime_seconds":60.000455499,"social_golfer_32x8x10_seed_4_final_score":176,"social_golfer_32x8x10_seed_4_unique_contacts":464,"social_golfer_32x8x10_seed_4_best_conflict_positions":64,"social_golfer_32x8x10_seed_4_runtime_seconds":60.000776673000004,"social_golfer_36x9x10_seed_1_final_score":88,"social_golfer_36x9x10_seed_1_unique_contacts":532,"social_golfer_36x9x10_seed_1_best_conflict_positions":25,"social_golfer_36x9x10_seed_1_runtime_seconds":60.000300411000005,"social_golfer_36x9x10_seed_2_final_score":88,"social_golfer_36x9x10_seed_2_unique_contacts":532,"social_golfer_36x9x10_seed_2_best_conflict_positions":28,"social_golfer_36x9x10_seed_2_runtime_seconds":60.000895648,"social_golfer_36x9x10_seed_3_final_score":128,"social_golfer_36x9x10_seed_3_unique_contacts":532,"social_golfer_36x9x10_seed_3_best_conflict_positions":25,"social_golfer_36x9x10_seed_3_runtime_seconds":60.001598341,"social_golfer_36x9x10_seed_4_final_score":77,"social_golfer_36x9x10_seed_4_unique_contacts":533,"social_golfer_36x9x10_seed_4_best_conflict_positions":26,"social_golfer_36x9x10_seed_4_runtime_seconds":60.00083078,"social_golfer_36x9x11_seed_1_final_score":291,"social_golfer_36x9x11_seed_1_unique_contacts":573,"social_golfer_36x9x11_seed_1_best_conflict_positions":67,"social_golfer_36x9x11_seed_1_runtime_seconds":90.00188433,"social_golfer_36x9x11_seed_2_final_score":251,"social_golfer_36x9x11_seed_2_unique_contacts":573,"social_golfer_36x9x11_seed_2_best_conflict_positions":67,"social_golfer_36x9x11_seed_2_runtime_seconds":90.00059347999999,"social_golfer_36x9x11_seed_3_final_score":324,"social_golfer_36x9x11_seed_3_unique_contacts":570,"social_golfer_36x9x11_seed_3_best_conflict_positions":70,"social_golfer_36x9x11_seed_3_runtime_seconds":90.00006504299999,"social_golfer_36x9x11_seed_4_final_score":275,"social_golfer_36x9x11_seed_4_unique_contacts":569,"social_golfer_36x9x11_seed_4_best_conflict_positions":82,"social_golfer_36x9x11_seed_4_runtime_seconds":90.00230441800001,"social_golfer_40x10x10_seed_1_final_score":11,"social_golfer_40x10x10_seed_1_unique_contacts":599,"social_golfer_40x10x10_seed_1_best_conflict_positions":4,"social_golfer_40x10x10_seed_1_runtime_seconds":60.000340679,"social_golfer_40x10x10_seed_2_final_score":11,"social_golfer_40x10x10_seed_2_unique_contacts":599,"social_golfer_40x10x10_seed_2_best_conflict_positions":4,"social_golfer_40x10x10_seed_2_runtime_seconds":60.000359625,"social_golfer_40x10x10_seed_3_final_score":0,"social_golfer_40x10x10_seed_3_unique_contacts":600,"social_golfer_40x10x10_seed_3_best_conflict_positions":0,"social_golfer_40x10x10_seed_3_runtime_seconds":20.046822048,"social_golfer_40x10x10_seed_4_final_score":11,"social_golfer_40x10x10_seed_4_unique_contacts":599,"social_golfer_40x10x10_seed_4_best_conflict_positions":4,"social_golfer_40x10x10_seed_4_runtime_seconds":60.000505317999995,"social_golfer_40x10x11_seed_1_final_score":44,"social_golfer_40x10x11_seed_1_unique_contacts":656,"social_golfer_40x10x11_seed_1_best_conflict_positions":16,"social_golfer_40x10x11_seed_1_runtime_seconds":120.00002404,"social_golfer_40x10x11_seed_2_final_score":108,"social_golfer_40x10x11_seed_2_unique_contacts":652,"social_golfer_40x10x11_seed_2_best_conflict_positions":26,"social_golfer_40x10x11_seed_2_runtime_seconds":120.00134632,"social_golfer_40x10x11_seed_3_final_score":97,"social_golfer_40x10x11_seed_3_unique_contacts":653,"social_golfer_40x10x11_seed_3_best_conflict_positions":24,"social_golfer_40x10x11_seed_3_runtime_seconds":120.00085833300001,"social_golfer_40x10x11_seed_4_final_score":77,"social_golfer_40x10x11_seed_4_unique_contacts":653,"social_golfer_40x10x11_seed_4_best_conflict_positions":25,"social_golfer_40x10x11_seed_4_runtime_seconds":119.99993344100001},"status":"discard","description":"Tried a constructor-side dual seed for p=4: build both the current whole-group size-4 initializer and the older pairwise size-4 initializer, then keep whichever initial schedule has the lower initial paper objective before local search. In practice this behaved as another neutral no-op versus baseline.","timestamp":1776297782408,"segment":3,"confidence":77.00000000000061,"iterationTokens":15928,"asi":{"hypothesis":"A more structurally distinct constructor alternative may provide generic diversity without changing benchmark semantics: build both whole-group and pairwise p=4 greedy schedules, then start local search from the better initial basin.","rollback_reason":"The dual whole-group/pairwise constructor choice did not move the bundle at all relative to baseline, so it adds complexity without measurable benefit.","observations":{"baseline_mean_final_score":111.65,"experiment_mean_final_score":111.65,"baseline_solved_runs":3,"experiment_solved_runs":3,"result":"no meaningful change"},"next_action_hint":"Keep looking for gentler but more meaningfully different diversity sources; simple best-of-two constructor variants appear too correlated with the current baseline basin."}}
{"run":21,"commit":"165fe33","metric":101.95,"metrics":{"best_final_score":0,"worst_final_score":366,"mean_unique_contacts":566.35,"best_unique_contacts":654,"worst_unique_contacts":464,"solved_runs":5,"mean_best_conflict_positions":30.2,"best_best_conflict_positions":0,"runtime_total_seconds":351.264926368,"social_golfer_32x8x10_seed_1_final_score":0,"social_golfer_32x8x10_seed_1_unique_contacts":480,"social_golfer_32x8x10_seed_1_best_conflict_positions":0,"social_golfer_32x8x10_seed_1_runtime_seconds":4.184124568,"social_golfer_32x8x10_seed_2_final_score":0,"social_golfer_32x8x10_seed_2_unique_contacts":480,"social_golfer_32x8x10_seed_2_best_conflict_positions":0,"social_golfer_32x8x10_seed_2_runtime_seconds":0.8462000019999999,"social_golfer_32x8x10_seed_3_final_score":176,"social_golfer_32x8x10_seed_3_unique_contacts":464,"social_golfer_32x8x10_seed_3_best_conflict_positions":64,"social_golfer_32x8x10_seed_3_runtime_seconds":60.000517039,"social_golfer_32x8x10_seed_4_final_score":176,"social_golfer_32x8x10_seed_4_unique_contacts":464,"social_golfer_32x8x10_seed_4_best_conflict_positions":64,"social_golfer_32x8x10_seed_4_runtime_seconds":60.00027686199999,"social_golfer_36x9x10_seed_1_final_score":55,"social_golfer_36x9x10_seed_1_unique_contacts":535,"social_golfer_36x9x10_seed_1_best_conflict_positions":20,"social_golfer_36x9x10_seed_1_runtime_seconds":60.000540418,"social_golfer_36x9x10_seed_2_final_score":88,"social_golfer_36x9x10_seed_2_unique_contacts":532,"social_golfer_36x9x10_seed_2_best_conflict_positions":28,"social_golfer_36x9x10_seed_2_runtime_seconds":60.00112959199999,"social_golfer_36x9x10_seed_3_final_score":66,"social_golfer_36x9x10_seed_3_unique_contacts":534,"social_golfer_36x9x10_seed_3_best_conflict_positions":24,"social_golfer_36x9x10_seed_3_runtime_seconds":60.001602293000005,"social_golfer_36x9x10_seed_4_final_score":77,"social_golfer_36x9x10_seed_4_unique_contacts":533,"social_golfer_36x9x10_seed_4_best_conflict_positions":26,"social_golfer_36x9x10_seed_4_runtime_seconds":60.001421228999995,"social_golfer_36x9x11_seed_1_final_score":366,"social_golfer_36x9x11_seed_1_unique_contacts":568,"social_golfer_36x9x11_seed_1_best_conflict_positions":75,"social_golfer_36x9x11_seed_1_runtime_seconds":90.00185975800001,"social_golfer_36x9x11_seed_2_final_score":240,"social_golfer_36x9x11_seed_2_unique_contacts":574,"social_golfer_36x9x11_seed_2_best_conflict_positions":68,"social_golfer_36x9x11_seed_2_runtime_seconds":90.00155857099999,"social_golfer_36x9x11_seed_3_final_score":269,"social_golfer_36x9x11_seed_3_unique_contacts":575,"social_golfer_36x9x11_seed_3_best_conflict_positions":64,"social_golfer_36x9x11_seed_3_runtime_seconds":90.00076515699999,"social_golfer_36x9x11_seed_4_final_score":218,"social_golfer_36x9x11_seed_4_unique_contacts":576,"social_golfer_36x9x11_seed_4_best_conflict_positions":66,"social_golfer_36x9x11_seed_4_runtime_seconds":90.00071465100001,"social_golfer_40x10x10_seed_1_final_score":0,"social_golfer_40x10x10_seed_1_unique_contacts":600,"social_golfer_40x10x10_seed_1_best_conflict_positions":0,"social_golfer_40x10x10_seed_1_runtime_seconds":33.462648730999994,"social_golfer_40x10x10_seed_2_final_score":11,"social_golfer_40x10x10_seed_2_unique_contacts":599,"social_golfer_40x10x10_seed_2_best_conflict_positions":4,"social_golfer_40x10x10_seed_2_runtime_seconds":60.000419527000005,"social_golfer_40x10x10_seed_3_final_score":0,"social_golfer_40x10x10_seed_3_unique_contacts":600,"social_golfer_40x10x10_seed_3_best_conflict_positions":0,"social_golfer_40x10x10_seed_3_runtime_seconds":15.170962277,"social_golfer_40x10x10_seed_4_final_score":0,"social_golfer_40x10x10_seed_4_unique_contacts":600,"social_golfer_40x10x10_seed_4_best_conflict_positions":0,"social_golfer_40x10x10_seed_4_runtime_seconds":31.716751519,"social_golfer_40x10x11_seed_1_final_score":77,"social_golfer_40x10x11_seed_1_unique_contacts":653,"social_golfer_40x10x11_seed_1_best_conflict_positions":25,"social_golfer_40x10x11_seed_1_runtime_seconds":120.00018217099999,"social_golfer_40x10x11_seed_2_final_score":66,"social_golfer_40x10x11_seed_2_unique_contacts":654,"social_golfer_40x10x11_seed_2_best_conflict_positions":24,"social_golfer_40x10x11_seed_2_runtime_seconds":120.000327325,"social_golfer_40x10x11_seed_3_final_score":77,"social_golfer_40x10x11_seed_3_unique_contacts":653,"social_golfer_40x10x11_seed_3_best_conflict_positions":26,"social_golfer_40x10x11_seed_3_runtime_seconds":120.00139711,"social_golfer_40x10x11_seed_4_final_score":77,"social_golfer_40x10x11_seed_4_unique_contacts":653,"social_golfer_40x10x11_seed_4_best_conflict_positions":26,"social_golfer_40x10x11_seed_4_runtime_seconds":120.000792269},"status":"keep","description":"Conditioned a solver3-inspired repeat-guidance signal on true stagnation: among swaps tied on conflict positions and repeat excess, prefer fewer distinct active repeated pairs only after the search has already stalled for 2+ iterations, while preserving the original ordering earlier. This improved the p=4 stretch bundle substantially.","timestamp":1776298564613,"segment":3,"confidence":70.31034482758642,"iterationTokens":18975,"asi":{"hypothesis":"A gentle repeat-guidance signal should only influence hard plateau states, not easy early descents: activate active-repeated-pair minimization only after 2+ non-improving iterations, while keeping the baseline swap ordering before that.","observations":{"baseline_mean_final_score":111.65,"experiment_mean_final_score":101.95,"baseline_solved_runs":3,"experiment_solved_runs":5,"32x8x10_scores":[0,0,176,176],"36x9x10_scores":[55,88,66,77],"36x9x11_scores":[366,240,269,218],"40x10x10_scores":[0,11,0,0]},"learned_tradeoff":"Conditional guidance helps the broader bundle without destabilizing the already-solved easy 32x8x10 seeds, but it still leaves the hardest 32x8x10 seeds 3-4 untouched and one 36x9x11 seed remains quite weak.","next_action_hint":"Keep this guarded repeat-guidance path and next focus on constructor-side or stagnation-only diversification that specifically helps the remaining 32x8x10 hard seeds without losing the new gains on larger p=4 cases."}}
{"run":22,"commit":"165fe33","metric":112.2,"metrics":{"best_final_score":0,"worst_final_score":335,"mean_unique_contacts":565.6,"best_unique_contacts":654,"worst_unique_contacts":464,"solved_runs":4,"mean_best_conflict_positions":31.45,"best_best_conflict_positions":0,"runtime_total_seconds":387.865067679,"social_golfer_32x8x10_seed_1_final_score":0,"social_golfer_32x8x10_seed_1_unique_contacts":480,"social_golfer_32x8x10_seed_1_best_conflict_positions":0,"social_golfer_32x8x10_seed_1_runtime_seconds":4.182718122,"social_golfer_32x8x10_seed_2_final_score":0,"social_golfer_32x8x10_seed_2_unique_contacts":480,"social_golfer_32x8x10_seed_2_best_conflict_positions":0,"social_golfer_32x8x10_seed_2_runtime_seconds":0.862900145,"social_golfer_32x8x10_seed_3_final_score":176,"social_golfer_32x8x10_seed_3_unique_contacts":464,"social_golfer_32x8x10_seed_3_best_conflict_positions":64,"social_golfer_32x8x10_seed_3_runtime_seconds":60.000431832000004,"social_golfer_32x8x10_seed_4_final_score":176,"social_golfer_32x8x10_seed_4_unique_contacts":464,"social_golfer_32x8x10_seed_4_best_conflict_positions":64,"social_golfer_32x8x10_seed_4_runtime_seconds":60.000465523,"social_golfer_36x9x10_seed_1_final_score":66,"social_golfer_36x9x10_seed_1_unique_contacts":534,"social_golfer_36x9x10_seed_1_best_conflict_positions":24,"social_golfer_36x9x10_seed_1_runtime_seconds":60.000645977999994,"social_golfer_36x9x10_seed_2_final_score":77,"social_golfer_36x9x10_seed_2_unique_contacts":533,"social_golfer_36x9x10_seed_2_best_conflict_positions":28,"social_golfer_36x9x10_seed_2_runtime_seconds":60.00051643599999,"social_golfer_36x9x10_seed_3_final_score":108,"social_golfer_36x9x10_seed_3_unique_contacts":532,"social_golfer_36x9x10_seed_3_best_conflict_positions":30,"social_golfer_36x9x10_seed_3_runtime_seconds":60.00137254,"social_golfer_36x9x10_seed_4_final_score":130,"social_golfer_36x9x10_seed_4_unique_contacts":530,"social_golfer_36x9x10_seed_4_best_conflict_positions":36,"social_golfer_36x9x10_seed_4_runtime_seconds":60.001537087,"social_golfer_36x9x11_seed_1_final_score":335,"social_golfer_36x9x11_seed_1_unique_contacts":569,"social_golfer_36x9x11_seed_1_best_conflict_positions":70,"social_golfer_36x9x11_seed_1_runtime_seconds":90.00486235500001,"social_golfer_36x9x11_seed_2_final_score":304,"social_golfer_36x9x11_seed_2_unique_contacts":570,"social_golfer_36x9x11_seed_2_best_conflict_positions":70,"social_golfer_36x9x11_seed_2_runtime_seconds":90.003069407,"social_golfer_36x9x11_seed_3_final_score":304,"social_golfer_36x9x11_seed_3_unique_contacts":570,"social_golfer_36x9x11_seed_3_best_conflict_positions":69,"social_golfer_36x9x11_seed_3_runtime_seconds":90.000507088,"social_golfer_36x9x11_seed_4_final_score":198,"social_golfer_36x9x11_seed_4_unique_contacts":576,"social_golfer_36x9x11_seed_4_best_conflict_positions":66,"social_golfer_36x9x11_seed_4_runtime_seconds":90.000177933,"social_golfer_40x10x10_seed_1_final_score":0,"social_golfer_40x10x10_seed_1_unique_contacts":600,"social_golfer_40x10x10_seed_1_best_conflict_positions":0,"social_golfer_40x10x10_seed_1_runtime_seconds":10.447854463,"social_golfer_40x10x10_seed_2_final_score":0,"social_golfer_40x10x10_seed_2_unique_contacts":600,"social_golfer_40x10x10_seed_2_best_conflict_positions":0,"social_golfer_40x10x10_seed_2_runtime_seconds":53.60738064499999,"social_golfer_40x10x10_seed_3_final_score":11,"social_golfer_40x10x10_seed_3_unique_contacts":599,"social_golfer_40x10x10_seed_3_best_conflict_positions":4,"social_golfer_40x10x10_seed_3_runtime_seconds":60.000484172,"social_golfer_40x10x10_seed_4_final_score":11,"social_golfer_40x10x10_seed_4_unique_contacts":599,"social_golfer_40x10x10_seed_4_best_conflict_positions":4,"social_golfer_40x10x10_seed_4_runtime_seconds":60.000513258000005,"social_golfer_40x10x11_seed_1_final_score":77,"social_golfer_40x10x11_seed_1_unique_contacts":653,"social_golfer_40x10x11_seed_1_best_conflict_positions":25,"social_golfer_40x10x11_seed_1_runtime_seconds":120.00027552,"social_golfer_40x10x11_seed_2_final_score":128,"social_golfer_40x10x11_seed_2_unique_contacts":652,"social_golfer_40x10x11_seed_2_best_conflict_positions":24,"social_golfer_40x10x11_seed_2_runtime_seconds":120.001634521,"social_golfer_40x10x11_seed_3_final_score":77,"social_golfer_40x10x11_seed_3_unique_contacts":653,"social_golfer_40x10x11_seed_3_best_conflict_positions":28,"social_golfer_40x10x11_seed_3_runtime_seconds":120.000549283,"social_golfer_40x10x11_seed_4_final_score":66,"social_golfer_40x10x11_seed_4_unique_contacts":654,"social_golfer_40x10x11_seed_4_best_conflict_positions":23,"social_golfer_40x10x11_seed_4_runtime_seconds":119.99990443899999},"status":"discard","description":"Activated the new active-repeated-pair guidance one step earlier in stagnation (after 1 non-improving iteration instead of 2). That overreached: it hurt the broader p=4 stretch bundle and reduced solved runs.","timestamp":1776299882309,"segment":3,"confidence":81.56,"iterationTokens":12649,"asi":{"hypothesis":"If the guarded active-repeated-pair signal was helpful only late, perhaps turning it on slightly earlier after the first non-improving iteration would help plateau cases sooner without disturbing easy descents too much.","rollback_reason":"Earlier activation regressed mean_final_score from 101.95 to 112.2 and reduced solved_runs from 5 to 4, so the guidance becomes too aggressive when it starts after only one stagnant iteration.","observations":{"kept_commit":"165fe33","kept_mean_final_score":101.95,"experiment_mean_final_score":112.2,"kept_solved_runs":5,"experiment_solved_runs":4,"32x8x10_scores":[0,0,176,176],"36x9x10_scores":[66,77,108,130],"36x9x11_scores":[335,304,304,198]},"learned_tradeoff":"The active-repeated-pair signal is useful as a late tie-breaker but harmful when it starts influencing medium-stagnation states; the threshold itself matters materially.","next_action_hint":"Keep the >=2 stagnation threshold and explore orthogonal generic ideas next, likely gentle constructor diversity or a different late-only signal that targets hard cases without broadening influence earlier in the search."}}
