{"run":14,"commit":"0c2b168","metric":115,"metrics":{"best_final_score":0,"worst_final_score":300,"mean_unique_contacts":565.8,"best_unique_contacts":654,"worst_unique_contacts":464,"solved_runs":2,"mean_best_conflict_positions":31.5,"best_best_conflict_positions":0,"runtime_total_seconds":390.0840522,"social_golfer_32x8x10_seed_1_final_score":176,"social_golfer_32x8x10_seed_1_unique_contacts":464,"social_golfer_32x8x10_seed_1_best_conflict_positions":64,"social_golfer_32x8x10_seed_1_runtime_seconds":60.00026071399999,"social_golfer_32x8x10_seed_2_final_score":0,"social_golfer_32x8x10_seed_2_unique_contacts":480,"social_golfer_32x8x10_seed_2_best_conflict_positions":0,"social_golfer_32x8x10_seed_2_runtime_seconds":0.8974865409999999,"social_golfer_32x8x10_seed_3_final_score":176,"social_golfer_32x8x10_seed_3_unique_contacts":464,"social_golfer_32x8x10_seed_3_best_conflict_positions":64,"social_golfer_32x8x10_seed_3_runtime_seconds":60.001647563000006,"social_golfer_32x8x10_seed_4_final_score":66,"social_golfer_32x8x10_seed_4_unique_contacts":474,"social_golfer_32x8x10_seed_4_best_conflict_positions":24,"social_golfer_32x8x10_seed_4_runtime_seconds":60.000096657,"social_golfer_36x9x10_seed_1_final_score":77,"social_golfer_36x9x10_seed_1_unique_contacts":533,"social_golfer_36x9x10_seed_1_best_conflict_positions":25,"social_golfer_36x9x10_seed_1_runtime_seconds":60.000236341999994,"social_golfer_36x9x10_seed_2_final_score":170,"social_golfer_36x9x10_seed_2_unique_contacts":530,"social_golfer_36x9x10_seed_2_best_conflict_positions":29,"social_golfer_36x9x10_seed_2_runtime_seconds":60.000060121,"social_golfer_36x9x10_seed_3_final_score":108,"social_golfer_36x9x10_seed_3_unique_contacts":532,"social_golfer_36x9x10_seed_3_best_conflict_positions":28,"social_golfer_36x9x10_seed_3_runtime_seconds":60.001368598999996,"social_golfer_36x9x10_seed_4_final_score":119,"social_golfer_36x9x10_seed_4_unique_contacts":531,"social_golfer_36x9x10_seed_4_best_conflict_positions":32,"social_golfer_36x9x10_seed_4_runtime_seconds":60.001089974,"social_golfer_36x9x11_seed_1_final_score":300,"social_golfer_36x9x11_seed_1_unique_contacts":574,"social_golfer_36x9x11_seed_1_best_conflict_positions":58,"social_golfer_36x9x11_seed_1_runtime_seconds":89.999864031,"social_golfer_36x9x11_seed_2_final_score":240,"social_golfer_36x9x11_seed_2_unique_contacts":574,"social_golfer_36x9x11_seed_2_best_conflict_positions":66,"social_golfer_36x9x11_seed_2_runtime_seconds":90.000225846,"social_golfer_36x9x11_seed_3_final_score":249,"social_golfer_36x9x11_seed_3_unique_contacts":575,"social_golfer_36x9x11_seed_3_best_conflict_positions":65,"social_golfer_36x9x11_seed_3_runtime_seconds":90.000497785,"social_golfer_36x9x11_seed_4_final_score":269,"social_golfer_36x9x11_seed_4_unique_contacts":575,"social_golfer_36x9x11_seed_4_best_conflict_positions":60,"social_golfer_36x9x11_seed_4_runtime_seconds":89.999979528,"social_golfer_40x10x10_seed_1_final_score":11,"social_golfer_40x10x10_seed_1_unique_contacts":599,"social_golfer_40x10x10_seed_1_best_conflict_positions":4,"social_golfer_40x10x10_seed_1_runtime_seconds":60.000295626,"social_golfer_40x10x10_seed_2_final_score":11,"social_golfer_40x10x10_seed_2_unique_contacts":599,"social_golfer_40x10x10_seed_2_best_conflict_positions":4,"social_golfer_40x10x10_seed_2_runtime_seconds":60.000554717,"social_golfer_40x10x10_seed_3_final_score":0,"social_golfer_40x10x10_seed_3_unique_contacts":600,"social_golfer_40x10x10_seed_3_best_conflict_positions":0,"social_golfer_40x10x10_seed_3_runtime_seconds":39.958049489,"social_golfer_40x10x10_seed_4_final_score":11,"social_golfer_40x10x10_seed_4_unique_contacts":599,"social_golfer_40x10x10_seed_4_best_conflict_positions":4,"social_golfer_40x10x10_seed_4_runtime_seconds":60.000843314,"social_golfer_40x10x11_seed_1_final_score":66,"social_golfer_40x10x11_seed_1_unique_contacts":654,"social_golfer_40x10x11_seed_1_best_conflict_positions":24,"social_golfer_40x10x11_seed_1_runtime_seconds":120.00150293399999,"social_golfer_40x10x11_seed_2_final_score":97,"social_golfer_40x10x11_seed_2_unique_contacts":653,"social_golfer_40x10x11_seed_2_best_conflict_positions":26,"social_golfer_40x10x11_seed_2_runtime_seconds":120.001151585,"social_golfer_40x10x11_seed_3_final_score":77,"social_golfer_40x10x11_seed_3_unique_contacts":653,"social_golfer_40x10x11_seed_3_best_conflict_positions":28,"social_golfer_40x10x11_seed_3_runtime_seconds":120.00010856699998,"social_golfer_40x10x11_seed_4_final_score":77,"social_golfer_40x10x11_seed_4_unique_contacts":653,"social_golfer_40x10x11_seed_4_best_conflict_positions":25,"social_golfer_40x10x11_seed_4_runtime_seconds":120.000486068},"status":"discard","description":"Tried a lighter solver3-inspired generalization: keep the existing breakout operator, but bias breakout position choice toward the highest-incident conflict slots within the selected max-conflict week instead of choosing uniformly among conflicted slots. This was more robust than whole-week repair, but still regressed the expanded p=4 bundle relative to baseline.","timestamp":1776293819075,"segment":3,"confidence":33.32835820895528,"iterationTokens":22013,"asi":{"hypothesis":"A smaller solver3-style guidance signal should help more generally than the failed whole-week rebuild: if breakout swaps target the highest-incident conflict slots inside the worst week, they may escape heavy corridors without collapsing solved seeds.","rollback_reason":"The incident-burden breakout targeting was directionally saner than week-repair but still worsened the bundle mean from 111.65 to 115.0, while reducing solved runs from 3 to 2.","observations":{"baseline_mean_final_score":111.65,"experiment_mean_final_score":115,"baseline_solved_runs":3,"experiment_solved_runs":2,"32x8x10_scores":[176,0,176,66],"36x9x11_scores":[300,240,249,269]},"learned_tradeoff":"More aggressive burden targeting helps some hard seeds and larger cases, but it destabilizes already-solved easy seeds; the breakout operator is sensitive to over-guidance.","next_action_hint":"Keep the existing breakout targeting and instead explore guidance inside move selection, such as widening the neighborhood or candidate ordering around the highest-burden repeated pairs while leaving breakout stochasticity mostly intact."}}
{"run":15,"commit":"0c2b168","metric":114.55,"metrics":{"best_final_score":0,"worst_final_score":357,"mean_unique_contacts":565.75,"best_unique_contacts":655,"worst_unique_contacts":464,"solved_runs":3,"mean_best_conflict_positions":31.25,"best_best_conflict_positions":0,"runtime_total_seconds":390.079996916,"social_golfer_32x8x10_seed_1_final_score":0,"social_golfer_32x8x10_seed_1_unique_contacts":480,"social_golfer_32x8x10_seed_1_best_conflict_positions":0,"social_golfer_32x8x10_seed_1_runtime_seconds":7.403718553,"social_golfer_32x8x10_seed_2_final_score":88,"social_golfer_32x8x10_seed_2_unique_contacts":472,"social_golfer_32x8x10_seed_2_best_conflict_positions":32,"social_golfer_32x8x10_seed_2_runtime_seconds":60.001382948,"social_golfer_32x8x10_seed_3_final_score":176,"social_golfer_32x8x10_seed_3_unique_contacts":464,"social_golfer_32x8x10_seed_3_best_conflict_positions":64,"social_golfer_32x8x10_seed_3_runtime_seconds":60.001647405,"social_golfer_32x8x10_seed_4_final_score":88,"social_golfer_32x8x10_seed_4_unique_contacts":472,"social_golfer_32x8x10_seed_4_best_conflict_positions":32,"social_golfer_32x8x10_seed_4_runtime_seconds":60.000106013999996,"social_golfer_36x9x10_seed_1_final_score":77,"social_golfer_36x9x10_seed_1_unique_contacts":533,"social_golfer_36x9x10_seed_1_best_conflict_positions":27,"social_golfer_36x9x10_seed_1_runtime_seconds":60.001194092999995,"social_golfer_36x9x10_seed_2_final_score":119,"social_golfer_36x9x10_seed_2_unique_contacts":531,"social_golfer_36x9x10_seed_2_best_conflict_positions":26,"social_golfer_36x9x10_seed_2_runtime_seconds":60.00028562799999,"social_golfer_36x9x10_seed_3_final_score":77,"social_golfer_36x9x10_seed_3_unique_contacts":533,"social_golfer_36x9x10_seed_3_best_conflict_positions":27,"social_golfer_36x9x10_seed_3_runtime_seconds":60.001061787000005,"social_golfer_36x9x10_seed_4_final_score":97,"social_golfer_36x9x10_seed_4_unique_contacts":533,"social_golfer_36x9x10_seed_4_best_conflict_positions":24,"social_golfer_36x9x10_seed_4_runtime_seconds":60.001222860999995,"social_golfer_36x9x11_seed_1_final_score":291,"social_golfer_36x9x11_seed_1_unique_contacts":573,"social_golfer_36x9x11_seed_1_best_conflict_positions":71,"social_golfer_36x9x11_seed_1_runtime_seconds":90.001282664,"social_golfer_36x9x11_seed_2_final_score":229,"social_golfer_36x9x11_seed_2_unique_contacts":575,"social_golfer_36x9x11_seed_2_best_conflict_positions":65,"social_golfer_36x9x11_seed_2_runtime_seconds":90.004023421,"social_golfer_36x9x11_seed_3_final_score":280,"social_golfer_36x9x11_seed_3_unique_contacts":574,"social_golfer_36x9x11_seed_3_best_conflict_positions":65,"social_golfer_36x9x11_seed_3_runtime_seconds":90.001129499,"social_golfer_36x9x11_seed_4_final_score":357,"social_golfer_36x9x11_seed_4_unique_contacts":567,"social_golfer_36x9x11_seed_4_best_conflict_positions":76,"social_golfer_36x9x11_seed_4_runtime_seconds":90.00499099299999,"social_golfer_40x10x10_seed_1_final_score":0,"social_golfer_40x10x10_seed_1_unique_contacts":600,"social_golfer_40x10x10_seed_1_best_conflict_positions":0,"social_golfer_40x10x10_seed_1_runtime_seconds":33.808961809,"social_golfer_40x10x10_seed_2_final_score":11,"social_golfer_40x10x10_seed_2_unique_contacts":599,"social_golfer_40x10x10_seed_2_best_conflict_positions":4,"social_golfer_40x10x10_seed_2_runtime_seconds":60.00012987299999,"social_golfer_40x10x10_seed_3_final_score":0,"social_golfer_40x10x10_seed_3_unique_contacts":600,"social_golfer_40x10x10_seed_3_best_conflict_positions":0,"social_golfer_40x10x10_seed_3_runtime_seconds":2.829282977,"social_golfer_40x10x10_seed_4_final_score":22,"social_golfer_40x10x10_seed_4_unique_contacts":598,"social_golfer_40x10x10_seed_4_best_conflict_positions":7,"social_golfer_40x10x10_seed_4_runtime_seconds":60.00008528,"social_golfer_40x10x11_seed_1_final_score":55,"social_golfer_40x10x11_seed_1_unique_contacts":655,"social_golfer_40x10x11_seed_1_best_conflict_positions":20,"social_golfer_40x10x11_seed_1_runtime_seconds":120.001165538,"social_golfer_40x10x11_seed_2_final_score":77,"social_golfer_40x10x11_seed_2_unique_contacts":653,"social_golfer_40x10x11_seed_2_best_conflict_positions":24,"social_golfer_40x10x11_seed_2_runtime_seconds":120.001289117,"social_golfer_40x10x11_seed_3_final_score":150,"social_golfer_40x10x11_seed_3_unique_contacts":650,"social_golfer_40x10x11_seed_3_best_conflict_positions":35,"social_golfer_40x10x11_seed_3_runtime_seconds":119.999995756,"social_golfer_40x10x11_seed_4_final_score":97,"social_golfer_40x10x11_seed_4_unique_contacts":653,"social_golfer_40x10x11_seed_4_best_conflict_positions":26,"social_golfer_40x10x11_seed_4_runtime_seconds":120.000612477},"status":"discard","description":"Tried a solver3-style diversification inside move selection rather than breakout: when the search has already stagnated, choose randomly among swaps tied on the main preview tuple (conflict positions, repeat excess, max weekly conflict) instead of always taking the lexicographically smallest one. This preserved 3 solved runs but still slightly regressed the expanded bundle mean.","timestamp":1776294454054,"segment":3,"confidence":66.65671641791027,"iterationTokens":21249,"asi":{"hypothesis":"A little solver3-like stochasticity inside the tied move set should diversify plateau traversal without oversteering breakout behavior: only randomize among fully tied top swaps after the search has already stopped improving for a while.","rollback_reason":"The tied-swap randomization kept the run broadly competitive but still worsened the mean from 111.65 to 114.55, so it did not clear the primary metric.","observations":{"baseline_mean_final_score":111.65,"experiment_mean_final_score":114.55,"baseline_solved_runs":3,"experiment_solved_runs":3,"32x8x10_scores":[0,88,176,88],"40x10x11_scores":[55,77,150,97]},"learned_tradeoff":"Injecting randomness into tied local-search moves is less destructive than breakout over-guidance, but it still perturbs easy solved seeds enough to lose bundle mean.","next_action_hint":"Resume from the reverted baseline and look for a more structural but still general move-quality signal, likely something that helps distinguish tied swaps by future repairability instead of adding more randomness."}}
{"run":16,"commit":"0c2b168","metric":113.1,"metrics":{"best_final_score":0,"worst_final_score":419,"mean_unique_contacts":565.7,"best_unique_contacts":654,"worst_unique_contacts":464,"solved_runs":3,"mean_best_conflict_positions":31.2,"best_best_conflict_positions":0,"runtime_total_seconds":390.088752002,"social_golfer_32x8x10_seed_1_final_score":0,"social_golfer_32x8x10_seed_1_unique_contacts":480,"social_golfer_32x8x10_seed_1_best_conflict_positions":0,"social_golfer_32x8x10_seed_1_runtime_seconds":4.911500338000001,"social_golfer_32x8x10_seed_2_final_score":0,"social_golfer_32x8x10_seed_2_unique_contacts":480,"social_golfer_32x8x10_seed_2_best_conflict_positions":0,"social_golfer_32x8x10_seed_2_runtime_seconds":1.005292834,"social_golfer_32x8x10_seed_3_final_score":176,"social_golfer_32x8x10_seed_3_unique_contacts":464,"social_golfer_32x8x10_seed_3_best_conflict_positions":64,"social_golfer_32x8x10_seed_3_runtime_seconds":60.002030595,"social_golfer_32x8x10_seed_4_final_score":176,"social_golfer_32x8x10_seed_4_unique_contacts":464,"social_golfer_32x8x10_seed_4_best_conflict_positions":64,"social_golfer_32x8x10_seed_4_runtime_seconds":60.001534282,"social_golfer_36x9x10_seed_1_final_score":88,"social_golfer_36x9x10_seed_1_unique_contacts":532,"social_golfer_36x9x10_seed_1_best_conflict_positions":26,"social_golfer_36x9x10_seed_1_runtime_seconds":60.001252856,"social_golfer_36x9x10_seed_2_final_score":66,"social_golfer_36x9x10_seed_2_unique_contacts":534,"social_golfer_36x9x10_seed_2_best_conflict_positions":23,"social_golfer_36x9x10_seed_2_runtime_seconds":60.000500982,"social_golfer_36x9x10_seed_3_final_score":108,"social_golfer_36x9x10_seed_3_unique_contacts":532,"social_golfer_36x9x10_seed_3_best_conflict_positions":29,"social_golfer_36x9x10_seed_3_runtime_seconds":60.002531006000005,"social_golfer_36x9x10_seed_4_final_score":86,"social_golfer_36x9x10_seed_4_unique_contacts":534,"social_golfer_36x9x10_seed_4_best_conflict_positions":22,"social_golfer_36x9x10_seed_4_runtime_seconds":60.00041377,"social_golfer_36x9x11_seed_1_final_score":313,"social_golfer_36x9x11_seed_1_unique_contacts":571,"social_golfer_36x9x11_seed_1_best_conflict_positions":62,"social_golfer_36x9x11_seed_1_runtime_seconds":90.000696266,"social_golfer_36x9x11_seed_2_final_score":419,"social_golfer_36x9x11_seed_2_unique_contacts":565,"social_golfer_36x9x11_seed_2_best_conflict_positions":90,"social_golfer_36x9x11_seed_2_runtime_seconds":90.000891495,"social_golfer_36x9x11_seed_3_final_score":262,"social_golfer_36x9x11_seed_3_unique_contacts":572,"social_golfer_36x9x11_seed_3_best_conflict_positions":75,"social_golfer_36x9x11_seed_3_runtime_seconds":90.002306027,"social_golfer_36x9x11_seed_4_final_score":249,"social_golfer_36x9x11_seed_4_unique_contacts":575,"social_golfer_36x9x11_seed_4_best_conflict_positions":63,"social_golfer_36x9x11_seed_4_runtime_seconds":90.00502379000001,"social_golfer_40x10x10_seed_1_final_score":0,"social_golfer_40x10x10_seed_1_unique_contacts":600,"social_golfer_40x10x10_seed_1_best_conflict_positions":0,"social_golfer_40x10x10_seed_1_runtime_seconds":2.49632975,"social_golfer_40x10x10_seed_2_final_score":11,"social_golfer_40x10x10_seed_2_unique_contacts":599,"social_golfer_40x10x10_seed_2_best_conflict_positions":4,"social_golfer_40x10x10_seed_2_runtime_seconds":59.999907374,"social_golfer_40x10x10_seed_3_final_score":11,"social_golfer_40x10x10_seed_3_unique_contacts":599,"social_golfer_40x10x10_seed_3_best_conflict_positions":4,"social_golfer_40x10x10_seed_3_runtime_seconds":60.000956548,"social_golfer_40x10x10_seed_4_final_score":11,"social_golfer_40x10x10_seed_4_unique_contacts":599,"social_golfer_40x10x10_seed_4_best_conflict_positions":4,"social_golfer_40x10x10_seed_4_runtime_seconds":60.000169490999994,"social_golfer_40x10x11_seed_1_final_score":66,"social_golfer_40x10x11_seed_1_unique_contacts":654,"social_golfer_40x10x11_seed_1_best_conflict_positions":22,"social_golfer_40x10x11_seed_1_runtime_seconds":120.00044426900001,"social_golfer_40x10x11_seed_2_final_score":66,"social_golfer_40x10x11_seed_2_unique_contacts":654,"social_golfer_40x10x11_seed_2_best_conflict_positions":24,"social_golfer_40x10x11_seed_2_runtime_seconds":120.00011724100001,"social_golfer_40x10x11_seed_3_final_score":66,"social_golfer_40x10x11_seed_3_unique_contacts":654,"social_golfer_40x10x11_seed_3_best_conflict_positions":22,"social_golfer_40x10x11_seed_3_runtime_seconds":120.001592436,"social_golfer_40x10x11_seed_4_final_score":88,"social_golfer_40x10x11_seed_4_unique_contacts":652,"social_golfer_40x10x11_seed_4_best_conflict_positions":26,"social_golfer_40x10x11_seed_4_runtime_seconds":120.000472275},"status":"discard","description":"Tried a solver3-inspired move-quality signal instead of extra randomness: among swaps tied on conflict positions, repeat excess, and max weekly conflict, prefer moves that reduce the worst repeated-pair burden among the pairs touched by the swap. This helped some larger p=4 cases, but the bundle mean still regressed slightly because 32x8x10 seeds 3-4 stayed stuck and 36x9x11 seed 2 worsened.","timestamp":1776295218286,"segment":3,"confidence":76.99999999999986,"iterationTokens":20572,"asi":{"hypothesis":"A more structural solver3-style signal may beat extra randomness: among otherwise tied swaps, favor those that locally reduce the worst repeated-pair corridor touched by the move, which should improve future repairability across all pure-SGP cases.","rollback_reason":"The changed-pair burden tie-break was plausible and mildly helpful on 36x9x10 / 40x10x11, but it still raised the overall mean from 111.65 to 113.1 and badly worsened one 36x9x11 seed.","observations":{"baseline_mean_final_score":111.65,"experiment_mean_final_score":113.1,"baseline_solved_runs":3,"experiment_solved_runs":3,"32x8x10_scores":[0,0,176,176],"36x9x10_scores":[88,66,108,86],"36x9x11_scores":[313,419,262,249]},"learned_tradeoff":"Pair-burden-aware tie-breaking can help some mid-hard cases, but as a global ordering signal it still destabilizes the hardest bundle member more than it helps.","next_action_hint":"Keep the baseline local-search ordering and try a truly orthogonal diversification mechanism next, likely a very lightweight elite-week transplant or another constructor-side diversity change that does not perturb solved seeds as aggressively."}}
