{"run":38,"commit":"d3f9887","metric":84.8,"metrics":{"best_final_score":0,"worst_final_score":313,"mean_unique_contacts":568,"best_unique_contacts":657,"worst_unique_contacts":480,"solved_runs":6,"mean_best_conflict_positions":22.2,"best_best_conflict_positions":0,"runtime_total_seconds":333.920276367,"social_golfer_32x8x10_seed_1_final_score":0,"social_golfer_32x8x10_seed_1_unique_contacts":480,"social_golfer_32x8x10_seed_1_best_conflict_positions":0,"social_golfer_32x8x10_seed_1_runtime_seconds":3.524482678,"social_golfer_32x8x10_seed_2_final_score":0,"social_golfer_32x8x10_seed_2_unique_contacts":480,"social_golfer_32x8x10_seed_2_best_conflict_positions":0,"social_golfer_32x8x10_seed_2_runtime_seconds":3.854065231,"social_golfer_32x8x10_seed_3_final_score":0,"social_golfer_32x8x10_seed_3_unique_contacts":480,"social_golfer_32x8x10_seed_3_best_conflict_positions":0,"social_golfer_32x8x10_seed_3_runtime_seconds":3.245468718,"social_golfer_32x8x10_seed_4_final_score":0,"social_golfer_32x8x10_seed_4_unique_contacts":480,"social_golfer_32x8x10_seed_4_best_conflict_positions":0,"social_golfer_32x8x10_seed_4_runtime_seconds":1.9395832830000002,"social_golfer_36x9x10_seed_1_final_score":88,"social_golfer_36x9x10_seed_1_unique_contacts":532,"social_golfer_36x9x10_seed_1_best_conflict_positions":26,"social_golfer_36x9x10_seed_1_runtime_seconds":60.001176535000006,"social_golfer_36x9x10_seed_2_final_score":77,"social_golfer_36x9x10_seed_2_unique_contacts":533,"social_golfer_36x9x10_seed_2_best_conflict_positions":21,"social_golfer_36x9x10_seed_2_runtime_seconds":60.000021604000004,"social_golfer_36x9x10_seed_3_final_score":86,"social_golfer_36x9x10_seed_3_unique_contacts":534,"social_golfer_36x9x10_seed_3_best_conflict_positions":22,"social_golfer_36x9x10_seed_3_runtime_seconds":60.000808116,"social_golfer_36x9x10_seed_4_final_score":77,"social_golfer_36x9x10_seed_4_unique_contacts":533,"social_golfer_36x9x10_seed_4_best_conflict_positions":25,"social_golfer_36x9x10_seed_4_runtime_seconds":60.000291905,"social_golfer_36x9x11_seed_1_final_score":251,"social_golfer_36x9x11_seed_1_unique_contacts":573,"social_golfer_36x9x11_seed_1_best_conflict_positions":64,"social_golfer_36x9x11_seed_1_runtime_seconds":90.003087908,"social_golfer_36x9x11_seed_2_final_score":271,"social_golfer_36x9x11_seed_2_unique_contacts":573,"social_golfer_36x9x11_seed_2_best_conflict_positions":66,"social_golfer_36x9x11_seed_2_runtime_seconds":89.999942506,"social_golfer_36x9x11_seed_3_final_score":271,"social_golfer_36x9x11_seed_3_unique_contacts":573,"social_golfer_36x9x11_seed_3_best_conflict_positions":68,"social_golfer_36x9x11_seed_3_runtime_seconds":90.000341734,"social_golfer_36x9x11_seed_4_final_score":313,"social_golfer_36x9x11_seed_4_unique_contacts":571,"social_golfer_36x9x11_seed_4_best_conflict_positions":69,"social_golfer_36x9x11_seed_4_runtime_seconds":90.000297259,"social_golfer_40x10x10_seed_1_final_score":0,"social_golfer_40x10x10_seed_1_unique_contacts":600,"social_golfer_40x10x10_seed_1_best_conflict_positions":0,"social_golfer_40x10x10_seed_1_runtime_seconds":19.103605137000002,"social_golfer_40x10x10_seed_2_final_score":0,"social_golfer_40x10x10_seed_2_unique_contacts":600,"social_golfer_40x10x10_seed_2_best_conflict_positions":0,"social_golfer_40x10x10_seed_2_runtime_seconds":27.866272161,"social_golfer_40x10x10_seed_3_final_score":11,"social_golfer_40x10x10_seed_3_unique_contacts":599,"social_golfer_40x10x10_seed_3_best_conflict_positions":4,"social_golfer_40x10x10_seed_3_runtime_seconds":60.001580441,"social_golfer_40x10x10_seed_4_final_score":11,"social_golfer_40x10x10_seed_4_unique_contacts":599,"social_golfer_40x10x10_seed_4_best_conflict_positions":4,"social_golfer_40x10x10_seed_4_runtime_seconds":60.002113355,"social_golfer_40x10x11_seed_1_final_score":86,"social_golfer_40x10x11_seed_1_unique_contacts":654,"social_golfer_40x10x11_seed_1_best_conflict_positions":22,"social_golfer_40x10x11_seed_1_runtime_seconds":120.002481433,"social_golfer_40x10x11_seed_2_final_score":33,"social_golfer_40x10x11_seed_2_unique_contacts":657,"social_golfer_40x10x11_seed_2_best_conflict_positions":12,"social_golfer_40x10x11_seed_2_runtime_seconds":120.00244938,"social_golfer_40x10x11_seed_3_final_score":66,"social_golfer_40x10x11_seed_3_unique_contacts":654,"social_golfer_40x10x11_seed_3_best_conflict_positions":21,"social_golfer_40x10x11_seed_3_runtime_seconds":120.000040341,"social_golfer_40x10x11_seed_4_final_score":55,"social_golfer_40x10x11_seed_4_unique_contacts":655,"social_golfer_40x10x11_seed_4_best_conflict_positions":20,"social_golfer_40x10x11_seed_4_runtime_seconds":119.99995014699999},"status":"keep","description":"Counted stagnation against best-so-far improvements instead of any current-step conflict improvement. This lets late repeat-guidance and breakout stay active while the search is still circling below the incumbent best basin, and it produced a major bundle improvement.","timestamp":1776313022495,"segment":3,"confidence":14.372881355932188,"iterationTokens":11941,"asi":{"hypothesis":"The stagnation counter may be too forgiving because it resets on any current-step conflict improvement, even when the search is still below the incumbent best. Resetting only on best-so-far improvement could let the existing late guidance and breakout engage sooner on false-progress plateaus.","observations":{"previous_best_commit":"d8ffdef","previous_best_mean_final_score":91.25,"experiment_mean_final_score":84.8,"previous_best_solved_runs":6,"experiment_solved_runs":6,"32x8x10_scores":[0,0,0,0],"36x9x10_scores":[88,77,86,77],"36x9x11_scores":[251,271,271,313],"40x10x11_scores":[86,33,66,55],"runtime_total_seconds":333.920276367},"learned_tradeoff":"This is a strong generic improvement. The solver benefits from treating below-best recovery moves as continued stagnation, which preserves pressure for late guidance and breakout instead of over-crediting local downhill motion.","next_action_hint":"Use best-so-far stagnation counting as the new baseline. Future experiments can build on this plateau semantics, but avoid reintroducing stale scalar threshold changes or constructor screening."}}
{"run":39,"commit":"d3f9887","metric":106.1,"metrics":{"best_final_score":0,"worst_final_score":366,"mean_unique_contacts":566.7,"best_unique_contacts":654,"worst_unique_contacts":474,"solved_runs":3,"mean_best_conflict_positions":25.8,"best_best_conflict_positions":0,"runtime_total_seconds":390.104881562,"social_golfer_32x8x10_seed_1_final_score":66,"social_golfer_32x8x10_seed_1_unique_contacts":474,"social_golfer_32x8x10_seed_1_best_conflict_positions":24,"social_golfer_32x8x10_seed_1_runtime_seconds":59.999995461,"social_golfer_32x8x10_seed_2_final_score":0,"social_golfer_32x8x10_seed_2_unique_contacts":480,"social_golfer_32x8x10_seed_2_best_conflict_positions":0,"social_golfer_32x8x10_seed_2_runtime_seconds":15.381827335999999,"social_golfer_32x8x10_seed_3_final_score":66,"social_golfer_32x8x10_seed_3_unique_contacts":474,"social_golfer_32x8x10_seed_3_best_conflict_positions":24,"social_golfer_32x8x10_seed_3_runtime_seconds":60.001418183999995,"social_golfer_32x8x10_seed_4_final_score":0,"social_golfer_32x8x10_seed_4_unique_contacts":480,"social_golfer_32x8x10_seed_4_best_conflict_positions":0,"social_golfer_32x8x10_seed_4_runtime_seconds":7.7892078829999996,"social_golfer_36x9x10_seed_1_final_score":66,"social_golfer_36x9x10_seed_1_unique_contacts":534,"social_golfer_36x9x10_seed_1_best_conflict_positions":23,"social_golfer_36x9x10_seed_1_runtime_seconds":60.000111502,"social_golfer_36x9x10_seed_2_final_score":77,"social_golfer_36x9x10_seed_2_unique_contacts":533,"social_golfer_36x9x10_seed_2_best_conflict_positions":27,"social_golfer_36x9x10_seed_2_runtime_seconds":60.000658124,"social_golfer_36x9x10_seed_3_final_score":66,"social_golfer_36x9x10_seed_3_unique_contacts":534,"social_golfer_36x9x10_seed_3_best_conflict_positions":23,"social_golfer_36x9x10_seed_3_runtime_seconds":60.002479994,"social_golfer_36x9x10_seed_4_final_score":201,"social_golfer_36x9x10_seed_4_unique_contacts":529,"social_golfer_36x9x10_seed_4_best_conflict_positions":25,"social_golfer_36x9x10_seed_4_runtime_seconds":60.001199075,"social_golfer_36x9x11_seed_1_final_score":302,"social_golfer_36x9x11_seed_1_unique_contacts":572,"social_golfer_36x9x11_seed_1_best_conflict_positions":66,"social_golfer_36x9x11_seed_1_runtime_seconds":90.003011554,"social_golfer_36x9x11_seed_2_final_score":231,"social_golfer_36x9x11_seed_2_unique_contacts":573,"social_golfer_36x9x11_seed_2_best_conflict_positions":65,"social_golfer_36x9x11_seed_2_runtime_seconds":90.00217781900001,"social_golfer_36x9x11_seed_3_final_score":366,"social_golfer_36x9x11_seed_3_unique_contacts":568,"social_golfer_36x9x11_seed_3_best_conflict_positions":72,"social_golfer_36x9x11_seed_3_runtime_seconds":90.004771904,"social_golfer_36x9x11_seed_4_final_score":260,"social_golfer_36x9x11_seed_4_unique_contacts":574,"social_golfer_36x9x11_seed_4_best_conflict_positions":67,"social_golfer_36x9x11_seed_4_runtime_seconds":90.00036102499999,"social_golfer_40x10x10_seed_1_final_score":0,"social_golfer_40x10x10_seed_1_unique_contacts":600,"social_golfer_40x10x10_seed_1_best_conflict_positions":0,"social_golfer_40x10x10_seed_1_runtime_seconds":14.759159313,"social_golfer_40x10x10_seed_2_final_score":11,"social_golfer_40x10x10_seed_2_unique_contacts":599,"social_golfer_40x10x10_seed_2_best_conflict_positions":4,"social_golfer_40x10x10_seed_2_runtime_seconds":60.001050473,"social_golfer_40x10x10_seed_3_final_score":11,"social_golfer_40x10x10_seed_3_unique_contacts":599,"social_golfer_40x10x10_seed_3_best_conflict_positions":4,"social_golfer_40x10x10_seed_3_runtime_seconds":60.000649874,"social_golfer_40x10x10_seed_4_final_score":11,"social_golfer_40x10x10_seed_4_unique_contacts":599,"social_golfer_40x10x10_seed_4_best_conflict_positions":4,"social_golfer_40x10x10_seed_4_runtime_seconds":60.000605195999995,"social_golfer_40x10x11_seed_1_final_score":139,"social_golfer_40x10x11_seed_1_unique_contacts":651,"social_golfer_40x10x11_seed_1_best_conflict_positions":25,"social_golfer_40x10x11_seed_1_runtime_seconds":120.000677774,"social_golfer_40x10x11_seed_2_final_score":86,"social_golfer_40x10x11_seed_2_unique_contacts":654,"social_golfer_40x10x11_seed_2_best_conflict_positions":21,"social_golfer_40x10x11_seed_2_runtime_seconds":120.000467523,"social_golfer_40x10x11_seed_3_final_score":97,"social_golfer_40x10x11_seed_3_unique_contacts":653,"social_golfer_40x10x11_seed_3_best_conflict_positions":24,"social_golfer_40x10x11_seed_3_runtime_seconds":120.001198188,"social_golfer_40x10x11_seed_4_final_score":66,"social_golfer_40x10x11_seed_4_unique_contacts":654,"social_golfer_40x10x11_seed_4_best_conflict_positions":18,"social_golfer_40x10x11_seed_4_runtime_seconds":120.00071973600001},"status":"discard","description":"Tried a softer stagnation rule: best-so-far improvements still reset the counter, but current-step improvements below the incumbent only decay the counter by one instead of leaving it unchanged. This was too soft and regressed the bundle.","timestamp":1776314162514,"segment":3,"confidence":14.812227074235786,"iterationTokens":14649,"asi":{"hypothesis":"Best-so-far stagnation counting helped a lot, but maybe full persistence through below-best recovery moves is slightly too aggressive. A partial decay on current-step improvement could preserve most of the pressure while relaxing it a bit during real descent.","rollback_reason":"That relaxation was too soft. mean_final_score regressed from 84.8 to 106.1 and solved_runs fell from 6 to 3.","observations":{"kept_commit":"d3f9887","kept_mean_final_score":84.8,"experiment_mean_final_score":106.1,"kept_solved_runs":6,"experiment_solved_runs":3,"32x8x10_scores":[66,0,66,0],"36x9x10_scores":[66,77,66,201]},"learned_tradeoff":"The new baseline needs the full best-so-far stagnation pressure. Even mild forgiveness for below-best recovery moves weakens the late guidance/breakout regime too much.","next_action_hint":"Keep strict best-so-far stagnation counting. Future experiments should leave this counter semantics intact and look elsewhere, likely at tabu interaction or other mild plateau-control mechanisms."}}
{"run":40,"commit":"d3f9887","metric":118.05,"metrics":{"best_final_score":0,"worst_final_score":379,"mean_unique_contacts":565.25,"best_unique_contacts":650,"worst_unique_contacts":480,"solved_runs":4,"mean_best_conflict_positions":31.35,"best_best_conflict_positions":0,"runtime_total_seconds":334.885797802,"social_golfer_32x8x10_seed_1_final_score":0,"social_golfer_32x8x10_seed_1_unique_contacts":480,"social_golfer_32x8x10_seed_1_best_conflict_positions":0,"social_golfer_32x8x10_seed_1_runtime_seconds":1.698478176,"social_golfer_32x8x10_seed_2_final_score":0,"social_golfer_32x8x10_seed_2_unique_contacts":480,"social_golfer_32x8x10_seed_2_best_conflict_positions":0,"social_golfer_32x8x10_seed_2_runtime_seconds":4.815987299,"social_golfer_32x8x10_seed_3_final_score":0,"social_golfer_32x8x10_seed_3_unique_contacts":480,"social_golfer_32x8x10_seed_3_best_conflict_positions":0,"social_golfer_32x8x10_seed_3_runtime_seconds":2.2561654360000003,"social_golfer_32x8x10_seed_4_final_score":0,"social_golfer_32x8x10_seed_4_unique_contacts":480,"social_golfer_32x8x10_seed_4_best_conflict_positions":0,"social_golfer_32x8x10_seed_4_runtime_seconds":1.321732342,"social_golfer_36x9x10_seed_1_final_score":88,"social_golfer_36x9x10_seed_1_unique_contacts":532,"social_golfer_36x9x10_seed_1_best_conflict_positions":28,"social_golfer_36x9x10_seed_1_runtime_seconds":60.002533078999996,"social_golfer_36x9x10_seed_2_final_score":121,"social_golfer_36x9x10_seed_2_unique_contacts":529,"social_golfer_36x9x10_seed_2_best_conflict_positions":33,"social_golfer_36x9x10_seed_2_runtime_seconds":60.001369548,"social_golfer_36x9x10_seed_3_final_score":88,"social_golfer_36x9x10_seed_3_unique_contacts":532,"social_golfer_36x9x10_seed_3_best_conflict_positions":30,"social_golfer_36x9x10_seed_3_runtime_seconds":60.001295262,"social_golfer_36x9x10_seed_4_final_score":119,"social_golfer_36x9x10_seed_4_unique_contacts":531,"social_golfer_36x9x10_seed_4_best_conflict_positions":32,"social_golfer_36x9x10_seed_4_runtime_seconds":60.001680916,"social_golfer_36x9x11_seed_1_final_score":326,"social_golfer_36x9x11_seed_1_unique_contacts":568,"social_golfer_36x9x11_seed_1_best_conflict_positions":83,"social_golfer_36x9x11_seed_1_runtime_seconds":90.00067874999999,"social_golfer_36x9x11_seed_2_final_score":315,"social_golfer_36x9x11_seed_2_unique_contacts":569,"social_golfer_36x9x11_seed_2_best_conflict_positions":80,"social_golfer_36x9x11_seed_2_runtime_seconds":90.00324091299998,"social_golfer_36x9x11_seed_3_final_score":253,"social_golfer_36x9x11_seed_3_unique_contacts":571,"social_golfer_36x9x11_seed_3_best_conflict_positions":80,"social_golfer_36x9x11_seed_3_runtime_seconds":90.006356338,"social_golfer_36x9x11_seed_4_final_score":379,"social_golfer_36x9x11_seed_4_unique_contacts":565,"social_golfer_36x9x11_seed_4_best_conflict_positions":79,"social_golfer_36x9x11_seed_4_runtime_seconds":90.001889104,"social_golfer_40x10x10_seed_1_final_score":22,"social_golfer_40x10x10_seed_1_unique_contacts":598,"social_golfer_40x10x10_seed_1_best_conflict_positions":8,"social_golfer_40x10x10_seed_1_runtime_seconds":60.000149541999996,"social_golfer_40x10x10_seed_2_final_score":33,"social_golfer_40x10x10_seed_2_unique_contacts":597,"social_golfer_40x10x10_seed_2_best_conflict_positions":12,"social_golfer_40x10x10_seed_2_runtime_seconds":60.000977537999994,"social_golfer_40x10x10_seed_3_final_score":64,"social_golfer_40x10x10_seed_3_unique_contacts":596,"social_golfer_40x10x10_seed_3_best_conflict_positions":14,"social_golfer_40x10x10_seed_3_runtime_seconds":60.000293889999995,"social_golfer_40x10x10_seed_4_final_score":11,"social_golfer_40x10x10_seed_4_unique_contacts":599,"social_golfer_40x10x10_seed_4_best_conflict_positions":4,"social_golfer_40x10x10_seed_4_runtime_seconds":60.000373111,"social_golfer_40x10x11_seed_1_final_score":130,"social_golfer_40x10x11_seed_1_unique_contacts":650,"social_golfer_40x10x11_seed_1_best_conflict_positions":37,"social_golfer_40x10x11_seed_1_runtime_seconds":120.001242198,"social_golfer_40x10x11_seed_2_final_score":152,"social_golfer_40x10x11_seed_2_unique_contacts":648,"social_golfer_40x10x11_seed_2_best_conflict_positions":38,"social_golfer_40x10x11_seed_2_runtime_seconds":120.002238752,"social_golfer_40x10x11_seed_3_final_score":130,"social_golfer_40x10x11_seed_3_unique_contacts":650,"social_golfer_40x10x11_seed_3_best_conflict_positions":34,"social_golfer_40x10x11_seed_3_runtime_seconds":120.00177275200001,"social_golfer_40x10x11_seed_4_final_score":130,"social_golfer_40x10x11_seed_4_unique_contacts":650,"social_golfer_40x10x11_seed_4_best_conflict_positions":35,"social_golfer_40x10x11_seed_4_runtime_seconds":120.00091146700001},"status":"discard","description":"Tried a broader tabu aspiration rule: allow tabu moves when they improve the current schedule even if they do not beat the global best. This badly weakened the bundle, especially larger cases.","timestamp":1776314882468,"segment":3,"confidence":14.372881355932188,"iterationTokens":19533,"asi":{"hypothesis":"With the new best-so-far stagnation semantics, tabu aspiration may still be too strict. Allowing tabu moves that improve the current schedule, even if they do not beat the global best, could help basin recovery under the stronger plateau pressure.","rollback_reason":"This weakened tabu too much. mean_final_score regressed from 84.8 to 118.05, and larger cases degraded sharply.","observations":{"kept_commit":"d3f9887","kept_mean_final_score":84.8,"experiment_mean_final_score":118.05,"kept_solved_runs":6,"experiment_solved_runs":4,"32x8x10_scores":[0,0,0,0],"36x9x11_scores":[326,315,253,379],"40x10x11_scores":[130,152,130,130]},"learned_tradeoff":"The new baseline needs strict tabu aspiration. Best-so-far stagnation pressure already increases search aggressiveness; broadening aspiration on top of that destabilizes larger-case search.","next_action_hint":"Keep tabu aspiration strict. Do not loosen it beyond best-beating moves. Future experiments should keep the new stagnation semantics but avoid broad tabu weakening."}}
