{"run":44,"commit":"fea1825","metric":79.4,"metrics":{"best_final_score":0,"worst_final_score":273,"mean_unique_contacts":568.4,"best_unique_contacts":655,"worst_unique_contacts":480,"solved_runs":6,"mean_best_conflict_positions":22.05,"best_best_conflict_positions":0,"runtime_total_seconds":336.146274136,"social_golfer_32x8x10_seed_1_final_score":0,"social_golfer_32x8x10_seed_1_unique_contacts":480,"social_golfer_32x8x10_seed_1_best_conflict_positions":0,"social_golfer_32x8x10_seed_1_runtime_seconds":3.6858047030000005,"social_golfer_32x8x10_seed_2_final_score":0,"social_golfer_32x8x10_seed_2_unique_contacts":480,"social_golfer_32x8x10_seed_2_best_conflict_positions":0,"social_golfer_32x8x10_seed_2_runtime_seconds":5.970253415,"social_golfer_32x8x10_seed_3_final_score":0,"social_golfer_32x8x10_seed_3_unique_contacts":480,"social_golfer_32x8x10_seed_3_best_conflict_positions":0,"social_golfer_32x8x10_seed_3_runtime_seconds":4.298493929,"social_golfer_32x8x10_seed_4_final_score":0,"social_golfer_32x8x10_seed_4_unique_contacts":480,"social_golfer_32x8x10_seed_4_best_conflict_positions":0,"social_golfer_32x8x10_seed_4_runtime_seconds":3.66701963,"social_golfer_36x9x10_seed_1_final_score":97,"social_golfer_36x9x10_seed_1_unique_contacts":533,"social_golfer_36x9x10_seed_1_best_conflict_positions":24,"social_golfer_36x9x10_seed_1_runtime_seconds":60.000575533,"social_golfer_36x9x10_seed_2_final_score":66,"social_golfer_36x9x10_seed_2_unique_contacts":534,"social_golfer_36x9x10_seed_2_best_conflict_positions":23,"social_golfer_36x9x10_seed_2_runtime_seconds":60.00269195799999,"social_golfer_36x9x10_seed_3_final_score":55,"social_golfer_36x9x10_seed_3_unique_contacts":535,"social_golfer_36x9x10_seed_3_best_conflict_positions":19,"social_golfer_36x9x10_seed_3_runtime_seconds":60.001641192,"social_golfer_36x9x10_seed_4_final_score":66,"social_golfer_36x9x10_seed_4_unique_contacts":534,"social_golfer_36x9x10_seed_4_best_conflict_positions":23,"social_golfer_36x9x10_seed_4_runtime_seconds":59.999969942,"social_golfer_36x9x11_seed_1_final_score":258,"social_golfer_36x9x11_seed_1_unique_contacts":576,"social_golfer_36x9x11_seed_1_best_conflict_positions":64,"social_golfer_36x9x11_seed_1_runtime_seconds":90.001850109,"social_golfer_36x9x11_seed_2_final_score":273,"social_golfer_36x9x11_seed_2_unique_contacts":571,"social_golfer_36x9x11_seed_2_best_conflict_positions":69,"social_golfer_36x9x11_seed_2_runtime_seconds":90.00168353000001,"social_golfer_36x9x11_seed_3_final_score":238,"social_golfer_36x9x11_seed_3_unique_contacts":576,"social_golfer_36x9x11_seed_3_best_conflict_positions":62,"social_golfer_36x9x11_seed_3_runtime_seconds":90.001595865,"social_golfer_36x9x11_seed_4_final_score":260,"social_golfer_36x9x11_seed_4_unique_contacts":574,"social_golfer_36x9x11_seed_4_best_conflict_positions":66,"social_golfer_36x9x11_seed_4_runtime_seconds":90.003477537,"social_golfer_40x10x10_seed_1_final_score":0,"social_golfer_40x10x10_seed_1_unique_contacts":600,"social_golfer_40x10x10_seed_1_best_conflict_positions":0,"social_golfer_40x10x10_seed_1_runtime_seconds":27.273738913000003,"social_golfer_40x10x10_seed_2_final_score":11,"social_golfer_40x10x10_seed_2_unique_contacts":599,"social_golfer_40x10x10_seed_2_best_conflict_positions":4,"social_golfer_40x10x10_seed_2_runtime_seconds":60.002159308,"social_golfer_40x10x10_seed_3_final_score":0,"social_golfer_40x10x10_seed_3_unique_contacts":600,"social_golfer_40x10x10_seed_3_best_conflict_positions":0,"social_golfer_40x10x10_seed_3_runtime_seconds":6.833535337,"social_golfer_40x10x10_seed_4_final_score":11,"social_golfer_40x10x10_seed_4_unique_contacts":599,"social_golfer_40x10x10_seed_4_best_conflict_positions":4,"social_golfer_40x10x10_seed_4_runtime_seconds":59.999984225,"social_golfer_40x10x11_seed_1_final_score":55,"social_golfer_40x10x11_seed_1_unique_contacts":655,"social_golfer_40x10x11_seed_1_best_conflict_positions":19,"social_golfer_40x10x11_seed_1_runtime_seconds":120.003091183,"social_golfer_40x10x11_seed_2_final_score":66,"social_golfer_40x10x11_seed_2_unique_contacts":654,"social_golfer_40x10x11_seed_2_best_conflict_positions":20,"social_golfer_40x10x11_seed_2_runtime_seconds":120.001442734,"social_golfer_40x10x11_seed_3_final_score":66,"social_golfer_40x10x11_seed_3_unique_contacts":654,"social_golfer_40x10x11_seed_3_best_conflict_positions":23,"social_golfer_40x10x11_seed_3_runtime_seconds":120.00128313399999,"social_golfer_40x10x11_seed_4_final_score":66,"social_golfer_40x10x11_seed_4_unique_contacts":654,"social_golfer_40x10x11_seed_4_best_conflict_positions":21,"social_golfer_40x10x11_seed_4_runtime_seconds":120.000732592},"status":"keep","description":"Increased solver4's week-local pair tabu tenure from 10 to 12 iterations under the best-so-far stagnation + 4+ late repeat-guidance regime. The stronger short-term memory improved the p=4 stretch bundle, especially larger hard cases.","timestamp":1776319262140,"segment":3,"confidence":12.406250000000018,"iterationTokens":17788,"asi":{"hypothesis":"Shortening tabu tenure regressed, suggesting the new best-so-far stagnation regime still benefits from stronger short-term memory. Increasing the fixed week-local tabu tenure from 10 to 12 might stabilize hard-case search without changing guidance or breakout structure.","observations":{"previous_best_commit":"9f33e41","previous_best_mean_final_score":81.7,"experiment_mean_final_score":79.4,"previous_best_solved_runs":6,"experiment_solved_runs":6,"32x8x10_scores":[0,0,0,0],"36x9x10_scores":[97,66,55,66],"36x9x11_scores":[258,273,238,260],"40x10x11_scores":[55,66,66,66],"runtime_total_seconds":336.146274136},"learned_tradeoff":"Under best-so-far stagnation counting, the solver prefers stronger tabu memory, not weaker. A slightly longer tenure improved larger-case stability while preserving the perfect 32x8x10 result.","next_action_hint":"Use tabu tenure 12 as the new baseline. If plateau-control is explored further, prefer similarly mild strengthening/conditioning of existing memory rather than loosening aspiration or shortening tenure."}}
{"run":45,"commit":"fea1825","metric":86.55,"metrics":{"best_final_score":0,"worst_final_score":355,"mean_unique_contacts":567.75,"best_unique_contacts":656,"worst_unique_contacts":480,"solved_runs":7,"mean_best_conflict_positions":22.55,"best_best_conflict_positions":0,"runtime_total_seconds":330.98914363,"social_golfer_32x8x10_seed_1_final_score":0,"social_golfer_32x8x10_seed_1_unique_contacts":480,"social_golfer_32x8x10_seed_1_best_conflict_positions":0,"social_golfer_32x8x10_seed_1_runtime_seconds":4.495515795,"social_golfer_32x8x10_seed_2_final_score":0,"social_golfer_32x8x10_seed_2_unique_contacts":480,"social_golfer_32x8x10_seed_2_best_conflict_positions":0,"social_golfer_32x8x10_seed_2_runtime_seconds":4.5791609950000005,"social_golfer_32x8x10_seed_3_final_score":0,"social_golfer_32x8x10_seed_3_unique_contacts":480,"social_golfer_32x8x10_seed_3_best_conflict_positions":0,"social_golfer_32x8x10_seed_3_runtime_seconds":5.562165986,"social_golfer_32x8x10_seed_4_final_score":0,"social_golfer_32x8x10_seed_4_unique_contacts":480,"social_golfer_32x8x10_seed_4_best_conflict_positions":0,"social_golfer_32x8x10_seed_4_runtime_seconds":0.8848256090000001,"social_golfer_36x9x10_seed_1_final_score":66,"social_golfer_36x9x10_seed_1_unique_contacts":534,"social_golfer_36x9x10_seed_1_best_conflict_positions":23,"social_golfer_36x9x10_seed_1_runtime_seconds":60.000754731,"social_golfer_36x9x10_seed_2_final_score":110,"social_golfer_36x9x10_seed_2_unique_contacts":530,"social_golfer_36x9x10_seed_2_best_conflict_positions":26,"social_golfer_36x9x10_seed_2_runtime_seconds":60.000187211000004,"social_golfer_36x9x10_seed_3_final_score":77,"social_golfer_36x9x10_seed_3_unique_contacts":533,"social_golfer_36x9x10_seed_3_best_conflict_positions":27,"social_golfer_36x9x10_seed_3_runtime_seconds":60.003021956,"social_golfer_36x9x10_seed_4_final_score":55,"social_golfer_36x9x10_seed_4_unique_contacts":535,"social_golfer_36x9x10_seed_4_best_conflict_positions":19,"social_golfer_36x9x10_seed_4_runtime_seconds":60.000796139,"social_golfer_36x9x11_seed_1_final_score":240,"social_golfer_36x9x11_seed_1_unique_contacts":574,"social_golfer_36x9x11_seed_1_best_conflict_positions":68,"social_golfer_36x9x11_seed_1_runtime_seconds":90.00309429699999,"social_golfer_36x9x11_seed_2_final_score":355,"social_golfer_36x9x11_seed_2_unique_contacts":569,"social_golfer_36x9x11_seed_2_best_conflict_positions":66,"social_golfer_36x9x11_seed_2_runtime_seconds":90.002296801,"social_golfer_36x9x11_seed_3_final_score":240,"social_golfer_36x9x11_seed_3_unique_contacts":574,"social_golfer_36x9x11_seed_3_best_conflict_positions":68,"social_golfer_36x9x11_seed_3_runtime_seconds":90.002663366,"social_golfer_36x9x11_seed_4_final_score":282,"social_golfer_36x9x11_seed_4_unique_contacts":572,"social_golfer_36x9x11_seed_4_best_conflict_positions":66,"social_golfer_36x9x11_seed_4_runtime_seconds":90.00361098699999,"social_golfer_40x10x10_seed_1_final_score":11,"social_golfer_40x10x10_seed_1_unique_contacts":599,"social_golfer_40x10x10_seed_1_best_conflict_positions":4,"social_golfer_40x10x10_seed_1_runtime_seconds":60.000166183,"social_golfer_40x10x10_seed_2_final_score":0,"social_golfer_40x10x10_seed_2_unique_contacts":600,"social_golfer_40x10x10_seed_2_best_conflict_positions":0,"social_golfer_40x10x10_seed_2_runtime_seconds":18.871690499,"social_golfer_40x10x10_seed_3_final_score":0,"social_golfer_40x10x10_seed_3_unique_contacts":600,"social_golfer_40x10x10_seed_3_best_conflict_positions":0,"social_golfer_40x10x10_seed_3_runtime_seconds":37.764486033,"social_golfer_40x10x10_seed_4_final_score":0,"social_golfer_40x10x10_seed_4_unique_contacts":600,"social_golfer_40x10x10_seed_4_best_conflict_positions":0,"social_golfer_40x10x10_seed_4_runtime_seconds":45.577151142999995,"social_golfer_40x10x11_seed_1_final_score":97,"social_golfer_40x10x11_seed_1_unique_contacts":653,"social_golfer_40x10x11_seed_1_best_conflict_positions":23,"social_golfer_40x10x11_seed_1_runtime_seconds":120.00028360099999,"social_golfer_40x10x11_seed_2_final_score":88,"social_golfer_40x10x11_seed_2_unique_contacts":652,"social_golfer_40x10x11_seed_2_best_conflict_positions":22,"social_golfer_40x10x11_seed_2_runtime_seconds":120.000881096,"social_golfer_40x10x11_seed_3_final_score":66,"social_golfer_40x10x11_seed_3_unique_contacts":654,"social_golfer_40x10x11_seed_3_best_conflict_positions":23,"social_golfer_40x10x11_seed_3_runtime_seconds":120.00202894600001,"social_golfer_40x10x11_seed_4_final_score":44,"social_golfer_40x10x11_seed_4_unique_contacts":656,"social_golfer_40x10x11_seed_4_best_conflict_positions":16,"social_golfer_40x10x11_seed_4_runtime_seconds":120.002136001},"status":"discard","description":"Tried strengthening solver4's fixed week-local pair tabu tenure further from 12 to 14 iterations under the best-so-far stagnation + 4+ late repeat-guidance regime. The extra memory overconstrained search and regressed the p=4 stretch bundle.","timestamp":1776321002343,"segment":3,"confidence":12.262548262548261,"iterationTokens":15969,"asi":{"hypothesis":"Since moving tabu tenure from 10 to 12 helped, a further mild increase to 14 might continue the stronger-memory trend without disturbing the effective best-so-far stagnation, late repeat-guidance, or breakout structure.","rollback_reason":"The stronger fixed tenure overconstrained search. mean_final_score regressed from 79.4 to 86.55, with larger-case regressions outweighing the extra solved run.","observations":{"baseline_commit":"fea1825","baseline_mean_final_score":79.4,"experiment_mean_final_score":86.55,"baseline_solved_runs":6,"experiment_solved_runs":7,"32x8x10_scores":[0,0,0,0],"36x9x10_scores":[66,110,77,55],"36x9x11_scores":[240,355,240,282],"40x10x11_scores":[97,88,66,44],"runtime_total_seconds":330.98914363},"learned_tradeoff":"The stronger-memory direction is real only up to a point. Tenure 12 helped over 10, but 14 overshot; the live sweet spot appears narrower than 'keep increasing tabu'.","next_action_hint":"Keep 12 as the fixed baseline. Prune the idea of further unconditional tenure increases and look for a different mild mechanism or a conditional memory scheme rather than a larger global tabu constant."}}
{"run":46,"commit":"fea1825","metric":93,"metrics":{"best_final_score":0,"worst_final_score":302,"mean_unique_contacts":567.8,"best_unique_contacts":654,"worst_unique_contacts":480,"solved_runs":6,"mean_best_conflict_positions":23.1,"best_best_conflict_positions":0,"runtime_total_seconds":335.560121219,"social_golfer_32x8x10_seed_1_final_score":0,"social_golfer_32x8x10_seed_1_unique_contacts":480,"social_golfer_32x8x10_seed_1_best_conflict_positions":0,"social_golfer_32x8x10_seed_1_runtime_seconds":5.470923171,"social_golfer_32x8x10_seed_2_final_score":0,"social_golfer_32x8x10_seed_2_unique_contacts":480,"social_golfer_32x8x10_seed_2_best_conflict_positions":0,"social_golfer_32x8x10_seed_2_runtime_seconds":3.111222879,"social_golfer_32x8x10_seed_3_final_score":0,"social_golfer_32x8x10_seed_3_unique_contacts":480,"social_golfer_32x8x10_seed_3_best_conflict_positions":0,"social_golfer_32x8x10_seed_3_runtime_seconds":2.491352151,"social_golfer_32x8x10_seed_4_final_score":0,"social_golfer_32x8x10_seed_4_unique_contacts":480,"social_golfer_32x8x10_seed_4_best_conflict_positions":0,"social_golfer_32x8x10_seed_4_runtime_seconds":7.411679853,"social_golfer_36x9x10_seed_1_final_score":77,"social_golfer_36x9x10_seed_1_unique_contacts":533,"social_golfer_36x9x10_seed_1_best_conflict_positions":27,"social_golfer_36x9x10_seed_1_runtime_seconds":60.001436731999995,"social_golfer_36x9x10_seed_2_final_score":148,"social_golfer_36x9x10_seed_2_unique_contacts":532,"social_golfer_36x9x10_seed_2_best_conflict_positions":24,"social_golfer_36x9x10_seed_2_runtime_seconds":60.000838428,"social_golfer_36x9x10_seed_3_final_score":137,"social_golfer_36x9x10_seed_3_unique_contacts":533,"social_golfer_36x9x10_seed_3_best_conflict_positions":24,"social_golfer_36x9x10_seed_3_runtime_seconds":60.001396015999994,"social_golfer_36x9x10_seed_4_final_score":97,"social_golfer_36x9x10_seed_4_unique_contacts":533,"social_golfer_36x9x10_seed_4_best_conflict_positions":25,"social_golfer_36x9x10_seed_4_runtime_seconds":60.002709279,"social_golfer_36x9x11_seed_1_final_score":282,"social_golfer_36x9x11_seed_1_unique_contacts":572,"social_golfer_36x9x11_seed_1_best_conflict_positions":68,"social_golfer_36x9x11_seed_1_runtime_seconds":90.001011487,"social_golfer_36x9x11_seed_2_final_score":302,"social_golfer_36x9x11_seed_2_unique_contacts":572,"social_golfer_36x9x11_seed_2_best_conflict_positions":67,"social_golfer_36x9x11_seed_2_runtime_seconds":90.001724061,"social_golfer_36x9x11_seed_3_final_score":260,"social_golfer_36x9x11_seed_3_unique_contacts":574,"social_golfer_36x9x11_seed_3_best_conflict_positions":65,"social_golfer_36x9x11_seed_3_runtime_seconds":90.00342959700001,"social_golfer_36x9x11_seed_4_final_score":198,"social_golfer_36x9x11_seed_4_unique_contacts":576,"social_golfer_36x9x11_seed_4_best_conflict_positions":61,"social_golfer_36x9x11_seed_4_runtime_seconds":90.000640762,"social_golfer_40x10x10_seed_1_final_score":0,"social_golfer_40x10x10_seed_1_unique_contacts":600,"social_golfer_40x10x10_seed_1_best_conflict_positions":0,"social_golfer_40x10x10_seed_1_runtime_seconds":2.6665405050000004,"social_golfer_40x10x10_seed_2_final_score":11,"social_golfer_40x10x10_seed_2_unique_contacts":599,"social_golfer_40x10x10_seed_2_best_conflict_positions":4,"social_golfer_40x10x10_seed_2_runtime_seconds":60.000072525,"social_golfer_40x10x10_seed_3_final_score":0,"social_golfer_40x10x10_seed_3_unique_contacts":600,"social_golfer_40x10x10_seed_3_best_conflict_positions":0,"social_golfer_40x10x10_seed_3_runtime_seconds":53.002701884000004,"social_golfer_40x10x10_seed_4_final_score":11,"social_golfer_40x10x10_seed_4_unique_contacts":599,"social_golfer_40x10x10_seed_4_best_conflict_positions":4,"social_golfer_40x10x10_seed_4_runtime_seconds":60.00090040199999,"social_golfer_40x10x11_seed_1_final_score":77,"social_golfer_40x10x11_seed_1_unique_contacts":653,"social_golfer_40x10x11_seed_1_best_conflict_positions":26,"social_golfer_40x10x11_seed_1_runtime_seconds":120.000662515,"social_golfer_40x10x11_seed_2_final_score":77,"social_golfer_40x10x11_seed_2_unique_contacts":653,"social_golfer_40x10x11_seed_2_best_conflict_positions":22,"social_golfer_40x10x11_seed_2_runtime_seconds":120.002811181,"social_golfer_40x10x11_seed_3_final_score":97,"social_golfer_40x10x11_seed_3_unique_contacts":653,"social_golfer_40x10x11_seed_3_best_conflict_positions":24,"social_golfer_40x10x11_seed_3_runtime_seconds":120.000761888,"social_golfer_40x10x11_seed_4_final_score":86,"social_golfer_40x10x11_seed_4_unique_contacts":654,"social_golfer_40x10x11_seed_4_best_conflict_positions":21,"social_golfer_40x10x11_seed_4_runtime_seconds":120.005951293},"status":"discard","description":"Tried a conditional stronger-memory scheme: keep solver4's base week-local pair tabu tenure at 12, but extend recorded swaps on the current max-conflict week(s) to tenure 14. This over-targeted hard weeks and regressed the p=4 stretch bundle.","timestamp":1776321842438,"segment":3,"confidence":11.6764705882353,"iterationTokens":26558,"asi":{"hypothesis":"A fixed global tenure of 14 was too much, but perhaps only the current max-conflict week needs extra short-term memory. Recording swaps on the hardest week(s) with tenure 14 while leaving other weeks at 12 might stabilize the hard basin without globally overconstraining search.","rollback_reason":"This conditional longer-memory scheme still oversteered the search and regressed mean_final_score from 79.4 to 93.0, especially on 36x9x10 and 40x10x11.","observations":{"baseline_commit":"fea1825","baseline_mean_final_score":79.4,"experiment_mean_final_score":93,"baseline_solved_runs":6,"experiment_solved_runs":6,"32x8x10_scores":[0,0,0,0],"36x9x10_scores":[77,148,137,97],"36x9x11_scores":[282,302,260,198],"40x10x11_scores":[77,77,97,86]},"learned_tradeoff":"Even conditional extra tabu on the hardest week is too much. The winning tenure-12 result does not seem to want additional memory layered specifically onto conflict hotspots.","next_action_hint":"Keep fixed tenure 12 and prune both unconditional and max-conflict-week tenure increases. Look for a different mild mechanism outside the tabu-memory axis."}}
