{"run":35,"commit":"d8ffdef","metric":112.8,"metrics":{"best_final_score":0,"worst_final_score":373,"mean_unique_contacts":566,"best_unique_contacts":653,"worst_unique_contacts":474,"solved_runs":1,"mean_best_conflict_positions":29.6,"best_best_conflict_positions":0,"runtime_total_seconds":390.065759478,"social_golfer_32x8x10_seed_1_final_score":66,"social_golfer_32x8x10_seed_1_unique_contacts":474,"social_golfer_32x8x10_seed_1_best_conflict_positions":24,"social_golfer_32x8x10_seed_1_runtime_seconds":60.001307102999995,"social_golfer_32x8x10_seed_2_final_score":66,"social_golfer_32x8x10_seed_2_unique_contacts":474,"social_golfer_32x8x10_seed_2_best_conflict_positions":24,"social_golfer_32x8x10_seed_2_runtime_seconds":60.000999952,"social_golfer_32x8x10_seed_3_final_score":66,"social_golfer_32x8x10_seed_3_unique_contacts":474,"social_golfer_32x8x10_seed_3_best_conflict_positions":24,"social_golfer_32x8x10_seed_3_runtime_seconds":60.000502979000004,"social_golfer_32x8x10_seed_4_final_score":66,"social_golfer_32x8x10_seed_4_unique_contacts":474,"social_golfer_32x8x10_seed_4_best_conflict_positions":24,"social_golfer_32x8x10_seed_4_runtime_seconds":60.00069833,"social_golfer_36x9x10_seed_1_final_score":110,"social_golfer_36x9x10_seed_1_unique_contacts":530,"social_golfer_36x9x10_seed_1_best_conflict_positions":27,"social_golfer_36x9x10_seed_1_runtime_seconds":60.000481799,"social_golfer_36x9x10_seed_2_final_score":77,"social_golfer_36x9x10_seed_2_unique_contacts":533,"social_golfer_36x9x10_seed_2_best_conflict_positions":21,"social_golfer_36x9x10_seed_2_runtime_seconds":60.000387853999996,"social_golfer_36x9x10_seed_3_final_score":77,"social_golfer_36x9x10_seed_3_unique_contacts":533,"social_golfer_36x9x10_seed_3_best_conflict_positions":26,"social_golfer_36x9x10_seed_3_runtime_seconds":60.001001341,"social_golfer_36x9x10_seed_4_final_score":99,"social_golfer_36x9x10_seed_4_unique_contacts":531,"social_golfer_36x9x10_seed_4_best_conflict_positions":28,"social_golfer_36x9x10_seed_4_runtime_seconds":60.001079055000005,"social_golfer_36x9x11_seed_1_final_score":291,"social_golfer_36x9x11_seed_1_unique_contacts":573,"social_golfer_36x9x11_seed_1_best_conflict_positions":69,"social_golfer_36x9x11_seed_1_runtime_seconds":90.00061923199999,"social_golfer_36x9x11_seed_2_final_score":302,"social_golfer_36x9x11_seed_2_unique_contacts":572,"social_golfer_36x9x11_seed_2_best_conflict_positions":68,"social_golfer_36x9x11_seed_2_runtime_seconds":90.00049638500002,"social_golfer_36x9x11_seed_3_final_score":373,"social_golfer_36x9x11_seed_3_unique_contacts":571,"social_golfer_36x9x11_seed_3_best_conflict_positions":72,"social_golfer_36x9x11_seed_3_runtime_seconds":90.00134962199999,"social_golfer_36x9x11_seed_4_final_score":249,"social_golfer_36x9x11_seed_4_unique_contacts":575,"social_golfer_36x9x11_seed_4_best_conflict_positions":60,"social_golfer_36x9x11_seed_4_runtime_seconds":90.000401321,"social_golfer_40x10x10_seed_1_final_score":11,"social_golfer_40x10x10_seed_1_unique_contacts":599,"social_golfer_40x10x10_seed_1_best_conflict_positions":4,"social_golfer_40x10x10_seed_1_runtime_seconds":60.001442582,"social_golfer_40x10x10_seed_2_final_score":11,"social_golfer_40x10x10_seed_2_unique_contacts":599,"social_golfer_40x10x10_seed_2_best_conflict_positions":4,"social_golfer_40x10x10_seed_2_runtime_seconds":59.999887114,"social_golfer_40x10x10_seed_3_final_score":0,"social_golfer_40x10x10_seed_3_unique_contacts":600,"social_golfer_40x10x10_seed_3_best_conflict_positions":0,"social_golfer_40x10x10_seed_3_runtime_seconds":2.74744647,"social_golfer_40x10x10_seed_4_final_score":11,"social_golfer_40x10x10_seed_4_unique_contacts":599,"social_golfer_40x10x10_seed_4_best_conflict_positions":4,"social_golfer_40x10x10_seed_4_runtime_seconds":60.000643272,"social_golfer_40x10x11_seed_1_final_score":97,"social_golfer_40x10x11_seed_1_unique_contacts":653,"social_golfer_40x10x11_seed_1_best_conflict_positions":25,"social_golfer_40x10x11_seed_1_runtime_seconds":120.001585098,"social_golfer_40x10x11_seed_2_final_score":130,"social_golfer_40x10x11_seed_2_unique_contacts":650,"social_golfer_40x10x11_seed_2_best_conflict_positions":37,"social_golfer_40x10x11_seed_2_runtime_seconds":120.00097710200001,"social_golfer_40x10x11_seed_3_final_score":77,"social_golfer_40x10x11_seed_3_unique_contacts":653,"social_golfer_40x10x11_seed_3_best_conflict_positions":26,"social_golfer_40x10x11_seed_3_runtime_seconds":120.002101048,"social_golfer_40x10x11_seed_4_final_score":77,"social_golfer_40x10x11_seed_4_unique_contacts":653,"social_golfer_40x10x11_seed_4_best_conflict_positions":25,"social_golfer_40x10x11_seed_4_runtime_seconds":120.00081659},"status":"discard","description":"Tried a principled best-of-two greedy initializer: build two independent randomized greedy schedules and start local search from the one with the better internal paper metrics. This hurt badly, collapsing all 32x8x10 seeds to 66.","timestamp":1776310382399,"segment":3,"confidence":31.46551724137925,"iterationTokens":26327,"asi":{"hypothesis":"A generic mini-portfolio in the initializer might help: generate two independent greedy candidates and start local search from the one with the lower internal paper-style conflict metrics.","rollback_reason":"This selection pressure overfit the initializer stage and destroyed useful basin diversity. mean_final_score regressed from 91.25 to 112.8, with all 32x8x10 seeds stuck at 66.","observations":{"kept_commit":"d8ffdef","kept_mean_final_score":91.25,"experiment_mean_final_score":112.8,"kept_solved_runs":6,"experiment_solved_runs":1,"32x8x10_scores":[66,66,66,66],"36x9x11_scores":[291,302,373,249]},"learned_tradeoff":"Choosing the apparently better greedy construction by local paper metrics is not actually a good proxy for downstream search basin quality. The current solver benefits from keeping the single sampled construction rather than screening it.","next_action_hint":"Do not revisit best-of-two initializer screening with current paper metrics. Future constructor work should preserve basin diversity instead of pre-filtering candidates by shallow local quality."}}
{"run":36,"commit":"d8ffdef","metric":99,"metrics":{"best_final_score":0,"worst_final_score":300,"mean_unique_contacts":566.8,"best_unique_contacts":652,"worst_unique_contacts":474,"solved_runs":3,"mean_best_conflict_positions":27.9,"best_best_conflict_positions":0,"runtime_total_seconds":390.063368645,"social_golfer_32x8x10_seed_1_final_score":66,"social_golfer_32x8x10_seed_1_unique_contacts":474,"social_golfer_32x8x10_seed_1_best_conflict_positions":24,"social_golfer_32x8x10_seed_1_runtime_seconds":60.00059813,"social_golfer_32x8x10_seed_2_final_score":66,"social_golfer_32x8x10_seed_2_unique_contacts":474,"social_golfer_32x8x10_seed_2_best_conflict_positions":24,"social_golfer_32x8x10_seed_2_runtime_seconds":60.001180328000004,"social_golfer_32x8x10_seed_3_final_score":0,"social_golfer_32x8x10_seed_3_unique_contacts":480,"social_golfer_32x8x10_seed_3_best_conflict_positions":0,"social_golfer_32x8x10_seed_3_runtime_seconds":6.5971395269999995,"social_golfer_32x8x10_seed_4_final_score":66,"social_golfer_32x8x10_seed_4_unique_contacts":474,"social_golfer_32x8x10_seed_4_best_conflict_positions":24,"social_golfer_32x8x10_seed_4_runtime_seconds":60.001153853999995,"social_golfer_36x9x10_seed_1_final_score":77,"social_golfer_36x9x10_seed_1_unique_contacts":533,"social_golfer_36x9x10_seed_1_best_conflict_positions":28,"social_golfer_36x9x10_seed_1_runtime_seconds":60.001161902,"social_golfer_36x9x10_seed_2_final_score":66,"social_golfer_36x9x10_seed_2_unique_contacts":534,"social_golfer_36x9x10_seed_2_best_conflict_positions":23,"social_golfer_36x9x10_seed_2_runtime_seconds":60.001127948,"social_golfer_36x9x10_seed_3_final_score":77,"social_golfer_36x9x10_seed_3_unique_contacts":533,"social_golfer_36x9x10_seed_3_best_conflict_positions":27,"social_golfer_36x9x10_seed_3_runtime_seconds":60.00202607000001,"social_golfer_36x9x10_seed_4_final_score":77,"social_golfer_36x9x10_seed_4_unique_contacts":533,"social_golfer_36x9x10_seed_4_best_conflict_positions":28,"social_golfer_36x9x10_seed_4_runtime_seconds":60.001223095,"social_golfer_36x9x11_seed_1_final_score":300,"social_golfer_36x9x11_seed_1_unique_contacts":574,"social_golfer_36x9x11_seed_1_best_conflict_positions":65,"social_golfer_36x9x11_seed_1_runtime_seconds":90.002166983,"social_golfer_36x9x11_seed_2_final_score":229,"social_golfer_36x9x11_seed_2_unique_contacts":575,"social_golfer_36x9x11_seed_2_best_conflict_positions":66,"social_golfer_36x9x11_seed_2_runtime_seconds":90.00016968,"social_golfer_36x9x11_seed_3_final_score":251,"social_golfer_36x9x11_seed_3_unique_contacts":573,"social_golfer_36x9x11_seed_3_best_conflict_positions":68,"social_golfer_36x9x11_seed_3_runtime_seconds":90.004486151,"social_golfer_36x9x11_seed_4_final_score":218,"social_golfer_36x9x11_seed_4_unique_contacts":576,"social_golfer_36x9x11_seed_4_best_conflict_positions":59,"social_golfer_36x9x11_seed_4_runtime_seconds":89.999934912,"social_golfer_40x10x10_seed_1_final_score":0,"social_golfer_40x10x10_seed_1_unique_contacts":600,"social_golfer_40x10x10_seed_1_best_conflict_positions":0,"social_golfer_40x10x10_seed_1_runtime_seconds":31.241675575,"social_golfer_40x10x10_seed_2_final_score":11,"social_golfer_40x10x10_seed_2_unique_contacts":599,"social_golfer_40x10x10_seed_2_best_conflict_positions":4,"social_golfer_40x10x10_seed_2_runtime_seconds":60.000030345,"social_golfer_40x10x10_seed_3_final_score":11,"social_golfer_40x10x10_seed_3_unique_contacts":599,"social_golfer_40x10x10_seed_3_best_conflict_positions":4,"social_golfer_40x10x10_seed_3_runtime_seconds":60.001225911,"social_golfer_40x10x10_seed_4_final_score":0,"social_golfer_40x10x10_seed_4_unique_contacts":600,"social_golfer_40x10x10_seed_4_best_conflict_positions":0,"social_golfer_40x10x10_seed_4_runtime_seconds":17.171837313,"social_golfer_40x10x11_seed_1_final_score":99,"social_golfer_40x10x11_seed_1_unique_contacts":651,"social_golfer_40x10x11_seed_1_best_conflict_positions":32,"social_golfer_40x10x11_seed_1_runtime_seconds":120.00163663400001,"social_golfer_40x10x11_seed_2_final_score":88,"social_golfer_40x10x11_seed_2_unique_contacts":652,"social_golfer_40x10x11_seed_2_best_conflict_positions":28,"social_golfer_40x10x11_seed_2_runtime_seconds":120.00062969499999,"social_golfer_40x10x11_seed_3_final_score":108,"social_golfer_40x10x11_seed_3_unique_contacts":652,"social_golfer_40x10x11_seed_3_best_conflict_positions":27,"social_golfer_40x10x11_seed_3_runtime_seconds":120.001541926,"social_golfer_40x10x11_seed_4_final_score":170,"social_golfer_40x10x11_seed_4_unique_contacts":650,"social_golfer_40x10x11_seed_4_best_conflict_positions":27,"social_golfer_40x10x11_seed_4_runtime_seconds":120.000184395},"status":"discard","description":"Tried delaying breakout from 4 to 5 non-improving iterations so the existing 3+ late repeat-guidance would get more time before perturbation. This improved some guardrail cases but regressed the primary bundle versus the current best.","timestamp":1776311222517,"segment":3,"confidence":28.515624999999975,"iterationTokens":18166,"asi":{"hypothesis":"The current 3+ late repeat-guidance may not have enough time to work before breakout fires. Delaying breakout from 4 to 5 non-improving iterations could preserve the same guidance rule while giving it an extra chance to repair the plateau.","rollback_reason":"This tradeoff was not good enough for the primary metric: mean_final_score regressed from 91.25 to 99.0, and only one 32x8x10 seed solved instead of two.","observations":{"kept_commit":"d8ffdef","kept_mean_final_score":91.25,"experiment_mean_final_score":99,"kept_solved_runs":6,"experiment_solved_runs":3,"32x8x10_scores":[66,66,0,66],"36x9x10_scores":[77,66,77,77],"36x9x11_scores":[300,229,251,218]},"learned_tradeoff":"Giving late guidance more runway before breakout helped some guardrail cases but weakened the primary 32x8x10 lane. The current breakout timing is still part of the best overall balance.","next_action_hint":"Keep breakout timing at the current baseline. Future experiments should move away from timing-only scalar tweaks and toward different mild mechanisms, while preserving the simple untabued conflict-anchored distinct-position breakout."}}
{"run":37,"commit":"d8ffdef","metric":95,"metrics":{"best_final_score":0,"worst_final_score":313,"mean_unique_contacts":566.8,"best_unique_contacts":655,"worst_unique_contacts":474,"solved_runs":5,"mean_best_conflict_positions":27.45,"best_best_conflict_positions":0,"runtime_total_seconds":337.12597482,"social_golfer_32x8x10_seed_1_final_score":0,"social_golfer_32x8x10_seed_1_unique_contacts":480,"social_golfer_32x8x10_seed_1_best_conflict_positions":0,"social_golfer_32x8x10_seed_1_runtime_seconds":8.445284684,"social_golfer_32x8x10_seed_2_final_score":0,"social_golfer_32x8x10_seed_2_unique_contacts":480,"social_golfer_32x8x10_seed_2_best_conflict_positions":0,"social_golfer_32x8x10_seed_2_runtime_seconds":7.006940763999999,"social_golfer_32x8x10_seed_3_final_score":66,"social_golfer_32x8x10_seed_3_unique_contacts":474,"social_golfer_32x8x10_seed_3_best_conflict_positions":24,"social_golfer_32x8x10_seed_3_runtime_seconds":60.001387406,"social_golfer_32x8x10_seed_4_final_score":66,"social_golfer_32x8x10_seed_4_unique_contacts":474,"social_golfer_32x8x10_seed_4_best_conflict_positions":24,"social_golfer_32x8x10_seed_4_runtime_seconds":60.001343338,"social_golfer_36x9x10_seed_1_final_score":99,"social_golfer_36x9x10_seed_1_unique_contacts":531,"social_golfer_36x9x10_seed_1_best_conflict_positions":32,"social_golfer_36x9x10_seed_1_runtime_seconds":60.001820008,"social_golfer_36x9x10_seed_2_final_score":77,"social_golfer_36x9x10_seed_2_unique_contacts":533,"social_golfer_36x9x10_seed_2_best_conflict_positions":27,"social_golfer_36x9x10_seed_2_runtime_seconds":60.000650078999996,"social_golfer_36x9x10_seed_3_final_score":108,"social_golfer_36x9x10_seed_3_unique_contacts":532,"social_golfer_36x9x10_seed_3_best_conflict_positions":27,"social_golfer_36x9x10_seed_3_runtime_seconds":60.000512996,"social_golfer_36x9x10_seed_4_final_score":99,"social_golfer_36x9x10_seed_4_unique_contacts":531,"social_golfer_36x9x10_seed_4_best_conflict_positions":32,"social_golfer_36x9x10_seed_4_runtime_seconds":60.000423667,"social_golfer_36x9x11_seed_1_final_score":313,"social_golfer_36x9x11_seed_1_unique_contacts":571,"social_golfer_36x9x11_seed_1_best_conflict_positions":67,"social_golfer_36x9x11_seed_1_runtime_seconds":90.00281831299999,"social_golfer_36x9x11_seed_2_final_score":260,"social_golfer_36x9x11_seed_2_unique_contacts":574,"social_golfer_36x9x11_seed_2_best_conflict_positions":67,"social_golfer_36x9x11_seed_2_runtime_seconds":90.00025121,"social_golfer_36x9x11_seed_3_final_score":220,"social_golfer_36x9x11_seed_3_unique_contacts":574,"social_golfer_36x9x11_seed_3_best_conflict_positions":72,"social_golfer_36x9x11_seed_3_runtime_seconds":90.003627202,"social_golfer_36x9x11_seed_4_final_score":275,"social_golfer_36x9x11_seed_4_unique_contacts":569,"social_golfer_36x9x11_seed_4_best_conflict_positions":74,"social_golfer_36x9x11_seed_4_runtime_seconds":90.00534896699999,"social_golfer_40x10x10_seed_1_final_score":22,"social_golfer_40x10x10_seed_1_unique_contacts":598,"social_golfer_40x10x10_seed_1_best_conflict_positions":7,"social_golfer_40x10x10_seed_1_runtime_seconds":60.000281994999995,"social_golfer_40x10x10_seed_2_final_score":0,"social_golfer_40x10x10_seed_2_unique_contacts":600,"social_golfer_40x10x10_seed_2_best_conflict_positions":0,"social_golfer_40x10x10_seed_2_runtime_seconds":1.548850805,"social_golfer_40x10x10_seed_3_final_score":0,"social_golfer_40x10x10_seed_3_unique_contacts":600,"social_golfer_40x10x10_seed_3_best_conflict_positions":0,"social_golfer_40x10x10_seed_3_runtime_seconds":1.8117477499999999,"social_golfer_40x10x10_seed_4_final_score":0,"social_golfer_40x10x10_seed_4_unique_contacts":600,"social_golfer_40x10x10_seed_4_best_conflict_positions":0,"social_golfer_40x10x10_seed_4_runtime_seconds":1.70036568,"social_golfer_40x10x11_seed_1_final_score":55,"social_golfer_40x10x11_seed_1_unique_contacts":655,"social_golfer_40x10x11_seed_1_best_conflict_positions":20,"social_golfer_40x10x11_seed_1_runtime_seconds":120.00066455599999,"social_golfer_40x10x11_seed_2_final_score":66,"social_golfer_40x10x11_seed_2_unique_contacts":654,"social_golfer_40x10x11_seed_2_best_conflict_positions":23,"social_golfer_40x10x11_seed_2_runtime_seconds":120.00010425900001,"social_golfer_40x10x11_seed_3_final_score":108,"social_golfer_40x10x11_seed_3_unique_contacts":652,"social_golfer_40x10x11_seed_3_best_conflict_positions":29,"social_golfer_40x10x11_seed_3_runtime_seconds":120.001531653,"social_golfer_40x10x11_seed_4_final_score":66,"social_golfer_40x10x11_seed_4_unique_contacts":654,"social_golfer_40x10x11_seed_4_best_conflict_positions":24,"social_golfer_40x10x11_seed_4_runtime_seconds":119.99998698},"status":"discard","description":"Tried reordering the existing late-stage tie-breaks so max-conflict-week concentration stays ahead of active-repeated-pair guidance when the late guidance is active. This modestly improved some larger-case behavior but still regressed the primary bundle versus the current best.","timestamp":1776312302620,"segment":3,"confidence":19.729729729729762,"iterationTokens":13049,"asi":{"hypothesis":"The current late active-repeated-pair guidance may be slightly over-prioritizing pair-count cleanup over conflict concentration. Keeping the existing max-conflict-week tie-break ahead of active_repeated_pairs_after could preserve the current signals while concentrating repairs better.","rollback_reason":"The reordered precedence improved some guardrail metrics but still regressed the primary mean_final_score from 91.25 to 95.0, so the current tie-break order remains better overall.","observations":{"kept_commit":"d8ffdef","kept_mean_final_score":91.25,"experiment_mean_final_score":95,"kept_solved_runs":6,"experiment_solved_runs":5,"32x8x10_scores":[0,0,66,66],"36x9x11_scores":[313,260,220,275],"40x10x11_scores":[55,66,108,66]},"learned_tradeoff":"The existing late repeat-guidance ordering is already close to the best balance. Reordering the same signals can help larger cases but still harms the primary 32x8x10 objective.","next_action_hint":"Stop tweaking ordering among the current late-stage signals for now. The next experiment should try a different mild mechanism, likely around how stagnation is counted or how tabu interacts with non-improving local-search moves, without broadening breakout or constructor filtering."}}
