{"run":26,"commit":"7f7375a","metric":111.25,"metrics":{"best_final_score":0,"worst_final_score":388,"mean_unique_contacts":566.05,"best_unique_contacts":654,"worst_unique_contacts":474,"solved_runs":2,"mean_best_conflict_positions":29.6,"best_best_conflict_positions":0,"runtime_total_seconds":390.06028614,"social_golfer_32x8x10_seed_1_final_score":66,"social_golfer_32x8x10_seed_1_unique_contacts":474,"social_golfer_32x8x10_seed_1_best_conflict_positions":24,"social_golfer_32x8x10_seed_1_runtime_seconds":60.00093553,"social_golfer_32x8x10_seed_2_final_score":0,"social_golfer_32x8x10_seed_2_unique_contacts":480,"social_golfer_32x8x10_seed_2_best_conflict_positions":0,"social_golfer_32x8x10_seed_2_runtime_seconds":3.653180546,"social_golfer_32x8x10_seed_3_final_score":66,"social_golfer_32x8x10_seed_3_unique_contacts":474,"social_golfer_32x8x10_seed_3_best_conflict_positions":24,"social_golfer_32x8x10_seed_3_runtime_seconds":60.000205404,"social_golfer_32x8x10_seed_4_final_score":66,"social_golfer_32x8x10_seed_4_unique_contacts":474,"social_golfer_32x8x10_seed_4_best_conflict_positions":24,"social_golfer_32x8x10_seed_4_runtime_seconds":60.000786185,"social_golfer_36x9x10_seed_1_final_score":88,"social_golfer_36x9x10_seed_1_unique_contacts":532,"social_golfer_36x9x10_seed_1_best_conflict_positions":26,"social_golfer_36x9x10_seed_1_runtime_seconds":60.001346104999996,"social_golfer_36x9x10_seed_2_final_score":66,"social_golfer_36x9x10_seed_2_unique_contacts":534,"social_golfer_36x9x10_seed_2_best_conflict_positions":23,"social_golfer_36x9x10_seed_2_runtime_seconds":60.000210827,"social_golfer_36x9x10_seed_3_final_score":128,"social_golfer_36x9x10_seed_3_unique_contacts":532,"social_golfer_36x9x10_seed_3_best_conflict_positions":28,"social_golfer_36x9x10_seed_3_runtime_seconds":60.000782764,"social_golfer_36x9x10_seed_4_final_score":77,"social_golfer_36x9x10_seed_4_unique_contacts":533,"social_golfer_36x9x10_seed_4_best_conflict_positions":24,"social_golfer_36x9x10_seed_4_runtime_seconds":60.001104338,"social_golfer_36x9x11_seed_1_final_score":249,"social_golfer_36x9x11_seed_1_unique_contacts":575,"social_golfer_36x9x11_seed_1_best_conflict_positions":64,"social_golfer_36x9x11_seed_1_runtime_seconds":90.00201427900001,"social_golfer_36x9x11_seed_2_final_score":357,"social_golfer_36x9x11_seed_2_unique_contacts":567,"social_golfer_36x9x11_seed_2_best_conflict_positions":85,"social_golfer_36x9x11_seed_2_runtime_seconds":90.00326112699999,"social_golfer_36x9x11_seed_3_final_score":251,"social_golfer_36x9x11_seed_3_unique_contacts":573,"social_golfer_36x9x11_seed_3_best_conflict_positions":71,"social_golfer_36x9x11_seed_3_runtime_seconds":90.002133705,"social_golfer_36x9x11_seed_4_final_score":388,"social_golfer_36x9x11_seed_4_unique_contacts":566,"social_golfer_36x9x11_seed_4_best_conflict_positions":79,"social_golfer_36x9x11_seed_4_runtime_seconds":90.001312217,"social_golfer_40x10x10_seed_1_final_score":11,"social_golfer_40x10x10_seed_1_unique_contacts":599,"social_golfer_40x10x10_seed_1_best_conflict_positions":4,"social_golfer_40x10x10_seed_1_runtime_seconds":60.001192682,"social_golfer_40x10x10_seed_2_final_score":0,"social_golfer_40x10x10_seed_2_unique_contacts":600,"social_golfer_40x10x10_seed_2_best_conflict_positions":0,"social_golfer_40x10x10_seed_2_runtime_seconds":26.796914297,"social_golfer_40x10x10_seed_3_final_score":11,"social_golfer_40x10x10_seed_3_unique_contacts":599,"social_golfer_40x10x10_seed_3_best_conflict_positions":4,"social_golfer_40x10x10_seed_3_runtime_seconds":60.000504182,"social_golfer_40x10x10_seed_4_final_score":11,"social_golfer_40x10x10_seed_4_unique_contacts":599,"social_golfer_40x10x10_seed_4_best_conflict_positions":4,"social_golfer_40x10x10_seed_4_runtime_seconds":60.000522655,"social_golfer_40x10x11_seed_1_final_score":66,"social_golfer_40x10x11_seed_1_unique_contacts":654,"social_golfer_40x10x11_seed_1_best_conflict_positions":22,"social_golfer_40x10x11_seed_1_runtime_seconds":120.001091376,"social_golfer_40x10x11_seed_2_final_score":77,"social_golfer_40x10x11_seed_2_unique_contacts":653,"social_golfer_40x10x11_seed_2_best_conflict_positions":27,"social_golfer_40x10x11_seed_2_runtime_seconds":120.00094513100001,"social_golfer_40x10x11_seed_3_final_score":139,"social_golfer_40x10x11_seed_3_unique_contacts":651,"social_golfer_40x10x11_seed_3_best_conflict_positions":31,"social_golfer_40x10x11_seed_3_runtime_seconds":120.000065334,"social_golfer_40x10x11_seed_4_final_score":108,"social_golfer_40x10x11_seed_4_unique_contacts":652,"social_golfer_40x10x11_seed_4_best_conflict_positions":28,"social_golfer_40x10x11_seed_4_runtime_seconds":120.000818867},"status":"discard","description":"Tried making the second breakout swap reactive by recomputing the conflict state after the first random swap and choosing the second swap from that updated state. It made breakout too deterministic and regressed the bundle.","timestamp":1776303002372,"segment":3,"confidence":59.51515151515131,"iterationTokens":14558,"asi":{"hypothesis":"With breakout no longer tabued, perhaps the second random swap should respond to the first swap's new conflict landscape instead of sampling both swaps from the stale pre-breakout state.","rollback_reason":"Recomputing between the two breakout swaps regressed mean_final_score from 98.2 to 111.25 and dropped solved_runs from 5 to 2, so it over-shaped the perturbation instead of leaving it usefully noisy.","observations":{"kept_commit":"7f7375a","kept_mean_final_score":98.2,"experiment_mean_final_score":111.25,"kept_solved_runs":5,"experiment_solved_runs":2,"32x8x10_scores":[66,0,66,66],"36x9x11_scores":[249,357,251,388]},"learned_tradeoff":"The successful breakout change seems to rely on keeping the perturbation lightly random; making the second swap reactive turned it into another guided operator and lost too much robustness.","next_action_hint":"Keep breakout untabued but otherwise simple. Future plateau-escape experiments should preserve this light randomness rather than repeatedly recomputing or guiding the breakout path."}}
{"run":27,"commit":"7f7375a","metric":105.1,"metrics":{"best_final_score":0,"worst_final_score":408,"mean_unique_contacts":566.7,"best_unique_contacts":654,"worst_unique_contacts":474,"solved_runs":4,"mean_best_conflict_positions":26.9,"best_best_conflict_positions":0,"runtime_total_seconds":384.64052137,"social_golfer_32x8x10_seed_1_final_score":0,"social_golfer_32x8x10_seed_1_unique_contacts":480,"social_golfer_32x8x10_seed_1_best_conflict_positions":0,"social_golfer_32x8x10_seed_1_runtime_seconds":2.070131289,"social_golfer_32x8x10_seed_2_final_score":0,"social_golfer_32x8x10_seed_2_unique_contacts":480,"social_golfer_32x8x10_seed_2_best_conflict_positions":0,"social_golfer_32x8x10_seed_2_runtime_seconds":2.648362084,"social_golfer_32x8x10_seed_3_final_score":66,"social_golfer_32x8x10_seed_3_unique_contacts":474,"social_golfer_32x8x10_seed_3_best_conflict_positions":24,"social_golfer_32x8x10_seed_3_runtime_seconds":60.000142905,"social_golfer_32x8x10_seed_4_final_score":0,"social_golfer_32x8x10_seed_4_unique_contacts":480,"social_golfer_32x8x10_seed_4_best_conflict_positions":0,"social_golfer_32x8x10_seed_4_runtime_seconds":4.003005474999999,"social_golfer_36x9x10_seed_1_final_score":97,"social_golfer_36x9x10_seed_1_unique_contacts":533,"social_golfer_36x9x10_seed_1_best_conflict_positions":26,"social_golfer_36x9x10_seed_1_runtime_seconds":60.002456018000004,"social_golfer_36x9x10_seed_2_final_score":77,"social_golfer_36x9x10_seed_2_unique_contacts":533,"social_golfer_36x9x10_seed_2_best_conflict_positions":23,"social_golfer_36x9x10_seed_2_runtime_seconds":60.000914317,"social_golfer_36x9x10_seed_3_final_score":88,"social_golfer_36x9x10_seed_3_unique_contacts":532,"social_golfer_36x9x10_seed_3_best_conflict_positions":25,"social_golfer_36x9x10_seed_3_runtime_seconds":60.00051046,"social_golfer_36x9x10_seed_4_final_score":77,"social_golfer_36x9x10_seed_4_unique_contacts":533,"social_golfer_36x9x10_seed_4_best_conflict_positions":27,"social_golfer_36x9x10_seed_4_runtime_seconds":60.002414791999996,"social_golfer_36x9x11_seed_1_final_score":366,"social_golfer_36x9x11_seed_1_unique_contacts":568,"social_golfer_36x9x11_seed_1_best_conflict_positions":82,"social_golfer_36x9x11_seed_1_runtime_seconds":90.002359955,"social_golfer_36x9x11_seed_2_final_score":408,"social_golfer_36x9x11_seed_2_unique_contacts":566,"social_golfer_36x9x11_seed_2_best_conflict_positions":79,"social_golfer_36x9x11_seed_2_runtime_seconds":90.00216084600001,"social_golfer_36x9x11_seed_3_final_score":240,"social_golfer_36x9x11_seed_3_unique_contacts":574,"social_golfer_36x9x11_seed_3_best_conflict_positions":68,"social_golfer_36x9x11_seed_3_runtime_seconds":90.00422962100001,"social_golfer_36x9x11_seed_4_final_score":333,"social_golfer_36x9x11_seed_4_unique_contacts":571,"social_golfer_36x9x11_seed_4_best_conflict_positions":70,"social_golfer_36x9x11_seed_4_runtime_seconds":90.004003934,"social_golfer_40x10x10_seed_1_final_score":11,"social_golfer_40x10x10_seed_1_unique_contacts":599,"social_golfer_40x10x10_seed_1_best_conflict_positions":4,"social_golfer_40x10x10_seed_1_runtime_seconds":59.999920048999996,"social_golfer_40x10x10_seed_2_final_score":0,"social_golfer_40x10x10_seed_2_unique_contacts":600,"social_golfer_40x10x10_seed_2_best_conflict_positions":0,"social_golfer_40x10x10_seed_2_runtime_seconds":51.929063948,"social_golfer_40x10x10_seed_3_final_score":11,"social_golfer_40x10x10_seed_3_unique_contacts":599,"social_golfer_40x10x10_seed_3_best_conflict_positions":4,"social_golfer_40x10x10_seed_3_runtime_seconds":60.000159866,"social_golfer_40x10x10_seed_4_final_score":22,"social_golfer_40x10x10_seed_4_unique_contacts":598,"social_golfer_40x10x10_seed_4_best_conflict_positions":8,"social_golfer_40x10x10_seed_4_runtime_seconds":60.000380064999995,"social_golfer_40x10x11_seed_1_final_score":66,"social_golfer_40x10x11_seed_1_unique_contacts":654,"social_golfer_40x10x11_seed_1_best_conflict_positions":24,"social_golfer_40x10x11_seed_1_runtime_seconds":120.000550993,"social_golfer_40x10x11_seed_2_final_score":66,"social_golfer_40x10x11_seed_2_unique_contacts":654,"social_golfer_40x10x11_seed_2_best_conflict_positions":23,"social_golfer_40x10x11_seed_2_runtime_seconds":120.000590798,"social_golfer_40x10x11_seed_3_final_score":77,"social_golfer_40x10x11_seed_3_unique_contacts":653,"social_golfer_40x10x11_seed_3_best_conflict_positions":27,"social_golfer_40x10x11_seed_3_runtime_seconds":120.00101156300002,"social_golfer_40x10x11_seed_4_final_score":97,"social_golfer_40x10x11_seed_4_unique_contacts":653,"social_golfer_40x10x11_seed_4_best_conflict_positions":24,"social_golfer_40x10x11_seed_4_runtime_seconds":120.000718157},"status":"discard","description":"Tried spreading the two breakout swaps across distinct weeks when possible, instead of allowing both swaps to hit the same max-conflict week. This weakened the successful untabued breakout behavior and regressed the bundle.","timestamp":1776303722458,"segment":3,"confidence":44.13483146067441,"iterationTokens":5636,"asi":{"hypothesis":"A mild plateau-escape refinement might help without making breakout more guided: keep breakout untabued, but spread its two random swaps across distinct weeks when multiple high-conflict weeks exist so the perturbation touches more than one local basin.","rollback_reason":"The distinct-weeks breakout variant regressed mean_final_score from 98.2 to 105.1 and worsened the hardest larger cases, especially 36x9x11 seeds 1, 2, and 4.","observations":{"kept_commit":"7f7375a","kept_mean_final_score":98.2,"experiment_mean_final_score":105.1,"kept_solved_runs":5,"experiment_solved_runs":4,"32x8x10_scores":[0,0,66,0],"36x9x11_scores":[366,408,240,333]},"learned_tradeoff":"The successful untabued breakout seems to benefit from concentrating both random swaps where the search already sees the biggest weekly burden; forcing dispersion across weeks loses that advantage.","next_action_hint":"Keep breakout untabued and allow concentration on the same hard week. Future plateau-escape ideas should avoid making the perturbation more structured along week boundaries."}}
{"run":28,"commit":"7f7375a","metric":105.75,"metrics":{"best_final_score":0,"worst_final_score":392,"mean_unique_contacts":566.55,"best_unique_contacts":654,"worst_unique_contacts":474,"solved_runs":5,"mean_best_conflict_positions":26.35,"best_best_conflict_positions":0,"runtime_total_seconds":375.21838556,"social_golfer_32x8x10_seed_1_final_score":0,"social_golfer_32x8x10_seed_1_unique_contacts":480,"social_golfer_32x8x10_seed_1_best_conflict_positions":0,"social_golfer_32x8x10_seed_1_runtime_seconds":19.997522544,"social_golfer_32x8x10_seed_2_final_score":66,"social_golfer_32x8x10_seed_2_unique_contacts":474,"social_golfer_32x8x10_seed_2_best_conflict_positions":24,"social_golfer_32x8x10_seed_2_runtime_seconds":60.000473588,"social_golfer_32x8x10_seed_3_final_score":0,"social_golfer_32x8x10_seed_3_unique_contacts":480,"social_golfer_32x8x10_seed_3_best_conflict_positions":0,"social_golfer_32x8x10_seed_3_runtime_seconds":11.935028266,"social_golfer_32x8x10_seed_4_final_score":66,"social_golfer_32x8x10_seed_4_unique_contacts":474,"social_golfer_32x8x10_seed_4_best_conflict_positions":24,"social_golfer_32x8x10_seed_4_runtime_seconds":60.00202287700001,"social_golfer_36x9x10_seed_1_final_score":108,"social_golfer_36x9x10_seed_1_unique_contacts":532,"social_golfer_36x9x10_seed_1_best_conflict_positions":24,"social_golfer_36x9x10_seed_1_runtime_seconds":60.000792669,"social_golfer_36x9x10_seed_2_final_score":97,"social_golfer_36x9x10_seed_2_unique_contacts":533,"social_golfer_36x9x10_seed_2_best_conflict_positions":25,"social_golfer_36x9x10_seed_2_runtime_seconds":60.00115232,"social_golfer_36x9x10_seed_3_final_score":77,"social_golfer_36x9x10_seed_3_unique_contacts":533,"social_golfer_36x9x10_seed_3_best_conflict_positions":26,"social_golfer_36x9x10_seed_3_runtime_seconds":60.00100284,"social_golfer_36x9x10_seed_4_final_score":97,"social_golfer_36x9x10_seed_4_unique_contacts":533,"social_golfer_36x9x10_seed_4_best_conflict_positions":25,"social_golfer_36x9x10_seed_4_runtime_seconds":60.001455226000004,"social_golfer_36x9x11_seed_1_final_score":260,"social_golfer_36x9x11_seed_1_unique_contacts":574,"social_golfer_36x9x11_seed_1_best_conflict_positions":67,"social_golfer_36x9x11_seed_1_runtime_seconds":90.001366016,"social_golfer_36x9x11_seed_2_final_score":364,"social_golfer_36x9x11_seed_2_unique_contacts":570,"social_golfer_36x9x11_seed_2_best_conflict_positions":69,"social_golfer_36x9x11_seed_2_runtime_seconds":90.004750578,"social_golfer_36x9x11_seed_3_final_score":392,"social_golfer_36x9x11_seed_3_unique_contacts":562,"social_golfer_36x9x11_seed_3_best_conflict_positions":80,"social_golfer_36x9x11_seed_3_runtime_seconds":90.00247569,"social_golfer_36x9x11_seed_4_final_score":291,"social_golfer_36x9x11_seed_4_unique_contacts":573,"social_golfer_36x9x11_seed_4_best_conflict_positions":66,"social_golfer_36x9x11_seed_4_runtime_seconds":90.00400886499999,"social_golfer_40x10x10_seed_1_final_score":0,"social_golfer_40x10x10_seed_1_unique_contacts":600,"social_golfer_40x10x10_seed_1_best_conflict_positions":0,"social_golfer_40x10x10_seed_1_runtime_seconds":4.48168586,"social_golfer_40x10x10_seed_2_final_score":0,"social_golfer_40x10x10_seed_2_unique_contacts":600,"social_golfer_40x10x10_seed_2_best_conflict_positions":0,"social_golfer_40x10x10_seed_2_runtime_seconds":41.368058468,"social_golfer_40x10x10_seed_3_final_score":0,"social_golfer_40x10x10_seed_3_unique_contacts":600,"social_golfer_40x10x10_seed_3_best_conflict_positions":0,"social_golfer_40x10x10_seed_3_runtime_seconds":25.151348831,"social_golfer_40x10x10_seed_4_final_score":11,"social_golfer_40x10x10_seed_4_unique_contacts":599,"social_golfer_40x10x10_seed_4_best_conflict_positions":4,"social_golfer_40x10x10_seed_4_runtime_seconds":60.000815869,"social_golfer_40x10x11_seed_1_final_score":66,"social_golfer_40x10x11_seed_1_unique_contacts":654,"social_golfer_40x10x11_seed_1_best_conflict_positions":21,"social_golfer_40x10x11_seed_1_runtime_seconds":120.00037358099999,"social_golfer_40x10x11_seed_2_final_score":66,"social_golfer_40x10x11_seed_2_unique_contacts":654,"social_golfer_40x10x11_seed_2_best_conflict_positions":23,"social_golfer_40x10x11_seed_2_runtime_seconds":120.00160008099999,"social_golfer_40x10x11_seed_3_final_score":66,"social_golfer_40x10x11_seed_3_unique_contacts":654,"social_golfer_40x10x11_seed_3_best_conflict_positions":23,"social_golfer_40x10x11_seed_3_runtime_seconds":120.001756308,"social_golfer_40x10x11_seed_4_final_score":88,"social_golfer_40x10x11_seed_4_unique_contacts":652,"social_golfer_40x10x11_seed_4_best_conflict_positions":26,"social_golfer_40x10x11_seed_4_runtime_seconds":120.000984844},"status":"discard","description":"Tried making breakout less self-similar by choosing one conflicted anchor slot from the max-conflict week and one random partner slot from a different group, instead of requiring both breakout slots to already be conflicted. This regressed the bundle.","timestamp":1776304406273,"segment":3,"confidence":35.071428571428605,"iterationTokens":13865,"asi":{"hypothesis":"A milder breakout might preserve the gains from untabued perturbation while opening different repair paths: keep one breakout slot tied to a currently conflicted position, but make the partner slot random within another group so breakout is less self-reinforcing.","rollback_reason":"The anchored-plus-random breakout regressed mean_final_score from 98.2 to 105.75 and especially worsened the 36x9x11 tail, even though solved_runs stayed at 5.","observations":{"kept_commit":"7f7375a","kept_mean_final_score":98.2,"experiment_mean_final_score":105.75,"kept_solved_runs":5,"experiment_solved_runs":5,"32x8x10_scores":[0,66,0,66],"36x9x11_scores":[260,364,392,291]},"learned_tradeoff":"The current breakout seems to work because both perturbation endpoints come from already-conflicted structure in the hard week; relaxing one endpoint to a random donor weakens repair quality more than it improves exploration.","next_action_hint":"Keep breakout endpoint selection fully conflict-anchored. Avoid further breakout-slot randomization and instead look for other small post-breakout or stagnation-structure changes that preserve the successful concentrated perturbation."}}
