{"run":23,"commit":"165fe33","metric":122.6,"metrics":{"best_final_score":0,"worst_final_score":397,"mean_unique_contacts":565.2,"best_unique_contacts":654,"worst_unique_contacts":464,"solved_runs":3,"mean_best_conflict_positions":31.9,"best_best_conflict_positions":0,"runtime_total_seconds":390.058968934,"social_golfer_32x8x10_seed_1_final_score":256,"social_golfer_32x8x10_seed_1_unique_contacts":464,"social_golfer_32x8x10_seed_1_best_conflict_positions":56,"social_golfer_32x8x10_seed_1_runtime_seconds":60.001137332,"social_golfer_32x8x10_seed_2_final_score":0,"social_golfer_32x8x10_seed_2_unique_contacts":480,"social_golfer_32x8x10_seed_2_best_conflict_positions":0,"social_golfer_32x8x10_seed_2_runtime_seconds":0.770334029,"social_golfer_32x8x10_seed_3_final_score":66,"social_golfer_32x8x10_seed_3_unique_contacts":474,"social_golfer_32x8x10_seed_3_best_conflict_positions":24,"social_golfer_32x8x10_seed_3_runtime_seconds":60.000582584,"social_golfer_32x8x10_seed_4_final_score":176,"social_golfer_32x8x10_seed_4_unique_contacts":464,"social_golfer_32x8x10_seed_4_best_conflict_positions":64,"social_golfer_32x8x10_seed_4_runtime_seconds":60.001758796999994,"social_golfer_36x9x10_seed_1_final_score":77,"social_golfer_36x9x10_seed_1_unique_contacts":533,"social_golfer_36x9x10_seed_1_best_conflict_positions":25,"social_golfer_36x9x10_seed_1_runtime_seconds":60.000641236999996,"social_golfer_36x9x10_seed_2_final_score":77,"social_golfer_36x9x10_seed_2_unique_contacts":533,"social_golfer_36x9x10_seed_2_best_conflict_positions":27,"social_golfer_36x9x10_seed_2_runtime_seconds":60.001579826,"social_golfer_36x9x10_seed_3_final_score":66,"social_golfer_36x9x10_seed_3_unique_contacts":534,"social_golfer_36x9x10_seed_3_best_conflict_positions":24,"social_golfer_36x9x10_seed_3_runtime_seconds":60.001714307,"social_golfer_36x9x10_seed_4_final_score":108,"social_golfer_36x9x10_seed_4_unique_contacts":532,"social_golfer_36x9x10_seed_4_best_conflict_positions":30,"social_golfer_36x9x10_seed_4_runtime_seconds":60.001978560999994,"social_golfer_36x9x11_seed_1_final_score":271,"social_golfer_36x9x11_seed_1_unique_contacts":573,"social_golfer_36x9x11_seed_1_best_conflict_positions":68,"social_golfer_36x9x11_seed_1_runtime_seconds":90.00252727799999,"social_golfer_36x9x11_seed_2_final_score":377,"social_golfer_36x9x11_seed_2_unique_contacts":567,"social_golfer_36x9x11_seed_2_best_conflict_positions":74,"social_golfer_36x9x11_seed_2_runtime_seconds":90.001167102,"social_golfer_36x9x11_seed_3_final_score":397,"social_golfer_36x9x11_seed_3_unique_contacts":567,"social_golfer_36x9x11_seed_3_best_conflict_positions":72,"social_golfer_36x9x11_seed_3_runtime_seconds":90.001954092,"social_golfer_36x9x11_seed_4_final_score":240,"social_golfer_36x9x11_seed_4_unique_contacts":574,"social_golfer_36x9x11_seed_4_best_conflict_positions":65,"social_golfer_36x9x11_seed_4_runtime_seconds":89.99995117899999,"social_golfer_40x10x10_seed_1_final_score":0,"social_golfer_40x10x10_seed_1_unique_contacts":600,"social_golfer_40x10x10_seed_1_best_conflict_positions":0,"social_golfer_40x10x10_seed_1_runtime_seconds":27.906646224,"social_golfer_40x10x10_seed_2_final_score":0,"social_golfer_40x10x10_seed_2_unique_contacts":600,"social_golfer_40x10x10_seed_2_best_conflict_positions":0,"social_golfer_40x10x10_seed_2_runtime_seconds":27.09317211,"social_golfer_40x10x10_seed_3_final_score":11,"social_golfer_40x10x10_seed_3_unique_contacts":599,"social_golfer_40x10x10_seed_3_best_conflict_positions":4,"social_golfer_40x10x10_seed_3_runtime_seconds":60.000866044,"social_golfer_40x10x10_seed_4_final_score":11,"social_golfer_40x10x10_seed_4_unique_contacts":599,"social_golfer_40x10x10_seed_4_best_conflict_positions":4,"social_golfer_40x10x10_seed_4_runtime_seconds":59.999943310999996,"social_golfer_40x10x11_seed_1_final_score":66,"social_golfer_40x10x11_seed_1_unique_contacts":654,"social_golfer_40x10x11_seed_1_best_conflict_positions":23,"social_golfer_40x10x11_seed_1_runtime_seconds":120.000338952,"social_golfer_40x10x11_seed_2_final_score":110,"social_golfer_40x10x11_seed_2_unique_contacts":650,"social_golfer_40x10x11_seed_2_best_conflict_positions":34,"social_golfer_40x10x11_seed_2_runtime_seconds":120.000044874,"social_golfer_40x10x11_seed_3_final_score":66,"social_golfer_40x10x11_seed_3_unique_contacts":654,"social_golfer_40x10x11_seed_3_best_conflict_positions":23,"social_golfer_40x10x11_seed_3_runtime_seconds":120.001965343,"social_golfer_40x10x11_seed_4_final_score":77,"social_golfer_40x10x11_seed_4_unique_contacts":653,"social_golfer_40x10x11_seed_4_best_conflict_positions":21,"social_golfer_40x10x11_seed_4_runtime_seconds":120.00149065000001},"status":"discard","description":"Tried a more localized late-stage repeat-guidance tie-break: after true stagnation, among swaps already tied on conflict, repeat excess, and active repeated pairs, prefer the move with lower max incident burden on the changed positions. This regressed badly.","timestamp":1776300962362,"segment":3,"confidence":70.31034482758642,"iterationTokens":37311,"asi":{"hypothesis":"A very local late-only incident-bucket signal might be safer than broader ordering changes: after 2+ stagnant iterations, break ties by preferring swaps that leave a lower worst incident burden on the positions they actually touch.","rollback_reason":"This signal regressed mean_final_score from 101.95 to 122.6, crashed one formerly solved 32x8x10 seed to 256, and worsened the hard 36x9x11 seeds.","observations":{"kept_commit":"165fe33","kept_mean_final_score":101.95,"experiment_mean_final_score":122.6,"kept_solved_runs":5,"experiment_solved_runs":3,"32x8x10_scores":[256,0,66,176],"36x9x11_scores":[271,377,397,240]},"learned_tradeoff":"Even when delayed until real stagnation, additional incident-bucket guidance appears too distortive; local-search tie-breaking is now easy to over-steer on this bundle.","next_action_hint":"Stop adding more late-stage local-search ranking criteria for now. Shift the next experiment toward constructor-side diversity or another basin-entry change that stays generic and leaves the kept late repeat-guidance untouched."}}
{"run":24,"commit":"165fe33","metric":117.7,"metrics":{"best_final_score":0,"worst_final_score":428,"mean_unique_contacts":565.1,"best_unique_contacts":654,"worst_unique_contacts":464,"solved_runs":3,"mean_best_conflict_positions":33.05,"best_best_conflict_positions":0,"runtime_total_seconds":390.080898296,"social_golfer_32x8x10_seed_1_final_score":88,"social_golfer_32x8x10_seed_1_unique_contacts":472,"social_golfer_32x8x10_seed_1_best_conflict_positions":32,"social_golfer_32x8x10_seed_1_runtime_seconds":60.001912173,"social_golfer_32x8x10_seed_2_final_score":176,"social_golfer_32x8x10_seed_2_unique_contacts":464,"social_golfer_32x8x10_seed_2_best_conflict_positions":64,"social_golfer_32x8x10_seed_2_runtime_seconds":60.00412437600001,"social_golfer_32x8x10_seed_3_final_score":132,"social_golfer_32x8x10_seed_3_unique_contacts":468,"social_golfer_32x8x10_seed_3_best_conflict_positions":48,"social_golfer_32x8x10_seed_3_runtime_seconds":60.002064795,"social_golfer_32x8x10_seed_4_final_score":88,"social_golfer_32x8x10_seed_4_unique_contacts":472,"social_golfer_32x8x10_seed_4_best_conflict_positions":32,"social_golfer_32x8x10_seed_4_runtime_seconds":60.001084168999995,"social_golfer_36x9x10_seed_1_final_score":77,"social_golfer_36x9x10_seed_1_unique_contacts":533,"social_golfer_36x9x10_seed_1_best_conflict_positions":27,"social_golfer_36x9x10_seed_1_runtime_seconds":60.001163276999996,"social_golfer_36x9x10_seed_2_final_score":97,"social_golfer_36x9x10_seed_2_unique_contacts":533,"social_golfer_36x9x10_seed_2_best_conflict_positions":26,"social_golfer_36x9x10_seed_2_runtime_seconds":60.001135152,"social_golfer_36x9x10_seed_3_final_score":99,"social_golfer_36x9x10_seed_3_unique_contacts":531,"social_golfer_36x9x10_seed_3_best_conflict_positions":35,"social_golfer_36x9x10_seed_3_runtime_seconds":60.000330074999994,"social_golfer_36x9x10_seed_4_final_score":66,"social_golfer_36x9x10_seed_4_unique_contacts":534,"social_golfer_36x9x10_seed_4_best_conflict_positions":23,"social_golfer_36x9x10_seed_4_runtime_seconds":60.000852117,"social_golfer_36x9x11_seed_1_final_score":428,"social_golfer_36x9x11_seed_1_unique_contacts":566,"social_golfer_36x9x11_seed_1_best_conflict_positions":76,"social_golfer_36x9x11_seed_1_runtime_seconds":90.003893311,"social_golfer_36x9x11_seed_2_final_score":242,"social_golfer_36x9x11_seed_2_unique_contacts":572,"social_golfer_36x9x11_seed_2_best_conflict_positions":69,"social_golfer_36x9x11_seed_2_runtime_seconds":90.001511276,"social_golfer_36x9x11_seed_3_final_score":260,"social_golfer_36x9x11_seed_3_unique_contacts":574,"social_golfer_36x9x11_seed_3_best_conflict_positions":61,"social_golfer_36x9x11_seed_3_runtime_seconds":90.00208833500001,"social_golfer_36x9x11_seed_4_final_score":253,"social_golfer_36x9x11_seed_4_unique_contacts":571,"social_golfer_36x9x11_seed_4_best_conflict_positions":67,"social_golfer_36x9x11_seed_4_runtime_seconds":90.0017249,"social_golfer_40x10x10_seed_1_final_score":0,"social_golfer_40x10x10_seed_1_unique_contacts":600,"social_golfer_40x10x10_seed_1_best_conflict_positions":0,"social_golfer_40x10x10_seed_1_runtime_seconds":8.186015127000001,"social_golfer_40x10x10_seed_2_final_score":11,"social_golfer_40x10x10_seed_2_unique_contacts":599,"social_golfer_40x10x10_seed_2_best_conflict_positions":4,"social_golfer_40x10x10_seed_2_runtime_seconds":60.000524961,"social_golfer_40x10x10_seed_3_final_score":0,"social_golfer_40x10x10_seed_3_unique_contacts":600,"social_golfer_40x10x10_seed_3_best_conflict_positions":0,"social_golfer_40x10x10_seed_3_runtime_seconds":27.609225161,"social_golfer_40x10x10_seed_4_final_score":0,"social_golfer_40x10x10_seed_4_unique_contacts":600,"social_golfer_40x10x10_seed_4_best_conflict_positions":0,"social_golfer_40x10x10_seed_4_runtime_seconds":21.704769607,"social_golfer_40x10x11_seed_1_final_score":86,"social_golfer_40x10x11_seed_1_unique_contacts":654,"social_golfer_40x10x11_seed_1_best_conflict_positions":22,"social_golfer_40x10x11_seed_1_runtime_seconds":120.000159584,"social_golfer_40x10x11_seed_2_final_score":88,"social_golfer_40x10x11_seed_2_unique_contacts":652,"social_golfer_40x10x11_seed_2_best_conflict_positions":29,"social_golfer_40x10x11_seed_2_runtime_seconds":120.001609627,"social_golfer_40x10x11_seed_3_final_score":77,"social_golfer_40x10x11_seed_3_unique_contacts":653,"social_golfer_40x10x11_seed_3_best_conflict_positions":26,"social_golfer_40x10x11_seed_3_runtime_seconds":120.000783184,"social_golfer_40x10x11_seed_4_final_score":86,"social_golfer_40x10x11_seed_4_unique_contacts":654,"social_golfer_40x10x11_seed_4_best_conflict_positions":20,"social_golfer_40x10x11_seed_4_runtime_seconds":120.00086001000001},"status":"discard","description":"Tried constructor-side symmetry seeding: build the greedy initializer under a deterministic seed-derived person relabeling, then map back before local search. This changed basins but regressed the bundle overall.","timestamp":1776301802300,"segment":3,"confidence":70.31034482758606,"iterationTokens":23297,"asi":{"hypothesis":"The current constructor may still be trapped by arbitrary person-id tie bias, so a deterministic seed-derived person relabeling could create meaningfully different but still fully honest initial basins without spending extra search budget.","rollback_reason":"Seed-derived person relabeling regressed mean_final_score from 101.95 to 117.7 and reduced solved_runs back to 3, with a major hit on 36x9x11 seed 1.","observations":{"kept_commit":"165fe33","kept_mean_final_score":101.95,"experiment_mean_final_score":117.7,"kept_solved_runs":5,"experiment_solved_runs":3,"32x8x10_scores":[88,176,132,88],"36x9x11_scores":[428,242,260,253]},"learned_tradeoff":"Symmetry-based constructor diversity does change basins, but this particular seeded relabeling degrades the bundle more than it helps; arbitrary label-bias removal is not enough on its own.","next_action_hint":"Revert to the kept late repeat-guidance branch and avoid further arbitrary constructor-symmetry permutations for now. The next experiment should likely touch restart/breakout structure or a more principled constructor bias, not another relabeling trick."}}
{"run":25,"commit":"7f7375a","metric":98.2,"metrics":{"best_final_score":0,"worst_final_score":357,"mean_unique_contacts":566.6,"best_unique_contacts":654,"worst_unique_contacts":474,"solved_runs":5,"mean_best_conflict_positions":27.45,"best_best_conflict_positions":0,"runtime_total_seconds":343.798456145,"social_golfer_32x8x10_seed_1_final_score":0,"social_golfer_32x8x10_seed_1_unique_contacts":480,"social_golfer_32x8x10_seed_1_best_conflict_positions":0,"social_golfer_32x8x10_seed_1_runtime_seconds":3.1356206259999997,"social_golfer_32x8x10_seed_2_final_score":66,"social_golfer_32x8x10_seed_2_unique_contacts":474,"social_golfer_32x8x10_seed_2_best_conflict_positions":24,"social_golfer_32x8x10_seed_2_runtime_seconds":60.000153351,"social_golfer_32x8x10_seed_3_final_score":66,"social_golfer_32x8x10_seed_3_unique_contacts":474,"social_golfer_32x8x10_seed_3_best_conflict_positions":24,"social_golfer_32x8x10_seed_3_runtime_seconds":60.000213742999996,"social_golfer_32x8x10_seed_4_final_score":0,"social_golfer_32x8x10_seed_4_unique_contacts":480,"social_golfer_32x8x10_seed_4_best_conflict_positions":0,"social_golfer_32x8x10_seed_4_runtime_seconds":6.350269686000001,"social_golfer_36x9x10_seed_1_final_score":77,"social_golfer_36x9x10_seed_1_unique_contacts":533,"social_golfer_36x9x10_seed_1_best_conflict_positions":26,"social_golfer_36x9x10_seed_1_runtime_seconds":60.000143936,"social_golfer_36x9x10_seed_2_final_score":77,"social_golfer_36x9x10_seed_2_unique_contacts":533,"social_golfer_36x9x10_seed_2_best_conflict_positions":26,"social_golfer_36x9x10_seed_2_runtime_seconds":60.000938562,"social_golfer_36x9x10_seed_3_final_score":130,"social_golfer_36x9x10_seed_3_unique_contacts":530,"social_golfer_36x9x10_seed_3_best_conflict_positions":35,"social_golfer_36x9x10_seed_3_runtime_seconds":60.000234575,"social_golfer_36x9x10_seed_4_final_score":119,"social_golfer_36x9x10_seed_4_unique_contacts":531,"social_golfer_36x9x10_seed_4_best_conflict_positions":27,"social_golfer_36x9x10_seed_4_runtime_seconds":60.002334058,"social_golfer_36x9x11_seed_1_final_score":251,"social_golfer_36x9x11_seed_1_unique_contacts":573,"social_golfer_36x9x11_seed_1_best_conflict_positions":71,"social_golfer_36x9x11_seed_1_runtime_seconds":90.00242462599999,"social_golfer_36x9x11_seed_2_final_score":357,"social_golfer_36x9x11_seed_2_unique_contacts":567,"social_golfer_36x9x11_seed_2_best_conflict_positions":85,"social_golfer_36x9x11_seed_2_runtime_seconds":90.003555385,"social_golfer_36x9x11_seed_3_final_score":260,"social_golfer_36x9x11_seed_3_unique_contacts":574,"social_golfer_36x9x11_seed_3_best_conflict_positions":58,"social_golfer_36x9x11_seed_3_runtime_seconds":90.00352922500001,"social_golfer_36x9x11_seed_4_final_score":264,"social_golfer_36x9x11_seed_4_unique_contacts":570,"social_golfer_36x9x11_seed_4_best_conflict_positions":71,"social_golfer_36x9x11_seed_4_runtime_seconds":90.000319048,"social_golfer_40x10x10_seed_1_final_score":0,"social_golfer_40x10x10_seed_1_unique_contacts":600,"social_golfer_40x10x10_seed_1_best_conflict_positions":0,"social_golfer_40x10x10_seed_1_runtime_seconds":10.595352809,"social_golfer_40x10x10_seed_2_final_score":0,"social_golfer_40x10x10_seed_2_unique_contacts":600,"social_golfer_40x10x10_seed_2_best_conflict_positions":0,"social_golfer_40x10x10_seed_2_runtime_seconds":46.500620745,"social_golfer_40x10x10_seed_3_final_score":11,"social_golfer_40x10x10_seed_3_unique_contacts":599,"social_golfer_40x10x10_seed_3_best_conflict_positions":4,"social_golfer_40x10x10_seed_3_runtime_seconds":60.000319813999994,"social_golfer_40x10x10_seed_4_final_score":0,"social_golfer_40x10x10_seed_4_unique_contacts":600,"social_golfer_40x10x10_seed_4_best_conflict_positions":0,"social_golfer_40x10x10_seed_4_runtime_seconds":1.6443630149999997,"social_golfer_40x10x11_seed_1_final_score":77,"social_golfer_40x10x11_seed_1_unique_contacts":653,"social_golfer_40x10x11_seed_1_best_conflict_positions":27,"social_golfer_40x10x11_seed_1_runtime_seconds":120.001216915,"social_golfer_40x10x11_seed_2_final_score":77,"social_golfer_40x10x11_seed_2_unique_contacts":653,"social_golfer_40x10x11_seed_2_best_conflict_positions":26,"social_golfer_40x10x11_seed_2_runtime_seconds":120.00099783900001,"social_golfer_40x10x11_seed_3_final_score":66,"social_golfer_40x10x11_seed_3_unique_contacts":654,"social_golfer_40x10x11_seed_3_best_conflict_positions":23,"social_golfer_40x10x11_seed_3_runtime_seconds":120.00031872699999,"social_golfer_40x10x11_seed_4_final_score":66,"social_golfer_40x10x11_seed_4_unique_contacts":654,"social_golfer_40x10x11_seed_4_best_conflict_positions":22,"social_golfer_40x10x11_seed_4_runtime_seconds":120.001044726},"status":"keep","description":"Stopped writing random breakout swaps into the tabu history. That made breakout a true perturbation instead of an immediate short-term prohibition, and it improved the p=4 stretch bundle.","timestamp":1776302402402,"segment":3,"confidence":55.323943661971875,"iterationTokens":14308,"asi":{"hypothesis":"The kept late repeat-guidance branch may be over-constraining its own breakout recovery by immediately tabuing the two random breakout swaps; letting breakout be a pure perturbation could improve repairability without changing the neighborhood or benchmark semantics.","observations":{"previous_best_commit":"165fe33","previous_best_mean_final_score":101.95,"experiment_mean_final_score":98.2,"previous_best_solved_runs":5,"experiment_solved_runs":5,"32x8x10_scores":[0,66,66,0],"40x10x10_scores":[0,0,11,0],"runtime_total_seconds":343.798456145},"learned_tradeoff":"Removing breakout tabu recording materially improved the mean and lowered conflict-position tails while keeping solved-run count at 5; the hardest remaining bundle member is still 36x9x11 seed 2, but breakout now exits plateaus more effectively on the rest of the bundle.","next_action_hint":"Keep breakout as an untabued perturbation. Next experiments should stay in this family of mild plateau-escape structure changes rather than adding more tie-break criteria or arbitrary constructor permutations."}}
