{"run":32,"commit":"d8ffdef","metric":91.25,"metrics":{"best_final_score":0,"worst_final_score":282,"mean_unique_contacts":567.05,"best_unique_contacts":654,"worst_unique_contacts":474,"solved_runs":6,"mean_best_conflict_positions":26.05,"best_best_conflict_positions":0,"runtime_total_seconds":330.062309188,"social_golfer_32x8x10_seed_1_final_score":0,"social_golfer_32x8x10_seed_1_unique_contacts":480,"social_golfer_32x8x10_seed_1_best_conflict_positions":0,"social_golfer_32x8x10_seed_1_runtime_seconds":7.517222920999999,"social_golfer_32x8x10_seed_2_final_score":0,"social_golfer_32x8x10_seed_2_unique_contacts":480,"social_golfer_32x8x10_seed_2_best_conflict_positions":0,"social_golfer_32x8x10_seed_2_runtime_seconds":6.079447626,"social_golfer_32x8x10_seed_3_final_score":66,"social_golfer_32x8x10_seed_3_unique_contacts":474,"social_golfer_32x8x10_seed_3_best_conflict_positions":24,"social_golfer_32x8x10_seed_3_runtime_seconds":60.000706822,"social_golfer_32x8x10_seed_4_final_score":66,"social_golfer_32x8x10_seed_4_unique_contacts":474,"social_golfer_32x8x10_seed_4_best_conflict_positions":24,"social_golfer_32x8x10_seed_4_runtime_seconds":60.000091643,"social_golfer_36x9x10_seed_1_final_score":97,"social_golfer_36x9x10_seed_1_unique_contacts":533,"social_golfer_36x9x10_seed_1_best_conflict_positions":24,"social_golfer_36x9x10_seed_1_runtime_seconds":59.999999583000005,"social_golfer_36x9x10_seed_2_final_score":77,"social_golfer_36x9x10_seed_2_unique_contacts":533,"social_golfer_36x9x10_seed_2_best_conflict_positions":24,"social_golfer_36x9x10_seed_2_runtime_seconds":60.001480688,"social_golfer_36x9x10_seed_3_final_score":108,"social_golfer_36x9x10_seed_3_unique_contacts":532,"social_golfer_36x9x10_seed_3_best_conflict_positions":27,"social_golfer_36x9x10_seed_3_runtime_seconds":59.999958114,"social_golfer_36x9x10_seed_4_final_score":88,"social_golfer_36x9x10_seed_4_unique_contacts":532,"social_golfer_36x9x10_seed_4_best_conflict_positions":32,"social_golfer_36x9x10_seed_4_runtime_seconds":60.001095938,"social_golfer_36x9x11_seed_1_final_score":231,"social_golfer_36x9x11_seed_1_unique_contacts":573,"social_golfer_36x9x11_seed_1_best_conflict_positions":70,"social_golfer_36x9x11_seed_1_runtime_seconds":90.005447752,"social_golfer_36x9x11_seed_2_final_score":282,"social_golfer_36x9x11_seed_2_unique_contacts":572,"social_golfer_36x9x11_seed_2_best_conflict_positions":71,"social_golfer_36x9x11_seed_2_runtime_seconds":90.00114587499999,"social_golfer_36x9x11_seed_3_final_score":275,"social_golfer_36x9x11_seed_3_unique_contacts":569,"social_golfer_36x9x11_seed_3_best_conflict_positions":74,"social_golfer_36x9x11_seed_3_runtime_seconds":90.00100615599999,"social_golfer_36x9x11_seed_4_final_score":229,"social_golfer_36x9x11_seed_4_unique_contacts":575,"social_golfer_36x9x11_seed_4_best_conflict_positions":59,"social_golfer_36x9x11_seed_4_runtime_seconds":90.00100432400001,"social_golfer_40x10x10_seed_1_final_score":0,"social_golfer_40x10x10_seed_1_unique_contacts":600,"social_golfer_40x10x10_seed_1_best_conflict_positions":0,"social_golfer_40x10x10_seed_1_runtime_seconds":9.422140526,"social_golfer_40x10x10_seed_2_final_score":0,"social_golfer_40x10x10_seed_2_unique_contacts":600,"social_golfer_40x10x10_seed_2_best_conflict_positions":0,"social_golfer_40x10x10_seed_2_runtime_seconds":1.681993744,"social_golfer_40x10x10_seed_3_final_score":0,"social_golfer_40x10x10_seed_3_unique_contacts":600,"social_golfer_40x10x10_seed_3_best_conflict_positions":0,"social_golfer_40x10x10_seed_3_runtime_seconds":1.9887039059999998,"social_golfer_40x10x10_seed_4_final_score":0,"social_golfer_40x10x10_seed_4_unique_contacts":600,"social_golfer_40x10x10_seed_4_best_conflict_positions":0,"social_golfer_40x10x10_seed_4_runtime_seconds":1.635485432,"social_golfer_40x10x11_seed_1_final_score":77,"social_golfer_40x10x11_seed_1_unique_contacts":653,"social_golfer_40x10x11_seed_1_best_conflict_positions":25,"social_golfer_40x10x11_seed_1_runtime_seconds":120.000663967,"social_golfer_40x10x11_seed_2_final_score":86,"social_golfer_40x10x11_seed_2_unique_contacts":654,"social_golfer_40x10x11_seed_2_best_conflict_positions":20,"social_golfer_40x10x11_seed_2_runtime_seconds":120.00038749400001,"social_golfer_40x10x11_seed_3_final_score":66,"social_golfer_40x10x11_seed_3_unique_contacts":654,"social_golfer_40x10x11_seed_3_best_conflict_positions":21,"social_golfer_40x10x11_seed_3_runtime_seconds":120.000508028,"social_golfer_40x10x11_seed_4_final_score":77,"social_golfer_40x10x11_seed_4_unique_contacts":653,"social_golfer_40x10x11_seed_4_best_conflict_positions":26,"social_golfer_40x10x11_seed_4_runtime_seconds":120.00039751899999},"status":"keep","description":"Made breakout swaps avoid reusing the same touched positions when possible. This prevents the two random breakout swaps from canceling or overlapping trivially, while keeping breakout untabued and otherwise simple. It improved the p=4 stretch bundle substantially.","timestamp":1776307262432,"segment":3,"confidence":28.515624999999975,"iterationTokens":14494,"asi":{"hypothesis":"The untabued breakout may still waste perturbation budget because its two random swaps can overlap or partially undo each other. Requiring the two breakout swaps to touch distinct positions when possible could strengthen plateau escape without making it more guided.","observations":{"previous_best_commit":"90d883f","previous_best_mean_final_score":97.2,"experiment_mean_final_score":91.25,"previous_best_solved_runs":4,"experiment_solved_runs":6,"32x8x10_scores":[0,0,66,66],"36x9x11_scores":[231,282,275,229],"40x10x10_scores":[0,0,0,0],"runtime_total_seconds":330.062309188},"learned_tradeoff":"This is a strong generic improvement: keeping breakout swaps distinct improved both the hard 36x9x11 tails and solved-run count, while preserving the simple untabued conflict-anchored breakout structure.","next_action_hint":"Use distinct-position untabued breakout as the new baseline. Future breakout work should keep this non-overlap property and look for similarly simple perturbation-efficiency improvements rather than stronger guidance or resets."}}
{"run":33,"commit":"d8ffdef","metric":115.35,"metrics":{"best_final_score":0,"worst_final_score":430,"mean_unique_contacts":565.95,"best_unique_contacts":654,"worst_unique_contacts":474,"solved_runs":5,"mean_best_conflict_positions":28.95,"best_best_conflict_positions":0,"runtime_total_seconds":335.025325859,"social_golfer_32x8x10_seed_1_final_score":0,"social_golfer_32x8x10_seed_1_unique_contacts":480,"social_golfer_32x8x10_seed_1_best_conflict_positions":0,"social_golfer_32x8x10_seed_1_runtime_seconds":3.211832051,"social_golfer_32x8x10_seed_2_final_score":0,"social_golfer_32x8x10_seed_2_unique_contacts":480,"social_golfer_32x8x10_seed_2_best_conflict_positions":0,"social_golfer_32x8x10_seed_2_runtime_seconds":3.622094542,"social_golfer_32x8x10_seed_3_final_score":66,"social_golfer_32x8x10_seed_3_unique_contacts":474,"social_golfer_32x8x10_seed_3_best_conflict_positions":24,"social_golfer_32x8x10_seed_3_runtime_seconds":60.000754816,"social_golfer_32x8x10_seed_4_final_score":66,"social_golfer_32x8x10_seed_4_unique_contacts":474,"social_golfer_32x8x10_seed_4_best_conflict_positions":24,"social_golfer_32x8x10_seed_4_runtime_seconds":60.000417286,"social_golfer_36x9x10_seed_1_final_score":86,"social_golfer_36x9x10_seed_1_unique_contacts":534,"social_golfer_36x9x10_seed_1_best_conflict_positions":20,"social_golfer_36x9x10_seed_1_runtime_seconds":60.001708248,"social_golfer_36x9x10_seed_2_final_score":119,"social_golfer_36x9x10_seed_2_unique_contacts":531,"social_golfer_36x9x10_seed_2_best_conflict_positions":30,"social_golfer_36x9x10_seed_2_runtime_seconds":60.001394595,"social_golfer_36x9x10_seed_3_final_score":139,"social_golfer_36x9x10_seed_3_unique_contacts":531,"social_golfer_36x9x10_seed_3_best_conflict_positions":25,"social_golfer_36x9x10_seed_3_runtime_seconds":60.001014534999996,"social_golfer_36x9x10_seed_4_final_score":77,"social_golfer_36x9x10_seed_4_unique_contacts":533,"social_golfer_36x9x10_seed_4_best_conflict_positions":26,"social_golfer_36x9x10_seed_4_runtime_seconds":60.001485327,"social_golfer_36x9x11_seed_1_final_score":271,"social_golfer_36x9x11_seed_1_unique_contacts":573,"social_golfer_36x9x11_seed_1_best_conflict_positions":71,"social_golfer_36x9x11_seed_1_runtime_seconds":90.000709629,"social_golfer_36x9x11_seed_2_final_score":273,"social_golfer_36x9x11_seed_2_unique_contacts":571,"social_golfer_36x9x11_seed_2_best_conflict_positions":77,"social_golfer_36x9x11_seed_2_runtime_seconds":90.002356559,"social_golfer_36x9x11_seed_3_final_score":430,"social_golfer_36x9x11_seed_3_unique_contacts":564,"social_golfer_36x9x11_seed_3_best_conflict_positions":83,"social_golfer_36x9x11_seed_3_runtime_seconds":90.002435762,"social_golfer_36x9x11_seed_4_final_score":430,"social_golfer_36x9x11_seed_4_unique_contacts":564,"social_golfer_36x9x11_seed_4_best_conflict_positions":94,"social_golfer_36x9x11_seed_4_runtime_seconds":90.00373361199999,"social_golfer_40x10x10_seed_1_final_score":0,"social_golfer_40x10x10_seed_1_unique_contacts":600,"social_golfer_40x10x10_seed_1_best_conflict_positions":0,"social_golfer_40x10x10_seed_1_runtime_seconds":1.755158538,"social_golfer_40x10x10_seed_2_final_score":0,"social_golfer_40x10x10_seed_2_unique_contacts":600,"social_golfer_40x10x10_seed_2_best_conflict_positions":0,"social_golfer_40x10x10_seed_2_runtime_seconds":1.9352652889999997,"social_golfer_40x10x10_seed_3_final_score":11,"social_golfer_40x10x10_seed_3_unique_contacts":599,"social_golfer_40x10x10_seed_3_best_conflict_positions":4,"social_golfer_40x10x10_seed_3_runtime_seconds":60.000042885,"social_golfer_40x10x10_seed_4_final_score":0,"social_golfer_40x10x10_seed_4_unique_contacts":600,"social_golfer_40x10x10_seed_4_best_conflict_positions":0,"social_golfer_40x10x10_seed_4_runtime_seconds":1.596123417,"social_golfer_40x10x11_seed_1_final_score":77,"social_golfer_40x10x11_seed_1_unique_contacts":653,"social_golfer_40x10x11_seed_1_best_conflict_positions":26,"social_golfer_40x10x11_seed_1_runtime_seconds":120.004802218,"social_golfer_40x10x11_seed_2_final_score":88,"social_golfer_40x10x11_seed_2_unique_contacts":652,"social_golfer_40x10x11_seed_2_best_conflict_positions":23,"social_golfer_40x10x11_seed_2_runtime_seconds":120.000805816,"social_golfer_40x10x11_seed_3_final_score":108,"social_golfer_40x10x11_seed_3_unique_contacts":652,"social_golfer_40x10x11_seed_3_best_conflict_positions":29,"social_golfer_40x10x11_seed_3_runtime_seconds":120.003961589,"social_golfer_40x10x11_seed_4_final_score":66,"social_golfer_40x10x11_seed_4_unique_contacts":654,"social_golfer_40x10x11_seed_4_best_conflict_positions":23,"social_golfer_40x10x11_seed_4_runtime_seconds":120.000415724},"status":"discard","description":"Tried strengthening breakout efficiency further by avoiding reuse of the same groups when both breakout swaps hit the same week, on top of the existing distinct-position rule. This regressed the p=4 stretch bundle badly.","timestamp":1776308762409,"segment":3,"confidence":31.46551724137925,"iterationTokens":14494,"asi":{"hypothesis":"The next mild breakout-efficiency step was to avoid reusing the same groups when both breakout swaps hit the same week, so the perturbation would spread across four groups instead of clustering into two or three.","rollback_reason":"This over-structured breakout. mean_final_score regressed from 91.25 to 115.35, and the hard 36x9x11 tails blew up to 430 on two seeds.","observations":{"kept_commit":"d8ffdef","kept_mean_final_score":91.25,"experiment_mean_final_score":115.35,"kept_solved_runs":6,"experiment_solved_runs":5,"36x9x11_scores":[271,273,430,430],"40x10x10_scores":[0,0,11,0]},"learned_tradeoff":"Distinct-position breakout was helpful, but adding a same-week distinct-group requirement pushed the perturbation too far toward forced spreading. Breakout still wants to stay concentrated on the hard structure rather than explicitly covering more groups.","next_action_hint":"Do not revisit same-week group-spreading for breakout. Keep the distinct-position rule but otherwise preserve concentrated breakout, and look for milder ideas outside explicit spread constraints."}}
{"run":34,"commit":"d8ffdef","metric":97.9,"metrics":{"best_final_score":0,"worst_final_score":282,"mean_unique_contacts":566.9,"best_unique_contacts":654,"worst_unique_contacts":474,"solved_runs":6,"mean_best_conflict_positions":26.45,"best_best_conflict_positions":0,"runtime_total_seconds":330.06383265,"social_golfer_32x8x10_seed_1_final_score":0,"social_golfer_32x8x10_seed_1_unique_contacts":480,"social_golfer_32x8x10_seed_1_best_conflict_positions":0,"social_golfer_32x8x10_seed_1_runtime_seconds":7.433870197,"social_golfer_32x8x10_seed_2_final_score":0,"social_golfer_32x8x10_seed_2_unique_contacts":480,"social_golfer_32x8x10_seed_2_best_conflict_positions":0,"social_golfer_32x8x10_seed_2_runtime_seconds":5.832728035999999,"social_golfer_32x8x10_seed_3_final_score":66,"social_golfer_32x8x10_seed_3_unique_contacts":474,"social_golfer_32x8x10_seed_3_best_conflict_positions":24,"social_golfer_32x8x10_seed_3_runtime_seconds":60.000859358,"social_golfer_32x8x10_seed_4_final_score":66,"social_golfer_32x8x10_seed_4_unique_contacts":474,"social_golfer_32x8x10_seed_4_best_conflict_positions":24,"social_golfer_32x8x10_seed_4_runtime_seconds":60.000911106,"social_golfer_36x9x10_seed_1_final_score":108,"social_golfer_36x9x10_seed_1_unique_contacts":532,"social_golfer_36x9x10_seed_1_best_conflict_positions":29,"social_golfer_36x9x10_seed_1_runtime_seconds":60.001505824,"social_golfer_36x9x10_seed_2_final_score":181,"social_golfer_36x9x10_seed_2_unique_contacts":529,"social_golfer_36x9x10_seed_2_best_conflict_positions":30,"social_golfer_36x9x10_seed_2_runtime_seconds":60.000554123,"social_golfer_36x9x10_seed_3_final_score":97,"social_golfer_36x9x10_seed_3_unique_contacts":533,"social_golfer_36x9x10_seed_3_best_conflict_positions":26,"social_golfer_36x9x10_seed_3_runtime_seconds":60.00016765899999,"social_golfer_36x9x10_seed_4_final_score":99,"social_golfer_36x9x10_seed_4_unique_contacts":531,"social_golfer_36x9x10_seed_4_best_conflict_positions":32,"social_golfer_36x9x10_seed_4_runtime_seconds":60.00108881,"social_golfer_36x9x11_seed_1_final_score":220,"social_golfer_36x9x11_seed_1_unique_contacts":574,"social_golfer_36x9x11_seed_1_best_conflict_positions":68,"social_golfer_36x9x11_seed_1_runtime_seconds":90.00115477499999,"social_golfer_36x9x11_seed_2_final_score":282,"social_golfer_36x9x11_seed_2_unique_contacts":572,"social_golfer_36x9x11_seed_2_best_conflict_positions":68,"social_golfer_36x9x11_seed_2_runtime_seconds":90.002819132,"social_golfer_36x9x11_seed_3_final_score":271,"social_golfer_36x9x11_seed_3_unique_contacts":573,"social_golfer_36x9x11_seed_3_best_conflict_positions":65,"social_golfer_36x9x11_seed_3_runtime_seconds":90.001652451,"social_golfer_36x9x11_seed_4_final_score":240,"social_golfer_36x9x11_seed_4_unique_contacts":574,"social_golfer_36x9x11_seed_4_best_conflict_positions":67,"social_golfer_36x9x11_seed_4_runtime_seconds":90.000116444,"social_golfer_40x10x10_seed_1_final_score":0,"social_golfer_40x10x10_seed_1_unique_contacts":600,"social_golfer_40x10x10_seed_1_best_conflict_positions":0,"social_golfer_40x10x10_seed_1_runtime_seconds":46.519700254,"social_golfer_40x10x10_seed_2_final_score":0,"social_golfer_40x10x10_seed_2_unique_contacts":600,"social_golfer_40x10x10_seed_2_best_conflict_positions":0,"social_golfer_40x10x10_seed_2_runtime_seconds":1.687303981,"social_golfer_40x10x10_seed_3_final_score":0,"social_golfer_40x10x10_seed_3_unique_contacts":600,"social_golfer_40x10x10_seed_3_best_conflict_positions":0,"social_golfer_40x10x10_seed_3_runtime_seconds":2.0262395360000003,"social_golfer_40x10x10_seed_4_final_score":0,"social_golfer_40x10x10_seed_4_unique_contacts":600,"social_golfer_40x10x10_seed_4_best_conflict_positions":0,"social_golfer_40x10x10_seed_4_runtime_seconds":1.7803624560000002,"social_golfer_40x10x11_seed_1_final_score":66,"social_golfer_40x10x11_seed_1_unique_contacts":654,"social_golfer_40x10x11_seed_1_best_conflict_positions":23,"social_golfer_40x10x11_seed_1_runtime_seconds":120.000706456,"social_golfer_40x10x11_seed_2_final_score":86,"social_golfer_40x10x11_seed_2_unique_contacts":654,"social_golfer_40x10x11_seed_2_best_conflict_positions":20,"social_golfer_40x10x11_seed_2_runtime_seconds":120.000703861,"social_golfer_40x10x11_seed_3_final_score":77,"social_golfer_40x10x11_seed_3_unique_contacts":653,"social_golfer_40x10x11_seed_3_best_conflict_positions":26,"social_golfer_40x10x11_seed_3_runtime_seconds":120.00045499499998,"social_golfer_40x10x11_seed_4_final_score":99,"social_golfer_40x10x11_seed_4_unique_contacts":651,"social_golfer_40x10x11_seed_4_best_conflict_positions":27,"social_golfer_40x10x11_seed_4_runtime_seconds":120.001392828},"status":"discard","description":"Tried making late active-repeated-pair guidance even more selective by delaying it from 3+ to 4+ non-improving iterations. This softened the guidance too much and regressed the bundle versus the current best.","timestamp":1776309482403,"segment":3,"confidence":28.515624999999975,"iterationTokens":12426,"asi":{"hypothesis":"The current late repeat-guidance may still be slightly too eager. Delaying activation from 3+ to 4+ non-improving iterations could keep the useful signal only for deeper plateaus.","rollback_reason":"The stricter threshold regressed mean_final_score from 91.25 to 97.9. The current 3+ activation remains the better late-stage balance.","observations":{"kept_commit":"d8ffdef","kept_mean_final_score":91.25,"experiment_mean_final_score":97.9,"kept_solved_runs":6,"experiment_solved_runs":6,"36x9x10_scores":[108,181,97,99],"36x9x11_scores":[220,282,271,240],"40x10x10_scores":[0,0,0,0]},"learned_tradeoff":"Late repeat-guidance helps only in a narrow window: 2+ was too early, 4+ is too late, and 3+ remains the current best threshold.","next_action_hint":"Keep the existing 3+ threshold. If guidance is revisited again, avoid moving the activation later; look for different mild, generic ideas rather than more threshold pushing."}}
