{"run":17,"commit":"0c2b168","metric":132.05,"metrics":{"best_final_score":0,"worst_final_score":344,"mean_unique_contacts":564.25,"best_unique_contacts":653,"worst_unique_contacts":466,"solved_runs":1,"mean_best_conflict_positions":35.15,"best_best_conflict_positions":0,"runtime_total_seconds":390.091335679,"social_golfer_32x8x10_seed_1_final_score":154,"social_golfer_32x8x10_seed_1_unique_contacts":466,"social_golfer_32x8x10_seed_1_best_conflict_positions":56,"social_golfer_32x8x10_seed_1_runtime_seconds":60.00039725199999,"social_golfer_32x8x10_seed_2_final_score":66,"social_golfer_32x8x10_seed_2_unique_contacts":474,"social_golfer_32x8x10_seed_2_best_conflict_positions":24,"social_golfer_32x8x10_seed_2_runtime_seconds":60.001059311,"social_golfer_32x8x10_seed_3_final_score":154,"social_golfer_32x8x10_seed_3_unique_contacts":466,"social_golfer_32x8x10_seed_3_best_conflict_positions":56,"social_golfer_32x8x10_seed_3_runtime_seconds":60.000306531999996,"social_golfer_32x8x10_seed_4_final_score":0,"social_golfer_32x8x10_seed_4_unique_contacts":480,"social_golfer_32x8x10_seed_4_best_conflict_positions":0,"social_golfer_32x8x10_seed_4_runtime_seconds":1.298973095,"social_golfer_36x9x10_seed_1_final_score":130,"social_golfer_36x9x10_seed_1_unique_contacts":530,"social_golfer_36x9x10_seed_1_best_conflict_positions":36,"social_golfer_36x9x10_seed_1_runtime_seconds":59.999944176999996,"social_golfer_36x9x10_seed_2_final_score":99,"social_golfer_36x9x10_seed_2_unique_contacts":531,"social_golfer_36x9x10_seed_2_best_conflict_positions":29,"social_golfer_36x9x10_seed_2_runtime_seconds":60.002060454,"social_golfer_36x9x10_seed_3_final_score":130,"social_golfer_36x9x10_seed_3_unique_contacts":530,"social_golfer_36x9x10_seed_3_best_conflict_positions":34,"social_golfer_36x9x10_seed_3_runtime_seconds":60.000355234,"social_golfer_36x9x10_seed_4_final_score":108,"social_golfer_36x9x10_seed_4_unique_contacts":532,"social_golfer_36x9x10_seed_4_best_conflict_positions":23,"social_golfer_36x9x10_seed_4_runtime_seconds":60.004904714,"social_golfer_36x9x11_seed_1_final_score":273,"social_golfer_36x9x11_seed_1_unique_contacts":571,"social_golfer_36x9x11_seed_1_best_conflict_positions":76,"social_golfer_36x9x11_seed_1_runtime_seconds":90.00286287200001,"social_golfer_36x9x11_seed_2_final_score":284,"social_golfer_36x9x11_seed_2_unique_contacts":570,"social_golfer_36x9x11_seed_2_best_conflict_positions":82,"social_golfer_36x9x11_seed_2_runtime_seconds":90.00302819999999,"social_golfer_36x9x11_seed_3_final_score":315,"social_golfer_36x9x11_seed_3_unique_contacts":569,"social_golfer_36x9x11_seed_3_best_conflict_positions":67,"social_golfer_36x9x11_seed_3_runtime_seconds":90.001166093,"social_golfer_36x9x11_seed_4_final_score":344,"social_golfer_36x9x11_seed_4_unique_contacts":570,"social_golfer_36x9x11_seed_4_best_conflict_positions":64,"social_golfer_36x9x11_seed_4_runtime_seconds":90.000010717,"social_golfer_40x10x10_seed_1_final_score":22,"social_golfer_40x10x10_seed_1_unique_contacts":598,"social_golfer_40x10x10_seed_1_best_conflict_positions":7,"social_golfer_40x10x10_seed_1_runtime_seconds":60.002231035,"social_golfer_40x10x10_seed_2_final_score":22,"social_golfer_40x10x10_seed_2_unique_contacts":598,"social_golfer_40x10x10_seed_2_best_conflict_positions":8,"social_golfer_40x10x10_seed_2_runtime_seconds":60.001693149,"social_golfer_40x10x10_seed_3_final_score":22,"social_golfer_40x10x10_seed_3_unique_contacts":598,"social_golfer_40x10x10_seed_3_best_conflict_positions":8,"social_golfer_40x10x10_seed_3_runtime_seconds":60.000260083,"social_golfer_40x10x10_seed_4_final_score":11,"social_golfer_40x10x10_seed_4_unique_contacts":599,"social_golfer_40x10x10_seed_4_best_conflict_positions":4,"social_golfer_40x10x10_seed_4_runtime_seconds":60.001660934,"social_golfer_40x10x11_seed_1_final_score":110,"social_golfer_40x10x11_seed_1_unique_contacts":650,"social_golfer_40x10x11_seed_1_best_conflict_positions":32,"social_golfer_40x10x11_seed_1_runtime_seconds":120.00125274899999,"social_golfer_40x10x11_seed_2_final_score":119,"social_golfer_40x10x11_seed_2_unique_contacts":651,"social_golfer_40x10x11_seed_2_best_conflict_positions":33,"social_golfer_40x10x11_seed_2_runtime_seconds":120.00441147000001,"social_golfer_40x10x11_seed_3_final_score":201,"social_golfer_40x10x11_seed_3_unique_contacts":649,"social_golfer_40x10x11_seed_3_best_conflict_positions":37,"social_golfer_40x10x11_seed_3_runtime_seconds":120.000202831,"social_golfer_40x10x11_seed_4_final_score":77,"social_golfer_40x10x11_seed_4_unique_contacts":653,"social_golfer_40x10x11_seed_4_best_conflict_positions":27,"social_golfer_40x10x11_seed_4_runtime_seconds":120.000937255},"status":"discard","description":"Tried a lightweight elite-week transplant inspired by solver3 donor-session ideas: on breakout, if the current schedule differs from the incumbent best schedule in the chosen max-conflict week, copy that week from the incumbent instead of doing two blind random swaps. This was far too destabilizing for the bundle.","timestamp":1776295819228,"segment":3,"confidence":46.52083333333322,"iterationTokens":15110,"asi":{"hypothesis":"A donor-session-style breakout may be a safer orthogonal diversification operator than greedy week repair: transplant a single elite week from the incumbent best schedule only when the current schedule has drifted in that same max-conflict week.","rollback_reason":"The elite-week transplant made the bundle much worse, dropping solved runs from 3 to 1 and raising mean_final_score from 111.65 to 132.05.","observations":{"baseline_mean_final_score":111.65,"experiment_mean_final_score":132.05,"baseline_solved_runs":3,"experiment_solved_runs":1,"32x8x10_scores":[154,66,154,0],"40x10x11_scores":[110,119,201,77]},"dead_end":"Whole-week state transplants are still too coarse for solver4's current basin geometry, even when the donor week comes from the incumbent best schedule rather than the constructor.","next_action_hint":"Avoid coarse week-level perturbations. Next promising direction remains constructor-side or move-ranking diversity that changes basin entry more gently, not breakout replacement."}}
{"run":18,"commit":"0c2b168","metric":111.65,"metrics":{"best_final_score":0,"worst_final_score":324,"mean_unique_contacts":565.65,"best_unique_contacts":656,"worst_unique_contacts":464,"solved_runs":3,"mean_best_conflict_positions":31.05,"best_best_conflict_positions":0,"runtime_total_seconds":390.091342211,"social_golfer_32x8x10_seed_1_final_score":0,"social_golfer_32x8x10_seed_1_unique_contacts":480,"social_golfer_32x8x10_seed_1_best_conflict_positions":0,"social_golfer_32x8x10_seed_1_runtime_seconds":4.408590055,"social_golfer_32x8x10_seed_2_final_score":0,"social_golfer_32x8x10_seed_2_unique_contacts":480,"social_golfer_32x8x10_seed_2_best_conflict_positions":0,"social_golfer_32x8x10_seed_2_runtime_seconds":1.487698283,"social_golfer_32x8x10_seed_3_final_score":176,"social_golfer_32x8x10_seed_3_unique_contacts":464,"social_golfer_32x8x10_seed_3_best_conflict_positions":64,"social_golfer_32x8x10_seed_3_runtime_seconds":60.000046695,"social_golfer_32x8x10_seed_4_final_score":176,"social_golfer_32x8x10_seed_4_unique_contacts":464,"social_golfer_32x8x10_seed_4_best_conflict_positions":64,"social_golfer_32x8x10_seed_4_runtime_seconds":60.000174539,"social_golfer_36x9x10_seed_1_final_score":88,"social_golfer_36x9x10_seed_1_unique_contacts":532,"social_golfer_36x9x10_seed_1_best_conflict_positions":25,"social_golfer_36x9x10_seed_1_runtime_seconds":60.000297477000004,"social_golfer_36x9x10_seed_2_final_score":88,"social_golfer_36x9x10_seed_2_unique_contacts":532,"social_golfer_36x9x10_seed_2_best_conflict_positions":28,"social_golfer_36x9x10_seed_2_runtime_seconds":60.000904417,"social_golfer_36x9x10_seed_3_final_score":128,"social_golfer_36x9x10_seed_3_unique_contacts":532,"social_golfer_36x9x10_seed_3_best_conflict_positions":25,"social_golfer_36x9x10_seed_3_runtime_seconds":60.000461947,"social_golfer_36x9x10_seed_4_final_score":77,"social_golfer_36x9x10_seed_4_unique_contacts":533,"social_golfer_36x9x10_seed_4_best_conflict_positions":26,"social_golfer_36x9x10_seed_4_runtime_seconds":60.00077302100001,"social_golfer_36x9x11_seed_1_final_score":291,"social_golfer_36x9x11_seed_1_unique_contacts":573,"social_golfer_36x9x11_seed_1_best_conflict_positions":67,"social_golfer_36x9x11_seed_1_runtime_seconds":90.002072436,"social_golfer_36x9x11_seed_2_final_score":251,"social_golfer_36x9x11_seed_2_unique_contacts":573,"social_golfer_36x9x11_seed_2_best_conflict_positions":67,"social_golfer_36x9x11_seed_2_runtime_seconds":90.002713688,"social_golfer_36x9x11_seed_3_final_score":324,"social_golfer_36x9x11_seed_3_unique_contacts":570,"social_golfer_36x9x11_seed_3_best_conflict_positions":70,"social_golfer_36x9x11_seed_3_runtime_seconds":90.003244329,"social_golfer_36x9x11_seed_4_final_score":275,"social_golfer_36x9x11_seed_4_unique_contacts":569,"social_golfer_36x9x11_seed_4_best_conflict_positions":82,"social_golfer_36x9x11_seed_4_runtime_seconds":90.00260113399999,"social_golfer_40x10x10_seed_1_final_score":11,"social_golfer_40x10x10_seed_1_unique_contacts":599,"social_golfer_40x10x10_seed_1_best_conflict_positions":4,"social_golfer_40x10x10_seed_1_runtime_seconds":60.000405355000005,"social_golfer_40x10x10_seed_2_final_score":11,"social_golfer_40x10x10_seed_2_unique_contacts":599,"social_golfer_40x10x10_seed_2_best_conflict_positions":4,"social_golfer_40x10x10_seed_2_runtime_seconds":60.000457407999995,"social_golfer_40x10x10_seed_3_final_score":0,"social_golfer_40x10x10_seed_3_unique_contacts":600,"social_golfer_40x10x10_seed_3_best_conflict_positions":0,"social_golfer_40x10x10_seed_3_runtime_seconds":25.552160223,"social_golfer_40x10x10_seed_4_final_score":11,"social_golfer_40x10x10_seed_4_unique_contacts":599,"social_golfer_40x10x10_seed_4_best_conflict_positions":4,"social_golfer_40x10x10_seed_4_runtime_seconds":60.000428611,"social_golfer_40x10x11_seed_1_final_score":44,"social_golfer_40x10x11_seed_1_unique_contacts":656,"social_golfer_40x10x11_seed_1_best_conflict_positions":16,"social_golfer_40x10x11_seed_1_runtime_seconds":120.000601951,"social_golfer_40x10x11_seed_2_final_score":108,"social_golfer_40x10x11_seed_2_unique_contacts":652,"social_golfer_40x10x11_seed_2_best_conflict_positions":26,"social_golfer_40x10x11_seed_2_runtime_seconds":120.000323069,"social_golfer_40x10x11_seed_3_final_score":97,"social_golfer_40x10x11_seed_3_unique_contacts":653,"social_golfer_40x10x11_seed_3_best_conflict_positions":24,"social_golfer_40x10x11_seed_3_runtime_seconds":119.999929193,"social_golfer_40x10x11_seed_4_final_score":77,"social_golfer_40x10x11_seed_4_unique_contacts":653,"social_golfer_40x10x11_seed_4_best_conflict_positions":25,"social_golfer_40x10x11_seed_4_runtime_seconds":120.00108696299999},"status":"discard","description":"Tried a constructor-side dual-seed idea: evaluate both the normal greedy week order and the reversed week order, then start local search from whichever initial schedule has the lower initial paper objective. In practice this was effectively a wash against the current baseline.","timestamp":1776296427209,"segment":3,"confidence":38.500000000000114,"iterationTokens":14472,"asi":{"hypothesis":"A gentle constructor-side diversity change might help without destabilizing solved seeds: build both forward-week and reverse-week greedy schedules, then keep the better initial basin before local search.","rollback_reason":"The dual week-order seeding produced effectively the same bundle quality as the existing baseline, so it did not justify changing the algorithm.","observations":{"baseline_mean_final_score":111.65,"experiment_mean_final_score":111.65,"baseline_solved_runs":3,"experiment_solved_runs":3,"result":"no meaningful change"},"next_action_hint":"Keep this as a neutral result and continue exploring other constructor-side diversity or finer-grained local-search guidance; do not keep the extra complexity for a no-op."}}
{"run":19,"commit":"0c2b168","metric":112.9,"metrics":{"best_final_score":0,"worst_final_score":450,"mean_unique_contacts":565.9,"best_unique_contacts":654,"worst_unique_contacts":464,"solved_runs":3,"mean_best_conflict_positions":30.6,"best_best_conflict_positions":0,"runtime_total_seconds":390.085444354,"social_golfer_32x8x10_seed_1_final_score":0,"social_golfer_32x8x10_seed_1_unique_contacts":480,"social_golfer_32x8x10_seed_1_best_conflict_positions":0,"social_golfer_32x8x10_seed_1_runtime_seconds":6.111165037,"social_golfer_32x8x10_seed_2_final_score":0,"social_golfer_32x8x10_seed_2_unique_contacts":480,"social_golfer_32x8x10_seed_2_best_conflict_positions":0,"social_golfer_32x8x10_seed_2_runtime_seconds":5.330704355,"social_golfer_32x8x10_seed_3_final_score":66,"social_golfer_32x8x10_seed_3_unique_contacts":474,"social_golfer_32x8x10_seed_3_best_conflict_positions":24,"social_golfer_32x8x10_seed_3_runtime_seconds":60.001152306,"social_golfer_32x8x10_seed_4_final_score":176,"social_golfer_32x8x10_seed_4_unique_contacts":464,"social_golfer_32x8x10_seed_4_best_conflict_positions":64,"social_golfer_32x8x10_seed_4_runtime_seconds":60.001011952999995,"social_golfer_36x9x10_seed_1_final_score":108,"social_golfer_36x9x10_seed_1_unique_contacts":532,"social_golfer_36x9x10_seed_1_best_conflict_positions":28,"social_golfer_36x9x10_seed_1_runtime_seconds":60.003440163,"social_golfer_36x9x10_seed_2_final_score":77,"social_golfer_36x9x10_seed_2_unique_contacts":533,"social_golfer_36x9x10_seed_2_best_conflict_positions":26,"social_golfer_36x9x10_seed_2_runtime_seconds":60.000275698,"social_golfer_36x9x10_seed_3_final_score":108,"social_golfer_36x9x10_seed_3_unique_contacts":532,"social_golfer_36x9x10_seed_3_best_conflict_positions":28,"social_golfer_36x9x10_seed_3_runtime_seconds":60.001378834,"social_golfer_36x9x10_seed_4_final_score":77,"social_golfer_36x9x10_seed_4_unique_contacts":533,"social_golfer_36x9x10_seed_4_best_conflict_positions":26,"social_golfer_36x9x10_seed_4_runtime_seconds":60.001291267,"social_golfer_36x9x11_seed_1_final_score":238,"social_golfer_36x9x11_seed_1_unique_contacts":576,"social_golfer_36x9x11_seed_1_best_conflict_positions":63,"social_golfer_36x9x11_seed_1_runtime_seconds":90.00055294500001,"social_golfer_36x9x11_seed_2_final_score":450,"social_golfer_36x9x11_seed_2_unique_contacts":564,"social_golfer_36x9x11_seed_2_best_conflict_positions":89,"social_golfer_36x9x11_seed_2_runtime_seconds":90.002528163,"social_golfer_36x9x11_seed_3_final_score":302,"social_golfer_36x9x11_seed_3_unique_contacts":572,"social_golfer_36x9x11_seed_3_best_conflict_positions":67,"social_golfer_36x9x11_seed_3_runtime_seconds":90.00305691099999,"social_golfer_36x9x11_seed_4_final_score":253,"social_golfer_36x9x11_seed_4_unique_contacts":571,"social_golfer_36x9x11_seed_4_best_conflict_positions":79,"social_golfer_36x9x11_seed_4_runtime_seconds":90.002882504,"social_golfer_40x10x10_seed_1_final_score":11,"social_golfer_40x10x10_seed_1_unique_contacts":599,"social_golfer_40x10x10_seed_1_best_conflict_positions":4,"social_golfer_40x10x10_seed_1_runtime_seconds":60.001675379,"social_golfer_40x10x10_seed_2_final_score":0,"social_golfer_40x10x10_seed_2_unique_contacts":600,"social_golfer_40x10x10_seed_2_best_conflict_positions":0,"social_golfer_40x10x10_seed_2_runtime_seconds":43.655231116,"social_golfer_40x10x10_seed_3_final_score":11,"social_golfer_40x10x10_seed_3_unique_contacts":599,"social_golfer_40x10x10_seed_3_best_conflict_positions":4,"social_golfer_40x10x10_seed_3_runtime_seconds":60.000339645,"social_golfer_40x10x10_seed_4_final_score":11,"social_golfer_40x10x10_seed_4_unique_contacts":599,"social_golfer_40x10x10_seed_4_best_conflict_positions":4,"social_golfer_40x10x10_seed_4_runtime_seconds":60.000407654,"social_golfer_40x10x11_seed_1_final_score":88,"social_golfer_40x10x11_seed_1_unique_contacts":652,"social_golfer_40x10x11_seed_1_best_conflict_positions":29,"social_golfer_40x10x11_seed_1_runtime_seconds":120.000289916,"social_golfer_40x10x11_seed_2_final_score":139,"social_golfer_40x10x11_seed_2_unique_contacts":651,"social_golfer_40x10x11_seed_2_best_conflict_positions":25,"social_golfer_40x10x11_seed_2_runtime_seconds":120.005487327,"social_golfer_40x10x11_seed_3_final_score":66,"social_golfer_40x10x11_seed_3_unique_contacts":654,"social_golfer_40x10x11_seed_3_best_conflict_positions":24,"social_golfer_40x10x11_seed_3_runtime_seconds":120.001669032,"social_golfer_40x10x11_seed_4_final_score":77,"social_golfer_40x10x11_seed_4_unique_contacts":653,"social_golfer_40x10x11_seed_4_best_conflict_positions":28,"social_golfer_40x10x11_seed_4_runtime_seconds":120.000603613},"status":"discard","description":"Tried a solver3-style repeat-guidance refinement inside local-search tie-breaking: among swaps already tied on conflict positions and repeat excess, prefer the move that leaves fewer distinct active repeated pairs before using weekly conflict concentration and lexicographic order. This improved one 32x8x10 seed and one 36x9x11 seed, but still regressed the bundle mean slightly because other hard seeds worsened.","timestamp":1776297170343,"segment":3,"confidence":66.65671641791056,"iterationTokens":11811,"asi":{"hypothesis":"Among equal-conflict, equal-repeat swaps, favoring lower active repeated-pair count should improve future repairability more generally than the previous max-changed-pair-burden tie-break.","rollback_reason":"The active-repeated-pairs tie-break helped some individual seeds but still raised the bundle mean from 111.65 to 112.9, mainly because 36x9x11 seed 2 blew up to 450 and 32x8x10 seed 4 stayed stuck.","observations":{"baseline_mean_final_score":111.65,"experiment_mean_final_score":112.9,"baseline_solved_runs":3,"experiment_solved_runs":3,"32x8x10_scores":[0,0,66,176],"36x9x11_scores":[238,450,302,253]},"learned_tradeoff":"This signal is more promising than the previous pair-burden max tie-break, but it still oversteers some hard large-case basins.","next_action_hint":"Revert this tie-break and try a different gentle constructor-side diversity idea or a more localized repeat-guidance signal that only activates on severely stagnating runs."}}
