{"run":41,"commit":"9f33e41","metric":81.7,"metrics":{"best_final_score":0,"worst_final_score":313,"mean_unique_contacts":568.1,"best_unique_contacts":655,"worst_unique_contacts":480,"solved_runs":6,"mean_best_conflict_positions":21.65,"best_best_conflict_positions":0,"runtime_total_seconds":333.086298284,"social_golfer_32x8x10_seed_1_final_score":0,"social_golfer_32x8x10_seed_1_unique_contacts":480,"social_golfer_32x8x10_seed_1_best_conflict_positions":0,"social_golfer_32x8x10_seed_1_runtime_seconds":2.979058194,"social_golfer_32x8x10_seed_2_final_score":0,"social_golfer_32x8x10_seed_2_unique_contacts":480,"social_golfer_32x8x10_seed_2_best_conflict_positions":0,"social_golfer_32x8x10_seed_2_runtime_seconds":3.3907638600000003,"social_golfer_32x8x10_seed_3_final_score":0,"social_golfer_32x8x10_seed_3_unique_contacts":480,"social_golfer_32x8x10_seed_3_best_conflict_positions":0,"social_golfer_32x8x10_seed_3_runtime_seconds":2.733870577,"social_golfer_32x8x10_seed_4_final_score":0,"social_golfer_32x8x10_seed_4_unique_contacts":480,"social_golfer_32x8x10_seed_4_best_conflict_positions":0,"social_golfer_32x8x10_seed_4_runtime_seconds":1.460345861,"social_golfer_36x9x10_seed_1_final_score":97,"social_golfer_36x9x10_seed_1_unique_contacts":533,"social_golfer_36x9x10_seed_1_best_conflict_positions":25,"social_golfer_36x9x10_seed_1_runtime_seconds":60.000552488,"social_golfer_36x9x10_seed_2_final_score":66,"social_golfer_36x9x10_seed_2_unique_contacts":534,"social_golfer_36x9x10_seed_2_best_conflict_positions":24,"social_golfer_36x9x10_seed_2_runtime_seconds":60.001405284,"social_golfer_36x9x10_seed_3_final_score":55,"social_golfer_36x9x10_seed_3_unique_contacts":535,"social_golfer_36x9x10_seed_3_best_conflict_positions":20,"social_golfer_36x9x10_seed_3_runtime_seconds":60.000295605000005,"social_golfer_36x9x10_seed_4_final_score":66,"social_golfer_36x9x10_seed_4_unique_contacts":534,"social_golfer_36x9x10_seed_4_best_conflict_positions":23,"social_golfer_36x9x10_seed_4_runtime_seconds":60.002299063,"social_golfer_36x9x11_seed_1_final_score":313,"social_golfer_36x9x11_seed_1_unique_contacts":571,"social_golfer_36x9x11_seed_1_best_conflict_positions":67,"social_golfer_36x9x11_seed_1_runtime_seconds":90.002414664,"social_golfer_36x9x11_seed_2_final_score":291,"social_golfer_36x9x11_seed_2_unique_contacts":573,"social_golfer_36x9x11_seed_2_best_conflict_positions":57,"social_golfer_36x9x11_seed_2_runtime_seconds":90.001837625,"social_golfer_36x9x11_seed_3_final_score":198,"social_golfer_36x9x11_seed_3_unique_contacts":576,"social_golfer_36x9x11_seed_3_best_conflict_positions":63,"social_golfer_36x9x11_seed_3_runtime_seconds":90.000427671,"social_golfer_36x9x11_seed_4_final_score":251,"social_golfer_36x9x11_seed_4_unique_contacts":573,"social_golfer_36x9x11_seed_4_best_conflict_positions":64,"social_golfer_36x9x11_seed_4_runtime_seconds":90.00394452799999,"social_golfer_40x10x10_seed_1_final_score":0,"social_golfer_40x10x10_seed_1_unique_contacts":600,"social_golfer_40x10x10_seed_1_best_conflict_positions":0,"social_golfer_40x10x10_seed_1_runtime_seconds":2.8781968620000002,"social_golfer_40x10x10_seed_2_final_score":11,"social_golfer_40x10x10_seed_2_unique_contacts":599,"social_golfer_40x10x10_seed_2_best_conflict_positions":4,"social_golfer_40x10x10_seed_2_runtime_seconds":60.000126926,"social_golfer_40x10x10_seed_3_final_score":11,"social_golfer_40x10x10_seed_3_unique_contacts":599,"social_golfer_40x10x10_seed_3_best_conflict_positions":4,"social_golfer_40x10x10_seed_3_runtime_seconds":60.000567345,"social_golfer_40x10x10_seed_4_final_score":0,"social_golfer_40x10x10_seed_4_unique_contacts":600,"social_golfer_40x10x10_seed_4_best_conflict_positions":0,"social_golfer_40x10x10_seed_4_runtime_seconds":31.930976602,"social_golfer_40x10x11_seed_1_final_score":55,"social_golfer_40x10x11_seed_1_unique_contacts":655,"social_golfer_40x10x11_seed_1_best_conflict_positions":20,"social_golfer_40x10x11_seed_1_runtime_seconds":120.002267219,"social_golfer_40x10x11_seed_2_final_score":77,"social_golfer_40x10x11_seed_2_unique_contacts":653,"social_golfer_40x10x11_seed_2_best_conflict_positions":21,"social_golfer_40x10x11_seed_2_runtime_seconds":120.000094905,"social_golfer_40x10x11_seed_3_final_score":66,"social_golfer_40x10x11_seed_3_unique_contacts":654,"social_golfer_40x10x11_seed_3_best_conflict_positions":22,"social_golfer_40x10x11_seed_3_runtime_seconds":120.001573714,"social_golfer_40x10x11_seed_4_final_score":77,"social_golfer_40x10x11_seed_4_unique_contacts":653,"social_golfer_40x10x11_seed_4_best_conflict_positions":19,"social_golfer_40x10x11_seed_4_runtime_seconds":120.00027641899999},"status":"keep","description":"Retuned late active-repeated-pair guidance for the new best-so-far stagnation semantics by delaying activation from 3+ to 4+ non-improving iterations. Under the stricter stagnation counter this reduced over-eager guidance and improved the p=4 stretch bundle.","timestamp":1776316082507,"segment":3,"confidence":13.673640167364013,"iterationTokens":15979,"asi":{"hypothesis":"Best-so-far stagnation counting made the old 3+ late repeat-guidance threshold effectively stronger. Delaying the guidance to 4+ non-improving iterations might keep the new plateau semantics while reducing over-eager tie-break steering.","observations":{"previous_best_commit":"d3f9887","previous_best_mean_final_score":84.8,"experiment_mean_final_score":81.7,"previous_best_solved_runs":6,"experiment_solved_runs":6,"32x8x10_scores":[0,0,0,0],"36x9x10_scores":[97,66,55,66],"36x9x11_scores":[313,291,198,251],"40x10x11_scores":[55,77,66,77],"runtime_total_seconds":333.086298284},"learned_tradeoff":"Threshold tuning was stale under the old current-step-reset regime, but under best-so-far stagnation semantics a slightly later repeat-guidance trigger is beneficial. The new plateau pressure stays strong while avoiding premature tie-break steering.","next_action_hint":"Use 4+ late repeat-guidance as the new baseline together with best-so-far stagnation counting. Future experiments can consider whether breakout timing should be retuned under the same new semantics, but avoid constructor screening and broad tabu weakening."}}
{"run":42,"commit":"9f33e41","metric":89.25,"metrics":{"best_final_score":0,"worst_final_score":353,"mean_unique_contacts":568.05,"best_unique_contacts":655,"worst_unique_contacts":480,"solved_runs":8,"mean_best_conflict_positions":22.4,"best_best_conflict_positions":0,"runtime_total_seconds":325.640018426,"social_golfer_32x8x10_seed_1_final_score":0,"social_golfer_32x8x10_seed_1_unique_contacts":480,"social_golfer_32x8x10_seed_1_best_conflict_positions":0,"social_golfer_32x8x10_seed_1_runtime_seconds":5.703722765,"social_golfer_32x8x10_seed_2_final_score":0,"social_golfer_32x8x10_seed_2_unique_contacts":480,"social_golfer_32x8x10_seed_2_best_conflict_positions":0,"social_golfer_32x8x10_seed_2_runtime_seconds":8.292242843,"social_golfer_32x8x10_seed_3_final_score":0,"social_golfer_32x8x10_seed_3_unique_contacts":480,"social_golfer_32x8x10_seed_3_best_conflict_positions":0,"social_golfer_32x8x10_seed_3_runtime_seconds":1.6571022780000002,"social_golfer_32x8x10_seed_4_final_score":0,"social_golfer_32x8x10_seed_4_unique_contacts":480,"social_golfer_32x8x10_seed_4_best_conflict_positions":0,"social_golfer_32x8x10_seed_4_runtime_seconds":5.6446880450000005,"social_golfer_36x9x10_seed_1_final_score":66,"social_golfer_36x9x10_seed_1_unique_contacts":534,"social_golfer_36x9x10_seed_1_best_conflict_positions":22,"social_golfer_36x9x10_seed_1_runtime_seconds":60.00100639,"social_golfer_36x9x10_seed_2_final_score":86,"social_golfer_36x9x10_seed_2_unique_contacts":534,"social_golfer_36x9x10_seed_2_best_conflict_positions":21,"social_golfer_36x9x10_seed_2_runtime_seconds":60.000222758999996,"social_golfer_36x9x10_seed_3_final_score":86,"social_golfer_36x9x10_seed_3_unique_contacts":534,"social_golfer_36x9x10_seed_3_best_conflict_positions":22,"social_golfer_36x9x10_seed_3_runtime_seconds":60.000725775999996,"social_golfer_36x9x10_seed_4_final_score":66,"social_golfer_36x9x10_seed_4_unique_contacts":534,"social_golfer_36x9x10_seed_4_best_conflict_positions":24,"social_golfer_36x9x10_seed_4_runtime_seconds":60.00229866800001,"social_golfer_36x9x11_seed_1_final_score":271,"social_golfer_36x9x11_seed_1_unique_contacts":573,"social_golfer_36x9x11_seed_1_best_conflict_positions":66,"social_golfer_36x9x11_seed_1_runtime_seconds":90.00183540999998,"social_golfer_36x9x11_seed_2_final_score":302,"social_golfer_36x9x11_seed_2_unique_contacts":572,"social_golfer_36x9x11_seed_2_best_conflict_positions":69,"social_golfer_36x9x11_seed_2_runtime_seconds":90.002412387,"social_golfer_36x9x11_seed_3_final_score":302,"social_golfer_36x9x11_seed_3_unique_contacts":572,"social_golfer_36x9x11_seed_3_best_conflict_positions":69,"social_golfer_36x9x11_seed_3_runtime_seconds":90.00421266900001,"social_golfer_36x9x11_seed_4_final_score":353,"social_golfer_36x9x11_seed_4_unique_contacts":571,"social_golfer_36x9x11_seed_4_best_conflict_positions":68,"social_golfer_36x9x11_seed_4_runtime_seconds":90.003182032,"social_golfer_40x10x10_seed_1_final_score":0,"social_golfer_40x10x10_seed_1_unique_contacts":600,"social_golfer_40x10x10_seed_1_best_conflict_positions":0,"social_golfer_40x10x10_seed_1_runtime_seconds":26.256554383,"social_golfer_40x10x10_seed_2_final_score":0,"social_golfer_40x10x10_seed_2_unique_contacts":600,"social_golfer_40x10x10_seed_2_best_conflict_positions":0,"social_golfer_40x10x10_seed_2_runtime_seconds":3.133319412,"social_golfer_40x10x10_seed_3_final_score":0,"social_golfer_40x10x10_seed_3_unique_contacts":600,"social_golfer_40x10x10_seed_3_best_conflict_positions":0,"social_golfer_40x10x10_seed_3_runtime_seconds":49.868469395999995,"social_golfer_40x10x10_seed_4_final_score":0,"social_golfer_40x10x10_seed_4_unique_contacts":600,"social_golfer_40x10x10_seed_4_best_conflict_positions":0,"social_golfer_40x10x10_seed_4_runtime_seconds":36.363294256,"social_golfer_40x10x11_seed_1_final_score":66,"social_golfer_40x10x11_seed_1_unique_contacts":654,"social_golfer_40x10x11_seed_1_best_conflict_positions":22,"social_golfer_40x10x11_seed_1_runtime_seconds":120.001435301,"social_golfer_40x10x11_seed_2_final_score":55,"social_golfer_40x10x11_seed_2_unique_contacts":655,"social_golfer_40x10x11_seed_2_best_conflict_positions":19,"social_golfer_40x10x11_seed_2_runtime_seconds":120.00061165899999,"social_golfer_40x10x11_seed_3_final_score":66,"social_golfer_40x10x11_seed_3_unique_contacts":654,"social_golfer_40x10x11_seed_3_best_conflict_positions":23,"social_golfer_40x10x11_seed_3_runtime_seconds":120.00177478500001,"social_golfer_40x10x11_seed_4_final_score":66,"social_golfer_40x10x11_seed_4_unique_contacts":654,"social_golfer_40x10x11_seed_4_best_conflict_positions":23,"social_golfer_40x10x11_seed_4_runtime_seconds":120.001328731},"status":"discard","description":"Retuned breakout timing under the new best-so-far stagnation semantics and 4+ late repeat-guidance threshold by delaying breakout from 4 to 5 non-improving iterations. This increased solved runs on guardrails but regressed the primary bundle versus the current best.","timestamp":1776316700075,"segment":3,"confidence":13.504132231404965,"iterationTokens":14293,"asi":{"hypothesis":"With best-so-far stagnation counting and the delayed 4+ repeat-guidance trigger, breakout at 4 may now be slightly too eager. Pushing breakout to 5 could let the milder guidance act once before perturbation.","rollback_reason":"This helped some guardrails and increased solved_runs, but primary mean_final_score regressed from 81.7 to 89.25, so breakout stayed too delayed for the main objective.","observations":{"kept_commit":"9f33e41","kept_mean_final_score":81.7,"experiment_mean_final_score":89.25,"kept_solved_runs":6,"experiment_solved_runs":8,"32x8x10_scores":[0,0,0,0],"36x9x10_scores":[66,86,86,66],"36x9x11_scores":[271,302,302,353],"40x10x10_scores":[0,0,0,0]},"learned_tradeoff":"Under the new stagnation semantics, raising the repeat-guidance threshold to 4 helped, but delaying breakout to 5 over-favors guardrail polishing at the expense of the primary bundle. Breakout at 4 still appears to be the better overall balance.","next_action_hint":"Keep the new 4+ repeat-guidance threshold but restore breakout at 4. Future experiments should explore different mild mechanisms under the new plateau semantics rather than more breakout-delay tuning."}}
{"run":43,"commit":"9f33e41","metric":86.8,"metrics":{"best_final_score":0,"worst_final_score":304,"mean_unique_contacts":568,"best_unique_contacts":655,"worst_unique_contacts":480,"solved_runs":7,"mean_best_conflict_positions":22.4,"best_best_conflict_positions":0,"runtime_total_seconds":332.490257279,"social_golfer_32x8x10_seed_1_final_score":0,"social_golfer_32x8x10_seed_1_unique_contacts":480,"social_golfer_32x8x10_seed_1_best_conflict_positions":0,"social_golfer_32x8x10_seed_1_runtime_seconds":2.0767550260000003,"social_golfer_32x8x10_seed_2_final_score":0,"social_golfer_32x8x10_seed_2_unique_contacts":480,"social_golfer_32x8x10_seed_2_best_conflict_positions":0,"social_golfer_32x8x10_seed_2_runtime_seconds":2.429478698,"social_golfer_32x8x10_seed_3_final_score":0,"social_golfer_32x8x10_seed_3_unique_contacts":480,"social_golfer_32x8x10_seed_3_best_conflict_positions":0,"social_golfer_32x8x10_seed_3_runtime_seconds":5.515429332,"social_golfer_32x8x10_seed_4_final_score":0,"social_golfer_32x8x10_seed_4_unique_contacts":480,"social_golfer_32x8x10_seed_4_best_conflict_positions":0,"social_golfer_32x8x10_seed_4_runtime_seconds":1.5731399,"social_golfer_36x9x10_seed_1_final_score":66,"social_golfer_36x9x10_seed_1_unique_contacts":534,"social_golfer_36x9x10_seed_1_best_conflict_positions":23,"social_golfer_36x9x10_seed_1_runtime_seconds":60.001805530999995,"social_golfer_36x9x10_seed_2_final_score":77,"social_golfer_36x9x10_seed_2_unique_contacts":533,"social_golfer_36x9x10_seed_2_best_conflict_positions":22,"social_golfer_36x9x10_seed_2_runtime_seconds":60.001834628,"social_golfer_36x9x10_seed_3_final_score":66,"social_golfer_36x9x10_seed_3_unique_contacts":534,"social_golfer_36x9x10_seed_3_best_conflict_positions":23,"social_golfer_36x9x10_seed_3_runtime_seconds":60.000456476,"social_golfer_36x9x10_seed_4_final_score":97,"social_golfer_36x9x10_seed_4_unique_contacts":533,"social_golfer_36x9x10_seed_4_best_conflict_positions":26,"social_golfer_36x9x10_seed_4_runtime_seconds":60.000693073,"social_golfer_36x9x11_seed_1_final_score":291,"social_golfer_36x9x11_seed_1_unique_contacts":573,"social_golfer_36x9x11_seed_1_best_conflict_positions":66,"social_golfer_36x9x11_seed_1_runtime_seconds":90.002661664,"social_golfer_36x9x11_seed_2_final_score":260,"social_golfer_36x9x11_seed_2_unique_contacts":574,"social_golfer_36x9x11_seed_2_best_conflict_positions":66,"social_golfer_36x9x11_seed_2_runtime_seconds":90.00010242300002,"social_golfer_36x9x11_seed_3_final_score":304,"social_golfer_36x9x11_seed_3_unique_contacts":570,"social_golfer_36x9x11_seed_3_best_conflict_positions":68,"social_golfer_36x9x11_seed_3_runtime_seconds":90.00211923,"social_golfer_36x9x11_seed_4_final_score":271,"social_golfer_36x9x11_seed_4_unique_contacts":573,"social_golfer_36x9x11_seed_4_best_conflict_positions":65,"social_golfer_36x9x11_seed_4_runtime_seconds":90.000547787,"social_golfer_40x10x10_seed_1_final_score":0,"social_golfer_40x10x10_seed_1_unique_contacts":600,"social_golfer_40x10x10_seed_1_best_conflict_positions":0,"social_golfer_40x10x10_seed_1_runtime_seconds":35.785395939,"social_golfer_40x10x10_seed_2_final_score":0,"social_golfer_40x10x10_seed_2_unique_contacts":600,"social_golfer_40x10x10_seed_2_best_conflict_positions":0,"social_golfer_40x10x10_seed_2_runtime_seconds":2.7741479900000003,"social_golfer_40x10x10_seed_3_final_score":11,"social_golfer_40x10x10_seed_3_unique_contacts":599,"social_golfer_40x10x10_seed_3_best_conflict_positions":4,"social_golfer_40x10x10_seed_3_runtime_seconds":59.999963468,"social_golfer_40x10x10_seed_4_final_score":0,"social_golfer_40x10x10_seed_4_unique_contacts":600,"social_golfer_40x10x10_seed_4_best_conflict_positions":0,"social_golfer_40x10x10_seed_4_runtime_seconds":41.306357782,"social_golfer_40x10x11_seed_1_final_score":86,"social_golfer_40x10x11_seed_1_unique_contacts":654,"social_golfer_40x10x11_seed_1_best_conflict_positions":22,"social_golfer_40x10x11_seed_1_runtime_seconds":120.00106506,"social_golfer_40x10x11_seed_2_final_score":66,"social_golfer_40x10x11_seed_2_unique_contacts":654,"social_golfer_40x10x11_seed_2_best_conflict_positions":22,"social_golfer_40x10x11_seed_2_runtime_seconds":120.001365486,"social_golfer_40x10x11_seed_3_final_score":86,"social_golfer_40x10x11_seed_3_unique_contacts":654,"social_golfer_40x10x11_seed_3_best_conflict_positions":21,"social_golfer_40x10x11_seed_3_runtime_seconds":120.000195543,"social_golfer_40x10x11_seed_4_final_score":55,"social_golfer_40x10x11_seed_4_unique_contacts":655,"social_golfer_40x10x11_seed_4_best_conflict_positions":20,"social_golfer_40x10x11_seed_4_runtime_seconds":120.000166268},"status":"discard","description":"Retuned solver4's week-local pair tabu tenure from 10 iterations down to 8 under the new best-so-far stagnation regime. Shorter tabu reduced some blocking, but regressed the bundle versus the current best.","timestamp":1776317644804,"segment":3,"confidence":13.124497991967884,"iterationTokens":17312,"asi":{"hypothesis":"With best-so-far stagnation counting and 4+ late repeat-guidance, the fixed week-local tabu tenure of 10 might now be slightly too conservative. Reducing it to 8 could release productive revisits sooner without broadening aspiration.","rollback_reason":"Shortening tabu was regressive: mean_final_score worsened from 81.7 to 86.8, with weaker 36x9x11 performance and only 7 solved runs.","observations":{"kept_commit":"9f33e41","kept_mean_final_score":81.7,"experiment_mean_final_score":86.8,"kept_solved_runs":6,"experiment_solved_runs":7,"32x8x10_scores":[0,0,0,0],"36x9x10_scores":[66,77,66,97],"36x9x11_scores":[291,260,304,271]},"learned_tradeoff":"The new baseline still benefits from the stronger tabu memory. Best-so-far stagnation pressure does not mean the tabu tenure should be shortened; doing so weakens hard-case search stability.","next_action_hint":"Restore tabu tenure 10. If tabu is revisited, try the opposite direction or a more conditional mechanism instead of further shortening."}}
