{"run":53,"commit":"fea1825","metric":81.95,"metrics":{"best_final_score":0,"worst_final_score":273,"mean_unique_contacts":568.35,"best_unique_contacts":655,"worst_unique_contacts":480,"solved_runs":6,"mean_best_conflict_positions":22.45,"best_best_conflict_positions":0,"runtime_total_seconds":335.55890561,"social_golfer_32x8x10_seed_1_final_score":0,"social_golfer_32x8x10_seed_1_unique_contacts":480,"social_golfer_32x8x10_seed_1_best_conflict_positions":0,"social_golfer_32x8x10_seed_1_runtime_seconds":3.8107803110000003,"social_golfer_32x8x10_seed_2_final_score":0,"social_golfer_32x8x10_seed_2_unique_contacts":480,"social_golfer_32x8x10_seed_2_best_conflict_positions":0,"social_golfer_32x8x10_seed_2_runtime_seconds":5.483164995999999,"social_golfer_32x8x10_seed_3_final_score":0,"social_golfer_32x8x10_seed_3_unique_contacts":480,"social_golfer_32x8x10_seed_3_best_conflict_positions":0,"social_golfer_32x8x10_seed_3_runtime_seconds":4.290698833,"social_golfer_32x8x10_seed_4_final_score":0,"social_golfer_32x8x10_seed_4_unique_contacts":480,"social_golfer_32x8x10_seed_4_best_conflict_positions":0,"social_golfer_32x8x10_seed_4_runtime_seconds":3.6759093210000002,"social_golfer_36x9x10_seed_1_final_score":86,"social_golfer_36x9x10_seed_1_unique_contacts":534,"social_golfer_36x9x10_seed_1_best_conflict_positions":22,"social_golfer_36x9x10_seed_1_runtime_seconds":60.00087088,"social_golfer_36x9x10_seed_2_final_score":97,"social_golfer_36x9x10_seed_2_unique_contacts":533,"social_golfer_36x9x10_seed_2_best_conflict_positions":25,"social_golfer_36x9x10_seed_2_runtime_seconds":60.00070366,"social_golfer_36x9x10_seed_3_final_score":55,"social_golfer_36x9x10_seed_3_unique_contacts":535,"social_golfer_36x9x10_seed_3_best_conflict_positions":20,"social_golfer_36x9x10_seed_3_runtime_seconds":60.001901288999996,"social_golfer_36x9x10_seed_4_final_score":77,"social_golfer_36x9x10_seed_4_unique_contacts":533,"social_golfer_36x9x10_seed_4_best_conflict_positions":25,"social_golfer_36x9x10_seed_4_runtime_seconds":60.001960108,"social_golfer_36x9x11_seed_1_final_score":258,"social_golfer_36x9x11_seed_1_unique_contacts":576,"social_golfer_36x9x11_seed_1_best_conflict_positions":64,"social_golfer_36x9x11_seed_1_runtime_seconds":90.000047,"social_golfer_36x9x11_seed_2_final_score":273,"social_golfer_36x9x11_seed_2_unique_contacts":571,"social_golfer_36x9x11_seed_2_best_conflict_positions":69,"social_golfer_36x9x11_seed_2_runtime_seconds":90.00433689200001,"social_golfer_36x9x11_seed_3_final_score":238,"social_golfer_36x9x11_seed_3_unique_contacts":576,"social_golfer_36x9x11_seed_3_best_conflict_positions":62,"social_golfer_36x9x11_seed_3_runtime_seconds":90.001843002,"social_golfer_36x9x11_seed_4_final_score":260,"social_golfer_36x9x11_seed_4_unique_contacts":574,"social_golfer_36x9x11_seed_4_best_conflict_positions":66,"social_golfer_36x9x11_seed_4_runtime_seconds":90.00290448300001,"social_golfer_40x10x10_seed_1_final_score":0,"social_golfer_40x10x10_seed_1_unique_contacts":600,"social_golfer_40x10x10_seed_1_best_conflict_positions":0,"social_golfer_40x10x10_seed_1_runtime_seconds":4.445478695,"social_golfer_40x10x10_seed_2_final_score":11,"social_golfer_40x10x10_seed_2_unique_contacts":599,"social_golfer_40x10x10_seed_2_best_conflict_positions":4,"social_golfer_40x10x10_seed_2_runtime_seconds":60.000272945999995,"social_golfer_40x10x10_seed_3_final_score":0,"social_golfer_40x10x10_seed_3_unique_contacts":600,"social_golfer_40x10x10_seed_3_best_conflict_positions":0,"social_golfer_40x10x10_seed_3_runtime_seconds":24.769717387,"social_golfer_40x10x10_seed_4_final_score":11,"social_golfer_40x10x10_seed_4_unique_contacts":599,"social_golfer_40x10x10_seed_4_best_conflict_positions":4,"social_golfer_40x10x10_seed_4_runtime_seconds":60.001479168,"social_golfer_40x10x11_seed_1_final_score":55,"social_golfer_40x10x11_seed_1_unique_contacts":655,"social_golfer_40x10x11_seed_1_best_conflict_positions":20,"social_golfer_40x10x11_seed_1_runtime_seconds":120.00070632600001,"social_golfer_40x10x11_seed_2_final_score":66,"social_golfer_40x10x11_seed_2_unique_contacts":654,"social_golfer_40x10x11_seed_2_best_conflict_positions":23,"social_golfer_40x10x11_seed_2_runtime_seconds":120.000800324,"social_golfer_40x10x11_seed_3_final_score":66,"social_golfer_40x10x11_seed_3_unique_contacts":654,"social_golfer_40x10x11_seed_3_best_conflict_positions":23,"social_golfer_40x10x11_seed_3_runtime_seconds":119.99984612000002,"social_golfer_40x10x11_seed_4_final_score":86,"social_golfer_40x10x11_seed_4_unique_contacts":654,"social_golfer_40x10x11_seed_4_best_conflict_positions":22,"social_golfer_40x10x11_seed_4_runtime_seconds":120.002556635},"status":"discard","description":"Tried a limited late-stage neighborhood expansion: on the last pre-breakout step, allow otherwise clean-clean swaps from the currently hardest week instead of restricting consideration to swaps with at least one conflicted endpoint. A confirmation rerun improved over the first attempt but still regressed the p=4 stretch bundle versus baseline.","timestamp":1776328502396,"segment":3,"confidence":6.815450643776829,"iterationTokens":14520,"asi":{"hypothesis":"Instead of adding more tie-break pressure, a better mild direction might be to expand the candidate neighborhood only after real stagnation. Allowing clean-clean swaps from the hardest week on the final pre-breakout step could expose escape moves that the normal conflict-filtered neighborhood misses.","rollback_reason":"The expanded neighborhood remained weaker than baseline. A confirmation rerun improved over the first attempt but still landed at mean_final_score 81.95 versus the 79.4 baseline.","observations":{"baseline_commit":"fea1825","baseline_mean_final_score":79.4,"initial_experiment_mean_final_score":88.55,"confirmation_rerun_mean_final_score":81.95,"baseline_solved_runs":6,"confirmation_solved_runs":6,"32x8x10_scores":[0,0,0,0],"36x9x10_scores":[86,97,55,77],"36x9x11_scores":[258,273,238,260],"40x10x11_scores":[55,66,66,86]},"learned_tradeoff":"Late-stage neighborhood expansion around the hardest week is less damaging than late-stage week-focused tie-breaking, but it still over-emphasizes generic week pressure and does not beat the current baseline.","next_action_hint":"Prune simplest hard-week-only neighborhood expansion. If neighborhood shaping is revisited, pivot toward repeated-pair-structured expansion rather than generic hardest-week expansion."}}
{"run":54,"commit":"fea1825","metric":83.35,"metrics":{"best_final_score":0,"worst_final_score":293,"mean_unique_contacts":567.95,"best_unique_contacts":654,"worst_unique_contacts":480,"solved_runs":7,"mean_best_conflict_positions":23.15,"best_best_conflict_positions":0,"runtime_total_seconds":333.562872678,"social_golfer_32x8x10_seed_1_final_score":0,"social_golfer_32x8x10_seed_1_unique_contacts":480,"social_golfer_32x8x10_seed_1_best_conflict_positions":0,"social_golfer_32x8x10_seed_1_runtime_seconds":3.4627204480000002,"social_golfer_32x8x10_seed_2_final_score":0,"social_golfer_32x8x10_seed_2_unique_contacts":480,"social_golfer_32x8x10_seed_2_best_conflict_positions":0,"social_golfer_32x8x10_seed_2_runtime_seconds":5.336408668,"social_golfer_32x8x10_seed_3_final_score":0,"social_golfer_32x8x10_seed_3_unique_contacts":480,"social_golfer_32x8x10_seed_3_best_conflict_positions":0,"social_golfer_32x8x10_seed_3_runtime_seconds":4.218540131,"social_golfer_32x8x10_seed_4_final_score":0,"social_golfer_32x8x10_seed_4_unique_contacts":480,"social_golfer_32x8x10_seed_4_best_conflict_positions":0,"social_golfer_32x8x10_seed_4_runtime_seconds":3.469859627,"social_golfer_36x9x10_seed_1_final_score":66,"social_golfer_36x9x10_seed_1_unique_contacts":534,"social_golfer_36x9x10_seed_1_best_conflict_positions":24,"social_golfer_36x9x10_seed_1_runtime_seconds":60.001168452,"social_golfer_36x9x10_seed_2_final_score":66,"social_golfer_36x9x10_seed_2_unique_contacts":534,"social_golfer_36x9x10_seed_2_best_conflict_positions":23,"social_golfer_36x9x10_seed_2_runtime_seconds":60.000504762000006,"social_golfer_36x9x10_seed_3_final_score":88,"social_golfer_36x9x10_seed_3_unique_contacts":532,"social_golfer_36x9x10_seed_3_best_conflict_positions":24,"social_golfer_36x9x10_seed_3_runtime_seconds":60.001170169,"social_golfer_36x9x10_seed_4_final_score":66,"social_golfer_36x9x10_seed_4_unique_contacts":534,"social_golfer_36x9x10_seed_4_best_conflict_positions":24,"social_golfer_36x9x10_seed_4_runtime_seconds":60.00125701099999,"social_golfer_36x9x11_seed_1_final_score":258,"social_golfer_36x9x11_seed_1_unique_contacts":576,"social_golfer_36x9x11_seed_1_best_conflict_positions":64,"social_golfer_36x9x11_seed_1_runtime_seconds":90.002519752,"social_golfer_36x9x11_seed_2_final_score":273,"social_golfer_36x9x11_seed_2_unique_contacts":571,"social_golfer_36x9x11_seed_2_best_conflict_positions":69,"social_golfer_36x9x11_seed_2_runtime_seconds":90.000993503,"social_golfer_36x9x11_seed_3_final_score":293,"social_golfer_36x9x11_seed_3_unique_contacts":571,"social_golfer_36x9x11_seed_3_best_conflict_positions":70,"social_golfer_36x9x11_seed_3_runtime_seconds":90.002030185,"social_golfer_36x9x11_seed_4_final_score":260,"social_golfer_36x9x11_seed_4_unique_contacts":574,"social_golfer_36x9x11_seed_4_best_conflict_positions":66,"social_golfer_36x9x11_seed_4_runtime_seconds":90.001885188,"social_golfer_40x10x10_seed_1_final_score":11,"social_golfer_40x10x10_seed_1_unique_contacts":599,"social_golfer_40x10x10_seed_1_best_conflict_positions":4,"social_golfer_40x10x10_seed_1_runtime_seconds":60.001546764000004,"social_golfer_40x10x10_seed_2_final_score":0,"social_golfer_40x10x10_seed_2_unique_contacts":600,"social_golfer_40x10x10_seed_2_best_conflict_positions":0,"social_golfer_40x10x10_seed_2_runtime_seconds":17.12287362,"social_golfer_40x10x10_seed_3_final_score":0,"social_golfer_40x10x10_seed_3_unique_contacts":600,"social_golfer_40x10x10_seed_3_best_conflict_positions":0,"social_golfer_40x10x10_seed_3_runtime_seconds":5.416391986,"social_golfer_40x10x10_seed_4_final_score":0,"social_golfer_40x10x10_seed_4_unique_contacts":600,"social_golfer_40x10x10_seed_4_best_conflict_positions":0,"social_golfer_40x10x10_seed_4_runtime_seconds":54.774331182999994,"social_golfer_40x10x11_seed_1_final_score":66,"social_golfer_40x10x11_seed_1_unique_contacts":654,"social_golfer_40x10x11_seed_1_best_conflict_positions":24,"social_golfer_40x10x11_seed_1_runtime_seconds":119.99996691,"social_golfer_40x10x11_seed_2_final_score":88,"social_golfer_40x10x11_seed_2_unique_contacts":652,"social_golfer_40x10x11_seed_2_best_conflict_positions":25,"social_golfer_40x10x11_seed_2_runtime_seconds":120.00299206800001,"social_golfer_40x10x11_seed_3_final_score":66,"social_golfer_40x10x11_seed_3_unique_contacts":654,"social_golfer_40x10x11_seed_3_best_conflict_positions":24,"social_golfer_40x10x11_seed_3_runtime_seconds":120.001914356,"social_golfer_40x10x11_seed_4_final_score":66,"social_golfer_40x10x11_seed_4_unique_contacts":654,"social_golfer_40x10x11_seed_4_best_conflict_positions":22,"social_golfer_40x10x11_seed_4_runtime_seconds":120.00060983899999},"status":"discard","description":"Tried a mild repeated-pair-structured neighborhood expansion: on the final pre-breakout stagnation step, allow clean-clean swaps only when both endpoints belong to groups that already contain repeated-pair conflict. The simple group-level expansion remained worse than the baseline, regressing the expanded p=4 bundle despite being less damaging than earlier hard-week-only expansion variants.","timestamp":1776331362655,"segment":3,"confidence":6.301587301587305,"iterationTokens":26966}
{"type":"config","name":"Solver5 construction-heuristics coverage","metricName":"total_constructed_weeks","metricUnit":"","bestDirection":"higher"}
{"run":53,"commit":"74d4f98","metric":99,"metrics":{"frontier_gap_sum":487,"solved_cells":9,"exact_frontier_cells":9,"unsolved_cells":72,"p2_constructed_weeks":99,"p3_constructed_weeks":0,"p4_constructed_weeks":0,"p5_constructed_weeks":0,"p6_constructed_weeks":0,"p7_constructed_weeks":0,"p8_constructed_weeks":0,"p9_constructed_weeks":0,"p10_constructed_weeks":0,"W_8_4":0,"W_10_4":0,"W_10_10":0},"status":"keep","description":"Set up solver5 as a construction-first pure-SGP solver family with engine registration, canonical validation/scoring, a fixed construction-coverage benchmark harness, and the initial round-robin p=2 family.","timestamp":1776336067748,"segment":3,"confidence":null,"iterationTokens":135,"asi":{"hypothesis":"A solver5 scaffold plus an honest fixed coverage benchmark will let autoresearch optimize construction-family coverage incrementally, starting from the simplest exact family.","portfolio_state":"round_robin_only","benchmark_shape":"fixed 2..10 x 2..10 pure-SGP matrix scored by maximum score-zero constructed weeks per cell","next_action_hint":"Implement the next high-ROI constructor family, likely KTS/NKTS for p=3 or a prime-order RTD/MOLS engine."}}
{"run":54,"commit":"a6a7ca0","metric":155,"metrics":{"frontier_gap_sum":431,"solved_cells":18,"exact_frontier_cells":12,"unsolved_cells":63,"p2_constructed_weeks":99,"p3_constructed_weeks":16,"p4_constructed_weeks":12,"p5_constructed_weeks":13,"p6_constructed_weeks":7,"p7_constructed_weeks":8,"p8_constructed_weeks":0,"p9_constructed_weeks":0,"p10_constructed_weeks":0,"W_8_4":0,"W_10_4":0,"W_10_10":0},"status":"keep","description":"Added prime-order RTD/MOLS-style construction routing to solver5: affine-plane frontier constructors for p=g prime and transversal-design constructors for 3<=p<=g on prime group counts, preserving round-robin priority for p=2.","timestamp":1776336229550,"segment":3,"confidence":null,"iterationTokens":13864,"asi":{"hypothesis":"Prime-order linear algebra constructors give broad honest lower-bound coverage cheaply: RTD from linear MOLS for 3<=p<=g and affine-plane lines for p=g should raise many cells at once.","family_added":"prime_rtd_plus_affine_plane","coverage_pattern":"improves prime group-count rows g=3,5,7 while leaving composite rows untouched","next_action_hint":"Implement a dedicated p=3 KTS/NKTS family next, since it should dominate the full p=3 column including composite g values like 6,8,9,10."}}
{"run":55,"commit":"fe4b5e0","metric":277,"metrics":{"frontier_gap_sum":309,"solved_cells":33,"exact_frontier_cells":15,"unsolved_cells":48,"p2_constructed_weeks":99,"p3_constructed_weeks":37,"p4_constructed_weeks":34,"p5_constructed_weeks":30,"p6_constructed_weeks":24,"p7_constructed_weeks":25,"p8_constructed_weeks":18,"p9_constructed_weeks":10,"p10_constructed_weeks":0,"W_8_4":8,"W_10_4":0,"W_10_10":0},"status":"keep","description":"Generalized solver5's RTD/MOLS-style constructors from prime orders to supported prime-power orders (4, 8, 9) with finite-field arithmetic, extending both transversal-design and affine-plane families across more rows of the fixed coverage matrix.","timestamp":1776336415445,"segment":3,"confidence":3.1785714285714284,"iterationTokens":14299,"asi":{"hypothesis":"Prime-power finite-field support should unlock the biggest next chunk of honest construction coverage because RTD/MOLS and affine-plane families extend cleanly from primes to 4, 8, and 9.","family_added":"prime_power_rtd_plus_affine_plane","coverage_pattern":"new coverage now includes g=4,8,9 rows for many p<=g cells while composite non-prime-power rows 6 and 10 remain untouched","next_action_hint":"Return to dedicated family work next: KTS/NKTS for p=3 and then p=4-specific routing for composite rows like g=6 and g=10."}}
{"run":56,"commit":"96d0ec9","metric":281,"metrics":{"frontier_gap_sum":305,"solved_cells":33,"exact_frontier_cells":16,"unsolved_cells":48,"p2_constructed_weeks":99,"p3_constructed_weeks":41,"p4_constructed_weeks":34,"p5_constructed_weeks":30,"p6_constructed_weeks":24,"p7_constructed_weeks":25,"p8_constructed_weeks":18,"p9_constructed_weeks":10,"p10_constructed_weeks":0,"W_8_4":8,"W_10_4":0,"W_10_10":0},"status":"keep","description":"Added generic recursive +G(t)-style lifting for solver5's prime-power transversal-design family, appending smaller constructed schedules inside latent groups when p divides g; this upgraded 9-3 from the RTD lower bound to the exact 13-week construction.","timestamp":1776336845198,"segment":3,"confidence":2.888888888888889,"iterationTokens":26168,"asi":{"hypothesis":"Recursive +G(t)-style lifting should turn some RTD lower bounds into stronger constructions without adding bespoke cell-specific schedules, as long as latent-group size is divisible by p and the smaller instance is already constructible.","family_added":"recursive_rtd_latent_group_lifting","coverage_pattern":"improves 9-3 to 13 exactly; no benefit yet for 8-4 because 2-4 remains unavailable and no effect on composite non-prime-power rows like g=6 or g=10","next_action_hint":"Focus next on KTS/NKTS for p=3 or a dedicated p=4 router; RTD/MOLS and recursive lifting have likely harvested most easy generic gains in the fixed matrix."}}
{"run":57,"commit":"189cb75","metric":284,"metrics":{"frontier_gap_sum":302,"solved_cells":33,"exact_frontier_cells":17,"unsolved_cells":48,"p2_constructed_weeks":99,"p3_constructed_weeks":44,"p4_constructed_weeks":34,"p5_constructed_weeks":30,"p6_constructed_weeks":24,"p7_constructed_weeks":25,"p8_constructed_weeks":18,"p9_constructed_weeks":10,"p10_constructed_weeks":0,"W_8_4":8,"W_10_4":0,"W_10_10":0},"status":"keep","description":"Added the generic Kirkman 6t+1 construction for p=3 on prime-power group counts congruent to 1 mod 6, using the Ray-Chaudhuri/Wilson-style shifted base class; this raises 7-3 to the exact 10-week frontier.","timestamp":1776336982776,"segment":3,"confidence":26.428571428571427,"iterationTokens":21101,"asi":{"hypothesis":"A direct Kirkman family for q ≡ 1 mod 6 should outperform RTD lower bounds on the affected p=3 rows while remaining a genuine constructor family rather than a benchmark-specific schedule bank.","family_added":"kirkman_6t_plus_1","coverage_pattern":"improves 7-3 from 7 to the exact 10-week frontier; composite p=3 rows 6 and 10 still need NKTS-style or other dedicated constructions","next_action_hint":"Target p=3 composite rows next with NKTS or another exact/near-exact triples family, or pivot to the dedicated p=4 router for rows like 8 and 10."}}
{"run":58,"commit":"3552e73","metric":284,"metrics":{"frontier_gap_sum":302,"solved_cells":33,"exact_frontier_cells":17,"unsolved_cells":48,"p2_constructed_weeks":99,"p3_constructed_weeks":44,"p4_constructed_weeks":34,"p5_constructed_weeks":30,"p6_constructed_weeks":24,"p7_constructed_weeks":25,"p8_constructed_weeks":18,"p9_constructed_weeks":10,"p10_constructed_weeks":0,"W_8_4":8,"W_10_4":0,"W_10_10":0},"status":"keep","description":"Refactored solver5 from a monolithic mod.rs into explicit architecture modules: problem validation, finite-field algebra, construction families/routing, and canonical result projection. This preserves construction coverage while making future family additions maintainable.","timestamp":1776337805476,"segment":3,"confidence":37,"iterationTokens":27996,"asi":{"hypothesis":"A structural refactor that splits validation, family routing, algebra, and result projection should preserve behavior while materially improving extensibility for upcoming NKTS and p=4 router work.","architectural_outcome":"solver5 modularized into problem.rs, field.rs, families.rs, result.rs with thin mod.rs orchestrator","why_keep_on_equal_metric":"equal benchmark coverage but substantially better maintainability and clearer boundaries in line with construction-first architecture","next_action_hint":"Implement the next family in families.rs without growing a new monolith: composite p=3 NKTS or dedicated p=4 routing."}}
{"run":59,"commit":"0357a1f","metric":284,"metrics":{"frontier_gap_sum":302,"solved_cells":33,"exact_frontier_cells":17,"unsolved_cells":48,"p2_constructed_weeks":99,"p3_constructed_weeks":44,"p4_constructed_weeks":34,"p5_constructed_weeks":30,"p6_constructed_weeks":24,"p7_constructed_weeks":25,"p8_constructed_weeks":18,"p9_constructed_weeks":10,"p10_constructed_weeks":0,"W_8_4":8,"W_10_4":0,"W_10_10":0},"status":"keep","description":"Completed the solver5 architecture hardening program: typed internal construction model, per-family modules, explicit router/capability gating, separate composition and heuristic layers, modular family/router tests, and an architecture/honesty design note. Coverage stayed unchanged while the extension scaffold became significantly stronger.","timestamp":1776339403711,"segment":3,"confidence":61.666666666666664,"iterationTokens":27996,"asi":{"hypothesis":"A strong architectural split across typed schedule model, family modules, router, composition, heuristics, tests, and docs can preserve solver5 benchmark honesty while making future advanced heuristics maintainable.","architectural_outcome":"solver5 now has explicit problem/types/families/composition/router/heuristics/result boundaries plus modular tests and architecture docs","why_keep_on_equal_metric":"equal coverage with materially better long-term maintainability and safer extension seams for NKTS and p=4 work","next_action_hint":"Resume honest solver5 coverage work on top of the new scaffold, starting with NKTS/composite p=3 or the dedicated p=4 router without re-monolithizing."}}
