{"run":29,"commit":"90d883f","metric":97.2,"metrics":{"best_final_score":0,"worst_final_score":335,"mean_unique_contacts":566.6,"best_unique_contacts":653,"worst_unique_contacts":474,"solved_runs":4,"mean_best_conflict_positions":26.8,"best_best_conflict_positions":0,"runtime_total_seconds":336.425512016,"social_golfer_32x8x10_seed_1_final_score":0,"social_golfer_32x8x10_seed_1_unique_contacts":480,"social_golfer_32x8x10_seed_1_best_conflict_positions":0,"social_golfer_32x8x10_seed_1_runtime_seconds":3.6340079469999997,"social_golfer_32x8x10_seed_2_final_score":66,"social_golfer_32x8x10_seed_2_unique_contacts":474,"social_golfer_32x8x10_seed_2_best_conflict_positions":24,"social_golfer_32x8x10_seed_2_runtime_seconds":60.00044902,"social_golfer_32x8x10_seed_3_final_score":66,"social_golfer_32x8x10_seed_3_unique_contacts":474,"social_golfer_32x8x10_seed_3_best_conflict_positions":24,"social_golfer_32x8x10_seed_3_runtime_seconds":60.0001286,"social_golfer_32x8x10_seed_4_final_score":0,"social_golfer_32x8x10_seed_4_unique_contacts":480,"social_golfer_32x8x10_seed_4_best_conflict_positions":0,"social_golfer_32x8x10_seed_4_runtime_seconds":6.364077046999999,"social_golfer_36x9x10_seed_1_final_score":66,"social_golfer_36x9x10_seed_1_unique_contacts":534,"social_golfer_36x9x10_seed_1_best_conflict_positions":24,"social_golfer_36x9x10_seed_1_runtime_seconds":60.001274465,"social_golfer_36x9x10_seed_2_final_score":88,"social_golfer_36x9x10_seed_2_unique_contacts":532,"social_golfer_36x9x10_seed_2_best_conflict_positions":27,"social_golfer_36x9x10_seed_2_runtime_seconds":60.000520632,"social_golfer_36x9x10_seed_3_final_score":99,"social_golfer_36x9x10_seed_3_unique_contacts":531,"social_golfer_36x9x10_seed_3_best_conflict_positions":28,"social_golfer_36x9x10_seed_3_runtime_seconds":60.000557321,"social_golfer_36x9x10_seed_4_final_score":139,"social_golfer_36x9x10_seed_4_unique_contacts":531,"social_golfer_36x9x10_seed_4_best_conflict_positions":24,"social_golfer_36x9x10_seed_4_runtime_seconds":60.000499523,"social_golfer_36x9x11_seed_1_final_score":335,"social_golfer_36x9x11_seed_1_unique_contacts":569,"social_golfer_36x9x11_seed_1_best_conflict_positions":63,"social_golfer_36x9x11_seed_1_runtime_seconds":90.001308269,"social_golfer_36x9x11_seed_2_final_score":262,"social_golfer_36x9x11_seed_2_unique_contacts":572,"social_golfer_36x9x11_seed_2_best_conflict_positions":70,"social_golfer_36x9x11_seed_2_runtime_seconds":90.00140406199999,"social_golfer_36x9x11_seed_3_final_score":262,"social_golfer_36x9x11_seed_3_unique_contacts":572,"social_golfer_36x9x11_seed_3_best_conflict_positions":71,"social_golfer_36x9x11_seed_3_runtime_seconds":90.00246019800001,"social_golfer_36x9x11_seed_4_final_score":209,"social_golfer_36x9x11_seed_4_unique_contacts":575,"social_golfer_36x9x11_seed_4_best_conflict_positions":66,"social_golfer_36x9x11_seed_4_runtime_seconds":90.003106974,"social_golfer_40x10x10_seed_1_final_score":11,"social_golfer_40x10x10_seed_1_unique_contacts":599,"social_golfer_40x10x10_seed_1_best_conflict_positions":4,"social_golfer_40x10x10_seed_1_runtime_seconds":59.999782165999996,"social_golfer_40x10x10_seed_2_final_score":11,"social_golfer_40x10x10_seed_2_unique_contacts":599,"social_golfer_40x10x10_seed_2_best_conflict_positions":4,"social_golfer_40x10x10_seed_2_runtime_seconds":60.000144034,"social_golfer_40x10x10_seed_3_final_score":0,"social_golfer_40x10x10_seed_3_unique_contacts":600,"social_golfer_40x10x10_seed_3_best_conflict_positions":0,"social_golfer_40x10x10_seed_3_runtime_seconds":4.8893254100000005,"social_golfer_40x10x10_seed_4_final_score":0,"social_golfer_40x10x10_seed_4_unique_contacts":600,"social_golfer_40x10x10_seed_4_best_conflict_positions":0,"social_golfer_40x10x10_seed_4_runtime_seconds":1.589642674,"social_golfer_40x10x11_seed_1_final_score":77,"social_golfer_40x10x11_seed_1_unique_contacts":653,"social_golfer_40x10x11_seed_1_best_conflict_positions":27,"social_golfer_40x10x11_seed_1_runtime_seconds":120.000042032,"social_golfer_40x10x11_seed_2_final_score":88,"social_golfer_40x10x11_seed_2_unique_contacts":652,"social_golfer_40x10x11_seed_2_best_conflict_positions":30,"social_golfer_40x10x11_seed_2_runtime_seconds":120.001020234,"social_golfer_40x10x11_seed_3_final_score":88,"social_golfer_40x10x11_seed_3_unique_contacts":652,"social_golfer_40x10x11_seed_3_best_conflict_positions":25,"social_golfer_40x10x11_seed_3_runtime_seconds":120.001575245,"social_golfer_40x10x11_seed_4_final_score":77,"social_golfer_40x10x11_seed_4_unique_contacts":653,"social_golfer_40x10x11_seed_4_best_conflict_positions":25,"social_golfer_40x10x11_seed_4_runtime_seconds":120.001273656},"status":"keep","description":"Made the late active-repeated-pair guidance even more selective: it now activates only after 3+ non-improving iterations instead of 2+. This slightly improved the p=4 stretch bundle.","timestamp":1776304982209,"segment":3,"confidence":21.966101694915306,"iterationTokens":11558,"asi":{"hypothesis":"The late repeat-guidance keep may still be engaging a bit too early after the untabued breakout change; raising its activation threshold from 2 to 3 stagnant iterations could preserve the good basin escapes while reducing over-steering on medium-stagnation states.","observations":{"previous_best_commit":"7f7375a","previous_best_mean_final_score":98.2,"experiment_mean_final_score":97.2,"previous_best_solved_runs":5,"experiment_solved_runs":4,"32x8x10_scores":[0,66,66,0],"36x9x11_scores":[335,262,262,209],"runtime_total_seconds":336.425512016},"learned_tradeoff":"A slightly later activation improves the mean and runtime, mainly by helping the harder larger p=4 cases, but it trades away one solved run versus the previous best. The primary metric still improved, so this is worth keeping.","next_action_hint":"Use this more selective >=3 threshold as the new baseline. Further experiments should continue to tune plateau-escape structure or late-only guidance carefully, with special attention to whether larger-case gains justify any loss in solved-run count."}}
{"run":30,"commit":"90d883f","metric":112.75,"metrics":{"best_final_score":11,"worst_final_score":344,"mean_unique_contacts":565.55,"best_unique_contacts":655,"worst_unique_contacts":474,"solved_runs":0,"mean_best_conflict_positions":32.95,"best_best_conflict_positions":4,"runtime_total_seconds":390.080890038,"social_golfer_32x8x10_seed_1_final_score":66,"social_golfer_32x8x10_seed_1_unique_contacts":474,"social_golfer_32x8x10_seed_1_best_conflict_positions":24,"social_golfer_32x8x10_seed_1_runtime_seconds":60.000497463,"social_golfer_32x8x10_seed_2_final_score":66,"social_golfer_32x8x10_seed_2_unique_contacts":474,"social_golfer_32x8x10_seed_2_best_conflict_positions":24,"social_golfer_32x8x10_seed_2_runtime_seconds":60.001243648000006,"social_golfer_32x8x10_seed_3_final_score":66,"social_golfer_32x8x10_seed_3_unique_contacts":474,"social_golfer_32x8x10_seed_3_best_conflict_positions":24,"social_golfer_32x8x10_seed_3_runtime_seconds":60.001415173,"social_golfer_32x8x10_seed_4_final_score":66,"social_golfer_32x8x10_seed_4_unique_contacts":474,"social_golfer_32x8x10_seed_4_best_conflict_positions":24,"social_golfer_32x8x10_seed_4_runtime_seconds":60.000629992,"social_golfer_36x9x10_seed_1_final_score":77,"social_golfer_36x9x10_seed_1_unique_contacts":533,"social_golfer_36x9x10_seed_1_best_conflict_positions":25,"social_golfer_36x9x10_seed_1_runtime_seconds":60.000617981000005,"social_golfer_36x9x10_seed_2_final_score":77,"social_golfer_36x9x10_seed_2_unique_contacts":533,"social_golfer_36x9x10_seed_2_best_conflict_positions":27,"social_golfer_36x9x10_seed_2_runtime_seconds":59.999948003,"social_golfer_36x9x10_seed_3_final_score":183,"social_golfer_36x9x10_seed_3_unique_contacts":527,"social_golfer_36x9x10_seed_3_best_conflict_positions":44,"social_golfer_36x9x10_seed_3_runtime_seconds":60.00335265099999,"social_golfer_36x9x10_seed_4_final_score":108,"social_golfer_36x9x10_seed_4_unique_contacts":532,"social_golfer_36x9x10_seed_4_best_conflict_positions":28,"social_golfer_36x9x10_seed_4_runtime_seconds":60.001058856,"social_golfer_36x9x11_seed_1_final_score":229,"social_golfer_36x9x11_seed_1_unique_contacts":575,"social_golfer_36x9x11_seed_1_best_conflict_positions":65,"social_golfer_36x9x11_seed_1_runtime_seconds":90.00090506,"social_golfer_36x9x11_seed_2_final_score":344,"social_golfer_36x9x11_seed_2_unique_contacts":570,"social_golfer_36x9x11_seed_2_best_conflict_positions":76,"social_golfer_36x9x11_seed_2_runtime_seconds":90.000413639,"social_golfer_36x9x11_seed_3_final_score":242,"social_golfer_36x9x11_seed_3_unique_contacts":572,"social_golfer_36x9x11_seed_3_best_conflict_positions":73,"social_golfer_36x9x11_seed_3_runtime_seconds":90.001420909,"social_golfer_36x9x11_seed_4_final_score":251,"social_golfer_36x9x11_seed_4_unique_contacts":573,"social_golfer_36x9x11_seed_4_best_conflict_positions":75,"social_golfer_36x9x11_seed_4_runtime_seconds":90.00010639,"social_golfer_40x10x10_seed_1_final_score":33,"social_golfer_40x10x10_seed_1_unique_contacts":597,"social_golfer_40x10x10_seed_1_best_conflict_positions":11,"social_golfer_40x10x10_seed_1_runtime_seconds":60.000483876,"social_golfer_40x10x10_seed_2_final_score":11,"social_golfer_40x10x10_seed_2_unique_contacts":599,"social_golfer_40x10x10_seed_2_best_conflict_positions":4,"social_golfer_40x10x10_seed_2_runtime_seconds":60.000293209,"social_golfer_40x10x10_seed_3_final_score":64,"social_golfer_40x10x10_seed_3_unique_contacts":596,"social_golfer_40x10x10_seed_3_best_conflict_positions":14,"social_golfer_40x10x10_seed_3_runtime_seconds":60.000253423,"social_golfer_40x10x10_seed_4_final_score":64,"social_golfer_40x10x10_seed_4_unique_contacts":596,"social_golfer_40x10x10_seed_4_best_conflict_positions":14,"social_golfer_40x10x10_seed_4_runtime_seconds":60.000250032000004,"social_golfer_40x10x11_seed_1_final_score":99,"social_golfer_40x10x11_seed_1_unique_contacts":651,"social_golfer_40x10x11_seed_1_best_conflict_positions":34,"social_golfer_40x10x11_seed_1_runtime_seconds":120.001139393,"social_golfer_40x10x11_seed_2_final_score":55,"social_golfer_40x10x11_seed_2_unique_contacts":655,"social_golfer_40x10x11_seed_2_best_conflict_positions":20,"social_golfer_40x10x11_seed_2_runtime_seconds":120.001928218,"social_golfer_40x10x11_seed_3_final_score":77,"social_golfer_40x10x11_seed_3_unique_contacts":653,"social_golfer_40x10x11_seed_3_best_conflict_positions":26,"social_golfer_40x10x11_seed_3_runtime_seconds":119.99996762,"social_golfer_40x10x11_seed_4_final_score":77,"social_golfer_40x10x11_seed_4_unique_contacts":653,"social_golfer_40x10x11_seed_4_best_conflict_positions":27,"social_golfer_40x10x11_seed_4_runtime_seconds":120.001231073},"status":"discard","description":"Cleared the entire tabu history whenever breakout fires, on top of the existing untabued breakout perturbation. This was far too destructive and regressed the bundle badly.","timestamp":1776305764830,"segment":3,"confidence":34.71428571428575,"iterationTokens":22340,"asi":{"hypothesis":"After delaying late repeat-guidance to 3+ stagnant iterations, perhaps the remaining self-blocking is old tabu residue surviving across breakouts; clearing tabu entirely on breakout might let the post-perturbation repair phase move more freely.","rollback_reason":"Global tabu clearing on breakout regressed mean_final_score from 97.2 to 112.75 and collapsed solved_runs from 4 to 0, indicating that some retained short-term memory is still crucial even with untabued breakout swaps.","observations":{"kept_commit":"90d883f","kept_mean_final_score":97.2,"experiment_mean_final_score":112.75,"kept_solved_runs":4,"experiment_solved_runs":0,"32x8x10_scores":[66,66,66,66],"40x10x10_scores":[33,11,64,64]},"learned_tradeoff":"Untabued breakout helps, but wiping all tabu state removes too much stabilizing structure and pushes the search into uniformly mediocre basins.","next_action_hint":"Keep breakout untabued but retain ordinary tabu memory. Avoid global reset operators; future experiments should be smaller and more selective than full tabu clearing."}}
{"run":31,"commit":"90d883f","metric":115.4,"metrics":{"best_final_score":0,"worst_final_score":393,"mean_unique_contacts":566.4,"best_unique_contacts":654,"worst_unique_contacts":474,"solved_runs":2,"mean_best_conflict_positions":27.1,"best_best_conflict_positions":0,"runtime_total_seconds":390.061946129,"social_golfer_32x8x10_seed_1_final_score":0,"social_golfer_32x8x10_seed_1_unique_contacts":480,"social_golfer_32x8x10_seed_1_best_conflict_positions":0,"social_golfer_32x8x10_seed_1_runtime_seconds":6.480300294999999,"social_golfer_32x8x10_seed_2_final_score":0,"social_golfer_32x8x10_seed_2_unique_contacts":480,"social_golfer_32x8x10_seed_2_best_conflict_positions":0,"social_golfer_32x8x10_seed_2_runtime_seconds":8.724391292,"social_golfer_32x8x10_seed_3_final_score":66,"social_golfer_32x8x10_seed_3_unique_contacts":474,"social_golfer_32x8x10_seed_3_best_conflict_positions":24,"social_golfer_32x8x10_seed_3_runtime_seconds":60.000597547,"social_golfer_32x8x10_seed_4_final_score":66,"social_golfer_32x8x10_seed_4_unique_contacts":474,"social_golfer_32x8x10_seed_4_best_conflict_positions":24,"social_golfer_32x8x10_seed_4_runtime_seconds":60.00010721500001,"social_golfer_36x9x10_seed_1_final_score":99,"social_golfer_36x9x10_seed_1_unique_contacts":531,"social_golfer_36x9x10_seed_1_best_conflict_positions":28,"social_golfer_36x9x10_seed_1_runtime_seconds":60.000347508,"social_golfer_36x9x10_seed_2_final_score":97,"social_golfer_36x9x10_seed_2_unique_contacts":533,"social_golfer_36x9x10_seed_2_best_conflict_positions":25,"social_golfer_36x9x10_seed_2_runtime_seconds":60.00054793,"social_golfer_36x9x10_seed_3_final_score":121,"social_golfer_36x9x10_seed_3_unique_contacts":529,"social_golfer_36x9x10_seed_3_best_conflict_positions":35,"social_golfer_36x9x10_seed_3_runtime_seconds":60.001030674999996,"social_golfer_36x9x10_seed_4_final_score":88,"social_golfer_36x9x10_seed_4_unique_contacts":532,"social_golfer_36x9x10_seed_4_best_conflict_positions":27,"social_golfer_36x9x10_seed_4_runtime_seconds":60.001972822,"social_golfer_36x9x11_seed_1_final_score":271,"social_golfer_36x9x11_seed_1_unique_contacts":573,"social_golfer_36x9x11_seed_1_best_conflict_positions":61,"social_golfer_36x9x11_seed_1_runtime_seconds":90.000808481,"social_golfer_36x9x11_seed_2_final_score":375,"social_golfer_36x9x11_seed_2_unique_contacts":569,"social_golfer_36x9x11_seed_2_best_conflict_positions":68,"social_golfer_36x9x11_seed_2_runtime_seconds":90.00167590800001,"social_golfer_36x9x11_seed_3_final_score":280,"social_golfer_36x9x11_seed_3_unique_contacts":574,"social_golfer_36x9x11_seed_3_best_conflict_positions":62,"social_golfer_36x9x11_seed_3_runtime_seconds":90.002386487,"social_golfer_36x9x11_seed_4_final_score":393,"social_golfer_36x9x11_seed_4_unique_contacts":571,"social_golfer_36x9x11_seed_4_best_conflict_positions":72,"social_golfer_36x9x11_seed_4_runtime_seconds":90.00281731999999,"social_golfer_40x10x10_seed_1_final_score":11,"social_golfer_40x10x10_seed_1_unique_contacts":599,"social_golfer_40x10x10_seed_1_best_conflict_positions":4,"social_golfer_40x10x10_seed_1_runtime_seconds":60.000167919,"social_golfer_40x10x10_seed_2_final_score":11,"social_golfer_40x10x10_seed_2_unique_contacts":599,"social_golfer_40x10x10_seed_2_best_conflict_positions":4,"social_golfer_40x10x10_seed_2_runtime_seconds":59.999970035,"social_golfer_40x10x10_seed_3_final_score":11,"social_golfer_40x10x10_seed_3_unique_contacts":599,"social_golfer_40x10x10_seed_3_best_conflict_positions":4,"social_golfer_40x10x10_seed_3_runtime_seconds":60.000614554,"social_golfer_40x10x10_seed_4_final_score":22,"social_golfer_40x10x10_seed_4_unique_contacts":598,"social_golfer_40x10x10_seed_4_best_conflict_positions":8,"social_golfer_40x10x10_seed_4_runtime_seconds":60.000190947,"social_golfer_40x10x11_seed_1_final_score":137,"social_golfer_40x10x11_seed_1_unique_contacts":653,"social_golfer_40x10x11_seed_1_best_conflict_positions":23,"social_golfer_40x10x11_seed_1_runtime_seconds":120.001931471,"social_golfer_40x10x11_seed_2_final_score":66,"social_golfer_40x10x11_seed_2_unique_contacts":654,"social_golfer_40x10x11_seed_2_best_conflict_positions":24,"social_golfer_40x10x11_seed_2_runtime_seconds":120.000185732,"social_golfer_40x10x11_seed_3_final_score":66,"social_golfer_40x10x11_seed_3_unique_contacts":654,"social_golfer_40x10x11_seed_3_best_conflict_positions":24,"social_golfer_40x10x11_seed_3_runtime_seconds":120.001648248,"social_golfer_40x10x11_seed_4_final_score":128,"social_golfer_40x10x11_seed_4_unique_contacts":652,"social_golfer_40x10x11_seed_4_best_conflict_positions":25,"social_golfer_40x10x11_seed_4_runtime_seconds":120.00068929800001},"status":"discard","description":"Cleared tabu only for the current max-conflict weeks when breakout fires, trying a selective post-breakout memory reset instead of a global one. This still regressed the bundle.","timestamp":1776306662317,"segment":3,"confidence":35.66972477064209,"iterationTokens":18223,"asi":{"hypothesis":"A week-local version of the failed global reset might still help: only clear tabu entries for the current max-conflict weeks when breakout fires, leaving the rest of the short-term memory intact.","rollback_reason":"Even week-local tabu clearing regressed mean_final_score from 97.2 to 115.4 and cut solved_runs from 4 to 2, so post-breakout memory resets remain too destructive.","observations":{"kept_commit":"90d883f","kept_mean_final_score":97.2,"experiment_mean_final_score":115.4,"kept_solved_runs":4,"experiment_solved_runs":2,"32x8x10_scores":[0,0,66,66],"36x9x11_scores":[271,375,280,393]},"learned_tradeoff":"The current breakout already supplies enough perturbation; even selective tabu clearing removes too much repair structure on the hard weeks.","next_action_hint":"Abandon tabu-reset experiments for now. Keep breakout untabued but otherwise leave tabu history alone, and focus on smaller perturbation-quality changes such as avoiding redundant breakout swaps."}}
