{"type":"config","name":"solver4 32x8x10 multiseed quality (4x60s gamma=0)","metricName":"mean_final_score","metricUnit":"","bestDirection":"lower"}
{"run":65,"commit":"aa39ee9","metric":5188.5,"metrics":{"best_final_score":5094,"worst_final_score":5388,"mean_unique_contacts":461.5,"best_unique_contacts":466,"worst_unique_contacts":452,"solved_runs":0,"mean_best_conflict_positions":61,"best_best_conflict_positions":50,"runtime_total_seconds":240.003562363,"seed_1_final_score":5136,"seed_1_unique_contacts":464,"seed_1_best_conflict_positions":64,"seed_1_runtime_seconds":60.000909611,"seed_2_final_score":5136,"seed_2_unique_contacts":464,"seed_2_best_conflict_positions":64,"seed_2_runtime_seconds":60.000935869,"seed_3_final_score":5094,"seed_3_unique_contacts":466,"seed_3_best_conflict_positions":50,"seed_3_runtime_seconds":60.000181693,"seed_4_final_score":5388,"seed_4_unique_contacts":452,"seed_4_best_conflict_positions":66,"seed_4_runtime_seconds":60.00153519},"status":"keep","description":"Clean baseline for solver4 32x8x10 autoresearch lane: 4 fixed gamma=0 seeds at 60s each, after archiving stale solver3-era autoresearch artifacts.","timestamp":1776271061715,"segment":8,"confidence":null,"iterationTokens":1201,"asi":{"hypothesis":"Baseline restored strong heuristic branch on a clean solver4-specific 32x8x10 multiseed lane.","baseline_shape":"Current branch already solves 32x8x9 but plateaus on 32x8x10; seed_3 is strongest and seed_4 is weakest.","next_action_hint":"Target solver4 search-basin quality on 32x8x10 via diversification, plateau escape, or conflict-concentration handling without changing lane semantics."}}
{"run":66,"commit":"68cd1d0","metric":5178,"metrics":{"best_final_score":5136,"worst_final_score":5304,"mean_unique_contacts":462,"best_unique_contacts":464,"worst_unique_contacts":456,"solved_runs":0,"mean_best_conflict_positions":64,"best_best_conflict_positions":64,"runtime_total_seconds":240.002214959,"seed_1_final_score":5304,"seed_1_unique_contacts":456,"seed_1_best_conflict_positions":64,"seed_1_runtime_seconds":60.000344315,"seed_2_final_score":5136,"seed_2_unique_contacts":464,"seed_2_best_conflict_positions":64,"seed_2_runtime_seconds":60.000234043,"seed_3_final_score":5136,"seed_3_unique_contacts":464,"seed_3_best_conflict_positions":64,"seed_3_runtime_seconds":60.000282463,"seed_4_final_score":5136,"seed_4_unique_contacts":464,"seed_4_best_conflict_positions":64,"seed_4_runtime_seconds":60.001354138},"status":"keep","description":"Make solver4 breakouts conflict-guided by choosing max-conflict weeks instead of uniformly random weeks.","timestamp":1776271515077,"segment":8,"confidence":null,"iterationTokens":19708,"asi":{"hypothesis":"Breakouts were wasting perturbations on clean weeks; focusing them on max-conflict weeks should improve weak seeds.","learned_tradeoff":"This improved the 4-seed mean and worst seed materially, but eliminated the previous seed_3 spike (5094/466) and collapsed all best-conflict scores to 64.","basin_shape":"The change seems to homogenize outcomes: weaker seeds improved more than the strongest seed.","next_action_hint":"Try preserving conflict-guided breakouts while restoring more upside via stronger intra-week perturbation diversity or aspiration/tie-break behavior within the focused weeks."}}
{"run":67,"commit":"0aa1171","metric":5136,"metrics":{"best_final_score":5136,"worst_final_score":5136,"mean_unique_contacts":464,"best_unique_contacts":464,"worst_unique_contacts":464,"solved_runs":0,"mean_best_conflict_positions":64,"best_best_conflict_positions":64,"runtime_total_seconds":240.005430762,"seed_1_final_score":5136,"seed_1_unique_contacts":464,"seed_1_best_conflict_positions":64,"seed_1_runtime_seconds":60.001731289999995,"seed_2_final_score":5136,"seed_2_unique_contacts":464,"seed_2_best_conflict_positions":64,"seed_2_runtime_seconds":60.00020017,"seed_3_final_score":5136,"seed_3_unique_contacts":464,"seed_3_best_conflict_positions":64,"seed_3_runtime_seconds":60.00118499999999,"seed_4_final_score":5136,"seed_4_unique_contacts":464,"seed_4_best_conflict_positions":64,"seed_4_runtime_seconds":60.002314301999995},"status":"keep","description":"Keep conflict-guided breakout weeks and also target conflicted positions within those weeks during random breakout swaps.","timestamp":1776271889401,"segment":8,"confidence":5,"iterationTokens":7074,"asi":{"hypothesis":"Focused breakout weeks still left random swaps on clean positions; restricting swap endpoints to conflicted positions should improve perturbation efficiency.","key_result":"Large mean improvement to 5136 with all four seeds converging to the same 464-contact basin.","tradeoff":"This removed both the weak 452-contact tail and the previous 466-contact spike; the search now strongly favors a stable 464-contact plateau.","next_action_hint":"Push past the 464-contact plateau by changing the move neighborhood or tie-break objective, not by further homogenizing breakout selection."}}
{"run":4,"commit":"09e5a95","metric":4978.5,"metrics":{"best_final_score":4926,"worst_final_score":5136,"mean_unique_contacts":471.5,"best_unique_contacts":474,"worst_unique_contacts":464,"solved_runs":0,"mean_best_conflict_positions":34,"best_best_conflict_positions":24,"runtime_total_seconds":240.002674507,"seed_1_final_score":4926,"seed_1_unique_contacts":474,"seed_1_best_conflict_positions":24,"seed_1_runtime_seconds":60.000581145000005,"seed_2_final_score":4926,"seed_2_unique_contacts":474,"seed_2_best_conflict_positions":24,"seed_2_runtime_seconds":60.000883312,"seed_3_final_score":5136,"seed_3_unique_contacts":464,"seed_3_best_conflict_positions":64,"seed_3_runtime_seconds":60.000820776,"seed_4_final_score":4926,"seed_4_unique_contacts":474,"seed_4_best_conflict_positions":24,"seed_4_runtime_seconds":60.000389274},"status":"keep","description":"Tie-break equal-conflict local-search swaps by lower repeat_excess before lexicographic order; improved three seeds from 464 to 474 contacts and cut mean_final_score from 5136.0 to 4978.5.","timestamp":1776274856187,"segment":0,"confidence":8,"iterationTokens":7074,"asi":{"hypothesis":"Among swaps with the same paper conflict-position score, preferring lower repeat_excess should steer solver4 toward better canonical-quality basins on 32x8x10 without changing the primary move objective.","observations":{"mean_final_score_before":5136,"mean_final_score_after":4978.5,"improved_seeds":[1,2,4],"unchanged_seed":[3],"mean_unique_contacts_after":471.5,"best_conflict_positions_after":24},"next_action_hint":"Probe whether the remaining seed-3 plateau can be broken by conflict-aware selection among equal-repeat-excess swaps or by stronger plateau escapes after reaching the 24-conflict basin."}}
{"run":5,"commit":"03290be","metric":4968,"metrics":{"best_final_score":4800,"worst_final_score":5136,"mean_unique_contacts":472,"best_unique_contacts":480,"worst_unique_contacts":464,"solved_runs":0,"mean_best_conflict_positions":32,"best_best_conflict_positions":0,"runtime_total_seconds":123.687795747,"seed_1_final_score":4800,"seed_1_unique_contacts":480,"seed_1_best_conflict_positions":0,"seed_1_runtime_seconds":3.095162211,"seed_2_final_score":4800,"seed_2_unique_contacts":480,"seed_2_best_conflict_positions":0,"seed_2_runtime_seconds":0.590200793,"seed_3_final_score":5136,"seed_3_unique_contacts":464,"seed_3_best_conflict_positions":64,"seed_3_runtime_seconds":60.001337092,"seed_4_final_score":5136,"seed_4_unique_contacts":464,"seed_4_best_conflict_positions":64,"seed_4_runtime_seconds":60.001095651},"status":"keep","description":"Among equal-conflict and equal-repeat-excess swaps, prefer moves that reduce the worst per-week conflict concentration before lexicographic tie-breaking; this solved two seeds to 480 contacts and improved mean_final_score from 4978.5 to 4968.0.","timestamp":1776275151210,"segment":0,"confidence":4.2,"iterationTokens":11405,"asi":{"hypothesis":"When conflict-position and repeat-excess tie, preferring swaps that lower the maximum weekly conflict concentration should help solver4 finish concentrated basins on 32x8x10.","observations":{"mean_final_score_before":4978.5,"mean_final_score_after":4968,"solved_like_seeds":[1,2],"plateau_seeds":[3,4],"best_unique_contacts_after":480,"best_conflict_positions_after":0,"runtime_total_seconds_after":123.687795747},"next_action_hint":"Investigate why seeds 3 and 4 remain stuck at the 64-conflict basin; likely next leverage is stronger diversification or breakout targeting conditioned on repeated failure to enter the low-conflict basin."}}
{"type":"config","name":"solver4 32x8x10 multiseed quality (4x60s gamma=0, meet-at-most-once)","metricName":"mean_final_score","metricUnit":"","bestDirection":"lower"}
{"run":6,"commit":"6ac3b34","metric":88,"metrics":{"best_final_score":0,"worst_final_score":176,"mean_unique_contacts":472,"best_unique_contacts":480,"worst_unique_contacts":464,"solved_runs":2,"mean_best_conflict_positions":32,"best_best_conflict_positions":0,"runtime_total_seconds":123.901388889,"seed_1_final_score":0,"seed_1_unique_contacts":480,"seed_1_best_conflict_positions":0,"seed_1_runtime_seconds":3.255692308,"seed_2_final_score":0,"seed_2_unique_contacts":480,"seed_2_best_conflict_positions":0,"seed_2_runtime_seconds":0.6445003029999999,"seed_3_final_score":176,"seed_3_unique_contacts":464,"seed_3_best_conflict_positions":64,"seed_3_runtime_seconds":60.000684486,"seed_4_final_score":176,"seed_4_unique_contacts":464,"seed_4_best_conflict_positions":64,"seed_4_runtime_seconds":60.000511792000005},"status":"keep","description":"Fix the Social Golfer benchmark encoding to use meet-at-most-once semantics (`RepeatEncounter.max_allowed_encounters = 1`) and tighten solver4 gating to require that encoding; under the corrected canonical scorer, two seeds now score 0 and the new baseline mean_final_score is 88.0.","timestamp":1776275904282,"segment":1,"confidence":null,"iterationTokens":148,"asi":{"hypothesis":"The Social Golfer benchmark cases were misconfigured with max_allowed_encounters=0, so correcting them to meet-at-most-once (=1) and matching solver4 gating should make perfect zero-repeat schedules score 0 canonically.","target_change":"Re-initialized autoresearch because the benchmark question changed from the misconfigured encoding to the intended meet-at-most-once semantics.","observations":{"new_baseline_mean_final_score":88,"solved_runs":2,"perfect_seed_scores":[0,0],"remaining_plateau_scores":[176,176]},"next_action_hint":"Resume search-quality work on the corrected lane by targeting the remaining two 176-score seeds without perturbing the now-correct canonical scoring semantics."}}
{"run":7,"commit":"6ac3b34","metric":194,"metrics":{"best_final_score":88,"worst_final_score":336,"mean_unique_contacts":466,"best_unique_contacts":472,"worst_unique_contacts":464,"solved_runs":0,"mean_best_conflict_positions":51,"best_best_conflict_positions":32,"runtime_total_seconds":240.002044843,"seed_1_final_score":88,"seed_1_unique_contacts":472,"seed_1_best_conflict_positions":32,"seed_1_runtime_seconds":60.000960265,"seed_2_final_score":176,"seed_2_unique_contacts":464,"seed_2_best_conflict_positions":64,"seed_2_runtime_seconds":60.000459920999994,"seed_3_final_score":176,"seed_3_unique_contacts":464,"seed_3_best_conflict_positions":64,"seed_3_runtime_seconds":60.000317873,"seed_4_final_score":336,"seed_4_unique_contacts":464,"seed_4_best_conflict_positions":44,"seed_4_runtime_seconds":60.000306783999996},"status":"discard","description":"Tried a deeper tie-break chain that, after conflict positions / repeat_excess / max weekly conflict, prefers lower squared weekly conflict mass before lexicographic order. It regressed the corrected meet-at-most-once lane badly: no solved seeds, mean_final_score worsened from 88 to 194.","timestamp":1776276386487,"segment":1,"confidence":null,"iterationTokens":124,"asi":{"hypothesis":"Among swaps still tied on conflict_positions, repeat_excess, and max weekly conflict, preferring lower squared weekly conflict mass might smooth the remaining 176-score plateaus into solvable basins.","rollback_reason":"The extra tie-break overfit the local-search ordering and destroyed the strong solved-seed behavior on the corrected lane, worsening mean_final_score from 88 to 194 and reducing solved_runs from 2 to 0.","observations":{"baseline_mean_final_score":88,"experiment_mean_final_score":194,"baseline_solved_runs":2,"experiment_solved_runs":0,"worst_seed_regressed_to":336},"next_action_hint":"Revert this square-sum tie-break and try a less invasive direction, likely in breakout/restart behavior conditioned on being stuck in the 176 basin rather than adding another deterministic local-search ordering layer."}}
{"type":"config","name":"solver4 p4 stretch bundle quality (32x8x10 multiseed + larger p4 cases)","metricName":"mean_final_score","metricUnit":"","bestDirection":"lower"}
{"run":10,"commit":"2dfacef","metric":0,"metrics":{"best_final_score":0,"worst_final_score":0,"mean_unique_contacts":0,"best_unique_contacts":0,"worst_unique_contacts":0,"solved_runs":0,"mean_best_conflict_positions":0,"best_best_conflict_positions":0,"runtime_total_seconds":0,"social_golfer_32x8x10_seed_1_final_score":0,"social_golfer_32x8x10_seed_1_unique_contacts":0,"social_golfer_32x8x10_seed_1_best_conflict_positions":0,"social_golfer_32x8x10_seed_1_runtime_seconds":0,"social_golfer_32x8x10_seed_2_final_score":0,"social_golfer_32x8x10_seed_2_unique_contacts":0,"social_golfer_32x8x10_seed_2_best_conflict_positions":0,"social_golfer_32x8x10_seed_2_runtime_seconds":0,"social_golfer_32x8x10_seed_3_final_score":0,"social_golfer_32x8x10_seed_3_unique_contacts":0,"social_golfer_32x8x10_seed_3_best_conflict_positions":0,"social_golfer_32x8x10_seed_3_runtime_seconds":0,"social_golfer_32x8x10_seed_4_final_score":0,"social_golfer_32x8x10_seed_4_unique_contacts":0,"social_golfer_32x8x10_seed_4_best_conflict_positions":0,"social_golfer_32x8x10_seed_4_runtime_seconds":0,"social_golfer_36x9x10_seed_1_final_score":0,"social_golfer_36x9x10_seed_1_unique_contacts":0,"social_golfer_36x9x10_seed_1_best_conflict_positions":0,"social_golfer_36x9x10_seed_1_runtime_seconds":0,"social_golfer_36x9x10_seed_2_final_score":0,"social_golfer_36x9x10_seed_2_unique_contacts":0,"social_golfer_36x9x10_seed_2_best_conflict_positions":0,"social_golfer_36x9x10_seed_2_runtime_seconds":0,"social_golfer_36x9x10_seed_3_final_score":0,"social_golfer_36x9x10_seed_3_unique_contacts":0,"social_golfer_36x9x10_seed_3_best_conflict_positions":0,"social_golfer_36x9x10_seed_3_runtime_seconds":0,"social_golfer_36x9x10_seed_4_final_score":0,"social_golfer_36x9x10_seed_4_unique_contacts":0,"social_golfer_36x9x10_seed_4_best_conflict_positions":0,"social_golfer_36x9x10_seed_4_runtime_seconds":0,"social_golfer_36x9x11_seed_1_final_score":0,"social_golfer_36x9x11_seed_1_unique_contacts":0,"social_golfer_36x9x11_seed_1_best_conflict_positions":0,"social_golfer_36x9x11_seed_1_runtime_seconds":0,"social_golfer_36x9x11_seed_2_final_score":0,"social_golfer_36x9x11_seed_2_unique_contacts":0,"social_golfer_36x9x11_seed_2_best_conflict_positions":0,"social_golfer_36x9x11_seed_2_runtime_seconds":0,"social_golfer_36x9x11_seed_3_final_score":0,"social_golfer_36x9x11_seed_3_unique_contacts":0,"social_golfer_36x9x11_seed_3_best_conflict_positions":0,"social_golfer_36x9x11_seed_3_runtime_seconds":0,"social_golfer_36x9x11_seed_4_final_score":0,"social_golfer_36x9x11_seed_4_unique_contacts":0,"social_golfer_36x9x11_seed_4_best_conflict_positions":0,"social_golfer_36x9x11_seed_4_runtime_seconds":0,"social_golfer_40x10x10_seed_1_final_score":0,"social_golfer_40x10x10_seed_1_unique_contacts":0,"social_golfer_40x10x10_seed_1_best_conflict_positions":0,"social_golfer_40x10x10_seed_1_runtime_seconds":0,"social_golfer_40x10x10_seed_2_final_score":0,"social_golfer_40x10x10_seed_2_unique_contacts":0,"social_golfer_40x10x10_seed_2_best_conflict_positions":0,"social_golfer_40x10x10_seed_2_runtime_seconds":0,"social_golfer_40x10x10_seed_3_final_score":0,"social_golfer_40x10x10_seed_3_unique_contacts":0,"social_golfer_40x10x10_seed_3_best_conflict_positions":0,"social_golfer_40x10x10_seed_3_runtime_seconds":0,"social_golfer_40x10x10_seed_4_final_score":0,"social_golfer_40x10x10_seed_4_unique_contacts":0,"social_golfer_40x10x10_seed_4_best_conflict_positions":0,"social_golfer_40x10x10_seed_4_runtime_seconds":0,"social_golfer_40x10x11_seed_1_final_score":0,"social_golfer_40x10x11_seed_1_unique_contacts":0,"social_golfer_40x10x11_seed_1_best_conflict_positions":0,"social_golfer_40x10x11_seed_1_runtime_seconds":0,"social_golfer_40x10x11_seed_2_final_score":0,"social_golfer_40x10x11_seed_2_unique_contacts":0,"social_golfer_40x10x11_seed_2_best_conflict_positions":0,"social_golfer_40x10x11_seed_2_runtime_seconds":0,"social_golfer_40x10x11_seed_3_final_score":0,"social_golfer_40x10x11_seed_3_unique_contacts":0,"social_golfer_40x10x11_seed_3_best_conflict_positions":0,"social_golfer_40x10x11_seed_3_runtime_seconds":0,"social_golfer_40x10x11_seed_4_final_score":0,"social_golfer_40x10x11_seed_4_unique_contacts":0,"social_golfer_40x10x11_seed_4_best_conflict_positions":0,"social_golfer_40x10x11_seed_4_runtime_seconds":0},"status":"crash","description":"Attempted to rerun the expanded p=4 stretch autoresearch baseline, but the wrapper failed immediately with a permission error: tools/autoresearch/solver4-8x4x10/autoresearch.sh was not executable.","timestamp":1776291346143,"segment":3,"confidence":null,"iterationTokens":3034,"asi":{"hypothesis":"The solver2 cleanup was complete, so the expanded benchmark baseline should run cleanly.","rollback_reason":"The benchmark wrapper itself was not executable, so the run never started.","error_details":{"stderr":"./autoresearch.sh: line 4: /home/ralph/ralph-repos/GroupMixer/tools/autoresearch/solver4-8x4x10/autoresearch.sh: Permission denied"},"next_action_hint":"Restore execute permission on tools/autoresearch/solver4-8x4x10/autoresearch.sh and rerun the baseline."}}
